,category,headline,authors,link,short descr,date,image_caption(s),image_link(s),article
0,WELLNESS,"Interview With Author Racelle Rosett: Dying, Living, Surviving Breast Cancer","Janice Taylor, Contributor
I am a Creative Life Coach, author of the Our Lady of Weight L...",https://www.huffingtonpost.com/entry/breast-cancer-month_us_5b9c5e16e4b03a1dcc7e2325,"Racelle Rosett, award-winning author, breast cancer survivor and blogger shares her thoughts on dying, living and surviving breast cancer with Janice Taylor, life and wellness coach.",2012-10-17,pink ribbon in woman chest to support breast cancer cause,https://img.huffingtonpost.com/asset/5b9c5e161f0000500021311f.jpeg?ops=scalefit_720_noupscale," Racelle Rosett, winner of the WGA award for thirtysomething, recipient of both the Moment Magazine-Karma Foundation Prize for Jewish short fiction and the Lilith Fiction Prize, author of the critically acclaimed book Moving Waters, breast cancer survivor and blogger shares her thoughts on dying, living and surviving breast cancer with Janice Taylor, life and wellness coach.Why blog about breast cancer now?I had not expected to blog about breast cancer and didn't until several years after my initial diagnosis. When you're being treated for breast cancer you are mostly in a reactive state. You're really carried along like one of those dance numbers where smartly dressed men in suits hold you aloft.It wasn't until afterward that I got a chance to catch my breath, when the drama receded. When it's not such an emergency and instead of thinking about dying all the time you start to think about how you're going to live.Now what? The truth is having had cancer in some way informs everything you do, from the smallest blueberry that you eat with the hopes that its antioxidants will tip the scales in your favor, to the relationships you have and don't have. Everything is reevaluated.For me, I kind of skipped through cancer because I was so supported and then when I had to step into my day-to-day life, I really felt the impact like an aftershock. I was a writer before I was a blogger and that is how I process my experiences, so it was a logical step for me.What is different about blogging [and] writing fiction or television?I really didn't anticipate the strong immediate response I've gotten from readers that were not women with cancer. I began by writing with my cousin and other breast cancer patients in mind. I thought it might speak to them and reduce the fear of someone at the start of their journey.But the readers who seem most interested in the blog are people whose mother-sister-wife-friend has had cancer. I think it gives them a window into the experience they may not have had. Also, the humor is an important part of my worldview. I swear that at the start of my treatment, I actually googled ""cancer humor"" and was shocked and appalled to find nothing. We have done a lot of laughing on this journey. I would very likely be bitter and angry were it not for my ability to see what is funny about it. No, really.Also, there were people who discouraged me from being public about my cancer status, and that just seemed wrong to me. I know that I have the ability to make this less frightening to other women, and nothing would stop me from doing that. Also it's a truth about me, the same way that I stopped coloring my hair (when it grew back), and people respond so positively to that. I think you are always safer in the world if you lead with who you are.How has it affected your faith?My faith was not really tested by cancer. That is to say, my belief does not have god in it. I have a strong belief in how we treat each other as human beings. That we have the ability to enact godliness towards one another. Having said that, much of how I have healed in this process was brought about [by] my religious practices and values.The members of my temple and my community stepped forward to feed my family and to care for us, as we have done for other people when they have needed our help. In the same way, the ritual of a Sabbath and setting aside a time for rest and to celebrate by eating special foods and drinking wine was very much what was called for in this experience. Much of this value emerged as I wrote the blog. I don't take cancer personally or feel that it has meaning in that way.People will occasionally post that anger will give you cancer, and I'm only really angry at the people who post things like that. Cancer is just cancer -- it's like saying that if a car loses control and hits you while you walk on the sidewalk that there's a reason for it -- the reason you have cancer is that you were walking down the street and your cells spun out of control. Done.How did you keep from being afraid?I wasn't terribly afraid for myself. I don't like hospitals or enclosed spaces, but I have Ativan for that. I felt confident in my doctors, and I was love-bombed.More than anything, I was really concerned about my kids. I had done a pretty good job of keeping their world relatively safe, and then I had to spring this on them. Also, I didn't want me dying to become part of their story. I have known a lot of people who have lost their mothers to cancer, and I was worried for my kids in this way. The truth is, they are very much in their own lives, but I want to be there for them if they [need] me, to jump on a plane or answer the phone or just sit with them, for as long as I could.I do know women who did not have the kind of medical coverage I had, and had to be fearful about money in a moment when they were dealing with a cancer diagnosis, which is unconscionable as far as I am concerned. When I'm done here, I'll blog about that.How do you cope with the change of energy?That's been hard for me because there is so much I want to do. I have had the wish, like Calvin and Hobbes, to have a fleet of clones running around doing my bidding. I have to take naps, but the truth is I have always done that. I haven't really scaled back what I wish to accomplish, but I have to be really disciplined about how I expend my energy.I have long joked that I should keep a stack of Post-it notes with the word ""no"" on them next to the phone so that I don't over-volunteer. I just have to work smarter and be a little more princessy. Waking me during a nap is a hanging offense.How do you control your thoughts?I am a big fan of cognitive therapy. I would rather meet Aaron Beck* than Beck. I struggled with anxiety when I was younger, and was able to really resolve it because of those tools. In terms of cancer, I was helped by this skill set. I tried to not go down the rabbit hole with fear. I have learned that being afraid is not a form of protection.Also, worry can exhaust you, and to get through this you need to be fit. I have, however, become smart about not getting tests done on a Friday. If you do, you can devote your entire weekend to worry. I get test on Mondays and schedule follow-ups on Wednesdays. Also I live walking distance from a bakery called Big Sugar and if used in moderation, one of their chocolate cupcakes can really take the edge off.*Dr. Aaron Beck -- father of cognitive therapy.Thank you, Racelle. Brava!Visit Janice Taylor, Life & Wellness Coach: Our Lady of Weight Loss Virtual ShoulderFor more by Janice Taylor, click here.For more on breast cancer, click here."
1,PARENTING,"Make Your Own Damn Dinner, Mitt","Sheila Quirke, Contributor
Mary Tyler Mom",https://www.huffingtonpost.com/entry/mitt-romney_us_5b9c6b2ae4b03a1dcc7e7e83,"Do men go hungry, waiting for their working women to tend to their most basic of human needs?",2012-10-17,"Republican Presidential nominee Mitt Romney speaks on October 16, 2012 during the second of three presidential debates at Hofstra University in Hempstead, New York. AFP PHOTO / Stan HONDA (Photo credit should read STAN HONDA/AFP/Getty Images)",https://img.huffingtonpost.com/asset/5b9c6b2a240000310094aab9.jpeg?ops=scalefit_720_noupscale,"In last night's presidential debate, Governor Romney managed to offend me and other women in both new and creative ways. It was astounding, really. He made these seemingly throwaway comments that, twelve hours later, are still gnawing at me. Full disclosure: I am not of any concern to Mitt or his campaign. First of all, I live in Illinois, where I have yet to see a single campaign ad. Team Romney is not seeking my vote, nor does it matter to them. I'm an Obama supporter, which was probably clear to you after reading my headline.  That said, I am an interested participant in our democracy. I am the geek that will watch all three presidential debates, not to mention last week's vice presidential sparring. Every four years I indulge myself. Last night, in response to a young woman's question about lessening the wage gap between men and women in the workplace (it felt like a flashback to 1984, honestly), Mitt started talking about things like binders and moms utilizing flex-time to go home early and fix dinner. The thinly-veiled misogyny in Mitt's responses has me reeling. Why is it that women, moms specifically, need to go home and make dinner? Where are the men? Do men not eat? Do men not cook? Do men go hungry, waiting for their working women to tend to their most basic of human needs? In choosing those words and sharing anecdotal evidence of his progressive work place strategies, he both dates and outs himself. He makes himself the helper of women, and it is through his beneficence that moms can cook and tend to their families. Thank you, Mitt. Truly, thank you. Sigh.We need to embrace a culture that does not continue to restrict the duties of the home -- which are really very important to a family's well-being -- to women. You know who should be cooking and cleaning and shopping and tending children and laundering? Parents. If the family leaders -- either one or two parents, male or female -- make specific arrangements that one will work outside the home and one will work inside the home, all is good. A decision has been made and agreed upon. Cue the songbirds. If the finances are such that both parents, should there be two parents, need to work outside the home, do not assume that all of the work that must continue to be done inside the home -- IMPORTANT WORK -- will be done by women, specifically mom. MOM is not code for 'managing others' messes.' Last night, Romney revealed to us all his narrow, narrow understanding of the American family. To him, that is a husband/father, a wife/mother and a number of adorable children -- the more children, the better. If a family should lack a husband/father, that family runs the risk of children playing with AK-47s. If that family should include two moms or two dads, well, let's just not talk about that, alright? So much has already been said and written about the binders of women Romney commissioned. What I haven't seen is an exploration of how completely condescending and paternalistic that comment was. Here was Mitt, casting himself as the beneficent patron of women. Are we to honestly believe that in 2002, Team Romney could find NO qualified female candidates for cabinet posts? Really? And if was only through the helping hand of Governor Romney that women were allowed into the inner sanctum of Massachusetts governance? Really? I had the chance to pull together a cabinet and all the applicants seemed to be men. And I -- and I went to my staff, and I said, 'How come all the people for these jobs are -- are all men?' They said, 'Well, these are the people that have the qualifications.' And I said, 'Well, gosh, can't we -- can't we find some -- some women that are also qualified?' And so we -- we took a concerted effort to go out and find women who had backgrounds that could be qualified to become members of our cabinet. I went to a number of women's groups and said, 'Can you help us find folks?' and they brought us whole binders full of women.Apparently, I am supposed to be grateful to Mitt for helping a gal out. Um, no. I am not grateful. I am scared. Truly scared. On paper, Mitt Romney would love me. I am white, a home owner, a mother, my husband is the sole income earner and yes, I cook and clean for our family. In reality, I challenge everything he stands for. His positions related to women are alarmingly dangerous to my sisters young and old. They are dangerous to families, too, as women are such a strong thread in the family fabric. I will not cook for you, Mitt, but I may give you some of my old binders, which have been collecting dust since 1991. Seems like you need them."
2,WELLNESS,"Tuberculosis: Fewer TB Cases Around The World Last Year, But Drug-Resistance A Worry, WHO Says","Reuters, Reuters",https://www.huffingtonpost.com/entry/tuberculosis-world-cases-drug-resistance_us_5b9c6b19e4b03a1dcc7e7de0,INDIA AND CHINA * New tools to fight TB being developed But the report cited slow progress in identifying cases of drug-resistant,2012-10-17,"In this photo taken Friday, March 27 , 2009, a visitor walks near a poster promoting tuberculosis awareness with the Chinese characters ""Control TB, Everyone's Duty"" and a yellow warning sticker to ""Not Spit"" at the Beijing Chest Hospital which specializes in the treatment of tuberculosis in Tongzhou, near Beijing. One in 10 cases of tuberculosis in China cannot be treated by the most commonly-used drugs, a problem driven by lack of testing and misuse of medicine, according to a national survey that shows for the first time the size of the epidemic of drug-resistant forms of the killer lung disease. (AP Photo/Ng Han Guan)",https://img.huffingtonpost.com/asset/5b9c6b192400005100533053.jpeg?ops=scalefit_720_noupscale,"* New tools to fight TB being developed* Diagnoses of drug resistant TB laggingBy Julie SteenhuysenCHICAGO, Oct 17 (Reuters) - New tuberculosis infections dropped 2.2 percent worldwide last year, but with nearly 9 million new infections, the World Health Organization said TB remains a massive problem that could worsen if countries shortchange funding to fight it.In its annual assessment released Wednesday, WHO also said only one in five people with drug-resistant strains of TB is being diagnosed each year, leaving hundreds of thousands of people who are potentially infecting others with this particularly deadly form of the disease.Overall, the report found that 8.7 million people fell ill with tuberculosis in 2011 and 1.4 million died, including nearly 430,000 people who were also infected with HIV, the virus that causes AIDS.Dr. Mario Raviglione, director of the WHO's Stop TB program, said the report, based on data from 204 countries and territories, paints a mixed picture of progress in the fight against TB, noting that ""51 million people have been cured and 20 million lives have been saved"" since 1995.Raviglione also cheered progress in developing rapid diagnostic tools that allow patients to be quickly tested for drug-resistant strains of TB, and he looked forward to the expected addition of at least two new drugs to fight drug-resistant forms of TB in the next year.But the report cited slow progress in identifying cases of drug-resistant tuberculosis, which health officials called a growing health emergency.""On the one hand, we have existing as well as new tools on the horizon which could make a significant difference and even support dreams of elimination in some settings,"" Raviglione told reporters at a press conference.""On the other hand, we are at risk of stagnation if additional resources are not urgently mobilized by the governments of endemic countries, first, and if the international community then is not ready to fill the gap.""Despite advances in curbing the disease, the report said not all countries enjoyed equal progress.Cambodia, for example, has made big strides in reducing TB rates, with the number of cases dropping by 45 percent between 2002 and 2011. But the African and European regions are not on track to halve 1990 levels of mortality by 2015.INDIA AND CHINARaviglione said there were 60,000 reported cases of drug resistant MDR-TB from all countries in the report, with India and China representing most of those cases.MDR-TB is resistant to at least two first-line drugs - isoniazid and rifampicin - while XDR-TB is resistant to those two drugs as well as a powerful antibiotic type called a fluoroquinolone and a second-line injectable antibiotic.""India and China are the countries that need to accelerate the detection, the diagnosis and the treatment of MDR-TB in order for the entire world then to be able to progress, because they have the majority of cases,"" Raviglione said.He said India, China, Russia and South Africa represent two thirds of the world's cases of drug-resistant TB, and he urged those governments to step up efforts to test and treat patients.""If they don't move, we will always have slow progress.""One bright note is that past investments in technology are beginning to pay off in new and more effective tools.For example, a new rapid molecular diagnostic test for TB and resistant forms of TB called Xpert, being marked by California-based Cepheid, is being rolled out in 67 developing countries, with South Africa representing more than a third of that response.A big part of that is from a deal by the Bill and Melinda Gates Foundation, the U.S. Agency for International Development and UNITAID - a group that facilitates the procurement of AIDS, malaria and tuberculosis drugs - to cut the price of the test from $17 to $10.""There is also progress in the pipeline towards new drugs and towards new vaccines,"" Raviglione said.""We expect at least two if not three entirely new compounds that kill the TB bacillus very effectively to be available in the next few months,"" he said.But WHO officials worry about a funding gap that could stall progress in fighting the disease.Between 2013 and 2015, WHO projects $8 billion per year will be needed to fight TB, and while much of that will be spent by affected countries, WHO said there is already a $3 billion funding gap projected in 2013.""Particularly serious is the gap for the care of MDR-TB, which will mean millions of unnecessary deaths in the next few years,"" Raviglione told the briefing.Dr. Grania Brigden, TB adviser for Doctors Without Borders, said the report reinforces that MDR-TB is an escalating public health emergency.""With barely one in 20 TB patients being tested for drug resistance, we're just seeing the tip of the iceberg,"" said Brigden, who called for more treatment and better drugs. "
3,MONEY,Romney's 'Pick A Number' Tax Plan Would Hurt Middle-Income Households,Catherine New,https://www.huffingtonpost.com/entry/romney-pick-a-number-tax-plan_us_5b9c6b1ce4b03a1dcc7e7e34,"In Tuesday night's debate, Romney offered up the latest rendition on his tax plan, which includes slashing marginal tax rates",2012-10-17,"Republican presidential nominee Mitt Romney listens as President Barack Obama speaks during the second presidential debate at Hofstra University, Tuesday, Oct. 16, 2012, in Hempstead, N.Y. (AP Photo/David Goldman)",https://img.huffingtonpost.com/asset/5b9c6b1c26000035007f7867.jpeg?ops=scalefit_720_noupscale,"Middle-income households and homeowners in expensive real-estate markets are still the biggest losers when it comes to Republican presidential nominee Mitt Romney's tax plan. In Tuesday night's debate, Romney offered up the latest rendition on his tax plan, which includes slashing marginal tax rates by 20 percent across the board and offseting revenue with a limit on household write-offs for mortgage interest, charitable contributions and other other popular deductions. ""... In terms of bringing down deductions, one way of doing that would be to say everybody gets -- I’ll pick a number -- $25,000 of deductions and credits. And you can decide which ones to use,"" Romney said. This cap, he explained, could be anywhere from $17,000 up to $50,000 and would offset revenue lost from a lower tax rate. Higher-income tax payers could have an even lower cap, Romney has said.But for consumers, a cap on mortgage deductions could hurt, especially in areas where housing costs are high, like California, New York and other metropolitan areas including Washington, D.C. For example, a homeowner holding a $500,000 mortgage would have interest payments that exceed a $17,000 cap, and that does not include other itemized deductions such as charitable contributions, medical bills and doesn't consider high state or local income tax. That leaves homeowners in high-cost housing markets holding a higher tax bill, Politico  and Bloomberg have both reported.. On Wednesday, Ezra Klein pointed out in the Washington post, ""A deduction cap at the lower level could raise taxes for middle-class homeowners who use the mortgage interest deduction in areas where real-estate values are high. And a cap at the higher level wouldn’t be likely to raise enough revenue to pay for the rate cuts.""Romney's proposed deduction cap would affect at least 13.7 million taxpayers. According to Bloomberg, at least 3.7 million U.S. taxpayers last year reported deductions of $25,000 or more. About 10 million others wrote off $15,000 to $25,000. Lobbyists for the housing industry are already ramping up efforts to keep mortgage tax breaks as generous as possible, the Hill reported last week.Meanwhile, all middle-income earners will actually pay more under Romney's plan, according to the study of Romney's tax plan by the Tax Policy Center, a nonpartisan tax think tank in Washington, D.C. Even using the most progressive approach to closing loopholes, the study showed that 95 percent of Americans will still pay more taxes or around $500 more per year on average, Mother Jones has reported. ""All of the promises couldn't be met simultaneously without resorting to tax increases on households with income below $200,000,"" the studys author William Gale of the Tax Policy Center said last week about Romney's tax plan. "
