,category,headline,authors,link,short descr,date,image_caption(s),image_link(s),article
11,STYLE & BEAUTY,Spa Tips to Prepare for the FLOTUS,"Linda Harding-Bond, Contributor
Spa Retail Trainer",https://www.huffingtonpost.com/entry/spa-tips-quality_us_5b9c6899e4b03a1dcc7e6b8f,"There are certain amenities and qualities which I look for that would satisfy most folks, probably even a FLOTUS. It may surprise you that while luxurious surroundings are always a plus, it is not always my primary requirement.",2012-10-17,"First lady Michelle Obama waves as she is introduced onstage to address the Congressional Black Caucus Foundation's 42nd Annual Phoenix Awards dinner in Washington, Saturday, Sept. 22, 2012. (AP Photo/Cliff Owen)",https://img.huffingtonpost.com/asset/5b9c68992500003200360ddf.jpeg?ops=scalefit_720_noupscale,"When it comes to spa-ing I admit that I am a major pain in the you-know-what. Bravo's Real Housewives have nothing on me when it comes to spa-ing. I can out-diva any of them (but in a nice way). I've never worked on a FLOTUS, but as an award-winning esthetician and international spa consultant, I know what I like. I can't imagine (sans security) it would be that different from Mrs. O. I have no problem requesting an esthetician who understands the needs of my brown skin and a senior or award-winning therapist for my body treatments. I would think that Michelle Obama's personal assistant would request as much for her. Why would anyone want less? Would your spa pass muster in this regard? There are certain amenities and qualities which I look for that would satisfy most folks, probably even a FLOTUS. It may surprise you that while luxurious surroundings are always a plus, it is not always my primary requirement. I must also mention that I am not of fan of the one-size-fits-all spa robes. Act like you know, and stock your locker room accordingly, please. Prepare properly for the ""bootylicious-ness"" that may be headed your way. Here is my personal checklist that I use before recommending a spa to my friends and clients.1. I want to be engaged in conversation and be seen as an individual. I want your therapists to be knowledgeable enough to answer questions about my skin and know what they are talking about. I want for them to educate me and delight me with information about some new advancement or offering at your hotel/spa that they think might interest me, and not just because it's the ""item of the week."" I don't want robotics, and I don't want to be patronized.  2. I want more than a perfunctory peek through the loupe at my skin. A good skin analysis can shock a client into becoming a facial believer. Skin can reveal a lot. I can tell from looking through my magnifying lamp how much stress, water, pizza and sleep my clients have taken in. I want someone who has enough expertise and life experience to do the same for me. 3. I want to receive the appropriate facial or treatment. Often, clients will book a service because it is familiar or sounds exotic. It isn't necessarily always the best treatment for their skin. I want a therapist who is sharp and knowledgeable enough to recommend what is correct, even if what they are selecting costs less. This is a sign of integrity and expertise and will always endear me, bring me back for more and inspire me to rave about you on social media.4. I want the correct and appropriate products used on my skin. I find that estheticians who have not been trained to work on ethnic skin cannot confidently select the right products to use. Because their references are European, their techniques may also be too aggressive. Having a skincare professional cause hyperpigmentation (dark marks) is inexcusable and a direct result of insufficient training. I want to be able to trust my facialist enough to doze off and wake up with my skin glowing, not damaged. 5. I want recommendations for home care. Recommending a home care program or product means that you are invested enough in me as your client to want my skin to look good post-service. A clever therapist knows that product sales are a way to stay connected to the client. I personally love receiving follow-up calls or notes inquiring about my skin. One of my therapists from the Oberoi Rajvilas in India checks in with me frequently on Facebook. She will be my first stop when I'm in that part of the world again. So, for all of the above-mentioned qualities, how many did your spa meet? If the number is three or less, then maybe it's time to redirect your renovation budget, stop slapping gold leaf on everything and reset. Think about investing more of your money and time in staff training. After all, you never know when the FLOTUS might decide to visit.Linda Harding is President of Moontide Consulting.."
12,MONEY,Why an Entitled Attitude Leaves You Financially Crippled,"Brazen Life, Contributor
Lifestyle and career blog",https://www.huffingtonpost.com/entry/personal-finance-tips_us_5b9c6abde4b03a1dcc7e7a73,"We don't necessarily believe these things should be free, but we think a normal person who works for a living should have certain things and be able to afford to do certain things.",2012-10-17,Young woman with a piggy bank and using a calculator,https://img.huffingtonpost.com/asset/5b9c6abd26000036007f784b.jpeg?ops=scalefit_720_noupscale,"Growing up in the U.S. in this period of time has given most of us a relatively impaired view of ourselves. We grow up believing strongly in our rights, but those rights have little to do with what's allowed and a lot more to do with what we think the world owes us for merely existing.We don't necessarily believe these things should be free, but we think a normal person who works for a living should have certain things and be able to afford to do certain things.Yet some of the things we think we're owed end up leading us into debt -- things we might actually be able to live without. Here are a few examples:VehiclesAt some point, a car went from being a long-distance transportation device to being a substitute for legs. We don't just use the car to visit relatives 30 miles away; we take it to work a couple of miles away or to the grocery store down the street.If we find ourselves without a car, we feel trapped. We consider it to be a ""fixed cost"" of life, so we figure we'll just have to take out a loan to buy one. We now care more about the ownership of a car than its intended use, which was to facilitate necessary (relatively) long-distance travel. Sure, cars allow people to commute further to work, but those of us who don't actually go far for work, or don't get paid enough to make up the cost of the vehicle, might just be throwing money out the window.Food and HealthAmericans eat out more than any other people on earth, and as a result, we're also the least healthy. We think being hungry is occasion enough to go to the nearest burger joint and drop $10 for a meal that probably racks up another $10 in medical bills in the long run. Not only do we think this is acceptable, we think it's normal.We assume that growing fresh food in the backyard is for ""granolas"" and gardening hobbyists. Cooking is a rare skill only held by people who studied that sort of thing, and eating vegetables is for rabbits and vegans. We demand to subsist on processed corn derivatives and pulped animals because they're ""tasty."" The result -- besides a food bill that's five or six times higher than that of someone who cooks their own food -- is a lifetime cost of hundreds of thousands of dollars in over-the-counter pills and more serious medical treatments for our failing livers, hearts and arteries.EntertainmentMany of us spend our time at work trying to make the world more efficient. We work to make systems work better, to add new innovations, and to remove dead weight where we can.Yet when we leave work and come home, we leave that philosophy behind. Somehow we consider things like a big-screen TV, the latest video games, cable service and an awesome sound system to be required in the same way that a dining table, chairs, and a frying pan might be. We never consider that we might better substitute things that could actually save us money, make us healthier, or help us become more competitive as employees. This is surprising since the list for such pursuits is incredibly long, including anything from playing sports to gardening to studying a foreign language or starting our own business on the side.EducationThis is a big one -- we think going to college is our right. We don't really worry about how much it costs or how much money our degree will help us make later in life; we just sort of assume the cost will take care of itself and someone will hire us and give us lots of money for our ability to drink 15 PBRs and still flawlessly quote Voltaire.No one bothers to consider that the four years you spent in a drunken stupor could have been spent learning a useful trade and contributing to society. As an experienced plumber, you could have a permanent job making $50,000 a year, with zero debt and a nice chunk of change already saved up in that time; yet somehow an unemployed graduate with a degree living in destitution, massive debt and with no employable skills at all has the nerve to look down on such people.If we were to let go of our ridiculous ideas about what we're entitled to and what's ""normal"" for us as Americans, we could begin to shake off the shackles of our creditors. If you don't borrow money, you don't have to pay interest, which is why the quickest way to debt-free living is not to take out major loans in the first place and to match your standard of living to your income (or beneath it).Alan Brady is a passionate blogger who spends his time researching and writing about the economy, recent job market trends and business. He is currently writing for the labor lawyers locator attorneys.com. Brazen Life is a lifestyle and career blog for ambitious young professionals. Hosted by Brazen Careerist, we offer edgy and fun ideas for navigating the changing world of work -- this isn't your parents' career-advice blog. Be Brazen."
13,WELLNESS,"West Nile Outbreak: Cases Top 4,500, Making It The Second-Worst Year On Record","Reuters, Reuters",https://www.huffingtonpost.com/entry/west-nile-outbreak-cases_us_5b9c6ba2e4b03a1dcc7e81ad,By Marice Richter Just over half of the cases reported to the CDC this year have been of the severe neuroinvasive form of,2012-10-17,"FILE - In a Thursday, Aug. 16, 2012 file photo, dead mosquitos are lined up waiting to be sorted at the Dallas County mosquito lab in Dallas. Health officials say itￂﾒs the worst year ever for West Nile in Texas, which has seen nearly half the countryￂﾒs deaths from the virus this year. The Texas Department of State Health Services Commissioner David Lakey said Wednesday Sept. 5, 2012 that at least 40 people have died from the virus in Texas. The state has recorded at least 495 cases of neuroinvasive West Nile, considered the most serious form of the illness because it affects the nervous system. (AP Photo/LM Otero, File)",https://img.huffingtonpost.com/asset/5b9c6ba2240000310094ab01.jpeg?ops=scalefit_720_noupscale,"By Marice RichterDALLAS, Oct 17 (Reuters) - The number of West Nile virus cases across the United States has topped 4,500, with another 282 cases reported last week, making 2012 the nation's second-worst year on record for the mosquito-borne disease, government figures showed on Wednesday.The Centers for Disease Control and Prevention said 4,531 cases have been reported this year, the highest number since the record outbreak of 2003, when 9,862 cases were reported.Another 15 deaths from the disease were reported last week, bringing the total to 183, the CDC said.Almost 70 percent of the cases have been reported in eight states: Texas, California, Louisiana, Mississippi, Illinois, South Dakota, Michigan and Oklahoma. More than one-third were in Texas, with Dallas-Fort Worth at the center of the outbreak.Just over half of the cases reported to the CDC this year have been of the severe neuroinvasive form of the disease, which can lead to meningitis and encephalitis.The milder form of the disease causes flu-like symptoms and is rarely lethal. (Editing by Paul Thomasch and Doina Chiacu)"
