,category,headline,authors,link,short descr,date,image_caption(s),image_link(s),article
5,RELIGION,Muslim Friends Of Beheaded Aid Worker Mourn,,https://www.huffingtonpost.com/entry/british-muslims-alan-henning_n_5931328.html,,2014-10-04,"MANCHESTER, ENGLAND - OCTOBER 04: Dr Shameela Islam-Zulfiqar, who accompanied murdered British aid worker Alan Henning on mercy missions to Syria, attends a press conference at Manchester Central Mosque on October 4, 2014 in Manchester, England. A video purporting to show the beheading of British hostage Alan Henning has been released by Islamic State militants. Aid worker Alan Henning had been held by Islamic State since December 26th 2013 and was taken by militants as he arrived in Syria to help victims of the civil war. (Photo by Christopher Furlong/Getty Images)",https://img.huffingtonpost.com/asset/5bb7f07d2200004301dd329c.jpeg?ops=scalefit_720_noupscale,"* Muslims express shock at murder at start of Eid festival* Prime Minister Cameron says Henning was simply trying to help* Cameron vows to use all Britain's assets to fight insurgents (Adds family statement)By Stephen AddisonLONDON, Oct 4 (Reuters) - Muslim groups across Britain united on Saturday to join Prime Minister David Cameron in condemning the beheading of aid worker Alan Henning by Islamic State insurgents.Prayers for the 47-year-old taxi driver were said in mosques throughout Britain at the start of the Muslim Eid al-Adha festival, as his family said they were numb with grief.Cameron called Henning a gentle, compassionate man who had simply tried to help others, and said Britain would do all it could to destroy his killers.British media had focused on Henning as an ordinary, middle-aged non-Muslim who had given up his time and left behind a wife and two teenage children to help Muslim friends drive informal aid convoys to the victims of Syria's civil war.""We will use all the assets we have ... to defeat this organization, which is utterly ruthless, senseless and barbaric in the way it treats people,"" Cameron said in a televised statement after meeting the heads of Britain's armed forces and intelligence agencies.Henning had been held in Syria for nine months before a video was posted on YouTube on Friday showing him kneeling against a desert setting before a masked man holding a knife.The man spoke briefly with the same southern British accent as the killer of previous hostages, widely dubbed ""Jihad John.""A second video featuring an unmasked, apparently British fighter pouring scorn on Cameron for failing to send in ground troops was being urgently examined by police on Saturday, Cameron's office said.Henning was the fourth Western hostage to be beheaded by Islamic State, which has been attacked by U.S., British, French and Arab fighter jets since seizing swathes of Iraq and Syria.His case had prompted a wave of appeals for his release from British Muslim leaders.Shuja Shafi, Secretary General of the Muslim Council of Britain, called his murder ""a despicable and offensive act."" ""COWARDLY ACT""Imam Asim Hussain of the Manchester Central Mosque said it was a ""cowardly and criminal act of appalling brutality, by a group who do not represent Islam at all.""Henning's aid convoy had been taking supplies to a hospital in northwest Syria last December when it was stopped by gunmen.Fears for his safety had grown since the British parliament voted last month to authorize British involvement in air strikes against Islamic State in Iraq.In the YouTube video, Henning appears to read from a script before being killed. ""Because of our parliament's decision to attack the Islamic State, I, as a member of the British public, will now pay the price for that decision,"" he says.Britain's Muslim leaders have in the past been accused of being reluctant to publicly confront Islamic extremism.Henning's case prompted a united response, however.Last month, a letter signed by over 100 British Imams and Muslim leaders said the threats to Henning had no justification in Islam. ""This is not Jihad (Holy war) - it is a war against all humanity,"" it read.Henning's wife Barbara and his two teenage children said they were devastated at the loss of a man who had cared about the welfare of others. ""He will be remembered for this and we as a family are extremely proud of him and what he achieved,"" they said in a statement.On Friday, the father of journalist John Cantlie, another Briton being held by Islamic State, appealed for his son's release.In Brussels, the European Union's External Action Service said the EU was ""committed to contribute to the fight against all terrorist groups that endanger regional and global stability,"" and would spare no effort to ensure that ""an end is put to this atrocious terrorist campaign and all perpetrators are held accountable."" (Editing by Kevin Liffey)"
6,CRIME,NYPD Kills Third Man In A Week,Simon McCormack,https://www.huffingtonpost.com/entry/nypd-kills-third-man-in-a-week_n_5931396.html,,2014-10-04,"NEW YORK, NY - SEPTEMBER 25: New York Police Department Commissioner Bill Bratton speaks at a press conference announcing that there are no known terrorist threats to the New York City subway system on September 25, 2014 in New York City. Earlier today the Iraqi prime minister, in town for the United Nations General Assembly, said Iraqi forces had uncovered a plot by terrorists to attack the New York and Paris subway systems. (Photo by Andrew Burton/Getty Images)",https://img.huffingtonpost.com/asset/5ba2b1c02200003000da6c76.jpeg?ops=scalefit_720_noupscale,"NEW YORK (AP) — A New York City officer shot and killed a knife-wielding man who came at officers responding to a call about a domestic dispute Friday, police said, marking the third person to die in a police shooting in the city this week.Officers were initially called to a home in the Sheepshead Bay section of Brooklyn around 5:30 p.m. to address a problem between 28-year-old Denis Volchkin and his mother, but he left before officers arrived, police said. They were called to the same home again around 8 p.m., when the mother escorted them inside.The son lunged at the officers with a knife in hand, and an officer shot him once in the torso, police said. The two officers were taken to a hospital for tinnitus.The confrontation came four days after police shot and killed two men — one accidentally — amid another domestic dispute in Brooklyn. In that case, one of the men, Francisco Carvajal, was carrying a knife and had pushed his way into his ex-girlfriend's apartment Monday night, police said. After Carvajal had shown up earlier that evening, she had called another man, Rafael Laureano, for help.As Carvajal used the knife to cut through the door of the bathroom in which the woman had locked herself and her children, officers broke down the front door, and the unarmed Laureano bolted into the apartment, although a sergeant tried to stop him, police spokesman Stephen Davis said Thursday.Carvajal tried to attack Laureano with the knife, and officers repeatedly ordered Carvajal to drop the weapon, police said. But instead, he came at them, and officers fired at least 10 times, killing both men, police said.Nine rounds hit Carvajal; one hit Laureano in the back."
7,MEDIA,Netanyahu Fooled the New York Times -- For One Day,"James Zogby, ContributorPresident, Arab American Institute; author, 'Arab Voices'",https://www.huffingtonpost.com/entry/netanyahu-fooled-the-new_b_5931380.html,"This Israeli fantasy of making peace with the Arabs without first making peace with the Palestinians has been around for decades. It is, in effect, a desire to turn the Arab Peace Initiative on its head. As is often the case, Netanyahu's clever, but disingenuous, ploys can't stand up in the face of reality.",2014-10-04,"Israeli Prime Minister Benjamin Netanyahu gestures as he speaks during a joint press conference with Defense Minister (unseen) at the defense ministry in the coastal city of Tel Aviv on August 2, 2014. Israel will continue its military campaign in the Gaza Strip for as long as needed and with as much force as necessary,Netanyahu said. AFP PHOTO/GALI TIBBON (Photo credit should read GALI TIBBON/AFP/Getty Images)",https://img.huffingtonpost.com/asset/5bb5bff63c000020010d05a5.jpeg?ops=scalefit_720_noupscale,"Ever the clever one, Israeli Prime Minister Benjamin Netanyahu was up to his old tricks again this week. On Monday, he addressed a half empty UN General Assembly chamber and then came to Washington for what was reported to be a rather chilly meeting with President Obama. His United Nations' speech was classic Netanyahu -- ominous doomsday warnings coupled with red meat for the faithful, followed by misdirection and, for good measure, a bit of outright deceit intended for media consumption. The latter, most notably, included the Prime Minister's offer to the Arab States to join with Israel in creating ""a productive partnership that would build a more secure, peaceful, and prosperous Middle East"" -- the idea being something like ""we can't make peace with the Palestinians, but if you, Arab States, make peace with us, then we can work together to find a solution to all our problems"". This Israeli fantasy of making peace with the Arabs without first making peace with the Palestinians has been around for decades. It is, in effect, a desire to turn the Arab Peace Initiative on its head with Israel seeking to secure the benefits of regional recognition and normalization, while paying no price, in return. To the uninitiated, or the true-believer, the idea has some appeal -- making it appear that Netanyahu is taking the ""high road"" in fighting extremism and seeking peace. It is, however, a non-starter since it is something that no Arab leader, and most certainly no segment of Arab public opinion will tolerate. No Arab, at this point, will walk over the bodies of Gaza's dead or by-pass Arab rights in Jerusalem. There is another more fundamental problem and that is that Netanyahu wasn't serious. His proposal wasn't real. It was, instead, the sort of clever gamesmanship, playing for headlines, for which the Israeli PM is notorious. As is often the case, when he is backed into a corner, Netanyahu will try to maneuver by changing the subject. It was disturbing that instead of straight-away dismissing this stunt, the New York Times took the bait and headlined their report on the Israeli leader's speech and meeting with President Obama -- ""Netanyahu Sees Arab Alliance Aiding Mideast Peace"". The accompanying story began,Prime Minister Benjamin Netanyahu of Israel on Wednesday raised the tantalizing prospect that a new Arab alliance could resuscitate Israel's moribund peace talks with the Palestinians, but President Obama responded with a familiar complaint -- that Jewish settlements are the real problem.The headline and the framing of the story were misleading and disturbing, portraying Netanyahu as a visionary who sees new possibilities in a changing world, and Obama as stuck in the past with nothing to offer but ""a familiar complaint"". But wading further into this story makes it clear that the headline and the lead paragraphs were, in fact, nothing more than the misdirection, Netanyahu had hoped for. Right before the White House meeting, Israel had approved over 2,000 new settlement units in East Jerusalem and a group of hardline settlers, with Israeli military protection occupied a number of homes in Silwan, an Arab community also in East Jerusalem. Far from being just President Obama's ""familiar complaint,"" settlement expansion designed to frustrate peace and embarrass the White House is the modus operandi of the Israeli government -- which, by its very actions, makes it clear that it has no intention of reaching a just peace agreement with the Palestinians. In the aftermath of the horrific slaughter of innocents in Gaza and in the midst of the rapid expansion of Jewish-only colonies in and around occupied Jerusalem, any talk of an ""Arab Alliance"" with Israel becomes sheer nonsense. And the notion that Israel is now in an ""arguably stronger position in the region, if not internationally"" is also nonsense. With Israel facing a UN investigation into its bombing of UN facilities in Gaza, a Security Council vote on a pending Palestinian resolution to set a date for Israeli withdrawal from the occupied territories, and growing international outrage over Israel's behavior in the Gaza war and its ever expanding settlement program -- Israel is, in fact, more isolated then ever before. And because the U.S. continues to be Israel's strongest ally, it is putting the U.S. at risk, as well. The very next day, the Times ran an editorial entitled ""Mr. Netanyahu's Strange Course"", in which they rebutted not only the Prime Minister, but the aforementioned article. They referred to the newly announced settlements as ""another in a string of calculated embarrassments that... have undermined American efforts"" and quoted the Administration rebuke that the new construction ""would bring international condemnation [that would] 'distance Israel from even its closest allies.'"" As is often the case, Netanyahu's clever, but disingenuous, ploys can't stand up in the face of reality. The Israeli Prime Minister may have initially fooled the New York Times headline writers and story editors. But in the end, the Times got it right when they closed their editorial noting ""Mr. Netanyahu's present course is antagonizing everyone"". Follow @AAIUSA for more."
8,ENTERTAINMENT,Taylor Swift Calls Out Celebrity Culture,Lauren Duca,https://www.huffingtonpost.com/entry/taylor-swift-celebrity-culture_n_5931904.html,,2014-10-04,"LAS VEGAS, NV - SEPTEMBER 19: Recording artist Taylor Swift performs onstage during the 2014 iHeartRadio Music Festival at the MGM Grand Garden Arena on September 19, 2014 in Las Vegas, Nevada. (Photo by Kevin Mazur/WireImage)",https://img.huffingtonpost.com/asset/5bb47eff1f000039012418b1.jpeg?ops=scalefit_720_noupscale,"Taylor Swift may collect BFFs with more fervor than Taylor Swift names Scottish Folds after TV characters, but she doesn't really give a crap if she's part of the ""in-crowd."" In an interview with Canada's Fashion magazine, she spoke about how she feels the pressures of having a posse of mindless followers and then just shakes it off: ""Celebrities surround themselves with people who don't know what they want and only have you to validate their lives – that's not interesting to me.Despite the fact that, as Jezebel noted, this may be 10% intended as a jab at Katy Perry, it's interesting to hear a celebrity call out celebrity culture and recognize the power of true lady friendship.[h/t The Mirror]"
9,POLITICS,NRA's Ominous But Misleading Appeal,,https://www.huffingtonpost.com/entry/nra-ominous-appeal_n_5931956.html,,2014-10-04,"UNITED STATES - SEPTEMBER 22: From right, Sen. Mary Landrieu, D-La., New Orleans Mayor Mitch Landrieu and Rep. Cedric Richmond, D-La., make their way into the Pontchartrain Park Community Center in New Orleans to speak to seniors on Monday, Sept. 22, 2014. Sen. Landrieu and her brother New Orleans Mayor Mitch Landrieu endorsed Rep. Richmond during the event. (Photo By Bill Clark/CQ Roll Call)",https://img.huffingtonpost.com/asset/5bb8d86f200000f90101d384.jpeg?ops=scalefit_720_noupscale,"The following post first appeared on FactCheck.org.The National Rifle Association employs images in a series of TV ads of an intruder breaking into the home of a mother home alone with her baby to make the case that several Democratic candidates have “voted to take away your gun rights.” But the implication of the jarring imagery — that the legislators would prevent the woman from defending herself — goes far beyond the facts.Music in the ad sets an ominous tone as a woman in a bathrobe checks a baby crib in a darkened house before getting a text message – presumably from the spouse – saying they have “Landed. Miami.” She texts back, “Love You. Good night.” Then, a shadowy figure passes by a window before violently breaking through the front door. “It happens like that,” the female narrator says. “The police can’t get there in time. How you defend yourself is up to you. It’s your choice.”With images of the home now bathed in flashing police lights and cordoned off by crime tape, the narrator in a version of the ad attacking Louisiana Sen. Mary Landrieu continues, “But Mary Landrieu voted to take away your gun rights. Vote like your safety depends on it. Defend your freedom. Defeat Mary Landrieu.”Similar ads target Colorado Sen. Mark Udall and Florida gubernatorial candidate Charlie Crist.The implication of the ad’s imagery is unmistakable: the targets of the ad have voted or supported policies that might prevent homeowners from being able to protect themselves against a violent intruder. But the NRA has to stretch the legislators’ records to the breaking point to make that connection.First, and most importantly, none of the three politicians targeted in the ads is against people owning a gun or using it for self-defense in their homes. In its backup material, the NRA makes a more nuanced argument that the politicians have — in various ways — either voted for or expressed support for legislation that would limit the rights of law-abiding gun owners. It cites support for legislation that sought to expand background checks, or to limit assault weapons or large capacity magazines, or because they voted for the confirmation of Supreme Court Justices Sonia Sotomayor or Elena Kagan — both of whom the NRA views as hostile to gun rights.The NRA’s Case Against LandrieuLet’s start with the ad targeting Landrieu, as it has the weakest backing.There are three legs to the NRA’s case that “Mary Landrieu voted to take away your gun rights” — and none of them hold any weight with regard to the implied claim that Landrieu would limit the ability of the woman in the ad to defend herself with a gun against an intruder.The first is Landrieu’s vote for the Manchin-Toomey amendment for expanded background checks. The amendment, created by Sens. Joe Manchin, a Democrat, and Pat Toomey, a Republican, in the wake of the school shooting in Newtown, Connecticut, would have expanded background checks to private sales by unlicensed individuals at gun shows and over the Internet.In a vote of 54 to 46, the Manchin-Toomey amendment failed to garner the 60 votes needed to move forward — despite Landrieu’s support.So how exactly would that amendment have prevented a woman from having a gun in her home to protect herself from an intruder?Our fact-checking colleague at the Washington Post, Glenn Kessler, knocked down an unfounded hypothetical situation posed by the NRA — that the law would have prevented a woman threatened by a stalker, who lives in a remote area far from gun stores, from making the quick purchase of a shotgun from a cousin’s neighbor. But even in that narrow situation, Kessler noted the law would not have stood in the way of such a purchase.NRA spokesman Andrew Arulanandam told us the vote on the Manchin-Toomey amendment “was considered a gun control vote” and that it would have “diminished 2nd Amendment rights.”Besides, Arulanandam said, that vote was “in addition to other anti-gun votes she has cast.”The NRA also pointed to Landrieu’s votes to confirm Sonia Sotomayor and Elena Kagan to the U.S. Supreme Court — both of whom the NRA contends have been hostile to gun owners’ rights, based on positions they took in prior cases. We asked Arulanandam how those votes could have been a deal-breaker for the NRA given that Republican Sens. Lamar Alexander of Tennessee and Lindsey Graham of South Carolina both voted for Sotomayor’s confirmation; and Graham voted for Kagan’s as well. In September, the NRA endorsed the re-election bids of both Alexander and Graham.Arulanandam said people need to consider the totality of Landrieu’s record on gun control. But the only other votes cited by the NRA were ones Landrieu cast in 1999 and 2004 for amendments to close the so-called “gun show loophole” by requiring background checks on firearm transactions at gun shows. Expanded background checks “make it more difficult for law-abiding citizens to obtain a firearm,” Arulanandam said.“As the ad said, Mary Landrieu votes to take away your gun rights,” Arulanandam insisted.But the ad does more than that. It shows frightening images of an intruder breaking into a mother’s home at night. We’re not going to wade into the debate about the inconvenience of background checks at gun shows, but it’s a long stretch from there to the implication that Landrieu would prevent the woman in the ad — and anyone else like her –from obtaining a gun for self-defense.Landrieu’s campaign notes that Landrieu has co-sponsored and voted for legislation to allow people with permits to carry concealed weapons in states other than their own; has repeatedly opposed a ban on assault weapons and high capacity ammunition clips; and that she voted to prevent the seizure of firearms during a state of emergency. And perhaps most germane to the NRA ad, Landrieu praised a decision by the Supreme Court to repeal a ban on carrying handguns in Washington D.C.; and voted in 2009 to “restore Second Amendment rights in the District of Columbia” and to repeal its ban on semi-automatic weapons. In other words, Landrieu has been an advocate for people like those featured in the NRA ad being able to keep a firearm in their home for protection.Udall, Crist & Gun RightsIn its backup material for the claim that Udall “voted to take away your gun rights,” the NRA again cites votes for the Manchin-Toomey amendment and votes to confirm Sotomayor and Kagan to the Supreme Court. The Udall campaign noted that in Sotomayor’s confirmation hearing, the Colorado senator specifically asked her views on the 2nd Amendment’s right to bear arms. According to an Associated Press account at the time, Sotomayor “told Udall she would follow a 2008 Supreme Court ruling that affirmed Americans’ right to own guns for self-defense.” But in addition to those votes, the NRA cites Udall’s vote in 2013 to regulate large capacity ammunition feeding devices. The proposed amendment failed 46-54.The NRA’s Arulanandam says law-abiding people ought to be able to possess the “firearms they feel comfortable with,” including those with large-capacity ammunition feeding devices.“People have to be prepared for the worst and plan for the worst,” Arulanandam said. “What if there is more than one attacker? … Our position is that law-abiding people should be able to have the upper hand in situations like these.” On the same day as the Manchin-Toomey vote and the vote to regulate large capacity ammunition feeding devices, Udall also voted against an assault weapons ban; and in favor of cross-state reciprocity for the carrying of concealed firearms. The Udall campaign issued a statement to us, via e-mail, stating that “the implication that he [Udall] would prevent a responsible gun owner from purchasing a gun to protect herself is completely preposterous.” The NRA backup for the ad about Crist, the Florida gubernatorial candidate, refers to an article in the Tampa Bay Times in 2012. In that article, Crist — who was reliably pro-gun rights when he served as a Republican Florida governor — said that in light of the “wake-up call” from the Newtown shooting, he now supported an assault weapons ban, a size limit on ammunition clips and tougher background checks.“We need to have some restrictions, that’s pretty obvious to most people,” Crist told the Tampa Bay Times. “What do you need a 30-clip magazine for? Not to go hunting deer. I can tell you that because I hunt deer.”There is enough in the article to make a case that Crist supports legislation that would infringe on your gun rights, but does this mean he is “opposed” to your gun rights? Even the Supreme Court has said that Congress has the right to impose reasonable restrictions on gun rights. The argument then becomes what is a reasonable restriction. But as with all three ads, the comment about Crist needs to be considered in the totality of the ad’s imagery.It’s one thing for the NRA to make the argument, in the case of Udall, that he would limit this woman’s ability to use large ammunition clips; or in the case of Crist, that she might not be able to use an assault weapon; or in the case of Landrieu, that the woman might have to pass a background check if she had sought to buy a firearm at a gun show. But the imagery of the ad goes well beyond any of those more narrow issues.To be clear, none of the three — Landrieu, Udall or Crist — opposes the right of law-abiding Americans to own a handgun, or to use that gun to defend themselves against a home intruder.We should note that there is also a version of the NRA ad, using the same imagery, supporting NRA-endorsed Republicans — including Sen. Mitch McConnell of Kentucky and Senate candidate Tom Cotton of Arkansas. Those ads say the Republicans have “protected your right to self-defense.” (You can view all of the ads here). To that, we would add that the record shows their Democratic opponents, Alison Lundergan Grimes and Sen. Mark Pryor, respectively, have also supported Americans’ right to own a gun and to use it in self-defense against an intruder in their home.– Robert Farley"
