,category,headline,authors,link,short descr,date,image_caption(s),image_link(s),article
10,IMPACT,WHO Launches Emergency Ebola Fund To Prevent Future Response Blunders,,https://www.huffingtonpost.com/entry/who-ebola-fund_n_6542254.html,,2015-01-25,"World Health Organization (WHO) Director-General Dr. Margaret Chan Â on August 8, 2014 in Geneva gives a press conference following a two-day emergency meeting on west Africa's Ebola epidemic, as the death toll nears 1,000.Â The UN health body said its emergency committee, which includes global medical and policy experts, had declared the deadliest known outbreak of the Ebola virus a 'public health emergency of international concern'. AFP PHOTO / Alain GROSCLAUDEÂ Â (Photo credit should read ALAIN GROSCLAUDE/AFP/Getty Images)",https://img.huffingtonpost.com/asset/5bb1d3d42200005700db6dbc.jpeg?ops=scalefit_720_noupscale,"* Executive Board agrees contingency fund, rapid response* $100 million contingency fund ""good starting point"" - Chan* U.S. CDC boss says ""the WHO we have is not the WHO we need"" (Adds Chan, Aylward comments from news briefing)By Stephanie NebehayGENEVA, Jan 25 (Reuters) - The World Health Organization (WHO) said on Sunday it will create a contingency fund and an emergency workforce to respond quickly to crises after strong criticism of the agency's delay in confronting the Ebola epidemic.Director-general Dr. Margaret Chan said at an emergency meeting called to discuss the agency's Ebola response that the outbreak showed the need to strengthen WHO's crisis management and to streamline procedures for recruiting frontline workers.Ebola has been ""a mega crisis and it overwhelmed the capacity of WHO,"" she told a news briefing. ""Member states truly understand that the world does need a collective defense mechanism for global health security.""In the past year, 21,724 Ebola cases have been reported in nine countries and 8,641 people have died, according to the WHO, which says West Africa's outbreak is ebbing.A resolution seeking major reforms, brought by the United States and South Africa, was adopted by consensus at the meeting of the 34-member executive board.""The WHO we have is not the WHO we need, not the WHO we needed to respond to health emergencies of the magnitude of Ebola,"" Tom Frieden, director of the U.S. Centers for Disease Control (CDC), told the talks.In the debate, he said that political considerations often overruled technical expertise at the United Nations agency.""We have given some structure to what we expect in May, which is far-reaching reforms,"" said Frieden, referring to the WHO's annual meeting of health ministers in May.Major donors welcomed agreement on the emergency fund, which a WHO committee had recommended in 2011 should contain $100 million after the 2009-2010 influenza pandemic. Chan told reporters that the figure was ""a good starting point.""Bruce Aylward, WHO assistant director-general in charge of the Ebola response, said the agency would need about a workforce of about 1,500 for such emergencies, up from 1,000 currently.""What you see here is the potential for some of the most wide-ranging and sweeping reforms in any area of WHO that we've seen almost since the organization was established,"" he said.Dr. Dirk Cuypers of Belgium's health service said on behalf of the European Union: ""We need to ensure that a clear line of command for all levels of the organization is in place for emergency operations and we need a global work force ready to be deployed in a effective and timely manner.""Ebola cases are declining in Guinea, Liberia and Sierra Leone, Chan said. ""But we must maintain the momentum and guard against complacency and donor fatigue."" (Editing by Raissa Kasolowsky, Stephen Powell and Michael Urquhart) Like Us On Facebook   Follow Us On Twitter "
11,ENTERTAINMENT,30 Things You May Not Know About Charlie Hunnam,,https://www.huffingtonpost.com/entry/charlie-hunnam-facts_n_6542598.html,,2015-01-25,"MILAN, ITALY - JANUARY 18: Charlie Hunnam attends the Calvin Klein Collection show during the Milan Menswear Fashion Week Fall Winter 2015/2016 on January 18, 2015 in Milan, Italy. (Photo by Jacopo Raule/Getty Images)",https://img.huffingtonpost.com/asset/5bb49f763c000020010caa48.jpeg?ops=scalefit_720_noupscale,"Charlie Hunnam's handsome Hollywood evolution started more than a decade ago, but he's still winning over plenty of fans.Read more on Popsugar"
12,BUSINESS,Bottom In Sight For U.S. Gas Prices: Survey,,https://www.huffingtonpost.com/entry/gas-prices_n_6542628.html,The end of a months-long slide in gas prices may be near.,2015-01-25,"A gasoline nozzle is inserted into a vehicle's gas tank during refueling at a a Royal Dutch Shell Plc gas station in Portland, Tennessee, U.S., on Friday, Jan. 16, 2015. Trips to the pump that are costing less and less and job gains that have accelerated are helping Americans feel more optimistic about the economic recovery, now in its sixth year. Photographer: Luke Sharrett/Bloomberg via Getty Images",https://img.huffingtonpost.com/asset/5bb31a7f240000320055c132.jpeg?ops=scalefit_720_noupscale,"By Luc CohenNEW YORK, Jan 25 (Reuters) - The average price of a gallon of gasoline in the United States fell 13.3 cents in the past two weeks, falling to its lowest level since late April 2009, but the end of a months-long slide may be near, according to the Lundberg survey released Sunday.Prices for regular grade gasoline fell to $2.07 a gallon in the survey dated Jan. 23 from the previous survey on Jan. 9.The recent drop has taken prices down more than $1.24 a gallon from the same period a year ago, a decline driven by losses in the crude oil market from its June peak.However, survey publisher Trilby Lundberg noted that the drop in pump prices was less steep than it had been in previous periods and that the price many wholesale customers paid for gasoline rose in the past 10 days, suggesting a bottoming-out or increase in retail gasoline prices could be looming.""The street price crash is either coming to an end or is already at its bottom,"" Lundberg said, noting that it would take another substantial slide in the price of oil to reverse the gains in wholesale prices.Both U.S. and Brent crude futures continued their decline in the past week, after finishing the week ended Jan. 16 up slightly. These shallower price losses were part of the reason why the gasoline price drop was less steep this week and contributed to the gains in wholesale prices.On Friday, Brent crude closed up at $48.79 a barrel, while U.S. crude settled down 72 cents at $45.59.The highest price within the survey area in the 48 contiguous U.S. states was recorded in San Francisco at $2.54 per gallon, with the lowest in Albuquerque, New Mexico at $1.73. (Editing by Eric Walsh)"
13,POLITICS,The Unbearable Rudeness of Bibi,"Bennet Kelley, ContributorHost, Cyber Law and Business Report; political columnist; inte...",https://www.huffingtonpost.com/entry/the-unbearable-rudeness-o_b_6539558.html,"Time and time again, Netanyahu has shown little respect for American presidents, institutions or interests despite the fact that we provide Israel with over $3 billion in aid annually and use our diplomatic capital to block anti-Israeli measures at the United Nations.",2015-01-25,2015-01-25-Barack_Obama_with_Benjamin_Netanyahu_in_the_Oval_Office_51809_21.JPG,https://images.huffingtonpost.com/2015-01-25-Barack_Obama_with_Benjamin_Netanyahu_in_the_Oval_Office_51809_21-thumb.JPG,"With the front page of the paper being occupied by so-called Deflate-gate, Congress was quick to reclaim its rightful place with its own mini-tempest over House Speaker John Boehner's invitation to Israeli Prime Minister Benjamin (""Bibi"") Netanyahu to speak before a Joint Meeting of Congress without prior notice to and/or approval from the Obama administration.  The issue of a foreign head of state addressing a joint meeting of Congress is not in itself a huge deal. This would be the 115th time it occurred and would be Netanyahu's third appearance before the body.What is a big deal, however, is that Prime Minister Netanyahu actively sought, and Speaker Boehner extended, the invitation entirely behind the administration's back to permit Netanyahu to advocate harsher sanctions against Iran that the administration (and even Mossad) opposes while a final resolution with Iran is being negotiated. Even worse, the date selected (March 3) is only two weeks before Israel's election, so the administration will not be able to meet with Netanyahu due to longstanding policy of not meeting with foreign leaders too close to their election so as not to be seen as interfering.As an administration official explained privately, ""there are things you simply don't do. He spat in our face publicly and that's no way to behave."" Welcome to the Unbearable Rudeness of Bibi.When American Presidents speak of Israel, it is often expressing sentiments similar to President Clinton's when he said, ""America and Israel share a special bond. Our relations are unique among all nations.""When Prime Minister Netanyahu speaks of the United States, however, it is to say that ""American policy in the Middle East is based on lies and distortions"" or to boast that America is easily manipulated and moved ""in the right direction [so] they won't get in the way."" He has also bragged about double-crossing President Clinton by reluctantly agreeing to adhere the Oslo accords but then taking measures to render it meaningless.Secretary of State James Baker temporarily banned then-Deputy Foreign Minister Netanyahu from the State Department for his ""lies and distortions comments,"" while Netanyahu's manipulation comments only prove President Clinton's initial impression after meeting with the new Prime Minister in which he said ""[h]e thinks he is the superpower, and we are here to do whatever he requires."" (Further supporting Clinton's assessment was the recent statement of one of Netanyahu's cabinet members who told the U.S. ambassador that Israel expects ""unconditional"" support ""even when you think we're wrong."")Time and time again, Netanyahu has shown little respect for American presidents, institutions or interests despite the fact that we provide Israel with over $3 billion in aid annually, use our diplomatic capital to block anti-Israeli measures at the United Nations and have had to endure a devastating oil embargo and terrorist attacks at home and abroad because of our support for Israel.In 2010, Netanyahu announced the expansion of new settlements in occupied East Jerusalem on the same day that Vice President Joe Biden arrived to restart the peace process (ignoring the U.S.' request to to implement a settlement freeze as part of the resumption of peace talks with the Palestinians). Then Secretary of State Hillary Clinton condemned the announcement as an insult, while Vice President Biden privately scolded Netanyahu that he was ""undermin[ing] the security of our troops who are fighting in Iraq, Afghanistan and Pakistan.""Netanyahu has lectured the President in front of the White House press corps and compared the administration's refusal to set a firm deadline for Iran to act on its nuclear program or face military action to the Roosevelt's administration rejecting calls from Jewish leaders to bomb Auschwitz.He also has shown little reluctance about meddling in American politics. In 1998, when President Clinton was pushing Netanyahu to fulfill Israel's obligations under the Oslo accords, Netanyahu made a point of starting his U.S. tour by meeting with House Speaker Newt Gingrich and appearing at a political rally with Rev. Jerry Falwell (who at the time was selling a videotape called ""The Clinton Chronicles,'' which accused the President of having been a narcotics dealer and user and involved in the death of Vincent Foster).In 2012, Netanyahu was criticized in both Israel and the U.S. for actively supporting Republican challenger Mitt Romney. Romney and Netanyahu shared political consultants and Netanyahu's attempts to escalate the situation in Iran during the fall campaign were quickly translated into Romney attack ads in the final days of the campaign.Less than a month before the 2014 midterm elections, Netanyahu appeared on CBS' Face the Nation and charged that he was ""baffled"" by President Obama's opposition to expansion of settlements in the Occupied Territories, a position he said was ""against American values."" Haaretz, Israel's leading English newspaper, called the comments a ""stink bomb"" and condemned Netanyahu for playing the partisan during our election season when he ""slammed the president as if he was a Tea Party brawler rather than the leader of a country with a 'special relationship' with America.""Netanyahu's comments also were a flat out lie, since every President since the 1967 War, from President Johnson to President Obama, has expressed opposition to expansion of the settlements in the Occupied Territories.Netanyahu latest stunt seeks to fuel claims that President Obama is not ""pro-Israel,"" an astounding charge since former Defense Secretary Gates, who served under three Republican Presidents and Obama once reminded Netanyahu that ""no U.S. administration had done more, in concrete ways, for Israel's strategic defense than Obama's"" (a view shared by former Prime Ministers Shimon Peres and Ehud Barak). For Netanyahu to disrespect the United States just after Secretary of State Kerry had called nearly 50 head of state to head off action against Israel at the United Nations is astounding. Waterboys are treated with more respect than that.Maybe the better question is whether Netanyahu is a friend of the United States? In words and deed he clearly is not. As an American, I am deeply offended that a nation that we have given so much to and sacrificed for would show such a total lack of respect to our President. I am also appalled that so-called ""loyal opposition"" leaders were complicit in this scheme. Sadly, Republicans seem elated to see a foreign leader spit in the face of the United States (so much for ""politics ending at the water's edge"").Israelis also are outraged since Netanyahu is alienating Israel's most important ally to salvage his reelection chances. As one Israeli columnist noted, the relationship between the Prime Minister and the President of the United States is ""the greatest strategic asset that Israel has had since its establishment"" and Netanyahu has ""irresponsibly"" ""destroyed"" that relationship. Israeli voters may have the final say on this issue, since with Netanyahu running behind in the polls, they may send Bibi to a well-deserved retirement.He will not be missed."
14,ENTERTAINMENT,'Birdman' Upsets 'Boyhood' At PGA Awards,Christopher Rosen,https://www.huffingtonpost.com/entry/birdman-pga-award_n_6541374.html,,2015-01-25,"LOS ANGELES, CA - JANUARY 24: Producer/director Alejandro Gonzalez Inarritu accepts the Outstanding Producer of Theatrical Motion Pictures award for 'Birdman' onstage during the 26th Annual Producers Guild Of America Awards at the Hyatt Regency Century Plaza on January 24, 2015 in Los Angeles, California. (Photo by Mark Davis/Getty Images)",https://img.huffingtonpost.com/asset/5cf834092100004011e6b349.jpeg?ops=scalefit_720_noupscale,"Maybe this is an Oscar race after all: At Saturday night's Producers Guild of America Awards, ""Birdman"" producers Alejandro Gonzalez Iñárritu, John Lesher and James W. Skotchdopole won the Darryl F. Zanuck Award for best movie, topping Best Picture favorite ""Boyhood,"" among other Oscar nominees, for the honor.Why is this significant? Recent history, for one: Since 2007, when ""No Country for Old Men"" won at the Producers Guild Awards, the guild's top award winner has matched the Oscars' Best Picture choice every time. (Last year, ""12 Years a Slave"" and ""Gravity"" tied at the PGA Awards, giving the group a somewhat unfair statistical advantage.) In its history, the PGA Awards has successfully predicted the eventual Best Picture winner 18 of 25 times.The PGA Awards are also 2015's first major guild awards, making it the first time people in the industry (many of whom are also Academy members) have voted on this year's awards contenders. (Previous awards shows -- such as the Critics' Choice Awards and Golden Globes, both spots where ""Boyhood"" triumphed -- were voted on by media members.) That ""Birdman"" was chosen perhaps shows voters' hand a bit: It's a movie about the industry itself, and recent PGA Award and Best Picture winners ""The Artist"" and ""Argo"" were also about the power of Hollywood. As Grantland and Entertainment Weekly writer Mark Harris tweeted:""Birdman"" and ""Boyhood"" will battle again on Sunday night, when the Screen Actors Guild Awards are handed out. Both films are nominated for Outstanding Performance by a Cast in a Motion Picture (the SAG Awards' equivalent of Best Picture). The 87th annual Academy Awards are set for Feb. 22."
15,POLITICS,Chris Christie Reassures Iowa Voters That He's Conservative Enough,Igor Bobic,https://www.huffingtonpost.com/entry/chris-christie-iowa-freedom-summit_n_6539648.html,,2015-01-25,"Chris Christie, governor of New Jersey, speaks during the Iowa Freedom Summit in Des Moines, Iowa, U.S., on Saturday, Jan. 24, 2015. The talent show that is a presidential campaign began in earnest Saturday as more than 1,200 Republican activists, who probably will vote in Iowa's caucuses, packed into a historic Des Moines theater to see and hear from a parade of their party's prospective entries. Photographer: Daniel Acker/Bloomberg via Getty Images ",https://img.huffingtonpost.com/asset/5bb8e5af1f00004002257962.jpeg?ops=scalefit_720_noupscale,"DES MOINES, Iowa -- New Jersey Gov. Chris Christie (R) walked out on stage at the Iowa Freedom Summit on Saturday and resoundingly rejected the ""conventional wisdom"" that his East Coast style doesn't play in the heartland.""If I was too blunt, too direct, too loud and too New Jersey for Iowa, then why do you people keep inviting me back?"" Christie asked. He pointed to his warm relationship with the event's organizer, Rep. Steve King (R-Iowa), whom the governor described as ""a good friend.""Christie's remarks closed out a long day of speeches at the cattle call for conservative White House hopefuls, which also featured Sen. Ted Cruz (R-Texas), Wisconsin Gov. Scott Walker (R) and former Arkansas Gov. Mike Huckabee (R). Christie has faced questions about his ability to connect with social conservatives, who are crucial to winning the early Iowa caucuses. His straight-talk, no-nonsense image has won him many fans at home, but the act can come across as grating to those hearing him for the first time. He sought to soothe such concerns on Saturday by doing what he does best -- being blunt.""Being honest with the people you hope to represent about the feelings you hold deeply is never, ever a political liability, and I will never change doing it exactly that way,"" he said, touting his anti-abortion record in the blue state of New Jersey.Christie didn't receive nearly the amount of applause or adoration thrown at the conservative firebrands who spoke before him. But he did win over at least a few audience members, who said they didn't mind Christie's brash style.""What's more important is the ideas and the way they're implemented,"" said Iowa retiree Daniel Reneker. ""We have livestock out here we have to shout at once in a while.""""I've always liked that Christie's the type of guy he is,"" said Des Moines resident George Freeland.""He says the same thing most of the time, but I just like where he's going and I like where he's been. He's kind of proven,"" added Susan Heun, a member of the Iowa Republican Party's central committee.The governor also received a rare vote of confidence from Erick Erickson, a prominent social conservative and editor of RedState.com, who tweeted that he found Christie's address to be ""really solid and impressive.""Nick Ryan, an Iowa-based Republican strategist, said that Christie's reputation is both a boon to his presidential prospects and a potential liability during a long campaign.""The biggest thing that he has going for him is his reputation. But it’s quite possibly his biggest liability. He is known because has been brash. He’s blunt. That’s why he’s been interesting. He’s been newsworthy,"" Ryan said.Christie faces a litany of other challenges as well. His popularity in his home state is at the lowest levels he has ever seen, driven down by criticism that he is neglecting New Jersey with frequent fundraising trips out-of-state as chair of the Republican Governors Association and persistently gloomy economic headlines about the shaky state of New Jersey's finances. Also not forgotten by future Iowa caucus voters is Christie's alleged involvement in the George Washington Bridge scandal.""I don't know if I want his hand on the red button if he's willing to shut down the whole bridge,"" said Ben Unander, an Illinois resident who supports famed neurosurgeon and rising conservative star Ben Carson. ""He says he didn't, but come on, if you have a staff full of people, you need to know what they're doing. Ultimately I think he's responsible."""
