,category,headline,authors,link,short descr,date,image_caption(s),image_link(s),article
0,HEALTHY LIVING,Better Than Happiness,"Linda Bloom LCSW and Charlie Bloom MSW, ContributorBestselling Authors and Relationship Experts",https://www.huffingtonpost.com/entry/better-than-happiness_b_6723960.html,"It may sound strange coming from someone who has written dozens of blogs about happiness and taught a lot of seminars on the subject, to hear that happiness isn't necessarily all that it's cracked up to be. Or put another way, in terms of one's overall quality of life, spirit, and degree of personal fulfillment, some things play a much more significant role than feelings of happiness",2015-02-23,sun rays coming through branches of an oak tree on a misty morning sunrise,https://img.huffingtonpost.com/asset/5b9e920d1f0000510022111e.jpeg?ops=scalefit_720_noupscale,"It may sound strange coming from someone who has written dozens of blogs about happiness and taught a lot of seminars on the subject, to hear that happiness isn't necessarily all that it's cracked up to be. Or put another way, in terms of one's overall quality of life, spirit, and degree of personal fulfillment, some things play a much more significant role than feelings of happiness. I'll get to that in a minute.In my freshman year of college I read a book that changed my life. It was at the time the most important book that I had ever read, and it continues to be to this day. It's entitled, Man's Search for Meaning and it was written in 1946 by the Viennese psychiatrist and neurologist, Viktor Frankl.Frankl had been recently liberated from a concentration camp in which he had been imprisoned for several years, and shortly after receiving news that the Nazis executed his entire family, including his wife, pregnant with their first child, his brother, and both of his parents, as well as many other relatives.What Frankl personally witnessed and experienced during his incarceration led him to a conclusion that to this day stands as one of the most succinct and profound statements ever written about the human condition. That is that ""everything can be taken from a [person] but one thing: the last of the human freedoms -- to choose one's attitude in any given set of circumstances."" The circumstances in which Frankl lived during the war years, were beyond horrific. His writings were not simply expressions of a theory, but were grounded in his daily self-reflection on his own experience and his observation of countless other inmates and how they did or did not manage to survive unspeakable conditions.Frankl discovered that the primary variable that influenced the likelihood of whether his fellow prisoners survived of perished had to do with the degree to which they were identified with a purpose larger than themselves, particularly one in which they saw themselves as contributing in some meaningful way to the enhancement of the quality of others' lives. He claimed that those prisoners who suffered the physical and mental cruelties of the camps and managed to survive also tended to be the ones who sought and found the wherewithal to share the little they had, a comforting word, a crust of bread, or an act of simple kindness with others. Giving to others was of course not a guarantee of survival, but it was a way of sustaining a sense of purpose and meaning in the face of overwhelmingly brutal conditions. Without purpose of meaning, our life spirit diminishes and we become more vulnerable to physical and mental stressors.While it's natural to prefer happiness to suffering, Frankl recognized the paradox that a sense of purpose and meaning often is born out of adversity and pain, and he understood the potentially redemptive value in suffering. The recognition that there can be some good that comes out of our most painful experiences can be the central factor in the process of transforming suffering into purpose.In the January 2013 issue of The Atlantic , in her article entitled, ""There's More to Life than Being Happy,"" Emily Esfahani Smith writes, ""Research has shown that having meaning and purpose in life increases overall well-being and life satisfaction, improves mental and physical health, enhances resiliency and self esteem, and decreases the chances of depression."" She goes on to state that according to recent research, ""the single-minded pursuit of happiness is ironically leaving people less happy.""Happiness is usually associated or confused with pleasure, which has to do with experiencing enjoyable feelings and sensations. We feel happy when a need or desire is fulfilled, when we get what we want. The researcher, Kathleen Vohs claims that ""Happy people get a lot of joy from receiving benefits from others, while people leading meaningful lives get a lot of joy from giving to others.""A 2011 study concluded that people who have meaning in their lives through a clearly defined purpose, rate their life satisfaction higher even when they were feeling bad, than those without a sense of purpose.Several years prior to writing his groundbreaking book, Viktor Frankl was already living from a deep sense of purpose that at times required him to forego personal desires in favor of his commitment to fulfill other, purpose-driven intentions. In 1941 Austria had already been occupied by the Germans for three years. Frankl knew that it was just a matter of time before his parents would be taken away. At the time he was already distinguished internationally for his contributions to the field of psychology and had a widespread reputation. He had applied for and was given a visa to America where he and his wife would be safe from the Nazis, but as it became evident that his parents would inevitably be sent to a concentration camp, he recognized that he had to choose between rejecting his visa to America to help his parents make the painful and difficult adjustment to the camps, or to go to America to save himself and his wife and further pursue his career. After considerable deliberation he understood that his deepest purpose was in his loyalty and responsibility to his aging parents. He made the decision to put aside his individual pursuits, stay in Vienna and dedicate his life to being in service to his parents and later, to other inmates in the camps.Frankl's experiences during this time served to form the basis of his theoretical and clinical work that has since profoundly impacted on the quality of life for millions of people worldwide.Viktor Frankl died in 1997 at the age of 92. He spent his post-war years continuing to embody his commitment to serve through his teaching, his writings, and many other forms of contribution to the welfare of humanity. His life served as a stunning example of one man's extraordinary capacity to find and create meaning in a life that was at times characterized by indescribable physical and emotional suffering. He was literally living proof of the claim that we all have the power to choose our attitude in any given set of conditions, regardless of what the circumstances are, and that the choice that we make is the determining factor in the quality of our life. While there may be times when the ability to choose to feel happy doesn't seem available to us, there is never a time in which we lack the ability to choose our attitude. Frankl's life, more so than his written words, affirms that we all possess the power to make and act on this choice. It was, beyond any fragment of a doubt, a life well-lived."
1,ENTERTAINMENT,Jack Osbourne And Wife Announce Second Pregnancy,Lauren Zupkus,https://www.huffingtonpost.com/entry/jack-osbourne-wife-pregnant_n_6730748.html,,2015-02-22,"BEVERLY HILLS, CA - SEPTEMBER 13: TV Personality Jack Osbourne (L) and Actress Lisa Stelly (R) attend the annual 'Summer Spectacular Under The Stars' for the Brent Shapiro foundation for alcohol and drug awareness on September 13, 2014 in Beverly Hills, California. (Photo by Paul Archuleta/FilmMagic)",https://img.huffingtonpost.com/asset/5bb4a5f7250000360039050f.jpeg?ops=scalefit_720_noupscale,"Exciting news for the Osbournes!Jack Osbourne and his wife, Lisa (nee Stelly), announced Saturday that they are expecting their second child together. The former reality star took to his Instagram account to share the baby news with an adorable photo of his wife cuddled up with their 2-year-old daughter, Pearl.Lisa Osbourne went on her blog, Raddest Mom, to elaborate. ""I'm pregnant! Pearl is very happy to become a big sister,"" she wrote. ""She diligently reads her 'I’m a big sister' books every night and recites to me her plans of bathing, feeding, singing to, and holding the baby. We are more than halfway through this thing and are very excited to be parents again!""Jack's sister Kelly Osbourne also shared her excitement on Twitter: Congratulations to the family! "
2,EDUCATION,The Global Search for Education: Our Top 12 Global Teacher Blogs -- What Will Be the Most Significant Classroom Innovation in the Next 10 Years?,"C. M. Rubin, ContributorBlogger and author, 'The Real Alice in Wonderland'",https://www.huffingtonpost.com/entry/the-global-search-for-edu_b_6728470.html,"We liked their innovative ideas so much, we decided to invite these talented 12 back each month to answer one big picture question related to 21st century education.",2015-02-22,2015-02-22-cmrubinworldtop12teachersheadbutt300.jpg,https://images.huffingtonpost.com/2015-02-22-cmrubinworldtop12teachersheadbutt300-thumb.jpg,"Did someone say Oscar winners? As far as we know, our Top 12 haven't won any Oscars - yet - but they did win our hearts and our votes as the Best Global Teacher Blogs of 2014. We liked their innovative ideas so much, we decided to invite these talented 12 back each month to answer one big picture question related to 21st century education. The February question?What will be the most significant classroom innovation in the next 10 years?We suggested our Top 12 think about the perspectives shared by The Global Search for Education thought leaders. For example, in October 2013, we asked Michael Horn (co-author of Disrupting Class: How Disruptive Innovation Will Change the Way the World Learns), ""In the future, will students attend 'schools' or will they be called 'blended learning schools' that combine brick-and-mortar buildings with online learning?""So... back to that homework assignment, which was once again: What will be the most significant classroom innovation in the next 10 years? Our top 12 global teachers have spoken:Adam Steiner thinks that in the next ten years, new gadgets won't be as important as transforming students into creators of knowledge. Read all about it. Todd Finley advocates for mindfulness training and strenuous individualized exercise, believing that they will become widespread in the next ten years. Read all about it. Richard Wells thinks teaching students to teach themselves will be the next key innovation in education. Read all about it.  Tom Bennett praises the burgeoning collective communication of teachers across the world, and says increasing teacher independence will be the biggest forthcoming innovation. Read all about it.Vicki Davis thinks the technology that gave Stephen Hawking a voice needs to become more accessible to our students in the coming years. Read all about it.Lisa Currie suggests we listen to Andy Mead, who thinks the biggest innovation of the future won't be in technology but in teachers themselves, who will grow to develop a more personal, individual-oriented education. Read all about it.Silvia Tolisano says learning how to learn will be the future goal for education. Read all about it.Craig Kemp thinks wearable technology will be the next big innovation in education but notes that local Governments need to play the game and start funding technology in schools. Read all about it.Joe Bower warns that technology can be either a blessing or a curse depending on how it's used e.g. for the interest of the student or the corporation. Read all about it.Karen Lirenman thinks personalized learning and critical thinking will be the future of education. Read all about it.Pauline Hawkins thinks the individualized student-run education that the Internet and a school newspaper provide need to be integrated into the classroom for education to see innovative change in the next ten years. Read all about it.Be sure to join us next month for the next big picture question our Top 12 teachers have the answer for.Tom Bennett, Joe Bower, Susan Bowles, Lisa Currie, Vicki Davis, Todd Finley, Pauline Hawkins, Craig Kemp, Karen Lirenman, Adam Steiner, Silvia Tolisano, and Richard Wells are The Global Search for Education 2014 Top 12 Global Teacher Bloggers. Left to right top row: Adam Steiner, Susan Bowles, Richard Wells, Todd Finley Middle row: Vicki Davis, Lisa Currie, C. M. Rubin, Pauline Hawkins, Joe Bower Bottom row: Craig Kemp, Silvia Tolisano, Tom Bennett, Karen Lirenman(Lead photo is courtesy of Education Services Australia)Join me and globally renowned thought leaders including Sir Michael Barber (UK), Dr. Michael Block (U.S.), Dr. Leon Botstein (U.S.), Professor Clay Christensen (U.S.), Dr. Linda Darling-Hammond (U.S.), Dr. MadhavChavan (India), Professor Michael Fullan (Canada), Professor Howard Gardner (U.S.), Professor Andy Hargreaves (U.S.), Professor Yvonne Hellman (The Netherlands), Professor Kristin Helstad (Norway), Jean Hendrickson (U.S.), Professor Rose Hipkins (New Zealand), Professor Cornelia Hoogland (Canada), Honourable Jeff Johnson (Canada), Mme. Chantal Kaufmann (Belgium), Dr. EijaKauppinen (Finland), State Secretary TapioKosunen (Finland), Professor Dominique Lafontaine (Belgium), Professor Hugh Lauder (UK), Professor Ben Levin (Canada), Lord Ken Macdonald (UK), Professor Geoff Masters (Australia), Professor Barry McGaw (Australia), Shiv Nadar (India), Professor R. Natarajan (India), Dr. Pak Tee Ng (Singapore), Dr. Denise Pope (US), Sridhar Rajagopalan (India), Dr. Diane Ravitch (U.S.), Richard Wilson Riley (U.S.), Sir Ken Robinson (UK), Professor PasiSahlberg (Finland), Professor Manabu Sato (Japan), Andreas Schleicher (PISA, OECD), Dr. Anthony Seldon (UK), Dr. David Shaffer (U.S.), Dr. Kirsten Sivesind (Norway), Chancellor Stephen Spahn (U.S.), Yves Theze (LyceeFrancais U.S.), Professor Charles Ungerleider (Canada), Professor Tony Wagner (U.S.), Sir David Watson (UK), Professor Dylan Wiliam (UK), Dr. Mark Wormald (UK), Professor Theo Wubbels (The Netherlands), Professor Michael Young (UK), and Professor Minxuan Zhang (China) as they explore the big picture education questions that all nations face today. The Global Search for Education Community PageC. M. Rubin is the author of two widely read online series for which she received a 2011 Upton Sinclair award, ""The Global Search for Education"" and ""How Will We Read?"" She is also the author of three bestselling books, including The Real Alice in Wonderland, is the publisher of CMRubinWorld, and is a Disruptor Foundation Fellow."
3,TASTE,7 Vegetarian Dinners Even Carnivores Will Devour,"Jennifer Segal, ContributorChef, Recipe Developer and Busy Mom",https://www.huffingtonpost.com/entry/7-vegetarian-dinners-even-carnivores-will-devour_b_6709974.html,"A quick ragout of white beans, sweet cherry tomatoes and fresh herbs in a robustly flavored broth makes a satisfying vegetarian main course. Serve it with a green salad and garlic bread for sopping up the broth, and dinner is done!",2015-02-22,2015-02-19-BulgurSaladwithDillVegetablesandChickPeas575x376.jpg,https://images.huffingtonpost.com/2015-02-19-BulgurSaladwithDillVegetablesandChickPeas575x376-thumb.jpg,"Whether you are expecting a vegetarian guest or just want to mix up your family's dinner routine, you'll wow everyone with these meatless meals. 1. White Bean RagoutA quick ragout of white beans, sweet cherry tomatoes and fresh herbs in a robustly flavored broth makes a satisfying vegetarian main course. Serve it with a green salad and garlic bread for sopping up the broth, and dinner is done! GET THE RECIPE2. Quinoa Pilaf with Shiitake Mushrooms, Carrots & PecansQuinoa looks like couscous and eats like a grain but it's actually the tiny seed of a plant related to leafy greens like spinach and Swiss chard. It is incredibly high in protein and fiber, and contains all of the essential amino acids your body needs. Here, it's cooked with sautéed onions, carrots, shiitake mushrooms and pecans to make an earthy and hearty dish. GET THE RECIPE3. Bulgur Salad with Cucumbers, Red Peppers, Chick Peas, Lemon and DillMade with bulgur, fresh herbs, chopped vegetables and buttery chick peas, this Middle Eastern-style salad is like a bulked-up tabbouleh. Serve it with soup for dinner or keep it in the fridge all all week long for healthy lunches. GET THE RECIPE4. Spaghetti Squash GratinSpaghetti squash is a low-carb, low-cal alternative to pasta; when cooked, it transforms into golden, spaghetti-like strands. Here, it's tossed with marinara sauce, sprinkled with crispy breadcrumbs and cheese, and then baked until golden brown. GET THE RECIPE5. Zucchini Fritters with Feta and DillThe word fritter usually conjures up something heavy and deep-fried, but these zucchini pancakes are as delicate as can be. For a light dinner, serve them with tzatziki and a Greek salad. GET THE RECIPE6. Spinach & Gruyere QuicheThis is the best spinach quiche: it's made with a combination of heavy cream and Gruyère, which makes it incredibly rich and flavorful. There's also a good bit of spinach, which balances out all that richness and -- dare I say -- makes it just a little bit good for you. GET THE RECIPE7. Smoky Chickpea, Red Lentil & Vegetable SoupThis hearty, soul-satisfying soup is ready in 30 minutes, yet tastes like you spent all day in the kitchen making it. To round out the meal, serve it with a green salad and loaf of good bread. GET THE RECIPE"
