,category,headline,authors,link,short descr,date,image_caption(s),image_link(s),article
27,POLITICS,Loretta Lynch: Orlando Shooting Was An 'Act Of Hate And Terror',Amanda Terkel,https://www.huffingtonpost.com/entry/loretta-lynch-orlando-shooting_us_5766c3ace4b0853f8bf12eeb,It wasn't just about terrorism. It was an attack on the LGBT community.,2016-06-19,Attorney General Loretta Lynch has highlighted the continuing targeting of the LGBT community. ,https://img.huffingtonpost.com/asset/5766c70a2200002d00f81ce1.jpeg?cache=cHDcObo4FA&ops=crop_0_13_3486_1972%2Cscalefit_720_noupscale,"U.S. Attorney General Loretta Lynch called the Orlando shooting ""an act of hate and terror"" Sunday, emphasizing that the lesbian, gay, bisexual and transgender community continues to be the target of attacks in this country.""We're moving quickly; we're trying to uncover everything we can about this killer's motivations, what led him to this particular place, this particular club,"" Lynch said in an interview on CBS' ""Face the Nation. ""Why did he target the LGBT community, a community that so often is the victim of hate crime, in both an act of hate and terror?""Early in the morning of June 12, Omar Mateen killed 49 people at a gay nightclub in Orlando, in what is now the deadliest shooting in modern U.S. history.Much of the debate in the wake of the shooting has focused on terrorism -- what needs to be done to stop more attacks in the name of the so-called Islamic State on U.S. soil.Mateen had pledged allegiance to ISIS, but his father believed his son may have had a different motivation for the attack, noting that Mateen had recently become angry after seeing two men kissing in front of his family. Some of Mateen's friends said they believed he was gay -- but not open about it -- and may have tried to pick up men on gay dating sites. In the wake of the shooting, many in the LGBT community have called on politicians to examine the effect of their homophobic rhetoric and policies. Most notably, Florida Attorney General Pam Bondi (R) has been grilled about how her sympathetic post-Orlando rhetoric squares with her long fight against LGBT equality. ""I've never said I don't like gay people. That's ridiculous,"" she told CNN host Anderson Cooper in a recent interview.""But you were arguing [in court] that gay marriage -- if there was gay marriage, if there was same-sex marriage -- that would do harm to the people of Florida, to Florida society,"" Cooper replied. ""Are you saying you do not believe it would do harm to Florida?"" Bondi said that's not what she was arguing.""The question has now been called upon the people of Florida: Will you uproot this toxic dehumanization of the LGBT community,"" said Nadine Smith, executive director of the LGBT advocacy group Equality Florida, ""or will you, by action or indifference, allow us to be treated as inferiors in laws that protect our basic rights?"" "
28,POLITICS,How Obama's Presidency Has Been A Victory For Working Parents,Mollie Reilly,https://www.huffingtonpost.com/entry/obama-family-policies-fathers-day_us_5762e2a5e4b09c926cfe7b8d,The 44th president's legacy will include his strong advocacy for families.,2016-06-19,"President Barack Obama, pictured here with his daughters, has pushed for policies like paid parental leave. ",https://img.huffingtonpost.com/asset/57644c921500002a0073b36b.jpeg?ops=scalefit_720_noupscale,"As President Barack Obama approaches the end of his second term, there's been much discussion of what his legacy will be. While much of that debate focuses on his foreign policy or his sweeping domestic policies, such as the Affordable Care Act, there's another area where the 44th president has left a significant mark: making life easier for millions of working parents.""His administration has spent a lot of time and energy explaining why family-friendly policies are good for business, and providing a platform for employers to share their own views on the topic,"" said Debra Ness, president of the National Partnership for Women and Families.Those policies have included expanding paid parental leave and sick time, emphasizing gender equality in parenting and reducing some of the costs associated with having children. (There have also been some misses -- family policy advocates pointed to the administration's continued deportation raids targeting mothers and children as a major disappointment.) ""This administration has focused in on those issues in ways that previous administrations did not,"" says Heather Boushey, the executive director and chief economist of the Washington Center for Equitable Growth, noting that's been driven in part by the Obama administration's ideology and in part by the economic conditions over the last decade. Here are some of the ways Obama's presidency has benefited parents:He's emphasized giving new mothers and fathers the time off they need.""We are a nation that, on the one hand, both encourages and preaches about the importance of being good parents to your children,"" says Ellen Bravo of Family Values @ Work, an advocacy group that pushes for paid sick and family leave. ""And yet for millions Americans, doing exactly that will cost them their financial security."" Obama has pushed to make it possible for parents to be both engaged with their children and financially secure, signing an executive action granting federal workers six weeks of paid leave after a child is born. He's also urged Congress and state legislatures to expand paid leave, and emphasized the issue in his 2015 State of the Union address. The Labor Department, meanwhile, has given grants to states exploring the benefits of granting more workers paid leave.This emphasis appears to have had some trickle-down effects. Cities like New York, San Francisco and Austin have moved forward on their own to grant workers paid family leave. The issue also became an important one on the campaign trail throughout the primary season. And while just 12 percent of Americans currently have access to paid parental leave, there seems to be a shift in some sectors: Tech companies in particular have started offering generous paid leave programs, in part to retain talented workers.Many studies tout the benefits of family leave for parents and children alike. Children whose parents are granted paid parental leave are more likely to be immunized. Women are also more likely to breastfeed longer if given more paid time off, which in turn can help prevent asthma, infections and other health problems. A 2011 study found that increasing paid maternity and paternity leave could even reduce the infant mortality rate by 10 percent. Fathers who are given paternity leave are more likely to take an active role in parenting later on, which can help with children's development.Parents also see significant health benefits: A 2015 study published in Social Science & Medicine found women who are given paid maternity leave with full benefits are 16.2 percent less likely to become depressed than women without paid leave. Another study found that women who have paid maternity leave are significantly less likely to experience depression later in life.Allowing new parents time off to bond with their child also benefits the companies they work for. Research shows that individuals given paid maternity leave are more likely to return to work at the same company, reducing costs associated with employee turnover. Women who take paid leave are also more likely to work more hours and remain in the workforce longer.""That can save firms significant money,"" says Boushey.But it's not just new parents that need time with their kids.Obama has also required federal contractors to provide paid sick days to their employees, which parents can use to care for children or other loved ones in need. He's also emphasized these policies at the state and municipal level: Currently, five states and 26 cities have paid sick time policies in place.""The progress we have seen in recent years is hugely important, not just because of those who have been helped, but also because we now have an irrefutable body of evidence demonstrating that paid sick days policies work well for employers as well as workers,"" said Ness, pointing to research showing how paid sick time has little impact on profitability and in some cases has boosted productivity among workers.The American Medical Association has also endorsed paid sick leave, arguing that by giving individuals time off to care for themselves or their children, they are reducing the risk of transmitting diseases or viruses to others or prolonging illness.""Paid sick leave keeps our homes, offices and communities healthier while ensuring the family's economic security,"" the organization said.He's embraced the role of ""dad-in-chief.""""Barack Obama has been 'dad-in-chief' in a way we haven't seen before in the White House,"" said Bravo. ""He talks openly about the need for fathers to be engaged, but also that women are disproportionately affected by the lack of [family-friendly] policies."" Obama regularly talks about his relationship with his daughters, Malia and Sasha, and the importance of his role as a father. Bravo argues that by doing so, Obama has made parenthood an issue of national importance. She pointed specifically to Obama sharing how his daughters had reshaped his views on marriage equality.""That's a great model in a father,"" she said.His emphasis on fatherhood -- which Obama has said stems from his own childhood with an absent dad -- could have a concrete impact on kids if emulated. Studies show that children with engaged fathers have higher cognitive ability and stronger literacy skills. Children with engaged parents are also likelier to be healthy and have less emotional distress. And by emphasizing equality in parenting, Obama is making strides for women as well. ""His gender-neutral approach to family-friendly policies is also tremendously positive because it underscores that, for families and communities to thrive, we must recognize that caregiving is not just a women’s issue,"" said Ness.He's addressed rising income inequality. Obama's answers to the country's worsening economic inequality -- the Affordable Care Act, pushing for a higher minimum wage, proposing tax credits for child care expenses -- could have a significant impact on working families.""This is an era in which the kinds of benefits that families get make all the difference for economic security,"" said Boushey. Research shows that low wages have a major impact on families, and women of color are disproportionately affected. Raising the federal minimum wage, as Obama has proposed, would increase the salaries of millions of low-wage workers -- most of whom are women. As for the ACA, a 2014 Brookings Institution study found that Obamacare will ease income inequality over time by boosting the average income of the country's lowest earners. Another study by the Urban Institute found that the law will help close the coverage gap between white people and people of color.Ness also pointed to provisions of Obamacare, like contraception coverage and requiring employers to give nursing mothers time to pump at work, as being huge milestones for parents, arguing that these policies are ""essential to women’s ability to participate and succeed in the workforce."""
29,POLITICS,How Obama's Presidency Has Been A Victory For Working Parents,Mollie Reilly,https://www.huffingtonpost.com/entry/obama-family-policies-fathers-day_us_5762e2a5e4b09c926cfe7b8d,The 44th president's legacy will include his strong advocacy for families.,2016-06-19,Obama has emphasized the importance of fatherhood throughout his presidency.,https://img.huffingtonpost.com/asset/5762e33a2200002e00f8161e.jpeg?cache=G3xo8NIN9I&ops=crop_23_176_2121_1057%2Cscalefit_720_noupscale,"As President Barack Obama approaches the end of his second term, there's been much discussion of what his legacy will be. While much of that debate focuses on his foreign policy or his sweeping domestic policies, such as the Affordable Care Act, there's another area where the 44th president has left a significant mark: making life easier for millions of working parents.""His administration has spent a lot of time and energy explaining why family-friendly policies are good for business, and providing a platform for employers to share their own views on the topic,"" said Debra Ness, president of the National Partnership for Women and Families.Those policies have included expanding paid parental leave and sick time, emphasizing gender equality in parenting and reducing some of the costs associated with having children. (There have also been some misses -- family policy advocates pointed to the administration's continued deportation raids targeting mothers and children as a major disappointment.) ""This administration has focused in on those issues in ways that previous administrations did not,"" says Heather Boushey, the executive director and chief economist of the Washington Center for Equitable Growth, noting that's been driven in part by the Obama administration's ideology and in part by the economic conditions over the last decade. Here are some of the ways Obama's presidency has benefited parents:He's emphasized giving new mothers and fathers the time off they need.""We are a nation that, on the one hand, both encourages and preaches about the importance of being good parents to your children,"" says Ellen Bravo of Family Values @ Work, an advocacy group that pushes for paid sick and family leave. ""And yet for millions Americans, doing exactly that will cost them their financial security."" Obama has pushed to make it possible for parents to be both engaged with their children and financially secure, signing an executive action granting federal workers six weeks of paid leave after a child is born. He's also urged Congress and state legislatures to expand paid leave, and emphasized the issue in his 2015 State of the Union address. The Labor Department, meanwhile, has given grants to states exploring the benefits of granting more workers paid leave.This emphasis appears to have had some trickle-down effects. Cities like New York, San Francisco and Austin have moved forward on their own to grant workers paid family leave. The issue also became an important one on the campaign trail throughout the primary season. And while just 12 percent of Americans currently have access to paid parental leave, there seems to be a shift in some sectors: Tech companies in particular have started offering generous paid leave programs, in part to retain talented workers.Many studies tout the benefits of family leave for parents and children alike. Children whose parents are granted paid parental leave are more likely to be immunized. Women are also more likely to breastfeed longer if given more paid time off, which in turn can help prevent asthma, infections and other health problems. A 2011 study found that increasing paid maternity and paternity leave could even reduce the infant mortality rate by 10 percent. Fathers who are given paternity leave are more likely to take an active role in parenting later on, which can help with children's development.Parents also see significant health benefits: A 2015 study published in Social Science & Medicine found women who are given paid maternity leave with full benefits are 16.2 percent less likely to become depressed than women without paid leave. Another study found that women who have paid maternity leave are significantly less likely to experience depression later in life.Allowing new parents time off to bond with their child also benefits the companies they work for. Research shows that individuals given paid maternity leave are more likely to return to work at the same company, reducing costs associated with employee turnover. Women who take paid leave are also more likely to work more hours and remain in the workforce longer.""That can save firms significant money,"" says Boushey.But it's not just new parents that need time with their kids.Obama has also required federal contractors to provide paid sick days to their employees, which parents can use to care for children or other loved ones in need. He's also emphasized these policies at the state and municipal level: Currently, five states and 26 cities have paid sick time policies in place.""The progress we have seen in recent years is hugely important, not just because of those who have been helped, but also because we now have an irrefutable body of evidence demonstrating that paid sick days policies work well for employers as well as workers,"" said Ness, pointing to research showing how paid sick time has little impact on profitability and in some cases has boosted productivity among workers.The American Medical Association has also endorsed paid sick leave, arguing that by giving individuals time off to care for themselves or their children, they are reducing the risk of transmitting diseases or viruses to others or prolonging illness.""Paid sick leave keeps our homes, offices and communities healthier while ensuring the family's economic security,"" the organization said.He's embraced the role of ""dad-in-chief.""""Barack Obama has been 'dad-in-chief' in a way we haven't seen before in the White House,"" said Bravo. ""He talks openly about the need for fathers to be engaged, but also that women are disproportionately affected by the lack of [family-friendly] policies."" Obama regularly talks about his relationship with his daughters, Malia and Sasha, and the importance of his role as a father. Bravo argues that by doing so, Obama has made parenthood an issue of national importance. She pointed specifically to Obama sharing how his daughters had reshaped his views on marriage equality.""That's a great model in a father,"" she said.His emphasis on fatherhood -- which Obama has said stems from his own childhood with an absent dad -- could have a concrete impact on kids if emulated. Studies show that children with engaged fathers have higher cognitive ability and stronger literacy skills. Children with engaged parents are also likelier to be healthy and have less emotional distress. And by emphasizing equality in parenting, Obama is making strides for women as well. ""His gender-neutral approach to family-friendly policies is also tremendously positive because it underscores that, for families and communities to thrive, we must recognize that caregiving is not just a women’s issue,"" said Ness.He's addressed rising income inequality. Obama's answers to the country's worsening economic inequality -- the Affordable Care Act, pushing for a higher minimum wage, proposing tax credits for child care expenses -- could have a significant impact on working families.""This is an era in which the kinds of benefits that families get make all the difference for economic security,"" said Boushey. Research shows that low wages have a major impact on families, and women of color are disproportionately affected. Raising the federal minimum wage, as Obama has proposed, would increase the salaries of millions of low-wage workers -- most of whom are women. As for the ACA, a 2014 Brookings Institution study found that Obamacare will ease income inequality over time by boosting the average income of the country's lowest earners. Another study by the Urban Institute found that the law will help close the coverage gap between white people and people of color.Ness also pointed to provisions of Obamacare, like contraception coverage and requiring employers to give nursing mothers time to pump at work, as being huge milestones for parents, arguing that these policies are ""essential to women’s ability to participate and succeed in the workforce."""
30,POLITICS,"GOP Mayor Leaves Republican Party, In Part Because Of Donald Trump",Marina Fang,https://www.huffingtonpost.com/entry/gop-mayor-leaves-party-donald-trump_us_5766d092e4b0853f8bf13387,"""For the first time in my life, I cannot support the Republican nominee for president.""",2016-06-19,"Danny Jones (right), the Republican mayor of Charleston, West Virginia, has left his party because of Donald Trump.",https://img.huffingtonpost.com/asset/default-missing-image.jpg?cache=jIO2VoZgTY&ops=scalefit_720_noupscale,"After determining that he cannot support Donald Trump as his party's presidential nominee, a Republican mayor has abandoned the party altogether -- a sign of growing discontent within GOP ranks.Jones, who has been a Republican for 45 years, said that in November he will vote for Libertarian Party candidate Gary Johnson for president."
31,ENTERTAINMENT,Seth Meyers Takes Jab At Donald Trump During Northwestern Commencement Speech,Julia Brucculieri,https://www.huffingtonpost.com/entry/seth-meyers-northwestern-commencement-speech-donald-trump_us_5766b97ce4b0fbbc8beab60e,Zing!,2016-06-19,"Seth Meyers delivers the keynote address at the Northwestern University commencement at Ryan Field on Friday in Evanston, Illinois.",https://img.huffingtonpost.com/asset/5766c8b01500002a0073b5d6.jpeg?ops=scalefit_720_noupscale,"It's no secret that Seth Meyers isn't a fan of Donald Trump. The late-night host recently banned Trump from appearing on his show, and on Friday, he took things a little further.During his hilarious, joke-filled commencement speech at Northwestern University -- Meyers' alma mater -- the comedian made sure to take a little jab at the reality TV host-turned-presidential hopeful. First, he encouraged the class to cherish their memories and friendships from Northwestern, knowing that plenty of them probably weren't even listening to his speech. “My words won’t be what stays with you from today,” he said. “Today is the culmination of your journey and your achievements. So, while I’m speaking, I invite you to drift off and remember your favorite parts of the last four years. Remember what you accomplished and what you overcame and the fun you had and the people you met because that’s what will stay with you."" After sharing some thoughtful words of inspiration with the class of 2016 -- which he admittedly stole from Michelle Obama’s and Lin-Manuel Miranda’s previous commencement speeches at City College of New York and the University of Pennsylvania, respectively -- Meyers turned to the words of Trump. ""I think my favorite inspirational quote came from Donald Trump,"" Meyers said as the crowd cheered on, ""who said to the graduates of Trump University, 'If you want your money back, you’re gonna have to sue me, you losers.'""Of course, the crowd erupted into laughter. Following his dig at the presumptive GOP presidential nominee, Meyers fittingly urged the graduates to vote. ""Remember that the worst things that happen in this country don’t happen because of hate or rage or fear — they happen because of apathy,"" he said. ""I encourage you to be people of action. I encourage you to do the most you can while remembering the least you can do is vote. So, vote this election. Don’t forget.""You can watch his whole speech below: Editor’s note: Donald Trump regularly incites political violence and is a serial liar, rampant xenophobe, racist, misogynist and birther who has repeatedly pledged to ban all Muslims — 1.6 billion members of an entire religion — from entering the U.S."
