,category,headline,authors,link,short descr,date,image_caption(s),image_link(s),article
8,ENTERTAINMENT,J.K. Rowling Shudders At The Thought Of Donald Trump As President,Jacquie Lee,https://www.huffingtonpost.com/entry/jk-rowling-donald-trump_us_576800d4e4b0853f8bf16b25,"""His stubby fingers are currently within horrifyingly close reach of America's nuclear codes.""",2016-06-20,"<em>Harry Potter</em> author, J.K. Rowling, denounced nationalism, political scare-tactics and Donald Trump in a statement she released on her website Monday.",https://img.huffingtonpost.com/asset/5768079e1500002f001ba55c.jpeg?ops=crop_0_206_2000_1594%2Cscalefit_720_noupscale,"Harry Potter author J.K. Rowling called presumptive Republican presidential nominee Donald Trump a fascist and compared him to an ""unstable nightclub bouncer"" in a statement she posted on her website Monday.She made the comments in a statement titled ""On Monsters, Villains and the EU Referendum"" that denounced the scare-tactics used by British political parties when advising the public whether or not to remain a member of the European Union.""His stubby fingers are currently within horrifyingly close reach of America's nuclear codes,"" she wrote of Trump. Nationalism and fear is driving the current conversation about the upcoming EU Referendum vote, Rowling wrote. But she also noted that on the U.S. campaign trail, the same tactics are being used.""He achieved this pre-eminence by proposing crude, unworkable solutions to complex threats,"" she said. ""Terrorism? 'Ban all Muslims!' Immigration? 'Build a wall!'""Rowling has consistently been a member of team #NeverTrump, and recently said Trump is even worse than Voldemort, referring to a loathed Harry Potter character. But in May, Rowling shocked fans at the PEN America Literary Gala in New York City by defending Trump's right to be offensive.Last year an online petition demanding Trump be banned from entering the U.K. garnered half a million signatures. Rowling addressed both the signatures and Trump's comments in her Gala speech: If my offended feelings can justify a travel ban on Donald Trump, I have no moral ground on which to argue that those offended by feminism or the fight for transgender rights or universal suffrage should not oppress campaigners for those causes. If you seek the removal of freedoms from an opponent simply on the grounds that they have offended you, you have crossed the line to stand alongside tyrants who imprison, torture, and kill on exactly the same justification.Now, Rowling is using Trump, his comments and his tactics as an example of the type of nationalism she says is so dangerous.""Look towards the Republican Party in America and shudder,"" she said. ""God help America. God help us all.""Editor's note: Donald Trump regularly incites political violence and is a serial liar, rampant xenophobe, racist, misogynist and birther who has repeatedly pledged to ban all Muslims -- 1.6 billion members of an entire religion -- from entering the U.S."
9,POLITICS,A GOP Congressman Wants To Defund The Harriet Tubman $20 Bill. Really.,Zach Carter,https://www.huffingtonpost.com/entry/harriet-tubman-20-bill-steve-king_us_57687124e4b0fbbc8beb6f67,He filed legislation to do it.,2016-06-20,Rep. Steve King apparently likes all those white men on the money.,https://img.huffingtonpost.com/asset/576871ac1500002f001ba71e.jpeg?cache=ZnftDSnIZm&ops=crop_39_96_2961_1715%2Cscalefit_720_noupscale,"WASHINGTON -- Rep. Steve King (R-Iowa) has filed legislation that would block the U.S. Treasury Department from putting Harriet Tubman on the $20 bill.King is perhaps best-known in the nation's capital for his anti-immigration rhetoric and his hostility to undocumented immigrants. But this takes his mean-spirited forays into racial politics in a new direction.The congressman introduced an amendment that would bar the Treasury Department from spending any funds to redesign paper money or coin currency. If approved, the language would nullify Treasury's plans to replace the current image of President Andrew Jackson on the $20 bill with a portrait of Tubman -- a black woman after generations of white men on the money. King hopes his language will be attached to a broader bill authorizing the Treasury's overall funding.Harriet Tubman was a dedicated abolitionist and women's suffrage advocate. She aided John Brown as he prepared his 1859 anti-slavery raid on Harper's Ferry and was one of the most prominent participants in the Underground Railroad, a network of abolitionists who helped guide escaped slaves to freedom.Treasury announced its plan to swap Jackson for Tubman two months ago. The department had been considering a redesign of the $10 bill, which features the nation's first Treasury secretary, Alexander Hamilton. Popular enthusiasm for the musical ""Hamilton"" derailed that project in favor of a redesign of the $20 bill. Several historians have objected to the musical's benevolent depiction of Hamilton, arguing that it erases his authoritarian attitudes and overstates his commitment to racial justice. Jackson's presidential legacy, meanwhile, includes the Indian Removal Act, a key tool in the U.S. government's onetime policy of Native American genocide. Harriet Tubman, who was born before Jackson assumed the presidency and died in the early days of the Woodrow Wilson administration, carries none of this baggage.In the months since Treasury announced the switch, presumptive GOP presidential nominee Donald Trump has defended Old Hickory's place on the $20 and former Sen. Jim Webb (D-Va.) has argued there was more to Jackson's legacy than killing.King's office did not immediately respond to a request for comment."
10,BLACK VOICES,How Black Communities Could Better Help Sickle Cell Patients,Lilly Workneh,https://www.huffingtonpost.com/entry/black-communities-help-sickle-cell-patients_us_5766c66ee4b0853f8bf12f98,"African-Americans are disproportionately affected by sickle cell, but not enough are signing up for clinical trials to help.",2016-06-20,"Sickle-cell disease, sickle-cell anaemia or drepanocytosis is a recessive genetic blood disorder characterized by red blood cells that assume an abnormal, rigid, sickle shape. Here healthy blood cells are seen along with diseased cells.",https://img.huffingtonpost.com/asset/5766cea01500002b0073b5dd.jpeg?ops=scalefit_720_noupscale,"Imagine holding a cube of ice with no way to relinquish it, or being unable to remove a knife that's constantly piercing an open wound. These are some of the ways Marie Ojiambo described the ""excruciating"" pain of suffering from sickle cell disease, a disorder that causes red blood cells to change shape in ways that block proper blood flow and oxygen from traveling throughout the body. There are millions of black people around the world who are disproportionately affected by this disease. World Sickle Cell Awareness Day, which was on Sunday, is meant to raise public knowledge and understanding of the crippling condition. In effort to carry on with that mission, Pfizer shared news with reporters at a roundtable discussion on June 6 in New York about promising new research it has conducted that could help millions of sickle cell patients around the globe.Pfizer isn't the only company looking to improve treatments for the disease. Selexys and bluebird bio are two pharmaceutical companies that have both designed similar studies to treat sickle cell. But these companies all claim to run into a pretty significant problem: Difficulty enrolling black patients in the clinical trials.These trials help to test the efficacy of the medications pharmaceutical companies hope to develop for the disease but because of a confluence of factors, from distrust of doctors to logistical difficulties, the enrollment rates of black patients have been low.“Clinical trial participation is a challenge in general,” Dr. Freda Lewis-Hall, Pfizer's chief medical officer, said. “There are very special and unique problems in the sickle cell community. Only one in seven people in the U.S. know someone who has actually participated in a clinical trial and only one in five people say their physician has ever talked to them about a clinical trial. This is an elite experience, in general. When you get to the African-American community, it is an even more elite experience.”The tendency of the black community to participate in clinical trials at far lower rates is arguably because of the community's mistrust of doctors, which was instilled from unethical studies done in the past. The Tuskegee experiment was one particular controversial and horrifically unethical study on Syphilis that played a major role in this divide. The experiment, which was conducted from 1932 to 1972, involved 600 impoverished black men who were intentionally withheld from treatment of the disease by doctors who sought to see the condition take its full course in black bodies.The Tuskegee experiment, which was later turned into a film, forever left an impact on how black people perceive clinical studies and tainted their overall attitudes towards treatment from doctors, said Sonja L. Banks, president of the Sickle Cell Disease Association of America. “There are lot of things I hear, one is of past studies and the history about the Syphilis study,” Banks said of the barriers to getting black people to participate in clinical trials. “But the majority of individuals with sickle cell are African-American or minority. Who’s gonna help? Who’s going to make these drugs come to fruition. It’s gotta be us. If we don’t participate, we will never find treatment or a cure.” Banks added: “There’s not enough white people to get in trials to help you. Let’s get educated, [let’s] go back to the syphilis study and look at what happened. That will never happen again, because we’re too much of an educated community now. We can get educated enough to make an informed decision.” Lewis-Hall stressed that at the end of the day, ""we have got to find a way to increase diversity in clinical trials.""One of the ways to possibly alleviate the low participation from the black community and the cultural context behind mistreatment in the medical research community is to re-educate people about these past studies, according to Lewis-Hall.“In the 100 years since sickle cell was discovered, there’s only one FDA approved drug and it’s not even for sickle cell,” Banks said. “Our people are still going to emergency room as their medical home. It’s all very heart-wrenching.” Doctors said phase 2 of Prizer’s trial showed that the medication they developed decreased a patient's hospital stay by 55 hours and that individuals in the trial decreased their opioid use by 89 percent in the first 24 hours. However, the company is still seeking ways to enroll more patients to participate in the current and future phases of the study and help work towards a viable solution. “If this [trial] doesn’t make it because we can’t find and encourage enough patients to participate, for me, that would be a crying shame,” Lewis-Hall said. Ojiambo, who justly describes herself as a “sickle cell warrior,” said people in this particular patient population are “very, very desperate for a cure."" She said she believes that advocates, like herself, play a crucial role in educating others about the way patient safety is prioritized in studies like Pfizer's.“We need to talk more about the pros of the clinical trial studies,"" she said. ""We need to demystify the process.” Pfizer’s target is to enroll 350 patients in its study, which could take a few years, doctors said. They also said they plan to better fulfill patient's needs by providing comfort and ease throughout the process, should patients decide to participate in the trial.""One of our my favorite advocacy statements is: 'Nothing about us, without us,'"" Lewis-Hall said. “We need you, we don’t intend to do anything about you without you, but we need you here working with us.”If you are a patient suffering from sickle cell and would like to learn more about Pfizer's clinical study, visit this site. For more general information on which and where clinical studies are being conducted, click here."
11,BLACK VOICES,How Black Communities Could Better Help Sickle Cell Patients,Lilly Workneh,https://www.huffingtonpost.com/entry/black-communities-help-sickle-cell-patients_us_5766c66ee4b0853f8bf12f98,"African-Americans are disproportionately affected by sickle cell, but not enough are signing up for clinical trials to help.",2016-06-20,"Marie Ojiambo is a ""sickle cell warrior"" who is pursuing her doctorate in pharmacy and working hard to raise awareness around her struggle with sickle cell. ",https://img.huffingtonpost.com/asset/5766cece2200002e00f81ce9.jpeg?ops=crop_5_21_609_368%2Cscalefit_720_noupscale,"Imagine holding a cube of ice with no way to relinquish it, or being unable to remove a knife that's constantly piercing an open wound. These are some of the ways Marie Ojiambo described the ""excruciating"" pain of suffering from sickle cell disease, a disorder that causes red blood cells to change shape in ways that block proper blood flow and oxygen from traveling throughout the body. There are millions of black people around the world who are disproportionately affected by this disease. World Sickle Cell Awareness Day, which was on Sunday, is meant to raise public knowledge and understanding of the crippling condition. In effort to carry on with that mission, Pfizer shared news with reporters at a roundtable discussion on June 6 in New York about promising new research it has conducted that could help millions of sickle cell patients around the globe.Pfizer isn't the only company looking to improve treatments for the disease. Selexys and bluebird bio are two pharmaceutical companies that have both designed similar studies to treat sickle cell. But these companies all claim to run into a pretty significant problem: Difficulty enrolling black patients in the clinical trials.These trials help to test the efficacy of the medications pharmaceutical companies hope to develop for the disease but because of a confluence of factors, from distrust of doctors to logistical difficulties, the enrollment rates of black patients have been low.“Clinical trial participation is a challenge in general,” Dr. Freda Lewis-Hall, Pfizer's chief medical officer, said. “There are very special and unique problems in the sickle cell community. Only one in seven people in the U.S. know someone who has actually participated in a clinical trial and only one in five people say their physician has ever talked to them about a clinical trial. This is an elite experience, in general. When you get to the African-American community, it is an even more elite experience.”The tendency of the black community to participate in clinical trials at far lower rates is arguably because of the community's mistrust of doctors, which was instilled from unethical studies done in the past. The Tuskegee experiment was one particular controversial and horrifically unethical study on Syphilis that played a major role in this divide. The experiment, which was conducted from 1932 to 1972, involved 600 impoverished black men who were intentionally withheld from treatment of the disease by doctors who sought to see the condition take its full course in black bodies.The Tuskegee experiment, which was later turned into a film, forever left an impact on how black people perceive clinical studies and tainted their overall attitudes towards treatment from doctors, said Sonja L. Banks, president of the Sickle Cell Disease Association of America. “There are lot of things I hear, one is of past studies and the history about the Syphilis study,” Banks said of the barriers to getting black people to participate in clinical trials. “But the majority of individuals with sickle cell are African-American or minority. Who’s gonna help? Who’s going to make these drugs come to fruition. It’s gotta be us. If we don’t participate, we will never find treatment or a cure.” Banks added: “There’s not enough white people to get in trials to help you. Let’s get educated, [let’s] go back to the syphilis study and look at what happened. That will never happen again, because we’re too much of an educated community now. We can get educated enough to make an informed decision.” Lewis-Hall stressed that at the end of the day, ""we have got to find a way to increase diversity in clinical trials.""One of the ways to possibly alleviate the low participation from the black community and the cultural context behind mistreatment in the medical research community is to re-educate people about these past studies, according to Lewis-Hall.“In the 100 years since sickle cell was discovered, there’s only one FDA approved drug and it’s not even for sickle cell,” Banks said. “Our people are still going to emergency room as their medical home. It’s all very heart-wrenching.” Doctors said phase 2 of Prizer’s trial showed that the medication they developed decreased a patient's hospital stay by 55 hours and that individuals in the trial decreased their opioid use by 89 percent in the first 24 hours. However, the company is still seeking ways to enroll more patients to participate in the current and future phases of the study and help work towards a viable solution. “If this [trial] doesn’t make it because we can’t find and encourage enough patients to participate, for me, that would be a crying shame,” Lewis-Hall said. Ojiambo, who justly describes herself as a “sickle cell warrior,” said people in this particular patient population are “very, very desperate for a cure."" She said she believes that advocates, like herself, play a crucial role in educating others about the way patient safety is prioritized in studies like Pfizer's.“We need to talk more about the pros of the clinical trial studies,"" she said. ""We need to demystify the process.” Pfizer’s target is to enroll 350 patients in its study, which could take a few years, doctors said. They also said they plan to better fulfill patient's needs by providing comfort and ease throughout the process, should patients decide to participate in the trial.""One of our my favorite advocacy statements is: 'Nothing about us, without us,'"" Lewis-Hall said. “We need you, we don’t intend to do anything about you without you, but we need you here working with us.”If you are a patient suffering from sickle cell and would like to learn more about Pfizer's clinical study, visit this site. For more general information on which and where clinical studies are being conducted, click here."
12,IMPACT,This Dutch Landlord Will Cut Rent For Tenants Who Help Refugees,Sarah Ruiz-Grossman,https://www.huffingtonpost.com/entry/dutch-landlord-netherlands-tenants-rent-discout-refugees_us_57646fa7e4b015db1bc97723,"“If you give people the opportunity to connect with each other and work together, it’s a lot more effective.”",2016-06-20,"Refugees leave a shelter for refugees in Nijmegen, Netherlands, as they are being transferred to shelter locations and refugees centers across the country.",https://img.huffingtonpost.com/asset/576471fe2200002e00f81b01.jpeg?ops=scalefit_720_noupscale,"Home is truly where the heart is for this Dutch landlord.The Trudo housing corporation in southern Netherlands is offering a 100 euro discount on rent for any tenants who help refugees resettle, according to the Guardian. To receive the cut, tenants need to spend 10 hours a week helping new migrants navigate Dutch bureaucracy and settle into the neighborhood. “We want to find someone in the housing complex who can help [refugees] feel at home in the neighborhood,” director Thom Aussems told Dutch news outlet Omroep Brabant. “And let them know the customs of our country.”The Dutch residents would assist new arrivals with anything from how to take out the garbage, to navigating schooling and social security paperwork, according to the Guardian. But the initiative is not just about helping refugees settle -- it’s also about reducing tensions with local residents.Over the last year, the Netherlands has experienced a rise in anti-refugee sentiment, including protests against asylum-seekers, a rise in popularity of anti-immigrant parties, and a right-wing leader calling for male refugees to be locked up. This project hopes to combat the tensions with a dose of human connection: “Tensions occur when people don’t know each other, can’t understand each other or can’t communicate,” Aussems told the Guardian. “If you give people the opportunity to connect with each other and work together, it’s a lot more effective.” For Trudo’s average tenant, the 100 euro discount will represent almost 25 percent off regular rent, according to the Independent -- a substantial discount.The idea for the program arose from a similar, earlier initiative, which gave students rent cuts in exchange for mentoring school kids, according to Dutch News. Through the program, they were able to help around 350 children.Trudo currently houses 85 refugees, reports the Independent, and the corporation aims to take in twice that number next year."
13,IMPACT,This Dutch Landlord Will Cut Rent For Tenants Who Help Refugees,Sarah Ruiz-Grossman,https://www.huffingtonpost.com/entry/dutch-landlord-netherlands-tenants-rent-discout-refugees_us_57646fa7e4b015db1bc97723,"“If you give people the opportunity to connect with each other and work together, it’s a lot more effective.”",2016-06-20,The Taal aan Zee Foundation teaches Dutch to refugees and asylum seekers.,https://img.huffingtonpost.com/asset/576471821500002b0073b3ed.jpeg?ops=scalefit_720_noupscale,"Home is truly where the heart is for this Dutch landlord.The Trudo housing corporation in southern Netherlands is offering a 100 euro discount on rent for any tenants who help refugees resettle, according to the Guardian. To receive the cut, tenants need to spend 10 hours a week helping new migrants navigate Dutch bureaucracy and settle into the neighborhood. “We want to find someone in the housing complex who can help [refugees] feel at home in the neighborhood,” director Thom Aussems told Dutch news outlet Omroep Brabant. “And let them know the customs of our country.”The Dutch residents would assist new arrivals with anything from how to take out the garbage, to navigating schooling and social security paperwork, according to the Guardian. But the initiative is not just about helping refugees settle -- it’s also about reducing tensions with local residents.Over the last year, the Netherlands has experienced a rise in anti-refugee sentiment, including protests against asylum-seekers, a rise in popularity of anti-immigrant parties, and a right-wing leader calling for male refugees to be locked up. This project hopes to combat the tensions with a dose of human connection: “Tensions occur when people don’t know each other, can’t understand each other or can’t communicate,” Aussems told the Guardian. “If you give people the opportunity to connect with each other and work together, it’s a lot more effective.” For Trudo’s average tenant, the 100 euro discount will represent almost 25 percent off regular rent, according to the Independent -- a substantial discount.The idea for the program arose from a similar, earlier initiative, which gave students rent cuts in exchange for mentoring school kids, according to Dutch News. Through the program, they were able to help around 350 children.Trudo currently houses 85 refugees, reports the Independent, and the corporation aims to take in twice that number next year."
