,category,headline,authors,link,short descr,date,image_caption(s),image_link(s),article
34,POLITICS,"Ted Cruz Calleth Out To Iowa's Holy Land, For Yea, It Is Judgment Day",Howard Fineman,https://www.huffingtonpost.com/entry/ted-cruz-iowa-evangelicals_us_56aa6c79e4b05e4e3703a816,But some evangelicals have turned to a savior named Trump.,2016-01-28,Donald Trump is building up evangelical support -- at least in polls.,https://img.huffingtonpost.com/asset/56aa852c2a00006e000317c3.jpeg?ops=crop_0_280_2983_1543%2Cscalefit_720_noupscale,"CLIVE, Iowa -- Ted Cruz is a U.S. senator from Texas, but by the end of his speech here Wednesday night, he sounded more like an evangelical preacher urgently gathering the flock.Touted by his introducers as a ""man of Christ,"" Cruz lowered his head in reverence to God and Iowa caucus-goers.""I ask you to pray,"" he told the crowd of about 600 at a meeting hall in Clive, a Des Moines suburb. ""I want you to lift this country up in your prayers to power this revival, to create this community in the body of Christ.""His campaign was based, Cruz said, on a passage from the Bible -- 2 Chronicles 7:14 of the Old Testament -- in which God promises to protect the Israelites if they accept him.""If my people, who are called by my name, will humble themselves and pray and seek my face and turn from their wicked ways,"" Cruz recited, ""then I will hear from heaven and I will forgive their sin and will heal their land.""The message: God will heal America -- but only if you vote for Ted Cruz next Monday.There was urgency in Cruz's voice for a very good reason, and his name is Donald Trump.Evangelical Christians, who usually represent about half of the voters in the Republican presidential caucus in Iowa, were supposed to be Cruz's springboard to the White House. The son of a well-known preacher, the 45-year-old Cruz has tailored his career to appeal to such voters. Intellectually brilliant and superbly educated, Cruz presents himself as a shrewd lawyer who can use sacred texts -- the Bible and the U.S. Constitution -- to force the courts and Congress to make America a conservative utopia.But then along came Trump, with his nakedly racist, anti-Muslim and xenophobic appeals; his own secular version of the Apocalypse (immigration and the Islamic State); and his own version of the savior who can solve all problems -- himself.Theologically, evangelicals are Protestants who say they have, and have chosen, a direct personal relationship with Christ; who believe the words of the Bible are literal and infallible; and who feel an individual duty to ""spread the word"" of God to others.Speaking to evangelicals, Cruz is most comfortable pushing social issues (against abortion and same-sex marriage, in favor of public displays of faith) and antagonism to ""big government."" But Trump has made surprising inroads by raising fears about undocumented Mexicans here and terrorists everywhere, and by calling for an economic nationalism in which ""big government"" can be a weapon.As a result, Trump -- who until recently was pro-choice on abortion and tolerant on matters such as gay marriage -- is actually leading Cruz among evangelicals nationwide. More to the immediate point, he is surprisingly competitive with Cruz among evangelicals in Iowa. Cruz was backed by 39 percent in a recent poll, but Trump garnered 27 percent.After earlier efforts to avoid clashes, Cruz is now attacking Trump furiously on the campaign trail and in TV ads. The main points: Trump has flip-flopped on abortion and is a New Yorker who offers only a phony conservatism on ""faith issues.""Cruz assembled a choir of anti-abortion leaders to make that case at the town hall meeting in Clive.Julie Muselman, from the nearby town of Waukee, loved what she heard. She fears Trump as a false messiah and she praised Cruz.""He is honest, truthful and smart,"" said Muselman, 62. ""And I think he is also a committed Christian, which means he has taken Christ into his heart.""Muselman is an evangelical Christian who first got involved in Iowa presidential politics in 1976, when she voted in the Democratic caucus for Jimmy Carter, the first national candidate to appeal directly to evangelicals in biblical language. Now a Republican, she has voted for GOP candidates who ended up winning the caucuses: then-Arkansas Gov. Mike Huckabee in 2008, then-Sen. Rick Santorum of Pennsylvania in 2012. Neither of those last two men went on to win the nomination, which is often the case with the GOP winner of the Iowa caucuses. But in the process of competing in Iowa, Republican candidates pull themselves -- and their party -- further to the right as they alter their stands to suit the state's religious voters.Trump has been racing to the right at top speed. He has sought and won the endorsement of key religious conservatives such as Jerry Falwell Jr. -- who leads Liberty University, an influential evangelical institution founded by Falwell's father, himself a key supporter of Ronald Reagan in 1980.If Cruz doesn't draw a huge turnout among evangelicals, he and his aides concede, they are likely to lose the caucuses.On Sunday, just one day before caucus-goers gather, pastors in evangelical churches across the state will be speaking on this question -- Trump vs. Cruz -- even if they don't necessarily mention the two by name.Attacks and appeals based on faith (or lack thereof) have been common in U.S. politics almost since the beginning. The Republican Party of today is something new: a European-style religious party powered (and trapped) by the cultural traditionalism of evangelical Protestants and conservative Catholics. That gives Iowa outsized influence, because early in the primary season, Iowa Republicans put all the candidates on record as believers in the right-wing Gospel. And it makes the Iowa caucuses a test of the power of evangelicals. A Trump victory would be seen as a loss not just for Cruz.But Cruz is going to need help -- and perhaps some divine intervention -- to win."
35,LATINO VOICES,Things Turn Sour When Americans Taste Latin Fruits For The First Time,Carolina Moreno,https://www.huffingtonpost.com/entry/americans-taste-latin-fruits-for-the-first-time_us_56aa3f5be4b05e4e37037a85,"""It looks like a sea creature, I trust that it’s not because this is about fruit.""",2016-01-28,John Leguizamo On The Antidote To 'Hollywouldn't' Stereotypes,https://img.huffingtonpost.com/asset/569d673c2a00004d00030bf4.jpeg?cache=mGd74Vorvd&ops=scalefit_960_noupscale,"There's a long list of tropical fruits from Latin America that you simply can't find at the corner grocery store in the United States. Tamarind, dragon fruit, papaya, star fruit and rambutan -- these fruits are anything but strange for most Latinos but many Americans can't quite say the same. With that in mind, Flama sat a few reluctant non-Latinos down for an on-camera fruit tasting. It's safe to say that, for the most part, the participants weren't very impressed.""It looks like a sea creature, I trust that it’s not because this is about fruit,"" said one woman before tasting rambutan. After trying papaya, one man's first thought was to compare the fruit with the Dave Matthews Band. ""Like I get that people like it, but like it doesn't work for me,"" he said. Many users wrote comments on the video about an absence of more popular fruits like guanabana, mora, lulo, mangostino, granadilla and curuba. One question we do have for Flama, who in the world eats passion fruit straight from the source? Pro tip: Instead, turn it into a refreshing passion fruit juice or a delicious tart glaze.Also on HuffPost: "
36,BUSINESS,"Fossil Fuels Are A Terrible Investment, And They're Only Going To Get Worse",Ben Walsh,https://www.huffingtonpost.com/entry/fossil-fuels-terrible-investment_us_56aa3463e4b05e4e37037321,Dirty energy stocks are tumbling.,2016-01-28,"A woman wears as mask while walking in a neighborhood next to a coal-fired power plant on Nov. 26, 2015, in Shanxi, China.",https://img.huffingtonpost.com/asset/56aa7bde2a00006e000317a6.jpeg?ops=scalefit_720_noupscale,"The market is encouraging pension funds and institutions to jettison fossil fuels from their portfolios, waving a clear warning flag to investors about the financial future of oil and coal companies.Fossil fuel stocks are performing poorly compared to the market as a whole -- and perhaps most importantly, compared to renewable energy stocks, said Michael Liebreich, chairman of Bloomberg New Energy Finance, at a summit on climate risk put on by the nonprofit sustainability advocacy group Ceres.Referring to investors who won't divest and continue to own fossil fuel stocks, Liebreich pointedly said that the market was ""divesting through value destruction"" -- in other words, cutting their holdings in traditional, polluting energy companies by slashing their value.Over the last 10 years, the S&P 500 index is up just over 50 percent. Yet energy stocks over the same time period have risen only 1.3 percent.For big investors to simply allow their holdings in big energy companies to fall toward a vanishing point of worthlessness is deeply irresponsible, observers say.Indeed, former Vice President Al Gore, who shared the Nobel Peace Prize in 2007 for his work on climate change, compared the risk that some fossil fuel companies' assets will become worthless to the danger of mortgage-backed securities, whose collapse triggered the 2008 financial crisis.The nonprofit research group Carbon Tracker estimates that if the world changes its energy sources to keep climate change below 2 degrees Celsius, $2 trillion in fossil fuel assets will be stranded -- that is, unusable, far less valuable, and in some cases, liabilities. Also on HuffPost:"
37,BUSINESS,"Fossil Fuels Are A Terrible Investment, And They're Only Going To Get Worse",Ben Walsh,https://www.huffingtonpost.com/entry/fossil-fuels-terrible-investment_us_56aa3463e4b05e4e37037321,Dirty energy stocks are tumbling.,2016-01-28,Renewable energy stocks have dramatically outperformed fossil fuels.,https://img.huffingtonpost.com/asset/56aa75862a00006e00031799.png?ops=scalefit_720_noupscale,"The market is encouraging pension funds and institutions to jettison fossil fuels from their portfolios, waving a clear warning flag to investors about the financial future of oil and coal companies.Fossil fuel stocks are performing poorly compared to the market as a whole -- and perhaps most importantly, compared to renewable energy stocks, said Michael Liebreich, chairman of Bloomberg New Energy Finance, at a summit on climate risk put on by the nonprofit sustainability advocacy group Ceres.Referring to investors who won't divest and continue to own fossil fuel stocks, Liebreich pointedly said that the market was ""divesting through value destruction"" -- in other words, cutting their holdings in traditional, polluting energy companies by slashing their value.Over the last 10 years, the S&P 500 index is up just over 50 percent. Yet energy stocks over the same time period have risen only 1.3 percent.For big investors to simply allow their holdings in big energy companies to fall toward a vanishing point of worthlessness is deeply irresponsible, observers say.Indeed, former Vice President Al Gore, who shared the Nobel Peace Prize in 2007 for his work on climate change, compared the risk that some fossil fuel companies' assets will become worthless to the danger of mortgage-backed securities, whose collapse triggered the 2008 financial crisis.The nonprofit research group Carbon Tracker estimates that if the world changes its energy sources to keep climate change below 2 degrees Celsius, $2 trillion in fossil fuel assets will be stranded -- that is, unusable, far less valuable, and in some cases, liabilities. Also on HuffPost:"
38,POLITICS,Hawaii Introduces Bill To Ban Gay Conversion Therapy,Andy Campbell,https://www.huffingtonpost.com/entry/hawaii-ban-gay-conversion-therapy_us_56aa36fbe4b05e4e370374d3,The move follows a federal call to end the controversial technique nationwide.,2016-01-28,Democratic Rep. Della Au Belatti has introduced a bill in the Hawaii House to ban gay conversion therapy for minors.,https://img.huffingtonpost.com/asset/56aa40e21f00005000216d25.jpeg?cache=5EP6AQlh7A&ops=crop_0_583_2158_1380%2Cscalefit_720_noupscale,"Following federal calls to end gay conversion therapy for LGBT youth, Hawaii lawmakers have introduced a bill that would ban the practice in professional and educational circles.The proposed bill, which was introduced in the state's House and Senate, says that being gay isn't a disorder and makes it illegal to advertise, teach, or professionally counsel lesbian, gay, bisexual and transgender teens to change their sexual orientation.Hawaii passed same-sex marriage in 2013 after two decades of debate.""These children, these teenagers are quite vulnerable,"" Democratic Rep. Della Au Belatti, who introduced the bill, told The Associated Press. ""This is an issue because we don't want them to be subject to further pressure and stigmatization during their formative years in school.""Opponents say the bill doesn't give parents an opportunity to choose.“What if a child is questioning? They’re on the fence. It happens. As a parent, I want, personally, to steer my child in a particular direction. By this bill, I’m banned from doing that,” Rep. Bob McDermott (R-Ewa Beach) told KHON.“This is merely more political correctness,"" he added, ""nothing more than tyranny with manners.”Conversion therapy has been widely considered to do more harm than good. A federal report released in October found no evidence supporting the idea that homosexuality was a disorder that can be cured, and concluded that the therapy ""is inappropriate and reinforces harmful gender stereotypes.""The Huffington Post has spoken to several survivors of gay conversion therapy trauma, one of whom likened it to ""gay exorcism.""So far, several states have passed similar laws, including California, Oregon, New Jersey and Illinois, according to the AP."
39,POLITICS,Conservative Republicans Discuss Potential Budget Showdown,Matt Fuller,https://www.huffingtonpost.com/entry/conservatives-budget-showdown_us_56aa8199e4b001648922c7f1,This could get ugly.,2016-01-28,"House Freedom Caucus Chairman Jim Jordan of Ohio, flanked here by HFC members Scott Perry of Pennsylvania and Raul Labrador of Idaho, was in attendance at a Heritage Foundation retreat for conservatives on Thursday.",https://img.huffingtonpost.com/asset/56aa8a1b1f00005000216de4.jpeg?ops=scalefit_720_noupscale,"While House Democrats were busy in Baltimore listening to Vice President Joe Biden, House conservatives were holding their own retreat Thursday, meeting to discuss an upcoming budget debate and other conservative priorities in 2016.Roughly two dozen House conservatives met at the Salamander Resort and Spa in Middleburg, Virginia, for the Heritage Foundation's annual Conservative Member Retreat. And while members in attendance reported that there were no definitive decisions on how they'll move forward with the budget, it's clear there are some potential vote issues with the spending blueprint.Members don't have any firm demands yet, but a number of conservatives both in and outside of the House Freedom Caucus have expressed concern over the top-line 2017 spending number. Conservative Republicans would generally prefer to revert back to the spending number laid out in the 2011 Budget Control Act, rather than the new number to which Republicans and Democrats agreed in October -- a difference of about $30 billion. Rep. Dave Brat (R-Va.), the conservative who took down former House Majority Leader Eric Cantor in 2014, told The Huffington Post Thursday that reducing the 2017 budget by $30 billion was the ""minimum fix needed this year."" He said that conservatives should get ""pledges on paper"" for a future overhaul of entitlement programs like Medicare and Social Security.That could be a problem for GOP leaders.House Speaker Paul Ryan (R-Wis.) and House Majority Leader Kevin McCarthy (R-Calif.) privately met with Republican members of the chamber's budget committee earlier this month to tell them that the 2017 number isn't really negotiable, according to a senior GOP aide with knowledge of the meeting.Ryan and McCarthy argued that they need to adopt a budget and abide by the recent government spending numbers if they're going to have any chance of passing appropriations bills, the aide said. (Republicans look at the appropriations bills as a natural place to attach policy riders restricting agencies like the IRS and the Environmental Protection Agency.)""Every member wants to get back to a regular order appropriations process, and the budget is an important first step to achieving that goal,"" AshLee Strong, a spokeswoman for Ryan, told HuffPost on Thursday. ""The best path ahead will be discussed and determined by the conference in the coming weeks.""The budget is emerging as an early hurdle in Ryan's young speakership. The Congressional Budget Office recently handed Rep. Tom Price (R-Ga.), chairman of the budget committee, some difficult baselines to work with -- at least, if he wants to carry on the GOP tradition of balancing the budget within a 10-year time frame.Republicans are stuck in the bind of having to square increasing deficits within the 10-year window, and to get to balance, they'll have to rely on painful cuts as well as, probably, a collection of budgetary gimmicks.The problem is that Congress already used up the easiest spending cuts last year, and conservatives are apt to demand real reductions to achieve balance. Moderates, meanwhile, are likely to see the budget as an election-year liability -- particularly if they're forced to vote for cutting popular government programs.Complicating the matter is that the budget -- at least in this stage of the legislative process -- is usually a partisan vote. Republicans can't rely on a single Democrat to support the document. Therefore, the House GOP, with its 246 members, can only lose about 20 votes and still have a majority for passage.Part of the discussion on Thursday for conservatives involved the question of what could they get in exchange for supporting the higher spending number. But again, members are leaving final decisions for when they return to the Capitol next week.And this is just to start the budget negotiations. Once Price produces a document, conservatives will no doubt find issues with the budget -- as could moderates. Last year, defense hawks demanded additional spending outside the budget caps for their vote, which was a major point of contention among conservative budget committee members themselves.This year looks like it could be even more difficult."
40,POLITICS,The End Of California's Tampon Tax Could Be Near,Mollie Reilly,https://www.huffingtonpost.com/entry/california-tampon-tax-bill_us_56a950a5e4b0d82286d4df88,"""We are being taxed for being born as women.""",2016-01-28,"Of the 45 states that have sales taxes, 40 of them tax tampons and sanitary napkins as luxury items. ",https://img.huffingtonpost.com/asset/56a951ca1a00002d00ab176f.jpeg?cache=tYPw5gnaaT&ops=scalefit_720_noupscale,"The California board that oversees state taxes has endorsed a measure that would bar tampons and menstrual pads from being taxed as luxury items, marking a major step in the campaign to repeal the so-called tampon tax.The state Board of Equalization on Tuesday unanimously agreed to back a bill recently introduced by two members of the state assembly, Cristina Garcia (D-Bell Gardens) and Ling Ling Chang (R-Diamond Bar). The measure would exempt tampons and pads from state sales taxes. California is one of 40 states where tampons aren't considered a necessity, and thus are subject to sales tax. (Many other health-related items are classified as necessities under the California tax code and aren't taxed.) The Board of Equalization's members are elected. The board's endorsement is important because its administration of state taxes gives it an authoritative view of items that should be taxable and exempt from sales tax. “Effectively we are being taxed for being born as women,” Garcia said in a statement. The bill ""is about social justice, gender equity in our tax code, it's an opportunity to end an outdated tax that uniquely targets women for a function of their body, a function we don't control and can't ignore every month of our adult life.""Garcia's office estimates the bill would save California women $20 million annually. The bill's sponsors argue that the tax puts an undue burden on the approximately 2 million California women living in poverty.""By putting that money back in the hands of women, we are creating greater access to a very important health product -- especially in low-income and homeless populations,"" said Chang.Backlash against the tampon tax has picked up steam in recent months. A Change.org petition started by Cosmopolitan magazine gathered more than 43,000 signatures, while a similar effort aimed at the European Union drew over 300,000 supporters. Last year, the Canadian government was pressured into dropping its tampon tax. French lawmakers followed suit in December.President Barack Obama commented on the issue during an interview this month with YouTube personality Ingrid Nilsen, who told the president she doesn't ""know anyone who has a period who think it's a luxury.""""I think that's fair to say,"" said Obama, who said he was unaware of the tax until Nilsen brought it up. ""I suspect it's because men were making the laws when those taxes were passed, and I think it's pretty sensible for women in those states ... to get those taxes removed."" So far, just five states have specifically exempted pads and tampons from sales taxes: Maryland, Massachusetts, Minnesota, New Jersey and Pennsylvania. Everywhere else, women pay as much as 10 percent in taxes on the already high cost of getting a monthly period. ""When we look at other items that are tax exempt, I think it is only fair that these essential female products be included,” Garcia said in a statement this month. ""In fact, it is my hope that one day these necessary items will be free to all women.""Bills similar to California's are under consideration in New York and Ohio."
