,category,headline,authors,link,short descr,date,image_caption(s),image_link(s),article
14,SPORTS,CUT,Michael Klopman,https://www.huffingtonpost.com/entry/michael-sam-cut-rams_n_5739774.html,,2014-08-30,"CLEVELAND, OH - AUGUST 23: Michael Sam #96 of the St. Louis Rams reacts after sacking Johnny Manziel of the Cleveland Browns during an NFL preseason game at FirstEnergy Stadium on August 23, 2014 in Cleveland, Ohio. (Photo by Joe Robbins/Getty Images) ",https://img.huffingtonpost.com/asset/5c9a8b782300003300af496a.jpeg?ops=scalefit_720_noupscale,"Michael Sam, the first openly gay athlete drafted into the NFL, was cut by the St. Louis Rams as the team trimmed its roster ahead of the start of the 2014 season, according to multiple reports. The news emerged on Saturday shortly before the NFL's 4 p.m. ET deadline to finalize rosters and trim them down to 53 players. At a press conference following the announcement, Rams Head Coach Jeff Fisher said that Sam was notified of his release on Saturday, who replied ""Thanks for the opportunity."" Fisher said the decision to release Sam was ""a football decision,"" and, ""I was pulling for him, but it didn't work out."" Asked about how Sam's time with the Rams was, Fisher said, ""There was no distraction. Mike fit in very, very well. He was fun to be around. No issues.""More from The Associated Press:ST. LOUIS (AP) — The St. Louis Rams have cut Michael Sam, the first openly gay player drafted by an NFL team."
15,RELIGION,Catholic Patriarchs Denounce Islamic State's ‘Crimes Against Humanity',,https://www.huffingtonpost.com/entry/catholic-patriarchs-islamic-state_n_5738568.html,,2014-08-30,"This undated image posted on Wednesday, Aug. 27, 2014 by the Raqqa Media Center of the Islamic State group, a Syrian opposition group, which has been verified and is consistent with other AP reporting, shows a fighter from the Islamic State group, armed with a knife and an automatic weapon, next to captured Syrian army soldiers and officers, following the battle for the Tabqa air base, in Raqqa, Syria. A U.N. commission on Wednesday accused the extremist Islamic State organization of committing crimes against humanity with attacks on civilians, as pictures emerged of the extremists' bloody takeover of a Syrian military air base that added to the international organizationâs claims. (AP Photo/Raqqa Media Center of the Islamic State group)",https://img.huffingtonpost.com/asset/5bb7ee71220000ba01dd31df.jpeg?ops=scalefit_720_noupscale,"VATICAN CITY (RNS) The patriarchs and church leaders of Eastern Catholic churches have denounced as “crimes against humanity” the violence committed by the Islamic State militants in Iraq and Syria.In a statement issued Friday (Aug. 29), the patriarchs condemned the persecution and killing of Christians, Yazidis and other minorities, saying Christians in the region were being threatened by what was described as the jihadi group’s campaign of terror.Meeting outside the Lebanese capital Beirut, the patriarchs called on the international community to stop the “criminal actions” of the Islamic State militants and urged Islamic institutions to forcefully condemn the extremist group.Last week, Maronite Patriarch Bechara Rai of Lebanon visited Christian and Yazidi refugees in Erbil, in northern Iraqi Kurdistan. He joined calls from Chaldean Patriarch Louis Sako to stop the massacre of innocent civilians.Earlier in August, the Eastern patriarchs issued a statement saying Christians in countries of the Middle East are suffering from harsh persecution and being kicked out of their homes and lands by extremists.“We call upon the Arab League, the Organization of Islamic Conference, the U.N. Security Council and the International Criminal Court to take swift, effective and immediate salvaging action,” the statement said."
16,ENTERTAINMENT,Taylor Swift May Be Headed To 'The Voice',Lauren Zupkus,https://www.huffingtonpost.com/entry/taylor-swift-the-voice_n_5741822.html,,2014-08-30,"Taylor Swift arrives at the MTV Video Music Awards at The Forum on Sunday, Aug. 24, 2014, in Inglewood, Calif. (Photo by Jordan Strauss/Invision/AP)",https://img.huffingtonpost.com/asset/5bb477d03c000066000c9e91.jpeg?ops=scalefit_720_noupscale,"Taylor Swift is reportedly coming to NBC's ""The Voice,"" according to Us Weekly. The 24-year-old singer is rumored to join the seventh season of the singing competition as an advisor to the contestants. Other advisors for the upcoming season include Stevie Nicks, Gavin Rossdale, country music group Little Big Town and Alicia Keys. Swift would also share the stage with ""The Voice"" coaches Adam Levine, Blake Shelton and newcomers Gwen Stefani and Pharrell Williams. HuffPost has reached out to Swift's reps and NBC for comment and will update this post if and when one is received.[via Us Weekly]""The Voice"" premieres on Sept. 22 at 8 pm. ET on NBC. "
17,BUSINESS,America's Disappearing Jobs,,https://www.huffingtonpost.com/entry/americas-disappearing-job_n_5742028.html,,2014-08-30,"U.S. Postal Service delivery trucks sit at the Brookland Post Office in Washington, D.C., U.S., on Thursday, May 9, 2013. The USPS is projecting a loss of as much as a $6 billion for the year as it keeps pressure on Congress for help, Postmaster General Patrick Donahoe said this month. The service is scheduled to release second-quarter results May 10. Photographer: Andrew Harrer/Bloomberg via Getty Images",https://img.huffingtonpost.com/asset/5bb3127e260000350082057d.jpeg?ops=scalefit_720_noupscale,"After the Great Recession, which cost millions of Americans their jobs, the U.S. labor market has begun to heal. So far this year the United States has added an average of nearly 230,000 jobs per month. In the 10 years through 2022, the BLS estimates that total employment will grow by more than 15 million jobs, or nearly 11%.However, the outlook for some occupations is bleak. For example, the number of fallers — logging workers who cut down trees — is expected to decline by 43% between 2012 and 2022, the most of any occupation. Based on Bureau of Labor Statistics (BLS) estimates and projections for more than 1,000 occupations for 2012 and 2022, 24/7 Wall St. identified America’s disappearing jobs.Click here to see the nation’s disappearing jobsIn many cases, these rapidly declining occupations are already quite rare. For instance, there were just 1,600 locomotive firers — who are responsible for monitoring train tracks and engine instruments — in the U.S. as of 2012. In all, five of the fastest declining occupations had fewer than 10,000 workers in 2012.Yet, in other instances, occupations that are expected to contract still employ a large number of Americans. There were more than 320,000 people employed as data entry and information processing workers in 2012. There also were nearly half a million postal service workers.The projected decline in postal service workers is especially significant. In all, the BLS forecasts that the number postal service jobs will fall by 139,000 between 2012 and 2022 — or more than all of the other disappearing occupations put together. A number of factors are expected to contribute to this decline, including continued drops in mail volumes as well as the ongoing financial struggles of the U.S. Postal Service. The USPS has already cut tens of thousands of jobs since 2012, and it is currently slated to cut another 15,000 jobs next year.Increased automation, digitization, and technological innovation play a role in the decline of several of the fastest shrinking occupations. “We definitely think that technology and automation are a factor with some of these [jobs],” Martin Kohli, chief regional economist at the BLS, told 24/7 Wall St.The development of email has reduced mail volumes and, as a result, the need for postal service workers. Automated sorting systems have further reduced the need for human sorting. Similarly, motion picture projectionists have become less common as digital projection replaces traditional film rolls, Kohli said.International trade can also play a part in the decline of an occupation. Specifically, Kohli identified free trade and imports as factors impacting textile occupations. Trade, Kohli said, “reduces the demand for people to make shoes and textiles in this country, because imported shoes and cloth, often from Asia, cost relatively little.” At the same time, he noted that this allows Americans to focus on other industries, such as high-level manufacturing and providing financial services. Semiconductor processors, too, have become less-common in the U.S., as many businesses have elected to outsource manufacturing work abroad and focus on design, marketing, and distribution.To determine the jobs with the greatest forecast percentage decline in employment, 24/7 Wall St. reviewed BLS Employment Projections program data for 2012 and 2022. Most of these occupations refer to a specific job. In a few cases — postal service workers, data entry and information processing workers, and textile machine setters, operators, and tenders — we used a broader classification to reflect that multiple jobs in the larger job category would be among the fastest shrinking. Where several occupations were similar in their description, such as textile machine workers and fabric and apparel patternmakers, we selected only one occupation. Employment figures from the BLS for 2012 represent estimates, while figures for 2022 represent forecasts. Median annual wage figures are for 2012. Further information on each occupation came from the BLS’ Occupational Outlook Handbook.These are America’s Disappearing Jobs:"
18,BUSINESS,America's Disappearing Jobs,,https://www.huffingtonpost.com/entry/americas-disappearing-job_n_5742028.html,,2014-08-30,"10. Metal and Plastic Drilling and Boring Machine Setters, Operators, and Tenders",https://img.huffingtonpost.com/asset/5bb31276220000ba01dbc665.jpeg?ops=scalefit_960_noupscale,"After the Great Recession, which cost millions of Americans their jobs, the U.S. labor market has begun to heal. So far this year the United States has added an average of nearly 230,000 jobs per month. In the 10 years through 2022, the BLS estimates that total employment will grow by more than 15 million jobs, or nearly 11%.However, the outlook for some occupations is bleak. For example, the number of fallers — logging workers who cut down trees — is expected to decline by 43% between 2012 and 2022, the most of any occupation. Based on Bureau of Labor Statistics (BLS) estimates and projections for more than 1,000 occupations for 2012 and 2022, 24/7 Wall St. identified America’s disappearing jobs.Click here to see the nation’s disappearing jobsIn many cases, these rapidly declining occupations are already quite rare. For instance, there were just 1,600 locomotive firers — who are responsible for monitoring train tracks and engine instruments — in the U.S. as of 2012. In all, five of the fastest declining occupations had fewer than 10,000 workers in 2012.Yet, in other instances, occupations that are expected to contract still employ a large number of Americans. There were more than 320,000 people employed as data entry and information processing workers in 2012. There also were nearly half a million postal service workers.The projected decline in postal service workers is especially significant. In all, the BLS forecasts that the number postal service jobs will fall by 139,000 between 2012 and 2022 — or more than all of the other disappearing occupations put together. A number of factors are expected to contribute to this decline, including continued drops in mail volumes as well as the ongoing financial struggles of the U.S. Postal Service. The USPS has already cut tens of thousands of jobs since 2012, and it is currently slated to cut another 15,000 jobs next year.Increased automation, digitization, and technological innovation play a role in the decline of several of the fastest shrinking occupations. “We definitely think that technology and automation are a factor with some of these [jobs],” Martin Kohli, chief regional economist at the BLS, told 24/7 Wall St.The development of email has reduced mail volumes and, as a result, the need for postal service workers. Automated sorting systems have further reduced the need for human sorting. Similarly, motion picture projectionists have become less common as digital projection replaces traditional film rolls, Kohli said.International trade can also play a part in the decline of an occupation. Specifically, Kohli identified free trade and imports as factors impacting textile occupations. Trade, Kohli said, “reduces the demand for people to make shoes and textiles in this country, because imported shoes and cloth, often from Asia, cost relatively little.” At the same time, he noted that this allows Americans to focus on other industries, such as high-level manufacturing and providing financial services. Semiconductor processors, too, have become less-common in the U.S., as many businesses have elected to outsource manufacturing work abroad and focus on design, marketing, and distribution.To determine the jobs with the greatest forecast percentage decline in employment, 24/7 Wall St. reviewed BLS Employment Projections program data for 2012 and 2022. Most of these occupations refer to a specific job. In a few cases — postal service workers, data entry and information processing workers, and textile machine setters, operators, and tenders — we used a broader classification to reflect that multiple jobs in the larger job category would be among the fastest shrinking. Where several occupations were similar in their description, such as textile machine workers and fabric and apparel patternmakers, we selected only one occupation. Employment figures from the BLS for 2012 represent estimates, while figures for 2022 represent forecasts. Median annual wage figures are for 2012. Further information on each occupation came from the BLS’ Occupational Outlook Handbook.These are America’s Disappearing Jobs:"
19,POLITICS,John Kerry: U.S. To Push For Coalition To Fight 'Cancer' Of Islamic State,,https://www.huffingtonpost.com/entry/us-to-push-for-coalitio_n_5741588.html,,2014-08-30,"U.S. Secretary of State John Kerry speaks during a press conference concluding his visit to Naypyitaw to participate 47th Association of Southeast Asian Nations (ASEAN) Foreign Ministers meeting and 21st ASEAN Regional forum in Naypyitaw, Myanmar, Sunday, Aug. 10, 2014.(AP Photo/Gemunu Amarasinghe)",https://img.huffingtonpost.com/asset/5bb8d460200000c70101d258.jpeg?ops=scalefit_720_noupscale,"WASHINGTON, Aug 30 (Reuters) - U.S. Secretary of State John Kerry said the United States will use a NATO summit next week to push for a coalition of countries to beat back incursions in Syria and Iraq by Islamic State militants who are destabilizing the region and beyond.""With a united response led by the United States and the broadest possible coalition of nations, the cancer of ISIS will not be allowed to spread to other countries,"" Kerry wrote in an opinion piece published in The New York Times on Saturday.Public anger over the beheading of American journalist James Foley has led President Barack Obama to consider military strikes against Islamic State targets in Syria. So far, the United States has limited its actions to the group's forces in Iraq.The militant group, also referred to as both ISIS and ISIL, has seized about a third of each country and declared a caliphate, a reference to an Islamic state ruled by a caliph, which indicates a successor to the Prophet Mohammad, with temporal authority over all Muslims.Kerry said he and Defense Secretary Chuck Hagel will meet with their European counterparts to enlist support for a coalition to act against Islamic State militants. ""The goal is to enlist the broadest possible assistance,"" he wrote.Hagel and Kerry will then travel to the Middle East to shore up support from countries directly affected by the Islamic State threat, he said.Islamic State fighters have exhibited ""repulsive savagery and cruelty"" as they try to touch off a broader sectarian conflict, Kerry wrote, and the beheading of Foley ""shocked the conscience of the world.""""Already our efforts have brought dozens of nations to this cause,"" he said. ""Certainly there are different interests at play. But no decent country can support the horrors perpetrated by ISIS, and no civilized country should shirk its responsibility to help stamp out this disease.""Republicans and Democrats in Congress have called for lawmakers to vote on whether the United States should broaden its action against Islamic State.Two prominent Republicans criticized Obama on Saturday for saying the United States has not yet developed a strategy for confronting Islamic State in Syria.In an opinion piece also published on the op-ed page of Saturday's New York Times, Senators John McCain and Lindsey Graham called Obama's statement on Thursday ""startling"" and ""dangerous"" and said the threat from Islamic State requires ""a far greater sense of urgency"" than the administration is showing.McCain and Graham, in an essay headlined ""Stop Dithering, Confront ISIS,"" suggested revising the Authorization for Use of Military Force so it could be used for evolving terrorism threats like Islamic State.That would negate any need for members of Congress to approve specific military action against the group, or suffer the consequences of such a decision. (Reporting by Doina Chiacu; Editing by Sandra Maler and Leslie Adler)"
20,POLITICS,"The Meaning of the Koch Brothers Tapes: ""I Don't Know Where We'd Be Without You""","Mike Lux, ContributorPresident at Mike Lux Media",https://www.huffingtonpost.com/entry/the-meaning-of-the-koch-b_b_5741530.html,The spectacle of Mitch McConnell kowtowing to Charles and David Koch and other billionaires gathered recently at a luxury resort. This is going to help define the national narrative for the 2014 campaign -- these tapes make 100 percent clear that the modern Republican party is controlled by the Kochs and their billionaire friends.,2014-08-30,"Protesters attend a rally and march demanding Los Angeles Times not be sold to the Koch Brothers, portraits of which are held, May 23, 2013 in Beverly Hills, California. Charles and Bill Koch have donated millions to various conservative causes. AFP PHOTO /JOE KLAMAR (Photo credit should read JOE KLAMAR/AFP/Getty Images)",https://img.huffingtonpost.com/asset/5bb8d45f240000510098f576.jpeg?ops=scalefit_720_noupscale,"One of the classic strategies for politicians caught saying embarrassing things is to use the old ""there's nothing to see here, keep moving"" ploy. Republicans tried that at first when Romney was caught on the 47% tape, but it didn't work for them because it wasn't only what Romney said that was so offensive, it was the context: speaking to a bunch of wealthy donors about all those greedy seniors and poor people.  Sounds familiar.  The spectacle of Mitch McConnell, Joni Ernst, Cory Gardner, Tom Cotton, the head of the Republican Governors Association (and other politicians who were on the agenda or in attendance) kowtowing to Charles and David Koch and other billionaires gathered at the luxury resort. All the money spent on security ($870,000 to rent the hotel exclusively not to mention their own private security detail) to keep the meeting as secretive as possible. And Mitch McConnell, the most powerful man in the Republican party as the Senate Minority Leader, giving a speech outlining how his entire career, and the party's future policy strategy, were all in service to the Koch agenda. The combination will be as definitional to this campaign as the 47% video was to 2012.  And this won't just make an impact in the four Senate races which have gotten all the publicity so far. This is going to help define the national narrative for the 2014 campaign: these tapes make 100% clear that the modern Republican party is controlled by the Kochs and their billionaire friends. The Kochs invite the most powerful party leaders, the most important candidates, to their ""seminars,"" and they all come running. These politicians thank the Kochs and their billionaire friends profusely, talk about how they wouldn't be where they are today without them, and then tell them how they will battle on their behalf if they win.  Mitch McConnell, speaking of the Republican party, said, ""I want to start by thanking you, Charles and David, for the important work you're doing. I don't know where we'd be without you."" Joni Ernst made absolutely clear, multiple times, that she would never had a chance to win her primary without the donors in the room. Tom Cotton thanked the billionaire financiers for reviving the Republican party in his state, and Cory Gardner begged them to invest heavily not only in Colorado but in the entire Rocky Mountain region, which was ""ripe"" for them to come in and exploit.  Notice that these candidates come from all over the country - the South, the West, the Midwest. The Koch donor network has a broad and deep reach. They control the Republican party from sea to shining sea.  The Koch brothers have made clear their agenda. They don't believe in climate change, and want no regulations on their oil companies. They want their taxes reduced to almost nothing since they, after all, are the ""job creators."" They oppose reform and regulation of Wall Street. They don't believe in a minimum wage, or unemployment compensation, or student loans, or Social Security, Medicare, and Medicaid. They think public education should be privatized and turned over to the corporate sector.  And what the 47% recording, and the Koch conference recordings, confirm with 100% certainty, is that this is the same agenda, with the same values, shared by Republican politicians.  The Kochs and their millionaire/billionaire friends in that luxury hotel in Orange County, California are now in control of the Republican party- lock, stock, and barrel. And that is the narrative, confirmed on tape, of the 2014 election. Mitch McConnell is right: the GOP would be nowhere without the Koch brothers. The Republicans know where their bread is buttered, and will dance with the ones who brung 'em."
