,category,headline,authors,link,short descr,date,image_caption(s),image_link(s),article
7,TECH,"Twitter's 'Secret' IPO Puts Investors In The Dark, For Now","Reuters, Reuters",https://www.huffingtonpost.com/entry/twitter-secret-ipo_us_5bb36a01e4b0fa920b982254,She pointed to the recent IPOs of Facebook and Groupon. Groupon in 2011 was plagued by questions about its reliance on what,2013-09-15,"The Twitter Inc. logo and signage is displayed on the facade of the company's headquarters in San Francisco, California, U.S., on Friday, Sept. 13, 2013. Twitter Inc.'s market debut will be the most anticipated initial public offering since Facebook Inc. listed last year, and the microblogging service is making sure to avoid some of its rival's pitfalls. Photographer: David Paul Morris/Bloomberg via Getty Images",https://img.huffingtonpost.com/asset/5bb36a01240000310055dab4.jpeg?ops=scalefit_720_noupscale,"By Sarah N. LynchWASHINGTON, Sept 13 (Reuters) - Twitter's use of a confidential initial public offering filing has reignited a debate about a 2012 U.S. law that critics say denies investors time to digest a company's financial information and erodes the widely-held value of market transparency.The social media giant can use the more secretive process thanks to the Jumpstart Our Business Startups (JOBS) Act, which loosened a number of federal securities regulations in hopes of boosting capital raising, and thereby increasing job growth.It included a provision known as the IPO on-ramp that allowed ""emerging growth companies"" to keep draft filings with the Securities and Exchange Commission under wraps while negotiations over the disclosures occur.Companies that don't meet the emerging growth criteria must release their IPO filings, usually with hundreds of pages of detail about their financial condition, risk factors and ownership and management structure, months before they sell their shares.This gives investors, financial analysts and journalists a lot longer to analyze the company's prospects.In the case of Twitter and other emerging growth companies, they can delay the release until 21 days before a roadshow to investors, which usually precedes the share sale by only a few days or weeks.They can also can disclose less information about pay for executives and directors, and gauge interest by sophisticated investors prior to filing IPO documents with the SEC.The law helps true startups test the regulatory process for an IPO without worrying about bad publicity if they decide to later withdraw their paperwork. It also allows companies to keep information from their rivals for longer.Some critics say it's absurd to lump a household name like Twitter in this category, even if it fits the technical definition of less than $1 billion in annual revenue.Its market value once listed is expected to be more than $10 billion.There is also an irony in Twitter, which freely spreads around vast amounts information in the blink of an eye, keeping its own details out of view. It announced its IPO plans in a bare-bones tweet late on Thursday.J. Edward Ketz, an accounting professor at Pennsylvania State University, said the idea of having a confidential filing process is ""dead wrong"".""It goes against everything the SEC is about,"" he said. ""The whole purpose of having the SEC in the first place is to get corporations to provide full and complete information about what they're doing.""Advocates of the JOBS Act say those arguments don't hold water.They contend that keeping private the initial discussions with regulators spares companies the heartburn of putting out financials and then being prevented from elaborating on them due to ""quiet period"" rules. Those rules prevent company executives from making public statements related to information in the filing.They note that 21 days before the roadshow provides plenty of time for public debate.Ketz said Twitter is not doing anything illegal or wrong, but said the decision is not encouraging for shareholders. ""If management at Twitter were more investor friendly, it seems they wouldn't invoke the option that they have.""Others disagree, including Kate Mitchell, who chaired the IPO Task Force, a private-sector group whose work advised the Treasury Department and lawmakers, including Senator Charles Schumer, a New York Democrat who helped draft the IPO on-ramp provision of the JOBS Act.She said that while the idea of a confidential IPO process ""sounds nefarious,"" it allows for the company and the SEC to have a generous discussion about proper disclosures and accounting methods.And it prevents companies from being put in the awkward position of putting out some business information to some potential investors and Wall Street analysts and then not being able to publicly discuss it.She pointed to the recent IPOs of Facebook and Groupon. Groupon in 2011 was plagued by questions about its reliance on what some considered to be unusual accounting practices. Facebook faced serious doubts last year after its IPO filing described its lack of mobile advertising as a risk factor.""All this hype was building around these offerings, and there was limited and static communications,"" said Mitchell, who is also a co-founder and partner at Scale Venture Partners.She also said potential investors get to look at all the SEC's red-line edits on the draft registration statements before the company goes public. SLEEPER LEGISLATIONThe JOBS Act was a rare bipartisan bill that sailed through Congress last year, even though Washington was generally gridlocked over budget and other domestic issues.The idea of fostering young companies at a time of sluggish economic growth had strong appeal, and those critics concerned about the erosion of investor protections were only able to make modest changes to the legislation.Besides allowing emerging growth companies to quietly navigate the IPO process, the bill also opened the door for hedge funds to advertise private securities deals and allowed for crowdfunding, a capital-raising strategy that lets investors take small stakes in private start-ups over the Internet.Overall, roughly 250 companies have used the confidential IPO process as of June 2013, according to the SEC, who will not name the firms.Among the known companies are some that are far cries from start-ups. English soccer powerhouse Manchester United last year used a confidential IPO to launch its offering in the United States after abandoning earlier attempts in Hong Kong, Singapore and the UK.The architects of the Sarbanes-Oxley corporate accountability law in late July mocked the notion that the soccer club is an emerging growth company that is going to help create jobs in the United States.""They've been emerging for 120 years,"" said former U.S. Representative Michael Oxley, drawing laughter from a conference crowd last year.Schumer, in a statement to Reuters, said the confidential filing provision has been one of the most successful parts of the JOBS Act. He said investors still have all the information they need to analyze well in advance of the IPO.""If Twitter meets the definition of an emerging growth company, they're free to avail themselves of the relief provided under the bill,"" Schumer said. INVESTOR PROTECTIONSEven early on, some questioned whether the definition of ""emerging growth company"" was too broad. Mary Schapiro, who headed the U.S. Securities and Exchange Commission when the legislation was being debated, had tried to lower the $1 billion threshold but was not successful.In a March 2012 letter to Senate Banking Committee Chairman Tim Johnson and then-ranking Republican Richard Shelby, Schapiro said she recognized the importance of reducing IPO obstacles for small businesses, but was not sure the JOBS Act had found the best way.""A lower annual revenue threshold would pose less risk to investors and would more appropriately focus benefits provided by the new provisions on those smaller businesses that are the engine for growth for our economy,"" she said.Barbara Roper, the director of investor protection for the Consumer Federation of America, said Twitter's use of the confidential filing process undercuts the idea behind the JOBS Act.""It exposes the absurdity of the basic premise that this was about small company capital formation,"" she said."
8,TECH,Saudi Prince Who Owns Much Of Twitter Sees IPO By Early 2014,"Reuters, Reuters",https://www.huffingtonpost.com/entry/saudi-prince-twitter_us_5bb36a02e4b0fa920b982275,"By Mirna Sleiman But the prince said: ""In my discussion with Mr Costolo and the management of Twitter, I cautioned them to",2013-09-15,"(FILES) -- File picture dated February 23, 2010 shows Saudi tycoon Prince AlWaleed bin Talal speaking during a press conference in Riyadh. The recent partnership between US media tycoon Rupert Murdoch, a pro-Israel diehard, and AlWaleed, a member of ultra-Islamic Saudi Arabia's monarchy, has provoked the anger of Egypt's cultural community, which fears that a part of Arab cultural heritage and Egypt may fall into the hands of Israel. In a deal announced on February 23, 2010 the two multi-billionaires have put aside stark political differences for the lucrative business of movies and television, with Alwaleed announcing in Riyadh that his Middle East regional entertainment giant Rotana Group was selling a nine percent stake to Murdoch's global media empire News Corp. AFP PHOTO/STR (Photo credit should read -/AFP/Getty Images)",https://img.huffingtonpost.com/asset/5bb36a0220000030000038ef.jpeg?ops=scalefit_720_noupscale,"By Mirna SleimanDUBAI (Reuters) - Saudi billionaire Prince Alwaleed bin Talal says he will not sell any of his shares in microblogging site Twitter Inc when it goes public, and expects the firm's IPO to hit the market later this year or in early 2014.The prince, a nephew of Saudi Arabia's King Abdullah and owner of international investment firm Kingdom Holding, invested $300 million in the social media giant in late 2011.""Clearly the speed they're moving with shows that they would like to IPO sooner than later. I believe it will happen either this year or early next year,"" Alwaleed told Reuters in a telephone interview on Sunday.""Twitter is a very strategic investment for us. We believe that it is just beginning to touch the surface. We have invested $300 million in the company. We will be selling zero, nothing, at the IPO."" He did not say whether he might buy new shares in the offer.Alwaleed is a closely watched figure in international markets because of successful investments through Kingdom Holding in companies such as Citigroup and Rupert Murdoch's News Corp.Twitter has filed for an initial public offer of shares with U.S. regulators, the company said on Thursday, taking a first step toward what would be Silicon Valley's most anticipated debut since Facebook Inc's listing last year.""With the 300 million customers they have and half a billion tweets a day, the growth potential is tremendous,"" Alwaleed said. He said Chief Executive Dick Costolo was ""very knowledgeable, very much trustworthy"".The market expects the company's value once listed to be more than $10 billion; Alwaleed sees potential for a much higher valuation.""We hear that the company is valued at $14 billion-$15 billion but there have been trades above this valuation. We believe it might be worth more than that.""LEARNING LESSONSFacebook's rocky 2012 debut and subsequent share-price plunge chilled the consumer-dotcom IPO market for a year. The stock clawed its way back to its $38 IPO price in July, however, and is now at a record high after touching $45 this week.Alwaleed wouldn't comment on whether Twitter would choose to list on the New York Stock Exchange in order to avoid Facebook's disappointing experience on Nasdaq.But the prince said: ""In my discussion with Mr Costolo and the management of Twitter, I cautioned them to be very careful and not to repeat the mistakes of Facebook.""The lessons are not to brag too much, don't be greedy - I mean price it right and be realistic.""He added, ""There could be a good surprise for the market, where Twitter revenues coming from mobile compared to fixed devices are way ahead of what Facebook came with at the time of the IPO.""By transmitting news and opinion, social media such as Twitter played a big role in mass protests that have led to the ousting of Arab rulers in Tunisia, Egypt, Libya and Yemen since 2011.Saudi Arabia, where Twitter use has been growing rapidly, has spent billions of dollars on welfare schemes to contain discontent and avoid unrest.Alwaleed said on Sunday, ""There is no doubt that Twitter accelerated the process of disseminating news. It has to remain an open forum for everyone.""He added, ""I'm totally against anybody who tries to control or censor Twitter or any other social media, even if it is governments. It's a losing war.""(Editing by Andrew Torchia/Ruth Pitchford)"
9,ENTERTAINMENT,Arctic Monkeys' 'AM' Album Tops The British Albums Chart,"Reuters, Reuters",https://www.huffingtonpost.com/entry/arctic-monkeys-am-album-tops-british-albums-chart_us_5bb43942e4b066f8d2567eed,"LONDON, Sept 15 (Reuters) - British indie rock group Arctic Monkeys seized the top spot in the British albums chart on Sunday",2013-09-15,"LONDON, ENGLAND - JULY 27: Alex Turner of The Arctic Monkeys performs during the Opening Ceremony of the London 2012 Olympic Games at the Olympic Stadium on July 27, 2012 in London, England. (Photo by Lars Baron/Getty Images)",https://img.huffingtonpost.com/asset/5bb4394224000051009785bb.jpeg?ops=scalefit_720_noupscale,"LONDON, Sept 15 (Reuters) - British indie rock group Arctic Monkeys seized the top spot in the British albums chart on Sunday with ""AM"", their fifth consecutive studio album to debut at number 1, sales figures showed.The Official Charts Company said the group, from Sheffield, England, had sold more than 157,000 copies of their album in the first week, making it the second fastest selling album of the year.They were the first indie-released act to achieve a fifth debut number 1 in British chart history, it added.Last week's number 1, The 1975, the self-titled album by another English indie-rock band, was pushed to number 3, behind British alternative trio London Grammar, at number 2 with their new entry ""If you wait"".In the singles chart, U.S. singer Katy Perry held onto the top spot for a second week with ""Roar"", which has sold more than 280,000 copies.U.S. band OneRepublic took the second spot with ""Counting Stars"", their highest charting UK single to date. (Reporting by Andrew Osborn; Editing by Robin Pomeroy)"
10,ENTERTAINMENT,"Paul McCartney's 'New' Album Features Production By Mark Ronson, Paul Epworth, Giles Martin",,https://www.huffingtonpost.com/entry/paul-mccartney-new-album-mark-ronson-paul-epworth-giles-martin_us_5bb43942e4b066f8d2567ed5,"With just weeks until the release of his next album, Sir Paul McCartney publicized the tracklist to the upcoming project",2013-09-15,"SAN FRANCISCO, CA - AUGUST 09: Sir Paul McCartney performs during the 6th Annual Outside Lands Music & Arts Festival at Golden Gate Park on August 9, 2013 in San Francisco, California. (Photo by C Flanigan/WireImage)",https://img.huffingtonpost.com/asset/5bb4394224000030009785b9.jpeg?ops=scalefit_720_noupscale,"With just weeks until the release of his next album, Sir Paul McCartney publicized the tracklist to the upcoming project this weekend. Due out on Oct. 15, McCartney's ""New"" is a 12-track album which includes production by Mark Ronson, Paul Epworth, and Giles Martin. The album is led by McCartney's latest single, ""New,"" which made its debut late last month. ""It's funny, when I play people the album they’re surprised it’s me,"" McCartney said of the project. ""A lot of the tracks are quite varied and not necessarily in a style you'd recognize as mine. I didn't want it to all sound the same. I really enjoyed making this album. It's always great to get a chance to get into the studio with a bunch of new songs and I was lucky to work with some very cool producers. We had a lot of fun.""Check out the full tracklisting to ""New"" below. 1. Save Us  2. Alligator  3. On My Way to Work 4. Queenie Eye 5. Early Days 6. New 7. Appreciate 8. Everybody Out There 9. Hosanna 10. I Can Bet 11. Looking At Her 12. Road"
11,IMPACT,BuzzFeed Donates $500 To Charity After Photographer Dan Catt Accuses Site Of Stealing Photo,Meredith Bennett-Smith,https://www.huffingtonpost.com/entry/buzzfeed-charity-dan-catt-photos_us_5bb1b3dbe4b01857b70a571b,"""We discussed a number of things about BuzzFeed, copyright and photography,"" Catt wrote in his blog. ""I asked if they'd pay",2013-09-15,"An icon for the BuzzFeed app is photographed on the home screen of an Apple Inc. iPhone 5 in Tiskilwa, Illinois, U.S., on Thursday, May 30, 2013. New York Times Co., looking to imitate the business models used by startups such as BuzzFeed Inc., is considering letting advertisers sponsor more stories on its website, two people with knowledge of the situation said. Photographer: Daniel Acker/Bloomberg via Getty Images",https://img.huffingtonpost.com/asset/5bb1b3db240000300096db9d.jpeg?ops=scalefit_720_noupscale,"If BuzzFeed were to write a ""10 Ways To Say 'Sorry' After Doing Something Really Wrong"" post, the site's most recent payback would definitely rank No. 1. On Aug. 23, BuzzFeed staff writer Gabby Noone created a post titled ""18 Everyday Products You've Been Using Wrong."" That post went viral, attracting the attention of Dan Catt, a freelance coder and blogger who noticed the BuzzFeed list included a photo he had taken of his young son, but hadn't asked for permission. (The photo has since been removed.)Frustrated by the licensing violation, Catt penned a scathing take down of the viral content giant on his blog appropriately called, ""10 Good Reasons BuzzFeed Is Going To Pay My F#$king Invoice For Copyright Theft,"" and it was later picked up by Slate. Noone and BuzzFeed ""used my copyrighted photo without permission,"" Catt wrote in the post. The photo, a picture of Catt's young son drinking a juice box, was posted to Flikr and is not in the public domain or fair use, according to Catt. (Story continues below.) For Catt, the story had a happy ending, however. Shortly after writing the blog post, BuzzFeed's Art Director John Gara called him and the two had an apparently friendly conversation. ""We discussed a number of things about BuzzFeed, copyright and photography,"" Catt wrote in his blog. ""I asked if they'd pay the money I'd be invoicing them to charity instead, I've supported the Chordoma Foundation before and BuzzFeed were more than happy to do so, thanks John!""The company agreed to donate $500 to the foundation, which helps people living with chordoma -- a difficult to treat cancer that occurs in the head and spine. This is not the first time accusations of plagiarism or unfairly co-opted work has resulted in a windfall for a lucky charity, however.In 2012, a convoluted legal battle eventually resulted in cartoonist and founder of the website TheOatmeal.com Matthew Inman raising $211,223 for the American Cancer Society and the National Wildlife Federation, according to Fox News.And this February, New York photographer Brandon Stanton forced fashion brand DKNY to donate $25,000 to a Brooklyn YMCA after they used some of his photos without permission in a store display, according to the Telegraph."
12,WELLNESS,Seahawks Fans Seek Roar Record As Experts Warn Of Health Risks,Lynne Peeples,https://www.huffingtonpost.com/entry/seahawks-roar-record-hearing-loss_us_5b9d834ce4b03a1dcc88f602,"One in three U.S. soldiers returning from the Middle East reports hearing loss, making it the most common injury sustained",2013-09-14,"SEATTLE - NOVEMBER 08: A fan of the Seattle Seahawks yells during the game against the Detroit Lions on November 8, 2009 at Qwest Field in Seattle, Washington. The Seahawks defeated the Lions 32-20. (Photo by Otto Greule Jr/Getty Images) *** Local Caption ***",https://img.huffingtonpost.com/asset/5b9d834c26000033007fe7e1.jpeg?ops=scalefit_720_noupscale,"When audiologist Brian Fligor of Boston Children's Hospital first caught word of an upcoming attempt by Seattle Seahawks fans to set the Guinness World Record for the loudest crowd roar at a sports stadium, he scratched his head. ""Oh boy,"" he said. ""Pack people in nice and tight, all screaming at about 115 decibels, and yeah, I could imagine peak sound might hit 132 decibels.""""I'm a football fan,"" Fligor added. ""But I'm not a big fan of that.""The current crowd noise record is 131.76 decibels, set at a Turkish soccer arena in 2011. At that level, people can suffer immediate and permanent hearing damage, Fligor and other experts warned. In a society filled with iPods, rock concerts, subways and battlefields, loud noise is often overlooked as an environmental health hazard, they said. Sporting events aren't typically high on the loud list, but Seahawks fans also don't see themselves as typical. CenturyLink Field has earned a reputation around the NFL for its opponent-distracting noise, a result of the stadium's acoustical design and the lungs of some 60,000 screaming fans, often known as the team's ""12th man.""The loudest official recording during a Seahawks game is 112 decibels. Fans and the organizing group of this Sunday's crowd roar, Volume 12, believe they have a good chance at the Guinness World Record.Joe Tafoya, co-owner of Volume 12 and a former Seahawks defensive end, is well acquainted with the Seattle stadium's noise. He recalled one particular moment during the 2005 NFC Championship game there -- a victory that led the team to its first Super Bowl.""I had to stop and look around the stadium in sheer amazement of the level of noise, the passion the fans were pouring into it,"" he said. ""That stuck with me.""The idea that such noise could be in any way a health risk never crossed his mind. But now, he said, he sees hearing loss as a ""public health issue.""In addition to going for the crowd roar record at this week's Seahawks match-up against the San Francisco 49ers, Volume 12 is working with Seattle's hearing-impaired community to raise awareness of noise-induced hearing loss. Volunteers will be handing out 30,000 ear plugs attached to informational cards to fans at the game.Standard foam ear plugs are designed to drop noise levels entering the ear by around 30 decibels, but that may not be enough to safely stifle the crowd noise on Sunday.""In the real world, it's probably more like 20 or 25 decibels,"" said Dr. Jay Rubinstein, director of the University of Washington's Virginia Merrill Bloedel Hearing Research Center. ""That would be adequate if you're trying to reduce levels that start at 100 or 110 decibels. If you're going to be around something noisier, you need a greater level of hearing protection.""Rubinstein noted that hearing loss is the result of both a sound's intensity and its duration. The U.S. Occupational Safety and Health Administration limits the amount of time a worker can be exposed to noise levels of 85 decibels and higher to 8 hours a day. For every additional 5 decibel increase, the maximum time is cut in half. At 115 decibels, for example, the limit is just 15 minutes.By the time noise levels reach 130 decibels, ""it's really unsafe to be listening to the noise for any period of time,"" said Troy Cascia, an audiologist at the University of California, San Francisco Medical Center.Of course, football fans aren't the only ones at risk of noise-induced hearing loss. Certain occupations can be dangerously loud, such as construction work and military service.One in three U.S. soldiers returning from the Middle East reports hearing loss, making it the most common injury sustained by troops -- ahead of post-traumatic stress disorder and traumatic brain injury. Ringing in the ears (tinnitus) is No. 2 on the list.Then there are those notoriously noisy rock concerts and iPod earphones. ""If you go to a concert one time, that's not a big deal. But if you go to three concerts a year from age 15 to 55, then your hearing when you're 55 may actually look more like the hearing of a 75-year-old,"" said Fligor, noting that just 4 percent of concert-goers wear earplugs. ""Without hearing protection, you've essentially prematurely aged your ear.""Some everyday exposures to noise are less avoidable, such as the passing of an express subway car or firetruck. In those cases, experts suggest sticking a finger in each ear may be the best defense.""We live in a noisy world,"" said Fligor, ""and we are living longer.""More years means more exposure, and a greater likelihood that earlier exposures will manifest as hearing damage. That damage can be subtle, such as a diminished ability for the ear to detect the high pitch notes of speech, said Cascia, who emphasized the importance of protecting children's hearing. ""It can make it sound like people are mumbling,"" he added.Experts' best advice: seek hearing protection anytime you expect sounds to exceed about the level of a shout, and eat a healthy diet and get regular exercise. Poor circulation caused by conditions like type 2 diabetes or smoking can make the ear more susceptible to damage.For those fans attending the game in Seattle on Sunday, they recommend wearing ear plugs, perhaps even with ear muffs on top, and limiting the time they're in the packed stands.""Take a break and go out for 15 minutes,"" said Cascia, who happens to be a 49ers fan."
