,category,headline,authors,link,short descr,date,image_caption(s),image_link(s),article
5,ENVIRONMENT,"Climate Change This Week: Freaky Fracking, the Solar Sell and More","Mary Ellen Harte, Contributor
Biologist, Author, and Consultant on Climate Change and Popula...",https://www.huffingtonpost.com/entry/climate-change_us_5bb1299fe4b09bbe9a5bc460,"Friggin' Fracking Foiling Human Health all over the U.S., as both underground and accidental above ground releases of toxic chemicals enter our air and water, reports Elizabeth Royte at The Nation. Think organic chemicals, heavy metals and even radioactivity. Fun, huh?",2012-12-02,"To go with China-politics-congress, ADVANCER by Patrick Lescot The sun rises above the Beijing skyline early on November 6, 2012. The heirs of Mao Zedong convene this week to anoint China's next leaders, as the Communist Party maintains an iron grip on the economic powerhouse despite mounting calls for change in the Internet era. AFP PHOTO / Ed Jones (Photo credit should read Ed Jones/AFP/Getty Images)",https://img.huffingtonpost.com/asset/default-missing-image.jpg?cache=OKwy0EAPS0&ops=scalefit_720_noupscale,"Friggin' Fracking Foiling Human Health all over the U.S., as both underground and accidental above ground releases of toxic chemicals enter our air and water, reports Elizabeth Royte at The Nation. Think organic chemicals, heavy metals and even radioactivity. Fun, huh? The real price of this ""cheap, clean"" natural gas may be far higher than anyone wants. Go solar and wind, my friend!   Would You Like a Solar Panel with That Tupperware Set? Taking a page from Tupperware, solar companies across the US are having enthusiastic customers host parties to spread the great news about solar rooftop installations, reports Diane Cardwell at the New York Times. And it's working! Be the first in your neighborhood to go solar... ***** What does George Clooney, the Wakhan Corridor, and Integrated Cooking have in common? They're all in the 2012 Solar Cooker Review, at Solar Cookers International. Fascinating stuff. Next time the drought hits you, think about solar cooking your meals.   Waterfall off a Greenland Iceberg, 2003 (Mary Ellen Harte)It's Melting, Melting, Faster, Faster says the most reliable scientific study yet on the melting polar ice sheets, reports Darryl Fears at the Washington Post. The main culprit of sea level rise for now, however, is the global heating of the oceans, which expands them. Expected to rise about 40 inches by 2100, oceans rising just 6 inches can significantly increase storm flooding - think Hurricane Sandy! ***** At Last, a Green Radio Show to counter the Lush Bimbaugh wasteland. Check out On the Green Front with Betsy Rosenberg at Progressive Radio Network to keep updated on climate change, and other green topics. Expect a Megaflood, California, suggests new research, reports Michael Dettinger and Lyn Ingram in Scientific American. Newly discovered atmospheric rivers of water vapor create megastorms every 100 to 200 years in CA - the last 43-day one in 1862 turned the Central Valley into an inland lake. With climate change, atmospheric rivers will increase and hold more water, so expect record-breaking megastorms more frequently. Okay, kiddies, do the math - when is the next one due, and do you know how to build an ark? U.S. Blowing Into Offshore Wind Farms With Leases off Rhode Island, Massachussetts and Virginia, reports Michelle Smith at the Associated Press via the Christian Science Monitor. 430 square miles of leases are up for grabs. The perfect holiday gift for your billionaire spouse! Buy now! ***** Over 100 US Campuses Agreed to Divest Fossil Fuel Companies and Harvard students have voted to divest, reports Bill McKibben at 350.org from the road as he continues to tour and preach the power of divestment to universities across the US.  Every day is Earth Day, folks, as I was reminded by this pic of Greenland tundra I took in 2003. Making the U.S. a global clean energy leader will ensure a heck of a lot more jobs, and a clean, safe future. If you'd like to join the increasing numbers of people who want to TELL Congress that they will vote for clean energy candidates you can do so here. For more detailed summaries of the above and other climate change items, audio podcasts and texts are freely available."
6,ENVIRONMENT,"Climate Change This Week: Freaky Fracking, the Solar Sell and More","Mary Ellen Harte, Contributor
Biologist, Author, and Consultant on Climate Change and Popula...",https://www.huffingtonpost.com/entry/climate-change_us_5bb1299fe4b09bbe9a5bc460,"Friggin' Fracking Foiling Human Health all over the U.S., as both underground and accidental above ground releases of toxic chemicals enter our air and water, reports Elizabeth Royte at The Nation. Think organic chemicals, heavy metals and even radioactivity. Fun, huh?",2012-12-02,2012-12-02-15IcebergfallnrIllulissatGrnldresize.jpg,https://images.huffingtonpost.com/2012-12-02-15IcebergfallnrIllulissatGrnldresize.jpg,"Friggin' Fracking Foiling Human Health all over the U.S., as both underground and accidental above ground releases of toxic chemicals enter our air and water, reports Elizabeth Royte at The Nation. Think organic chemicals, heavy metals and even radioactivity. Fun, huh? The real price of this ""cheap, clean"" natural gas may be far higher than anyone wants. Go solar and wind, my friend!   Would You Like a Solar Panel with That Tupperware Set? Taking a page from Tupperware, solar companies across the US are having enthusiastic customers host parties to spread the great news about solar rooftop installations, reports Diane Cardwell at the New York Times. And it's working! Be the first in your neighborhood to go solar... ***** What does George Clooney, the Wakhan Corridor, and Integrated Cooking have in common? They're all in the 2012 Solar Cooker Review, at Solar Cookers International. Fascinating stuff. Next time the drought hits you, think about solar cooking your meals.   Waterfall off a Greenland Iceberg, 2003 (Mary Ellen Harte)It's Melting, Melting, Faster, Faster says the most reliable scientific study yet on the melting polar ice sheets, reports Darryl Fears at the Washington Post. The main culprit of sea level rise for now, however, is the global heating of the oceans, which expands them. Expected to rise about 40 inches by 2100, oceans rising just 6 inches can significantly increase storm flooding - think Hurricane Sandy! ***** At Last, a Green Radio Show to counter the Lush Bimbaugh wasteland. Check out On the Green Front with Betsy Rosenberg at Progressive Radio Network to keep updated on climate change, and other green topics. Expect a Megaflood, California, suggests new research, reports Michael Dettinger and Lyn Ingram in Scientific American. Newly discovered atmospheric rivers of water vapor create megastorms every 100 to 200 years in CA - the last 43-day one in 1862 turned the Central Valley into an inland lake. With climate change, atmospheric rivers will increase and hold more water, so expect record-breaking megastorms more frequently. Okay, kiddies, do the math - when is the next one due, and do you know how to build an ark? U.S. Blowing Into Offshore Wind Farms With Leases off Rhode Island, Massachussetts and Virginia, reports Michelle Smith at the Associated Press via the Christian Science Monitor. 430 square miles of leases are up for grabs. The perfect holiday gift for your billionaire spouse! Buy now! ***** Over 100 US Campuses Agreed to Divest Fossil Fuel Companies and Harvard students have voted to divest, reports Bill McKibben at 350.org from the road as he continues to tour and preach the power of divestment to universities across the US.  Every day is Earth Day, folks, as I was reminded by this pic of Greenland tundra I took in 2003. Making the U.S. a global clean energy leader will ensure a heck of a lot more jobs, and a clean, safe future. If you'd like to join the increasing numbers of people who want to TELL Congress that they will vote for clean energy candidates you can do so here. For more detailed summaries of the above and other climate change items, audio podcasts and texts are freely available."
7,ENVIRONMENT,Weather's Two Winter Seasons: Before and After Christmas,"Paul Yeager, Contributor
Meteorologist and Author of 'Weather Whys: Facts, Myths, and O...",https://www.huffingtonpost.com/entry/winter-snow_us_5bb1297fe4b09bbe9a5bc3c1,"From Thanksgiving through Christmas Day, it's not that we tolerate snow and cold; we actually enjoy it and look forward to it. But for the remainder of the winter, we go back to our snow-hating ways.",2012-12-02,"weather, winter, snow, young girl sledding down hill. perth, scotland.",https://img.huffingtonpost.com/asset/5bb1297f200000e500ff8ea0.jpeg?ops=scalefit_720_noupscale,"As a long time observer of the weather and how people react to it, I've come to the conclusion that we have two winter seasons, not one: winter before Christmas and winter after Christmas.We don't all celebrate Christmas, of course, but we're all aware of how romanticized a White Christmas is in this country.From Thanksgiving through Christmas Day (or perhaps New Year's Day), it's not that we tolerate snow and cold; we actually enjoy it and look forward to it.Singers croon about a White Christmas. Movies and animated specials are filled with images of fluffy snow falling on top of villages adorned with spectacular Christmas displays. Even commercials are full of happy shoppers bopping around during snow storms, but no one even seems to be cold or have wet feet. Christmas cards all look like scenes from Normal Rockwell paintings, and we reminisce about how it used to snow more when we were younger while admitting we hope that it snows for Christmas this year.For the remainder of the winter, which is when the majority of snow falls, I might add, we go back to our snow-hating ways. We hate the cold, and we complain of fussing with boots, hats, and scarves. We don't want to deal with travel delays associated with the weather, and, in fact, we often plan a cruise to the Caribbean or a week in Cancun. We hope for an early end to winter, and complain if the flakes continue to fall in March or April.I've written about our tendency to want to split winter into two seasons before, as well as whether Charles Dickens is responsible for our obsession with the idea of a White Christmas.Finally, here are some images that show the snow on the ground for the past three Christmas days (images courtesy of the National Operational Hydrologic Remote Sensing Center). As you can see, snow was fairly scarce last year, but it widespread the previous two years, especially 2009. Christmas snow cover on Christmas 2011 Christmas snow cover on Christmas 2010 Christmas snow cover on Christmas 2009"
8,CULTURE & ARTS,"Matthew Rolston's Ventriloquist Dummies In 'Talking Heads, The Vent Haven Portraits' (PHOTOS)",,https://www.huffingtonpost.com/entry/matthew-rolston-gets-up-c_us_5bb23cf9e4b0171db69ea1e1,"The photographs are compiled in the book ""Talking Heads, The Vent Haven Portraits,"" which we predict would catalyze superbly",2012-12-02,"Matthew Rolston, 'Talking Heads, The Vent Haven Portraits'",https://img.huffingtonpost.com/asset/5bb23ce02200005700db8405.jpeg?ops=scalefit_960_noupscale,"Visit celebrity photographer Matthew Rolston's website and you'll see pop icons like Michael Jackson, Lady Gaga, Taylor Swift and Nicki Minaj looking as glossy smooth as a porcelain doll. Yet his photographs of dolls themselves are not so forgiving.Far from the gloss of celebrity glamor, Rolston's photographs of ventriloquist dummies show the crackled paint and decayed wood that has phased the physical faces themselves, though not the smiles painted upon them. Rolston, who was discovered by Andy Warhol, snapped 100 dummies at the Vent Haven Museum in Fort Mitchell, Kentucky.There is an eerie beauty to the silenced puppets, their expressions somewhere between entertaining and grotesque. Rolston captures the dummies' ""head shots"" straight on against a white background, treating the wooden dolls as stars of another era. While the beauty of Hollywood's most stunning starlets will eventually fade, these ventriloquist dummies forever keep smiling, although this eternal existence is far from beautiful. The photographs are compiled in the book ""Talking Heads, The Vent Haven Portraits,"" which we predict would catalyze superbly bizarre coffee table small talk. What do you think of these creepy talking heads? Let us know in the comments."
9,SPORTS,"Keegan Bradley Heckled: Fan Calls Golfer 'Cheater' Over Anchoring, USGA Criticizes 'Deplorable Incident'",,https://www.huffingtonpost.com/entry/keegan-bradley-cheater-fan-anchoring-usga_us_5bb6c49fe4b097869fd2ba7c,"By Golfweek Staff, Golfweek On Saturday, Keegan Bradley says that he was heckled by a fan off the 18th green at the end of",2012-12-02,"Keegan Bradley lines up a put on the first hole during the first round of the World Challenge golf tournament at Sherwood Country Club in Thousand Oaks, Calif., Thursday, Nov. 29, 2012. (AP Photo/Bret Hartman)",https://img.huffingtonpost.com/asset/5bb6c49f240000300098607e.jpeg?ops=scalefit_720_noupscale,"By Golfweek Staff, Golfweek  On Saturday, Keegan Bradley says that he was heckled by a fan off the 18th green at the end of his third round at the Tiger Woods World Challenge, with the fan calling him a ""cheater"" because of his continued use of his long putter.This comes only days after the USGA and R&A proposed a ban of anchored putting on Jan. 1, 2016.The USGA made the following statement on Saturday's incident at Sherwood Country Club:""The United States Golf Association (USGA) today issued the following statement regarding yesterday’s incident at the World Challenge in which a spectator called Keegan for changes to the Rules of Golf."
10,TRAVEL,10 Family Adventures In Latin America (PHOTOS),"Jacada Travel, Contributor
Inspired, Tailor-Made Travel to Latin America, Africa, Asia, A...",https://www.huffingtonpost.com/entry/family-latin-america_us_5b9c91a5e4b03a1dcc7fe334,Help herd sheep with the gauchos on the Patagonian steppe or learn how to heal yourself with Amazonian plants as instructed by rainforest tribe leaders.,2012-12-01,Wildlife Tour of Argentina & Whale watching in Peninsula Valdes,https://img.huffingtonpost.com/asset/5b9c919f3c00005b0009cfae.jpeg?ops=scalefit_960_noupscale,"With the holiday season fast approaching many of us will be reuniting with our families over the festivities. Our team of Latin America travel designers have brought together our top ten family tours to Latin America  as a helpful guide on what sort of adventure your family might want to embark on in 2013. All these itineraries have been carefully designed to allow families to connect over challenging activities or unique cultural experiences. Perhaps you want to get down to earth with your brothers and sisters whilst camping out on the four day trek in Peru, or help herd sheep with the gauchos on the Patagonian steppe or learn how to heal yourself with Amazonian plants as instructed by rainforest tribe leaders. For luxury and meaningful family adventures of all kinds: Jacada Travel"
11,COMEDY,Happy Birthday Richard Pryor: 25 Reasons To Love The Legendary Comedian,Christine Friar,https://www.huffingtonpost.com/entry/happy-birthday-richard-pryor-slideshow_us_5bad0e8ae4b04234e856587e,"Legendary comedian Richard Pryor would have been 72 years old today, and to celebrate his legacy we've rounded up 25 of our",2012-12-01,"He Hung Out With Eddie Murphy, Sidney Poitier & Bill Cosby",https://img.huffingtonpost.com/asset/5bad0e853c000066000b0c9f.jpeg?ops=scalefit_960_noupscale,"Legendary comedian Richard Pryor would have been 72 years old today, and to celebrate his legacy we've rounded up 25 of our favorite reasons to love him. He's influenced everyone from Eddie Murphy to Louis CK, and the worlds of stand-up, film and TV have all been changed by his incredible career -- so today we're taking the opportunity to look back at some of his greatest moments."
12,BLACK VOICES,Engaging Churches to 'Get to Zero',"Elder Stacey S. Latimer, Contributor
Founder/CEO/Chairmain, Love Alive International Group",https://www.huffingtonpost.com/entry/black-americans-hivaids_us_5badcddce4b0bb1705fae63f,"The church is the cornerstone of black community, and as communities of faith increases their HIV/AIDS knowledge base and engage the process to end AIDS, so shall we see a significant decline in transmission rates for black people.",2012-12-01,"Children walk with activists in a torch light rally ahead of World AIDS Day in Kolkata, India, Friday, Nov. 30, 2012. The activists demanded monthly pension and free ration facilities for sex workers and HIV/AIDS affected people. (AP Photo/Bikas Das)",https://img.huffingtonpost.com/asset/5badcddc250000320037a12f.jpeg?ops=scalefit_720_noupscale,"As we observe 2012 World AIDS Day on December 1, we approach this day -- which brings people together for the purpose of increasing HIV/AIDS awareness -- with our focus on this year's theme, ""Getting to Zero"" (theme for years 2011-2015). Moving towards zero HIV infections, zero AIDS related deaths and zero discrimination will require community solidarity, along with public and private partners working together to encourage and foster progress in HIV/AIDS education, prevention, treatment and care. Since the theme's inception in 2011, numerous challenges such as war, terrorism, natural disasters and economic calamities have pushed for community and governments' prioritizing, while HIV funding has been hit with continued cuts, which assist to exacerbate the debilitating effects of HIV and the mortality rate of AIDS. All has not been lost in the desperate fight to bring relief to a people (black) disproportionately impacted by HIV/AIDS. In the year 2012 ""Ending AIDS"" has become the prophetic call to community. As we turn the tide of this pandemic together, ""Ending AIDS"" is a ""war cry"" from the bowels of love demanding the passionate and compassionate merging of gifts, talents and skills within communities to overcome that (AIDS) which has already taken so much of God's precious life from us. With all the great medical strides gained through research, improving the quality of care and treatments, one would assume all populations' numbers would decline. Data acquired from The Henry I. Kaiser Family Foundation HIV/AIDS Policy Fact Sheet shows black Americans have been ""disproportionately affected by HIV/AIDS since the epidemic's beginning, and that disparity has deepened over time."" Blacks account for more new HIV infections, AIDS diagnoses, people estimated to be living with HIV disease, and HIV related deaths than any other racial/ethic group in the U.S. Today, there are approximately 1.2 million people living with HIV/AIDS in the U.S., including approximately 545,000 who are Blacks in the U.S.Since the beginning of AIDS, faith's hands have played an incredible role in healing and restoration, and as pastors and congregants become more informed and take the necessary actions to be empowered to prevent the transmission and/or spread of AIDS, the number of hands belonging to faith will increase, and the community will be better for it. The church is a cornerstone of black community, and as communities of faith increases their HIV/AIDS knowledge base and engage the process to end AIDS, so shall we see a significant decline in transmission rates for black people.Slowly but surely, 30-plus years into the AIDS pandemic, we are witnessing tenacity, strength and resilience unfold in our ranks. These qualities are entrenched in our history, for at the core of the black struggle is the absolute capacity to overcome and survive against the odds. In the early days of the epidemic, those qualities lacked in the fight against AIDS for many communities, including institutions of faith, as many still are paralyzed by HIV stigma. With federal, state, city and local budgets strained by deficits, without passionate and strategic planning and advocacy, it is difficult for many leaders to prioritize HIV/AIDS prevention, education, services, care and treatment. There are only a few entities responding to this health crisis with the urgency it warrants. Collaborative partnerships within community neighborhoods are proving to be the way to maximize efficacy and capacity to fulfill the mission of meeting the needs of the community. An example of such a successful collaborative partnership is the one forged between Love Alive International Foundation, Watchful Eye, Intersections of the Triad , Brooklyn Medical Plaza, Black Veterans for Social Justice, Benjamin Banner High School, and MOCADA Museum -- all located in Brooklyn working together to make services more available and accessible, while successfully maximizing resources for the greater impact of meeting the community needs, as they fulfill their perspective missions."
