,category,headline,authors,link,short descr,date,image_caption(s),image_link(s),article
7,POLITICS,"Seriously, Stop Saying Marco Rubio Is The Moderate Candidate",Jonathan Cohn,https://www.huffingtonpost.com/entry/rubio-moderate-conservative_us_56cf3f46e4b0871f60ea66cb,He's more conservative than most Republican senators.,2016-02-25,"If Rubio somehow got the nomination, he'd probably be the most conservative GOP candidate in modern history.",https://img.huffingtonpost.com/asset/default-missing-image.jpg?cache=jIO2VoZgTY&ops=scalefit_720_noupscale,"Five candidates will be onstage in Texas for Thursday’s Republican presidential debate. But only three of them still have a plausible path to the nomination. And while real estate mogul Donald Trump is the clear front-runner, many political observers think Sen. Marco Rubio (R-Fla.) remains the most likely to overtake him.One reason is that these political professionals and analysts still think of Rubio as something of a kinder, gentler alternative to either Trump or Sen. Ted Cruz (R-Texas). Sometimes they call Rubio “mainstream,” as MSNBC’s Nicole Wallace did the other night. Sometimes they call him “moderate,” as Commentary’s Noah Rothman did last month. As the theory goes, Rubio's ability to win over less conservative voters could allow him to pick up the votes he needs to stop Trump -- and claim the nomination for himself. Maybe he could. But calling Rubio a moderate is just plain crazy. By any reasonable definition, Rubio is not just conservative. He is very, very conservative. You can even prove it with numbers, thanks to a widely used statistical method for measuring ideology.It’s called DW-NOMINATE, which is an acronym for “Dynamic and Weighted Nominal Three-Step Estimation.” Two political scientists, Keith Poole and Howard Rosenthal, developed the first version in the 1980s and have been tinkering with it ever since.DW-NOMINATE produces a numerical score for members of Congress based on their voting records. Efforts to measure political feelings statistically are always crude and the DW-NOMINATE scores are no exception. But they give a pretty good sense of where on the political spectrum elected officials lie, particularly relative to one another.HuffPost Infographic by Alissa SchellerAnd Rubio’s score is awfully telling. Zero in DW-NOMINATE signifies the rough ideological center of American politics. Lawmakers with more liberal voting records have scores less than zero, while lawmakers with more conservative voting records have scores greater than zero. As of the most recent Congress, Rubio’s lifetime voting record is 0.579, which places him firmly on the right end of the Republican caucus. Just nine senators have more conservative voting records than he does.That makes sense, given that Rubio has been among the reliably conservative votes in the Senate on everything from taxes to the treatment of detainees at Guantanamo Bay. And while Cruz is among those nine senators who are even more conservative, the DW-NOMINATE scores, which are based on voting records, don’t take into account the extreme positions that Rubio has taken up in the campaign -- like promising to rescind President Barack Obama’s executive orders on immigration on “day one,” or opposing abortion even in cases of incest or rape. The gap between Cruz and Rubio still exists, but it’s getting smaller.As for Trump, his lack of government service means he has no record on which to base a DW-NOMINATE score. But while Trump is by all appearances the most racist, sexist and xenophobic candidate in the race, he’s also taken up several positions -- like support of government negotiation of prescription drug prices -- that are sharply at odds with conservative orthodoxy.In other words, Trump may be more offensive than Rubio, but he’s probably not more conservative.Rubio himself is trying to make this argument right now, in the hopes it undercuts Trump’s support before it’s too late to stop him. Rubio hasn’t always been the most candid of politicians. But, in this case, he’s right.In fact, while comparisons across historical eras are difficult, a candidate with Rubio’s record would probably be the most conservative Republican nominee for president in modern history.It’s one more sign of just how far the Republican Party has lurched to the extreme fringes of American politics, no matter whom their nominee for president turns out to be."
8,SPORTS,Don't Believe The Derrick Rose Hype,Jordan Schultz,https://www.huffingtonpost.com/entry/dont-believe-the-derrick-rose-hype_us_56cdffa3e4b0ec6725e4d164,"The former NBA MVP has played very well of late, but it's an aberration more than anything else.",2016-02-25,Bulls point guard Derrick Rose has played much better basketball in the 2016 calendar year.,https://img.huffingtonpost.com/asset/56ce10341500002a000b0a0e.jpeg?ops=scalefit_720_noupscale,"No sooner had Derrick Rose declared he was back, than he was sidelined with hamstring tendinitis.The 27-year-old Chicago Bulls point guard was playing his best basketball all season, averaging over 19 points in the 2016 calendar year. Rose's steadiness and renewed sense of confidence stems from no longer having to wear a protective face mask. Amid tremendous dysfunction with a first-year head coach in Fred Hoiberg, along with a front office that was expecting a winner this year and instead got a clunky mix of disappointments, Rose's play has been a pleasant surprise. Unfortunately though, the former league MVP has cemented his legacy as an extremely talented, oft injured player of unfulfilled promise. Bulls fans know all too well that when things with Rose seem too good to be true, it's because they usually are. This recent stretch of production should be viewed as no different.After playing 81 games during the 2010-11 campaign, he combined to play in a mere 100 matches over three seasons. And, in that span, Rose was supplanted by fellow backcourt mate Jimmy Butler -- who caught up with The Huffington Post in 2013 on the verge of his breakout success -- as the clear-cut face of the franchise. Interestingly enough, the former No. 1 overall pick is far more productive with Butler (a two-time All-Star) on the bench and vise-versa. According to ESPN, Butler's scoring increases from 19.4 points per 36 minutes to 24.5 when Rose is out. Moreover, when Butler is out, Rose improves his scoring from 16.8 points to 23.4, per 36. Despite the immense combined talent of both guards, they cannot co-exist at an elite clip together.Rose has proven to be too ball dominant. Furthermore, with Butler recently sidelined with a knee injury, Rose has played some of his best ball yet.Rose's recent surge is not sustainable because he still struggles to shoot the ball proficiently, nor does he get to the rim frequently enough to augment such long-range deficiencies. He has never shot fewer free-throws in his career (3), and his sub-27 percent shooting from 3 is the worst of any starting point guard in the NBA. But even if we can overlook those issues, Rose's key problem -- even with his improved play -- is a lack of overall efficiency. Of the 25 players with a usage rate (the number of possessions a player uses per 40 minutes) of 26 or more, Rose's 13.54 player efficiency rating is the lowest clip.Kobe Bryant offered insight last week into how Chicago's prodigal son can maximize his ability without the top notch athleticism and speed he once possessed.""Derrick is at a position in his career where he'll have to adjust his game,"" Bryant told ESPN. ""And what I mean by that is start using his size a lot more instead of his speed and quickness and start going to the post a little bit more.""While Rose is certainly not at fault for his slew of injuries and diminished athletic ability, adjusting his style to highlight what plus attributes he still has is a necessity. Whether or not he has done so depends on who you ask.And Rose hasn't been shy to voice his opinion either: ""I think I'm a little bit more efficient,"" he said. ""I feel like I'm getting to spots, my spots that I want to get to on the floor, instead of settling.""Perhaps we can attribute his improved production to such a philosophy or maybe new-found confidence. And perhaps it will continue. Then again, when it comes to Derrick Rose, the injury questions always persist, and so too does the reality that he is completely removed from the NBA elite.Email me at jordan.schultz@huffingtonpost.com or ask me questions about anything sports-related on Twitter at @Schultz_Report, and follow me on Instagram at @Schultz_Report. Also, check out my SiriusXM Radio show Tuesdays and Thursdays from 3-6 PM ET on Bleacher Report channel 83."
9,SPORTS,Don't Believe The Derrick Rose Hype,Jordan Schultz,https://www.huffingtonpost.com/entry/dont-believe-the-derrick-rose-hype_us_56cdffa3e4b0ec6725e4d164,"The former NBA MVP has played very well of late, but it's an aberration more than anything else.",2016-02-25,"Despite their individual prowess, neither Butler nor Rose have played well together.",https://img.huffingtonpost.com/asset/56ce0f811500002b000b0a09.jpeg?ops=scalefit_720_noupscale,"No sooner had Derrick Rose declared he was back, than he was sidelined with hamstring tendinitis.The 27-year-old Chicago Bulls point guard was playing his best basketball all season, averaging over 19 points in the 2016 calendar year. Rose's steadiness and renewed sense of confidence stems from no longer having to wear a protective face mask. Amid tremendous dysfunction with a first-year head coach in Fred Hoiberg, along with a front office that was expecting a winner this year and instead got a clunky mix of disappointments, Rose's play has been a pleasant surprise. Unfortunately though, the former league MVP has cemented his legacy as an extremely talented, oft injured player of unfulfilled promise. Bulls fans know all too well that when things with Rose seem too good to be true, it's because they usually are. This recent stretch of production should be viewed as no different.After playing 81 games during the 2010-11 campaign, he combined to play in a mere 100 matches over three seasons. And, in that span, Rose was supplanted by fellow backcourt mate Jimmy Butler -- who caught up with The Huffington Post in 2013 on the verge of his breakout success -- as the clear-cut face of the franchise. Interestingly enough, the former No. 1 overall pick is far more productive with Butler (a two-time All-Star) on the bench and vise-versa. According to ESPN, Butler's scoring increases from 19.4 points per 36 minutes to 24.5 when Rose is out. Moreover, when Butler is out, Rose improves his scoring from 16.8 points to 23.4, per 36. Despite the immense combined talent of both guards, they cannot co-exist at an elite clip together.Rose has proven to be too ball dominant. Furthermore, with Butler recently sidelined with a knee injury, Rose has played some of his best ball yet.Rose's recent surge is not sustainable because he still struggles to shoot the ball proficiently, nor does he get to the rim frequently enough to augment such long-range deficiencies. He has never shot fewer free-throws in his career (3), and his sub-27 percent shooting from 3 is the worst of any starting point guard in the NBA. But even if we can overlook those issues, Rose's key problem -- even with his improved play -- is a lack of overall efficiency. Of the 25 players with a usage rate (the number of possessions a player uses per 40 minutes) of 26 or more, Rose's 13.54 player efficiency rating is the lowest clip.Kobe Bryant offered insight last week into how Chicago's prodigal son can maximize his ability without the top notch athleticism and speed he once possessed.""Derrick is at a position in his career where he'll have to adjust his game,"" Bryant told ESPN. ""And what I mean by that is start using his size a lot more instead of his speed and quickness and start going to the post a little bit more.""While Rose is certainly not at fault for his slew of injuries and diminished athletic ability, adjusting his style to highlight what plus attributes he still has is a necessity. Whether or not he has done so depends on who you ask.And Rose hasn't been shy to voice his opinion either: ""I think I'm a little bit more efficient,"" he said. ""I feel like I'm getting to spots, my spots that I want to get to on the floor, instead of settling.""Perhaps we can attribute his improved production to such a philosophy or maybe new-found confidence. And perhaps it will continue. Then again, when it comes to Derrick Rose, the injury questions always persist, and so too does the reality that he is completely removed from the NBA elite.Email me at jordan.schultz@huffingtonpost.com or ask me questions about anything sports-related on Twitter at @Schultz_Report, and follow me on Instagram at @Schultz_Report. Also, check out my SiriusXM Radio show Tuesdays and Thursdays from 3-6 PM ET on Bleacher Report channel 83."
10,POLITICS,Senate Honors Antonin Scalia With Pointless Resolution Versus Replacing Him,Jennifer Bendery,https://www.huffingtonpost.com/entry/antonin-scalia-senate-supreme-court-nominee_us_56cf4600e4b03260bf75d827,Scalia once lamented that politics were ruining the judicial confirmation process. Look where we are now.,2016-02-25,Mitch McConnell says he won't even meet with President Barack Obama's Supreme Court pick. That's a first.,https://img.huffingtonpost.com/asset/586d6fb6190000ab060e307a.jpeg?ops=scalefit_720_noupscale,"WASHINGTON -- The Senate voted unanimously Thursday to pass a resolution honoring the late Supreme Court justice Antonin Scalia, even as dozens of them are refusing to honor his legacy by filling his empty seat.All 100 senators cosponsored the resolution, which was introduced by Senate Majority Leader Mitch McConnell (R-Ky.) -- the same person who says he won't even meet with whoever President Barack Obama picks to fill Scalia's vacancy, never mind vote on that nominee. Nearly all Republicans are saying it's not fair to let Obama nominate Scalia's replacement since he's in his last year in office, so they won't hold any hearings or votes this year.The resolution commends Scalia for his 29 years on the court and celebrates his love of hunting, the opera, and, ironically, his enforcement of ""the separation of powers contained in the Constitution as a bulwark for individual freedom."" The Constitution requires the president to nominate people to the Supreme Court, and requires the Senate to vote on those nominees, either for or against.If Scalia were around to see how the Senate is responding to his vacancy, based on his previous statements on Supreme Court confirmations, he wouldn't be amused. He's lamented that the process has become too politicized and said he ""wouldn't want to go through it again.""""I am not happy about the intrusion of politics into the judicial appointment process,"" Scalia said in 2004.Six years later, he aired similar frustrations: ""As long as [the Constitution] is subject to revision, you should get used to controversial and absurd political theater when a person is nominated.""McConnell and Sen. Chuck Grassley (R-Iowa), who chairs the Judiciary Committee, are in talks with the White House about meeting with Obama to discuss the Supreme Court vacancy. But they're still holding firm in their position about not holding any hearings on a nominee until he's out of office.""We are working with the White House to schedule a time for a meeting,"" said McConnell spokesman Don Stewart. ""The Leader welcomes the opportunity to reiterate to the President directly that the American people will be heard on this matter, and the nomination will be determined by whoever wins the presidency in the fall."""
11,RELIGION,"Man Allegedly Brandishes Gun, Yells 'All Of You Should Die' To Muslim Couple",Nick Visser,https://www.huffingtonpost.com/entry/st-louis-islamophobia_us_56cd19abe4b0928f5a6dad6e,Local religious leaders have called for the act to be prosecuted as a hate crime.,2016-02-24,An incident in St. Louis has left the local Muslim community in fear after a man brandished a gun at a family house hunting.,https://img.huffingtonpost.com/asset/56cd20f51e0000230070ea24.jpeg?ops=crop_9_112_2439_1856%2Cscalefit_720_noupscale,"A Muslim couple said they were threatened by a man wielding a gun while house hunting in St. Louis, an event emblematic of the growing Islamophobia in America.Rabie and Marwah Ayoub say they were looking for a new home when Leonard Debello asked the family if they were Muslim. They say he then shouted, ""All of you should die,"" before going inside his house to get a weapon and brandishing it at the couple.""This state allows you to carry a gun and shoot you,"" he allegedly said. ""You, your wife and your kids have to die.""An image obtained by local CBS affiliate News 4 appears to show Debello holding a gun while standing outside his home.An officer with the St. Louis County Police Department told The Huffington Post on Tuesday that the case was still under investigation and would be presented to the prosecuting attorney's office, but no action had been taken yet aside from a brief arrest on Sunday. Debello later told News 4 he regretted the incident and had forgotten to take medication for PTSD that day.The St. Louis chapter of the Council on American-Islamic Relations has called for the act to be prosecuted as a hate crime. Faizan Syed, executive director of the chapter, said the event has stoked fear in the city's Muslim community and prompted the local religious council to hold an emergency meeting. He said the incident wasn't just directed at the Ayoubs, but rather the entire Muslim faith.""That's the nature of hate crimes, they don't just target one specific individual or family,"" Syed said. ""The crime itself has implications for a group and the effects happen to everybody within our community.""Syed said the rhetoric coming from the Republican Party during the presidential primaries, particularly from businessman Donald Trump, has ""definitely mainstreamed Islamophobia,"" and that acts of hate have spiked in the city.The three leading Republican candidates, Trump, Florida Sen. Marco Rubio and Texas Sen. Ted Cruz, have all stood by increasingly frightening anti-Muslim campaigns.""We now feel and we now see that it's almost an OK reality to target Muslims, to bully Muslim kids,"" Syed said, while noting this isn't just about Islamophobia. ""In America there is an issue of greater acceptance of intolerance to other people.""During a press conference on Tuesday, Rabie Ayoub said he now feared for his children's safety, as the family currently lives just a few blocks from Debello.“He wasn’t sorry when he pulled the gun, he wasn’t thinking about it. He was ready to shoot. If he shot me, my wife or kids, what’s his apology going to do,” he said.The Huffington Post is documenting this wave of Islamophobic hate for all of 2016. You can take a look at the running tally here.Also on HuffPost:"
12,POLITICS,Ted Cruz Faces A Tough Road Ahead After A Third Consecutive Trump Victory,Marina Fang,https://www.huffingtonpost.com/entry/ted-cruz-nevada-gop-caucus_us_56ccb909e4b0928f5a6d7ac8,All eyes turn to his home state of Texas.,2016-02-24,Republican presidential candidate Sen. Ted Cruz (R-Texas) speaks during a campaign event in Las Vegas on Monday.,https://img.huffingtonpost.com/asset/56ccb9bc1500002a000b08d6.jpeg?ops=scalefit_720_noupscale,"Real estate mogul Donald Trump handily defeated top rivals Sen. Ted Cruz (Texas) and Sen. Marco Rubio (Fla.) in Tuesday's Nevada GOP caucus, setting up a particularly difficult road ahead for Cruz.Trump has now won three straight state contests and appears to be barreling toward the Republican presidential nomination, while Cruz has only won one state, Iowa. Cruz's campaign had hoped to eke out a win in Nevada based on the strength of his political organization and ground game, which helped lead him to a similar victory in the Iowa caucus earlier this month. The caucus format relies on turning out voters who are engaged enough to spend several hours participating in the political process.By contrast, Trump has lagged behind Cruz and Rubio in his organizing efforts, and political observers expressed doubt that the businessman and former reality television star could turn out enough of his ardent supporters to the caucus sites.In addition to his strong ground game, Cruz relied on help from anti-government voters who may have supported Cliven Bundy, the Nevada rancher who held a standoff with federal authorities. In an ad released last week, Cruz vowed to privatize all the state’s public lands -- including its national parks, forests and monuments.Nevada's results set up an interesting battle in the crucial Super Tuesday states next week. These events will test whether Cruz can rein in Trump's dominance and plot a successful long-term strategy to win the nomination.The Texas senator, a conservative firebrand seen as an anti-establishment and evangelical alternative in the race, has seen some of his support base usurped by Trump. Exit polls in Nevada showed Trump defeating Cruz among voters who identified as conservative or evangelical.Across the country, Trump has proven formidable among voters who favor a smaller government and socially conservative values and above all, blame Washington for what they perceive as American weakness and failure. Trump has promoted a message of economic populism, promising to bring jobs and economic growth, which appeals to many lower-income GOP voters.Cruz has also had trouble courting party loyalists and establishment types, who will become essential to a general election victory if he manages to blunt Trump's dominance and win the GOP nomination. Rubio has scored a number of endorsements among members of Congress and state GOP leaders, including South Carolina Gov. Nikki Haley (R) and Nevada Sen. Dean Heller (R). And establishment types who fear Trump's dominance may continue to rally around Rubio rather than Cruz.Cruz's campaign continues to face criticism for mudslinging and ""dirty tricks"" against his rivals. Cruz fired senior aide Rick Tyler on Monday, after Tyler released a video that falsely claimed Rubio was dismissive of the Bible. Trump has also called Cruz's tactics ""sleazy.""The Texas senator now pins his hopes on his home state, whose voters will head to the polls on Super Tuesday. He will have to win big and pick up the state's 155 delegates if he wants to change the dynamics of a race that continues to favor Trump. Editor's note: Donald Trump is a serial liar, rampant xenophobe, racist, misogynist, birther and bully who has repeatedly pledged to ban all Muslims -- 1.6 billion members of an entire religion -- from entering the U.S."
13,CRIME,"Test Drive Leaves Car Salesman Dead, Driver Facing DUI Charges",Nina Golgowski,https://www.huffingtonpost.com/entry/test-drive-kills-salesman_us_56cdb160e4b0ec6725e47c27,Witnesses say the red Corvette was driving around 70 mph when it crashed into a tree Tuesday.,2016-02-24,"Alex Mark Demetro, 28, of Union City, California (left), faces felony charges after a test drive that killed Warren Smale, 43, of Montclair, California. ",https://img.huffingtonpost.com/asset/56cdba7b1500002b000b0973.png?cache=HPpoCekoRI&ops=crop_494_314_803_508%2Cscalefit_720_noupscale,"A car salesman is dead after a test driver, allegedly under the influence of drugs, drove their Corvette into a tree, authorities said.Alex Mark Demetro, 28, faces vehicular manslaughter and felony driving under the influence of drugs charges following Tuesday’s horrific crash in Ontario, California.Witnesses told KTLA that the red sports car was driving at speeds around 70 mph when it lost control and crashed into a tree just before 1 p.m.Warren Smale, a 43-year-old CarMax salesman from Montclair, California, was rushed from the scene to a hospital, where he died, KABC reported.Smale's co-workers gathered at the crash site Tuesday night, covering it with candles and flowers.""He was the guy at work that it didn't matter what kind of day you were having, he was there for you,"" Lydia Garrett told KTLA. ""He would make you laugh. He would make you smile.""She added that he ""probably had no clue"" what was about to happen to him -- he was just doing his job.Witness Paul Romo told KTLA that the tragedy made him realize how ""fragile"" life is.""That guy had no idea today would be his last day when he showed up to work today,"" he said.In a statement released by CarMax, the dealership expressed their heartbreak over the loss of one of their own under such circumstances.""Today is an incredibly sad day for the CarMax family. Our hearts and prayers go out to our colleague's family. CarMax is working closely with local authorities,"" they stated.Also on HuffPost:"
