,category,headline,authors,link,short descr,date,image_caption(s),image_link(s),article
8,POLITICS,One Oily Administration After Another,"Tom Engelhardt, ContributorEditor, TomDispatch.com",https://www.huffingtonpost.com/entry/one-oily-administration_b_5958404.html,"Buoyed by the country's boom in energy wealth, our president has been putting oil to work abroad. He has been using energy as the spear of his already highly militarized foreign policy. The result has been a sophisticated weaponization of oil that puts the energy mavens of the Bush administration to shame.",2014-10-09,"In this Tuesday, Feb. 21, 2012 photo, an oil drilling rig drill into the Gypsum Hills near Medicine Lodge, Kan. An emerging oil boom has been sparked by modern technologies using horizontal drilling and a technique known as hydraulic fracturing, or ?fracking,? to coax out oil and gas. The potential production from the Mississippian Lime formation here - and its impact on domestic energy supplies - remains uncertain. But the use of the technology to unlock energy supplies previously unavailable in the United States is now in play in places like Pennsylvania, Wyoming, Colorado, New Mexico, Texas, Oklahoma and Louisiana. (AP Photo/Orlin Wagner)",https://img.huffingtonpost.com/asset/5bb8d8d624000031005773a2.jpeg?ops=scalefit_720_noupscale,"You remember. It was the oiliest of administrations. The president was a (failed) West Texas oilman. The vice-president had been the CEO of the giant oil field services company, Halliburton, and before taking office, when speaking at the Petroleum Institute and elsewhere, was known to say things like, ""The Middle East, with two-thirds of the world's oil and the lowest cost, is still where the prize ultimately lies."" The national security adviser, Condoleezza Rice, long on the board of Chevron, had a double-hulled oil tanker named for her. They were a crew with the global flow of oil and how to control it on the brain. Just in case you forgot, and I know you haven't, the new vice president had barely taken office and set up an ""energy task force"" to develop future policy that he himself would chair when a parade of top oil executives began arriving at the White House to meet secretly with it.And then, after 9/11, came the assault on the oil heartlands of the planet. I'm sure you remember how, amid the chaos of a burning Baghdad, American troops were ordered to guard only the buildings of Iraq's Oil and Interior Ministries, and... well, I don't really have to review all of that for you, do I? Then, of course, Americans put into office the guy who swore he was going to end oil wars and attend to our global warming future instead -- a fellow named Barack Obama who, everyone knew, would step into office without an oil slick in his head.That was then and this is now. The Barack Obama of 2014 is essentially running a drill-baby-drill White House in a country where oil consumption is actually rising. His administration has been opening up ever more coastal areas to exploration and drilling from the East to the Arctic waters of Alaska, while encouraging the creation of a ""Saudi America"" in the American frack lands. The result: a torrent of crude oil and natural gas and something else as well, as Michael Klare points out today in ""Obama's New Oil Wars."" Buoyed by the country's boom in energy wealth, our president has been putting oil to work abroad. He has been using energy as the spear of his already highly militarized foreign policy. The result has been a sophisticated weaponization of oil that puts the energy mavens of the Bush administration to shame. But let Klare tell you the whole grim tale. "
9,ENTERTAINMENT,Hilary Duff Says Aaron Carter Makes Her 'Uncomfortable',Cavan Sieczkowski,https://www.huffingtonpost.com/entry/hilary-duff-aaron-carter-watch-what-happens-live_n_5958444.html,,2014-10-09,WATCH WHAT HAPPENS LIVE -- Pictured: Hilary Duff -- (Photo by: Charles Sykes/Bravo/NBCU Photo Bank via Getty Images),https://img.huffingtonpost.com/asset/5bb4806a240000500056190a.jpeg?ops=scalefit_720_noupscale,"Aaron Carter is not a topic of conversation Hilary Duff wants to discuss. The actress sat down with Andy Cohen for an episode of ""Watch What Happens Live"" Wednesday when Cohen broached the subject of her ex-boyfriend. Duff and Carter dated over a decade ago when they were just 13 years old, but in March, Carter revealed he still carries a torch for Duff in a particularly candid series of tweets. Cohen asked about the public declarations of love, which made Duff shake her head. ""Andy, I'm gonna hurt you right now,"" she said. ""I mean it's ... oh, I don't know. I don't know what to say about it. It was so many years ago. I literally haven't seen him in ... so it's uncomfortable."" ""He's just feeling you on Twitter publicly,"" Cohen said. ""It's nice to be felt,"" she responded. Last month, Duff told Buzzfeed she and Carter don't know each other. That is when the ""I Want Candy"" singer backed off a bit. ""I don't know Hilary, either. She don't know me and I don't know her,"" he told Wenn. ""I just need to shut up now about it. I think it's time. She's got a kid and she's married and I'm not trying to be that dude. That's not my intention. Hilary will always hold a very special place in my heart.""After breaking up with Carter, the 27-year-old went on to date Joel Madden and marry Mike Comrie in 2010. She and Comrie are parents to 2-year-old son, Luca. ""I would love to have more kids,"" Duff told Cohen. ""I mean, I am obsessed with Luca. He's everything ... I would love to. I think right now I'm busy getting back into work and my new record is my current baby, or my second baby. But I would like to in the future have more kids, yeah."" "
10,IMPACT,"Interview with Wendell Pierce, Part Three: Solutions, Local and Beyond (and Zimbabwe)","James Beard Foundation, ContributorPreserving America's diverse culinary heritage and future",https://www.huffingtonpost.com/entry/interview-with-wendell-pi_2_b_5946842.html,"We're holding Health Month on the JBF blog. In this post, we conclude our extended interview series with actor and activist Wendell Pierce, exploring his views on potential solutions to issues of food access, both locally and globally.",2014-10-08,2014-10-07-WendellPierceSeanHagwellphotographyRESIZED.jpeg,https://images.huffingtonpost.com/2014-10-07-WendellPierceSeanHagwellphotographyRESIZED-thumb.jpeg,"By Maggie Borden, James Beard FoundationThe 2014 JBF Food Conference, taking place October 27-28 in New York City, will explore the intersection of food and health. Our speakers and panelists will discuss the myriad ways in which food supports personal and public health; fails to deliver on the promise of better health; and both drives and responds to other cultural forces in America today.In anticipation of this two-day event, we're holding Health Month on the JBF blog. In the post below, we conclude our extended interview series with actor and activist Wendell Pierce, exploring his views on potential solutions to issues of food access, both locally and globally.--JBF: How can government-based initiatives and the private sector best work together to combat issues of food security?WP: It's a crisis, so all hands on deck. Of course there's going to be discussions of strategy, what some people think is beneficial, what others think. I say that we try them all, because all of them contribute to everything. Sterling Farms takes advantage of the Healthy Fresh Food Initiative. It's part of the Farm Bill specifically written for American businesses that choose to bring a grocery store into a designated food desert.Then there's the Let's Move campaign, which is educating kids early on. And then you have advocacy from nonprofit groups like the Alliance for a Healthier Generation, where I'm a board member. We have programs in over 3,000 schools. The Healthy Fresh Food Initiative of the Farm Bill, the advocacy of the First Lady, and the nonprofit world--I'm happy to be a part of all of them. Instead of having a debate about which strategy works best, I challenge people to ask, ""What is going to be your contribution to changing the paradigm?"" By the mere fact that we're different, we're going to have a multitude of different solutions brought to the table. JBF: In New Orleans or beyond, are there any companies or initiatives that you've been inspired by?  WP: One of the things I'm proudest of is the new culinary arts discipline at my high school, New Orleans Center for Creative Arts. These young chefs are learning to put together a five-star tasting menu along with the best red beans and rice, and actually have their own sustainable urban farm. We're teaching the chefs of the future to interact with the community, and showing them how the culinary arts can actually change the paradigm.We have to teach that new generation to look beyond fine dining and the celebrity world and notice the local, everyday people who have really influenced cuisine and cooking. That's what makes Anthony Bourdain so appealing. You know that you can take him anywhere and he appreciates how people connect with their food, and how they deliver that food to their community.I was in Zimbabwe, which is isolated from the world right now, and I'll never forget seeing rush hour on a Friday in Harare. People can't use their cars, and the buses are few and far between because they can't afford the gas. Masses of people are literally walking home down the middle of the street. And in the median? Corn, collard greens. They've taken any piece of land and they are farming. It amazed me because I immediately saw that this was the ultimate food desert. That should be celebrated as one of the most courageous and bravest acts demonstrated through food, and it left an impression on me.I think about all the community gardens around the country, and the endless possibilities if we called on grocers to give them a distribution arm. I'm a believer that everyone has a role to play. The more the merrier. Those people in Zimbabwe, the community gardener in South Los Angeles, that farmer's market in Michigan, and Whole Foods and Publix and Le Bernadin and Daniel--we are all of the same world. And there but by the grace of God go I. --Maggie Borden is assistant editor at the James Beard Foundation. Find her on Twitter and Instagram."
11,SPORTS,How the Washington Nationals Won Over a Young Atlanta Braves Fan,"John A. Tures, ContributorPolitical science professor, LaGrange College in Georgia",https://www.huffingtonpost.com/entry/how-the-washington-nation_b_5948212.html,"If Major League Baseball wants to keep winning fans back, and promote good sportsmanship, they'll do the little things like this.",2014-10-08,2014-10-07-10660353_832336643467724_5869701066364253202_n.jpg,https://images.huffingtonpost.com/2014-10-07-10660353_832336643467724_5869701066364253202_n-thumb.jpg,"Zachary Taylor Tures, now age 7, was named for a fighter who became president of the United States of America. He doesn't get in trouble at school for brawling, but he appreciates a good sports rivalry, especially with any team that locks horns with his favorite sports franchise: the Atlanta Braves.First he despised the New York Mets. Then it was the Philadelphia Phillies. The St. Louis Cardinals took their turn when they won a one-game playoff with the Braves. Last year, it was the Los Angeles Dodgers, who prevailed over the Braves in the NLDS playoffs last year.But as the Washington Nationals heated up their rivalry with the Atlanta Braves this year, you could see this coming. And when Nationals star Bryce Harper scuffed over the Atlanta Braves logo in the dirt during a critical summer game, Zach turned to me and announced ""I HATE THE NATIONALS!""It becomes an obsession, of course. He enjoyed watching Atlanta relief pitcher Craig Kimbrel mow down the visiting Nationals. In addition to checking on the Braves performance, he wanted to hear if the Nationals lost. Every time they did, he got a wicked grin on his face.But it was not the Braves' year. Too few runs cost the team a chance at the playoffs. The Nationals eventually clinched the division in Atlanta, just as I had lined up tickets for the next night. It was a Wednesday, but it was also Tom Glavine bobblehead doll night, the first Braves pitcher dad ever watched in an Atlanta game back in 1991 in Houston.Our heavily discounted tickets were right next to the Washington Nationals bullpen. Most Atlanta fans were polite to the visitors, but some took exception to the Nationals' celebration of clinching the playoffs at Turner Field the night before. There were a few uses of profanity, and a single finger salute directed to the Washington players, who absorbed it as if it was no big deal.Curiosity got the better of Zach. Used to watching Braves Bullpen Coach Eddie Perez, who chatted it up with him last year, the seven-year-old crept over to see what those enemy Washington players were up to.The Washington coach waved off Zach, then stopped, as if thinking the better of it. He called back Zach and tossed him a ball, which Zach caught. The little guy was positively bug-eyed at the kind gesture by the hated rivals.Toward the end of the game, I saw Nationals pitcher Tyler Clippard, an All-Star reliever, look our way. ""Hey Tyler!"" I called out. ""Would you autograph the baseball?"" He gave a furtive glance around, then nodded. A moment after Kimbrel finished off the last Washington batter to preserve a 3-1 win for Atlanta, Clippard signed the ball for Zach, who looked just as amazed as he was to get the ball from ""those evil Nationals"" in the first place. It was a moment to treasure.On the way back, Zach, who plays a decent game of coach pitch baseball, announced ""You know dad, I don't hate the Nationals anymore. In fact, if I got drafted by Washington, I think I actually would play for them.""If Major League Baseball wants to keep winning fans back, and promote good sportsmanship, they'll do the little things like this. And this playoff season, they got at least one additional fan, hoping they'd make their first World Series ever, since the Braves were out of it, of course.  John A. Tures is a professor of political science at LaGrange College in LaGrange, Ga. He can be reached at jtures@lagrange.edu."
12,SPORTS,How the Washington Nationals Won Over a Young Atlanta Braves Fan,"John A. Tures, ContributorPolitical science professor, LaGrange College in Georgia",https://www.huffingtonpost.com/entry/how-the-washington-nation_b_5948212.html,"If Major League Baseball wants to keep winning fans back, and promote good sportsmanship, they'll do the little things like this.",2014-10-08,2014-10-07-10612786_832334780134577_7433583129212773173_n.jpg,https://images.huffingtonpost.com/2014-10-07-10612786_832334780134577_7433583129212773173_n-thumb.jpg,"Zachary Taylor Tures, now age 7, was named for a fighter who became president of the United States of America. He doesn't get in trouble at school for brawling, but he appreciates a good sports rivalry, especially with any team that locks horns with his favorite sports franchise: the Atlanta Braves.First he despised the New York Mets. Then it was the Philadelphia Phillies. The St. Louis Cardinals took their turn when they won a one-game playoff with the Braves. Last year, it was the Los Angeles Dodgers, who prevailed over the Braves in the NLDS playoffs last year.But as the Washington Nationals heated up their rivalry with the Atlanta Braves this year, you could see this coming. And when Nationals star Bryce Harper scuffed over the Atlanta Braves logo in the dirt during a critical summer game, Zach turned to me and announced ""I HATE THE NATIONALS!""It becomes an obsession, of course. He enjoyed watching Atlanta relief pitcher Craig Kimbrel mow down the visiting Nationals. In addition to checking on the Braves performance, he wanted to hear if the Nationals lost. Every time they did, he got a wicked grin on his face.But it was not the Braves' year. Too few runs cost the team a chance at the playoffs. The Nationals eventually clinched the division in Atlanta, just as I had lined up tickets for the next night. It was a Wednesday, but it was also Tom Glavine bobblehead doll night, the first Braves pitcher dad ever watched in an Atlanta game back in 1991 in Houston.Our heavily discounted tickets were right next to the Washington Nationals bullpen. Most Atlanta fans were polite to the visitors, but some took exception to the Nationals' celebration of clinching the playoffs at Turner Field the night before. There were a few uses of profanity, and a single finger salute directed to the Washington players, who absorbed it as if it was no big deal.Curiosity got the better of Zach. Used to watching Braves Bullpen Coach Eddie Perez, who chatted it up with him last year, the seven-year-old crept over to see what those enemy Washington players were up to.The Washington coach waved off Zach, then stopped, as if thinking the better of it. He called back Zach and tossed him a ball, which Zach caught. The little guy was positively bug-eyed at the kind gesture by the hated rivals.Toward the end of the game, I saw Nationals pitcher Tyler Clippard, an All-Star reliever, look our way. ""Hey Tyler!"" I called out. ""Would you autograph the baseball?"" He gave a furtive glance around, then nodded. A moment after Kimbrel finished off the last Washington batter to preserve a 3-1 win for Atlanta, Clippard signed the ball for Zach, who looked just as amazed as he was to get the ball from ""those evil Nationals"" in the first place. It was a moment to treasure.On the way back, Zach, who plays a decent game of coach pitch baseball, announced ""You know dad, I don't hate the Nationals anymore. In fact, if I got drafted by Washington, I think I actually would play for them.""If Major League Baseball wants to keep winning fans back, and promote good sportsmanship, they'll do the little things like this. And this playoff season, they got at least one additional fan, hoping they'd make their first World Series ever, since the Braves were out of it, of course.  John A. Tures is a professor of political science at LaGrange College in LaGrange, Ga. He can be reached at jtures@lagrange.edu."
13,BUSINESS,Noah's Ark Theme Park Plans To Only Hire People Who Believe Biblical Flood Actually Happened,,https://www.huffingtonpost.com/entry/noahs-ark-theme-park-bible-hire_n_5955900.html,,2014-10-08,"FILE - In this July 7, 2011 file photo, Mike Zovath, co-founder of Answers in Genesis ministries, poses for photos at the Ark Encounter headquarters in Hebron, Ky. The ark will be the centerpiece of a proposed $170 million religious theme park that has been approved for $40 million in taxpayer-funded incentives. A state tourism board gave preliminary approval on Tuesday, July 29, 2014, for up to $18 million in tax rebates for the proposed full-sized replica of Noah's Ark as described in the book of Genesis. An independent consultant will now study the feasibility of the project and make a recommendation for the board to consider. (AP Photo/Dylan Lovan, File)",https://img.huffingtonpost.com/asset/5bb314603c000032000c4868.jpeg?ops=scalefit_720_noupscale,"By Steve BittenbenderLOUISVILLE, Ky., Oct 8 (Reuters) - The developer of a Noah's Ark-based theme park in Kentucky said on Wednesday he would fight for his religious rights after state officials warned he could lose millions in potential tax credits if he hires only people who believe in the biblical flood.Ark Encounter, which is slated to open in 2016 in Williamston, Kentucky, is not hiring anyone yet, but its parent company Answers in Genesis asks employees to sign a faith statement including a belief in creationism and the flood.State officials and Ark Encounter lawyers have exchanged letters in which the state threatened not to proceed with tax incentives for the park if there was discriminatory hiring practices, a state official confirmed on Wednesday.The letters between the parties came to light after the Louisville Courier-Journal and the Lexington Herald-Leader obtained them through open records requests.""We're hoping the state takes a hard look at their position, and changes their position so it doesn't go further than this,"" Ark Encounter's Executive President Mike Zovath told Reuters.Zovath, who is also co-founder of Answers in Genesis, said that if tax incentives for the project are withdrawn because it does not give written assurances the state now seeks, it would violate the organization's First Amendment and state constitutional rights.Plans for the park include a wooden replica of the ark during the $73-million first phase and other biblical-themed attractions will be added in phases. The project has been financed through donations and bonds, but Zavath said the state's incentives could help finance future phases.In July, Ark Encounter, LLC, received preliminary approval to collect a rebate from a portion of the sales tax revenues generated at its park.The tourism tax credit is potentially worth more than $18 million over a 10-year period.Zovath said the state has added a requirement about hiring practices that is not part of the existing tourism tax credits law.But a state official said on Wednesday that everybody knows laws regarding hiring practices and that the states doesn't need to elaborate them for companies seeking incentives.""We expect all of the companies that get tax incentives to obey the law,"" Gil Lawson, communications director for the Kentucky Tourism, Arts and Heritage Cabinet, said. (Editing by Fiona Ortiz, Brendan O'Brien and Sandra Maler)"
14,HEALTHY LIVING,Dallas Hospitals Set Up Ebola Wards As City Watches For Spread,,https://www.huffingtonpost.com/entry/dallas-hospitals-ebola-ward_n_5955960.html,,2014-10-08,"A sign points to the emergency room at Texas Health Presbyterian Hospital where Thomas Eric Duncan, the Ebola patient who traveled from Liberia to Dallas, is being treated Saturday, Oct. 4, 2014, in Dallas. Duncan remains in isolation, where he was listed in critical condition Saturday. At the end of the week, Texas health officials said they had narrowed to about 50 the group of people they were monitoring who had some exposure to Duncan. (AP Photo/LM Otero)",https://img.huffingtonpost.com/asset/5b9e55d7250000320036d071.jpeg?ops=scalefit_720_noupscale,"By Richard ValdmanisDALLAS, Oct 8 (Reuters) - Hospitals in Dallas have set up Ebola isolation wards and revamped procedures to deal with new patients, as the sprawling Texas city waits to see if the deadly virus spreads following the first case diagnosed on U.S. soil.Some 48 people are being monitored by health officials in Dallas after Thomas Eric Duncan, a Liberian visiting family in Dallas, came down with the disease in late September. He died early on Wednesday, hospital officials said.Ebola's incubation period can last as long as three weeks, but victims typically start showing symptoms within 10-14 days, making this week crucial, according to state officials.Children's Medical Center said it has set up an isolation unit for possible Ebola cases in part because five of the people that are being monitored after they were exposed to Duncan were children.""We sincerely hope these preparations are nothing more than a drill,"" the hospital said in an emailed statement.Parkland Memorial Hospital and Baylor University Hospital, both in Dallas, also said they have isolation wards available to treat Ebola patients, and have geared up screening procedures and staff training.Duncan's case has put a spotlight on U.S. efforts to combat Ebola, which has killed nearly 4,000 people in West Africa since March in the worst outbreak on record.Duncan was admitted to Texas Health Presbyterian Hospital on Sept. 28, two days after having initially been sent home with antibiotics by the hospital.Liberian officials have also accused Duncan of lying on his exit questionnaire about whether he had been in contact with anyone infected with Ebola, raising questions about the effectiveness of airport screening.The United States will begin new screening procedures for incoming air passengers at five major airports to help curb Ebola's spread, the White House said on Wednesday.Duncan arrived in Dallas Sept. 20.Texas Health Presbyterian hospital said on Wednesday another man had been admitted after reporting contact with Duncan's family and feeling ill. The CDC described the person as someone who ""does not have definite contact with Ebola or definite symptoms of Ebola.""Many Dallas residents said they were taking the Ebola scare in stride.""I'm not scared. If you keep your hands washed, and be prudent, there's nothing to worry about,"" said Brian Bay, 33, a nursing student from Dallas.A spokeswoman for the Texas State Fair in Dallas said the annual event, running from Sept. 26 to Oct. 19, had a record opening day attendance this year, despite the Ebola scare.""It does not appear that this has affected the fair,"" spokeswoman Karissa Schuler said, adding the organizers had made more hand sanitizer available this year. (Writing by Richard Valdmanis. Editing by Andre Grenon)"
