,category,headline,authors,link,short descr,date,image_caption(s),image_link(s),article
17,RELIGION,Cardinal: Catholic Church Will Not Budge On Divorce,,https://www.huffingtonpost.com/entry/cardinal-raymond-burke-divorce_n_5915882.html,,2014-10-04,"US cardinal Leo Raymond Burke walks on St Peter's square after a cardinals' meeting on the eve of the start of a conclave on March 11, 2013 at the Vatican. Cardinals will hold a final set of meetings on Monday before they are locked away to choose a new pope to lead the Roman Catholic Church through troubled times. AFP PHOTO / JOHANNES EISELE (Photo credit should read JOHANNES EISELE/AFP/Getty Images)",https://img.huffingtonpost.com/asset/5bb7f02d25000094003a0b22.jpeg?ops=scalefit_720_noupscale,"(RNS) Public disagreements over whether the Roman Catholic Church can change its teachings on Communion for remarried Catholics are growing sharper on the eve of a major Vatican summit, with conservatives led by U.S. Cardinal Raymond Burke making another push against loosening the rules.In a conference call with reporters on Tuesday (Sept. 30), Burke, who currently heads the Vatican’s high court, singled out the leading proponent of reforms, German Cardinal Walter Kasper, and his claims that critics of his proposals are really attacking Pope Francis.Kasper has said that the pope supports his efforts to find ways to fully reintegrate divorced and remarried Catholics into church life. The proposals have become a prime focus of the upcoming Vatican meeting, called a synod, which will convene on Sunday for two weeks to consider changes in family life in the modern world.“I find it amazing that the cardinal claims to speak for the pope,” said Burke, the former archbishop of St. Louis, speaking from Rome. “The pope doesn’t have laryngitis. The pope is not mute. He can speak for himself. If this is what he wants, he will say so.”“But for me as a cardinal to say that what I am saying are the words of Pope Francis? That to me is outrageous,” said Burke, who is reportedly set to be sidelined by Francis to a largely ceremonial post as patron of the Knights of Malta, a global church society based in Rome.Burke also said whatever Francis thinks about a more lenient approach on Communion for remarried Catholics, the pope can’t change current church teaching because he and all bishops “are held to obedience to the truth” about marriage, and that cannot change.Burke’s comments were echoed by others on the call and represent the latest effort by church conservatives to try to head off any possibility that the bishops and cardinals meeting at the Oct. 5-19 synod would open the door to changing any Catholic teaching, especially on marriage.Under current church law, divorced Catholics who remarry without first obtaining a church annulment — a complicated and sometimes expensive venture — are barred from Communion because they are considered to be living in sin. Critics say the practice alienates otherwise faithful Catholics and perpetuates the stigma around divorce.The high-level summit will cover a range of other hot-button issues, such as same-sex partners and the rise of cohabiting couples. The discussions will set out a road map for discussions at a larger, follow-up synod in 2015 where bishops could decide to make changes in church policies, or leave things as is.The focus of the debate as the process gets underway has come down to whether the church can change its doctrines or practices at all — and that argument has come down to whether Rome could allow divorced and remarried Catholics to receive Communion.Kasper, with the encouragement of Francis, last February opened the debate with a lengthy lecture to the world’s cardinals in which he said the church could and should adopt a more merciful approach to Catholics living in unorthodox relationships.A test case for such adaptations, Kasper said, is on Communion for the divorced and remarried. Kasper said that would not require changing church teaching on the indissolubility of marriage but only on the “discipline” related to receiving Communion.Opponents, including Burke, say that you can’t separate the discipline from the doctrine without undermining Christianity’s moral truths. They’ve become increasingly vocal and organized in lobbying against the reformers.* Earlier this week some 48 mainly conservative Catholic clergy and intellectuals — as well as prominent evangelical leaders such as Rick Warren – published an open letter to Francis and the synod delegates urging them not to dilute church teaching on marriage but to fight secularizing trends that they say have weakened marital standards. * This month, Burke and several other influential cardinals in the Roman Curia, including Cardinal Gerhard Mueller and Cardinal George Pell, collaborated on a book designed to counter Kasper’s ideas. * All told, as many as 10 cardinals aligned with the hierarchy’s conservative wing have written in opposition to Kasper.In an interview this week, Kasper expressed confidence that bishops at the back-to-back synods would ultimately back some change, and he hit back at critics like Burke, saying they are engaged in political maneuverings. He said they are afraid that any changes would lead to a “domino effect.”“This is all linked to ideology, an ideological understanding of the gospel that the gospel is like a penal code,” Kasper, who is retired from a curial job but lives in Rome, told America magazine.Critics of change in church policies are displaying “a theological fundamentalism which is not Catholic.”“If fear is at work,” he said, “fear is always a bad counselor. The church should not act out of fear. The church should be the people of hope.”"
18,CRIME,Hundreds At Harvard Receive Shooting Threats,,https://www.huffingtonpost.com/entry/harvard-shooting-threats_n_5930466.html,,2014-10-04,"UNITED STATES - SEPTEMBER 03: Harvard banners hang outside Memorial Church on the Harvard University campus in Cambridge, Massachusetts, U.S., on Friday, Sept. 4, 2009. Community activists in Allston, a section of Boston across the Charles River from Harvard's main campus in Cambridge, say university delays have left a (Photo by Michael Fein/Bloomberg via Getty Images)",https://img.huffingtonpost.com/asset/5ba2c84b2000003000feca22.jpeg?ops=scalefit_720_noupscale,"CAMBRIDGE, Mass., Oct 3 (Reuters) - Hundreds of students and staff at Harvard University received emails on Friday from a sender who threatened to come to the Ivy League school ""tomorrow"" and shoot them, according to campus police.The Harvard University Police Department said it could not verify that the threat was authentic but said it would step up security around the university's campus, centered in Cambridge, Massachusetts, just outside Boston, over the weekend.Boston-area residents have been on an elevated state of alert since a pair of homemade bombs were set off at the city's marathon in April 2013, killing three people and injuring 260.University police said they had alerted the Federal Bureau of Investigation and local law enforcement.Parts of the elite university were also evacuated in December when the school received a bomb threat from a person who turned out to be a student trying to get out of taking a final exam. That student was later arrested and is facing federal charges of making a hoax bomb threat. (Reporting by Scott Malone; Editing by Eric Beech)"
19,SPORTS,Sandy Koufax Chose His Faith Over The World Series And Still Won It All,Chris Greenberg,https://www.huffingtonpost.com/entry/sandy-koufax-yom-kippur-world-series_n_5930556.html,,2014-10-04,"MINNEAPOLIS, MN - OCTOBER 14: Picher Sandy Koufax of the Los Angeles Dodgers winds up to throw a pitch against the Minnesota Twin in game 7 of the 1965 World Series, October 14, 1965 at Metropolitan Stadium in Minneapolis, Minnesota. The Dodgers won the series 4 games to 3. Koufax was the series MVP and played for the Dodgers from 1955-66. (Photo by Focus on Sport/Getty Images)",https://img.huffingtonpost.com/asset/5bb76ef82600003600834cf2.jpeg?ops=scalefit_720_noupscale,"On the field, Sandy Koufax wasn't just any baseball player. Off the field, he wasn't viewed that way either. The Hall of Fame pitcher isn't just remembered by baseball fans as ""the man with the golden arm,"" but is revered by his Jewish admirers as ""the left arm of God"" for his talent as well as the public observance of his faith, most notably during the 1965 World Series. A legendary left-handed pitcher who spent his entire career with the Dodgers, Koufax dominated batters like few ever have, atop mounds in Brooklyn and Los Angeles -- as well as just about every major league locale in between. His preternatural gifts -- notably that knee-buckling curve and relatively overlooked fastball -- earned him three Cy Young Awards and all-time great status in an injury-shortened career that lasted from 1955 through 1966. Five years after retiring at the age of 30, Koufax became the youngest player ever inducted into the Baseball Hall of Fame in 1971.For many Jewish fans, he was something even more important than a plaque in Cooperstown. The lanky, reserved product of Lafayette High School in Brooklyn was a role model for young Jewish boys -- and girls -- who dreamt big league dreams while also bolstering the hopes of Jewish adults who hoped to find success or even simply acceptance in an America they may have felt viewed them as outsiders.Koufax's roles as Jewish talisman and big league superstar intersected during the 1965 World Series. The opening game of series between Koufax's Dodgers and the Minnesota Twins was scheduled for the afternoon of Oct. 6, the date of Yom Kippur. The holiest day of the year for Jews, Yom Kippur is the annual holy day of atonement that is set aside for fasting, religious service and repentance.It is not a day for pitching in the World Series, even if you're the ace of the team representing the National League fresh off a historic Cy Young Award-winning season that included the eighth perfect game in MLB history. Koufax told Dodgers manager Walter Aston that he would not be available to pitch because it was a holy day. ""By refusing to pitch that day, Koufax became inextricably linked with the American Jewish experience,"" wrote author Jane Leavy in her bestselling biography of the pitcher published in 2002. ""He was the New Patriarch: Abraham, Isaac, Jacob and Sandy. A moral exemplar, and single too! (Such a catch!)""Reserved to the point of being considered reclusive, Koufax chose to speak little of his decision or his faith through the years. His few comments suggest the choice to remove himself from consideration for the start was not difficult to make.“Respect,” Koufax responded before the 2014 season when asked by Jewish Week why he sat out the game. He would also tell the publication that he felt ""no pressure"" from his teammates to start the game. With Koufax unavailable, Alston gave the ball to Don Drysdale, a right-handed power pitcher who was named the 1962 Cy Young Award winner and earned his own spot in the Hall of Fame. Despite his own formidable talents, Drysdale struggled against the Twins in the series opener, surrendering seven runs over just 2.2 innings. When Alston came to the mound to remove him from the game, Drysdale quipped, ""I bet right now you wish I was Jewish, too,"" according to ESPN.com. The Dodgers would lose Game 1, 8-2.Back in uniform for the second game, Koufax was unable to even the series, giving up two runs over six innings as the Dodgers suffered a 5-1 loss. After the Dodgers won the next two games, Koufax twirled a complete-game, four-hit shutout in Game 5. The Twins would win Game 6 to force a winner-take-all Game 7. With Koufax on just two day's rest by virtue of having started the second and fifth games of the series rather than the first and fourth, Alston still gave him the ball. He wouldn't regret it. With the World Series hanging in the balance, Koufax pitched another complete-game shutout, allowing just three hits as the Dodgers won the decisive game 2-0. Tired and struggling with his curve as the game advanced, Koufax turned to his fastball in the later innings as Drysdale, with an extra day's rest, waited in case he was needed.Koufax would be named the World Series MVP and later Sports Illustrated's Sportsman Of The Year for 1965. Plagued by an arthritic left arm, he would retire after just one more sterling season. But his legacy was assured. Not only was he the pitcher that every lefty would be measured against, but he had broadened the horizon for innumerable Jewish kids. ""There are three things any self-respecting Jewish boy should want to grow up to be: a doctor, a lawyer, or Sandy Koufax,"" Alan Siegel wrote for The Atlantic in 2010. "
20,POLITICS,Joe Biden Apologizes For Saying Turkey Admitted To Border Security Failures In ISIS Fight,Igor Bobic,https://www.huffingtonpost.com/entry/joe-biden-erdogan_n_5932234.html,,2014-10-04,"Vice President Joe Biden speaks to students faculty and staff at Harvard University's Kennedy School of Government in Cambridge, Mass. Thursday, Oct. 2, 2014. (AP Photo/Winslow Townson)",https://img.huffingtonpost.com/asset/5bb8d86f250000cf003a54ea.jpeg?ops=scalefit_720_noupscale,"Vice President Joe Biden phoned Turkish President Recep Tayyip Erdogan on Saturday to offer a mea culpa for his recent remarks on Turkey's role in confronting Islamic State militants in neighboring Syria.Following a speech that touched on foreign policy at the Harvard Kennedy School on Thursday, Biden recounted a recent conversation he had with Erdogan, whom he called an ""old friend."" The vice president suggested that the Turkish leader had admitted that Turkey made mistakes by allowing foreign fighters allied with the Islamic State, also known as ISIL, to cross into Syria.""[Erdogan] said: 'You were right. We let too many people through.' Now they're trying to seal their border,"" Biden said.On Saturday, Erdogan warned that Biden would become ""history for me"" if he did not apologize. ""I have never said to him that we had made a mistake, never. If he did say this at Harvard, then he has to apologize to us,"" Erdogan said, according to the Associated Press. ""Foreign fighters have never entered Syria from our country. They may come to our country as tourists and cross into Syria, but no one can say that they cross in with their arms.""According to a statement from his office provided to The Huffington Post, Biden called to ""clarify"" his remarks and to apologize for ""any implication that Turkey or other Allies and partners in the region had intentionally supplied or facilitated the growth of ISIL or other violent extremists in Syria.""""The Vice President made clear that the United States greatly values the commitments and sacrifices made by our Allies and partners from around the world to combat the scourge of ISIL, including Turkey,"" the statement read. ""The two leaders reaffirmed the importance of Turkey and the United States working closely together to confront ISIL.""The spat follows the Turkish parliament's vote on Thursday to authorize military force against the Islamic State, opening the door for greater cooperation with the U.S. and its allies in the ongoing airstrike campaign against extremists in Iraq and Syria.Biden's remarks on Turkey are not the only ones from the speech to make headlines. When a questioner in the audience introduced himself as the vice president of the Harvard student body, Biden said, ""Isn't that a bitch?"""
21,HEALTHY LIVING,CDC Keeps Passengers On Plane At Newark Airport After Man Shows Ebola-Like Symptoms,Amanda L. Chan,https://www.huffingtonpost.com/entry/newark-ebola-united-flight-cdc_n_5932166.html,,2014-10-04,"United Airlines jets are seen at the gate at Newark Liberty International Airport, Tuesday, July 22, 2014, in Newark, N.J. In a sign of increased caution about flying near combat zones, U.S. and European airlines halted flights to Israel Tuesday after a rocket landed near Tel Aviv's Ben Gurion Airport. Delta Air Lines and United Airlines suspended service between the U.S. and Israel indefinitely. The actions come days after a Malaysia Airlines jet was shot down over eastern Ukraine with 298 people on board. (AP Photo/Julio Cortez)",https://img.huffingtonpost.com/asset/5b9e53cf250000350036cfaf.jpeg?ops=scalefit_720_noupscale,"Officials said on Saturday that a sick passenger and his daughter that were taken off a flight from Brussels to Newark over fears he might have Ebola, does not have the disease, ABC News reported. The pair, who are believed to be from Liberia, had been escorted off the plane by officials in HAZMAT gear from the Centers for Disease Control.After being taken to University Hospital in Newark for examination, his ""flu-like symptoms"" were determined to not be related to Ebola.""After an examination by physicians at University Hospital, the symptoms of one individual were found to be consistent with another, minor treatable condition unrelated to Ebola,"" said University Hospital spokeswoman Donna Leusner. ""The second individual, who was traveling with the patient, was asymptomatic. The two individuals will be released with self-monitoring.""CDC members in hazmat gear removed the passenger — whose identity has not been released — and his daughter from United Flight 998, ABC News reported, as other passengers stayed on the plane. The remaining passengers were allowed to leave a short time later.CBS News reported that a passenger was vomiting on the plane. United Airlines issued a statement on the incident:On Oct. 4, upon arrival at Newark Airport from Brussels, medical professionals instructed that customers and crew of United flight 998 remain on board until they could assist an ill customer. We are working with authorities and will accommodate our customers as quickly as we can.This story is developing..."
22,POLITICS,Flag That Flew Over Capitol On 9/11 Destroyed In Flight 93 Memorial Fire,AP,https://www.huffingtonpost.com/entry/911-capitol-flag-flight-93-memorial-fire_n_5932658.html,,2014-10-04,"A fire began about 3 p.m. and grew to include both the Flight 93 park office and park headquarters, according to a Somerset County emergency dispatcher. (AP Photo/Courtesy of National Park Foundation)",https://img.huffingtonpost.com/asset/60d422722600001a2951ec2a.jpeg?ops=scalefit_720_noupscale,"SHANKSVILLE, Pa. (AP) — A flag that flew over the U.S. Capitol on Sept. 11, 2001, was consumed in a fire at the Flight 93 National Memorial in Pennsylvania, the National Park Service said Saturday.Friday's fire in Shanksville destroyed the park's headquarters complex. State police and the park service are conducting a joint investigation into the blaze, whose cause hasn't been determined, the park service said.Park staff completed an initial inventory Saturday and said that, in addition to the flag, the losses included a handful of personal items of passengers and crew, DVD copies of the annual commemoration ceremony and meetings of the Flight 93 National Memorial Federal Advisory Commission, and about 100 tribute items left by visitors since 2001.Park staff saved hundreds of oral histories and a photo collection.The buildings comprised the park's headquarters, with conference facilities, storage space and the superintendent's office. The under-construction memorial and visitors center are about 2 miles away and were unaffected by the fire.The memorial in Shanksville marks the spot where United Airlines Flight 93 crashed during the Sept. 11 attacks. The plane, which was traveling from Newark, New Jersey, to San Francisco, went down in a reclaimed strip mine after passengers fought back against its hijackers. All 33 passengers and seven crew members were killed along with the hijackers.A memorial plaza was completed in time for the 10th anniversary of the attacks in 2011. There are plans for a 93-foot-tall tower with 40 wind chimes.Officials have said they hope construction of the visitors center will be finished by June."
23,ENTERTAINMENT,NBC Can't Get Enough 'Peter Pan',,https://www.huffingtonpost.com/entry/nbc-peter-pan_n_5926384.html,,2014-10-03,Hell-raisers: The Boys season 3 shakes up prestige TV with superhero debauchery,https://imagesvc.meredithcorp.io/v3/mm/image?url=https%3A%2F%2Fstatic.onecms.io%2Fwp-content%2Fuploads%2Fsites%2F6%2F2022%2F05%2F23%2FThe-Boys-32_2.jpg,
24,WORLDPOST,Major European Country To Recognize State Of Palestine,,https://www.huffingtonpost.com/entry/sweden-state-of-palestine_n_5926370.html,,2014-10-03,"Palestinian protesters wave the national flag during a demonstration against the decision by Israel to expropriate 400 hectares (988 acres) of land near the West Bank village of Wadi Fukin on September 26, 2014. Israel announced last week its biggest land grab in the West Bank since the 1980s, saying it planned to expropriate 400 hectares (988 acres) of land in the south of the territory, between the cities of Bethlehem and Hebron. AFP PHOTO/ MUSA AL SHAER (Photo credit should read MUSA AL-SHAER/AFP/Getty Images)",https://img.huffingtonpost.com/asset/5cc13e38240000d30b51af43.jpeg?ops=scalefit_720_noupscale,"STOCKHOLM, Oct 3 (Reuters) - Sweden's new center-left government will recognize the state of Palestine in a move that will make it the first major European country to take the step, Prime Minister Stefan Lofven said on Friday.The U.N. General Assembly approved the de facto recognition of the sovereign state of Palestine in 2012 but the European Union and most EU countries, have yet to give official recognition.""The conflict between Israel and Palestine can only be solved with a two-state solution, negotiated in accordance with international law,"" Lofven said during his inaugural address in parliament.""A two-state solution requires mutual recognition and a will to peaceful co-existence. Sweden will therefore recognize the state of Palestine.""For the Palestinians, Sweden's move will be a welcome boost for its ambitions.With its reputation as an honest broker in international affairs and with an influential voice in EU foreign policy, the decision may well make other countries sit up and pay attention at a time when the Palestinians are threatening unilateral moves towards statehood.However, there is likely to be strong criticism of Sweden from Israel, as well as from the United States and the EU, which maintain that an independent Palestinian state should only emerge through a negotiated process.Within the EU, some countries, such as Hungary, Poland and Slovakia recognize Palestine, but they did so before joining the 28-member bloc.If the center-left government fulfills its plans, Sweden would be the first country to recognize Palestine while being a member of the European Union.The Social Democrats and Greens hold a minority of seats in parliament and the incoming center-left government is likely to be one of Sweden's weakest for decades.The former center-right government would not recognize Palestine as the Palestinian authorities did not control their territory.The Palestinians want an independent state in the West Bank and Gaza, with its capital in East Jerusalem. While Gaza's boundaries are clearly defined, the precise territory of what would constitute Palestine in the West Bank and East Jerusalem will only be determined via negotiations with Israel on a two-state solution, negotiations which are currently suspended. (Reporting by Johan Ahlander Additional reporting by Luke Baker in Jerusalem; Editing by Alison Williams)"
