,category,headline,authors,link,short descr,date,image_caption(s),image_link(s),article
10,BLACK VOICES,Of Course Tom And Jerry Was Racist. The Question Is What to Do About That.,,https://www.huffingtonpost.com/entry/tom-jerry-racist_n_5931948.html,,2014-10-04,A poster for Joseph Barbera and William Hanna's 1950 cartoon 'The Framed Cat'. (Photo by Movie Poster Image Art/Getty Images),https://img.huffingtonpost.com/asset/5badffe0240000500054cfa4.jpeg?ops=scalefit_720_noupscale,"Is that cartoon cat racist? Amazon Prime and iTunes now feature a warning for Tom and Jerry cartoons from the 1940s and 1950s, which notes that they “may depict ethnic and racial prejudices that were once commonplace in American society.”Read more on Slate"
11,WORLDPOST,Rival Protesters Face Off In Hong Kong,,https://www.huffingtonpost.com/entry/hong-kong-rival-protesters_n_5931152.html,,2014-10-04,"Pro-democracy protesters (R) protect a barricade from rival protest groups (L) in the Mongkok district of Hong Kong on October 4, 2014. Hong Kong has been plunged into the worst political crisis since its 1997 handover as pro-democracy activists take over the streets following China's refusal to grant citizens full universal suffrage. AFP PHOTO / Philippe Lopez (Photo credit should read PHILIPPE LOPEZ/AFP/Getty Images)",https://img.huffingtonpost.com/asset/5cc13e412300004d00d0bee9.jpeg?ops=scalefit_720_noupscale,"By Clare Jim and Yimou LeeHONG KONG, Oct 4 (Reuters) - More than a thousand rival protesters, some wearing helmets, faced off in a densely populated, gritty district of Hong Kong on Saturday, fueling concerns that the Chinese-controlled city's worst unrest in decades could take a more violent turn.After a night of trouble which resulted in 19 arrests, supporters of the city's pro-Beijing government rallied next to pro-democracy protesters in Mong Kok, a working class neighborhood near the popular shopping district of Tsim Tsa Shui.Many Hong Kong residents expressed anger and frustration at police handling of the unrest, with some accusing security forces of co-operating with criminal gangs, failing to make arrests and helping some attackers to exit the scene quickly.""We condemn the violence used against Hong Kong civilians yesterday,"" said student leader Joshua Wong.""I find it ironic how people accuse us of being violent and radical and now after one week of peaceful protests the ones who use violence is them - the government that allows Triads to exercise brutality on peaceful protesters.""After a week of largely peaceful demonstrations demanding Beijing grant Hong Kong the unfettered right to choose its own leader, the mood turned ugly on Friday night in an area notorious for being the home of Triads.A rowdy crowd of around 2,000 filled the narrow streets of Mong Kok, one of the world's most densely populated areas, in the small hours of Saturday and the atmosphere was highly charged as police in riot gear tried to keep them under control.Among those detained by police were eight suspected gang members. Eighteen people were injured, including six police officers, according to local broadcaster RTHK.Student activists, established protest groups and ordinary Hong Kongers have joined forces to present Beijing with one of its biggest political challenges since it violently crushed pro-democracy protests in and around Tiananmen Square in 1989.Tens of thousands of protesters have staged sit-ins across Hong Kong over the past week, demanding the city's pro-Beijing leader Leung Chun-ying step down and China reverse a decision made in August to handpick the candidates for Hong Kong's 2017 leadership election.After police fired tear gas against mostly student protesters last weekend, the demonstrations have been largely peaceful.But on Saturday, some pro-democracy supporters - umbrellas in hand and wearing motor-bike helmets, gloves and black leather jackets - braced for trouble. Scores of yellow signs around the site occupied by pro-democracy supporters read: ""Police and mob working together - an alternative violent crackdown.""The pro-Beijing group, Caring Hong Kong Power, that organized the Mong Kok rally on Saturday afternoon said it supported the use of guns by police, if necessary, and also the deployment of the People's Liberation Army (PLA).Hong Kong leader Leung has said the use of PLA soldiers would not be necessary.One of the main student groups behind the ""Occupy Central"" protest movement said it would pull out of planned talks with the Hong Kong government, because it believed authorities had colluded in the attacks on demonstrators in Mong Kok.Secretary for Security Lai Tung-kwok said allegations police were co-operating with the Triads were false.The notorious gangs operate bars, nightclubs and massage parlors across Mong Kok, an area of high-rise apartment blocks across the harbor from the main protest areas.At times over the past week, police have left the streets, saying they wanted to ease tensions, though the reason for their apparent absence from this scene on Saturday morning was unclear.Police have defended their handling of fighting in the area, saying they had exercised ""dignity and restraint and tried our best to keep the situation under control.""But Amnesty International issued a statement criticizing them for ""(failing) in their duty to protect hundreds of peaceful pro-democracy protesters from attacks by counter demonstrators.""The Foreign Correspondents' Club in Hong Kong, the Hong Kong Journalists' Association (HKJA) and local broadcaster RTHK all strongly condemned violent attacks on members of the press during street clashes over the past 24 hours.""Hong Kong is in a turmoil unseen after the 1967 riot. Without an effective monitor of the media, the condition will only deteriorate further, making any rational discussion impossible,"" the HKJA said in a statement.About 1,000 protesters maintained their blockade outside administrative buildings in the city center. PROTESTS ""BUT A DAYDREAM""The ruling Communist Party's official People's Daily, in a front page editorial on Saturday, praised Hong Kong police for their restraint in the face of what it said was lawless protests, including ""poking"" of police with umbrellas.The protests will never spill over into the rest of China, the newspaper added. ""For the minority of people who want to foment a 'color revolution' on the mainland by way of Hong Kong, this is but a daydream.""Facing separatist unrest in far-flung and resource-rich Tibet and Xinjiang, Beijing is standing firm on Hong Kong, fearful that calls for democracy there could spread to the mainland, especially if successful. Demonstrations across Hong Kong have ebbed and flowed since last Sunday, when police used pepper spray, tear gas and batons to break them up in the worst unrest in Hong Kong since the former British colony was handed back to Chinese rule in 1997.At times, tens of thousands of people gathered to block roads and buildings in central areas of the global financial center, bringing them to a virtual standstill.China rules Hong Kong through a ""one country, two systems"" formula underpinned by the Basic Law, which accords Hong Kong some autonomy and freedoms not enjoyed on the mainland and has universal suffrage as an eventual goal.But Beijing decreed on Aug. 31 it would vet candidates who want to run for chief executive at an election in 2017, angering democracy activists, who took to the streets. (Additional reporting by Twinnie Siu, Elzio Barreto, Charlie Zhu, Clare Baldwin, Joseph Campbell, Donny Kwok, James Pomfret, Bobby Yip, Irene Jay Liu, Farah Master, Diana Chan, Kinling Lo, Venus Wu and Anne Marie Roantree in HONG KONG, and Ben Blanchard in BEIJING; Writing by Jeremy Laurence; Editing by Kim Coghill)"
12,WORLDPOST,U.S. Airstrikes Try To Halt ISIS Offensive On Syria Border Town,,https://www.huffingtonpost.com/entry/us-airstrikes-kobani_n_5931110.html,,2014-10-04,"Smoke rises from the Syrian town of Kobane, seen from near the Mursitpinar border crossing on the Turkish-Syrian border in the southeastern town of Suruc, Sanliurfa province, on October 3, 2014. Turkey will do what it can to prevent the predominantly Kurdish town of Kobani, near its border with Syria, falling to Islamic State insurgents, Prime Minister Ahmet Davutoglu said late on Thursday, but stopped short of committing to military action. Hours before Davutoglu's comments, parliament gave the government powers to order cross-border military incursions against Islamic State, and to allow foreign coalition forces to launch similar operations from Turkish territory. AFP PHOTO / BULENT KILIC (Photo credit should read BULENT KILIC/AFP/Getty Images)",https://img.huffingtonpost.com/asset/5cc13e402400003600229675.jpeg?ops=scalefit_720_noupscale,"By Ayla Jean Yackley and Sylvia WestallMURSITPINAR/BEIRUT, Oct 4 (Reuters) - Islamic State forces shelled the Syrian border town of Kobani on Saturday and its Kurdish defenders said they were expecting a new assault to try to capture it.U.S.-led coalition warplanes had struck at Islamic State targets overnight to halt the insurgents' advance and Saturday's barrages were less intense than the previous day.""Clashes continue now, they are shelling on all three fronts. They tried to invade Kobani last night but they were repelled,"" senior Kurdish official Asya Abdullah told Reuters from the town on Saturday.""We think they are planning to launch another big attack but YPG is prepared to resist them.,"" she said, refering to the Kurdish armed group defending it.Previous coalition air strikes have failed to stop the insurgent offensive and an estimated 180,000 people have fled across the border into Turkey to escape the fighting around Kobani - a conflict now overshadowing Syria's wider civil war.Islamic State said they would take the town within days and boasted they would pray in its mosques for the Muslim religious festival of Eid al-Adha, which began on Saturday.In Istanbul, Turkish President Tayyip Erdogan reacted angrily to comments by U.S. Vice President Joe Biden suggesting that Turkey had supported groups in Syria linked to al Qaeda.Turkey has up to now been a reluctant partner in the U.S.-led coalition of Western and regional allaies and the new dispute could complicate international efforts to present a united front against Islamic State.The insurgents stepped up their offensive close to the Turkish border last month, seizing surrounding villages and advancing to within a few kilometers (miles) of Kobani, which is also known as Ayn al-Arab. Its capture would allow Islamic State to consolidate its hold on swathes of territory in Syria and Iraq.Swift offensives by Islamic State since June have sent shockwaves through the region and prompted the United States and its allies to carry out a series of bombing raids to halt the insurgents' rapid advance.Rami Abdelrahman, who runs the Britain-based Syrian Observatory for Human Rights, said several hundred people had been killed on both sides since the assault on Kobani started two weeks ago.The rumble of artillery could be heard on both the eastern and western flanks of the town on Saturday but the barrage was less intense than on the previous day, a Reuters witness said.Coalition warplanes destroyed one insurgent vehicle and killed five fighters during raids in the countryside to the east and south of Kobani on Friday night, the observatory said. Ten Kurdish fighters were also killed in heavy fighting that carried on long into the night. "
13,CRIME,DOJ Asked To Review Troubled Police Department,Simon McCormack,https://www.huffingtonpost.com/entry/baltimore-police-doj-review_n_5931464.html,,2014-10-04,"Baltimore Police Commissioner Anthony Batts speaks at the news conference where Gil Kerlikowske, Director of National Drug Control Policy (ONDCP) and President Obama's top drug policy advisor, released the Obama Administration's National Drug Control Strategy, Wednesday, April 24, 2013, at the Welch Medical Library on the campus of Johns Hopkins School of Medicine in Baltimore, Maryland. (Lloyd Fox/Baltimore Sun/MCT via Getty Images)",https://img.huffingtonpost.com/asset/5ba2c39a2400003100546945.jpeg?ops=scalefit_720_noupscale,"JULIET LINDERMAN, Associated PressBALTIMORE (AP) — Baltimore officials are looking for a U.S. Justice Department review of the city police department's procedures and policies after several cases of use of force by officers have resulted in millions of dollars in legal settlements and public outcry.Commissioner Anthony W. Batts announced Friday that he was asking for a review. The move was backed by Mayor Stephanie Rawlings-Blake, who said in an emailed statement that she welcomed any partners willing to work in reducing excessive force complaints. A day earlier, City Council President Bernard Young sent a letter to outgoing U.S. Attorney General Eric Holder asking federal officials to take a look at the department.Young wrote that cases of people not charged with crimes suffering injuries at the hands of arresting officers ""damage the fragile relationship between the city's police officers and citizens.""Since Batts was appointed in September 2012, he said he has disciplined roughly 30 officers found guilty of misconduct. The cases that resulted in millions in payouts came before Batts became commissioner.On Friday, Batts described the Justice review as a ""collaborative reform process.""""We welcome the examination,"" Batts said. ""We have nothing to hide and everything to gain. Since my arrival I have not been afraid to bring outside reviews. This is in line with my policy that sunlight is the best disinfectant.""A federal review is not the same as an investigation. The review will not focus specifically on misconduct, but on the department's policies. Philadelphia and Las Vegas's police departments have also requested federal reviews.Batts said Friday that he has been in contact with Ronald Davis, director of the Office of Community Oriented Policing Services at the Justice Department, and that Davis agreed to the review.In the past few months Batts has responded quickly to allegations of excessive force. In June, Batts suspended an officer who slit a dog's throat, and last month placed on leave an officer caught on video repeatedly punching a man outside of a liquor store before placing him under arrest. Charges against the man, Kollin Truss, were dropped after prosecutors viewed the footage.""We're moving in the right direction,"" Batts said.But at least one critic said a federal review is too little, too late.""This is definitely not enough,"" said Rev. Cortly ""C.D."" Witherspoon, president of the Baltimore Chapter of the Southern Christian Leadership Conference. Witherspoon said a more thorough investigation into police misconduct is necessary, and suggested that the federal government take over the department temporarily. ""There needs to be an investigative probe. We need to stronger action."""
14,CRIME,"Unease Grows Between Mayor, NYPD",Simon McCormack,https://www.huffingtonpost.com/entry/nypd-nyc-mayor-relationship_n_5931526.html,,2014-10-04,"FILE - In this Sept. 11, 2014 file photo, New York City Police Commissioner Bill Bratton, left, and Mayor Bill de Blasio talk during memorial observances at the site of the World Trade Center in New York. De Blasioￃﾢￂﾀￂﾙs relationship with police, already strained by accusations he sided with frequent NYPD critic Al Sharpton over the chokehold death of an unarmed suspect, suffered another hit with revelations a top aide is living with a convicted killer who has often mocked officers as ￃﾢￂﾀￂﾜpigs.ￃﾢￂﾀￂﾝ(AP Photo/Mark Lennihan, Pool, File)",https://img.huffingtonpost.com/asset/5ba2aca4260000320080aad6.jpeg?ops=scalefit_720_noupscale,"JONATHAN LEMIRE, COLLEEN LONG Associated PressNEW YORK (AP) — New York City Mayor Bill de Blasio's relationship with police, already strained by accusations he sided with frequent NYPD critic Al Sharpton over the chokehold death of an unarmed suspect, suffered another hit with revelations a top aide is living with a convicted killer who has often mocked officers as ""pigs.""Police unions say it's only the latest incident that shows the mayor's lack of support for the 34,000-officer force. And even some de Blasio allies acknowledge the mayor could do a better job of leading the department he is simultaneously trying to reform.""This is difficult terrain, particularly for a new mayor,"" said Eugene O'Donnell, a professor of police studies at John Jay College of Criminal Justice who was on the mayor's transition team. ""Morale has been low on the force and it's only getting worse.""Following a pair of mayors who were largely lockstep with the NYPD, de Blasio was viewed suspiciously by police from the beginning with his fierce push to end stop-and-frisk, the crime-fighting tactic that allowed officers to stop anyone they deemed suspicious but a judge ruled sometimes discriminated against minorities.He drew their ire when he called a police official to inquire about the arrest of a political ally, who was later released. Police said the release had nothing to do with the mayor's request but the unions said the call made it seem like de Blasio was undermining officers.And the latest strain was the revelation that Rachel Noerdlinger, first lady Chirlane McCray's chief of staff and a highly visible face at City Hall, is dating Hassaun McFarlan, who pleaded guilty to manslaughter in a 1993 shooting when he was 15 and later served time for drug trafficking. The news website DNAinfo reported that McFarlan's Facebook page, now taken down, had several posts referring to police as ""pigs.""The city's largest police union has called for Noerdlinger's dismissal over the matter.""It raises serious questions about her judgment and character and the quality of the counsel she provides to City Hall,"" said union head Pat Lynch.Although de Blasio defended Noerdlinger — ""We don't care what someone's boyfriend says,"" he said — the controversy shows no signs of abating. It was revealed that Noerdlinger recently joined McCray for a high-level NYPD crime-fighting briefing while he city's Department of Investigations opened an investigation into whether Noerdlinger failed to disclose that she lived with McFarlan. It later closed the investigation without recommending any disciplinary action.But it's de Blasio's close ties to Sharpton — who is also Noerdlinger's former boss — that has fueled much of the unions' anger.Sharpton spent months denouncing the NYPD for the death of Eric Garner, a black man who died from a police chokehold in July while being arrested for selling loose cigarettes on the street. A grand jury this past week convened to consider possible charges against the white officers involved and the entire police department is being put through use of force retraining.In a City Hall summit called to ease tensions, de Blasio sat awkwardly between Police Commissioner William Bratton and Sharpton, who proceeded to rail against the NYPD, saying the mayor's teenage son, who is black, could also be a ""candidate for a chokehold.""Police unions were outraged that Sharpton was given equal billing with Bratton. That became a central point in a full-page ad taken out by the Sergeant's Benevolent Association in The New York Times opposing the city's bid to host the 2016 Democratic National Convention.""The mayor has provided a public platform to the loudest of the city's anti-safety agitators,"" wrote union president Ed Mullins. The ad also claimed that City Hall's ""diminished support for police officers translates directly into crime spikes and drops in quality of life.""Mayoral aides strongly disputed any suggestion that de Blaiso's leadership over the NYPD had been compromised.""The mayor has nothing but the strongest support for the brave men and women of the NYPD,"" said spokesman Phil Walzak, who noted crime continues to fall.But experts said there are political risks for de Blasio if the complaints grow louder.""The perception that City Hall and the police are not on the same page does not usually sit well with voters,"" said Costas Panagopoulos, political science professor at Fordham University.De Blasio has repeatedly defended Bratton but the perception that Sharpton is given an outsized voice at City Hall has penetrated even the city's elite, as evidenced by a roast at the annual white-tie Alfred E. Smith dinner Wednesday night.""What a crowd tonight,"" Home Depot founder Kenneth Langone said, looking around the ballroom at the Waldorf-Astoria. ""Although I don't see the person in charge of the NYPD up here tonight, Al Sharpton.""De Blasio, who was sitting nearby, smiled at the joke. And when the dinner ended, he hustled to a party for Sharpton's 60th birthday, telling reporters ""The more people criticize him, the more I want to hang out with him."" "
15,ENTERTAINMENT,Why That Character Is Missing From 'Gone Girl' (Spoiler),Lauren Duca,https://www.huffingtonpost.com/entry/gillian-flynn-rolling-stone_n_5932032.html,,2014-10-04,"NEW YORK, NY - SEPTEMBER 26: Author Gillian Flynn attends the 52nd New York Film Festival Opening Night Gala Presentation and World Premiere Of 'Gone Girl' at Alice Tully Hall on September 26, 2014 in New York City. (Photo by Jim Spellman/WireImage)",https://img.huffingtonpost.com/asset/5bb47f212600003001825f76.jpeg?ops=scalefit_720_noupscale,"In a recent interview with Rolling Stone, Gillian Flynn spoke about how she cut down on ""Gone Girl"" to make the book work on film. She discussed ""The Missing White Woman!"" phenomenon, how perfect Ben Affleck was for Nick and why -- spoiler alert -- Desi's mom is missing:[Desi's mom] is in the book for all about four pages, but everyone is fascinated by Desi's mom, including myself. She never made it into the first draft, but that was one of the hard ones [to cut]. I just realized there are all sorts of quirky supporting characters that are just kind of strange little cul-de-sacs in the book that just weren't going to make it into the film. The key to a good adaptation is respecting the incredibly huge differences between a book and a film — and just kind of setting out not to save everything I liked from the book, but saving everything I needed to. It boils down to the plot, which moves everything (and is very hard to disassemble too much) and making these characters believable so you can go to the crazy places that the story goes.  Maybe the really fascinating thing about Desi's mom is that one of her descriptors involves smelling ""vaguely vaginal""? Anyway, filmgoers will have to fill their desire to vaguely sense genitals through the .003 seconds during which we see that little part of Ben Affleck that looks ""better in 3-D.""Head over to Rolling Stone for the full interview."
16,HEALTHY LIVING,Quarantined Family Of Dallas Ebola Patient Finally Moved Out Of Home,Amanda L. Chan,https://www.huffingtonpost.com/entry/dallas-ebola-patient-family-moved_n_5932062.html,,2014-10-04,"A hazardous material cleaner removes a blue barrel from the apartment in Dallas, Friday, Oct. 3, 2014, where Thomas Eric Duncan, the Ebola patient who traveled from Liberia to Dallas stayed last week. The family living there has been confined under armed guard while being monitored by health officials. (AP Photo/LM Otero)",https://img.huffingtonpost.com/asset/5b9e53c22200008300d9fb38.jpeg?ops=scalefit_720_noupscale,"The quarantined family members of Dallas Ebola patient Thomas Eric Duncan have finally been moved from the apartment where they had been living since Sept. 28 -- despite the fact that the Ebola patient’s sweat-stained materials were still in the home -- to another location, city officials said Saturday. The four people include Duncan's partner, Louise, her 13-year-old son and her two nephews, who are in their 20s, CNN reported. According to the network they must stay quarantined until Oct. 19, when the 21-day incubation period for the virus will expire. ""Yesterday, we moved Louise and three brave young men from their apartment in Dallas to a secure location that was provided by a member of the faith community,"" Judge Clay Lewis Jenkins, director of Dallas County's Homeland Security and Emergency Management, said at a press conference. Jenkins said he drove the family to their new temporary home, calling it a ""place where I would put my own family.""Cleaning crews also finally began work on Friday to clean the apartment where Duncan had been staying, CNN reported. County officials acknowledged earlier this week that it had taken some time to find an entity willing to do the work. Officials announced earlier this week that they had to implement a control order for Duncan's family -- which included placing an armed guard outside the apartment -- so that they would remain under quarantine.""The decision to put a control order in place for these individuals was to ensure that we can monitor them as needed,"" Dr. David Lakey, commissioner of the Texas Department of State Health Services, said earlier this week.In addition to news of the family's relocation, health officials also provided updates on those individuals who are still being monitored due to their risk (both high and low) for infection. Nine people are being monitored (including Duncan's four relatives) because they are known to have been in contact with Duncan, while approximately 40 others are being monitored because it's not certain whether they had contact. None of these individuals have exhibited any signs of Ebola, such as fever. "
