,category,headline,authors,link,short descr,date,image_caption(s),image_link(s),article
0,LATINO VOICES,Light-Skinned Latinos Tend To Vote More Republican,Roque Planas,https://www.huffingtonpost.com/entry/lightskinned-latinos-tend_n_5843816.html,,2014-09-18,"DORAL, FL - FEBRUARY 28: U.S. Senator Marco Rubio (R-FL) walks out of the El Arepzo 2 restaurant on February 28, 2014 in Doral, Florida. Rubio and Florida Governor Rick Scott held a meet and greet with the Venezuelan community to discuss the ongoing crisis in Venezuela. (Photo by Joe Raedle/Getty Images)",https://img.huffingtonpost.com/asset/5bae9feb1f0000390122fc38.jpeg?ops=scalefit_720_noupscale,"Lighter-skinned Latinos are more likely to vote Republican, according to polling data analyzed by the Washington Post. The data highlights rarely recognized racial divisions within the Latino community that have perplexed the U.S. Census Bureau and tripped up mass media. But don’t expect it to change too much about the way you understand the Latino vote. Writing for The Washington Post’s Monkey Cage blog on Wednesday, professor Spencer Piston analyzed a sample of Latino citizens interviewed for the 2012 American National Election Studies. Interviewers measured the respondents' skin color. The data show that Hispanics with darker skin were far more likely to vote Democrat than those with lighter skin. In the most dramatic of four cases presented, the analysis estimated that Latinos with the darkest skin showed a 98 percent chance of voting Democrat, while those with the lightest skin showed a 43 percent chance. Despite the variation, Latinos of all skin tones tended to lean more strongly toward identifying as Democrats and voting Democrat in national elections, with the exception of the 2012 U.S. Senate election. The data isn’t too surprising when considering that non-Hispanic whites lean more conservative than people of color. Given that Latinos live in the U.S. and adapt to national ideas about race, one might expect Hispanic voter preferences to reflect, while not necessarily replicate, broader patterns. The predictions Piston makes based on the data, however, are questionable. He writes that the analysis should make us rethink projections suggesting that the growth of the Latino electorate will dilute the Republican vote, which are based on the premise that Latinos tend to vote Democrat. But the projections that Piston disputes measure Latino voters in the aggregate. Unless we expect the number of white Latinos to grow much faster than Latinos of color, or Republicans to get way better at selectively targeting them, there’s no reason to think those projections won’t pan out just because we now have data showing whiter Latinos vote for Democrats in fewer numbers. That information doesn’t change anything, it merely illuminates a phenomenon that was already there. The crux of Piston’s argument is that white Latinos start to identify more strongly as conservatives over time. But he doesn’t explain why the trend would accelerate. Nevertheless, Piston concludes with these words: The coming decades may therefore be characterized by a different kind of partisan polarization than we normally think about: polarization by skin tone. This would give new meaning to the phrase “divided by color,” and if it is indeed what the future holds, it is not at all clear that Republicans are the party with a “race problem.”Maybe. But there’s several reasons to question the prediction that whiter Latinos will become more Republican with time solely because of their racial identification. As a multiracial ethnicity, Latinos view race differently than non-Latinos because so many Hispanics come from a mixed-race background. While racial division and discrimination are undoubtedly part of the Latino experience, Latinos have less fixed ideas about race than non-Latino Americans. Our communities, our social groups and our families are racially mixed in a way that doesn’t exist to the same degree among non-Hispanic white and black Americans. That heritage makes it unlikely that light skin would act as strongly as a predictor of political affiliation in the Latino community as it does among non-Hispanic whites. The light-skinned Latino that Piston assumes will be more likely to vote Republican because he or she hasn’t experienced racial discrimination is likely surrounded by darker-skinned people at home, work, school and church who have. As friends and family, those people are likely to identify with one another, even if their personal experience differs. Latinos also face some forms of discrimination as a group. Resentment against the Spanish language, white American assumptions of cultural superiority and, most prominently, anti-immigrant sentiment, affects Latinos as a group. Because conservatives have embraced these nativist views with more enthusiasm than liberals, expect Republicans to repel Latinos of all races until those ideas are abandoned. The major exception is South Florida, where a largely white and historically conservative Cuban-America community, by sheer force of numbers, has made it culturally unacceptable and politically unviable for local Republicans to mount English-only campaigns or state crackdowns on undocumented immigrants. It is, of course, possible that Piston is right and lighter-skinned Latinos will move en masse toward the Republican Party in the future. And he points out that that political affiliations are less fixed among Latinos than non-Hispanic whites and blacks. But if that were going to happen, why hasn't it happened yet? Light-skinned Latinos today do in fact identify more strongly as Democrats than non-Hispanic whites in the analysis that Piston presents. "
1,WORLDPOST,Obama Is Wrong That ISIS Is 'Not Islamic',"Alastair Crooke, ContributorFmr. MI-6 agent; Author, 'Resistance: The Essence of Islamic R...",https://www.huffingtonpost.com/entry/obama-isis-not-islamic_b_5843830.html,"ISIS, in short, is as Wahhabist -- or more so -- as the Saudi King, Abdullah. There is here, surely, a delicious irony in Obama and Kerry taking upon their shoulders the task of seeking the ""delegitimization"" of the very doctrine from which the Saudi kingdom is derived. The only upholder of ""true Islam"" and custodian of Mecca happens to share the ""same"" Islam as ISIS. How can King Abdullah then denounce it? And how could any Muslim, familiar with the issues, take any such denunciation -- were it to be made -- seriously?",2014-09-18,"TAMPA, FL - SEPTEMBER 17: U.S. President Barack Obama waves as he arrives on stage to speak during a visit to the U.S. Central Command at the MacDill Air Force Base on September 17, 2014 in Tampa, Florida. On stage with him are Defense Secretary Chuck Hagel (L) and General Lloyd Austin, commander of U.S. Central Command. Obama visited the base to receive a briefing from his top commanders at CENTCOM, on the strategy to degrade and destroy ISIL. (Photo by Joe Raedle/Getty Images)",https://img.huffingtonpost.com/asset/5cc13d7d2400005500e4785b.jpeg?ops=scalefit_720_noupscale,"""We are fighting an ideology, not a regime."" - U.S. Secretary Of State John KerryLet us be plain: President Obama's (and Kerry's) basic premise that America and its allies are fighting a deviant, un-Islamic ideology, which must, and can be delegitimized by gathering together the Sunni Arab world to pronounce it ""un-Islamic,"" simply underlines how little they ""know"" about ISIS -- with which they are about to go to war. There is no ""true Islam"" in Islam. There has never been any central ""authority"" in Islam that could define such a thing. For better or worse (mostly for the better), Islam wears many faces. But paradoxically, there is one contemporary orientation that does make the big claim of being ""true Islam"": Wahhabism. As Professor As'ad AbuKhalil notes: ""What Mohammed Ibn 'Abdul-Wahab insisted upon -- and what is followers today insist upon -- is that men with the sword judge on behalf of God here on earth, and on all matters, small and big. This is where the Saudi Kingdom and ISIS fit. They are outside the boundaries of mainstream Islam, in that they refuse to even concede that they speak as representatives of a sect. Wahhabis (of all stripes) protest to even the name of Wahhabis: we are only Muslims, they assert; i.e. they alone are Muslim and everyone else is a kafir [unbeliever] who should be fought as ancient pagans at the time of Mohammad. Wahhabis claim that they represent the 'true Islam' when the strength of Islam throughout the ages is that there is no such thing as 'the true Islam.'""So the only claim to being ""true Islam"" is that proclaimed by Saudi Arabia -- and asserted by ISIS, too. Just to be clear, this joint claim derives from them both sharing the same doctrinal foundation: ʿAbd al-Wahhab's key text, The Book of Monotheism. ISIS, in short, is as Wahhabist -- or more so -- as the Saudi King, Abdullah. There is here, surely, a delicious irony in Obama and Kerry taking upon their shoulders the task of seeking the ""delegitimization"" of the very doctrine from which the Saudi kingdom is derived. So, the only upholder of ""true Islam"" and custodian of Mecca happens to share the ""same"" Islam as ISIS. How can King Abdullah then denounce it? And how could any Muslim, familiar with the issues, take any such denunciation -- were it to be made -- seriously? AND IT IS A STATEJohn Kerry would be right if he said al Qaeda is an ideology and not a regime. But he is wrong about ISIS. Unlike al Qaeda which only had an ""idea,"" ISIS has a clear purpose: to establish God's ""principality"" here and now. It has a doctrine for how to bring such a state into existence (drawn from the wars launched to establish the original Islamic State); it holds a territory greater in size than that of Great Britain; it has large financial resources; it has a handsomely equipped army (courtesy of the U.S., the U.K. and others), one that is led by competent commanders; and it has a leader who, many find, spoke well (on the one occasion that he has appeared publicly). In brief, this development (the ""Islamic State"") may be much more serious, be more grounded, and have much wider appeal than western bluster about ""thugs"" and ""mindless killers"" would imply. THE REAL TARGET OF AMERICA'S ARAB ALLIES IS ASSAD A number of Gulf and Arab states have signed up with Washington to fight ISIS, but only because they plan to insert a Trojan Horse into the ""war"" agenda. Their troops hidden in the belly of the wooden ""horse"" are gathered -- not to fight ISIS -- but to fight a quite different war. They want to turn it into a renewed offensive against President Assad and Syria. Indeed, at their preliminary summit in Jeddah, the Arab States agreed to a new Arab security architecture that would subvert the ""war on ISIS"" into war not just on ISIS, but also on President Assad and all Islamists (plainly they hope to pull the West into a larger war with the Muslim Brotherhood, Hamas, Hezbollah, etc.). Leading Saudi commentator, Jamal Khashoggi made the Saudi plan clear in a recent op-ed: ""We can thus say that eliminating ISIS also calls for the elimination of Assad ... The operation must target Moscow's ally in Damascus and topple him or pave the way to toppling him. Perhaps this is the logical explanation as to why Saudi Arabia approved training camps for the moderate Syrian opposition. It's tantamount to declaring an indirect war on the Syrian regime ... The Jeddah alliance is everyone's opportunity for a new beginning. It is not limited to its immediate task of eliminating ISIS but also includes the possibility of expanding towards reforming the situation in Iraq and Syria.""America's position is the nuanced one that it will not ""coordinate"" with Damascus, but, it will ""deconflict"" (Kerry's words) with it. Syria's armed forces demonstrably have militarily effectiveness, and America knows it -- and the only other game in town (as its expression goes), is ISIS. So, America, it seems, has conceded -- as a sop in order to keep the Gulf engaged -- to some Saudi diversion of the ""war against ISIS"" into a war, retargeted, to unseat President Assad. This reorientation sits comfortably with the Gulf exculpatory narrative that ISIS is no armed neo-Wahhabist vanguard movement, but merely a natural Sunni ""reaction"" that arose out of Assad's and former Iraqi Prime Minister Maliki's sectarian policies. Saudi Arabia will -- as its contribution to defeating ISIS -- then train and arm 5,000 ""moderate"" Syrian oppositionists to return to Syria. The U.S. understands full well that its (and its Saudi sponsor's) objective will be to bring down Assad -- and not to fight ISIS (with whom the Syrian ""moderates"" reportedly coordinate in battle and have a non-aggression pact). Syria's army is 130,000 strong, plus a further 100,000 auxiliaries. It is not likely that Saudi's Syrian brigades -- which have had a dismal record so far -- will bring down President Assad, but they will make U.S. policy incoherent and Syria more bloodstained. If there are two main protagonists in Syria -- the Syrian Army and ISIS -- then America has no choice: It must prefer Assad, but it cannot be seen to be doing so, without offending Saudi Arabia. So America enters the conflict with one arm tied behind its back (by its own Gulf allies). In ISIS' strategically important Syrian backyard, America has no visible and direct partner -- indeed, as former U.S. Ambassador to Iraq and Syria Ryan Crocker commented: ""We need to do everything we can to figure out who the non-ISIS [Syrian] opposition is. Frankly, we don't have a clue"" -- but can only work with Assad in a deniable and indirect way (which it is doing). But the U.S. cannot really hope to prevail against ISIS in such a convoluted manner -- and with its Gulf allies (and many American think tank allies, too -- see here, here and here) trying to muddy the waters by inserting their own Saudi-trained ""moderate"" army in order to weaken Assad at the same time that America is ""deconflicting"" with him. U.S. AIR ATTACKS SEEN AS ANTI-SUNNI, NOT ANTI-ISISEven in Iraq, the anti-ISIS coalition limitations will become more clear. Air attacks will become perceived not as attacks on ISIS but as attacks on the very Sunni communities into which it has merged and melted away. (The Iraqi government already has had to halt such strikes for this reason).The Iraqi Shiite will defend their territories with utmost vigor, but may well choose to stay aloof from entering the Euphrates Valley with its long history as a militant Sunni heartland. Baghdad will not wish to pursue the war into a full-court sectarian conflict, and the Peshmerga will have neither the capability nor the will to do more than protect their own communities. In sum, ISIS may find that there is actually a notable lack of regional will to repair the fracture of Iraq -- but instead a will that seeks to contain it as is.ISIS NOT A THREAT TO AMERICA Is the Islamic State a threat then? It is worth recalling that -- unlike al Qaeda -- ISIS' primary aim is not so much to provoke America into an overreaction and self-implosion (as Bin Laden thought the Afghan war had done to the Soviet Union). ISIS is not, of course, indifferent towards America, but it's primordial focus rather, is on founding God's Principality on earth, and instituting God's Law. It is not surprising then, that U.S. officials say that there is no present threat to the U.S. homeland. ISIS is about seizing territory militarily, securing its frontiers, eliminating idolatry and heresy and physically establishing a Caliphate."
2,RELIGION,Why Oklahoma Rep. John Bennett's Fear Mongering Makes Us Less Safe,"Rev. Dr. Susan Brooks Thistlethwaite, ContributorProfessor of Theology, Chicago Theological Seminary",https://www.huffingtonpost.com/entry/john-bennett-fear-mongering_b_5843862.html,Americans have enough enemies without creating imaginary ones. But that is what Oklahoma Rep. John Bennett is doing by fear mongering against the whole American Muslim community. Bennett is creating imaginary Muslim enemies where none exist.,2014-09-18,"FILE - In this Friday, April 12, 2013 file photo, Oklahoma state Rep. John Bennett, R-Salisaw, the chairman of the counter terrorism caucus, speaks during a news conference in Oklahoma City. On the 13th anniversary of the Sept. 11 attacks, a Muslim civil rights group and Bennett sparred over a comment the lawmaker posted to his Facebook page urging people to ""be wary"" of Muslim-Americans. (AP Photo/Sue Ogrocki)",https://img.huffingtonpost.com/asset/5bb7ef5c2100000001c91b50.jpeg?ops=scalefit_720_noupscale,"Americans have enough enemies without creating imaginary ones. But that is what Oklahoma Rep. John Bennett is doing by fear mongering against the whole American Muslim community. Bennett is creating imaginary Muslim enemies where none exist.Yet, Bennett is standing by his needlessly inflammatory statements, doubling down on comments about American Islam, and saying that ""This is a cancer in our nation that needs to be cut out.""Let's be clear. The biggest threat to the self-aggrandizing extremist group ISIL (Islamic State of Iraq and the Levant) is a prosperous, peaceful American Muslim community. American Muslims as law-abiding American citizens threaten the whole ISIL imaginary cosmic war of Muslims against the ""Great Satan"" of Western countries. Make no mistake. ISIL is a sadistic group of murdering, thieving thugs, but they are estimated at best between 20,000 and 30,000 fighters. When you place those numbers against the power of the United States, and the combined power of the U.S. and its allies, you see how small ISIL actually is.But ISIL itself is in the business of creating an imaginary Muslim through their media strategy. ISIL has a very savvy social media strategy playing the hashtag game on Twitter to magnify their cyber footprint. ISIL is playing us. By projecting every Western nightmare of the black hooded figure killing in a viscerally brutal way, as they did with the filmed execution of James Foley, the fine young journalist they brutally murdered, ISIL is targeting Americans for their fear mongering. They project themselves as larger and more threatening than they really are with that execution image, and now others also brutally murdered, gaming both Americans into fearing them and reaching new audiences for radicalizing and recruitment. Fear mongering in return, especially against an American Muslim community that is roundly condemning ISIL for what it is doing, does not help reduce the threat of ISIL to its proper size so we can deal with them effectively. Fear mongering only magnifies that threat into unrealistic, nightmare proportions and tempts us to behave reactively and hatefully, giving more energy to ISIL rather than using that energy to defeat them.Astonishingly, however, Bennett thinks this hateful fear mongering is compatible with the love ethic of Jesus. ""We need to share his [Jesus'] story, love others and stand for freedom,"" he said, after having called Islam a ""cancer."" Bennett seemed not to see the contradiction. No, it is not what Jesus meant by love to label fellow Americans a ""cancer"" when they have done nothing but hold a different faith than your own. Bennett himself is giving into the spirit of fear, not following the spirit of love. As a Christian pastor and teacher, I know it is unfaithful to give into fear. Jesus frequently teaches his disciples not to be afraid. In Matthew 10, verses 26-31, Jesus is recorded as saying ""do not fear"" three times, as Jesus exposes how the disciples would have cause to fear persecution for following his teachings, but that fear was unfaithful because fear gives over your power to the one threatening you. Don't do that, Jesus teaches. The disciples had plenty to fear from the brutal, sadistic Romans, a vast empire that ruled by fear and intimidation by their own military might and with the help of their local collaborators. The Romans were a real empire, not the bloated self-projection of some group of terrorists who call themselves ISIL. Jesus teaches the disciples to realize their fears are unfaithful, and that giving into fear only magnifies their hatefulness.The fear mongering of someone like Rep. Bennett magnifies hatred, and creates imaginary Muslim enemies where there are none. Instead of creating imaginary Muslims to fear, let us come together as Americans and as people of different faiths and humanist values to stand firm against the reality of the brutality of ISIL and confront it together. That is the only sure way we can be safe as Americans. And for me, as a Christian, that is the way of faithfulness."
