,category,headline,authors,link,short descr,date,image_caption(s),image_link(s),article
25,ENTERTAINMENT,We Finally Know Details About 'Star Wars: Rogue One',Bill Bradley,https://www.huffingtonpost.com/entry/star-wars-rogue-one-details_n_7096810.html,,2015-04-19,"LAS VEGAS - MAY 29: The opening title from the Star Wars film series is shown on screen while musicians perform during 'Star Wars: In Concert' at the Orleans Arena May 29, 2010 in Las Vegas, Nevada. The traveling production features a full symphony orchestra and choir playing music from all six of John Williams' Star Wars scores synchronized with footage from the films displayed on a three-story-tall, HD LED screen. (Photo by Ethan Miller/Getty Images)",https://img.huffingtonpost.com/asset/5bb4b330240000310097a94b.jpeg?ops=scalefit_720_noupscale,"The galaxy is about to get a lot less far, far away.The world was just given new hope with the ""Star Wars: The Force Awakens"" trailer, and now we also know details of the first stand-alone film, ""Star Wars: Rogue One."" The info came courtesy of Lucasfilm's Kathleen Kennedy and director Gareth Edwards on Sunday at the Star Wars Celebration in Anaheim, California.The film will reportedly be a prequel to ""New Hope"" and involve a rebel plot to steal plans for the Death Star, which the ""Star Wars"" Twitter account confirmed:Edwards also revealed that the plot would follow ordinary people who don't necessarily have the ability to use The Force. A teaser, which appeared to be shown at the event, already leaked online, but it has yet to be officially released. ""Rogue One"" is set to hit theaters on Dec. 16, 2016.Another ""Star Wars"" film, which will be directed by Josh Trank, remains untitled; however, it is set for release in 2018."
26,BUSINESS,The Soul of Photography,"Kevin O'Leary, ContributorRepeat entrepreneur, chairman of O'Shares, bestselling author,...",https://www.huffingtonpost.com/entry/the-soul-of-photography_b_7097072.html,"I bought my first camera, a Soviet made Zenit-E SLR, in 1970. I still have the first roll of black and white 35mm film that I developed. The smell of developer and fixer from the countless hours I have spent in darkrooms is still imprinted in my brain. To this day I always carry a camera.",2015-04-19,2015-04-19-1429486140-3622584-ArmenianChurchWorshippersRW.jpg,https://images.huffingtonpost.com/2015-04-19-1429486140-3622584-ArmenianChurchWorshippersRW.jpg,"I bought my first camera, a Soviet made Zenit-E SLR, in 1970. I still have the first roll of black and white 35mm film that I developed and the images I printed from it, scratches and all. The smell of developer and fixer from the countless hours I have spent in darkrooms is still imprinted in my brain. Over the years I was able to upgrade my equipment and to this day I always carry a camera. Like everybody else that is into photography, I bought my first digital camera in 2000. I was fascinated by the technology and like a lustful teenager I dumped my Leica M3 film camera for my new digital girlfriend, a Canon. For the next ten years I continued to upgrade from one digital camera to another. The resolution kept getting better and the software that drove the cameras more sophisticated. As an investor and television host I continued to travel the world and captured images that I could have only dreamed about when I was a teenager in my high school photo club. Today I have tens of thousands of photographs from dozens of countries. Last year I was moving some boxes in our basement and I came across one with no label on it. I opened it and there it was, my Leica M3 film camera. I had not held it in over a decade. I picked it up and immediately felt the familiarity of its curves. Shooting with a Leica is like learning how to ride a bicycle, once you know how you never forget. I cocked the camera and to my amazement I felt the resistance of 35mm film advancing through the shutter. There was still un-developed film in it. The camera counter showed 22 images had been exposed so I rewound the film and opened the back. It was a roll of 35 mm Kodak TRI-X ASA 400, the favorite film of my youth. I had no idea what was on that film or even if it would still be good having been in the camera for over a decade. I had dismantled and sold off my dark room many years prior, so I had no way to develop it. I went on the web and searched for a lab that was still processing black and white film. To my surprise there were still several labs active. I brought the roll in and explained to the technician what had happened. He warned me that leaving the roll inside a camera for 6 months was a bad idea, let alone over a decade. The lab said they would process it but made me agree that if it was destroyed by the developer bath it was not their liability. I agreed and left my cell number. A few days later my phone rang, it was the lab. ""You should come in and see this, you are not going to believe what you have here."" I was shooting Shark Tank on the Sony MGM studio lot in LA that day so I had no way to get back to the lab which was on the other side of the country. The technician suggested I should not touch or take the processed negatives out of their sleeve holders, as they were extremely delicate and maybe brittle. Instead they had done a high resolution scan to disk that could be viewed on a Mac. The more he talked to me the more I wanted to see the images. I asked him to email me one. Moments later I felt my phone vibrate and I opened his email. What I saw blew me away. During the years that the film had sat in the camera body the silver nitrate emulsion had begun to break down and had crystalized on the surface of the film leaving ghostly geometric streaks across the image. The pictures looked like they were from another world. They were absolutely stunning. I leaned over and showed my phone to Daymond John who was sitting to my right on the Shark Tank set. ""What the hell is that?"" he exclaimed. Exactly, I thought. The Leica M3 camera that I had jilted over a decade ago gave birth to images unrivaled by any of the thousands of digital images I had taken since. No Photoshop here, this was organic reality. It was karma. It changed my mind about everything in my photographic world. I don't care what anyone says about digital images, they can't rival photographs taken on film, period. Today my Lieca M3 is my number one camera again. I carry a digital SLR too but if I have to choose, I draw the Leica first. Today I favor Ilford HP5 Plus 400 and Kodak 400 TMAX. You can still buy it. I process it at a lab, do a low resolution scan of the roll and archive the original negatives. When I want to make an archival print I go back to the original negative and do a very high res scan with an Imacon Flextight Film Scanner. We print from that. Proof you can keep the soul of film in your work but take advantage of what digital offers. Many Hollywood directors are doing the same thing these days. They shoot their movie on 70mm film and transfer it to digital for the edit. I am not against using digital technology in the photographic arts. Far from it. For example in the 1987 test print made from a traditional old school enlarger of the Armenian Church Worshipers, the partially hidden face on the far left was not evident. The negative was exposed in extremely low light and ""pushed"" in processing but was still very thin. Over 20 years later scanning the same negative with the Imacon unlocked the secret face and changed the feel of the whole image, more mysterious I think. The point is it all starts on film. That is where the soul of the image is born. Encouraged by the ghostly Leica airshow images, I decided to exhibit my work to the public. For the majority of the work I went back to my original negatives and selected images from across 4 decades. To my surprise we sold $97,000 worth of photography the opening night. I donated the profit to teenage entrepreneurs in grades 11 and 12 across the country. If you would like to buy one of these images to support a teen entrepreneurs contact Laura Davidson at ldavidson@olearyventures.com . The prints are huge 57.5"" X 42.5"" so you are going to need some wall space. They are framed in painted white lacquer wood flat low profile frames with an archival print behind UV resistant non-reflective glass. There is a limited signed edition of 25 of each image. They cost $6,000 plus applicable taxes and shipping. I recently visited a lawyer's office to have some signature pages notarized. While waiting in the reception an image caught my eye. It was mine, the photograph of the man walking in Kiev in 1986. The firm's art curator had cataloged it into their collection. It had a plaque with my name on it. I often characterize lawyers as life forms found just above single cell amoebas. Not that day."
27,BUSINESS,The Soul of Photography,"Kevin O'Leary, ContributorRepeat entrepreneur, chairman of O'Shares, bestselling author,...",https://www.huffingtonpost.com/entry/the-soul-of-photography_b_7097072.html,"I bought my first camera, a Soviet made Zenit-E SLR, in 1970. I still have the first roll of black and white 35mm film that I developed. The smell of developer and fixer from the countless hours I have spent in darkrooms is still imprinted in my brain. To this day I always carry a camera.",2015-04-19,2015-04-19-1429486192-4948604-15CORRECTIONRETOUCHFINAL.jpg,https://images.huffingtonpost.com/2015-04-19-1429486192-4948604-15CORRECTIONRETOUCHFINAL.jpg,"I bought my first camera, a Soviet made Zenit-E SLR, in 1970. I still have the first roll of black and white 35mm film that I developed and the images I printed from it, scratches and all. The smell of developer and fixer from the countless hours I have spent in darkrooms is still imprinted in my brain. Over the years I was able to upgrade my equipment and to this day I always carry a camera. Like everybody else that is into photography, I bought my first digital camera in 2000. I was fascinated by the technology and like a lustful teenager I dumped my Leica M3 film camera for my new digital girlfriend, a Canon. For the next ten years I continued to upgrade from one digital camera to another. The resolution kept getting better and the software that drove the cameras more sophisticated. As an investor and television host I continued to travel the world and captured images that I could have only dreamed about when I was a teenager in my high school photo club. Today I have tens of thousands of photographs from dozens of countries. Last year I was moving some boxes in our basement and I came across one with no label on it. I opened it and there it was, my Leica M3 film camera. I had not held it in over a decade. I picked it up and immediately felt the familiarity of its curves. Shooting with a Leica is like learning how to ride a bicycle, once you know how you never forget. I cocked the camera and to my amazement I felt the resistance of 35mm film advancing through the shutter. There was still un-developed film in it. The camera counter showed 22 images had been exposed so I rewound the film and opened the back. It was a roll of 35 mm Kodak TRI-X ASA 400, the favorite film of my youth. I had no idea what was on that film or even if it would still be good having been in the camera for over a decade. I had dismantled and sold off my dark room many years prior, so I had no way to develop it. I went on the web and searched for a lab that was still processing black and white film. To my surprise there were still several labs active. I brought the roll in and explained to the technician what had happened. He warned me that leaving the roll inside a camera for 6 months was a bad idea, let alone over a decade. The lab said they would process it but made me agree that if it was destroyed by the developer bath it was not their liability. I agreed and left my cell number. A few days later my phone rang, it was the lab. ""You should come in and see this, you are not going to believe what you have here."" I was shooting Shark Tank on the Sony MGM studio lot in LA that day so I had no way to get back to the lab which was on the other side of the country. The technician suggested I should not touch or take the processed negatives out of their sleeve holders, as they were extremely delicate and maybe brittle. Instead they had done a high resolution scan to disk that could be viewed on a Mac. The more he talked to me the more I wanted to see the images. I asked him to email me one. Moments later I felt my phone vibrate and I opened his email. What I saw blew me away. During the years that the film had sat in the camera body the silver nitrate emulsion had begun to break down and had crystalized on the surface of the film leaving ghostly geometric streaks across the image. The pictures looked like they were from another world. They were absolutely stunning. I leaned over and showed my phone to Daymond John who was sitting to my right on the Shark Tank set. ""What the hell is that?"" he exclaimed. Exactly, I thought. The Leica M3 camera that I had jilted over a decade ago gave birth to images unrivaled by any of the thousands of digital images I had taken since. No Photoshop here, this was organic reality. It was karma. It changed my mind about everything in my photographic world. I don't care what anyone says about digital images, they can't rival photographs taken on film, period. Today my Lieca M3 is my number one camera again. I carry a digital SLR too but if I have to choose, I draw the Leica first. Today I favor Ilford HP5 Plus 400 and Kodak 400 TMAX. You can still buy it. I process it at a lab, do a low resolution scan of the roll and archive the original negatives. When I want to make an archival print I go back to the original negative and do a very high res scan with an Imacon Flextight Film Scanner. We print from that. Proof you can keep the soul of film in your work but take advantage of what digital offers. Many Hollywood directors are doing the same thing these days. They shoot their movie on 70mm film and transfer it to digital for the edit. I am not against using digital technology in the photographic arts. Far from it. For example in the 1987 test print made from a traditional old school enlarger of the Armenian Church Worshipers, the partially hidden face on the far left was not evident. The negative was exposed in extremely low light and ""pushed"" in processing but was still very thin. Over 20 years later scanning the same negative with the Imacon unlocked the secret face and changed the feel of the whole image, more mysterious I think. The point is it all starts on film. That is where the soul of the image is born. Encouraged by the ghostly Leica airshow images, I decided to exhibit my work to the public. For the majority of the work I went back to my original negatives and selected images from across 4 decades. To my surprise we sold $97,000 worth of photography the opening night. I donated the profit to teenage entrepreneurs in grades 11 and 12 across the country. If you would like to buy one of these images to support a teen entrepreneurs contact Laura Davidson at ldavidson@olearyventures.com . The prints are huge 57.5"" X 42.5"" so you are going to need some wall space. They are framed in painted white lacquer wood flat low profile frames with an archival print behind UV resistant non-reflective glass. There is a limited signed edition of 25 of each image. They cost $6,000 plus applicable taxes and shipping. I recently visited a lawyer's office to have some signature pages notarized. While waiting in the reception an image caught my eye. It was mine, the photograph of the man walking in Kiev in 1986. The firm's art curator had cataloged it into their collection. It had a plaque with my name on it. I often characterize lawyers as life forms found just above single cell amoebas. Not that day."
28,ARTS,Aisle View: Come to the Fun Home,"Steven Suskin, ContributorDrama critic",https://www.huffingtonpost.com/entry/aisle-view-come-to-the-fu_b_7097076.html,"Seekers of provocative, invigorating and entertaining theatre--musical or dramatic--will find it at Circle in the Square. To those who think that Fun Home doesn't sound like their sort of entertainment: this is musical theatre at its best, so go anyway. You're likely to be surprised, and thrilled, and enthralled.",2015-04-19,2015-04-19-1429484144-7528522-Fun_Home_0013_Judy_Kuhn__Oscar_Williams__Zell_Steele_Marrow__Sydney_Lucas__Michael_Cerveris__Photo_Credit_Joan_Marcus.jpg,https://images.huffingtonpost.com/2015-04-19-1429484144-7528522-Fun_Home_0013_Judy_Kuhn__Oscar_Williams__Zell_Steele_Marrow__Sydney_Lucas__Michael_Cerveris__Photo_Credit_Joan_Marcus-thumb.jpg,"  Judy Kuhn, Oscar Williams, Zell Steele Morrow, Sydney Lucas,  and Michael Cerveris in Fun Home. Photo: Joan Marcus   Last season's best off-Broadway musical is now this season's best Broadway musical. Fun Home is the best Broadway musical in years. Don't let the subject matter fool you. You might have heard that the Jeanine Tesori-Lisa Kron musical, adapted from the autobiographical ""graphic novel"" by Alison Bechdel, is about a lesbian cartoonist and her gay father who kills himself. That might not sound like a cheery way to spend a couple of hours, but don't be misled. Fun Home is an emotional roller-coaster ride, a grippingly heartwarming story mixed with some of the most smart and joyful musical numbers presently on Broadway. Alison (Beth Malone) is, indeed, a 43-year-old lesbian cartoonist. We also see her as the pre-teen Small Alison (Sydney Lucas) and the college-freshman Middle Alison (Emily Skeggs). The nature of the narrative that Kron and Tesori have devised--and the beauty of the piece--is that we can see them all at the same time, in the same space, sometimes delivering the same sentence. Small Alison grows up trying to communicate with her decidedly difficult father Bruce (Michael Cerveris); Middle Alison leaves home for college, where (a) she comes out, (b) learns her father is gay, and (c) watches as he commits suicide months later. The adult Alison, meanwhile, struggles to make sense of it all. While the three Alisons are central, Cerveris (of Assassins and Titanic) is the key to the proceedings. As the repressed, unknowable father, he gives an excellent performance so uncharacteristic that some viewers are likely not to even recognize him under the hairpiece. The hidden strength of the show is Judy Kuhn (of Les Misérables and Chess), as the mother Helen. Helen seems almost invisible in this family, her true self having dwindled over the course of the marriage. Late in the show, she is revealed to have been very much aware of the situation all along; but what could she do other than sit at the piano, passively practicing Chopin? ""Chaos never happens if it's never seen,"" she repeatedly notes. Finally comes her song, which illuminates the show. ""Days and Days"" is staggeringly good dramatic writing, and Kuhn--a three-time Tony nominee--is breathtakingly stunning. The cast is rounded out by the two young brothers, Oscar Williams and the cute-as-a-button Zell Steele Morrow; Roberta Colindrez, as Alison's droll college girlfriend; and Joel Perez, as several young men for whom Bruce hungers.   Beth Malone and Emily Skeggs in Fun Home. Photo: Jenny Anderson   The power of the story is enhanced by the songs, which mix passion with humor. Tesori has previously demonstrated her abilities as musical dramatist with Violet and Caroline, or Change, as well as putting food on the table with the less challenging but more popular Thoroughly Modern Millie and Shrek. The Fun Home score is monumental, revealing talent and sensitivity that is sustained throughout the piece. The music blends perfectly with the lyrics of the heretofore non-lyric writer Kron (of Well), whose book and lyrics here are equally exceptional. This is easily the finest theatre score in a decade, by my reckoning since The Light in the Piazza. Tesori and Kron mix emotionally moving numbers with others that simply lift the roof off the theatre. ""Come to the Fun Home"" is a comic knockout; appearing early in what thus far seems to be an overwhelmingly serious evening, the three pre-teens radiate blissful joy as they sing a pretend-TV commercial--in Jackson 5 style--for their family-run funeral home (hence, ""fun home""). ""Changing My Major,"" delivered by Ms. Skeggs in the first throes of passion, is an irrepressible whirlwind artfully crafted with the sort of rhymes an 18-year-old might devise; and ""Ring of Keys,"" in which the Small Alison discovers the meaning of physical attraction, is so gloriously good that you can't imagine Tesori and Kron can top it until they hit you with ""Days and Days."" Chris Fenwick leads a seven-piece band in John Clancy's sensitive orchestrations. Fun Home originated at the Public's Newman Theater--home of the original productions of A Chorus Line, Elaine Stritch at Liberty and Hamilton--where it was wonderfully staged by Sam Gold (Circle Mirror Transformation). Circle in the Square calls for a thoroughly different in-the-round staging, and in undertaking the challenge Mr. Gold has outdone himself: the show has grown stronger, and better. The actors move and turn to face the patrons, of course; but Gold and designer David Zinn (The Last Ship) favor the in-the-round audience by also having the scenery move, rotate, and reappear in different places like cartoon panels. The result is a greater immediacy that enhances the impact of the material. As an added bonus, we can't help but see the thrilled reactions of audience members sitting opposite.   Sam Gold's staging of Fun Home. Photo: Joan Marcus   The transfer, eighteen-months after the Public opening, brings cast changes in the roles of Middle Alison and the two brothers. The original girl, Alexandra Socha, was excellent but so is Ms. Skeggs, who replaced Socha midway through the Public run. Skeggs appears to be younger, more awkward and unsure of her path, which plays very well. The other Alisons reprise their excellent performances, although the 11-year-old Ms. Lucas appears noticeably older and taller than she was in 2013. The boys, too, are just as charming as the earlier pair; the 8-year-old Morrow, dancing and whooping on a fun(eral) home casket while using a spray can of furniture polish as a microphone, is quite a sight. The authors and director have seen fit to cut a favorite song from downtown, ""Al for Short."" Which on reflection is the right choice; we learn the essential information from ""Ring of Keys,"" which has more emotional heft, and there is no room in a brisk 100 minutes to restate yourself. It's highly uncommon, though, for present-day Broadway songwriters to cut an excellent song because they don't need it. Seekers of provocative, invigorating and entertaining theatre--musical or dramatic--will find it at Circle in the Square. To those who think that Fun Home doesn't sound like their sort of entertainment: this is musical theatre at its best, so go anyway. You're likely to be surprised, and thrilled, and enthralled. . Jeanine Tesori and Lisa Kron's Fun Home opened April 19, 2015 at Circle in the Square "
