,category,headline,authors,link,short descr,date,image_caption(s),image_link(s),article
6,POLITICS,"'Provocative' Police Tactics Inflamed Ferguson Protests, Experts Find",Ryan J. Reilly,https://www.huffingtonpost.com/entry/ferguson-protests-police-tactics-report_us_55e622a3e4b0aec9f35506ad,"An in-depth study concludes that ""inappropriate"" law enforcement responses escalated tension in St. Louis County.",2015-09-02,"<p>Police in riot gear watch protesters in Ferguson, Missouri, on Aug. 13, 2014.</p>",https://img.huffingtonpost.com/asset/default-missing-image.jpg?cache=KLbeMHqw50&ops=scalefit_720_noupscale,"WASHINGTON -- Law enforcement officials responding to demonstrations and unrest in Ferguson, Missouri, following the death of Michael Brown last August used a variety of inappropriate tactics and strategies that often exacerbated tensions, according to a report by policing experts that the Justice Department is releasing this week.The assessment finds that deploying dogs for crowd control was ""provocative,"" positioning snipers on top of armored vehicles during daytime protests ""inflamed tensions,"" tear gas was ""deployed inappropriately,"" and law enforcement used unconstitutional policing strategies that suppressed First Amendment rights. Such strategies ""had the unintended consequence of escalating rather than diminishing tension,"" the report states.The police response was also hampered by inconsistent leadership, a failure to understand the community, a reactive strategy for handling protests, poor communication, and complications caused by St. Louis County's extraordinarily fractured network of small law enforcement agencies, which a nationally recognized police research organization has criticized as ""dysfunctional and unsustainable.""The ""stress and pressure"" that officers were under at the time -- working long hours as taunts, spit, rocks and bottles of urine were hurled in their direction -- may have resulted in their making ""bad judgments"" and engaging in uncharacteristic behavior, according to the report. Officers on the front lines ""faced unprecedented levels of abuse,"" and minority officers in particular were targeted with ""extreme verbal abuse.""Additionally, law enforcement's response to the unrest ""seemed like a rudderless ship"" to many officers because ""direction for officers on arrests and engaging protesters seemed to change regularly,"" according to the report. Interviews with officers ""consistently, and clearly, indicated there was confusion"" about arrest procedures and guidelines, a situation that St. Louis County Police Chief Jon Belmar acknowledged in federal court last fall.The ""after-action"" assessment conducted at the request of the Justice Department's Office of Community Oriented Policing Services (COPS) examines the police response to protests in Ferguson over a 17-day period in 2014: from Aug. 9, when then-Ferguson Police Office Darren Wilson killed Brown, through Aug. 25, when the 18-year-old was buried. The study began last September. The assessment team -- led by former Missouri police officer and criminal law professor David L. Carter -- conducted over 160 confidential interviews with law enforcement officials, protesters, clergy, business owners, community members and other stakeholders. The report states that law enforcement agencies who responded to the situation in Ferguson ""encountered an event unprecedented in recent times"" that ""became a defining moment in policing history."" The large number of demonstrators and the widespread use of social media made the event particularly challenging. Ferguson should serve as ""a vivid reminder that law enforcement agencies must continually analyze their policing practices in relation to the communities they serve,"" the report says. While the report's key findings leaked out in late June, federal officials hope that this full, detailed examination will be helpful for other law enforcement agencies when dealing with mass demonstrations.COPS Director Ron Davis -- who writes that the Ferguson demonstrations became ""part of a national movement to reform our criminal justice system and represent a new civil rights movement"" -- suggests that the report may aid law enforcement agencies in protecting the rights of demonstrators and maintaining public safety.""The failure to learn from our experiences -- both our successes and setbacks -- increases the likelihood of repeating mistakes and contributes to loss of public trust,"" Davis writes in introducing the report. ""Law enforcement must be prepared to respond to this new movement and to do so in a manner different from that of the civil rights movement of the 1950s and 1960s, when law enforcement was often used to disrupt demonstrations, oppress free speech, and deny constitutional rights.""The aggressive tactics used by law enforcement in Ferguson came under heavy criticism in the press and on social media. The assessment team -- which included a watch commander in the Dallas Police Department who graduated from West Point and served in the first Gulf War -- largely agreed with the widespread critique of the militarized police presence. By positioning a sniper on top of an armored tactical vehicle, ""law enforcement helped to further the sentiment that they were reacting in a militaristic manner,"" the report says. Initial police responses ""appeared to galvanize a negative perspective and aggravate community concerns about police and the justice system in general."" Community members, the report notes, ""became angered at what they perceived to be a heavy-handed response by the police rather than the police being there to 'serve and protect.'""One community member said that ""riot gear, tear gas, five-second rule, tanks were all acts of aggression"" that exacerbated the crowd's response. ""Back to Selma all over again,"" the person said.""It was clear the armored vehicles stirred the emotions of demonstrators -- they expressed fear, anger, and intimidation by the vehicles' mere presence,"" the report says. ""Community members stated that the vehicles were 'acts of aggression' by the police.""The pointing of sniper rifles at crowds came under particular scrutiny. The report calls that ""a particularly alarming behavior, especially if the rifle is pointed at the viewer."" Law enforcement officials also did not seem to appreciate the ""profound effect"" that using dogs had, the report states.Police were criticized for taking an ""all or nothing"" approach to their tactical response during the protests. The report notes that tactical equipment could be used in a ""relatively limited manner"" and ramped up if necessary, but ""when an initial response is at a high level, options for gradual and measured escalation are more difficult.""Law enforcement ""must be reasonable and flexible with their choice of tactics ... consider the historical context of the community served, and focus not only on what may be authorized pursuant to policy but also on what is right,"" the report states. ""The assessment team concluded that the use of these military-like tactics, particularly the officers deployed with rifles, was not appropriate for the circumstances.""""While I understand that, we have to keep our people safe. Sometimes policing is not pretty,"" one police commander told investigators.As the report notes, police were at a disadvantage from the beginning of the protests, as the ""relationship between law enforcement and the communities of color in St. Louis County were extremely strained."" Additionally, as there had been no riots there after Dr. Martin Luther King Jr. was killed in 1968 or after the Rodney King acquittals in 1992, the community ""did not have any prior history with a similar critical incident on which to base the turn of events that resulted after Mr. Brown's death.""The fractured nature of law enforcement in St. Louis County was also problematic. Officers from over 50 different departments reported to the command post from Aug. 9 though Aug. 25. Some of those municipalities had officers who were not even certified, and the report says some of those agencies ""may not have a focus on officers engaged in non-traffic law enforcement efforts"" and may not have the skills to respond to such unrest.While the report notes the successful strategy implemented under Missouri Highway Patrol Capt. Ron Johnson, it says that because of the time he spent on community engagement and doing media interviews, he was ""less engaged in day-to-day, hour-to-hour incident command responsibilities and instead became the public face for the police response."" The report notes that St. Louis County Police Department officers thought putting the highway patrol in charge ""showed disrespect to them and their capabilities."" St. Louis County Police Chief Belmar and then-Ferguson Police Chief Thomas Jackson were not consulted about the change in command, according to the report.Johnson's decision to walk with the protesters along West Florissant Avenue ""seemed to have a positive impact on community relations,"" according to the report, but his ""perceived support for the demonstrators lowered morale among officers, including Missouri State Highway Patrol troopers.""Officers told the assessment team that ""inconsistent orders and a constant barrage of criticism from the public and the media"" left them with a sense of abandonment and a feeling that ""public image trumped officer safety."" Changes in policies were a constant source of tension.""There was no plan in place for arresting people and no standard way to document arrests,"" one officer said. Another officer stated that fellow officers were ""unclear who they could arrest."" Yet another officer said that their standing orders ""changed every day.""Investigators said problems came up because officers were operating for long periods of time in a stressful environment. The report points to the case of Ray Alberts, a former officer in nearby St. Ann who resigned after he was captured on video threatening Ferguson protesters; yelling, ""I will fucking kill you""; and pointing a semi-automatic assault rifle at a videographer.""Even a casual observer of the video can see that the officer looked flushed, hot, and frustrated,"" the report states. ""The involved officer was excused from Ferguson duty once the incident became known to command, and he later expressed remorse for his actions. His behavior was said to be uncharacteristic of his many years' experience as an officer, yet he not only experienced the stigma of becoming an Internet 'item' but also ultimately resigned from his position. From the videographer's perspective, the fact that the officer was under stress does not excuse the verbal abuse the videographer received or the threat of being shot and having a rifle pointed at him."" Full disclosure: The Huffington Post's Ryan J. Reilly, who wrote this story, and The Washington Post's Wesley Lowery were arrested by officers with the St. Louis County Police Department on Aug. 13, 2014. Nearly a full year later, Reilly and Lowery were charged in St. Louis County Municipal Court with ""trespassing"" in the McDonald's where they were working and ""interfering"" with police officers who forced the restaurant to close as a peaceful, daytime protest took place down the street. Reilly and Lowery are fighting the charges."
7,POLITICS,CNN Revises Debate Criteria In Possible Boost To Carly Fiorina,Sam Levine,https://www.huffingtonpost.com/entry/cnn-debate-rules_us_55e61829e4b0b7a9633ab64a,Fiorina had argued that the standards were unfair because they didn't reflect her boost in the polls after the Aug. 6 debate.,2015-09-01,"Sen. Ted Cruz (R-Texas) -- Announced March 23, 2015",https://img.huffingtonpost.com/asset/55b7e4ec1d00003000143032.jpeg?ops=scalefit_960_noupscale,"CNN announced on Tuesday that it would change the criteria for candidates to qualify for its top-tier Sept. 16 debate following a series of complaints from Carly Fiorina that the standard the network was using was unfair.The network said initially that the top 10 candidates in an average of public polls from July 16 to Sept. 10 would be allowed to participate in the top-tier debate while the rest of the candidates would participate in a separate one. Fiorina had argued that the standards were unfair because they didn't accurately reflect her increase in the polls after a strong performance at the Aug. 6 GOP debate. The network will now also look at the top 10 candidates in an average of polls from Aug. 7 to Sept. 10.CNN said in a statement that it is changing its criteria because of a lack of available polling following the Aug. 6 debate, noting there have been only three new polls to help shape the lineup of the debate.""In the event that any candidate is polling in the top 10 in an average of approved national polls released between August 7th and September 10th, we will add those candidates to our top tier debate, even if those candidates did not poll in the top 10 in an average of approved national polls between July 16th and September 10th,"" CNN said in a statement. ""We have discussed these changes with the Republican National Committee and the Ronald Reagan Presidential Library, and they are fully supportive.""Even though the lineup for the Sept. 10 debate has not been set, Fiorina's campaign said in a statement Tuesday that she expects to be onstage at the Reagan Library in the top-tier debate.""We're so grateful to the thousands of grassroots supporters and conservative activists around the country who weren't afraid to take on the political establishment and challenge the status quo to make this happen,"" the campaign said. ""We look forward to watching Carly Fiorina debate the other front runners at the Reagan Library.""Also on HuffPost:"
8,POLITICS,Kentucky Can't Just Fire The Clerk Who Won't Give Marriage Licenses To Gay Couples,Cristian Farias,https://www.huffingtonpost.com/entry/kentucky-clerk-marriage-licenses_us_55e5c2d5e4b0c818f619224c,The benefits of being an elected official.,2015-09-01,"<p>Rowan County clerk Kim Davis (right) refused to issue marriage licenses again on Sept. 1, 2015.</p>",https://img.huffingtonpost.com/asset/55e5c3cb1d00002f00146761.jpeg?cache=QpPtzvV9Fi&ops=crop_77_89_3081_1808%2Cscalefit_720_noupscale,"The defiant Kentucky clerk who has doubled down in her determination not to grant marriage licenses to same-sex couples can't be fired for refusing to do her job.On Tuesday, after the U.S. Supreme Court turned her away, Rowan County clerk Kim Davis again declined to grant those licenses, insisting that she was acting ""under God's authority."" So what happens next?Kentucky law largely shields an elected official like Davis from being forced out of her post. Until the next election, when the voters can boot her, she can be removed only through impeachment by the state legislature.That's a messy, lengthy process that has rarely been pursued in Kentucky. The simpler alternative, as Gov. Steve Beshear (D) told another recalcitrant clerk, would be for Davis to either issue the licenses or resign. But even the governor is legally powerless to make her resign.There are other ways to penalize her for shirking her official responsibilities.Kentucky civil rights attorney Joe Dunman -- who was involved in Obergefell v. Hodges, the Supreme Court case that legalized same-sex marriage nationwide -- explained in July that the state executive branch could seek charges against Davis. ""It is a crime in Kentucky for a public servant to intentionally refrain from performing a duty imposed upon him or her by the law,"" wrote Dunman in Insider Louisville.The Kentucky attorney general is currently considering the appointment of a special prosecutor to investigate whether Davis is breaking the law, according to the Louisville Courier-Journal.Some state lawmakers hope to stymie that legal process. In anticipation of potential criminal repercussions for Davis and other religious objectors, they are weighing bills that would grant religious exemptions to public officials opposed to same-sex marriage.The prospect of such a carveout raises other constitutional issues, Dunman noted. For one, the clerks in question took an oath to uphold the Constitution and the laws of the United States and Kentucky. When ""they're at work, they're not acting as private individuals. They're acting as the government,"" he wrote. That was precisely the reasoning the U.S. Court of Appeals for the 6th Circuit adopted last week when it ruled against Davis and told her she had ""little or no likelihood"" to win her case in her official capacity.Like Davis, the plaintiffs who first sued her in federal court are also not giving up. They're pursuing a contempt action before the judge who effectively ordered her to issue marriage licenses to straight and gay couples alike. On Monday, the Supreme Court refused to intervene and delay the judge's order.The plaintiffs are seeking only financial penalties against the clerk, not incarceration.So Davis could ultimately face consequences in civil or criminal court. Or maybe political consequences before the Kentucky legislature or the electorate.Just don't hold your breath if you hope to see her get fired like anyone else would be."
9,POLITICS,Chris Christie Threatens To 'Go Nuclear' In The Next GOP Debate,Ed Mazza,https://www.huffingtonpost.com/entry/chris-christie-jimmy-fallon-debate_us_55e53a1ee4b0b7a9633a177d,"""We may be changing tactics.""",2015-09-01,"Sen. Ted Cruz (R-Texas) -- Announced March 23, 2015",https://img.huffingtonpost.com/asset/55b7e4ec1d00003000143032.jpeg?ops=scalefit_960_noupscale,"Ignore Chris Christie at your own risk, CNN. The cable network will host the next Republican debate on Sept. 16, and Christie said -- perhaps jokingly -- that there could be fireworks if he's ignored the way he was during last month's debate on Fox News Channel. On Monday's ""The Tonight Show Starring Jimmy Fallon,"" the New Jersey governor and presidential candidate said that at one point during the debate, 20 questions went by with none directed at him. ""I was waiting for you to talk,"" Fallon told him.""Me too!"" said Christie.  So what will be different at the second GOP debate?""Stay tuned on Sept. 16th. We may be changing tactics,"" Christie said. ""You know, if I get to like 15 questions in a row -- count 'em at home -- if I get 15 in a row, you're going to go 'Uh oh, he's going to go nuclear now.'""""That's what I'm talking about,"" Fallon said. ""That's what we want to see!"" Check it out in the clip above. Also on HuffPost:"
10,POLITICS,Joe Biden To Appear On 'The Late Show' With Stephen Colbert,Sam Levine,https://www.huffingtonpost.com/entry/joe-biden-stephen-colbert_us_55e6074ce4b0b7a9633a9ff8,Biden is considering whether or not to run for president.,2015-09-01,"Sen. Ted Cruz (R-Texas) -- Announced March 23, 2015",https://img.huffingtonpost.com/asset/55b7e4ec1d00003000143032.jpeg?ops=scalefit_960_noupscale,"Vice President Joe Biden will appear on one of the first episodes of ""The Late Show"" with Stephen Colbert, the comedian announced on Twitter on Tuesday.The announcement comes as Biden is considering whether to seek the Democratic nomination for president. Biden appeared on ""The Colbert Report,"" Colbert's former show on Comedy Central, in 2010 and served hot dogs to veterans.Biden won't be the first political guest on Colbert's show, which launches next week. Former Florida Gov. Jeb Bush (R), who is running for president, will appear on the show on Sept. 8. Sen. Bernie Sanders (I-Vt.), who is seeking the Democratic presidential nomination, will also appear on the show on Sept. 18.Also on HuffPost:"
11,ENTERTAINMENT,Dick Cheney Does Not Endorse Donald Trump (Yet),Julia Brucculieri,https://www.huffingtonpost.com/entry/dick-cheney-donald-trump_us_55e5a506e4b0c818f61909b4,"He said it loud and clear: ""I'm not endorsing Donald Trump today.""",2015-09-01,"That giving your wife ""negotiable assets"" is a terrible mistake. ",https://img.huffingtonpost.com/asset/55d4bb861d00006e00145433.png?ops=scalefit_960_noupscale,"Dick Cheney doesn't endorse reality-TV-caricature-turned-presidential-candidate Donald Trump  today, but that doesn't mean he wouldn't in the future. Heck, he'd probably even vote for him (if given no other choice but to vote against the GOP, that is). CNN's special correspondent Jamie Gangel sat down for an interview with the former vice president and his daughter Liz Cheney about the upcoming election and the current Republican frontrunner, Trump. In a clip that aired on Monday morning's ""New Day,"" Gangel asked Cheney what he thought of the spectacle the real estate mogul has created.""Well, again, he’s a candidate and I don’t want to be in the business of rating candidates at this point, grading them. I have not signed on with anybody and I don’t plan to today,"" he said.Gangel then confirmed, ""You’re not endorsing Donald Trump today,"" to which Cheney responded in agreement, ""I'm not endorsing Donald Trump today.""However, when asked if he'd vote for The Donald, the politician said, ""I will support the nominee of my party, as I always have. I think it’s very important."" You can watch the clip at CNN. The full interview will air on ""Anderson Cooper 360"" Tuesday night at 8 p.m. Also on HuffPost: "
12,ENTERTAINMENT,"Watch Out, Netflix: Apple Has Plans To Launch Its Own Original Programming",Matthew Jacobs,https://www.huffingtonpost.com/entry/apple-original-programming_us_55e59752e4b0c818f619002d,"Whether that includes movies, TV series or both is unclear.",2015-09-01,Passing notes has gotten a little easier... but gone is the thrill of covert note delivery,https://img.huffingtonpost.com/asset/559f24b21b0000ba0427f83a.jpeg?ops=scalefit_960_noupscale,"To no one's surprise, Apple is mulling over plans to begin producing original programming, according to a Variety report that details the tech giant's inevitable contest with Netflix, Amazon, Hulu and YouTube. Apple representatives declined to comment for Variety's piece, but here are a few takeaways you should know:• The company is meeting with Hollywood executives to gauge interest in producing original content that Apple will host. Prospective development and production divisions could be introduced soon, with eyes on a full operation in place by next year. It's unclear how much of the heavy lifting will be done in-house, as opposed to purchasing distribution rights to titles from established studios, as Netflix did with this year's ""Beasts of No Nation"" and ""The Ridiculous Six.""• There's no word on whether the plans will include movies, TV series or both. • Apple made a bid earlier this year to work with the stars of BBC motor show ""Top Gear"" on a new series, which ultimately landed at Amazon. • The Apple TV, which is reportedly due for an upgrade announcement at the company's press event next week, could play a big part in these plans. Regardless, it's unclear whether the programming would take the form of a subscription VOD model akin to Netflix or a network-based buffet like the Sony PlayStation Vue, or whether Apple will stick to the pay-per-download approach it currently employs on iTunes.For more on Apple's initiative, head to Variety. Also on HuffPost:"
