,category,headline,authors,link,short descr,date,image_caption(s),image_link(s),article
7,WORLDPOST,World War II Erupts: Haunting Color Photos From 1939 Poland,"Ben Cosgrove, ContributorEditor, LIFE.com",https://www.huffingtonpost.com/entry/wwii-erupts-haunting-colo_b_5736428.html,,2014-08-30,2014-08-29-140829naziinvasionpolandjaeger19395702.jpg,https://images.huffingtonpost.com/2014-08-29-140829naziinvasionpolandjaeger19395702-thumb.jpg,"On Sept. 1, 1939, one week after Nazi Germany and the Soviet Union signed a non-aggression pact, more than a million German troops--along with 50,000 Slovakian soldiers--invaded Poland. Two weeks later, a half-million Russian troops attacked Poland from the east. After years of vague rumblings, explicit threats and open conjecture about the likelihood of a global conflict--in Europe, the Pacific and beyond--the Second World War had begun.In the weeks and months after the invasion, one of Adolf Hitler's personal photographer's, Hugo Jaeger, traveled extensively throughout the vanquished country, making color pictures of the chaos and destruction that the five-week battle left in its wake. Now, 75 years after the start of World War II, LIFE.com has published a series of Jaeger's pictures from Poland: haunting portraits of a country subjugated not by one enemy, but by several.[See the full gallery of color photos from 1939 Poland at LIFE.com.]In Jaeger's photos, we see early, unsettling evidence of the violence, unprecedented in its scope, that would soon be visited upon scores of countries and countless people around the globe, from the streets of London and the forests of Belgium to the North African desert and the sun-scorched islands of the South Pacific.Above: Refugees near Warsaw during the 1939 German invasion of Poland. (Sign reads, 'Danger Zone -- Do Not Proceed.')Above: Captured Polish soldiers, 1939.Above: Adolf Hitler views victory parade in Warsaw after the German invasion of Poland, 1939.All photos: Hugo Jaeger--The LIFE Picture Collection/Getty Images"
8,STYLE,How To Recover From Unicorn Hair,,https://www.huffingtonpost.com/entry/unicorn-hair-color-care_n_5737824.html,,2014-08-30,"UNIVERSAL CITY, CA - JULY 16: Nicole Richie visits 'Extra' at Universal Studios Hollywood on July 16, 2014 in Universal City, California. (Photo by Noel Vasquez/Getty Images)",https://img.huffingtonpost.com/asset/5b9e438c250000330036c8b1.jpeg?ops=scalefit_720_noupscale,"Little did I know how arduous, painful, and expensive going blue would be. But, who would’ve thought reverting back to my natural color was just as hard? Apparently, just adding black dye on top of blonde hair could turn my mop green. One colorist even told me that because my hair was so damaged and multicolored, it would take three sessions at a rate of $300 each to correct my hair. Needless to say, I was thankful I got a second consultation. But, even from there, it was a journey — going from black to blonde to blue to blonde again and back — but on it, I found myself. A new self, a better self. Read more on Refinery29"
9,WORLDPOST,Russian Politician Beaten After Investigating If Soldiers Killed In Ukraine,,https://www.huffingtonpost.com/entry/lev-shlosberg_n_5741130.html,,2014-08-30,"A Ukrainian soldier reads a newspaper at a checkpoint in the eastern city of Debaltseve on August 6, 2014. Russian President Vladimir Putin slapped a one-year ban and restriction on food and agricultural product imports from nations that have imposed sanctions on Russia over its defiant stance on Ukraine. AFP PHOTO/ ANATOLII STEPANOV (Photo credit should read ANATOLII STEPANOV/AFP/Getty Images)",https://img.huffingtonpost.com/asset/5cc13c77230000320093d92f.jpeg?ops=scalefit_720_noupscale,"By Alexei AnishchukMOSCOW, Aug 30 (Reuters) - A Russian politician said on Saturday he had been badly beaten after publicizing the mysterious funerals of two soldiers who may have died while fighting in Ukraine.Lev Shlosberg, a newspaper publisher who represents the liberal opposition Yabloko party in the regional assembly in the northwestern city of Pskov, said he was attacked on Friday evening near his home.""They attacked me from behind, I did not see any of them,"" Shlosberg said in a phone interview from his hospital ward.""Apparently, they knocked me unconscious with their first punch, threw me to the ground, beat me up and then ran away. Those people were very good professionals in their nasty business.""Shlosberg's paper published the investigation into the funerals of two Pskov-based paratroopers last week. The report added to a trail of evidence suggesting that Russian soldiers have been killed in eastern Ukraine, contradicting denials by Moscow that it is lending military support to separatist rebels there.The report has raised awkward questions for the Kremlin. When a Reuters reporter went on Wednesday to the cemetery where the soldiers were alleged to have been buried, he was stopped from entering and threatened by two young men with shaven heads.Shlosberg said he believed he had been attacked for presenting evidence that Russia's military was taking part in the Ukraine conflict and sustaining casualties.""I hope police will at least find the culprits,"" he said. ""This would be hard to do...but I don't see grounds for police to intentionally hamper the investigation.""Shlosberg said he did not want to discuss his injuries, but doctors had told him he would take 10 days to recover.The local governor demanded a thorough investigation of the attack, a demand echoed by the Organization for Security and Cooperation in Europe.A Kremlin spokesman has said that the relevant authorities will look into the reports about the soldiers' burials. (Additional reporting by Jason Bush, Denis Pinchuk; Editing by Mark Trevelyan and Stephen Powell)"
10,POLITICS,New Zealand: Time for a Small Country on the UN Security Council,"José Ramos-Horta, ContributorFormer President, East Timor, 1996 Nobel Peace Prize laureate",https://www.huffingtonpost.com/entry/new-zealand-time-for-a-sm_b_5740220.html,"In these incredibly challenging times in the Middle East, parts of Africa and Asia, the world needs small countries with New Zealand's record to be sitting in the UN Security Council. And it is important for other small UN member states to see New Zealand win and know that the UN Security Council is accessible for them too.",2014-08-30,2014-08-30-Barack_Obama_chairs_a_United_Nations_Security_Council_meeting.jpg,https://images.huffingtonpost.com/2014-08-30-Barack_Obama_chairs_a_United_Nations_Security_Council_meeting-thumb.jpg,"I believe that few people could name more than five members of the UN Security Council. The U.S., Russia and China certainly. Think hard and you would probably add in the United Kingdom and -- maybe -- France, as the countries who hold the power of ""nay"" or ""aye"" over key actions of the United Nations, including how the UN addresses conflicts arising around the world.  There are 10 other countries who are non-permanent members elected for two-year terms by the General Assembly.This October, New Zealand, Spain and Turkey will contest two vacant seats in the UN Security Council. Two seats, three contenders.  My country Timor-Leste is actively supporting New Zealand for one of the two seats.  I have lived with and aged with the UN Security Council, since December, 1975, when I first addressed the Council at age 25, on the Indonesian occupation of my country, Timor-Leste (formerly East Timor). And while the voice of the superpowers and other developed nations such as the European members are indispensable, the council, being the only group in the UN with real teeth, is far too important to be an exclusive club of the powerful.Besides the country of my birth where so many of my loved ones are buried in our long fight for freedom, without a doubt New Zealand is up there among my top 10 choices to visit and live.Covering an area of 268,000 sq kilometres, with 4.5 million wonderful people, an average wage of around US $46,000, New Zealand is affluent by any standards, prosperous and egalitarian, unpretentious, proudly independent.  Pakeha (New Zealanders of European descent) make up 70 percent of the population; about 13 percent are Maori and Pacific Islanders; Asians are 7 percent, people of mixed race are 8 percent. There is no dominant religion: almost 20% profess no particular faith; Anglicans, 15 percent; Roman Catholics 12 percent; Presbyterians 11 percent; and other assorted protestant variations. Literacy is 100 percent, life expectancy is over 80 years of age. Just one major worry: New Zealanders seem to have given up on sex, as population growth rate is a dismal 0.9 percent.  Unlike other European settler countries that almost completely obliterated indigenous identity, culture and languages, New Zealand is exemplary in its efforts to reconcile with the original inhabitants of the islands, the Maori people. Maori is an official language, together with English and New Zealand Sign Language.  Maori, a fiercely proud people, fought off marauding Europeans who landed landed in those far lands, but in 1840 Maori leaders and representatives of the British Crown signed the Treaty of Waitangi, and thus began the formation of New Zealand.   New Zealand's natural beauty is simply breath-taking; and unlike Australia, home to every ugly, poisonous animal on Earth, it is free from all these creatures -- no scorpions or cobras.  Being at the edge of the world was in fact an advantage during the Cold War era. It is so far that even the then ""expansionist"" Soviet Union never considered it to be a valuable asset to be invaded. Distance and isolation always protected it from super-power predators.   Like Australians who died on behalf of the British Empire by the tens of thousands in absurd wars in Asia and Africa, New Zealanders too were sacrificial lambs of the British Crown and imperial US in their foreign wars, from Asia to Africa and Turkey.  While enjoying close ties to the U.S. and Europe, New Zealanders have shown on occasion to be proudly independent. It was in the early 1980s that that postcard islands stood up to the giant US, refusing US Navy port calls over Washington's refusal to confirm or deny if the ships were carrying nuclear weapons. In response, the U.S. cut New Zealand out of its security agreement, ANZUS. New Zealanders also stood up against French nuclear testing in the Pacific Islands. The price they paid for this was the bombing of the Rainbow Warrior ship by French agents in Auckland harbor. New Zealand remains nuclear-free to this day.  About the size of Norway and equally proudly independent in world affairs, New Zealand is one of those few countries that has no dispute with anyone anywhere, was never invaded and never invaded anyone.  Modest and discreet, it doesn't boast about its generous aid contributions -- nearly half a billion dollars in total -- to the region and the rest of the world. Though small, it has made enormous contributions to development, peace and security in our region, in particular in Solomon Islands, Bougainville and Timor-Leste. Both Defence Force personnel and Police were involved in the UN operations in Timor-Leste, and helped contribute towards the stabilisation of my country throughout the difficult post-Independence period.  New Zealand has also deployed peace-keepers far from its shores, including in Afghanistan, Bosnia, Kosovo, the Sinai, and the demilitarized zone between North and South Korea. New Zealand did not send troops to Iraq as that mission did not have UN backing.   New Zealand is also heavily involved in disaster response, especially in the Pacific Islands and in Southeast Asia -- areas particularly vulnerable to cyclones, earthquakes and volcanos.  Why am I so passionately advocating for New Zealand to take a seat in the UN Security Council?  I have been a human rights activist, independence advocate, a diplomat, Foreign Minister, Prime Minister, President, spanning 40 years now; and it has been 40 years of observing, learning and exercising national governing powers as well practicing international diplomacy, being a beneficiary of the United Nations, a victim of the world's indifference but also grateful in the end when indifference changed to care.  In these incredibly challenging times in the Middle East, parts of Africa and Asia, the world needs small and independent countries with New Zealand's record to be sitting in the UN Security Council. And it is important for other small UN member states to see New Zealand win and know that the UN Security Council is accessible for them too.  While a truly global power like the U.S. is indeed an indispensable country, and while major regional powers like China, Russia, Japan, Indonesia, France, Great Britain, Germany, Brazil, Nigeria, South Africa, etc. are equally indispensable, the world needs small countries with decades of active engagement with the world, to facilitate dialogue, mediate and bring parties in wars to the negotiating table.  New Zealand is one such country. I am absolutely confident New Zealand would make profound impact, calming tempers, infusing serenity, proposing workable compromises and sustainable agreements.  Timor-Leste will vote for New Zealand and I hope all other proud UN Member States will do likewise."
11,WORLDPOST,EU Leaders Name Polish Prime Minister To Top Council Job,,https://www.huffingtonpost.com/entry/eu-polish-prime-minister_n_5742272.html,,2014-08-30,"BRUSSELS, BELGIUM - AUGUST 30: Polish Prime Minister and EU Council president-elect Donald Tusk (L), outgoing European Council President Herman Van Rompuy (C) and New High Representative for Foreign Affairs and Security Policy and Italian Foreign Affairs minister, Federica Mogherini (R) pose after European Union leaders are set to meet in a summit Saturday to discuss internal and international affairs at the European Union summit at the EU Headquarters in Brussels, Belgium on August 30, 2014. European Union leaders have nominated Italy's Mogherini to become the 28-nation bloc's new foreign policy chief for the next five years and Polish Prime Minister Donald Tusk to succeed European Council President Herman Van Rompuy in December. (Photo by Dursun Aydemir/Anadolu Agency/Getty Images)",https://img.huffingtonpost.com/asset/5cc13c78230000380093d931.jpeg?ops=scalefit_720_noupscale,"By Adrian Croft and Jan StrupczewskiBRUSSELS, Aug 30 (Reuters) - European Union leaders on Saturday chose Poland Prime Minister Donald Tusk to chair their Council and named Italian Federica Mogherini to run the bloc's foreign relations, as the EU prepared to threaten Russia with new sanctions over Ukraine.A summit in Brussels shared the two coveted EU posts between a Kremlin critic from ex-communist Eastern Europe and the foreign minister of one of Moscow's biggest customers for gas. EU officials gave Ukraine's embattled President Petro Poroshenko a warm welcome and assurances of further support.But divisions among the 28 EU nations have hampered action against Moscow, and a draft of the final statement indicated that they will merely ask the bloc's executive arm ""urgently"" to prepare more options for sanctions. Discussion on the measures lasted beyond midnight (2200 GMT).Poroshenko, who warned that a failure of attempts in coming days to end fighting with Russian troops and rebels in the east could lead to ""full-scale war"", said EU leaders had agreed that new sanctions would be conditional on his peace plan working.The appointment of Tusk as president of the European Council marked a major advance in influence for the eastern states who joined the bloc this century and who share non-member Ukraine's concerns about Russian President Vladimir Putin's ambitions.But many of the powerful western countries have hesitated to toughen trade sanctions for fear of damaging their own economies. Some of them, like Italy, are heavily reliant on Russian gas.In her first comments, Mogherini stressed the need to work for a lasting diplomatic deal with Russia.""As we think and we work on the level of sanctions, we also have to keep the diplomatic way open ... hoping that the combination, a wise combination, can be effective,"" she said.Ex-communist states had deadlocked an earlier summit two months ago by opposing Mogherini as too soft on Russia.The move of Tusk, a former student activist in the anti-Communist Solidarity movement, will force an upheaval in the government in Warsaw ahead of an election due next year.In Brussels, he pledged to address British Prime Minister David Cameron's concerns over growing EU powers and immigration from eastern Europe to help avoid London quitting the Union.Tusk will work closely with Jean-Claude Juncker, the incoming head of the EU's executive Commission. Cameron tried to block Juncker's appointment in June, fearing the former Luxembourg premier's federalist views would alienate Britons.""WAR AGAINST EUROPE""French President Francois Hollande stressed that a failure by Russia to reverse a flow of weapons and troops into eastern Ukraine would force the bloc to impose new economic measures.""Are we going to let the situation worsen, until it leads to war?"" Hollande said at a news conference. ""Because that's the risk today. There is no time to waste.""The president of formerly Soviet Lithuania, an outspoken critic of Vladimir Putin and of EU hesitation to challenge him, called for urgent military supplies to Kiev and a tougher arms embargo on Russia. Dalia Grybauskaite said Moscow, by attacking Ukraine, was effectively ""in a state of war against Europe"".Poroshenko gave short shrift to Moscow's denials by denouncing the past week's incursion of thousands of troops with hundreds of armored vehicles and said he expected the summit to order the European Commission to prepare a new set of sanctions.But, like Commission President Jose Manuel Barroso, he used their joint news conference to stress the importance of finding a political solution to a crisis that Putin blames on Kiev's drive to turn the ex-Soviet state away from its former master Moscow and toward an alliance with the EU and NATO.He said he was not looking for foreign military intervention and hoped for a ceasefire deal as early as Monday, when representatives of Moscow, Kiev and the EU meet.""I think we are very close to the point of no return,"" he said. ""The point of no return is full-scale war, which already happened on the territory controlled by separatists."" DEAL DONEThe appointments of Tusk and Mogherini balance the interests of left- and right-wing factions across the bloc, eastern and western states, northern Europe and the south, as well as satisfying some pressure for more women in senior EU roles.Tusk, a conservative easterner, replacing the Belgian Herman Van Rompuy; Mogherini from the center left takes over as the bloc's foreign policy chief, replacing Briton Catherine Ashton.Mogherini dismissed suggestions she was too young and inexperienced at 41 and pledged to speak for a ""new generation"" of Europeans to promote peace in the region and beyond.Tusk will also chair summits of the euro zone countries, even though Poland has yet to adopt the common EU currency.German Chancellor Angela Merkel said that was a mark of the leaders' determination to ""show unity"" and avoid the Union splitting between the 18 states using the euro and the other 10.Other elements in striking a deal on the top jobs will be understandings reached on further key roles in the Commission, which will be formed in the coming weeks by Juncker.Having failed to block the appointment of Juncker, whom he sees as too keen on centralizing powers in Brussels, it was Cameron who last week made Tusk's candidacy public. This came at the expense of the previous frontrunner for the Council presidency, center-left Danish premier Helle Thorning-Schmidt.Britain, France, Germany and other countries are competing to see their nominees secure important portfolios in Juncker's team, such as in economic affairs, trade and energy supply.The horse-trading over jobs underlines the power of rival national governments over the supranational institutions of the EU. Proponents of a strong political leadership in Brussels that can inspire and rally an increasingly skeptical European public behind the common project may again be left disappointed.Italian Prime Minister Matteo Renzi said on Friday he would propose a meeting to discuss tackling the ""really worrying"" economic situation across Europe, with growth and jobs elusive and fears of a new crisis for the euro currency.The leaders agreed to schedule that summit for Oct. 7, according to the draft statement.Germany, the leading economic power, has given signs this week of softening its opposition to calls from Italy and France for more leeway to stimulate growth by government spending. The leaders may make statements on the issue on Saturday.Hollande said EU states had to invest to promote growth and to use ""all possible flexibilities"" in the treaties that set up the currency union so that efforts to meet obligations to curb public deficits were adapted to foster economic growth. (Additional reporting by Alastair Macdonald, Julia Fioretti, Martin Santa, Andreas Rinke and Foo Yun Chee in Brussels; Writing by Alastair Macdonald; Editing by David Gregorio)"
12,FIFTY,"Increasingly, Retirees Dump Their Possessions and Hit the Road",,https://www.huffingtonpost.com/entry/traveling-the-world_n_5742224.html,,2014-08-30,"HELGOLAND, GERMANY - AUGUST 03: An elderly couple walk on August 3, 2013 on Heligoland Island, Germany. Heligoland Island, in German called Helgoland, lies in the North Sea and until World War II was a popular tourist destination. During the war it became strategically vital and all overground structures were obliterated by massive Allied bombing. Today the island has a population of about 1,200 and is again a popular tourist destination known for its abundant wildlife. (Photo by Sean Gallup/Getty Images)",https://img.huffingtonpost.com/asset/5bb66c6b1f0000df0024c2da.jpeg?ops=scalefit_720_noupscale,"SOME call themselves “senior gypsies.” Others prefer “international nomad.” David Law, 74, a retired executive recruiter who has primarily slept in tents in several countries in the last two years, likes the ring of “American Bedouin.”They are American retirees who have downsized to the extreme, choosing a life of travel over a life of tending to possessions. And their numbers are rising. Read more on The New York Times"
13,LATINO VOICES,The Other Guy Behind The Mexican-American Studies Ban Lost His Primary Too,Roque Planas,https://www.huffingtonpost.com/entry/tom-horne-lost_n_5739062.html,,2014-08-30,"Arizona Attorney General Tom Horne talks to a reporter outside the 9th U.S. Circuit Court of Appeals in Pasadena, Calif., Tuesday, June 21, 2011. The latest court battle between Arizona and the federal government is being fought in a Pasadena, Calif., courtroom where an appeals court will hear arguments Tuesday on whether the state can require proof of citizenship to register to vote. (AP Photo/Jae C. Hong)",https://img.huffingtonpost.com/asset/5bae9fd9250000940037d9e9.jpeg?ops=scalefit_720_noupscale,"The second of the two main forces behind an Arizona law banning a controversial Mexican-American Studies curriculum admitted defeat in his bid for reelection as the state’s Attorney General this week. Attorney General Tom Horne -- plagued by a campaign finance investigation, rumors of an extra-marital affair and a hit-and-run car accident -- lost the GOP primary to Mark Brnovich. The defeat in Tuesday’s election, which Horne did not conceded until the following day, came in the same round of primary elections on Tuesday that ousted the state Superintendent of Public Instruction John Huppenthal, the other major figure behind the fight against Mexican-American studies. Horne faces several investigations over allegations that he broke election and campaign finance laws, according to the Arizona Republic. Brnovich is an immigration hardliner who opposes “amnesty” and said on the campaign trail that he’d support outgoing Gov. Jan Brewer’s decision to withhold driver’s licenses for undocumented immigrants. Before serving as attorney general, Horne headed the state school system as superintendant of Public Instruction, where he led a conservative-backed effort to ban a Mexican-American studies curriculum at Tucson schools. An independent audit and education researchers credited the program with developing critical thinking schools and boosting student achievement. But Horne said the courses, which focused on controversial issues like racism and socioeconomic inequality and widely used books written by Latino authors, bred resentment against whites. The Arizona legislature passed a bill in 2010 banning courses that promote the overthrow of the government, foster ethnic solidarity or are aimed at people of a specific ethnicity. The following year, John Huppenthal, who replaced Horne as head of the state school system, declared Tucson out of compliance with the law and threatened to withhold 10 percent of the city’s education budget unless it discontinued the classes. Tucson Unified School District’s board voted to cancel the classes in December of 2011. Students of the banned classes have filed a lawsuit challenging the ethnic studies law which has been appealed to the 9th U.S. Circuit Court of Appeals. "
