,category,headline,authors,link,short descr,date,image_caption(s),image_link(s),article
10,POLITICS,"Jeb Bush Championed Fracking While Standing To Profit From It, Report Alleges",Sam Levine,https://www.huffingtonpost.com/entry/jeb-bush-fracking_n_6731066.html,,2015-02-22,"DETROIT, MI - FEBRUARY 4: Former Florida Governor Jeb Bush speaks at the Detroit Economic Club February 4, 2015 in Detroit, Michigan. Bush, the son of former republican President George H.W. Bush and the brother of former republican President George W. Bush, is considering becoming a republican candidate for the 2016 presidential election. (Photo by Bill Pugliano/Getty Images)",https://img.huffingtonpost.com/asset/5bb8e9ef1f00000002257ab0.jpeg?ops=scalefit_720_noupscale,"Former Florida Gov. Jeb Bush (R) pushed states to approve the controversial drilling practice known as fracking while he personally stood to profit from the practice, the Tampa Bay Times reported on Friday.According to the Times, Bush, a likely 2016 presidential contender, urged a group of New York conservatives in 2013 to support fracking, even while he was involved with a private equity group that was raising $40 million for a company acquiring fracking wells.  Hydraulic fracturing, or fracking, involves drilling water, chemicals and sand into the earth to break up rocks, thus freeing oil and natural gas. Environmentalists who object to the process say that fracking releases hazardous chemicals into the water supply.“We should be celebrating this phenomenal achievement –- and we do, in North Dakota, in Pennsylvania, in south and west Texas. Some states, like here in New York, are choosing not to grow. They won’t approve fracking,” Bush told the group, according to the  New York Post. “Meanwhile, in parts of New York where huge opportunities exist for the restoration of economic activity, people languish.”Those in the audience probably didn't know that Bush co-owns a company that is a managing partner of FracStar Logistics, a company that provides sand for fracking. According to the Times, Bush's son, Texas Land Commissioner George P. Bush, helped found FracStar, whose name has since been changed to Proforce Energy Services. The report also notes that the former governor and his other son, Jeb Bush Jr., are co-owners of the managing group, De Soto Partners.In addition, the Tampa Bay Times highlighted a speech that Bush gave in Colorado last year, in which he said that a possible statewide referendum that could permit more restrictions on fracking was ""one of the dumbest things I've ever heard.""Bush announced last last year that he was resigning all of his corporate and nonprofit board memberships, but he is still reviewing his role in businesses in which he is a principal partner or owner. The Tampa Bay Times' report suggests that Bush remains involved with De Soto Partners.Any appearance of a conflict of interest could prove tricky for Bush as he seeks to earn the Republican presidential nomination.For example, Bloomberg reported last month that in fall 2014, as Bush was gearing up for a possible presidential run, a private equity fund that listed him as its chairman and manager was raising millions, largely from offshore private investors. According to Bloomberg's report, the fund incorporated overseas to avoid U.S. taxes. When the Tampa Bay Times asked Bush about the relationship between his policy positions and his business interests as he considers a White House bid, he said that he was making an effort to separate the two and to be transparent.""I'm unraveling from every aspect of my business, both the investing company as well as the consulting business. Pretty much there,"" he said. ""At the proper time,"" Bush added, ""should I go forward (with a run for president), I'll give the people every opportunity to look at everything and they can make their own mind up."""
11,POLITICS,Walker In Hot Water Over Obama Comments,,https://www.huffingtonpost.com/entry/story_n_6730868.html,,2015-02-22,"Gov. Scott Walker talks about the release of the first television ad run against him by Democratic challenger Mary Burke on Wednesday, March 5, 2014, in Madison, Wis. The ad, released by Burkeâs campaign online Wednesday, comes eight months before the November election and signals that the race is heating up. (AP Photo/Scott Bauer)",https://img.huffingtonpost.com/asset/5bb8e9ed1f00002501257aae.jpeg?ops=scalefit_720_noupscale,What Rudy Giuliani did this week was stupid. What Scott Walker did ought to disqualify him as a serious presidential contender.Read more on www.washingtonpost.com
12,BLACK VOICES,Black Influence on Political Power Starts With Fair Voting Rights,"Clarence B. Jones, Contributor",https://www.huffingtonpost.com/entry/black-influence-on-politi_b_6730372.html,"If ""Black Lives"" REALLY MATTER, then we must acquire and exercise the right to vote to insure that we elect officials who will impartially administer the laws and manage those State and Municipal Agencies having jurisdiction over our children and our own daily lives.",2015-02-22,"NEW YORK, NY - JANUARY 19: People attend a service with the Reverend Al Sharpton and members of the National Action Network (NAN) during a wreath laying near the site where police officers Wenjian Liu and Rafael Ramos were killed in the Bedford-Stuyvesant neighorhood of Brooklyn in December of last year, on January 19, 2015 in New York City. The gathering was one of the 'Be Like King' events honoring and promoting the work Dr. Martin Luther King, Jr. on the Dr. King observed holiday. (Photo by Cem Ozdel/Anadolu Agency/Getty Images)",https://img.huffingtonpost.com/asset/5bae070f250000cf0037b254.jpeg?ops=scalefit_720_noupscale,"Almost 52 years ago, August 28, 1963,Martin Luther King, Jr., the 20th Century's pre-eminent Apostle of non-violence, social justice, and commitment to the pursuit of excellence, inspirationally described the road African-Americans had travelled from slavery and his ""dream"" to enable them to access future opportunities.He was 34 years old, I was 32. Until April 4, 1968, the date of his assassination in Memphis, TN, I had the privilege of serving as one of his political advisors, his personal lawyer and draft speechwriter. I am now 84 years old as we consider where we as a people go from here today.Repeatedly, in speeches and articles I have said that if ""The surviving Lions, don't tell THEIR stories, the Hunters will get all of the credit!""If ""Black Lives"" REALLY MATTER, then we must acquire and exercise the right to vote to insure that we elect officials who will impartially administer the laws and manage those State and Municipal Agencies having jurisdiction over our children and our own daily lives.THE most important thing that white supremacist political power feared and continues to fear is the right to vote, and it's exercise in the hands of African-Americans. The Civil War, the 13th, 14th and 15th Amendments to our Constitution constitute the cornerstones of our struggle to make sure, going forward, that we have the political power to assure that Black lives really do matter.The extent to which we as parents and as a community are prepared to exercise 24/7 disciplined and parental leadership will determine where we go from here. Our guidance, love and leadership can physically save our children from wanton gun violence, and spiritually save them from the denigrating effects of depression, self-hate and misplaced anger at innocent third parties. Most important we can save them from self-indulgent mediocrity.Our ancestors survived the Middle passage; slavery, Jim Crow, lynching's, the Klu Klux Klan and State government imposed racial segregation. We are the sons, daughters, grandsons and granddaughters of: Zora Neal Hurston, Richard Wright, Blanche K.Bruce, Mary McCleod Bethune, W. E. B. Dubois, Ida B. Wells Barnett, Fredrick Douglass, Sojourner Truth, Langston Hughes, Marcus Garvey, James Weldon Johnson, Malcom X, Samuel B. Cornish and John Russwurm, Dred Scott, Rosa Parks, Martin Luther King, Jr, Richard Allen, and many others.To quote a chorus from our Negro National Anthem:""We have come over a way that with tears has been watered, We have come, treading our path through the blood of the slaughtered, Out from the gloomy past, Till now we stand at last Where the white gleam of our bright star is cast.""Everyone who reads this post should also read, for the first time, or again, Howard Fast's novel FREEDOM ROAD. Reading it will refresh your recollection of just how, historically essential, has been and will be the acquisition and exercise of voting power to shaping our destiny as a people in the second decade of this 21st Century.Envisioning where we go from here therefore, first depends upon whether we adults, who are trustees of our children's current welfare and security, are prepared to step up to the plate and accept our historically and spiritually mandated calling:""Then I heard the voice of the Lord saying, ""Whom shall I send? And who will go for us?"" And I said, ""Here am I. Send me!"" (Isaiah 6:8)This post is part of the ""Black Future Month"" series produced by The Huffington Post and Black Lives Matter for Black History Month. Each day in February, this series will look at one of 28 different cultural and political issues affecting Black lives, from education to criminal-justice reform. To follow the conversation on Twitter, view #BlackFutureMonth -- and to see all the posts as part of our Black History Month coverage, read here."
13,WORLDPOST,ISIS Militants Claim Attacks On Iranian Ambassador's Residence In Libya,,https://www.huffingtonpost.com/entry/islamic-state-militants-c_n_6730420.html,,2015-02-22,"TRIPOLI, LIBYA - FEBRUARY 22: A car bomb went off Sunday near the Iranian embassy in Libyan capital Tripoli, on February 22, 2015. (Photo by Hazem Turkia/Anadolu Agency/Getty Images)",https://img.huffingtonpost.com/asset/5cc145a62400003300229e02.jpeg?ops=scalefit_720_noupscale,"(Islamic State claim, details)TRIPOLI, Feb 22 (Reuters) - Militants claiming loyalty to Islamic State said they were behind Sunday's twin bomb attacks on the residence of the Iranian ambassador in the Libyan capital and a rocket strike on the eastern Labraq airport, a group statement.The attack on the ambassador's residence came two days after the group claimed responsibility for a double suicide bombing that killed more than 40 people in the eastern town of Qubbah, one of the worst attacks on civilians since a 2011 uprising toppled Muammar Gaddafi.Western powers are concerned that Libya is emerging as a thriving battleground for militants loyal to Islamic State, which controls large areas of Iraq and Syria. Islamist fighters have exploited instability as two rival governments fight for control of territory.The group has stepped up attacks since Egypt launched air strikes on suspected militant targets in the eastern Libyan city of Derna on Monday, a day after Islamists released a video showing the execution of a group of Egyptian Coptic Christians.On Sunday, two bombs exploded at the gate of the Iranian ambassador's residence in central Tripoli. Iran's official IRNA news agency confirmed the blasts and said there had been no casualties, adding Iran had already suspended operations there.""Two devices were laid, one exploded first and then the other. The point of the second bomb was to create confusion,"" Colonel Jumaa al-Mashri from the National Security Agency told Tripoli-based al-Nabaa television.A Reuters reporter at the scene saw the second device exploding some 30 minutes after the first. Minor damage could be seen at the gate.""Soldiers of the Islamic State caliphate targeted the Iranian embassy in Tripoli,"" the group said in a statement posted with pictures of a flame on Twitter.The militants also claimed responsibility for a Grad rocket attack on Labraq airport, announced by officials on Saturday. No one was hurt. The airport is the main gateway into eastern Libya and Bayda, seat of the internationally recognized prime minister, Abdullah al-Thinni.His government and the House of Representatives, elected in June, have been working out of the east since a faction called Libya Dawn seized Tripoli in August, reinstating the previous assembly and setting up a rival administration.Last month, militants claiming affiliation with Islamic State stormed the Corinthia luxury hotel in Tripoli, killing five foreigners and at least four Libyans.Supporters of the group have also taken over government and university buildings in Sirte, a central city and birthplace of Gaddafi, according to residents. (Additional reporting by Omar Fahmy in Cairo and Mehrdad Balali in Dubai; Writing by Ulf Laessing; Editing by Rosalind Russell)"
14,POLITICS,Clinton Family Foundation May Pose Campaign Risks,,https://www.huffingtonpost.com/entry/clinton-foundation_n_6730302.html,,2015-02-22,"Former Secretary of State Hillary Rodham Clinton speaks in Gaston Hall at Georgetown University, in Washington, Wednesday, Dec. 3, 2014, about âSmart Power: Security Through Inclusive Leadershipâ as part of the launch of the inaugural National Action Plan Academy, a joint initiative of the Georgetown Institute for Women, Peace and Security, The Institute for Inclusive Security and the No Ceilings initiative of the Clinton Foundation. (AP Photo/Carolyn Kaster)",https://img.huffingtonpost.com/asset/5bb8e9ec2400003100577877.jpeg?ops=scalefit_720_noupscale,"WASHINGTON (AP) — The foundation launched by former President Bill Clinton more than a decade ago has battled HIV and AIDS in Africa, educated millions of children and fed the poor and hungry around the globe. It also has the potential to become a political risk for Hillary Rodham Clinton as she moves toward a second presidential campaign.The former secretary of state has struggled with some recent bad headlines over large donations given to the foundation by foreign governments in the past two years, and the $200 million-plus the organization has raised since 2013, ahead of her anticipated White House campaign.Republicans contend that foreign governments donating to a foundation led by a potential U.S. president creates unacceptable conflicts of interests. Also, the involvement of big money reinforces a long-standing narrative pushed by the GOP of the Clintons as a couple who frequently mix business and politics.""Unless Hillary Clinton immediately reinstates the ban on foreign countries giving to her foundation and returns the millions of dollars these governments have already donated, she's setting an incredibly dangerous precedent,"" said the chairman of the Republican National Committee, Reince Priebus. ""The American people are not about to elect a president in Hillary Clinton who could expose them to the demands of foreign governments because they dumped massive sums of cash into her foundation.""The foundation, which is scheduled to hold events in Morocco and Greece this spring, defended its financial support and addressed how it might function if Clinton runs for president. If she seeks office again, something taken as a given by most, the foundation said it would ensure its policies and practices are ""appropriate, just as we did when she served as secretary of state.""In 2009, when Clinton became President Barack Obama's chief diplomat, the foundation stopped raising money from foreign governments. The fundraising involving non-U.S. entities resumed in 2013, after she left the his administration.The Wall Street Journal last week reported the foundation had received money in 2014 from the United Arab Emirates, Saudi Arabia, Oman and others. The Washington Post reported the charity has raised nearly $2 billion since the former president started it in 2001. About one-third of its donations of $1 million or more come from foreign governments or non-U.S. entities, the newspaper found.Democrats say the Clintons can defend their work at the foundation because of its track record and history of tackling some of the world's biggest problems, from AIDS and clean water to hunger, educational opportunities and the protection of endangered wildlife.They also note that the foundation voluntarily discloses its donors — nonprofits are not required to do — and say there is no evidence the Clintons have used it to enrich themselves. Nearly 90 percent of the foundation's money goes toward its programming.""The foundation has done amazing work,"" said Connecticut Gov. Dan Malloy, a Democrat who campaigned with Bill Clinton last year. ""It has been a unifying force in our national affairs and in our international affairs.""Yet the influx of corporate and foreign money just before a potential Hillary Clinton campaign has caused some anxiety within her party.""There was a reason they stopped taking foreign government donations when Hillary was secretary of state,"" said Mike Carberry, a Johnson County, Iowa, supervisor and former county Democratic chairman. He said the foundation should reinstate the policies used from 2009 to 2013. ""It doesn't seem right.""The foundation has strong ties with several corporations and other large foundations. Last September's annual meeting in New York was sponsored by an array of companies that regularly lobby the federal government, including financial firms HSBC Bank USA, Barclays and Deutsche Bank, as well as Fortune 500 companies such as Coca-Cola, Microsoft, Monsanto, Procter & Gamble and ExxonMobil.Goldman Sachs, whose corporate officers have played leading roles in the Treasury Department in recent years, has worked with the Clinton Foundation on the 10,000 Women Initiative aimed at helping female entrepreneurs around the globe access capital.Many of the same donors to the Clintons' political campaigns have given money to the foundation. Dennis Cheng, a former Hillary Clinton campaign fundraiser, recently left the foundation as its chief development officer and is expected to be a top fundraiser for her expected campaign.The examination of the foundation's finances come as many Democrats want Clinton to take on a more populist economic agenda that would demand more oversight of Wall Street firms. It also follows efforts by Democrats to scrutinize Republican Mitt Romney's business practices in 2012 and tie Republican candidates to millions of dollars provided by the Koch Brothers and their business interests.Beyond the headlines, many Democrats say it shows the need for Clinton to begin actively campaigning and build an apparatus better suited to rapidly respond to these types of critiques.""There's a vacuum,"" said Tom Henderson, the chairman of the Polk County, Iowa, Democrats, who noted potential candidates such as former Maryland Gov. Martin O'Malley and former Virginia Sen. Jim Webb are visiting soon. ""She isn't doing anything"" in Iowa, he said.___Follow Ken Thomas on Twitter: https://twitter.com/KThomasDC"
15,RELIGION,"Norwegians Plan To Link Hands, Form Human 'Peace Circle' Around Mosque",Ryan Grenoble,https://www.huffingtonpost.com/entry/norwegian-oslo-peace-circle-mosque-muslims_n_6730536.html,,2015-02-22,"Norwegian Muslims create a human peace ring around the synagogue in Oslo, Norway on February 21, 2015. More than a 1,000 joined a peace vigil in Oslo Saturday, hosted by young Norwegian Muslims in a show of solidarity with Jews a week after fatal shootings in Denmark targeted a synagogue and free speech seminar. AFP PHOTO / FREDRIK VARFJELL (Photo credit should read Fredrik Varfjell/AFP/Getty Images)",https://img.huffingtonpost.com/asset/5bb7fb871f00002501252dbf.jpeg?ops=scalefit_720_noupscale,"One peace ring begets another.A group of Norwegians plans to link hands and encircle a mosque in Oslo, Norway, next Saturday, offering the symbolic peace gesture as a ""thank you"" to the city's Muslim population, more than 1,000 of whom formed their own ""peace circle"" around Oslo's synagogue this weekend.Organizers of the event say they want the human shield to be a seen as an endorsement of peace, tolerance and respect for Muslims, who they say are ""a vulnerable minority in Norwegian society.""""We want to stand shoulder to shoulder with our Muslim fellow citizens to show disgust towards increasing Muslim hate and xenophobia in society,"" the organizers say, according to a translation of the event's Facebook page. ""In this time of fear and polarization we feel it is more important than ever to stand together and show solidarity,"" the organizers continue. ""We believe in and will highlight [the] human will to live together in peace and in [respect] for each other regardless of religion [and] ethnicity.""This past Saturday, members of Oslo's Muslim population encircled a synagogue there. The gesture came a week after a Danish-born man, reportedly of Arab origins, killed two people at a free speech event and a synagogue in Copenhagen, Denmark.""Humanity is one and we are here to demonstrate that,"" Zeeshan Abdullah, one of the organizers of the synagogue event, told Reuters. ""There are many more peace mongers than warmongers ... There's still hope for humanity, for peace and love, across religious differences and backgrounds."""
16,ENTERTAINMENT,Aziz Ansari Pays Tribute To 'Parks & Rec' Producer Harris Wittels,E. Oliver Whitney,https://www.huffingtonpost.com/entry/aziz-ansari-harris-wittels-letter_n_6730602.html,,2015-02-22,"Aziz Ansari arrives at the 71st annual Golden Globe Awards at the Beverly Hilton Hotel on Sunday, Jan. 12, 2014, in Beverly Hills, Calif. (Photo by Jordan Strauss/Invision/AP)",https://img.huffingtonpost.com/asset/5c9a8ff0230000c100af4c38.jpeg?ops=scalefit_720_noupscale,"After Amy Poehler paid tribute to ""Parks and Rec"" producer, writer and guest star Harris Wittels on Thursday night, her co-star Aziz Ansari took to Tumblr to pen a heartfelt letter to the 30-year-old co-executive producer. Wittels, who ""Parks"" fans will also recognize as the animal control guy, was found dead at his home on Thursday.Ansari opened his letter by saying how ""devastated"" he felt over Wittel's death. ""There are so few people that you meet in life that give you that feeling that you’ve found a real unique, original person,"" Ansari wrote. ""Harris Wittels was one of those and we lost him yesterday. I’m still waiting for the other phone call to let me know that Harris is okay and this was all a horrible misunderstanding.""The ""Parks"" star looked back on his favorite memories and jokes with Wittels, who he was collaborating with on two unfinished film scripts. Ansari wrote that he always insisted on working with Wittels for things outside of ""Parks,"" including the time he hosted the 2010 MTV Movie Awards.""His jokes were so weird, unexpected, often brilliantly dumb that they were in that ultra-exclusive club of ones that made comedy people laugh -- and laugh hard. This was why Harris was such a go-to for everyone. Anyone that was ever in a writers room with him knew he was probably the funniest comedy writer out there. He was just a machine.""The emotional letter shares a handful of touching anecdotes about Wittels' bold and hilarious emails, his characteristic eating habits on set and Ansari's last memory of working with him the day before his death. The actor also wrote about Wittels' known struggle with addiction: ""We knew Harris had issues with addiction but things were pointing in the right direction. He was getting treatment and focused on his career and the opportunities ahead. It all seemed to point in the right direction.""Ansari closed the tribute with saying how much of a ""brutal loss"" Wittels' death is. ""You are far too special to sum up in any kind of piece like this. You were one of the best and we all will miss you.""Read Ansari's full letter here."
17,POLITICS,Potential GOP Presidential Candidates Are Divided On Gay Marriage,,https://www.huffingtonpost.com/entry/potential-gop-presidentia_0_n_6730306.html,,2015-02-22,"WASHINGTON, DC - JANUARY 21: Sen. Rand Paul (R-KY) speaks at a Ripon Society breakfast on Capitol Hill, January 21, 2015 in Washington, DC. Sen. Paul discussed President Barack Obamas State of the Union address and the Senate agenda for the coming year. (Photo by Mark Wilson/Getty Images)",https://img.huffingtonpost.com/asset/5bb8e9ec240000500098fbea.jpeg?ops=scalefit_720_noupscale,"WASHINGTON — A divide over gay marriage is emerging in the potential Republican presidential primary field, with candidates falling into one of two camps: those who want to admit defeat on a key social cause and move on, and those who want to keep fighting.Read more on The Boston Globe"
