,category,headline,authors,link,short descr,date,image_caption(s),image_link(s),article
0,STYLE & BEAUTY,Olivia Munn Pops In Bright Blue Jeans (PHOTO),Michelle Persad,https://www.huffingtonpost.com/entry/olivia-munn-photo_us_5b9c16d7e4b03a1dcc7c3f83,WHERE: The PETA activist was seen out and about in the Soho area of New York City on July 27th. Fame Flynet Want more? Be,2012-08-04,"Calvin Klein Lightweight ""Challis"" Roll-Up Shirt, $44",https://img.huffingtonpost.com/asset/5b9c16d726000036007f5a39.jpeg?ops=scalefit_960_noupscale,"WHO:  ""Magic Mike"" star and model, Olivia Munn WHAT: The covergirl may have been busy texting all afternoon, but she certainly took time out to pick this perfect ensemble. Munn paired bright blue jeans (very on trend right now) with a casual button-up cream tee. She let the denim steal the show, opting for a pair of nude pumps and a simple black shoulder bag. To add some interest to the top half of her outfit, the Oklahoma native layered on bracelets and added large hoop earrings. Her side part and pink blush finished the look off beautifully. WHERE: The PETA activist was seen out and about in the Soho area of New York City on July 27th.  Fame Flynet Shop a similar look below and check out more of our Look Of The Day picks.Want more? Be sure to check out Stylelist on Twitter, Facebook, Tumblr and Pinterest."
1,WELLNESS,"Michelle Rounds Desmoid Tumors: Rosie O'Donnell's Fiancee's Condition, Explained",,https://www.huffingtonpost.com/entry/michelle-rounds-desmoid-tumors-rosie-odonnell_us_5b9c179de4b03a1dcc7c46ae,People magazine reported that Rounds had the surgery in June. The couple has decided to postpone their wedding until next,2012-08-04,"CHICAGO, IL - MARCH 01: Michelle Rounds and Rosie O'Donnell attend Escape To Total Rewards at Union Station on March 1, 2012 in Chicago, Illinois. (Photo by Tasos Katopodis/Getty Images for Caesars Entertainment)",https://img.huffingtonpost.com/asset/5b9c179d2100003300c4fdee.jpeg?ops=scalefit_720_noupscale,"Michelle Rounds, fiancee of Rosie O'Donnell, is recovering after undergoing surgery for desmoid tumors, according to news reports.People magazine reported that Rounds had the surgery in June. The couple has decided to postpone their wedding until next summer because of Rounds's illness, O'Donnell wrote on her blog. ""Desmoid tumors, odd and curious beasts, strong and sneaky, a non cancer that acts cancerous,"" O'Donnell wrote on her blog. ""Only 900 cases a year in the US, an orphan disease -- beyond rare, only 3 people per million get this, michelle is one of them."" According to the Desmoid Tumor Research Foundation, desmoid tumors -- also known as aggressive fibromatoses -- are considered benign, but that doesn't mean they aren't dangerous because they grow quickly just like cancer. The tumors grow in the soft connective tissue in the body, but can also spread to other nearby tissues and organs, the Mayo Clinic reported. They can even grow into bone. Desmoid tumors are most common in men and in people between the ages of older childhood up until the 40s, according to the American Academy of Orthopaedic Surgeons. Symptoms usually include feeling some sort of lump -- sometimes painful -- in the arm or leg. However, symptoms can become more severe -- limiting mobility -- depending on where the tumors grow. The location of the tumors could also bring up other health concerns. For example, if the tumors form in the abdomen, it could lead to rectal bleeding or other GI symptoms, according to the Desmoid Tumor Research Foundation.The tumors are diagnosed with imaging tests like ultrasound, MRI or CT scans, or with a biopsy, according to the Mayo Clinic. Surgery is usually the best way to remove desmoid tumors, the American Academy of Orthopaedic Surgeons reported, though radiation therapy and drugs (like NSAIDs and Cox II inhibitors) could also help. "
2,DIVORCE,Divorce Readiness Questionnaire,"Natalie Gregg, Contributor
Divorce Lawyer, Entrepreneur, Mother of Two",https://www.huffingtonpost.com/entry/divorce_us_5b9c175ee4b03a1dcc7c448d,"Here are 10 Simple, True-or-False questions to ask if you are considering divorce.",2012-08-04,Close up of a couple arguing with the arms crossed,https://img.huffingtonpost.com/asset/5b9c175e2400003200531231.jpeg?ops=scalefit_720_noupscale,"I am a family lawyer, but I don't sell divorce. I often hear something like this from prospective clients:""I'm not sure that I want a divorce. Things have been bad for a while, but I am still hanging on. Sometimes I feel like it is over, but then I think of the kids, our house, our life. Is divorce really worth it?Your attorney is not there to convince you that your spouse is worthless, abusive or lacking in everything that you find valuable and good in this world, and they should never try to convince you that you need to leave your spouse if you are unsure.If you can't decide if divorce is worth it, you probably need to consult with a marital counselor instead of an attorney. However, bear in mind that a marriage counselor or family therapist advocates for the relationship -- the unit of both husband and wife, together.If you want a counselor that advocates for you and for your best interests as an individual, then I recommend that you find a therapist who does cognitive behavioral therapy or psychotherapy. Be sure to check whether mental health coverage is available on your health insurance plan and then find a provider inside your network. You can likely get a good referral from your family physician.Above all, focus on your family and what you need to do to preserve it. Consider your choice very carefully, and be sure to get the facts about what divorce entails before you pursue it. If you have children, you need to realize that you will most likely remain co-parents with your spouse after the divorce. You may not love your spouse anymore, but he or she will remain a part of your life until the kids are out of the house.Even if you are not sure what you should do, consider meeting with an attorney to discuss your options. Definitely find an attorney who is focused on family law, not a generalist who would take a criminal case or traffic ticket just as readily as a divorce. This is one of the most challenging roads that you will ever walk; be sure that you have an experienced guide to lead the way.If divorce is on your mind, here are 10 simple true-or-false questions to ask yourself before splitting:1. True or False: In the last six months, my spouse has changed their exercise, dress and grooming regime to look younger or fitter.2. True or False: I have not had sex with my spouse in over one month.3. True or False: I suspect that my spouse is cheating.4. True or False: I can't remember the last time sex was good.5. True or False: I can't remember why I married my spouse in the first place.6. True or False: I don't have access to the marital accounts, or the access that I have is very limited.7. True or False: I am currently involved in a romantic relationship with someone other than my spouse.8. True or False: My spouse has been diagnosed with a mental disorder/disease and fails to seek counseling or medical treatment.9. True or False: My spouse has an addiction to drugs, alcohol, porn, gambling, shopping, etc. but fails to seek treatment to address the addiction.10. True or False: We fight more than we laugh.If you answered TRUE to 1 or 2 questions, you are probably in need of some marital counseling or a good, old-fashioned date night with your spouse that includes a heart-to-heart conversation.If you answered TRUE to 2-5 questions, your marriage is salvageable but will take a lot of work. You need to ask yourself, ""Does my desire to fix this marriage outweigh my exhaustion at trying to do so?"" If so, then you should explore marital counseling. It is also advisable to consult with a lawyer just to ensure that you know your rights.If you answered TRUE to more than 5 questions, contact a family attorney."
3,BLACK VOICES,President Obama Birthday: Our Favorite Moments From The Commander-In-Chief's 50th Year,,https://www.huffingtonpost.com/entry/obama-birthday-2012_us_5badbea4e4b0bb1705faaae0,"Today, President Barack Obama celebrates his 51st birthday, and over the last 12 months the commander-in-chief has had more",2012-08-04,"President Barack Obama speaks at a campaign event at Loudoun County High School, Thursday, Aug. 2, 2012 in Leesburg, Va. (AP Photo/Pablo Martinez Monsivais)",https://img.huffingtonpost.com/asset/5badbea42200003401dac3ae.jpeg?ops=scalefit_720_noupscale,"Today, President Barack Obama celebrates his 51st birthday, and over the last 12 months the commander-in-chief has had more than his share of successes related to his job as president. Although his policy related successes are worthy of note, today Huffington Post BlackVoices decided to focus on some of the president's lighter moments from his 50th year -- moments that remind us that, despite his position as the most powerful man in the world -- he is still a regular guy.Check out our list and let us know which moments you enjoyed. "
4,BUSINESS,Money Laundering Banks Should Be Put Out Of Business,"Bloomberg View, Bloomberg View",https://www.huffingtonpost.com/entry/money-laundering-banks-drugs_us_5bb2ccb5e4b0480ca65c4f8f,Cash Surplus Bloomberg View: Today’s highlights: the editors on India’s power failures and on how Congress failed on cybersecurity,2012-08-04,"People walk past a logo of HSBC headquarters in Hong Kong Monday, July 30, 2012. HSBC PLC is to take a $700 million charge to cover the cost of U.S. fines arising from its failure to stamp out money-laundering at the bank. The provision was announced as the bank reported an 11 percent gain in pretax profit in the first half of the year, boosted by $4.3 billion in gains from asset sales. (AP Photo/Vincent Yu)",https://img.huffingtonpost.com/asset/5bb2ccb53c000020010c33fc.jpeg?ops=scalefit_720_noupscale,"Bloomberg View:To grow up in South Florida during the 1970s and 1980s, as I did, wasn’t your typical American childhood experience. Back then the area was known as the most dangerous place in the country.Carnage from the drug wars filled the local news long before “Miami Vice” became a hit TV show. By elementary school, my friends and I knew some of the lingo. A Colombian necktie wasn’t a piece of clothing, but a gruesome execution method. When I was 7 years old my barber was murdered in his shop, apparently over a drug deal.It had been a long time since I thought much about those days. By chance I recently came across a fabulous documentary, “Cocaine Cowboys,” by Miami filmmaker Billy Corben. Then last month a Senate panel held a hearing on the U.K. bank HSBC Holdings Plc (HSBA) and its ties to drug lords, money laundering, al- Qaeda and rogue nations such as Iran and North Korea.Here’s a bank with $2.7 trillion of assets that flouted U.S. laws for a decade, according to the July 17 report by the Senate Permanent Subcommittee on Investigations. HSBC turned a blind eye to organized crime, Mexican drug cartels and overseas terrorism financiers, and gave them access to the U.S. banking system. HSBC’s main U.S. regulator, the Office of the Comptroller of the Currency, for years tolerated its violations of anti-money laundering laws.For this, HSBC and the OCC apologized. Justice Department fines are likely. It’s an outrage HSBC hasn’t had its U.S. banking licenses revoked, assuming the Senate panel’s report is accurate -- and there’s no reason to believe it isn’t.Try ThisLet’s try out a novel idea: Banks that help drug cartels launder money and give cover to those tied to terrorism should be put out of business. Is that really so hard for everyone to agree on? Free markets have worked in the U.S. because we have the rule of law. It’s why so many investors from other countries want to do business here. When contracts are breached, courts can be accessed to enforce them. When individuals or companies commit crimes, they’re supposed to be prosecuted and punished.Except we have this mutant species of corporation called too-big-to-fail banks whose collapse might wreck the global economy. No financial institution in the U.S. can survive a felony indictment. So these companies have become un-indictable, creating a perverse nonchalance regarding financial crimes. In 2010, Wachovia paid $160 million to settle criminal allegations of laundering Mexican drug money. By then the bank had been bought by Wells Fargo & Co. (WFC), and the Justice Department let it off with a deferred-prosecution deal. Usually the most that happens to management is someone resigns, as HSBC’s head of compliance, David Bagley, said he would at last month’s Senate hearing.What would it take for the government to really crack down on wrongdoing in the financial-services industry? What finally prompted the feds to do something about cocaine smuggling into South Florida long ago was the epidemic of violence it spawned.A defining moment came in July 1979, when drug traffickers went on a shooting spree in broad daylight at the Dadeland Mall in Kendall, southwest of Miami. This was unprecedented. The gunmen arrived in a delivery van that had been converted into an armored personnel carrier. Two people were killed. Bystanders dove for cover. Cars in the parking lot were riddled with bullets from machine-gun fire.Attacks like that became frequent over the next few years. In 1979 there were 349 murders in South Florida, according to the Justice Department, triple the number of two years earlier. By 1981 murders had climbed to 621. The local police were outgunned, outnumbered, easily corrupted and often stoned. Finally in 1982 President Ronald Reagan formed a task force and devoted hundreds of additional federal agents to South Florida to restore law and order.Cash SurplusBack then, too, the cartels’ enablers included dirty banks. As Corben’s film noted, in 1979 the Federal Reserve’s Miami branch reported a $5 billion cash surplus -- more than the country’s other Federal Reserve banks combined. One crucial difference, compared with today, was the drug banks in those days were relatively small. When an outfit such as Sunshine State Bank got busted, it didn’t threaten the economy.In terms of stray bullets, Miami is a much safer place today. But mainly what the U.S. did was drive the cartels, the turf battles and the killings into Mexico, where the violence is out of mind for most Americans even while much of that country has turned into a narco-state.Maybe if the bankers were the ones spraying machine-gun fire in the streets, that might spur the U.S. government to take meaningful, punitive action. Short of that, you have to wonder if anything would. Too-big-to-fail isn’t merely an economic problem. It is a great moral failing of our society that poisons our democracy. Something has to give.(Jonathan Weil is a Bloomberg View columnist. The opinions expressed are his own.)Read more opinion online from Bloomberg View. Subscribe to receive a daily e-mail highlighting new View editorials, columns and op-ed articles.Today’s highlights: the editors on India’s power failures and on how Congress failed on cybersecurity; Stephen L. Carter on educational inequality; Ezra Klein on Mitt Romney’s exploding tax plan; William Pesek on higher food prices and Asia’s poor; Virginia Postrel on the historical lie behind “you didn’t build that”; Richard Cohen on the changing of the guard in Olympic fencing; Mohamed El-Erian on why central bankers can’t save the world; Handel Reynolds on cancers we don’t need to know about; Anthony B. Sanders on why Edward DeMarco was right to block mortgage writedowns.To contact the writer of this article: Jonathan Weil in New York at jweil6@bloomberg.net.To contact the editor responsible for this article: James Greiff at jgreiff@bloomberg.net."
5,BUSINESS,Is Education a Silver Bullet for Fixing the Economy?,"Richard Kirsch, Contributor
Director of Our Story - The Hub for American Narratives and au...",https://www.huffingtonpost.com/entry/is-education-a-silver-bul_us_5bb2cccae4b0480ca65c50ca,Is the president's assertion that the path to the American Dream in the new global economy depends on providing every child with a good education true?,2012-08-04,"In this Tuesday, July 17, 2012, file photo, business employment specialist Linda Reynolds, right, helps job searcher D'Andre Preston at WorkSource Oregon in Tualatin, Ore. The number of Americans seeking unemployment benefits rose by 34,000 last week, a figure that may have been skewed higher by seasonal factors. Applications for benefits increased to a seasonally adjusted 386,000, the Labor Department said Thursday, July 19, 2012. The gain followed a drop of 24,000 the previous week and was the biggest jump since April 2011. (AP Photo/Rick Bowmer, File)",https://img.huffingtonpost.com/asset/5bb2ccca200000300000094e.jpeg?ops=scalefit_720_noupscale,"We all know that the key to our economic future is a more educated workforce, right? Here, for example, are the ""Guiding Principles"" of President Obama's education policies: Providing a high-quality education for all children is critical to America's economic future. Our nation's economic competitiveness and the path to the American Dream depend on providing every child with an education that will enable them to succeed in a global economy that is predicated on knowledge and innovation.Now it's certainly true that a good education is still the best ticket -- other than inheriting wealth -- to entering the middle class. In the simplest terms, Americans with a Bachelor's degree or more earn more than the average wage and those with an Associate's degree earn less. So it makes sense for us to encourage our children to get a good education. But is the president's assertion that the path to the American Dream in the new global economy depends on providing every child with a good education true?As an important new report underscores, if that is the only path we rely on, our economy will come up way short and so will the great majority of Americans who are striving to live the American Dream -- with and without a good education. In Where Have All the Good Jobs Gone?, Center for Economic and Policy Research economists John Schmitt and Janelle Jones make a simple and powerful point: Over the past three decades, the workforce in the United States has gotten a lot more educated and productive, but fewer of us have a good job. The standard that Schmitt and Jones set for a good job is pretty basic: earning the median wage for men of $37,000 a year and having some sort of health insurance and retirement fund at work. Of course, that isn't a lot of money, and with most workers forced to pick up a bigger share of shrinking health benefits and pensions giving way to 401Ks, not a lofty benefit plan. Which is what makes the results of the study so striking. Even though the typical American worker is twice as likely to have a college degree than 30 years ago, the share of the workforce that has a good job declined, from 27.4 percent to 24.6 percent. The kicker here is that the decline occurred at every education level, although it was worse for those with a scanty education. But even workers with a four-year college degree or better were less likely to have a minimally decent job. The CEPR researchers take the data a bit further to make two compelling points. If we had not increased our educational level, it would have been a lot worse: only 17 percent of workers would have good jobs. The second point is that if job quality had kept up with increases in education, then 34 percent of workers would have a good job.I want to throw one more scary statistic into this brew before drawing the implications for building an economy that will work for everyone: most of the jobs that will be created in the next decade don't require much of an education. Of the 10 occupations expected to create the most jobs, eight of them require a high school degree or less. There will be almost four million job openings for retail clerks, home health aides, and the like compared with one million for nurses and college professors, the only two jobs in the 10 that require more than a high school degree.These numbers foretell an economy where even workers with a good education are barely making it and most Americans don't have a prayer of living the American Dream.The guiding principle for a different economic path is making the middle class the engine of the economy. Our economic policy must be driven by a commitment to make every job a middle-class job, regardless of the educational level of the worker. That means sharing our economic progress broadly, not concentrating it among a shrinking sliver of the rich.As the authors of Where Have All the Good Jobs Gone? point out in the first paragraph of their report, we have gotten a lot richer as a nation -- 60 percent richer -- over the 30 years in which good jobs dissolved. A more educated workforce, and an increase of about 50 percent in physical capital growth, led to a big jump in productivity. If that growth in productivity had been shared fairly, that $37,000 median wage would be a lot higher: $68,000 by one calculation. Even by a more modest measure -- if inequality had not increased, median family income would be $9,000 more. By either calculation, if that extra income were in the pockets of Americans -- instead of sitting in the investment portfolios of the super-rich and big corporations -- the economy would be booming.There are a host of policy solutions to build an economy in which our growth is broadly shared. A huge step would be to increase unionization. The manufacturing and construction workers of the mid-20th century didn't have a high school education -- they had a union. We should boost pay for low-income workers by increasing the minimum wage and enforcing wage laws so that employers pay workers for overtime and meal breaks and don't steal their wages or pretend they are independent contractors. We need to use public dollars to invest in job creation, from construction workers to school teachers, all with good wages and benefits. And yes, we should make it possible for many more of our young people to get a good and affordable education. But whether they get that education or not, all workers should get enough to live a dignified, secure life so they can take that path to the American Dream. Cross-posted from Next New Deal."
