,category,headline,authors,link,short descr,date,image_caption(s),image_link(s),article
8,HEALTHY LIVING,"Ebola Highly Unlikely To Become Airborne, Top Scientist Says",Amanda L. Chan,https://www.huffingtonpost.com/entry/ebola-airborne_n_5838054.html,,2014-09-17,"Dr. Anthony Fauci, the director of the National Institute of Allergy and Infectious Diseases, testifies before the House Foreign Affairs subcommittee on Africa, Global Health, Global Human Rights, and International Organizations hearing on the Ebola virus on Capitol Hill in Washington, Wednesday, Sept. 17, 2014. (AP Photo/Susan Walsh)",https://img.huffingtonpost.com/asset/5b9e4ce72100003300c5dde5.jpeg?ops=scalefit_720_noupscale,"WASHINGTON (AP) — It's incredibly unlikely that Ebola would mutate to spread through the air, and the best way to make sure it doesn't is to stop the epidemic, a top government scientist told concerned lawmakers Wednesday.""A virus that doesn't replicate, doesn't mutate,"" Dr. Anthony Fauci of the National Institutes of Health told a House Foreign Affairs subcommittee.Fauci said U.S. researchers are monitoring for mutations in the virus, which has killed at least 2,400 people.But considering all the dire things to worry about with this out-of-control epidemic in West Africa, that mutation concern is not ""something I would put at the very top of the radar screen,"" said Fauci, head of NIH's National Institute of Allergy and Infectious Diseases.The unprecedented Ebola outbreak is believed to have sickened nearly 5,000 people, mostly in Liberia, Sierra Leone and Guinea. The deadly virus also has reached Nigeria and Senegal.Ebola is spread through direct contact with the bodily fluids of sick patients. But as the epidemic has grown, so have questions about whether, if left unchecked, the virus might transform and become more contagious.In hearings in the Senate and House on Tuesday and Wednesday, lawmakers asked Fauci if it might even become airborne.Viruses certainly mutate all the time, making mistakes as they copy themselves in order to grow and spread, Fauci explained. Most of those mutations are irrelevant, not associated with any biological change.But sometimes, those mutations can make a virus a little more or a little less virulent, or make it a little more or a little less efficient at spreading in whatever way it normally is transmitted, he said.""Very, very rarely does it completely change the way it's transmitted,"" Fauci said.He stressed that he's not saying it's impossible.""People might think I'm pooh-poohing it. I'm not,"" Fauci said.He said the government had funded the Broad Institute in Boston to study the virus' mutations. In a publication last month, the researchers reported a somewhat more rapid rate of mutations than expected at that point in the outbreak, but that nothing had jumped out as being of special concern so far.Copyright 2014 The Associated Press. All rights reserved. This material may not be published, broadcast, rewritten or redistributed."
9,IMPACT,Why the Health of Mothers and Newborns Is Inseparable,"Esther Sharma, ContributorMum-to-one, qualified midwife, blogger for Girls Globe",https://www.huffingtonpost.com/entry/why-the-health-of-mothers_b_5837988.html,"I visited Maryam when her baby was 2 weeks old. I had been meaning to go sooner, but the steep, icy roads up to her 'house' in Kabul prohibited an earlier visit.",2014-09-17,"A woman wearing a burqa carries a child through the old town area of Kabul on June 19, 2010. At least five civilians, including two young girls, were killed in an air strike by NATO forces in eastern Afghanistan, police and hospital officials said. AFP PHOTO / ED JONES (Photo credit should read Ed Jones/AFP/Getty Images)",https://img.huffingtonpost.com/asset/5bb1ccee1f0000390123645b.jpeg?ops=scalefit_720_noupscale,"I visited Maryam when her baby was 2 weeks old. I had been meaning to go sooner, but the steep, icy roads up to her 'house' in Kabul prohibited an earlier visit. I guess that Maryam was about 15 when she had her baby, but no one really knows. She lived in a noisy and sparse house full of women and babies -- no men, which is unusual in Afghanistan and left the household somewhat vulnerable. It was wintertime, bitterly cold with little heating. I have no idea how these women ever got money for food, let alone heating. Maryam had recently moved to Kabul from another part of the country, didn't speak Dari, (the trade language of Kabul) and certainly didn't know how to read or write. When I arrived at her dilapidated mud house, I found her sitting with her tiny new baby heavily wrapped. She gave birth at home and had not had any postnatal care. I undressed the baby to conduct a newborn check. When I removed the baby's hat, I was horrified to discover a large oozing open sore on the side of the head, stretching down to the face. The baby had a severe case of impetigo -- an easy-to-treat but infectious bacterial condition, which can become serious if left unchecked. It is most likely that Maryam would not have sought any medical care for her baby had I not visited; she had no money to pay for transport to a health facility, no male chaperone to accompany her, she could not speak the language, didn't have the skills to negotiate a busy clinic and would probably have been ripped off at the pharmacy.An estimated 289,000 women died giving birth last year, and a staggering 2.9 million newborns die during their first month of life, amid sustained efforts to meet the Millennium Development Goals (MDG's) 4 and 5 targets of reducing child and maternal mortality rates, respectively.Significant progress towards reaching the MDG's has been made, particularly in the area of maternal health. The number of women dying due to pregnancy or birth related causes fell by nearly 50 percent globally since 1990 - an enormous achievement.Although overall, child (under 5) deaths have been declining, progress towards improving newborn survival is lagging behind. No specific MDG target around reducing newborn mortality has meant less focus in this area. Currently 40 percent of child deaths occur in newborns, representing an increase on newborn deaths in the past 10 years.There has been a tendency to treat the health of mothers and newborns as separate entities, instead of taking the necessitated fully integrated approach. The Lancet's recent Every Newborn series highlighted that the health and wellbeing of mothers and their babies is inseparable and that initiatives to improve maternal health must also incorporate newborn health elements. Putting this into practice, the Every Newborn Action Plan supports the implementation of ""newborn-specific actions"" within the context of maternal, newborn, child and adolescent health. As a midwife myself, it has been encouraging to see the fantastic recent emphasis on strengthening and scaling up midwifery on a global level -- midwives are perfectly placed to provide care to the mother and baby dyad, and are crucial to the success of MDG's 4 and 5 and post-2015 targets related to maternal and newborn health.But it goes even further than this. Evidence shows that educational gains for girls and women are associated with reduced child mortality; the use of modern contraceptives among women of childbearing age reduces fertility rates which in turn benefits the economic growth of countries and leads to greater job opportunities for women; empowering women through community participatory women's groups improves maternal and newborn health. The Every Woman, Every Child movement states that, ""The health of women and children is critically important to almost every area of human development and progress"".There are less than 500 days left to reach the MDG targets. The 17 proposed Sustainable Development Goals encompass a much broader agenda and it is not yet clear how progress will be measured. The great challenge that lies before us is to maintain the focus and build on the gains of improving the lives of mothers and their babies in the post-2015 world.In spite of living in Afghanistan's largest and best-resourced city, Maryam did not have any antenatal care. As a teenager, she was at higher risk of pregnancy related complications during pregnancy and birth. Fortunately, she remained healthy and her birth was straightforward, and with help accessing health care, her baby's impetigo was treated. But things could have been different. I want to see a day when young women like Maryam are educated, protected from child marriage, free to choose when they start having children, able to access care from a skilled midwife during pregnancy, birth and the postnatal period, free to plan how often and how many subsequent children to have, and whose babies not only survive, but thrive."
10,POLITICS,Attorney General Calls For Bigger Rewards For Wall Street Whistleblowers,Shadee Ashtari,https://www.huffingtonpost.com/entry/eric-holder-whistleblower-wall-street_n_5837790.html,,2014-09-17,"WASHINGTON, DC - AUGUST 21: Attorney General Eric Holder makes a major financial fraud announcement during a press conference August 21, 2014 at the Justice Department in Washington, DC. The Justice Department has reached a $16.65 billion settlement with Bank of America Corporation for financial fraud leading up to and during the financial crisis, the largest civil settlement with a single entity in American history, to resolve federal and state claims against Bank of America and its former and current subsidiaries, including Countrywide Financial Corporation and Merrill Lynch. (Photo by Alex Wong/Getty Images)",https://img.huffingtonpost.com/asset/5e691602230000cd1a0c2464.jpeg?ops=scalefit_720_noupscale,"Attorney General Eric Holder is urging Congress to increase the amount of cash rewards federal prosecutors can pay whistleblowers that turn over evidence of white-collar crime.""[T]he buck needs to stop somewhere where corporate misconduct is concerned,"" Holder said in remarks prepared for a speech Wednesday at the New York University School of Law. ""[W]e need not tolerate a system that permits top executives to enjoy all of the rewards of excessively risky activity while bearing none of the responsibility.""As the Justice Department furthers its ongoing investigations into potentially illegal conduct by financial firms, insider information from Wall Street executives has served as a critical factor in equipping prosecutors with the often elusive ""smoking gun"" evidence needed to ensure a conviction, Holder said in excerpts of the speech provided by the Justice Department. But under current law, provisions in the 1989 Financial Institutions Reform, Recovery, and Enforcement Act (FIRREA) cap the amount a whistleblower can receive for providing evidence of financial fraud at $1.6 million, ""a paltry sum"" for Wall Street executives, Holder said. In contrast, he argued, the federal False Claims Act, which combats fraud against government programs, allows citizens to receive as much as one-third of any damages recovered by the government.For federal prosecutors to gain access to the evidence needed to bring enforcement actions against financial fraud, Holder said, FIRREA must be modified to provide greater financial incentives for executives risking their careers to provide insider information to investigators.In recent years, however, the Justice Department has faced growing criticism over its failure to bring criminal charges against high-level individuals and major banks in connection with the 2008 financial crisis. Justice Department officials, including Holder, have responded by saying that some banks are just too big to prosecute, and that doing so would upset the global financial system.""I am concerned that the size of some of these institutions becomes so large that it does become difficult for us to prosecute them when we are hit with indications that if you do prosecute, if you do bring a criminal charge, it will have a negative impact on the national economy, perhaps even the world economy,"" Holder said during testimony before the Senate Judiciary Committee in March 2013. ""And I think that is a function of the fact that some of these institutions have become too large.""On Wednesday, Holder further stressed the importance of holding ""individual decision-makers"" responsible for their crimes -- in the name of judicial ""fairness"" and ""accountability.""""All other things being equal, few things discourage criminal activity at a firm -- or incentivize changes in corporate behavior -- like the prospect of individual decision-makers being held accountable,"" Holder said. "
11,ENTERTAINMENT,"MasterChef Recap: Girls Rule, Boys Drool in 'Winner Chosen'","Karen Fratti, ContributorTelevision connoisseur",https://www.huffingtonpost.com/entry/masterchef-recap-girls-ru_b_5837860.html,"Usually, MasterChef exaggerates: most extreme pressure test ever, or biggest cooking competition in the world!"" but this finale was super real.",2014-09-17,2014-09-17-519001masterchefwinnerchosenphotoslightboxtbd.jpg,https://images.huffingtonpost.com/2014-09-17-519001masterchefwinnerchosenphotoslightboxtbd-thumb.jpg,"Note: Do not read on if you haven't seen Season 5, Episode 18 of FOX's ""MasterChef"" titled ""Top 3 Compete.""Holy Boston Cream Pie, guys. I have to say I am thoroughly pleased with the fact that we had an Elizabeth and Courtney showdown for the finale. Usually, MasterChef exaggerates: most extreme pressure test ever, or biggest cooking competition in the world!"" but this finale was super real. Before we start taking bets, I shall provide you with my recap of the events this week. 1) The Top 3 have to cook for top chefs from all over America. Elizabeth wins with a delicious, and super trendy, skin on red snapper with cauliflower three ways. Anyone who's eaten in NYC recently will feel that purple faux-broccoli pain. 2) Elizabeth gets to drink champagne in the balcony and watch the pair cook off. Three classic American desserts: cheesecake, Boston cream pie (I've never had one, but I wanted to shove my face into Courtney's, the drips being more appealing than off-putting), and key lime pie. Yummers. Elizabeth's commentary on the differences between Courtney and Leslie were hysterical. Oh, to be a fly in that studio. Leslie threw salt in his batter and sealed the deal for the ladies. 3) I am rooting for Elizabeth, because her dishes always look so fancy. But then I want to root for Courtney, from my hometown, and because they sort of made a big deal about her past as a dancer in a strip club. Ladies, pull out those pony tails. 4) One full, three-course meal. They start with apps: Courtney has a pig ear salad. Big risk! Elizabeth has a grilled octo salad with fresh chickpeas and chorizo. Joe is not thrilled with bits of dog chew on his plate. Gordon says, much to Courtney's chagrin, that Elizabeth's plate is pretty and pulled off. 5) Elizabeth has lamb with a mint yogurt sauce and veggies, Courtney has duck breast and a farro veggie salad. You can sort of see the theme of both their meals. Courtney calls Elizabeth's lamb raw and it looked like they were going to come to blows. Elizabeth's lamb is uneven -- Joe's is rare, Gordon's perfect, which was a good strategy. Gordon detests a bad temp; Joe can handle it a little bit. Courtney's duck is ""spot on"" and ""stunning"" all around. 6) Elizabeth has a grapefruit and olive oil semolina cake that I want in my face. Courtney is cooking up a meringue, that should take a lot longer than she has. No one is playing it safe. Elizabeth gets Courtney back for her snide raw lamb comment: What does her dish look like? ""It looks like second place."" She put salt in her black cherries and makes Joe think, which is apparently a good thing. Gordon thinks it's clumsy. Elizabeth makes a spot-on cake, but it looks deconstructed and rustic. Everyone loves it though. Elizabeth's menu is connected and thematic. Courtney's was a little innovative though in the pairings, though. Elizabeth's fiance passes out under the pressure. And, it's Courtney. I respect her, but I don't like her and will have to stop here. I can't take the gloating. What did you think? Let me know  @karenfratti. ""MasterChef"" airs Mondays at 8 p.m. EDT on FOX."
12,TASTE,The 17 Greatest Steak Joints In America,,https://www.huffingtonpost.com/entry/the-17-greatest-steak-joi_n_5836810.html,,2014-09-17,"This steak rub featuring garlic, smoked paprika and crushed red pepper flakes. (Bill Hogan/Chicago Tribune/MCT via Getty Images)",https://img.huffingtonpost.com/asset/5b9e4cdc250000330036cc87.jpeg?ops=scalefit_720_noupscale,Steak lovers rejoice! Read more on Food Network
13,POLITICS,Top Interior Official To Take Over At Helm Of Environmental Group,Kate Sheppard,https://www.huffingtonpost.com/entry/suh-nrdc-interior_n_5838522.html,,2014-09-17,"Assistant Secretary of the Interior, Rhea Suh, helps Michelle Obama promote the ""Let's Move Outside"" program at Red Rock Canyon National Conservation Area outside Las Vegas Tuesday, June 1, 2010 in Red Rock Canyon. (AP Photo/Isaac Brekken)",https://img.huffingtonpost.com/asset/5e691610230000d11a0c246a.jpeg?ops=scalefit_720_noupscale,"WASHINGTON -- A top Department of Interior official is leaving the Obama administration to take over as the new president of the Natural Resources Defense Council, the environmental group announced Wednesday. Rhea Suh, who currently serves as the assistant secretary for policy, management and budget at the Department of Interior, will take over as president of the NRDC in January, the group said. Suh has served in that DOI post since 2009; in October 2013, Obama nominated her to become the assistant secretary for fish and wildlife and parks. That confirmation process, however, was delayed by objections from Republicans who argued that Suh was too much of an environmental activist for the job. While her nomination was eventually approved in committee along party lines, it had not yet gone before the full Senate. Before joining DOI, Suh worked at the William and Flora Hewlett Foundation and the David and Lucille Packard Foundation, which both fund environmental programs. This prompted much of the opposition among Republican senators. ""It has been an unparalleled privilege to work for the President and Interior Secretaries Ken Salazar and Sally Jewell,"" Suh said in a statement Wednesday. ""Now, I’m honored to join NRDC, our nation’s intrepid defender of clean air, safe water, and wild places.""She will replace current NRDC President Frances Beinecke, who has served in that capacity since 2006.Suh's selection at the NRDC will likely fuel complaints from Republicans about the environmental group's role in shaping Obama administration policies. A group of Republicans has sought to investigate the group's involvement in the Environmental Protection Agency's new rules on greenhouse gas emissions from power plants, accusing the NRDC of having ""improper"" influence over the proposal. The NRDC had previously laid out potential methods of reducing emissions in several public reports. "
14,POLITICS,Air Force Will No Longer Require 'So Help Me God' In Enlistment Oaths,Sam Levine,https://www.huffingtonpost.com/entry/air-force-oath_n_5838802.html,,2014-09-17,"NATIONAL HARBOR, MD - SEPTEMBER 15: U.S. Secretary of the Air Force Deborah Lee James speaks during the 2014 Air and Space Conference and Technology Exposition at Gaylord National Resort and Convention Center September 15, 2014 in National Harbor, Maryland. Secretary James spoke on 'The State of the Air Force' during the event which hosted by the Air Force Association. (Photo by Alex Wong/Getty Images)",https://img.huffingtonpost.com/asset/5e6916122600001123b62e08.jpeg?ops=scalefit_720_noupscale,"Airmen who enlist or reenlist in the United States Air Force will no longer have to say the phrase “so help me God” as part of a required oath, the agency announced on Wednesday.According to USA Today, the Air Force faced pressure to change the policy from the American Humanist Association, which threatened to sue them on behalf of an airman who was not allowed to reenlist because he would not say the phrase. The Air Force allowed those who took the oath to omit the phrase until late last year, but then began requiring all airmen to take the full oath, the Washington Post reported.In a statement, Secretary of the Air Force Deborah Lee James said the changes to the Air Force policy were effective immediately. “We take any instance in which Airmen report concerns regarding religious freedom seriously,” Lee said in the statement. “We are making the appropriate adjustments to ensure our Airmen's rights are protected.”Both the Army and the Navy allow soldiers and sailors to omit saying “so help me God” from their oaths when they enlist."
