,category,headline,authors,link,short descr,date,image_caption(s),image_link(s),article
3,POLITICS,Congress Ashamed Of Congress For Tending To Elections Before War Authorization Debate,Jennifer Bendery and Sabrina Siddiqui,https://www.huffingtonpost.com/entry/congress-war-authorization-isis_n_5831408.html,,2014-09-18,"UNITED STATES - SEPTEMBER 13: Rep. Jim McGovern, D-Mass., speaks during a news conference on the Farm Bill's Supplemental Nutrition Assistance Program (SNAP) outside the Capitol on Thursday, Sept. 13, 2012. (Photo By Bill Clark/CQ Roll Call)",https://img.huffingtonpost.com/asset/5bb8d62824000032005772f3.jpeg?ops=scalefit_720_noupscale,"WASHINGTON -- Congress is ashamed of itself for tending to elections before having a war authorization vote. But they'll do it anyway.A bipartisan faction of lawmakers has been demanding a vote to authorize President Barack Obama's military escalation against the Islamic State, also known as ISIS. Obama maintains he doesn't need a new authorization to expand U.S. military strikes against the terrorist group; indeed, the U.S. has already carried out 160 airstrikes in Iraq this summer and plans to expand into Syria. But some lawmakers disagree that the president has the authority under the 2001 Authorization for Use of Military Force to carry out an open-ended campaign of airstrikes against the Islamic State, and argue that Congress must weigh in -- if not for legal reasons, then at least to show where they stand on the serious matter of going to war. But with elections around the corner, many lawmakers aren't inclined to wade into a thorny debate about war authorization that could jeopardize their races. So the debate is being sidelined for two months, at a minimum, as political campaigns take hold. Not that members of Congress seem particularly surprised by their collective priorities.""I find it an act of cowardice, but not astonishing,"" said Sen. John McCain (R-Ariz.).""Is it embarrassing? Yes,"" said Rep. Jackie Speier (D-Calif.). ""It's an election year. Self-preservation trumps national security.""Members leading the charge for a new, better tailored AUMF speculate it's more than the current election cycle that's sending colleagues running from the issue. U.S. military action against the Islamic State could extend into and even beyond 2016, and should things go awry, lawmakers are inclined to let the president take the fall.""It's easier to be on the sidelines and, you know, if everything goes well, to say, 'I was always with you.' If not, you can say, 'Whoa, you blew it,'"" said Rep. Jim McGovern (D-Mass.). ""The fact that we're all taking great pains to do the absolute minimum to avoid an authorization ... is not only not doing our job, it's cowardice.""HuffPost talked to more than a dozen lawmakers about whether they thought Congress should stay in session to delve into the issue. Nearly everyone said yes.""I think we should complete discussions on this now. Absolutely,"" said Sen. Brian Schatz (D-Hawaii). ""This is what we're paid to do.""""Why wouldn't you vote?"" asked Sen. Tom Coburn (R-Okla.). ""Either you're for it or against it, and if you can't defend either being for it or against it, you don't have any business being here in the first place.""""I think the president would be missing an opportunity if he fails to see Senate approval, because it will strengthen his position,"" added Sen. Richard Blumenthal (D-Conn.). ""I am in favor of more votes as soon as possible."" Yet, the reality is that lawmakers are the ones fueling their party leaders' decisions on whether or not to hold votes -- and when to leave town. Senate Majority Leader Harry Reid (D-Nev.), for example, wouldn't be adjourning for two months if most Democrats were demanding attention to a war authorization debate. The same applies to House Speaker John Boehner (R-Ohio) and Republicans. In others words, some of the same lawmakers telling reporters they want a debate on war authorization may also be privately telling party leaders they want nothing to do with it.""People don't really want to take that vote,"" said one frustrated House Democrat, who requested anonymity. ""People say stuff in there, but they won't vote on it. Talk is cheap. Do I think there will be a vote when we come back? No.""For his part, Reid said he doesn't think it makes Congress seem cowardly that lawmakers are waiting until after they get re-elected to debate the limits of the president's war authority.""I didn't know we were waiting,"" he grumbled.Lawmakers do have to take one war-related vote before they leave town. It's on the narrower question of whether to support Obama's request to arm and train Syrian rebels to fight the Islamic State. The House approved that measure Wednesday evening, and the Senate is poised to pass it on Thursday. During the House vote, the measure's opponents frequently cited their broader questions about the U.S. war unfolding overseas.""Just how steep is the slippery slope we are embarking upon? How long will the conflict last? Is there an exit strategy? What does victory look like? How much will it cost? How many U.S. lives will be lost?"" asked Rep. Jerrold Nadler (D-N.Y.).Not everyone feels a sense of urgency on the need for a war authorization debate. Some lawmakers say they're fine with waiting until November to tackle the issue, even as U.S. military action escalates in the meantime.""I think at one point, we've got to vote on this issue and deal with that. If it's before the election, that doesn't bother me -- if it's before or after,"" said Sen. Mark Begich (D-Alaska), emphasizing that the vote on arming Syrian rebels suffices for now. ""I don't support funding the rebels, and that's the issue that's in front of me today.""""[Obama] needs to have a specific vote and approval by Congress at some point. I think it would be -- both legally and from a buy-in perspective from the American people -- wise for him to do that,"" said Rep. Bill Huizenga (R-Mich.), ""but I don't know what the president is going to do.""""It's going to take time for Congress to be able to see if [the president's plans] are achievable goals,"" added Sen. Tammy Baldwin (D-Wis.). ""I think we'll know a lot more as a couple more weeks pass."" Others said they're willing to take the president at his word that he can take military action against the Islamic State on his own.""I think what we'll do today is give the president exactly what he wants. He is the commander in chief. He was elected to that role,"" said Rep. Frank Lucas (R-Okla.). ""Right now the administration is telling us they have all the existing authority. I know some of my friends would like to repeal that authority, but I don't think that's the will of the body.""""I believe what the president has done so far -- and will be doing -- he doesn't need a vote to do that,"" said Sen. Bob Casey (D-Pa.). ""Some people seem to want to have a vote now; they're of the opinion he doesn't have authority now. That's a difference of opinion.""Even after the elections, there's no guarantee that lawmakers will prioritize a debate on war authorization. It may come down to public opinion deciding when, or if, Congress turns its attention to defining the limits on the president's authority to carry out attacks against the Islamic State -- an endeavor that some speculate could go on for years and incur significant costs.""It's up to our constituents to determine if they think we're doing our jobs,"" said Rep. Barbara Lee (D-Calif.). ""The public needs to judge the democracy. That's what elections are all about."""
4,SCIENCE,Scientist Shoots Down Theory About Peacock Tails,David Freeman,https://www.huffingtonpost.com/entry/peacock-tail-sexual-selection_n_5843950.html,,2014-09-18,"A male peacock displays its tail feathers and shakes them to attract the attention of female peacocks at Gut Aiderbichl in Henndorf, Austrian province of Salzburg, Saturday, April 26, 2014. Gut Aiderbichl is a place of mercy for rescued animals. (AP Photo/Kerstin Joensson)",https://img.huffingtonpost.com/asset/5baec1b92200004301db0d98.jpeg?ops=scalefit_720_noupscale,"Peacocks pay a steep price for impressing peahens, or so scientists have long hypothesized. The idea is that the extra weight and bulk of their elaborate tails make it hard for peacocks to get off the ground in a hurry--and thus makes them more vulnerable to predators.But surprising new research from the University of Leeds in England shoots down that hypothesis.Dr. Graham Askew, associate professor in muscle function and movement at the university's School of Biomedical Sciences, took high-speed films of five Indian peacocks as they took to the air. Then he clipped the birds' tails and again filmed their take-offs.Askew believed that the birds with the tails would take longer to get off the ground. After all, as he explained in a written statement issued by the university, ""These feathers weigh about 300 grams and can exceed 1.5 meters, so it's expected that the male birds would be making a significant sacrifice in their flight performance for being attractive--possibly giving up their lives if the train restricts escape from predators such as tigers and leopards in their natural environment.""But Askew found no significant difference in the birds' ability to get airborne before or after their tails were clipped--a finding he described as ""a bit surprising.""The peacock tail is considered a prime example of sexual selection, a form of natural selection in which some animals have specific features that make it easier for them to attract mates--and thus reproduce. Other examples include lions' manes and elks' antlers.Of course, just because the peacock's spectacular plumage doesn't affect flight performance doesn't mean it comes at no cost to the birds. ""There could be other costs associated with possessing a train,"" Askew told The Huffington Post in an email, ""such as the energy invested in producing the feathers (about 3% of their daily energy budget), changes in maneuverability, and a potential cost of making the birds more conspicuous to predators.""A paper describing Askew's research was published Sept. 18, 2014 in The Journal of Experimental Biology."
5,POLITICS,Celebrating The Changing Face Of American Citizenship,,https://www.huffingtonpost.com/entry/celebrating-the-changing-_n_5844896.html,,2014-09-18,"Eh Pree, nineteen years old, of Burma, waves a flag as she participates in a Naturalization Ceremony in Oklahoma City, Friday, June 27, 2014. Fifty-one individuals from 24 countries took the Oath of Allegiance to the United States as their final step to become citizens. (AP Photo/Sue Ogrocki)",https://img.huffingtonpost.com/asset/5bb8d663240000310057730a.jpeg?ops=scalefit_720_noupscale,The path to the oath is one that can be long and challenging – there are many requirements to become a naturalized US citizen – but it is also one that is within clear reach for those who receive the necessary assistance and who are able to marshall the often precious and limited resources (including time as well as money) needed to file the application and pass the interview and test.Read more on New America Media
6,POLITICS,Green Groups Announce Ad Buy Against Iowa Republican Joni Ernst,Kate Sheppard,https://www.huffingtonpost.com/entry/environmental-joni-ernst_n_5845370.html,,2014-09-18,"UNITED STATES - AUGUST 08: Joni Ernst, Iowa Republican Senate candidate, campaigns at the 2014 Iowa State Fair in Des Moines, Iowa, August 8, 2014. (Photo By Tom Williams/CQ Roll Call)",https://img.huffingtonpost.com/asset/5bb8d6653c000020010df94b.jpeg?ops=scalefit_720_noupscale,"WASHINGTON -- The League of Conservation Voters (LCV) and the political arm of the Sierra Club are targeting Iowa Republican candidate Joni Ernst with an $800,000 ad buy, highlighting statements she made in a primary debate about her desire to shut down the Environmental Protection Agency.LCV has added Ernst to its ""Dirty Dozen"" list, which it produces each election cycle to target candidates it opposes. The group plans to start running the ad on Iowa television stations this Sunday. LCV and the Sierra Club Independent Action previously ran ads attacking Ernst on this issue in June, and the Sierra Club also announced Thursday that it plans to spend an additional $1 million on anti-Ernst ads in September and October.(Watch the ad above.)  LCV President Gene Karpinski said Thursday that the group is on pace to spend $25 million this election cycle, by far the most money it has ever spent.The total is five times the amount that LCV spent on the last midterm election in 2010, and $10 million more than it spent in 2012. The environmental activist group said it intends to spend about half of the $25 million on Senate races, in hopes of keeping a ""pro-environment Senate.""LCV is focusing much of its Senate spending on a few key races: Iowa, Colorado, Michigan, and New Hampshire. The group is also spending on the Alaska Senate race between incumbent Democrat Mark Begich and Republican Dan Sullivan through its state-based affiliate.Separately, LCV Action Fund and the Natural Resources Defenses Council Action Fund PAC have raised nearly $4.6 million this year through their ""GiveGreen"" program, which allows donors to give directly to the campaigns of federal and state candidates the groups have endorsed."
7,SPORTS,"Kyrie Irving: 'Either We're Going To Be Really, Really Good Or We're Going To Suck'",Jordan Schultz,https://www.huffingtonpost.com/entry/kyrie-irving_0_n_5829810.html,,2014-09-18,"WASHINGTON, DC - FEBRUARY 7: Kyrie Irving #2 of the Cleveland Cavaliers shoots against Nene #42 of the Washington Wizards during the game at the Verizon Center on February 7, 2014 in Washington, DC. NOTE TO USER: User expressly acknowledges and agrees that, by downloading and or using this photograph, User is consenting to the terms and conditions of the Getty Images License Agreement. Mandatory Copyright Notice: Copyright 2014 NBAE (Photo by Ned Dishman/NBAE via Getty Images)",https://img.huffingtonpost.com/asset/5bb76ce22200005700dd0eec.jpeg?ops=scalefit_720_noupscale,"During his three-year NBA career, 22-year-old Kyrie Irving has assumed a role as one of the NBA's premier point guards and most dynamic playmakers. Irving, the first pick in the 2011 draft by Cleveland, earned Rookie of the Year honors. Last season, he averaged 21 points and a career-high six assists while making his second All-Star game (and earning the All-Star MVP). He was promptly rewarded with a sparkling new five-year, $90 million contract extension. Most recently, the Duke product led Team USA to a gold medal in the FIBA World Cup while anchoring point guard responsibilities and earning the tournament's Most Outstanding Player.Irving caught up with The Huffington Post during the FIBA games to discuss his love of music, his work with Coach K, and his thoughts on LeBron James, who recently said: ""I believe Kyrie can be the best point guard in the league very soon.""You are collaborating with Skullcandy music. What role has music played during your life?When I was younger my dad took me around a lot of old school music, whether it was church music or R&B. ... Then as I got older, I just started becoming interested in country music. I mean, I just have a true appreciation of it because of the way someone can express themselves through a beat and instruments and words is truly inspiring. I just have a true passion for it. What kind of music do you listen to before games?All types, man. Some playlists I have some ""Frozen"" songs on it from the Disney movie, ""Frozen."" Just everything, you know. Hey, that's a good movie, man. It's a great movie. Are there a few favorite artists that stand out for you?One of my good friends is Chris Brown, I’ve been onto him for the last few years. Then J. Cole, Nas, Jamie Cullum, the pianist. A little bit of George Winston -- he’s a pianist as well. Those are my favorites.How is playing under Coach K for the national team different from your experience working with him at Duke?It’s not a big difference. He just expects a little bit more out of me than he did at Duke. Our relationship is always looking each other in the eye and always telling each other the truth, and that’s how our relationship has been since I met him.The international game seems to fit your skills so well in the open floor. Give me a sense of how comfortable you are right now with your game, especially with the FIBA style of play.It’s definitely an adjustment, especially in the open court. That’s where I excel, so I try to do that as much as possible and just try to make everybody better as well. We have so many weapons, so many guys that are playing on this team. This is fun. It’s really fun. With that in mind, what you can extract from this experience that you can take to the NBA to help take you to the next level?I’ve had a chance to play with a lot of players, but every time I get the chance to play with the best of the best, it’s such a unique opportunity that I feel honored to get. My role is totally different with the Cavs than it is with [Team USA], and I’m completely OK with that, just because I know the game is that much easier and that much more fun when you have guys that are basically at the peak of what we do. What do you learn about yourself when you’re in a different country with all of these guys playing basketball against international competitors? Do you feel like it makes you more mature, off the floor as well? As far as a basketball standpoint, you learn from everybody who’s on the team and the coaching staff, everybody. And you can build relationships on and off the floor. That’s what I’m really about. Obviously when I’m on the court I take care of business, but off the court it’s about building relationships you never thought you could develop. Just being a human outside of the game. The game is what it is, it’s going to be what it is, and I gotta keep living my life no matter what, and that’s what I do.With your new contract, how excited are you to get out and show that you really are the best point guard in the NBA? How does the contact make you look at the game differently?I’m just looking forward to the amount of space and the amount of plays there are gonna be. The easy job of just showing up every night but knowing that everybody’s ready to go to war. Not to disrespect any other time that we’ve had, but this is the best team I’m going to be a part of, and I see it as that. Being part of a great team. We’re a good team right now, but we want to become a great team eventually. Coming into this season, that’s the biggest thing in my mindset, doing whatever possible to win and try to win a championship. That combination of you and LeBron -- talk about the open floor. That really is going to be incredible. What was your first reaction when you found out he was joining your team?I was excited. Obviously one of the best players coming back home is something that is monumental, and I think in NBA league history, to have three All-Stars on one team ... I mean it's happened before.But not like this.That’s what I’m saying. We only have five guys returning from the team last year, so that’s crazy in itself. Of course, we have Mike Miller, James Jones, Matrix (Shawn Marion). We have a chance to do something special, so now we just gotta make it happen.At what point will you start to talk with your guys, whether it’s the returners or LeBron or Kevin Love? Or is that something that just happens on the floor during camp?Who knows? Honestly, I have no idea. It can happen the first day I get back, it can happen end of the season, mid-week in the season. We just have to develop an identity. I think that’s the most important thing is find out who we want to be, and exactly what we want to accomplish. The ultimate goal is to win a championship but the journey is what’s going to be the biggest part in how we try to devise this. A lot of people are going to be going for us, but it’s something you want as a competitor.What has been the reaction from all the Uncle Drew ads? Because they’re incredible, everybody seems to love them and they've even developed a cult following. I’m just thankful that everybody loved it. I get joy out of it, watching other people enjoy it as well. It’s more or less something we all can connect to, because we all know that old guy that comes to the park, and either he’s good or he’s terrible. I just wanted to do something that people could connect to, and we’re all part of it. It wasn’t just me making it, but everyone joining in on the experience and being part of something bigger than all of us. It’s a role that I played; I didn’t know it was going to become that big but I’m just really excited that everyone enjoyed it, and I continue to make it because it puts smiles on people’s faces. Let's talk about Kevin Love for a moment. Where do you see him being the best asset to your two-man game? Pick-and-roll, pick-and-pop, transition?What’s crazy is that LeBron and K-Love have been in the top 10 in scoring the last three years. And I’m in the top 20 my last two years. We all come from our respective places where we were before and we all had different roles, but one thing I don’t want them to change is the way we play. And that’s just making plays. It’s not just all about scoring, but just making plays and playing off one another. Me and K-Love playing pick-and-roll, either the point guard is going to go with the two, or he’s going to try to fight over and it’s going to be one-on-one with the big and someone has to help on the back side. You just start thinking about basketball plays and the basketball knowledge that I have, and seeing the play ahead. And I’m already getting excited, because what are teams going to do? You’re going to have to decide who you’re going to guard and how you’re going to guard us, and that’s going to be tough.With that in mind, is Year 1 championship or bust for the Cavs?No, I don’t see it that way. Winning a championship -- either it can happen right away, it can happen in one year, two years. It takes time. Me and K-Love haven’t even been to the playoffs, so it’s not more or less championship or bust, we just gotta figure it out. That’s basically what it’s going to boil down. It’s not about what everyone else thinks, what everyone else is predicting. Either we’re going to be really, really good or we’re going to suck. Everyone’s kind of jumping ship or they’re staying on with us -- honestly I really don’t care. What have you learned from the Spurs and some of these other teams that have been there year in and year out? Every team has their own identities. I don’t think one team should try to emulate what they do. The Spurs, one thing they consistently do is play hard. You can never take that away from them. But they’re also talented as well, do things the right way, and their system works for them. Then we have the Heat last year, which is guys playing around the perimeter, four guys, one in. Pick-and-rolls dominate the offense, LeBron and [Dwyane Wade isolations]. Teams play different ways, and if you find that way to win and it works, then I don’t think you should change it. So we just have to find our identity, and that’s what I’ve learned. When you find out how to win and the way to win, that’s when you start getting on a roll, and things become that much easier.And that identity comes just from playing with one another?Yep, just finding consistency, that’s all. Once you find consistency in this game, then day in, day out you have a legitimate chance at winning. And that’s how I want to feel, that every single day we have that consistency, and knowing that we have a great chance at winning tonight against any team. This interview has been edited and condensed for clarity.Email me at jordan.schultz@huffingtonpost.com or ask me questions about anything sports-related at @Schultz_Report and follow me on Instagram @Schultz_Report. Also, be sure and catch my NBC Sports Radio show, Kup and Schultz, which airs Sunday mornings from 9-12 ET, right here."
