,category,headline,authors,link,short descr,date,image_caption(s),image_link(s),article
8,POLITICS,Cops Recording Your Every Move For 10 Weeks Doesn't Violate The Constitution,Cristian Farias,https://www.huffingtonpost.com/entry/warrantless-video-surveillance-constitutional_us_56b90dc9e4b08069c7a875ed,"New court ruling further blurs the line between new technologies and what constitutes lawful ""searches.""",2016-02-09,Courts are still grappling with whether warrantless videos taken for law enforcement purposes violate your privacy rights.,https://img.huffingtonpost.com/asset/default-missing-image.jpg?cache=jIO2VoZgTY&ops=crop_729_1205_3499_2251%2Cscalefit_720_noupscale,"A federal appeals court on Monday ruled it is not unconstitutional for law enforcement to set up a camera on a public utility pole and record a suspect's moves for 10 weeks straight.Such warrantless recording is permitted, the U.S. Court of Appeals for the 6th Circuit said, because people have ""no reasonable expectation of privacy in video footage recorded by a camera that was located on top of a public utility pole and that captured the same views enjoyed by passersby on public roads.""The ruling stemmed in part from a nasty, years-long confrontation between two Tennessee brothers and local police -- long-simmering bad blood that led to shootouts, officer deaths and ultimately a criminal trial that ended in acquittals for the brothers.Despite this history, the conflict persisted, and federal agents later learned from local law enforcement that one of the brothers, Rocky Houston, had a prior felony and thus was in violation of federal law for possessing firearms in his rural property -- which he shared with his brother Leon, who slept in a trailer, and an adult daughter, who lived in a nearby barn.Federal agents followed up on the tip and visited the property to investigate, but quickly realized that their vehicle ""stuck out like a sore thumb"" and they couldn't conduct proper surveillance of the premises. That's when they enlisted the help of the utility company and, without obtaining a warrant, set up a camera from a pole located roughly 200 yards away from Leon's trailer.That was good enough to monitor the brothers' activities for 10 weeks straight, including instances of Houston handling guns on the property. About a month after the surveillance ended, the agents moved in on the farm, seized 25 firearms -- 17 of them Houston's -- and charged him under a federal law that prohibits former felons from possessing them.Houston was ultimately convicted and sentenced to nine years in prison for the offense, in large part based on the evidence gathered through the warrantless surveillance of the family property.On appeal, the 6th Circuit ruled the surveillance didn't violate his Fourth Amendment right to be free from unreasonable searches.""The ATF agents only observed what Houston made public to any person traveling on the roads surrounding the farm,"" the court said, reasoning that the ""agents had a right to access the public utility pole and the camera captured only views that were plainly visible to any member of the public who drove down the roads bordering the farm.""But the court also dismissed the notion that the length of surveillance mattered to its constitutional analysis, noting that ""the Fourth Amendment does not punish law enforcement for using technology to more efficiently conduct their investigations.""As George Washington University law professor Orin Kerr observed in a legal blog, the court appears to have employed an interest-balancing theory to reach its conclusion -- that is, the surveillance is justified because it helps avoid giving wrongdoers ""the upper hand.""""The law cannot be that modern technological advances are off-limits to law enforcement when criminals may use them freely,"" the court said.The 6th Circuit ruling from Monday is an outgrowth of a 2012 Supreme Court decision that declared it unconstitutional to install a GPS device on a vehicle without a warrant -- the first major ruling to try to adapt the law on unreasonable searches and seizures to the realities of modern technology.Though she didn't write the court's lead opinion, Justice Sonia Sotomayor, whom the 6th Circuit cited, wrote separately to articulate a broad and liberal vision for how the Fourth Amendment should be interpreted in the age of smartphones and the surveillance state.""Awareness that the Government may be watching chills associational and expressive freedoms. And the Government’s unrestrained power to assemble data that reveal private aspects of identity is susceptible to abuse,"" she wrote.In light of these concerns, Sotomayor questioned whether the government should be entrusted with these technologies without a meaningful check, ""especially in light of the Fourth Amendment’s goal to curb arbitrary exercises of police power"" and ""police surveillance.""Sotomayor's view is not the law nationwide. But as the Houston case and others illustrate, the Supreme Court may need to clarify soon what is and isn't reasonable as government tactics grow more and more sophisticated."
9,POLITICS,Cops Recording Your Every Move For 10 Weeks Doesn't Violate The Constitution,Cristian Farias,https://www.huffingtonpost.com/entry/warrantless-video-surveillance-constitutional_us_56b90dc9e4b08069c7a875ed,"New court ruling further blurs the line between new technologies and what constitutes lawful ""searches.""",2016-02-09,"For a federal appeals court, a camera that recorded a suspect's moves for 10 weeks straight didn't violate his ""reasonable expectation of privacy.""",https://img.huffingtonpost.com/asset/56b939b71a00002d00ab23ce.jpeg?ops=scalefit_720_noupscale,"A federal appeals court on Monday ruled it is not unconstitutional for law enforcement to set up a camera on a public utility pole and record a suspect's moves for 10 weeks straight.Such warrantless recording is permitted, the U.S. Court of Appeals for the 6th Circuit said, because people have ""no reasonable expectation of privacy in video footage recorded by a camera that was located on top of a public utility pole and that captured the same views enjoyed by passersby on public roads.""The ruling stemmed in part from a nasty, years-long confrontation between two Tennessee brothers and local police -- long-simmering bad blood that led to shootouts, officer deaths and ultimately a criminal trial that ended in acquittals for the brothers.Despite this history, the conflict persisted, and federal agents later learned from local law enforcement that one of the brothers, Rocky Houston, had a prior felony and thus was in violation of federal law for possessing firearms in his rural property -- which he shared with his brother Leon, who slept in a trailer, and an adult daughter, who lived in a nearby barn.Federal agents followed up on the tip and visited the property to investigate, but quickly realized that their vehicle ""stuck out like a sore thumb"" and they couldn't conduct proper surveillance of the premises. That's when they enlisted the help of the utility company and, without obtaining a warrant, set up a camera from a pole located roughly 200 yards away from Leon's trailer.That was good enough to monitor the brothers' activities for 10 weeks straight, including instances of Houston handling guns on the property. About a month after the surveillance ended, the agents moved in on the farm, seized 25 firearms -- 17 of them Houston's -- and charged him under a federal law that prohibits former felons from possessing them.Houston was ultimately convicted and sentenced to nine years in prison for the offense, in large part based on the evidence gathered through the warrantless surveillance of the family property.On appeal, the 6th Circuit ruled the surveillance didn't violate his Fourth Amendment right to be free from unreasonable searches.""The ATF agents only observed what Houston made public to any person traveling on the roads surrounding the farm,"" the court said, reasoning that the ""agents had a right to access the public utility pole and the camera captured only views that were plainly visible to any member of the public who drove down the roads bordering the farm.""But the court also dismissed the notion that the length of surveillance mattered to its constitutional analysis, noting that ""the Fourth Amendment does not punish law enforcement for using technology to more efficiently conduct their investigations.""As George Washington University law professor Orin Kerr observed in a legal blog, the court appears to have employed an interest-balancing theory to reach its conclusion -- that is, the surveillance is justified because it helps avoid giving wrongdoers ""the upper hand.""""The law cannot be that modern technological advances are off-limits to law enforcement when criminals may use them freely,"" the court said.The 6th Circuit ruling from Monday is an outgrowth of a 2012 Supreme Court decision that declared it unconstitutional to install a GPS device on a vehicle without a warrant -- the first major ruling to try to adapt the law on unreasonable searches and seizures to the realities of modern technology.Though she didn't write the court's lead opinion, Justice Sonia Sotomayor, whom the 6th Circuit cited, wrote separately to articulate a broad and liberal vision for how the Fourth Amendment should be interpreted in the age of smartphones and the surveillance state.""Awareness that the Government may be watching chills associational and expressive freedoms. And the Government’s unrestrained power to assemble data that reveal private aspects of identity is susceptible to abuse,"" she wrote.In light of these concerns, Sotomayor questioned whether the government should be entrusted with these technologies without a meaningful check, ""especially in light of the Fourth Amendment’s goal to curb arbitrary exercises of police power"" and ""police surveillance.""Sotomayor's view is not the law nationwide. But as the Houston case and others illustrate, the Supreme Court may need to clarify soon what is and isn't reasonable as government tactics grow more and more sophisticated."
10,ENTERTAINMENT,Gwyneth Paltrow Testifies Against Man Accused Of Stalking Her For 17 Years,,https://www.huffingtonpost.com/entry/gwyneth-paltrow-stalker-trial_us_56b9c19de4b01d80b247b0b0,"Dante Michael Soiu allegedly sent her about 70 letters, a cookbook, clothing and other items from 2009 and 2014.",2016-02-09,"During the 17 years she was stalked, Gwyneth Paltrow received letters, some of which contained death threats.",https://img.huffingtonpost.com/asset/default-missing-image.jpg?cache=jIO2VoZgTY&ops=scalefit_720_noupscale,"LOS ANGELES (Reuters) - Oscar-winning actress Gwyneth Paltrow told a Los Angeles court on Monday that she feared for her safety after receiving dozens of letters from a man accused of stalking her for the past 17 years, according to media reports.Paltrow, who read aloud from the letters sent by Dante Michael Soiu, 67, told the jury she found the messages ""religious to pornographic to threatening,"" the California wire agency City News Service (CNS) reported.Paltrow, 43, said Soiu sent her about 70 letters, a cookbook, clothing and other items from 2009 and 2014, CNS reported.""I have a goal to marry Gwyneth Paltrow,"" one letter said, according to CNS.A 2010 letter declared, ""You are hopelessly lost,"" CBS News reported. ""Now you must die. Yourself, must die so that Christ can have preeminence.""Paltrow, who testified for about three hours, told the court she feared for the safety of her family and said at least one of the letters had arrived directly to her Los Angeles home.Soiu's attorney, Lynda Westlund, told the court he was harmless and said Paltrow misinterpreted his letters, many of which were biblical in nature and meant as religious messages to the actress, CNS said.Soiu has pleaded not guilty to one felony count of stalking.This is the second time Soiu, of Columbus, Ohio, has faced trial on charges of stalking Paltrow. He was found not guilty by reason of insanity in a 2001 trial.He spent more than three years in a mental health facility after the trial, CBS News reported.Related On HuffPost: "
11,POLITICS,Obamacare Helped Millions Of Uninsured. It May Not Help Many More.,Jeffrey Young,https://www.huffingtonpost.com/entry/obamacare-uninsured-rates_us_56b90b93e4b08069c7a872dd,There's only so much one health care reform law can do.,2016-02-09,"People stand in line for treatment at a Remote Area Medical clinic at the Wise County Fairgrounds in Wise, Virginia, on July 17, 2015. These pop-up clinics provide free care to people who can't afford services.",https://img.huffingtonpost.com/asset/56b90c6b1f00007f00217931.jpeg?cache=1WSnt0H7wy&ops=crop_0_23_3977_2540%2Cscalefit_720_noupscale,"WASHINGTON -- If there's just one thing that's crystal clear about Obamacare, it's that the landmark health care law has taken a huge bite out of America's uninsured rate.The Affordable Care Act is undoubtedly succeeding at one of its chief goals. But a closer look at the available data also suggests that this progress may have reached a plateau and that millions of the remaining uninsured are probably going to stay that way.New survey findings published by the Centers for Disease Control and Prevention on Tuesday underscore just how far the U.S. has come in expanding health coverage. Through the first three quarters of 2015, the uninsured rate was 9.1 percent, meaning that 28.8 million Americans lacked health coverage. That compares to 14.4 percent, or 44.8 million people, in 2013 and to 11.5 percent, or 36 million people, in 2014.In other words, since Obamacare benefits took effect at the beginning of 2014, the number of people without health insurance has fallen a staggering 16 million and the rate of uninsured has dropped by nearly 37 percent. That's after just two years of sign-ups on the health insurance exchanges and expanded Medicaid, and those figures reflect lower uninsured rates at every income level and among every demographic group.Despite these impressive national results, the CDC survey also shows that most states didn't see a statistically significant decrease in the uninsured rate from the end of 2014 through September 2015. According to the agency's findings, just eight states did so. Changes in Uninsured Rates, 2014 to 2015""We will continue to see slow but steady progress in reducing the uninsured, but nothing like the tremendous decrease from the first couple years of the ACA,"" said Larry Levitt, senior vice president of the Henry J. Kaiser Family Foundation. ""It has mostly stalled out, but it has stalled out at a significantly lower number of uninsured, completely as expected. No one anticipated the ACA to get to 100 percent coverage because it simply wasn't designed to.""Enrollment growth via the health insurance exchanges was considerably slower in the 2016 open enrollment period than in the first two years. The number of people joining Medicaid and the Children's Health Insurance Program each month, a related benefit, has also flattened out, Levitt said. Louisiana is poised to expand Medicaid, but unless one of the more populous state holdouts -- like Florida or Texas -- does so, another big drop in the uninsured rate seems unlikely, he said.Indeed, what's happening on the ground is consistent with what the Congressional Budget Office projected when lawmakers passed the Affordable Care Act in 2010 and with its revised estimates last March. The agency correctly predicted that the number of uninsured would drop sharply in the first three years and then level off in the mid-20 millions, at about 10 percent of the population. The Department of Health and Human Services also anticipated this pattern before the 2016 open enrollment period, which ended last month.The persistent gap can be partially explained by the fact that many U.S. residents are simply ineligible for government-sponsored health benefits, even under the Affordable Care Act. According to other data analyzed by the Kaiser Family Foundation, 15 percent of the uninsured are undocumented immigrants who can't sign up for Medicaid or private insurance through the exchanges because of their citizenship status. Nine percent of those without coverage live in states that refused to enact the Medicaid expansion and left their poorest residents without access to that program or to subsidized private coverage, because the law limits financial assistance to people who earn at least poverty wages. But nearly half of the remaining uninsured do qualify for some form of help and aren't taking advantage of it, the Kaiser Family Foundation data show. Twenty-eight percent could enroll in Medicaid or the Children's Health Insurance Program but don't, while 22 percent qualify for tax credit subsidies on the health insurance exchanges.""This is a classic 'glass half empty/half full' story. Half the uninsured are eligible for some help. On the one hand, that leaves you to believe that substantial progress can still be made,"" Levitt said. ""On the other hand, we're two years into the program and those people haven't availed themselves of that help yet,"" he said. Apart from Social Security and Medicare -- which automatically enroll almost everyone who qualifies -- government programs typically don't reach everybody who could use them. And despite all the publicity (good and bad) surrounding Obamacare, not everyone has gotten the message, especially among hard-to-reach populations like those in remote rural areas or impoverished urban neighborhoods, which include large numbers of uninsured people.""We're not doing a very good job of educating people about their options and, if anything, that's probably going to get worse,"" Levitt said. He noted that funding for outreach and enrollment programs is on the decline. The latest data on health insurance exchange enrollment, made public by the Department of Health and Human Services last week, illustrate where things stand. ""There was a lot of people who came in at the beginning, some additional people in 2015, and then a modest number of additional people in 2016,"" Levitt said. ""We obviously don't have the uninsured numbers yet for 2016, but I suspect it'll show a similar pattern of more modest progress.""In the just-ended enrollment period, nearly 13 million people signed up for private coverage through the marketplaces, including more than 4 million new customers in 38 states using the federal HealthCare.gov platform and others on the 13 state-run exchanges. This at least met the federal government's own projections for enrollment. But federal officials expect the net gain in coverage through the exchanges to be about 1 million by the end of 2016, reflecting a mix of people leaving that coverage and others signing up during the year.There's another big reason why some people still go without health insurance: They simply can't afford it. The Kaiser Family Foundation data show that 15 percent of the remaining uninsured don't qualify for tax credits on the exchanges because they declined health benefits offered by their employers, and another 12 percent of the uninsured earn too much to get subsidies on the marketplaces.Changes to the Affordable Care Act, such as those promoted by Democratic presidential candidate Hillary Clinton, could partially address the affordability issue in ways that would encourage more people to get insurance. For his part, Sen. Bernie Sanders (I-Vt.) has proposed replacing all forms of health insurance with a single-payer program administered by the government that would achieve true universal coverage.But even if Clinton or Sanders wins the White House in November, they will face hostile Republican lawmakers in Congress whose primary focus remains dismantling the Affordable Care Act. Although the GOP keeps promising to come up with a plan to ""replace"" the law, no existing or previous Republican health care plan seeks to expand health coverage on the scale of Obamacare, and all would actually increase the ranks of the uninsured relative to today.Absent a major shift that makes Republicans in Congress and at the state level more amenable to government-funded health benefits, Obamacare has likely accomplished about all it can for the uninsured. That's meant a lot to millions of people, but millions more will continue to need help they won't get."
12,CRIME,Couple Allegedly Allowed 9-Year-Old To Drive Home Because They Were Too Drunk,,https://www.huffingtonpost.com/entry/drunk-parents-wisconsin-drive-home_us_56b994e5e4b08069c7a8a237,They were reportedly too intoxicated to do so themselves.,2016-02-09,"Jason Robert Roth, left, and Amanda Rose Eggert, right, allegedly allowed their young daughter to drive them because they were too drunk.",https://img.huffingtonpost.com/asset/56b9963e1800006f0080b87e.jpeg?cache=eQmMJkptBI&ops=scalefit_720_noupscale,"MILWAUKEE (Reuters) - A Wisconsin couple allowed their 9-year-old daughter to drive them and their 11-month-old baby because they were too drunk to do so themselves, according to Polk County Circuit Court records.Jason Roth, 36, and Amanda Eggert, 32, pleaded not guilty at the court on Friday to charges of recklessly endangering safety and neglecting a child, according to the online records.On Jan. 31, a sheriff's deputy responded to a call about an erratic driver and found the couple and their children parked at a boat drop in Polk County, about 75 miles northeast of Minneapolis, according to a criminal complaint.The deputy arrested the couple when he learned that their 9-year-old daughter was driving them and their baby home in their pickup truck because they were both intoxicated, according to the complaint from the county prosecutor's office.Eggert also faces several charges stemming from a fight she had with paramedics who arrived to help her with a cut on her hand suffered when she was snowmobiling earlier in the day, court records showed.Lawyers for the couple were not immediately available for comment.(Reporting by Brendan O'Brien in Milwaukee; Editing by Lisa Von Ahn)Also on HuffPost:"
13,POLITICS,Paul LePage Admits That He Was Actually Talking About Black Drug Dealers All Along,Amanda Terkel,https://www.huffingtonpost.com/entry/paul-lepage-black-drug-dealers_us_56ba0a92e4b04f9b57db2678,So much for this supposedly not being about race.,2016-02-09,Maine Gov. Paul LePage (R) says drug dealers come to the state and impregnate white women.,https://img.huffingtonpost.com/asset/56ba16c11f00000d012179e0.jpeg?cache=IJCT9j0aqw&ops=crop_0_326_3000_1637%2Cscalefit_720_noupscale,"Maine Gov. Paul LePage (R) said Tuesday he felt an obligation to raise awareness about ""black dealers"" who bring drugs into the state, even though he previously claimed that race should not be brought into the discussion.Last month, LePage railed against drug traffickers contributing to the state's heroin epidemic, saying that ""guys with the name D-Money, Smoothie, Shifty ... come up here, they sell their heroin, and they go back home.""""Incidentally, half the time they impregnate a young, white girl before they leave, which is a real sad thing because then we have another issue that we've got to deal with down the road,"" he added in comments that took off nationwide and landed him in hot water. He later held a press conference and insisted he never meant to make the issue about race. ""I never said anything about white or black traffickers. ... What are they, black? I don't know. I just read the names,"" he said. But on Tuesday, he seemed to reveal his true feelings.""I had to go scream at the top of my lungs about black dealers coming in and doing the things that they’re doing to our state,"" he said on his weekly radio appearance on WVOM. ""I had to scream about guillotines and those types of things before they were embarrassed into giving us a handful of DEA agents. That is what it takes with this 127th [legislature]. It takes outrageous comments and outrageous actions to get them off the dime.""In recent days, LePage has also joked about bringing back the guillotine for drug dealers and urged Maine residents to shoot them on sight. And for the record, there are also white drug dealers in Maine. LePage has had a tense relationship with the Democratic-controlled state House, which recently tried -- and failed -- to begin impeachment proceedings against him. LePage also skipped the governor's traditional State of the State address before the legislature, instead submitting his remarks in a letter. He devoted a considerable amount of time in the letter to attacking ""socialist"" lawmakers. Also on HuffPost:"
