,category,headline,authors,link,short descr,date,image_caption(s),image_link(s),article
4,DIVORCE,Good Things That Came From Bad Divorces,"Pauline Gaines, Contributor
Blogger at www.perilsofdivorcedpauline.com",https://www.huffingtonpost.com/entry/good-things-that-came-fro_us_5b9c642fe4b03a1dcc7e4e0e,The black-and-white thinking that surrounds divorce obscures some of the good things that never would have happened if certain marriages had never ended.,2012-10-17,"NEW YORK, NY - JANUARY 13: Nora Ephron attends the 'Love, Loss, and What I Wore' 500th performance celebration at B Smith's Restaurant on January 13, 2011 in New York City. (Photo by Astrid Stawiarz/Getty Images)",https://img.huffingtonpost.com/asset/5b9c642f2100003300c51b05.jpeg?ops=scalefit_720_noupscale,"We hear so many horror stories that come from divorce: financial devastation, children's psychological demise, lives torn asunder. I don't intend to advocate divorce nor diminish any of the hardships that befall many people post-split.I do want to suggest, however, that the black-and-white thinking that surrounds divorce obscures some of the good things that never would have happened if certain marriages had never ended.So I have compiled a list of people whose contributions to the world were inspired by their lives being blown apart.1. Pema Chodron. After her second divorce, this world-reknowned Buddhist nun started her study of Buddhism. Had she remained married, it is unlikely that she would have launched the spiritual journeys of the hundreds of thousands of people who have read her work or studied with her.2. Madeleine Albright. The first female Secretary of State, Albright's perfect-seeming life exploded when she discovered her husband was having an affair. Albright credits the pain of her divorce to her transformation from university lecturer to political leader. ""I hated being divorced,"" she said. ""But I loved being Secretary of State.""3. Constance Ahrons. After her own horrific divorce, complete with multiple court hearings and even a kidnaping, this Marriage and Family therapist wrote The Good Divorce, a bible on how to divorce with dignity in the best interest of the children. The twice-divorced Ahrons has also voiced her criticism of Judith Wallerstein's studies on the long-lasting destruction divorce has on children. Ahrons believes that the children of these truly hellish divorces would have been just as troubled if their parents had stayed together because the dysfunction was due to the parents' mental illness and abuse. Regardless, Ahrons is a realist; she maintains that the traditional nuclear family isn't viable for many and that people can and do benefit from adding stepparents and stepsiblings into their families.4. Nora Ephron. Had it not been for Ephron's second marriage derailing when she was pregnant with her second son, there would be no Heartburn, nor Huffington Post Divorce section. Enough said.5. Eleanor Roosevelt. Although she wasn't technically divorced, she was a figurehead in a parallel-lives marriage. Her mother-in-law ran her house and raised her kids; her husband carried on with her former best friend. Devastated to learn of her husband's betrayal when she turned 40, Eleanor used the collapse of her personal life to catapult herself into the public, where she became a relentless advocate for the disenfranchised and one of the world's great humanitarians. Clearly, her famous line, ""you must do the things you think you cannot do"" came from experience.As for the things that have transpired from my own bad divorce: some days I can think of a lot of good, some days I can only think of a lot of needless drama. Divorce has put quite a crimp in my perfectionism and my compulsion to make everything look neat and tidy. I keep waiting for the day when I'm ""over"" my obsessive-compulsive self, but I'm beginning to think that day will never come. As Pema Chodron says:""We think that the point is to pass the test or to overcome the problem, but the truth is that things don't really get solved. They come together and they fall apart."" What about you, my divorced homies? Did any good things come from your divorces? "
5,WELLNESS,School Lunches: Yet Another Diet Mishap?,"Laura Cipullo, RD, CDE, Contributor
Registered dietitian, certified diabetes educator, nutrition e...",https://www.huffingtonpost.com/entry/school-lunches_us_5b9c67c5e4b03a1dcc7e6494,"Please, America: Throw away the scales and stop focusing only on calories. Yes, calories are of extreme importance for weight management. But they are only of equal, or perhaps even lesser, significance than food quality.",2012-10-17,"COMMERCIAL IMAGE - In this photograph released by HBO on Wednesday May 2, 2012, Students of Lasley Elementary School in Lakewood, Colo., Isabel Martinez, Dillon Bushlack, and Kaela Salas, enjoy a healthy lunch from their new salad bar, courtesy of HBOￂﾒs The Weight of the Nation campaign in Lakewood, Colo. (Jack Dempsey/AP Images for HBO)",https://img.huffingtonpost.com/asset/5b9c67c5240000300094a981.jpeg?ops=scalefit_720_noupscale,"What does America want? Do we want skinny people? Perhaps ultimately costing them their health? Is the school lunch debacle about our children's health -- specifically, the prevention of chronic diseases and the promotion of healthy lifestyles -- or only about losing weight? As of this school year, The National School Lunch Program has cut calories at each meal and has finally included more fruits and vegetables in the lunch line. According to the USDA:The Healthy, Hunger‐Free Kids Act of 2010 directed USDA to update the NSLP's meal pattern and nutrition standards based on the latest Dietary Guidelines for Americans. The new meal pattern goes into effect at the beginning of SY 2012‐13, and increases the availability of fruits, vegetables, and whole grains in the school menu. New dietary specifications set specific calorie limits to ensure age‐appropriate meals for grades K‐5, 6‐8, and 9‐12. Other meal enhancements include gradual reductions in the sodium content of the meals (sodium targets must be reached by SY 2014‐15, SY 2017‐18 and SY 2022‐23). While school lunches must meet Federal meal requirements, decisions about what specific foods to serve and how they are prepared are made by local school food authorities.However, the message we hear through the media -- and yes, from the students too -- is all about too few calories and being hungry for more. This calorie frenzy reinforces America's unhealthy obsession with numbers -- whether they be on a scale or a nutrition label. Are calorie maximums really essential when serving high-quality, healthy foods? Perhaps just getting Americans, specifically our children, to eat fruits and vegetables should be our major concern rather than calorie-counting! So please, America: Throw away the scales and stop focusing only on calories. Yes, calories are of extreme importance for weight management. But they are only of equal, or perhaps even lesser, significance than food quality. Raising happy and healthy eaters -- our students -- should (really must!) begin with high-quality, nutrient-dense foods rather than lower-calorie processed foods. Fruits, vegetables, whole grains, lean proteins and healthy fats are nutrient-dense foods. Foods such as avocados and nuts are nutrient-dense as well as caloric, but also are vital components of healthy eating programs. Proteins are also critical... Yet the new school lunch program limits students in grades 9 to 12 to just two ounces of protein at lunch (14 grams/protein/day). The question is: Should schools put a maximum calorie level on these foods? If so, should they raise the new maximum 550 kcals to 650 kcals for grades K-5, 600 to 700 for grades 6-8 and 750 to 850 for grades 9-12? Be proactive! See what the new school lunch guidelines are here. Let your voices be heard.Unfortunately, when children (adults, too!) feel they are being restricted -- and they actually are -- psychological rebellion ensues. Research has shown results signifying that daughters of mothers who restrict their intakes and/or put them on diets eventually fall prey to binge eating and weight gain. However, The National School Lunch Program has decreased calories on average by only about 100 calories at the lunch meal.[1] So are kids crying hunger because there are fewer calories, or because they just don't like the food being offered... and, consequently, are taking in even fewer calories?When trying to look at this new lunch scenario from an objective point of view, it seems the government and the public must make some critical decisions. Either allow individuals to be responsible for providing their own lunches, or focus on giving children quality food that not only meets the Dietary Guidelines for Americans 2010 but also looks and tastes great! Can we parents expect a lunch aide to get our children to eat veggies if we can't get them to eat veggies at home? If there is simply a 100-calorie difference in students' meal choices, it seems barely significant enough to cause a raucous. Obviously, if students are not eating the fruits, veggies and grains that make up these calories, they will be hungry and wanting more food. So, if we can shift the focus on calorie-counting to increasing the palatability of the new, healthier foods being offered, we can stimulate a positive impact on school lunch programs. Perhaps even nationwide! Let's Move encourages the Chefs Move to School program. However, getting Jaime Oliver -- or even any chef -- to come to a school once is just not enough. Parents... Can you volunteer your time or recipes? Instead of salad bars, let's offer vegetables on a hummus platter, or even with ranch dressing. Research reported in the Journal of the American Dietetic Association concluded that vegetable consumption increased by 80 percent when served with ranch dressing. In other words, get creative! Pair these new foods with some older, more familiar foods or just fun foods like dips.[2]Suggestions to help you make good of the new No Hungry Kid Act:• Invite chefs to your school once a week, bi-monthly or once a month to teach lunch workers new and healthy recipes.• Have students rotate through the school kitchen to help prepare meals and offer new ideas.• Have children plant gardens and eat the food they grow.• Include cooking class in your curriculum and teach kids how to make healthy, tasty food.• Create yearly school cookbooks featuring the students' favorite new healthy recipes.• Teach students how to modify their favorite recipes to develop more wholesome, healthy recipes. When all is said and done, parents need to be the gatekeepers of their children's intakes. If you can financially afford to, send a balanced lunch from home half of the week or all of the week. Take the time to make your children's lunches. Help organize a committee to create change in your local school. Concentrate on what you can do with this new program rather than bemoaning its limitations. Americans need to change the ways they think about -- and eat -- food. Encourage the consumption of wholesome, less processed foods, and of course, don't forget to get moving physically to stay healthy and prevent disease. References:1. United States Department of Agriculture. Food and Nutrition Service. Comparison of Current and New Regulatory Requirements. N.p., 26 Jan. 2012. Web. 12 Oct. 2012. Link.2. Fisher, J., J. Mennella, S. Hughes, et al. ""Offering 'Dip' Promotes Intake of a Moderately-Liked Raw Vegetables among Preschoolers with Genetic Sensitivity to Bitterness."" Journal of the American Dietetic Association (2011), doi: 10.1016/j.jada.2011.08.032For more by Laura Cipullo, RD, CDE, click here.For more healthy living health news, click here."
6,WEDDINGS,Blake Lively's Wedding Planner Dishes On Blake's Big Day,,https://www.huffingtonpost.com/entry/blake-lively-wedding-planner_us_5b9c6bade4b03a1dcc7e81bf,"Click through the slideshow below to see photos of the couple over the years. According to Tara Guérard, the wedding planner",2012-10-17,"FILE - This June 15, 2011 file photo shows actors Blake Lively, left, and Ryan Reynolds at the premiere of ""Green Lantern"" in Los Angeles. Reynolds wed Blake Lively in Mount Pleasant, S.C., Sunday, Sept. 9, 2012, at Boone Hall Plantation, according to a person familiar with the ceremony who requested anonymity because they were not authorized to speak on the matter. While it's Lively's first marriage, Reynolds was previously married to Scarlett Johansson. Their divorce was finalized last summer after three years of marriage. Lively and Reynolds both starred in last year's ￂﾓGreen Lantern.ￂﾔ (AP Photo/Matt Sayles, file)",https://img.huffingtonpost.com/asset/5b9c6bad1f00002c00213624.jpeg?ops=scalefit_720_noupscale,"Blake Lively is a woman who knows what she wants, and isn't afraid to ask for it.According to Tara Guérard, the wedding planner who organized Blake Lively and Ryan Reynold's secret September wedding, the bride knew exactly what she wanted for the ceremony -- and was determined to get it! Guérard told People on Monday: ""She had 250 photos, and she wanted all those elements in her wedding."" The bride was also involved in the creation of her wedding dress, which she helped design along with Marchesa co-founders Georgina Chapman and Keren Craig. The duo told People that working with Lively was a great experience:""Blake is incredibly stylish, and she really knew what she wanted. It was very much how we do a lot of brides. We started with a lot of sketches, and we sit down and talk through the sketches until we came to the final dress … She just wanted to be romantic and beautiful."" Martha Stewart Weddings will be featuring the celebration in their December issue.Click through the slideshow below to see photos of the couple over the years.Keep in touch! Check out HuffPost Weddings on Facebook, Twitter and Pinterest. "
7,WEDDINGS,Blake Lively's Wedding Planner Dishes On Blake's Big Day,,https://www.huffingtonpost.com/entry/blake-lively-wedding-planner_us_5b9c6bade4b03a1dcc7e81bf,"Click through the slideshow below to see photos of the couple over the years. According to Tara Guérard, the wedding planner",2012-10-17,"Premiere Of Warner Bros. Pictures' ""Green Lantern"" - Red Carpet",https://img.huffingtonpost.com/asset/5b9c6ba32200003000d93ade.jpeg?ops=scalefit_960_noupscale,"Blake Lively is a woman who knows what she wants, and isn't afraid to ask for it.According to Tara Guérard, the wedding planner who organized Blake Lively and Ryan Reynold's secret September wedding, the bride knew exactly what she wanted for the ceremony -- and was determined to get it! Guérard told People on Monday: ""She had 250 photos, and she wanted all those elements in her wedding."" The bride was also involved in the creation of her wedding dress, which she helped design along with Marchesa co-founders Georgina Chapman and Keren Craig. The duo told People that working with Lively was a great experience:""Blake is incredibly stylish, and she really knew what she wanted. It was very much how we do a lot of brides. We started with a lot of sketches, and we sit down and talk through the sketches until we came to the final dress … She just wanted to be romantic and beautiful."" Martha Stewart Weddings will be featuring the celebration in their December issue.Click through the slideshow below to see photos of the couple over the years.Keep in touch! Check out HuffPost Weddings on Facebook, Twitter and Pinterest. "
8,DIVORCE,Danny DeVito Divorce: Celebrities Who Made Extravagant Purchases Post-Split,Kelsey Borresen,https://www.huffingtonpost.com/entry/danny-devito-divorce-cele_us_5b9c6bc7e4b03a1dcc7e828d,"Is Danny DeVito using retail therapy to help cope with his recent separation from Rhea Perlman? This week, Radar Online reported",2012-10-17,"LONDON, ENGLAND - MARCH 12: Danny DeVito attends a photocall to premote the new film The Lorax at The Dorchester Hotel on March 12, 2012 in London, United Kingdom. (Photo by Tim Whitby/Getty Images)",https://img.huffingtonpost.com/asset/5b9c6bc7240000510094ab11.jpeg?ops=scalefit_720_noupscale,"Is Danny DeVito using retail therapy to help cope with his recent separation from Rhea Perlman?This week, Radar Online reported that DeVito was looking to buy a convertible sports car such as Porsche or a Ferrari. DeVito and Perlman announced their split in October 2012, after 30 years of marriage. Recent reports suggest that DeVito's wandering eye may have played a part in their separation. A rep for the actor told the New York Post that the reports amount to ""pure and simple fabrication."" If DeVito is indeed in the market for a pricey new ride, he wouldn't be the first celebrity to drop major cash post-split. Click through the slides below to see five other stars who made extravagant purchases after their marriages fell apart. "
9,WELLNESS,Meningitis Outbreak: 16 Now Dead,"Reuters, Reuters",https://www.huffingtonpost.com/entry/meningitis-outbreak-deaths-dead_us_5b9c6afae4b03a1dcc7e7b66,A spokeswoman for the department gave no details about the victim other than that the person was from southwest Virginia,2012-10-17,"This undated image made available by The Centers for Disease Control and Prevention shows the Exserohilum rostratum fungus. The CDC said Thursday, Oct. 11, 2012 tests have shown Exserohilum fungus in 10 people sickened in the current fungal meningitis outbreak. Itￂﾒs a common mold found in soil and on plants. (AP Photo/CDC)",https://img.huffingtonpost.com/asset/5b9c6afa2200005700d93a92.jpeg?ops=scalefit_720_noupscale,"Oct 16 (Reuters) - The U.S. meningitis outbreak linked to contaminated steroid injections has claimed another life with the death of a patient in Virginia, bringing the death toll to 16, the Virginia Department of Health said in a statement on Tuesday.A spokeswoman for the department gave no details about the victim other than that the person was from southwest Virginia.It was the second death in Virginia after an injection of steroids made by the New England Compounding Center in Massachusetts.The Centers for Disease Control and Prevention said earlier Tuesday that there had been 15 deaths. But its tally sometimes lags reporting from individual states.Federal agents searched the offices of NECC in Framingham, Massachusetts, on Tuesday as part of investigations of the company. (Reporting By Greg McCune; Editing by Eric Beech)"
10,WELLNESS,"New England Compounding Center, Pharmacy Tied To Meningitis Outbreak, Raided By Feds","Reuters, Reuters",https://www.huffingtonpost.com/entry/new-england-compounding-center-feds-raid_us_5b9c6afde4b03a1dcc7e7c11,State pharmacy regulators have said that NECC violated its license in Massachusetts by not requiring patient prescriptions,2012-10-17,"A Food and Drug Administration Agent stands at the doorway of New England Compounding Center in Framingham, Mass., Tuesday, Oct. 16, 2012, as investigators work inside. The company's steroid medication has been linked to a deadly meningitis outbreak. FDA spokesman Steven Immergut says the visit is part of the investigation into the outbreak, which has killed at least 15 people and sickened more than 200 others in 15 states. (AP Photo/Bill Sikes)",https://img.huffingtonpost.com/asset/5b9c6afd2400003200533047.jpeg?ops=scalefit_720_noupscale,"By Svea Herbst-Bayliss and Bill BerkrotBOSTON/NEW YORK, Oct 16 (Reuters) - Federal agents on Tuesday raided the Massachusetts pharmacy linked to a meningitis outbreak that has killed 15 people and sickened more than 200 others, federal prosecutors said.Agents from the U.S. Food and Drug Administration searched the New England Compounding Center (NECC) in the Boston suburb of Framingham, with officers from the local police department on site providing support, Framingham police said.Carmen Ortiz, U.S. Attorney for Massachusetts, said: ""I can confirm that this office and our law enforcement partners are investigating allegations concerning the New England Compounding Center.""Ortiz cautioned it was ""entirely premature"" to speculate about what might be uncovered.Officials from NECC did not immediately respond to phone calls or emails seeking comment.The raid came as a leading U.S. lawmaker called for an investigation of whether NECC violated federal laws covering potentially addictive drugs, a day after the health scare widened to new medications.The U.S. meningitis outbreak continues to grow and has so far killed 15 people and infected 231, according to a tally from the Centers for Disease Control and Prevention on Tuesday.""We will see more patients reporting in ill and we'll have to treat many more,"" Dr. William Schaffner, an infectious diseases expert at the Vanderbilt University Medical Center in Nashville, said on ""CBS This Morning.""The FDA on Monday widened its investigation of the cause of the fungal meningitis outbreak to other drugs made by the NECC.Nearly 14,000 people nationwide are at risk of infection because they received injections from suspect steroid medications shipped to 76 facilities in 23 states.Another 19 people were reported stricken with fungal meningitis on Tuesday. The 231 total does not include two people who have a non-meningitis fungal infection from injections in their joints (as opposed to back injections), so the total of infections reached 233.In Washington, Massachusetts Democratic Congressman Edward Markey, a senior member of the committee that oversees business, called on the Justice Department to investigate whether NECC violated federal laws designed to stem illegal activity in controlled drugs.The NECC already faces multiple investigations by the FDA and several states, but Markey's request could launch an even more serious probe involving the Drug Enforcement Agency, which oversees sales of potentially addictive, or ""controlled,"" drugs. 'CAN'T ASSURE THE STERILITY'The FDA said Monday it was looking into two other drugs made by the NECC.The agency said it had received reports of a patient with possible meningitis who received an injection of a different steroid than the one found to have caused the deaths. It said Tuesday that one transplant patient was infected with a fungus after receiving a drug used in open heart surgery made by NECC. The FDA had originally said two such patients were infected.Another patient identified by the FDA received an injection of the steroid triamcinolone, also supplied by NECC.During a conference call on Tuesday with doctors on the meningitis outbreak, FDA official Janet Woodcock stressed that the two additional products had not been linked to confirmed infections. She asked doctors to contact patients injected since May to make sure they have no signs of infection.NECC said in a statement that it was reviewing the new information from the FDA.The FDA has been inspecting the NECC facilities. Woodcock said that based on the condition of the plant and other factors, ""we really can't assure the sterility of these products.""The legal threat to NECC also mounted as more victims of meningitis filed lawsuits.Lyn Laperriere, who remains in hospital with fungal meningitis, filed a federal lawsuit in Michigan on Tuesday. The lawsuit says he received an epidural injection of methylprednisolone acetate manufactured by NECC on Sept. 6 and shortly afterward showed symptoms of fever, headache, stiff neck, nausea and vomiting as well as light sensitivity.Laperriere went to a hospital in Ypsilanti, Michigan, where he was admitted and began treatment first for bacterial meningitis which proved ineffective, the lawsuit states. He was later diagnosed with fungal meningitis.Brenda Bansale of Howell, Michigan, who also is hospitalized for fungal meningitis, filed a federal lawsuit in Detroit on Monday that contends she was injected on Aug. 28 and developed severe headaches and nausea on Oct. 4.All but eight of the 23 states that received suspect medications from the Massachusetts specialist pharmacy have reported at least one case of fungal meningitis.Meningitis is an infection of the membranes covering the brain and spinal cord. Symptoms include headache, fever and nausea. Fungal meningitis is not contagious.The outbreak has raised questions about how the pharmaceuticals industry operates. NECC engaged in a practice called drug compounding that is not regulated by the FDA, which generally oversees drug makers.In compounding, pharmacies prepare specific doses of approved medications, based on guidance from a doctor, to meet an individual patient's need.A Reuters investigation found that NECC solicited bulk orders from physicians and failed to require proof of individual patient prescriptions as required under state regulations, emails to a customer showed.State pharmacy regulators have said that NECC violated its license in Massachusetts by not requiring patient prescriptions before shipping products.The 15 states reporting cases of meningitis are Tennessee, Michigan, Pennsylvania, New Hampshire, Illinois, Indiana, Minnesota, New Jersey, Texas, Idaho, Maryland, North Carolina, Virginia, Ohio and Florida. (Reporting by Susan Heavey in Washington, Michele Gershberg in New York and David Bailey in Minneapolis; Writing by Greg McCune; Editing by Vicki Allen, Cynthia Osterman and Prudence Crowther)"
