,category,headline,authors,link,short descr,date,image_caption(s),image_link(s),article
11,DIVORCE,"You May Be Divorced, But You're Still a Family","Virginia Gilbert, Contributor
Licensed Marriage and Family Therapist",https://www.huffingtonpost.com/entry/you-may-be-divorced-but-y_us_5b9c0617e4b03a1dcc7bd805,One of the most misguided concepts divorced couples with children have is that they will actually be able to get divorced.,2012-08-03,"Man and woman quarrelling about little, confused girl. White background, whole body of little girl",https://img.huffingtonpost.com/asset/5b9c06171f000051002110cc.jpeg?ops=scalefit_720_noupscale,"One of the most misguided concepts divorced couples with children have is that they will actually be able to get divorced. Even after the legal dissolution and remarriage, ex-spouses who have children together will always be those children's parents. Parenting decisions have to be made, schools and extracurriculars have to be chosen, homework has to be monitored and transferred between houses.Co-parenting is dramatically altered through parental alienation, mental illness, or abuse. But most exes don't have divorces this extreme. And while they may hate each other, and be bitter about the circumstances of the break-up or the way the settlement went down, they still comprise a family for their children -- albeit, a family that is reconfigured.While it may be unthinkable early on that contentious co-parents could both attend a child's graduation, wedding, or participate as involved grandparents, doing those things becomes likelier as years pass.Which is why working through anger, honoring the terms of the divorce agreement and creating consistency in both households is crucial for the well-being of the children. What's Possible When Children Come First  An example: a man I know was devastated to learn that his wife of 20 years was leaving him for another man. She wanted to move from Los Angeles to Boston -- with their twin daughters -- where she had family, better job opportunities and the man she had fallen in love with. Guess what the husband did? He moved back to Boston as well, where he also had family, got a job, and a home close to his ex and daughters. They now have an amicable divorce and an enviable co-parenting relationship.I realize some readers may be apoplectic at this point. I am not advocating that exes pull up stakes and relocate for the sake of an ex-spouse who strayed. Clearly, this is an unusual situation and one that was only possible because the ex-husband had a job and extended family waiting for him back east. But I mention this case because it is a remarkable example of what's possible when divorced parents shelve their anger and put their children first.Exes must realize that their actions towards the other parent impact that parent's household. If you are consumed with resentment toward your ex, it is imperative that you work through your feelings in therapy rather than take them out on your former partner. If you make life hell for your ex, you also make life hell for your children.Following are two common ways exes get back at their children's other parent. For the sake of clarity, I have made these examples gender-specific, but they can be employed by both men and women.Trying to Control What Goes on in the Other Parent's HouseMothers often have difficulty entrusting their ex-husbands with the care of the children. Sometimes this is because they have been stay-at-home-moms who shouldered the bulk of child-rearing. Sometimes this is because they feel that they are more in tune with their children's needs. Sometimes they feel superior for other reasons.The conviction that mother knows best can lead to intrusive attempts to control what Dad does in his house, like multiple calls to the kids during Dad's timeshare days, interrogating kids about what they did when they were with Dad and frequent e-mails to Dad with copious instructions on the care and feeding of the children.Unless you have good evidence that Dad is endangering the welfare of the children, stay out of his business! Yes, he may do things differently from you, but he would still be doing those things if you were married. It would be great if you could synchronize all aspects of child-rearing -- meals, bedtime, homework supervision, parenting techniques. Rarely is this possible, however. Although you may believe you are helping Dad and protecting the children, compulsive meddling communicates to both that you feel Dad is incompetent.While it's often unconscious, this sense of superiority poisons a co-parenting relationship and hurts the children's relationship with the other parent. Do you really want your kids to grow up thinking Dad is a nincompoop, and you're the only parent they should trust? If the answer to this question is ""yes,"" you need to re-tool your approach to child-rearing.If you don't get a handle on your need to be ""the best"", you will model competitiveness for your children and give them a blueprint for how to blow up future relationships. Another reason to stop sweeping Dad's side of the street: your kids could end up feeling smothered by your intrusiveness and distance themselves from you over time.Withholding Child SupportChild support is designed to help the person with less resources -- generally, but not always the ex-wife -- comfortably provide for the children. In a perfect world of equal pay and equal parenting, there would be no child support: exes would scale down their lifestyles in equal measure, be able to afford two homes, and split all the children's expenses equally.But we don't live in a perfect world. We live in a world in which women typically earn less than men, and, if they have been out of the work force for years due to child-rearing, jobs that pay enough to support a family are not readily available to them. And if an ex-wife is working, she is probably paying a hefty portion of her salary in childcare fees.Some men resent paying child support because they believe their ex-spouses spend the money on expenses that are not child-related. While this is sometimes the case, more often than not the recipient of child support is using that money to feed the kids and keep a roof over their heads. Withholding child support, becoming unemployed in order to modify child support, or simply paying child support late hurts the children. If a mother is stressed out because she doesn't have money to cover rent, the children feel it. Having two homes doesn't mean you're no longer a family. If you are tinkering with child support by telling yourself your kids will have everything they need -- and more -- with you, you are not acting in the best interest of your children. You are acting from a place of revenge against your ex and you need to work through these feelings so that your children grow up feeling safe and able to enjoy their childhood.Stop Competing!Trying to out-parent or undermine your ex are forms of competition. These tactics belong on the sports field or in the business arena, but have no place in family life. Families rife with competition are dysfunctional minefields that wreak havoc on the psyches of their most vulnerable members -- the children. Your number one job as a divorced parent is to support your kids' relationship and home life with your ex. That means paying court-ordered child support on time, respecting your ex's boundaries, and letting your kids know they don't have to take sides. The greatest gift divorced parents can give their children is the sense that they're still a family."
12,DIVORCE,I Was Married to a Con Man,"Lisa Arends, Contributor
Author, wellness coach, and math teacher",https://www.huffingtonpost.com/entry/i-was-married-to-a-con-ma_us_5b9c0ebde4b03a1dcc7c0d96,My husband was a brilliant and talented man whose skills included creating and maintaining a separate existence.,2012-08-03,A man holding a notebook under his arm and leaving,https://img.huffingtonpost.com/asset/5b9c0ebd2100003300c4fadd.jpeg?ops=scalefit_720_noupscale,"If my husband had been Pinocchio, his nose would have been a giant redwood. While we were married, I thought he was a real boy. Once he disappeared, I learned otherwise.My husband and I used to watch ""Lost"" and shake our heads in disbelief at Sawyer's deceptions. We laughed at ""Dirty Rotten Scoundrels"" when the con artists were conned themselves. We were shocked at the audacity of Leonardo DiCaprio's character in ""Catch Me if You Can"", and we were disturbed when we discovered the movie was based on a true story. While I thought he shared my disdain for the trickery and fraud in these tales, it seems as though he had been taking notes. Overnight, I went from an ordinary life to one that felt more like a movie.My husband was a brilliant and talented man whose skills included creating and maintaining a separate existence. He had two cameras. Two bicycles. Two wallets. Two wives. Two distinct lives. When the financial mess he created in his life with me became too great to keep hidden, he broke up with me via text and vanished. That was when I learned that my husband was anything but a real boy -- he was a con man. My life was a virtual reality -- my home a movie set consisting of false fronts. He was an expert lie crafter; he always knew the exact proportion of truth to weave into the falsehoods to make a story believable. He always had an answer; he never hesitated. His office must have been like a busy air traffic control tower as he directed emails, texts, and phone calls to support his various tales. The extent of his deceptions was made clear when I sat with an auto insurance card in my hand -- my name had been digitally removed -- while I pulled up the file from the insurance company and verified that both names were present on the actual document. He thought he could erase me as easily as he could my name using Photoshop. While my husband was in jail after being arrested for felony bigamy, I talked with his other wife, who was as stunned by the situation as I was. No woman should ever have to have a conversation about ""our husband,"" even if it is a cordial and informative discussion. I learned that when he was pulled in for questioning, his lies became increasingly absurd as he struggled to maintain his façade. My favorite? He claimed that he and I had divorced years earlier and I had since married a chiropractor named Mark Mercer. Mark, if you're out there, I'm sorry that I have no recollection of our marriage and that I have never recognized our fictitious anniversaries. One of the saddest aspects of the situation is that he was conning himself just as much as he was fooling those around him. In trying to pull the wool over others' eyes, he inadvertently knitted himself a mask with no eyeholes. He told so many lies for so long, he began to believe his own fabrications (he even admitted as much in a text to my mother). It became impossible for him to tell where the lies ended and the authenticity began. In trying to keep everyone else in the dark, he lost himself. The real boy was replaced with a hollow man.  I came out of the marriage confused, unsure of what was real and what was fabrication. I was embarrassed. How could I have been such a fool? My anger was explosive as I came to the realization that I had been literally sleeping with the enemy. The crime was intensified by the fact that it was carried out by the man who had sworn to love and protect me. Yet, eventually, I began to feel compassion for him, as I saw through the lies to the pain that must have born them. I have come to the realization that the life I knew was real to me, and that has to be enough. I will never know what prompted his moral malignancies nor will I ever find certainty in truth. I was conned, but that is not the end of my story. I am now exploring the world un-shaded by his lies."
13,STYLE & BEAUTY,Five Minutes with Fern Mallis at Lakme Fashion Week Winter Festive 2012,"Marissa Bronfman, Contributor
Founder of Moxie Media and Bowl Bar",https://www.huffingtonpost.com/entry/fern-mallis_us_5b9c172fe4b03a1dcc7c425e,"Find out why Mallis feels Lakme Fashion Week is so important for young designers, why fashion sponsorship needs policing and how Indian designers can rise to the occasion.",2012-08-03,"NEW YORK, NY - JUNE 04: Fern Mallis attends 2012 CFDA Awards Dinner hosted by Tommy Hilfiger at Monkey Bar on June 4, 2012 in New York City. (Photo by Dimitrios Kambouris/Getty Images for Tommy Hilfiger)",https://img.huffingtonpost.com/asset/5b9c172f240000320053121e.jpeg?ops=scalefit_720_noupscale,"It was a surprise treat to see the former Queen of New York fashion week sitting front row at Lakme Fashion Week (LFW) in Mumbai on Friday. She hasn't attended LFW for the last two seasons. Two years ago, the woman credited with starting New York fashion week left her illustrious post at global fashion management company IMG (which currently runs LFW) to start her own consulting company, Fern Mallis LLC.Despite a one-year absence from Mumbai's fashion scene, the 10 years that Mallis spent creating, shaping and nurturing Lakme Fashion Week has clearly left an indelible mark -- she remains knowledgeable about the Indian market, frank about LFW's strengths and weaknesses and effusive about her love for the country and the promising design talent that is found here. Find out why Mallis feels Lakme Fashion Week is so important for young designers, why fashion sponsorship needs policing and how Indian designers can take advantage of the extraordinary change India is going through.  Fern Mallis with Michelle Obama at the White House wearing Indian designer Kallol Datta (Photo from Fern Mallis' Twitter profile)What did you think of the Gen Next show?The Gen Next show is really the signature of Lakme Fashion Week and it's one of the best things about this week -- discovering and finding new talent. The show was great. Richa Agarwal was my favorite designer in the show. The collection was refreshing, completely saleable and wearable. It was certainly overly layered for the show -- which we all understand, but I could see it next season in Anthropologie or Free People. It was young and exciting, I loved the mix of fabrics, I loved the shapes of the clothes. I thought it was terrific. What is Lakme Fashion Week's greatest strength?I think its biggest strength is discovering new talent and trying to give them that platform. We've seen so much of the talent through the ten years go on to be very successful and then to be players in the industry. When Lakme was formed it was really the split between Delhi and Mumbai and it was a choice that people had to make -- if they wanted to go with the 'newer, younger' or the old guard of Indian fashion and the old guard stayed in Delhi and the new guard came to Lakme.There is a lot of criticism about sponsorship and Bollywood showstoppers and sponsorship at Lakme. What do you think about these criticisms?Through the years there's been a line in the sand that gets stepped over a lot in this country and I, as much as anyone else, understand the need for sponsorships for shows to happen, but for 20 years in New York I was the policeman holding the ground -- where things were inappropriate and where sponsors names and products should not be incorporated into a show for the purity of a show. We lose that battle a lot here in India. That's the shift that's happened through the years and in fashion weeks in general -- it's become a lot more about sponsorships than designers, in some cases. I've always tried to protect the designer's integrity in the shows.Gen Next has been great for some designers while others fall by the wayside. Some designers who gain critical success can't translate that into commercial success. Why do you think this happens?It's a confluence of planets and everything has to come together at the right time, there's no real formula. So much of success in this business is timing, it's luck, it's about financing. One of the biggest obstacles in this country with the designers, if you look at the program and who to contact, the designer has their name, their email -- and that's a problem. There's not enough of a business community here that is training people to be the business partners, to work with these designers and help them grow their businesses and nurture them and finance them. There's not a successful designer in the world who hasn't had a good business partner with them. Here they're all one man, one woman shops. You got to the stalls [in The Source] and maybe mum is there helping write the order. I've written thousands of orders over my ten years here and I can tell you that thousands of things never got delivered or never got made. You never know who's going to follow through, they write it down and you never hear from somebody again. There's a professional code of how to do business that's not being taught here in the schools, and the industry is still very nascent here. So much of your work has been in New York. When people find out that you've done so much in Indian fashion, especially in Bombay, what's their reaction?They're just completely gaga and want to come with me! Everybody I know wants to be in India with me. India is enjoying such an extraordinary place in culture right now, it's India's moment and India really needs to seize that moment and get behind these kinds of industries, the creative talents, the accessories, the designers. I could be bringing a busload -- a plane load! -- of people in a nanosecond who want to be here with me and shop with me. Forty percent of my wardrobe is from India! I'm the big ambassador for India. Kallol Datta, who's closing the show, is thrilled -- I sent him a picture a couple weeks ago of me at the White House with Mrs. Obama wearing his outfit. He's just behind himself and I am so proud to do that because I really think that some of these people are really talented and whatever it takes. Everybody is so intrigued -- if people haven't been here they're dying to come. The people who have been here love India and everyone wants to come back. It's a very special place, you either love it or hate it. There's no gray matter. For me it's a place that I fell in love with 11 years ago and that's been very much a part of my life. This interview has been edited and condensed. Read more from Marissa Bronfman here."
14,STYLE & BEAUTY,Five Minutes with Fern Mallis at Lakme Fashion Week Winter Festive 2012,"Marissa Bronfman, Contributor
Founder of Moxie Media and Bowl Bar",https://www.huffingtonpost.com/entry/fern-mallis_us_5b9c172fe4b03a1dcc7c425e,"Find out why Mallis feels Lakme Fashion Week is so important for young designers, why fashion sponsorship needs policing and how Indian designers can rise to the occasion.",2012-08-03,2012-08-03-HPFernMallisMichelleObamaKallolDattaMarissaBronfman.jpg,https://images.huffingtonpost.com/2012-08-03-HPFernMallisMichelleObamaKallolDattaMarissaBronfman.jpg,"It was a surprise treat to see the former Queen of New York fashion week sitting front row at Lakme Fashion Week (LFW) in Mumbai on Friday. She hasn't attended LFW for the last two seasons. Two years ago, the woman credited with starting New York fashion week left her illustrious post at global fashion management company IMG (which currently runs LFW) to start her own consulting company, Fern Mallis LLC.Despite a one-year absence from Mumbai's fashion scene, the 10 years that Mallis spent creating, shaping and nurturing Lakme Fashion Week has clearly left an indelible mark -- she remains knowledgeable about the Indian market, frank about LFW's strengths and weaknesses and effusive about her love for the country and the promising design talent that is found here. Find out why Mallis feels Lakme Fashion Week is so important for young designers, why fashion sponsorship needs policing and how Indian designers can take advantage of the extraordinary change India is going through.  Fern Mallis with Michelle Obama at the White House wearing Indian designer Kallol Datta (Photo from Fern Mallis' Twitter profile)What did you think of the Gen Next show?The Gen Next show is really the signature of Lakme Fashion Week and it's one of the best things about this week -- discovering and finding new talent. The show was great. Richa Agarwal was my favorite designer in the show. The collection was refreshing, completely saleable and wearable. It was certainly overly layered for the show -- which we all understand, but I could see it next season in Anthropologie or Free People. It was young and exciting, I loved the mix of fabrics, I loved the shapes of the clothes. I thought it was terrific. What is Lakme Fashion Week's greatest strength?I think its biggest strength is discovering new talent and trying to give them that platform. We've seen so much of the talent through the ten years go on to be very successful and then to be players in the industry. When Lakme was formed it was really the split between Delhi and Mumbai and it was a choice that people had to make -- if they wanted to go with the 'newer, younger' or the old guard of Indian fashion and the old guard stayed in Delhi and the new guard came to Lakme.There is a lot of criticism about sponsorship and Bollywood showstoppers and sponsorship at Lakme. What do you think about these criticisms?Through the years there's been a line in the sand that gets stepped over a lot in this country and I, as much as anyone else, understand the need for sponsorships for shows to happen, but for 20 years in New York I was the policeman holding the ground -- where things were inappropriate and where sponsors names and products should not be incorporated into a show for the purity of a show. We lose that battle a lot here in India. That's the shift that's happened through the years and in fashion weeks in general -- it's become a lot more about sponsorships than designers, in some cases. I've always tried to protect the designer's integrity in the shows.Gen Next has been great for some designers while others fall by the wayside. Some designers who gain critical success can't translate that into commercial success. Why do you think this happens?It's a confluence of planets and everything has to come together at the right time, there's no real formula. So much of success in this business is timing, it's luck, it's about financing. One of the biggest obstacles in this country with the designers, if you look at the program and who to contact, the designer has their name, their email -- and that's a problem. There's not enough of a business community here that is training people to be the business partners, to work with these designers and help them grow their businesses and nurture them and finance them. There's not a successful designer in the world who hasn't had a good business partner with them. Here they're all one man, one woman shops. You got to the stalls [in The Source] and maybe mum is there helping write the order. I've written thousands of orders over my ten years here and I can tell you that thousands of things never got delivered or never got made. You never know who's going to follow through, they write it down and you never hear from somebody again. There's a professional code of how to do business that's not being taught here in the schools, and the industry is still very nascent here. So much of your work has been in New York. When people find out that you've done so much in Indian fashion, especially in Bombay, what's their reaction?They're just completely gaga and want to come with me! Everybody I know wants to be in India with me. India is enjoying such an extraordinary place in culture right now, it's India's moment and India really needs to seize that moment and get behind these kinds of industries, the creative talents, the accessories, the designers. I could be bringing a busload -- a plane load! -- of people in a nanosecond who want to be here with me and shop with me. Forty percent of my wardrobe is from India! I'm the big ambassador for India. Kallol Datta, who's closing the show, is thrilled -- I sent him a picture a couple weeks ago of me at the White House with Mrs. Obama wearing his outfit. He's just behind himself and I am so proud to do that because I really think that some of these people are really talented and whatever it takes. Everybody is so intrigued -- if people haven't been here they're dying to come. The people who have been here love India and everyone wants to come back. It's a very special place, you either love it or hate it. There's no gray matter. For me it's a place that I fell in love with 11 years ago and that's been very much a part of my life. This interview has been edited and condensed. Read more from Marissa Bronfman here."
