,category,headline,authors,link,short descr,date,image_caption(s),image_link(s),article
6,BUSINESS,Fired Barclays Trader's Activities From As Early As 2006 Draw Scrutiny In Libor Investigation (CORRECTED),"Reuters, Reuters",https://www.huffingtonpost.com/entry/ryan-reich-barclays-libor_us_5bb2cccbe4b0480ca65c5107,"Reich, now a portfolio manager with New York-based hedge fund WCG Management, was dismissed from Barclays for allegedly sending",2012-08-04,File photo dated 12/04/11 of a general view of a branch of Barclays as they today revealed a potential &pound;450 million bill for mis-selling complex financial products to unwitting small businesses.,https://img.huffingtonpost.com/asset/5bb2cccb200000e800000950.jpeg?ops=scalefit_720_noupscale,"(Repeats story issued Friday, no changes to headline or text)* New York swaps trader was fired over Libor emails* Now works at New York-based hedge fund WCG Management* Supervisors knew of his Libor emails-source* Traders saw nothing wrong with Libor actions-lawyersBy Jennifer Ablan and Matthew Goldstein and Carrick MollenkampAug 3 (Reuters) - A 30-year-old former Barclays Plc swaps trader in New York, who was fired from the bank in 2010, is among those drawing scrutiny from prosecutors in the deepening scandal over the manipulation of global benchmark interest rates.U.S. prosecutors in Washington, D.C. are looking at Ryan Reich's activities while at Barclays between August 2006 and March 2010, said several people familiar with the situation, who declined to be identified because the bid-rigging investigation is ongoing.Reich, now a portfolio manager with New York-based hedge fund WCG Management, was dismissed from Barclays for allegedly sending inappropriate emails seeking internal bank information, according to two sources familiar with the situation.One of those sources, who used to work for the bank, said the information Reich sought concerned how the Libor benchmark rate was going to be priced, information that could have been useful for his trading positions.Reached by telephone on Friday, Reich declined to comment. A spokeswoman at the U.S. Department of Justice did not return phone calls or emails seeking comment.Libor, the London interbank offered rate, is used to set rates on trillions of dollars of contracts for everything from home mortgages to credit cards. The investigation has embroiled banks on both sides of the Atlantic and involves yen and euro rates as well as those for the dollar.Lawyers familiar with the investigation say federal prosecutors continue to reach out to individuals to gauge interest in cooperating or taking pleas. They said p r osecutors are expected to begin making decisions on charging individuals late this month or in early September.Indeed, many of the traders under scrutiny do not believe they did anything wrong because their employers and regulators had some awareness of their activities, the lawyers said. Information released by the New York Fed shows that bank regulators in the United States and Europe knew some banks were submitting low Libor bids during the financial crisis to make institutions appear healthier than they were.A person familiar with Reich's dismissal from Barclays said that the young trader, who joined Barclays just two years after graduating from Princeton University, was directed by his supervisors to send the emails and they were aware of everything he was doing.The person, who did not want to be identified, said the practice of sending emails to gather information on future Libor pricing went back to the 1990s at Barclays, long before Reich joined the firm.""This was systemic at Barclays,"" said the person.Barclays declined to comment. INCONSPICUOUSReich was a part of a low-profile New York trading desk at Barclays that is now increasingly in focus as prosecutors and regulators extend their investigation of the Libor scandal, which began to come to light in 2008. In June, Barclays paid a $453 million penalty to authorities in t he United States and the UK to settle allegations some of its traders colluded with people at other banks to manipulate Libor.In the United States, federal authorities and regulators are focusing on the activities of the Barclays desk on which Reich worked. It traded U.S. Treasury and U.S. dollar and Canadian dollar interest rate swaps.Reuters previously reported that Jay Merchant, one of that desk's top traders, who in 2009 served as head of U.S. dollar swaps trading, is being scrutinized by federal authorities as well. Merchant moved to UBS in late 2009 to run that firm's swaps desk.Ritankar ""Ronti"" Pal, who Merchant reported to and who had overseen all of the desk's trading since 2006, recently left Barclays, according to people familiar with the matter. A man who appeared at an address listed for Pal declined comment and called for building security to escort a reporter away. Pal didn't respond to a written request for comment.The Libor investigation is focusing on allegations that traders at various banks colluded to try and rig the price of Libor to impact the interest rate on swaps, a type of derivative contract. On many swaps, the interest paid is a floating rate, so depending on which side a bank sat on a trade it would have an interest in getting either a lower or higher Libor rate.One thing authorities are looking into is whether traders at banks were trying to get information ahead of time to know where Libor was going to be set for the next day, or work with other traders to influence the rate.As reported last week by Reuters, people familiar with the investigation said authorities are looking at whether some individuals on the Barclay's trading desk tried to influence the rate on Libor by communicating with other traders in London to get a higher return on certain swaps the desk was trading.Traders at JPMorgan Chase & Co also had dealings with some of the Barclays traders under scrutiny, according to a person familiar with the investigation. JPMorgan declined to comment.Reich filed an employment arbitration case against Barclays following his dismissal. The case was eventually resolved, though terms were not disclosed. POSSIBLE CHARGESAnother lawyer familiar with the investigation said prosecutors could charge traders with wire fraud, a charge that does not require them to actually have succeeded in manipulating Libor, but merely have sought to do it. Wire fraud is often used when individuals communicate through emails or cell phones as part of a conspiracy charge.Reich's current employer, WCG Management, is a macro hedge fund that specializes in trading bonds, currencies and interest rate swaps. It oversees $3.4 billion in assets and is led by Barry Wittlin, a former top proprietary trader with Merrill Lynch.Officials at WCG did not respond to a request for comment.People familiar with the investigation said there is no indication authorities are looking at the hedge fund and authorities are not looking at any of Reich's activities at the fund. (Editing by Martin Howell and Leslie Gevirtz)"
7,BUSINESS,Euro Crisis 2012: Greece Reportedly Saved From Bankruptcy By European Central Bank,"Reuters, Reuters",https://www.huffingtonpost.com/entry/greece-bankruptcy-european-central-bank_us_5bb2cccbe4b0480ca65c50df,Until now the Bank of Greece could only accept T-Bills up to a limit of 3 billion euros ($3.70 billion) as collateral for,2012-08-04,"Mario Draghi, President of the European Central Bank, ECB addresses the media during the press conference following the meeting of the ECB Governing Council in Frankfurt am Main, Central Germany, on August 2, 2012. The European Central Bank is of one mind in its determination to preserve the embattled single currency, its president Mario Draghi said. 'The endorsement to do whatever it takes to preserve the euro as a stable currency has been unanimous,' Draghi said, acknowledging however that Germany's central bank had 'reservations' on buying government bonds as one way of tackling the eurozone debt crisis. AFP PHOTO / DANIEL ROLAND (Photo credit should read DANIEL ROLAND/AFP/GettyImages)",https://img.huffingtonpost.com/asset/5bb2cccb2400005100972a3d.jpeg?ops=scalefit_720_noupscale,"BERLIN, Aug 4 (Reuters) - The European Central Bank (ECB) has saved Greece from bankruptcy for the time being by securing it interim financing in the form of additional emergency loans from the Bank of Greece, German newspaper Die Welt said on Saturday.The ECB's Governing Council agreed at its meeting on Thursday to increase the upper limit for the amount of Greek short-term loans the Bank of Greece can accept in exchange for emergency loans, the newspaper said in an advance copy of the article due to appear in its Saturday edition.Until now the Bank of Greece could only accept T-Bills up to a limit of 3 billion euros ($3.70 billion) as collateral for emergency liquidity assistance (ELA) but it has applied to have this limit increased to 7 billion euros, the daily said, citing central bank sources.The ECB Governing Council gave this wish the green light, the paper said.The move should enable the Greek government to access up to an extra 4 billion euros of funds, the paper said, adding that this should ensure the country keeps its head above water until the ""troika"" of the European Union, the European Central Bank and the International Monetary Fund decide on the disbursement of the next tranche of money from its aid program in September.The ECB declined to comment, the paper said. Below are the unemployment rates of nations inside the Eurozone:"
8,ENTERTAINMENT,Russell Brand Documentary: Actor Smokes Heroin In Shocking Scene From 'From Addiction To Recovery',Crystal Bell,https://www.huffingtonpost.com/entry/russell-brand-documentary-heroin-addiction_us_5bb3fbb8e4b066f8d252cc07,"""To me, the gravity is heroin, and then death. You know, to sleep,"" he told Details magazine last May, ""that incremental",2012-08-04,"FILE - This June 30, 2012 file photo originally released by the David Lynch Foundation shows Russell Brand at David Lynch Foundation: A Night of Comedy honoring George Shapiro in Beverly Hills, Calif. Brand must perform 20 hours of community service and pay a $500 court fee to resolve a misdemeanor charge stemming from a confrontation with a photographer in New Orleans. Brand did not appear in Municipal Court Thursday morning, but his attorney, Robert Glass, entered a not-guilty plea on his behalf to a charge of criminal damage to property. Glass said that under a deal with the district attorney's office, the case would be dismissed if the actor provides proof he has completed the service requirement by Aug. 31. (Photo by John Shearer/Invision for David Lynch Foundation, file)",https://img.huffingtonpost.com/asset/5bb3fbb83c000066000c7bae.jpeg?ops=scalefit_720_noupscale,"Russell Brand is the subject of an upcoming documentary for BBC Three, entitled ""Russell Brand: From Addiction to Recovery."" In the tell-all special, Brand reveals that he feels jealous of his old self when watching footage of him taking heroin. According to The Sun, the shocking footage -- of Brand smoking smack in his 20s -- will be featured in the BBC film, which depicts Brand’s highs and lows as he recalls his drug-addicted past.""This is when you know it's a disease. It doesn't matter that I was sat in that flat in Hackney and now I'm in the Savoy. I'm jealous of me then,"" he tells his friend Martino Sclavi as he watches the homemade video at the London’s Savoy Hotel. ""It doesn't make a difference to me. The money, the fame, the power, the sex, the women - none of it. I'd rather be a drug addict.""In April, the comedian and actor testified before a parliamentary committee reviewing U.K. drug policy to call for more ""compassionate"" action toward drug addicts. ""By regarding addiction as an illness, by offering treatment instead of a more punitive approach, we can prevent people from committing crimes,"" Brand told members of Parliament, before opening up about his own struggles with heroin addiction. ""Personally, I was a criminal when I was a drug addict by virtue of my addiction and the ways that I had to acquire money to get drugs."" According to The Guardian, Brand testified to advocate for treating drug addiction as a health and social welfare issue rather than as a criminal one. Despite cracking a few jokes, Brand was serious in his plea. ""I think there needs to be love and compassion for everybody involved,"" said Brand. ""If people are committing criminal behavior, then it needs to be dealt with legally, but you need to offer them treatment.""Brand has been open about his battle to overcome drug addiction in the past and has said society needs to change the way it views addicts. After the death of singer Amy Winehouse in July, Brand wrote a passionate blog post on his website to not only honor his late friend but also to advocate for treatment, claiming that drug addiction should be treated like a potentially fatal illness.""Addiction is a serious disease; it will end with jail, mental institutions or death,"" he wrote. ""All we can do is adapt the way we view [addiction], not as a crime or a romantic affectation but as a disease that will kill.""Brand, who has been sober for nearly a decade, attends AA meetings three times a week in order to keep his addiction in check. ""To me, the gravity is heroin, and then death. You know, to sleep,"" he told Details magazine last May, ""that incremental suicide of turning your life into a dream, to make being awake as similar to sleep as possible. Drowsily, lazily, dry-mouth your way through the day's ceremonies, fumble your way back into the dew-bather you never really left, draped in brown, brown now all around, the haze!""PHOTOS: Celebrity rehab stories"
9,ENTERTAINMENT,Marilyn Monroe's Career: What Would Have Happened If She Hadn't Died 50 Years Ago At 36?,Joe Satran,https://www.huffingtonpost.com/entry/marilyn-monroe-career_us_5bb3fbaae4b066f8d252ca9d,"Churchwell added that Monroe was plagued by debilitating stage fright, even on movie sets, so she would have had to address",2012-08-04,"In this undated publicity photo courtesy Running Press, Marilyn Monroe is shown wearing a knife-pleated gold lamé gown made from one complete circle of fabric. She wore this dress in ""Gentlemen Prefer Blondes."" Monroe passed away a half-century ago this week, a murky death that remains one of Hollywood's most tantalizing mysteries. But look around: Her legend lives on, more vibrantly than ever. In a twist she surely would have appreciated, this 1950's bombshell has become a 21st-century pop culture phenom. (AP Photo/Courtesy Running Press)",https://img.huffingtonpost.com/asset/5bb3fbaa200000e5000051c1.jpeg?ops=scalefit_720_noupscale,"Fifty years ago this Sunday, Paula Strasberg was sitting in her apartment on Central Park West when she got a horrible phone call. Her friend and pupil Marilyn Monroe was dead.Strasberg had been with Monroe just days before in Los Angeles, coaching her through her performance on what ended up being her final movie, ""Something's Gotta Give."" The coaching taxed Strasberg's strength, which was already ravaged by cancer that she refused to discuss with even close friends and that ended her life soon after, so she flew back to New York for a few days of rest. She knew Marilyn wasn't doing well -- but she had no idea just how badly.Strasberg's son John, one of the few people alive who knew Monroe well, recalls that his mother was wracked by guilt in the days that followed the awful revelation.""My mother was going, 'Oh, it's my fault, I should have been there with her'. One had the sense of taking care of Marilyn. She liked that -- and she also elicited it from people,"" he told The Huffington Post. Paula was, of course, far from alone in her grief. Monroe's death from a drug overdose at the age of 36 was a personal tragedy -- the inevitable ending to a life that was wracked by depression, abuse and drug addiction. But it was an equally large tragedy for Hollywood. The movie industry lost years, if not decades, of work from one of its brightest stars. Monroe was so tortured the last few years of life that she was in no shape to get her career together. Even if she had survived the night of Aug. 5, 1962, she might have ended up in a similar situation a few months later. And many of the factors that led her to abuse drugs were tied to her personal life, not her career. But assuming for a moment that she was able to find health and happiness -- what might have she done for the next 30 or 40 years of her career?It's a question that has haunted John Strasberg, 71, for a half a century. He knew Monroe for about eight years, when he was a teenager and she worked with his parents, Paula and Lee Strasberg, who ran the famed Actors Studio in New York. The Strasbergs played as big a part as anyone in Monroe's career during its final phase.Monroe went to the Strasbergs in search of respect. She was tired of being known as nothing more than a pretty face, and eager to be taken seriously as an actress. John Strasberg said his father would talk to Monroe for hours and hours, alone in their apartment. Despite Paula's best efforts to eavesdrop on their conversations, no one ever knew what they discussed. But John Strasberg said that those talks and Monroe's work at the Actors Studio convinced his father that she had it in her to become the kind of dramatic actress she hoped to be. ""My father, who adored her and thought she was potentially one of the great actresses of her generation, thought that she could play all the great parts -- Blanche, in '[A] Streetcar [Named Desire],' for example,"" he said. Making better movies was certainly a central ambition in the last years of her life. She was emboldened by her work with the Strasbergs and by the good reviews she got for her roles in ""Bus Stop"" and ""Some Like It Hot."" Monroe and Lee Strasberg talked for years about collaborating on an adaptation of Somerset Maugham's ""Rain,"" which would be directed by Strasberg and star Monroe as protagonist Sadie Thompson. They also discussed adapting Dostoevsky's ""The Brothers Karamazov,"" with Monroe as Grushenka, a beautiful woman who inspires a character to murder his father. There also were rumors of a movie about Freud.Yet Sarah Churchwell, author of 2004's ""The Many Lives Of Marilyn Monroe,"" noted that Monroe's movie choices were severely limited by her contract with 20th Century Fox studios, headed by the dictatorial Darryl Zanuck.""He was completely contemptuous of her,"" she explained. ""People forget how much power the studio heads had in those days. He was giving her garbage all the time because he thought she was worthless.""It's also unclear whether Monroe had the skills to master the kinds of dramatic roles she yearned for. John Strasberg, an actor and acting teacher himself, thinks Monroe was an indisputably ""brilliant comedian,"" who created the ""dumb blonde"" archetype and played it better than anyone else. But he also said she relied too much on his mother's coaching when she tried to stretch beyond that. He thinks that in the best-case scenario, Monroe would have spent the rest of her career pursuing romantic comedies like ""Some Like It Hot"" -- and avoiding both dramas and bad comedies like ""Something's Gotta Give."" But it seems likely that Monroe's movie career would have lasted only a few more years, even in the best of circumstances.""Back in those days, women, after a certain age, just weren't cast in movies,"" Strasberg said. ""Bette Davis was the first one to fight through the prejudice about how women should look in movies and playing leading roles; she had won Academy Awards, but she couldn't get a job, so she put out ads in 'Variety' and the such. Whether Marilyn could have done that, I don't know. Certainly there was the possibility of that.""Churchwell also noted that Monroe died just before Hollywood started to shift away from the studio system and toward the wild culture of the 1970s, which was hard on many actors of Monroe's generation.""I'm struggling to come up with one contemporary of Marilyn's who made any movie in the 70s. There wouldn't have been those roles for her -- she would have had to go do something else,"" she said. ""It's very difficult to imagine her suddenly making films with Warren Beatty.""Monroe might have elected to try acting on the stage in New York. Much of her training at the Actors Studio was geared toward theater, and Strasberg said Monroe always felt more comfortable in the bustling, relatively anonymous world of New York than celebrity-obsessed Los Angeles. Joyce Carol Oates, who in 2001 wrote ""Blonde,"" an novel about Monroe, believes the stage offered Monroe's best chance of salvation. ""My belief about Marilyn Monroe is that if she had only resisted returning to Hollywood, to make such an egregious movie as 'Let's Make Love,' but had remained in NYC in association with the Actors Studio, she might well have had a stage career as a serious mature actress; she might even be alive today,"" Oates wrote in an email to The Huffington Post. Strasberg once performed a scene from ""A Streetcar Named Desire"" with Monroe and found her very charismatic. But he isn't sure Monroe would have been able to sustain a nightly job in theater. ""Could she have held herself together on that daily basis? Would she have had that kind of discipline -- which obviously would have come from having enough love for what she was doing … I just don't know, because I never saw her do it,"" he said.Churchwell added that Monroe was plagued by debilitating stage fright, even on movie sets, so she would have had to address that with a qualified therapist before tackling the theater in a serious way. If Monroe had been able to do that, Churchwell noted, she might have also started a one-woman act in Las Vegas, as her contemporary Debbie Reynolds did. Then again, Monroe also might have decided to leave acting altogether. In her last interview, she said, ""It might be a kind of relief to be finished.""Churchwell pointed out that Monroe was not, in 1962, in a financial position to retire -- the actress had been ""vastly underpaid by contemporary standards of her peers"" for most of her career. (Especially unjust considering how much money others make from her image to this day.) It was only in her last contract with Fox, signed less than a month before her death, that she received $500,000 per movie. And if she had survived the night of Aug. 5, finished ""Something's Gotta Give,"" then made enough movies to build a good-sized nest egg -- what then?""She had seen women like Betty Grable bow out gracefully, say, 'I've had my time, and now it's time for something else',"" Churchwell said. ""So I don't think it was difficult for Marilyn to imagine that.""If she had lived, Monroe would have been 86 this year."
10,ENTERTAINMENT,"President Obama, Harvey Weinstein: Movie Mogul Plans $35,000-Per-Person Fundraiser",Crystal Bell,https://www.huffingtonpost.com/entry/president-obama-harvey-weinstein-fundraiser_us_5bb3fbb6e4b066f8d252cbc2,Movie mogul Harvey Weinstein is the lastest Hollywood figure to plan a high-profile fundraiser for President Obama. Weinstein,2012-08-04,"President Barack Obama talks abut taxes, Friday, August 3, 2012, in Eisenhower Executive Office Building on the White House campus in Washington. (AP Photo/J. Scott Applewhite)",https://img.huffingtonpost.com/asset/5bb3fbb6250000cf0038d45c.jpeg?ops=scalefit_720_noupscale,"Movie mogul Harvey Weinstein is the lastest Hollywood figure to plan a high-profile fundraiser for President Obama. Weinstein will hold a $35,000-per-person dinner at his Westport, Conn. home on Monday, Aug. 6. The famed movie producer has been a staunch supporter of the president. According to public records, Weinstein has donated over $75,000 to democratic campaigns this election cycle, including a $35,800 check directly to Obama's campaign. ""I think he’s got deep personal beliefs,"" Weinstein told The Huffington Post in July. ""I don’t have to agree with everything a candidate does to support him."" In May, actor George Clooney hosted a star-studded Obama fundraiser at his home in Studio City, Ca. The 150-person event brought in $15 million, from both ticket prices -- $40,000 per person -- and donations of $3 or more that entered donors into a raffle to win tickets to the event, according to the Los Angeles Times. Following Clooney's event, actress Sarah Jessica Parker and her husband Matthew Broderick hosted their own dinner for President Obama and his wife Michelle Obama in New York City. The intimate gathering banked approximately $2 million for the president's campaign. Mitt Romney's campaign has criticized President Obama for his relationship with the Hollywood elite. However, when asked about Obama's relationship with the stars in June, his spokesman, Jay Carney, fired back: ""Two words. Donald Trump. Next question?"" Trump is one of Romney's most high-profile supporters."
