,category,headline,authors,link,short descr,date,image_caption(s),image_link(s),article
11,ARTS,"Hofesh Shechter's 'Untouchable' at the Royal Ballet, Sandwiched by Sturdy Classics","Carla Escoda, ContributorDance, theatre and arts critic, based in San Francisco. Former...",https://www.huffingtonpost.com/entry/hofesh-shechters-untoucha_b_7093950.html,"Tuesday night's performance of Four T's was not as uniformly bracing as generally seen across the pond, though Robert Clark on piano and the Royal Opera House orchestra under Barry Wordsworth gave a crisp account of the Hindemith score.",2015-04-19,2015-04-19-1429407678-2619948-TripleBill260315RoyalBallet2507.jpg,https://images.huffingtonpost.com/2015-04-19-1429407678-2619948-TripleBill260315RoyalBallet2507-thumb.jpg," Ballet to the People caught the final night of the Royal Ballet's curious mixed bill that seems to have been programmed by the ancient dart-throwing method. George Balanchine's iconic The Four Temperaments set a high bar for the rest of the evening, followed by a much-anticipated new work by Hofesh Shechter. And a 65-minute closer, which violates the rules of programming evenings of dance - except that it's Kenneth MacMillan's Song of the Earth, set to the sublime Mahler song cycle, Das Lied von der Erde.  Tuesday night's performance of Four T's was not as uniformly bracing as generally seen across the pond, though Robert Clark on piano and the Royal Opera House orchestra under Barry Wordsworth gave a crisp account of the Hindemith score. Apart from the stupendous Itziar Mendizabal, who blazed through Choleric like a fighter jet, this cast did not push the off-balance work to the extremes that make Balanchine's 1946 riposte to classicism so exciting. Still, there was much to admire, starting with the sweeping shapes Claire Calvert made with her legs, the poetry of Matthew Golding's every move, the expert partnering by all the men, and the razor-sharp style and aplomb of Lara Turk's dancing - even after her pointe shoe ribbons came completely untied. Turk did not dial down her performance at all, and managed to keep the shoe on and the flying ribbons from tripping her or any of her comrades. The irresistible Vadim Muntagirov radiated the angst and despair of a war-ravaged generation in Melancholic better than any of the current crop of New York City Ballet dancers. But he and they all dance in the shadow of Bart Cook, who reigned supreme in this role through the 70's, and, after him, Peter Boal.Eric Underwood dispatched the Phlegmatic variation with elegance - and a vexatious habit of curling his toes under when pointing his feet. Pointed feet were not called for in Hofesh Shechter's Untouchable, which placed 20 of the company's soloists and corps dancers in costumes vaguely resembling combat fatigues, and in dreadlocks and other nifty hairdos rarely seen on an opera house stage. This was Shechter's first commission for the Royal. Unlike the overtly political, in-your-face work he has made for his own company, he has given these ballet dancers an exciting new vocabulary without anything to say. The first few minutes of the ensemble moving as one squadron, their unison staggering, slouching and prowling in a dusty gloom proved riveting. The next two minutes less so. At the end of an eternity (program notes claim it was only 30 minutes), this writhing, grunting mass of humanity completed their exertions and left unanswered the question ""Why?"" Hints of Eastern European folk dance, of Omani-style bullfighting, fits of Sufi whirling and chest-slapping, packaged without any dramatic arc, lit by a Trekkie (""beam me up, Scotty""), did nothing to enlighten the situation. The American reality television competition So You Think You Can Dance is littered with countless examples of this style of dance, dubbed 'combat jazz' by Sonya Tayeh, one of the show's most popular choreographers. The SYTYCD format limits these pieces to about 90 seconds, which is about right when you don't have a story to tell or a mood to convey other than belligerence. That the highly trained athletes of the Royal Ballet can master this style should come as no surprise; the real surprise is that Shechter, known for his spine-chilling innovation, failed to exploit the rest of their considerable gifts. The thumping score with Middle Eastern overtones was written by modern Renaissance man Shechter, in collaboration with Nell Catchpole. Voices started chanting what sounded like holy syllables in a Middle Eastern tongue; when her date whispered ""they're singing Nigel Farage"" it meant nothing to Ballet to the People. Until she tuned in to the BBC election debate on Thursday evening and got a full dose of the right-wing politician's toxic fumes. Still, it was hard to take any of this seriously, when the thought of an American composer creating a score for a ballet around an incantation of the name of Texas Senator Ted Cruz just cracked her up.Pairing Untouchable with MacMillan's 1965 Song of the Earth only diminished the power of both. The MacMillan, with its lack of bombast, looked stylistically quaint, and the Shechter even more devoid of meaning. But, like a sturdy clean-up batter, Song of the Earth came through.  MacMillan created a shimmering world and indelible characters, a community stalked by an ever-present Messenger of Death, danced with quiet menace by Edward Watson. Watson eventually tears the trusting Nehemiah Kish from the lovely, dignified Laura Morera, whose journey from hope to anguish, and finally to acceptance, is marked by captivating gestural expressions that bridge mime and pure dance.  The ballet is replete with taut, finely chiseled images of abstract beauty, that also serve as visual metaphors. A group of dancers seated on the floor, with legs extended, magically become a sea, or a ship. Women gliding smoothly over the ground assume the form of angels. Hoisted effortlessly into the air by Kish, Morera stretches and arches her back, high over his head, poised in a perfect balance in his hands - an archer's bow, or a crescent moon. The faintest hints of Chinese influence in movement and shape echo the ancient Chinese poetry that inspired the Mahler song cycle. The entire work is a marvel of austerity and restraint, even as it evokes intense emotion. It's a tricky business programming mixed bills, and taking risks with new choreographers is essential. Hofesh Shechter may have been uncharacteristically risk-averse in his first outing at the Royal; should he be given another shot at these tremendous dancers, Ballet to the People hopes he comes prepared to unleash his full artillery."
12,ARTS,"Hofesh Shechter's 'Untouchable' at the Royal Ballet, Sandwiched by Sturdy Classics","Carla Escoda, ContributorDance, theatre and arts critic, based in San Francisco. Former...",https://www.huffingtonpost.com/entry/hofesh-shechters-untoucha_b_7093950.html,"Tuesday night's performance of Four T's was not as uniformly bracing as generally seen across the pond, though Robert Clark on piano and the Royal Opera House orchestra under Barry Wordsworth gave a crisp account of the Hindemith score.",2015-04-19,2015-04-19-1429407835-4230822-TripleBill260315RoyalBallet678EdwardWatsonROH2015.PhTristramKenton.jpg,https://images.huffingtonpost.com/2015-04-19-1429407835-4230822-TripleBill260315RoyalBallet678EdwardWatsonROH2015.PhTristramKenton-thumb.jpg," Ballet to the People caught the final night of the Royal Ballet's curious mixed bill that seems to have been programmed by the ancient dart-throwing method. George Balanchine's iconic The Four Temperaments set a high bar for the rest of the evening, followed by a much-anticipated new work by Hofesh Shechter. And a 65-minute closer, which violates the rules of programming evenings of dance - except that it's Kenneth MacMillan's Song of the Earth, set to the sublime Mahler song cycle, Das Lied von der Erde.  Tuesday night's performance of Four T's was not as uniformly bracing as generally seen across the pond, though Robert Clark on piano and the Royal Opera House orchestra under Barry Wordsworth gave a crisp account of the Hindemith score. Apart from the stupendous Itziar Mendizabal, who blazed through Choleric like a fighter jet, this cast did not push the off-balance work to the extremes that make Balanchine's 1946 riposte to classicism so exciting. Still, there was much to admire, starting with the sweeping shapes Claire Calvert made with her legs, the poetry of Matthew Golding's every move, the expert partnering by all the men, and the razor-sharp style and aplomb of Lara Turk's dancing - even after her pointe shoe ribbons came completely untied. Turk did not dial down her performance at all, and managed to keep the shoe on and the flying ribbons from tripping her or any of her comrades. The irresistible Vadim Muntagirov radiated the angst and despair of a war-ravaged generation in Melancholic better than any of the current crop of New York City Ballet dancers. But he and they all dance in the shadow of Bart Cook, who reigned supreme in this role through the 70's, and, after him, Peter Boal.Eric Underwood dispatched the Phlegmatic variation with elegance - and a vexatious habit of curling his toes under when pointing his feet. Pointed feet were not called for in Hofesh Shechter's Untouchable, which placed 20 of the company's soloists and corps dancers in costumes vaguely resembling combat fatigues, and in dreadlocks and other nifty hairdos rarely seen on an opera house stage. This was Shechter's first commission for the Royal. Unlike the overtly political, in-your-face work he has made for his own company, he has given these ballet dancers an exciting new vocabulary without anything to say. The first few minutes of the ensemble moving as one squadron, their unison staggering, slouching and prowling in a dusty gloom proved riveting. The next two minutes less so. At the end of an eternity (program notes claim it was only 30 minutes), this writhing, grunting mass of humanity completed their exertions and left unanswered the question ""Why?"" Hints of Eastern European folk dance, of Omani-style bullfighting, fits of Sufi whirling and chest-slapping, packaged without any dramatic arc, lit by a Trekkie (""beam me up, Scotty""), did nothing to enlighten the situation. The American reality television competition So You Think You Can Dance is littered with countless examples of this style of dance, dubbed 'combat jazz' by Sonya Tayeh, one of the show's most popular choreographers. The SYTYCD format limits these pieces to about 90 seconds, which is about right when you don't have a story to tell or a mood to convey other than belligerence. That the highly trained athletes of the Royal Ballet can master this style should come as no surprise; the real surprise is that Shechter, known for his spine-chilling innovation, failed to exploit the rest of their considerable gifts. The thumping score with Middle Eastern overtones was written by modern Renaissance man Shechter, in collaboration with Nell Catchpole. Voices started chanting what sounded like holy syllables in a Middle Eastern tongue; when her date whispered ""they're singing Nigel Farage"" it meant nothing to Ballet to the People. Until she tuned in to the BBC election debate on Thursday evening and got a full dose of the right-wing politician's toxic fumes. Still, it was hard to take any of this seriously, when the thought of an American composer creating a score for a ballet around an incantation of the name of Texas Senator Ted Cruz just cracked her up.Pairing Untouchable with MacMillan's 1965 Song of the Earth only diminished the power of both. The MacMillan, with its lack of bombast, looked stylistically quaint, and the Shechter even more devoid of meaning. But, like a sturdy clean-up batter, Song of the Earth came through.  MacMillan created a shimmering world and indelible characters, a community stalked by an ever-present Messenger of Death, danced with quiet menace by Edward Watson. Watson eventually tears the trusting Nehemiah Kish from the lovely, dignified Laura Morera, whose journey from hope to anguish, and finally to acceptance, is marked by captivating gestural expressions that bridge mime and pure dance.  The ballet is replete with taut, finely chiseled images of abstract beauty, that also serve as visual metaphors. A group of dancers seated on the floor, with legs extended, magically become a sea, or a ship. Women gliding smoothly over the ground assume the form of angels. Hoisted effortlessly into the air by Kish, Morera stretches and arches her back, high over his head, poised in a perfect balance in his hands - an archer's bow, or a crescent moon. The faintest hints of Chinese influence in movement and shape echo the ancient Chinese poetry that inspired the Mahler song cycle. The entire work is a marvel of austerity and restraint, even as it evokes intense emotion. It's a tricky business programming mixed bills, and taking risks with new choreographers is essential. Hofesh Shechter may have been uncharacteristically risk-averse in his first outing at the Royal; should he be given another shot at these tremendous dancers, Ballet to the People hopes he comes prepared to unleash his full artillery."
13,MEDIA,BuzzFeed Deleted 3 Posts Under Pressure From Its Business Department,,https://www.huffingtonpost.com/entry/buzzfeed-deleted-3-posts-_n_7093794.html,,2015-04-19,"The logo of news website BuzzFeed is seen on a computer screen in Washington on March 25, 2014. AFP PHOTO/Nicholas KAMM (Photo credit should read NICHOLAS KAMM/AFP/Getty Images)",https://img.huffingtonpost.com/asset/5bb5c6b33c000018010d07e8.jpeg?ops=scalefit_720_noupscale,"Earlier this week, BuzzFeed launched an internal review of any posts that its editors or writers had deleted from the site since editor-in-chief Ben Smith was hired in January 2012. In an interview on Friday, and a memo sent to staff on Saturday, Smith revealed that the review has already uncovered three instances where complaints from the site’s business and advertising departments led Smith to delete posts.Read more on Gawker"
14,WORLDPOST,Supreme Leader Khamenei Says Iranian Nuclear Weapons Are A U.S. 'Myth',,https://www.huffingtonpost.com/entry/iran-nuclear-weapons_n_7094778.html,,2015-04-19,"In this picture released by an official website of the office of the Iranian supreme leader, Supreme Leader Ayatollah Ali Khamenei attends a meeting with a group of religious performers in Tehran, Iran, Thursday, April 9, 2015. Iran's top leader on Thursday stopped short of giving his endorsement to the framework nuclear deal struck last week between Teheran and world powers, while the country's president warned separately that Tehran's approval of a final deal depends on the immediate lifting of all sanctions related to its controversial nuclear program. (AP Photo/Office of the Iranian Supreme Leader)",https://img.huffingtonpost.com/asset/5cc149db260000520070a7f3.jpeg?ops=scalefit_720_noupscale,"* Supreme leader says Iran being threatened militarily* Khamenei has supported talks but remains distrustful* IRGC leader rejects inspections of military sites (Adds comments from U.S. senators)By Sam WilkinDUBAI, April 19 (Reuters) - Iran's Supreme Leader Ayatollah Ali Khamenei told military commanders on Sunday the United States had created the ""myth"" of nuclear weapons to portray Iran as a threat, hardening his rhetoric before nuclear negotiations resume this week.Khamenei, the highest authority in Iran, has supported the nuclear talks but continues to express deep mistrust of the United States.""They created the myth of nuclear weapons so they could say the Islamic Republic is a source of threat. No, the source of threat is America itself, with its unrestrained, destabilizing interventions,"" Khamenei said in a televised address to a hall of several hundred military commanders.""The other side is methodically and shamelessly threatening us militarily ... even if they did not make these overt threats, we would have to be prepared,"" he said.Political leaders in Iran and the United States have to contend with domestic constituencies skeptical about the outcome of the talks. Khamenei's comments did not appear to suggest he has withdrawn his cautious support for the diplomatic process.Iran and six world powers including the United States reached a framework accord on Iran's disputed nuclear program this month and will resume negotiations in Vienna this week, aiming to reach a final deal by the end of June.The framework accord is a step towards a settlement that would allay Western fears that Iran could build an atomic bomb, with economic sanctions on Tehran being lifted in return.Despite significant progress, the two sides still disagree on several issues, including how quickly international sanctions would be lifted under a final deal. ""NATIONAL HUMILIATION""Earlier this month, Khamenei insisted that all sanctions be lifted immediately on a deal being reached, a condition the U.S. State Department dismissed. He warned of Washington's ""devilish"" intentions, even as he reaffirmed his support for Iran's negotiating team.The deputy commander of the powerful Islamic Revolutionary Guards Corps (IRGC) on Sunday rejected any inspections of military sites as a ""national humiliation,"" highlighting another area of difference between the two sides.""This subject is treasonous and selling out the country, and if anyone speaks of it we will respond with hot lead,"" Hossein Salami said, in comments cited by state news agency IRNA.Republican U.S. Senator Bob Corker, the co-author of legislation that would allow Congress to review any final nuclear deal with Iran, told CNN on Sunday that lifting of sanctions must be phased to ensure Iran's compliance and include broad inspection capabilities for military sites.Senator Marco Rubio, a Republican 2016 presidential candidate, said the agreement thus far leaves too much infrastructure in place for Iran to develop a nuclear weapon.He told the CBS program ""Face the Nation"" that U.S. and international sanctions must remain in place, with a warning of U.S. military action if certain thresholds are crossed.""We don't want that to happen, but risk of a nuclear Iran is so great that that option must be on the table,"" Rubio said.Khamenei also criticized U.S. support for a Saudi-led offensive in Yemen, where a coalition of Arab countries is bombing Iran-allied Houthi rebels who seized the capital Sanaa last year and took control of other parts of the country.""Today these tragic events are happening in Yemen and the Americans are supporting the oppressor,"" he said.The four-week old campaign, in which Iran and Western countries have backed opposite sides, began during the last round of nuclear talks. Growing civilian casualties and Western suspicions that Iran is arming the Houthis have added to tensions. (Additional reporting by David Lawder in Washington; Editing by Gareth Jones)"
15,ARTS,"Miami Art, Not Miami Vice, Attracts Aficionados","Magda Abu-Fadil, ContributorDirector of Media Unlimited in Lebanon",https://www.huffingtonpost.com/entry/miami-art-not-miami-vice_b_7094642.html,Two people walk into a bar... and find an exquisite Sir Henry Moore marble sculpture mounted on a pedestal in a fountain adorning a five-star hotel lobby's atrium. It's not your typical joke punchline.,2015-04-19,2015-04-19-1429432401-4156966-SirHenryMooresSpindleinMiamiAbuFadil.jpg,https://images.huffingtonpost.com/2015-04-19-1429432401-4156966-SirHenryMooresSpindleinMiamiAbuFadil-thumb.jpg,"Two people walk into a bar... and find an exquisite Sir Henry Moore marble sculpture mounted on a pedestal in a fountain adorning a five-star hotel lobby's atrium.Not your typical joke punchline, but then Miami has long transcended the Miami Vice TV police series reputation that made it the butt of jokes and derision and has become quite a magnet for artists and art lovers.  Sir Henry Moore's ""Spindle"" in Miami (Abu-Fadil)The sculpture I saw at Miami's Intercontinental Hotel is based on Moore's Spindle series and was carved in Italy in 1981. It stands majestically at 4.5 meters (14.7 feet) in height and weighs about 70 tons.But that's not all.I enjoyed that aspect of the city on a recent visit and did the traditional thing of discovering the Pérez Art Museum Miami (PAMM) that I hadn't seen during a brief hop years earlier. In ""Miami Attracts the World's Ultra Wealthy,"" a feature in the April issue of Cityscape Abu Dhabimagazine, developers are drawn to the city's growing real estate market in upmarket Miami Beach as well as districts like Wynwood, a former industrial zone, a magnet for galleries, trendy cafés, restaurants and boutiques. Shepard Fairey's wheat-pasted mural (Abu-Fadil)It's noted for, among other things, the Wynwood Walls, an open-air display of street art and graffiti that combines amazing imagination, technique, nuance, peculiarities and beauty.Visitors can walk freely along pathways into open courtyards and alleys, sit at picnic benches, or enjoy a meal or coffee at the café while taking in the mix of colors, genres and designs on display all over the area.Visitors entering Wynwood Walls can't miss Shepard Fairey's wheat-pasted mural with images of the Dalai Lama, Martin Luther King, Jr., and, particularly, as a tribute to Tony Goldman.Goldman, the late patron who conceived of the walls project in 2009, said: ""Wynwood's large stock of warehouse buildings, all with no windows, would be my giant canvases to bring to them the greatest street art ever seen in one place.""Artist Ryan McGinness' 33 Women mural of Day-Glo paint set against a black wall brings out in stark assertion his rendition of female nudes. Ryan McGinness' 33 Women (Abu-Fadil)He is quoted as saying: ""These drawings are my version of what is sexy.""  ""Women on the Walls"" is another perspective on female sensuality by Miss Van, a.k.a. Vanessa Alice Bensimon, and occupies an imposing space in the Wynwood art park. Miss Van, who hails from the French city of Toulouse but has lived in Barcelona and exhibited in various cities, is a noted graffiti and street artist who often renders her female characters' faces into animal and bird visages.   Miss Van's ""Women on the Walls"" (Abu-Fadil)The New York-born, Baltimore-based artist who goes by the single name of Gaia produced an impressive portrait of American oil and railroad tycoon Henry Flagler on one of the walls.Gaia, in Greek mythology a deity personifying the Earth, said of Flagler:If you're from Miami, you've definitely heard of him. He's the reason why Florida is essentially Florida or why Miami is even called Miami... He established Overtown on the west side of the freight tracks for his black workers. This historic neighborhood that sits 15 blocks south of the Wynwood Walls would eventually be decimated by the construction of (interstate highway) I-95 and urban renewal.  Gaia's portrait of American industrialist Henry Flagler (courtesy Kadragic)The area is overflowing with art. I walked outside the main enclosure to find murals on side streets and alleys and well into adjacent neighborhoods.A very realistic portrait of what seems to be a woman -- one can't always tell -- with a fixed look that adorns a segment of a street corner's wall next to a shuttered shop. The vertical stylized script alongside it could almost pass for Arabic. There was no description of it.    Outside the Wynwood Walls (Abu-Fadil)A very colorful mural of four characters from what could be a comic book shows three males (one carrying a bouquet of flowers) and a female with horns holding an ice cream cone.Again, nobody in sight to explain.  Comic book characters street art? (Abu-Fadil)My meanderings took me to Miami's Design District, another neighborhood that is home to artists and galleries.I visited the Locust Projects, a not-for-profit gallery ""dedicated to providing contemporary visual artists the freedom to experiment with new ideas without the pressures of gallery sales or limitations of conventional exhibition spaces.""The installation ""Sun Breaker"" by New York-based artist Ruby Sky Stiler fills the space with her suspended laser-cut screens and wall-mounted plaster reliefs.   Part of Ruby Sky Stiler's ""Sun Breaker"" installation (Abu-Fadil)According to Cityscape Abu Dhabi magazine:Art has become identified with serious money as well as creativity in Miami since the beginning of Art Basel Miami in 2002. Following the parent exhibition that started in Basel, Switzerland, in 1970, the Miami version has expanded and created a local year-round market for art. It is another attraction for the ultra-wealthy as well as many of the people who live in the area. "
