,category,headline,authors,link,short descr,date,image_caption(s),image_link(s),article
0,BUSINESS,U.S. Fourth-Quarter GDP Rose At A 0.7 Percent Rate,"Lucia Mutikani, Reuters",https://www.huffingtonpost.com/entry/economic-growth-q4-2015_us_56ab6f6fe4b00b033aaeb194,The growth pace was in line with economists' expectations and followed a 2 percent rate in the third quarter.,2016-01-29,"Traders work on the floor of the New York Stock Exchange (NYSE) on January 29, 2016 in New York City.",https://img.huffingtonpost.com/asset/56ab71a81a00001001ab1910.jpeg?ops=scalefit_720_noupscale,"WASHINGTON, Jan 29 (Reuters) - U.S. economic growth braked sharply in the fourth quarter as businesses stepped up efforts to reduce an inventory glut and a strong dollar and tepid global demand weighed on exports.Gross domestic product increased at a 0.7 percent annual rate, the Commerce Department said on Friday in a report that showed a further cutback in investment by energy firms grappling with lower oil prices. Growth in consumer spending also slowed as unseasonably mild weather cut into spending on utilities.But with the labor market strengthening and some of the impediments to growth largely temporary, economists expect output to pick up in the first quarter of 2016. First-quarter growth estimates are for now mostly above a 2 percent rate.""The economy took its lumps late last year. It's not going to be smooth sailing in 2016, but we don't see the ship sinking either, and the rising concern about a recession later on this year triggered by China, those fears need a reality check,"" said Chris Rupkey, chief economist at MUFG Union Bank in New York.The Federal Reserve on Wednesday acknowledged that growth ""slowed late last year,"" but also noted that ""labor market conditions improved further."" The U.S. central bank raised interest rates in December for the first time since June 2006.Though the Fed has not ruled out another hike in March, weaker growth and financial markets volatility could see that delayed until June. Excluding inventories and trade, the economy grew at a 1.6 percent pace in the fourth quarter.The fourth-quarter growth pace was in line with economists' expectations and followed a 2 percent rate in the third quarter. The economy grew 2.4 percent in 2015 after a similar expansion in 2014.The GDP data, together with a surprise decision by the Bank of Japan to cut a benchmark interest rate below zero in a bold move to stimulate the Japanese economy, buoyed the dollar against a basket of currencies. Prices for U.S. Treasuries rose and U.S. stocks were trading higher.In the fourth quarter, businesses accumulated $68.6 billion worth of inventory. While that was down from $85.5 billion in the third quarter, it was a bit more than economists had expected, suggesting inventories could remain a drag on growth in the first quarter.The small inventory build subtracted 0.45 percentage point from the first estimate of fourth-quarter GDP growth.LIMITED SPILLOVERConsumer spending, which accounts for more than two thirds of U.S. economic activity, increased at a 2.2 percent rate. Though that was a step-down from the 3.0 percent pace notched in the third quarter, the gain was above economists' expectations.Unusually mild weather hurt sales of winter apparel in December and undermined demand for heating through the quarter.With gasoline prices around $2 per gallon, a tightening labor market gradually lifting wages and house prices boosting household wealth, economists believe the slowdown in consumer spending will be short-lived.""The consumer will continue to power ahead, as spillovers from the weak mining and manufacturing sector to services industries remain limited,"" said Harm Bandholz, chief U.S. economist at UniCredit Research in New York.Income at the disposal of households after accounting for taxes and inflation increased 3.2 percent in the fourth quarter after rising 3.8 percent in the prior period. Savings rose to a lofty $739.3 billion from $700.6 billion in the third quarter.While a separate report from the University of Michigan showed a dip in its consumer sentiment index in January because of the recent stock market sell-off, consumer optimism remained at levels consistent with steady economic growth.The dollar, which has gained 11 percent against the currencies of the United States' trading partners since last January, remained a drag on exports, leading to a trade deficit that subtracted 0.47 percentage point from GDP growth in the fourth quarter.The downturn in energy sector investment put more pressure on business spending on nonresidential structures. Spending on mining exploration, wells and shafts dropped at a 38.7 percent rate after plunging at a 47.0 percent pace in the third quarter.Investment in mining exploration, wells and shafts fell 35 percent in 2015, the largest drop since 1986.As oil prices appear to level off, the energy sector drag on the economy is expected to ease in the coming quarters. Oil prices have plummeted more than 60 percent since mid-2014, forcing oil field companies such as Schlumberger and Halliburton to slash their capital spending budgets.Business spending on equipment contracted at a 2.5 percent rate last quarter after rising at a 9.9 percent pace in the third quarter. Investment in residential construction remained a bright spot, rising at a 8.1 percent rate.With consumer spending softening, inflation retreated in the fourth quarter. A price index in the GDP report that strips out food and energy costs increased at a 1.2 percent rate, slowing from a 1.4 percent pace in the third quarter.(Reporting by Lucia Mutikani; Editing by Andrea Ricci)"
1,POLITICS,Trump Debate Flap Throws Republican Party Into Deeper Chaos,"James Oliphant, Reuters",https://www.huffingtonpost.com/entry/trump-fox-news-debate-gop-chaos_us_56ab85b7e4b077d4fe8db8e0,Trump's candidacy threatens to scramble the Republican coalition built since the presidency of Ronald Reagan.,2016-01-29,"Republican presidential candidate Donald Trump gestures as he speaks to veterans at Drake University on January 28, 2016 in Des Moines, Iowa.",https://img.huffingtonpost.com/asset/56ab862f1f00007f00216ea2.jpeg?ops=scalefit_720_noupscale,"DES MOINES, Jan 29 (Reuters) - As seven Republican presidential contenders squared off here for the final debate before voters begin winnowing the field, Donald Trump presided over his own, separate rally a mile away in front of a packed house of cheering supporters.It would be hard to find a more ideal metaphor for the forces tearing asunder the Republican Party.For months, Trump has chosen to operate in his own political universe, violating the conventional wisdom that governs presidential campaigns, thumbing his nose at conservative institutions ranging from the Fox News Channel to the National Review and advocating policies at odds withparty orthodoxy.And whether he wins the Iowa caucuses on Monday, Trump's candidacy promises to continue to upend the established political order as the presidential race intensifies ahead of the Nov. 8 election. Most national opinion polls have him with more than 30 percent of the Republican primary electorate - and those voters are showing little sign of switching to anyone else.""I think he will have made a permanent impact on the process,"" Newt Gingrich, the former speaker of the U.S. House of Representatives and a 2012 presidential candidate, told Reuters. Trump's campaign, he said, ""is one of those great disruptions that reshapes everything.""Tensions within the Republican Party between grassroots conservatives and the Washington establishment have been simmering since the Tea Party movement arose during President Barack Obama's first term, catapulting presidential contenders Senators Ted Cruz, Marco Rubio and Rand Paul to office, among others.NEW FISSURESBut Trump's insurgent candidacy has carved new fissures into the party, splitting conservative talk-radio hosts, religious leaders, and Washington pundits, with some sounding the alarm while others implore the party to respond to the anger toward Republican incumbents among voters who are fueling Trump's rise.The billionaire businessman has mounted his campaign on the notion of the fading American working-class, arguing they are under threat by both free trade deals favored by Republicans that encourage companies to send jobs overseas and by waves of illegal immigrants that work for low wages.""People are upset. People believe that promises made have not been promises kept. There comes a point when you've had it,"" said Iowa Republican Party Chairman Jeff Kaufmann, who has appeared at Trump rallies.Trump's candidacy threatens to scramble the Republican coalition built since the presidency of Ronald Reagan, one that worked to unite evangelical Christians and other social conservatives, economic conservatives, and military hawks behind a standard-bearer.The New York real estate tycoon and former reality TV star does not check many of those boxes. He shocked evangelicals here when he told them he has never asked God for forgiveness and spends little time on issues such as abortion and same-sex marriage. He has threatened to slap tariffs on imported goods to protect American jobs and raise taxes on hedge-fund managers. He has decried the wars in Iraq and Afghanistan and has sounded reluctant to deeply involve U.S. forces in the conflict in Syria.""He is attracting people of all kinds of backgrounds who have never thought of themselves asRepublicans,"" Gingrich said. ""I think it's very hard for traditional political observers to understand (what's happening).""Early during Thursday's debate in Des Moines, it seemed that the seven Republicans on the stage worked collectively to try and wean voters in Iowa and elsewhere off of Trump, with some dismissing him as an entertainer and others blasting his policy stances. His absence loomed over the entire event.And Trump demonstrated the sway he holds over the race when it was revealed that Fox News executives had made an 11th-hour pitch to woo him back onto the debate stage, handing him a rhetorical victory of sorts even as his rivals seemed to relish his absence.He also was joined at his event in Des Moines by two other Republican presidential candidates, Mike Huckabee and Rick Santorum - perhaps an acknowledgement that Trump's campaign may be a juggernaut now that may not be able to be stopped and that it might be time to climb aboard.A NEW FORMULA?Cruz alluded at the debate to the need to bring order to what has been a chaotic campaign.""Anyone who is able to win in the Republican Party has to be able to bring together the disparate elements of the Reagan coalition,"" he said. ""You've got to be able to bring together conservatives and evangelicals and libertarians, and stitch together a winning majority.""But Ford O'Connell, a Republican strategist who is not aligned with any candidate, said Cruz may be too beholden to the conventional ways to win the nomination.""What resonates (for voters) is not just Trump's bravado, it's that the everyday man thinks he's fighting for him,"" O'Connell said. ""Cruz assumes being a conservative means an ideological checklist. For a lot of others in the party, or for some who have left the party, it's more of a feeling.""Even as the seven candidates argued among themselves about who is best positioned to challenge Trump for the nomination, analytics provided by Google during the debate showed Trump eclipsed all of them in terms of number of searches.And if Trump loses next Monday in Iowa - he's locked in a close race with Cruz in the state - polls show him with large leads in New Hampshire and South Carolina, the next states to hold nominating contests.""This is not something that fits into some nice little tight box. That is the beauty of Trump,"" O'Connell said. ""I think he could be the nominee. And I think he could actually win the presidency."" (Reporting by James Oliphant; Editing by Jonathan Oatis)"
2,POLITICS,Trump Debate Flap Throws Republican Party Into Deeper Chaos,"James Oliphant, Reuters",https://www.huffingtonpost.com/entry/trump-fox-news-debate-gop-chaos_us_56ab85b7e4b077d4fe8db8e0,Trump's candidacy threatens to scramble the Republican coalition built since the presidency of Ronald Reagan.,2016-01-29,"Republican Presidential candidates (L-R) Senator Rand Paul, New Jersey Gov. Chris Christie, retired neurosurgeon Ben Carson, Texas Senator Ted Cruz, Florida Senator Marco Rubio, former Florida Gov. Jeb Bush, and Ohio Gov. John Kasich arrive for the Republican Presidential debate sponsored by Fox News at the Iowa Events Center in Des Moines, Iowa on January 28, 2016.",https://img.huffingtonpost.com/asset/56ab86c21f00007f00216ea4.jpeg?ops=scalefit_720_noupscale,"DES MOINES, Jan 29 (Reuters) - As seven Republican presidential contenders squared off here for the final debate before voters begin winnowing the field, Donald Trump presided over his own, separate rally a mile away in front of a packed house of cheering supporters.It would be hard to find a more ideal metaphor for the forces tearing asunder the Republican Party.For months, Trump has chosen to operate in his own political universe, violating the conventional wisdom that governs presidential campaigns, thumbing his nose at conservative institutions ranging from the Fox News Channel to the National Review and advocating policies at odds withparty orthodoxy.And whether he wins the Iowa caucuses on Monday, Trump's candidacy promises to continue to upend the established political order as the presidential race intensifies ahead of the Nov. 8 election. Most national opinion polls have him with more than 30 percent of the Republican primary electorate - and those voters are showing little sign of switching to anyone else.""I think he will have made a permanent impact on the process,"" Newt Gingrich, the former speaker of the U.S. House of Representatives and a 2012 presidential candidate, told Reuters. Trump's campaign, he said, ""is one of those great disruptions that reshapes everything.""Tensions within the Republican Party between grassroots conservatives and the Washington establishment have been simmering since the Tea Party movement arose during President Barack Obama's first term, catapulting presidential contenders Senators Ted Cruz, Marco Rubio and Rand Paul to office, among others.NEW FISSURESBut Trump's insurgent candidacy has carved new fissures into the party, splitting conservative talk-radio hosts, religious leaders, and Washington pundits, with some sounding the alarm while others implore the party to respond to the anger toward Republican incumbents among voters who are fueling Trump's rise.The billionaire businessman has mounted his campaign on the notion of the fading American working-class, arguing they are under threat by both free trade deals favored by Republicans that encourage companies to send jobs overseas and by waves of illegal immigrants that work for low wages.""People are upset. People believe that promises made have not been promises kept. There comes a point when you've had it,"" said Iowa Republican Party Chairman Jeff Kaufmann, who has appeared at Trump rallies.Trump's candidacy threatens to scramble the Republican coalition built since the presidency of Ronald Reagan, one that worked to unite evangelical Christians and other social conservatives, economic conservatives, and military hawks behind a standard-bearer.The New York real estate tycoon and former reality TV star does not check many of those boxes. He shocked evangelicals here when he told them he has never asked God for forgiveness and spends little time on issues such as abortion and same-sex marriage. He has threatened to slap tariffs on imported goods to protect American jobs and raise taxes on hedge-fund managers. He has decried the wars in Iraq and Afghanistan and has sounded reluctant to deeply involve U.S. forces in the conflict in Syria.""He is attracting people of all kinds of backgrounds who have never thought of themselves asRepublicans,"" Gingrich said. ""I think it's very hard for traditional political observers to understand (what's happening).""Early during Thursday's debate in Des Moines, it seemed that the seven Republicans on the stage worked collectively to try and wean voters in Iowa and elsewhere off of Trump, with some dismissing him as an entertainer and others blasting his policy stances. His absence loomed over the entire event.And Trump demonstrated the sway he holds over the race when it was revealed that Fox News executives had made an 11th-hour pitch to woo him back onto the debate stage, handing him a rhetorical victory of sorts even as his rivals seemed to relish his absence.He also was joined at his event in Des Moines by two other Republican presidential candidates, Mike Huckabee and Rick Santorum - perhaps an acknowledgement that Trump's campaign may be a juggernaut now that may not be able to be stopped and that it might be time to climb aboard.A NEW FORMULA?Cruz alluded at the debate to the need to bring order to what has been a chaotic campaign.""Anyone who is able to win in the Republican Party has to be able to bring together the disparate elements of the Reagan coalition,"" he said. ""You've got to be able to bring together conservatives and evangelicals and libertarians, and stitch together a winning majority.""But Ford O'Connell, a Republican strategist who is not aligned with any candidate, said Cruz may be too beholden to the conventional ways to win the nomination.""What resonates (for voters) is not just Trump's bravado, it's that the everyday man thinks he's fighting for him,"" O'Connell said. ""Cruz assumes being a conservative means an ideological checklist. For a lot of others in the party, or for some who have left the party, it's more of a feeling.""Even as the seven candidates argued among themselves about who is best positioned to challenge Trump for the nomination, analytics provided by Google during the debate showed Trump eclipsed all of them in terms of number of searches.And if Trump loses next Monday in Iowa - he's locked in a close race with Cruz in the state - polls show him with large leads in New Hampshire and South Carolina, the next states to hold nominating contests.""This is not something that fits into some nice little tight box. That is the beauty of Trump,"" O'Connell said. ""I think he could be the nominee. And I think he could actually win the presidency."" (Reporting by James Oliphant; Editing by Jonathan Oatis)"
3,WOMEN,Here's What Single Women Are Looking For In A Presidential Candidate,Taylor Pittman,https://www.huffingtonpost.com/entry/heres-what-single-women-are-looking-for-in-a-presidential-candidate_us_56ab95e8e4b077d4fe8dc8b7,"Support for reproductive rights and equal pay, for a start.",2016-01-29,"Martin O'Malley, Hillary Clinton and Bernie Sanders appear during the NBC Democratic debate in South Carolina on Jan. 17. A new survey suggests single women find Clinton more likable than they find Sanders.",https://img.huffingtonpost.com/asset/56abb0a31f00007f00216f10.jpeg?cache=fNwh837x9k&ops=scalefit_720_noupscale,"A new survey reveals what’s motivating single women to head to the polls, and (surprise!) issues involving reproductive health and equal pay are at the top of the list.A Web survey featured in the March issue of Elle magazine breaks down which issues young women are most concerned about as they prepare to cast their votes. The survey of mostly single millennial women was conducted in partnership with the organization American Women.According to the survey, 80 percent of single women would support a candidate who fought for equal pay for equal work. A majority of the unmarried women surveyed (eight in 10 actually) were also more likely to support a candidate who supported their right to ""maintain full control over their reproductive health.""An article about the survey published on Elle.com offered a look at the candidates young unmarried women find most likable as well. As for which candidates gave them a ""warm, favorable feeling,"" 49 percent felt such feelings when they thought about Hillary Clinton. Bernie Sanders came in second with 37 percent.It's also important to note that 86 percent of all single women said the odds were low when it came to voting for a candidate who called women such names as ""fat pigs,"" ""slobs"" and ""disgusting animals"" (as Republican candidate Donald Trump has in the past). Among Republican women alone, 73 percent said it was unlikely that they would vote for a candidate who described women this way.So how many single women are planning to head to the polls with these views in mind? According to the survey, nine out of 10 reported that they are ""almost certain"" they'll be at the ballot box to cast their votes for president this year.See more of the findings included in the survey on Elle's site. Also on HuffPost:"
4,WOMEN,Here's What Single Women Are Looking For In A Presidential Candidate,Taylor Pittman,https://www.huffingtonpost.com/entry/heres-what-single-women-are-looking-for-in-a-presidential-candidate_us_56ab95e8e4b077d4fe8dc8b7,"Support for reproductive rights and equal pay, for a start.",2016-01-29,"In a new survey, 86 percent of all single women who participated said it was unlikely they'd vote for a candidate who called women such names as ""fat pigs"" and ""disgusting animals"" as Trump has done in the past.",https://img.huffingtonpost.com/asset/56abdb3f2a00006e0003195e.jpeg?ops=scalefit_720_noupscale,"A new survey reveals what’s motivating single women to head to the polls, and (surprise!) issues involving reproductive health and equal pay are at the top of the list.A Web survey featured in the March issue of Elle magazine breaks down which issues young women are most concerned about as they prepare to cast their votes. The survey of mostly single millennial women was conducted in partnership with the organization American Women.According to the survey, 80 percent of single women would support a candidate who fought for equal pay for equal work. A majority of the unmarried women surveyed (eight in 10 actually) were also more likely to support a candidate who supported their right to ""maintain full control over their reproductive health.""An article about the survey published on Elle.com offered a look at the candidates young unmarried women find most likable as well. As for which candidates gave them a ""warm, favorable feeling,"" 49 percent felt such feelings when they thought about Hillary Clinton. Bernie Sanders came in second with 37 percent.It's also important to note that 86 percent of all single women said the odds were low when it came to voting for a candidate who called women such names as ""fat pigs,"" ""slobs"" and ""disgusting animals"" (as Republican candidate Donald Trump has in the past). Among Republican women alone, 73 percent said it was unlikely that they would vote for a candidate who described women this way.So how many single women are planning to head to the polls with these views in mind? According to the survey, nine out of 10 reported that they are ""almost certain"" they'll be at the ballot box to cast their votes for president this year.See more of the findings included in the survey on Elle's site. Also on HuffPost:"
5,WOMEN,Kerry Washington: 'Abortion Is A Reality',Zeba Blay,https://www.huffingtonpost.com/entry/kerry-washington-abortion-is-a-reality_us_56ab7a2ee4b0010e80e9b16e,The 'Scandal' actress says it's important to see abortion on screen.,2016-01-29,Kerry Washington poses in the Getty Images Portrait Studio at the 2016 Winter Television Critics Association press tour.,https://img.huffingtonpost.com/asset/56ab86271f00005000216ea1.jpeg?ops=scalefit_720_noupscale,"Kerry Washington is unapologetic about the depiction of abortion on her hit show, ""Scandal.""On the show's winter finale in November, the actress's character Olivia Pope is briefly shown undergoing an abortion procedure. The scene, which was all of one-minute, drew some backlash, but many viewers commended producer Shonda Rhimes and the writers of the show for bravely showing something that's unfortunately still considered taboo by many. In an interview with Women's Wear Daily published on Wednesday, Washington stood by the finale, saying: “[Abortion is] a reality, and more often than not, it’s a really difficult choice to make. The same was true for Olivia.”For the actress, it's important that the reality of abortion be reflected on screen.“By not having those moments represented in media, we add to the idea that there’s something shameful to be talked about,"" Washington said. ""It’s always important that our storytelling reflects the real experiences of human beings, because it allows us to not feel as alone.”Studies have shown that depictions of abortion on TV are often misleading and don't fully reflect real-life statistics, with the few women who get abortions on TV being overwhelmingly white and rich. Thankfully, women like Washington and Rhimes are playing a small, but vital, part in shifting perceptions. Also on HuffPost:"
