,category,headline,authors,link,short descr,date,image_caption(s),image_link(s),article
0,SCIENCE,Here's What's Next For NASA's New Horizons Spacecraft,Eliza Sankar-Gorton,https://www.huffingtonpost.com/entry/here-is-whats-next-for-nasas-new-horizons-space-craft_us_55e5c17ce4b0aec9f35482bd,The craft could flyby another amazing object as soon as January 1st.,2015-09-02,"<p><span style=""font-family: Arial, Helvetica, sans-serif; font-size: 14px; line-height: 30.030029296875px; background-color: #eeeeee;"">An artist's impression of NASA's New Horizons spacecraft encountering a Pluto-like object in the distant Kuiper belt.</span></p>",https://img.huffingtonpost.com/asset/55e5c3441400002e002e4932.jpeg?ops=scalefit_720_noupscale,"Two months after the New Horizon's spacecraft nailed the Pluto flyby, it's setting its sights on something new: a tiny icy object that sits in the asteroid belt past the dwarf planet. NASA's goal is to gather as much data as possible about this Kuiper Belt object (KBO), called 2014 MU69, while using fuel sparingly.""This KBO costs less fuel to reach [than other candidate targets], leaving more fuel for the flyby, for ancillary science, and greater fuel reserves to protect against the unforeseen,"" Alan Stern, New Horizons principal investigator, said in a press release.Stern said that 2014 MU69, identified as a good candidate with the help of Hubble telescope, is an ideal flyby target because of what it can teach us about the origins of the Kuiper Belt. At 100th of the size of Pluto, just 30 miles across, this KBO is likely similar to the building blocks that are thought to have come together to create the dwarf planet and other larger objects in the Belt.“The detailed images and other data that New Horizons could obtain from a KBO flyby will revolutionize our understanding of the Kuiper Belt and KBOs,”said New Horizons team member John Spencer.  The craft will make four maneuvers toward the small icy object in late October and early November and could reach 2014 MU69 as early as January 1.Previously on HuffPost Science: New Horizons Won't Be The Only Spacecraft At Our Solar System's Edge"
1,WEIRD NEWS,People Pick Awful Tattoos By Chance And Still Go Through With It In 'Tattoo Roulette',Ron Dicker,https://www.huffingtonpost.com/entry/tattoo-roulette-elite-daily_us_55e73e1ae4b0b7a9633b511c,"Someone ""wins"" a Trump hair tramp stamp.",2015-09-02,Tattoo Roulette: People Play Carnival Game For Awful Tattoos [LABS] l Elite Daily,http://cdn.makeagif.com/media/9-02-2015/a5AQwp.gif,"Getting a tattoo can be a monumental undertaking. It is permanent, after all.So imagine having ink done without having any choice in the design or location.Elite Daily's ""Tattoo Roulette"" features people playing Plinko, a game from ""The Price is Right,"" to determine the cheesy tattoo they will bear -- and where.An Elite Daily spokeswoman assured The Huffington Post that this is all on the level. Of the 12 people selected to play the game from a casting call on Craigslist and Facebook, only five backed out, she said.Watch above to see who gets the Donald Trump hair tramp stamp ... forever. Also on HuffPost:"
2,SPORTS,The 25 NFL Breakout Stars Of 2015,Jordan Schultz,https://www.huffingtonpost.com/entry/nfl-breakout-stars-2015_us_55cb8924e4b0923c12befabc,These guys got next.,2015-09-02,"<p><span style=""color: #262626; font-family: arial, sans-serif; font-size: 13px; line-height: 16px;"">Second-year players Carlos Hyde, Teddy Bridgewater, Davante Adams and Allen Robinson should all be in line for breakout seasons.</span></p>",https://img.huffingtonpost.com/asset/default-missing-image.jpg?cache=KLbeMHqw50&ops=scalefit_720_noupscale,"Predicting the next crop of NFL stars isn't exactly like trying to finish The New York Times Sunday crossword puzzle -- but it's not much easier, either.My predictions in 2014 were evidence of that; whereas, in 2012 and 2013, I seemed to hit the jackpot.With pro football about to kick off, keep in mind that this year's list of breakout competitors excludes both rookies and defensive players.Oh, and for the fantasy players out there, this list will hopefully help you win your league(s)."
3,POLITICS,97 Percent Of DC's Prisoners In One Type Of Solitary Confinement Are Black,Dana Liebelson,https://www.huffingtonpost.com/entry/solitary-confinement-prison-report_us_55e71effe4b0aec9f3556937,"Corrections officials say prolonged isolation is a ""grave"" problem and they seek to limit or end it.",2015-09-02,"<p><span style=""font-family: Arial, Helvetica, sans-serif; font-size: 14px; line-height: 18.1818180084229px; background-color: #eeeeee;"">A guard house spans the walls of the Clinton Correctional Facility in Dannemora, N.Y., in </span>this June 15, 2015, file photo.</p>",https://img.huffingtonpost.com/asset/default-missing-image.jpg?cache=KLbeMHqw50&ops=scalefit_720_noupscale,"WASHINGTON ― At least 66,000 inmates in state and federal prisons were held in some form of solitary confinement last year, according to a report released Wednesday by corrections officials and researchers from Yale Law School. Not only are black men overrepresented in prison compared to their share of the population, they are also disproportionately placed in isolation once they’re behind bars. In Washington, D.C., 97 percent of men in administrative segregation ― one type of solitary confinement ― were black. Because the District lacks its own prison facility, inmates sentenced there are actually held in multiple federal prisons.The report, which is based on a national survey answered by 46 state and federal prison directors, comes at a time when the use of isolation on prisoners is under heavy scrutiny by lawmakers and judges. In June, Supreme Court Justice Anthony Kennedy denounced the practice, writing that “years on end of near-total isolation exact a terrible price.” This week, California agreed to move thousands of inmates out of solitary confinement as part of a landmark settlement.The stress of isolation inhibits neuron formation, scientists have found, which can cause permanent changes to the brain. General concerns about the practice prompted the Association of State Correctional Administrators, which includes heads of corrections agencies, to partake in the project with Yale. They acknowledge in their report that prolonged isolation is a “grave” problem and say that they seek to limit or end it, an unprecedented statement.“Having the people who run the prison systems as committed as they are to prison systems running differently, and the reduction or elimination of isolation, is important,” Judith Resnik, a professor at Yale Law School who co-authored the report, told The Huffington Post. She called the report a “statement of their commitment.”Because not every jurisdiction participated in the survey, the researchers estimated that the number of people in solitary confinement could be as high as 100,000. That number does not cover jails or juvenile, military and immigration detention facilities.In the fall of 2014, Arkansas reported placing the highest percentage of male inmates in administrative segregation, which is defined in the report as putting inmates in cells ― either alone or with cellmates ― and holding them there for most hours of the day for 30 days or more. Administrative segregation is often imposed when a prisoner is seen as a potential risk to other inmates or prison staff. Arkansas’ figure does not include other forms of isolation, like that used for punishment or protection. On average, black prisoners made up 47 percent of the administrative segregation population and 39 percent of the total male prison population in 21 jurisdictions that provided demographic data. (Not every respondent answered every question in the report. Twenty-two jurisdictions provided demographic data; of those, 21 had a smaller percentage of white male prisoners in administrative segregation than in the general prison population.)ADX Florence, a supermax prison in Colorado, held more than half of its prisoners in solitary confinement for over three years, according to the report. An inmate at that facility told The New York Times that prisoners on his cellblock ""screamed and banged on their doors for hours.""The researchers also sought to shed light on the duration and conditions of solitary confinement. ""Most participants reported that inmates in solitary spend 23 hours a day in their cells on weekdays; about half of all jurisdictions reported that prisoners spent 23 hours a day in a cell on weekends,"" the report said.Conditions varied widely by location. Virginia, for example, prohibited inmates in administrative segregation from having letters, paper or pens and pencils in their cells. New Hampshire banned magazines. Other states, including Montana and North Dakota, prohibited some segregated inmates from getting visits or social phone calls. Seven jurisdictions provided free televisions. North Dakota and Wyoming allowed video game consoles, Arkansas, MP4 players. But jurisdictions may limit access to activities and personal materials as punishment, and what's reported as policy does not always happen in practice.The researchers are planning to continue the project with 2015 data, focusing on other categories of isolation. ""Hopefully this report is part of several markers of a transformation in the assumptions of what is normal inside prisons,"" Resnik said. ""There should be nothing typical about the kinds of conditions we found."" Clarification:  This post was updated to explain that Washington, D.C., lacks its own prison system and inmates sentenced in the District are held in multiple locations nationwide."
4,MEDIA,CNN Nabs Politico Media Reporter Dylan Byers,Gabriel Arana,https://www.huffingtonpost.com/entry/cnn-nabs-politico-media-reporter-dylan-byers_us_55e6f751e4b0aec9f3552be1,"CNN media correspondent Brian Stelter described Byers as a ""scoop machine.""",2015-09-02,"<p>Dylan Byers is joining <a href=""https://www.huffpost.com/news/topic/cnn"">CNN</a>.</p>",https://img.huffingtonpost.com/asset/55e6f94b1400002e002e4af8.png?ops=crop_113_36_1239_707%2Cscalefit_720_noupscale,"Politico media reporter Dylan Byers announced on Twitter Wednesday that he is joining CNN as senior reporter for media and politics. Byers, who is known for frequently breaking news, will start his new role at CNN on Sept. 14.“Byers is a scoop machine,” CNN Senior Media Correspondent Brian Stelter wrote in a post announcing the hire. “When I've been offline for more than a few hours, the way I see what I've missed is by checking his Twitter feed.”CNN Money editor Lex Haris and CNN Politics editor Rachel Smolkin described Byers as a “fearless reporter” in an internal CNN memo.""Dylan comes to us from Politico where he distinguished himself as a fearless reporter on all things media, willing to take on political figures and media organizations,” they wrote. “He's fast, provocative -- and makes news that people want to talk about.""Stelter added that he looks forward to no longer competing with Byers:UPDATE, 11:47 p.m.: Politico editors Susan Glasser and Tom McGeveran sent the following note to staffers wishing Byers well in his new role and thanking him for his work at Politico:You may have already seen the news but we wanted to say a few words about Dylan Byers, who will be leaving POLITICO to work at CNN later this month. Over the course of his nearly four years here and even with his move a year ago to the West Coast, Dylan has been a must-read at POLITICO, helping to establish what we think is an essential part of POLITICO’s report on politics and power: our reporting on the media. What started as a one-man blog under Dylan and before him Michael Calderone has now evolved into a full-on media desk, combining forces with the old Capital New York six-person media team. The soft launch this summer of POLITICO Media is only the beginning of this effort, about which you'll here a lot more as we expand our reporting on the media industry and its part in the great drama of American politics and power. In the meantime, we wanted to take a moment to wish Dylan well on his new adventure and thank him for his pioneering work on the beat, before we roll up our sleeves and get to work making it the authoritative report on the media we now know it can be. Michael Calderone contributed reporting."
5,POLITICS,"'Provocative' Police Tactics Inflamed Ferguson Protests, Experts Find",Ryan J. Reilly,https://www.huffingtonpost.com/entry/ferguson-protests-police-tactics-report_us_55e622a3e4b0aec9f35506ad,"An in-depth study concludes that ""inappropriate"" law enforcement responses escalated tension in St. Louis County.",2015-09-02,"<p>A member of the St. Louis County Police Department points his weapon in the direction of a group of protesters in Ferguson, Missouri, on Aug. 13, 2014.</p>",https://img.huffingtonpost.com/asset/default-missing-image.jpg?cache=KLbeMHqw50&ops=scalefit_720_noupscale,"WASHINGTON -- Law enforcement officials responding to demonstrations and unrest in Ferguson, Missouri, following the death of Michael Brown last August used a variety of inappropriate tactics and strategies that often exacerbated tensions, according to a report by policing experts that the Justice Department is releasing this week.The assessment finds that deploying dogs for crowd control was ""provocative,"" positioning snipers on top of armored vehicles during daytime protests ""inflamed tensions,"" tear gas was ""deployed inappropriately,"" and law enforcement used unconstitutional policing strategies that suppressed First Amendment rights. Such strategies ""had the unintended consequence of escalating rather than diminishing tension,"" the report states.The police response was also hampered by inconsistent leadership, a failure to understand the community, a reactive strategy for handling protests, poor communication, and complications caused by St. Louis County's extraordinarily fractured network of small law enforcement agencies, which a nationally recognized police research organization has criticized as ""dysfunctional and unsustainable.""The ""stress and pressure"" that officers were under at the time -- working long hours as taunts, spit, rocks and bottles of urine were hurled in their direction -- may have resulted in their making ""bad judgments"" and engaging in uncharacteristic behavior, according to the report. Officers on the front lines ""faced unprecedented levels of abuse,"" and minority officers in particular were targeted with ""extreme verbal abuse.""Additionally, law enforcement's response to the unrest ""seemed like a rudderless ship"" to many officers because ""direction for officers on arrests and engaging protesters seemed to change regularly,"" according to the report. Interviews with officers ""consistently, and clearly, indicated there was confusion"" about arrest procedures and guidelines, a situation that St. Louis County Police Chief Jon Belmar acknowledged in federal court last fall.The ""after-action"" assessment conducted at the request of the Justice Department's Office of Community Oriented Policing Services (COPS) examines the police response to protests in Ferguson over a 17-day period in 2014: from Aug. 9, when then-Ferguson Police Office Darren Wilson killed Brown, through Aug. 25, when the 18-year-old was buried. The study began last September. The assessment team -- led by former Missouri police officer and criminal law professor David L. Carter -- conducted over 160 confidential interviews with law enforcement officials, protesters, clergy, business owners, community members and other stakeholders. The report states that law enforcement agencies who responded to the situation in Ferguson ""encountered an event unprecedented in recent times"" that ""became a defining moment in policing history."" The large number of demonstrators and the widespread use of social media made the event particularly challenging. Ferguson should serve as ""a vivid reminder that law enforcement agencies must continually analyze their policing practices in relation to the communities they serve,"" the report says. While the report's key findings leaked out in late June, federal officials hope that this full, detailed examination will be helpful for other law enforcement agencies when dealing with mass demonstrations.COPS Director Ron Davis -- who writes that the Ferguson demonstrations became ""part of a national movement to reform our criminal justice system and represent a new civil rights movement"" -- suggests that the report may aid law enforcement agencies in protecting the rights of demonstrators and maintaining public safety.""The failure to learn from our experiences -- both our successes and setbacks -- increases the likelihood of repeating mistakes and contributes to loss of public trust,"" Davis writes in introducing the report. ""Law enforcement must be prepared to respond to this new movement and to do so in a manner different from that of the civil rights movement of the 1950s and 1960s, when law enforcement was often used to disrupt demonstrations, oppress free speech, and deny constitutional rights.""The aggressive tactics used by law enforcement in Ferguson came under heavy criticism in the press and on social media. The assessment team -- which included a watch commander in the Dallas Police Department who graduated from West Point and served in the first Gulf War -- largely agreed with the widespread critique of the militarized police presence. By positioning a sniper on top of an armored tactical vehicle, ""law enforcement helped to further the sentiment that they were reacting in a militaristic manner,"" the report says. Initial police responses ""appeared to galvanize a negative perspective and aggravate community concerns about police and the justice system in general."" Community members, the report notes, ""became angered at what they perceived to be a heavy-handed response by the police rather than the police being there to 'serve and protect.'""One community member said that ""riot gear, tear gas, five-second rule, tanks were all acts of aggression"" that exacerbated the crowd's response. ""Back to Selma all over again,"" the person said.""It was clear the armored vehicles stirred the emotions of demonstrators -- they expressed fear, anger, and intimidation by the vehicles' mere presence,"" the report says. ""Community members stated that the vehicles were 'acts of aggression' by the police.""The pointing of sniper rifles at crowds came under particular scrutiny. The report calls that ""a particularly alarming behavior, especially if the rifle is pointed at the viewer."" Law enforcement officials also did not seem to appreciate the ""profound effect"" that using dogs had, the report states.Police were criticized for taking an ""all or nothing"" approach to their tactical response during the protests. The report notes that tactical equipment could be used in a ""relatively limited manner"" and ramped up if necessary, but ""when an initial response is at a high level, options for gradual and measured escalation are more difficult.""Law enforcement ""must be reasonable and flexible with their choice of tactics ... consider the historical context of the community served, and focus not only on what may be authorized pursuant to policy but also on what is right,"" the report states. ""The assessment team concluded that the use of these military-like tactics, particularly the officers deployed with rifles, was not appropriate for the circumstances.""""While I understand that, we have to keep our people safe. Sometimes policing is not pretty,"" one police commander told investigators.As the report notes, police were at a disadvantage from the beginning of the protests, as the ""relationship between law enforcement and the communities of color in St. Louis County were extremely strained."" Additionally, as there had been no riots there after Dr. Martin Luther King Jr. was killed in 1968 or after the Rodney King acquittals in 1992, the community ""did not have any prior history with a similar critical incident on which to base the turn of events that resulted after Mr. Brown's death.""The fractured nature of law enforcement in St. Louis County was also problematic. Officers from over 50 different departments reported to the command post from Aug. 9 though Aug. 25. Some of those municipalities had officers who were not even certified, and the report says some of those agencies ""may not have a focus on officers engaged in non-traffic law enforcement efforts"" and may not have the skills to respond to such unrest.While the report notes the successful strategy implemented under Missouri Highway Patrol Capt. Ron Johnson, it says that because of the time he spent on community engagement and doing media interviews, he was ""less engaged in day-to-day, hour-to-hour incident command responsibilities and instead became the public face for the police response."" The report notes that St. Louis County Police Department officers thought putting the highway patrol in charge ""showed disrespect to them and their capabilities."" St. Louis County Police Chief Belmar and then-Ferguson Police Chief Thomas Jackson were not consulted about the change in command, according to the report.Johnson's decision to walk with the protesters along West Florissant Avenue ""seemed to have a positive impact on community relations,"" according to the report, but his ""perceived support for the demonstrators lowered morale among officers, including Missouri State Highway Patrol troopers.""Officers told the assessment team that ""inconsistent orders and a constant barrage of criticism from the public and the media"" left them with a sense of abandonment and a feeling that ""public image trumped officer safety."" Changes in policies were a constant source of tension.""There was no plan in place for arresting people and no standard way to document arrests,"" one officer said. Another officer stated that fellow officers were ""unclear who they could arrest."" Yet another officer said that their standing orders ""changed every day.""Investigators said problems came up because officers were operating for long periods of time in a stressful environment. The report points to the case of Ray Alberts, a former officer in nearby St. Ann who resigned after he was captured on video threatening Ferguson protesters; yelling, ""I will fucking kill you""; and pointing a semi-automatic assault rifle at a videographer.""Even a casual observer of the video can see that the officer looked flushed, hot, and frustrated,"" the report states. ""The involved officer was excused from Ferguson duty once the incident became known to command, and he later expressed remorse for his actions. His behavior was said to be uncharacteristic of his many years' experience as an officer, yet he not only experienced the stigma of becoming an Internet 'item' but also ultimately resigned from his position. From the videographer's perspective, the fact that the officer was under stress does not excuse the verbal abuse the videographer received or the threat of being shot and having a rifle pointed at him."" Full disclosure: The Huffington Post's Ryan J. Reilly, who wrote this story, and The Washington Post's Wesley Lowery were arrested by officers with the St. Louis County Police Department on Aug. 13, 2014. Nearly a full year later, Reilly and Lowery were charged in St. Louis County Municipal Court with ""trespassing"" in the McDonald's where they were working and ""interfering"" with police officers who forced the restaurant to close as a peaceful, daytime protest took place down the street. Reilly and Lowery are fighting the charges."
