,category,headline,authors,link,short descr,date,image_caption(s),image_link(s),article
0,WEDDINGS,Marriage In India: Grooms Required To Prove They Have A Toilet Before Marrying,,https://www.huffingtonpost.com/entry/marriage-in-india_us_5b9d320ae4b03a1dcc8564d7,"The initiative is part of the state's Mukhyamantri Kanyadan Yojna (MKY), a program launched in 2006 to help poor women marry",2013-05-24,QUESTION: Which country requires a newspaper notice of intent to marry in order to obtain a marriage license?,https://img.huffingtonpost.com/asset/5b9b67ab26000033007f1aa0.jpeg?ops=scalefit_960_noupscale,"To participate in a mass marriage ceremony in the Indian state of Madhya Pradesh on Monday, there was just one requirement for grooms-to-be: prove they owned a toilet.In an effort to improve sanitation (India's 2011 census revealed that less than half of Indian homes had a toilet), the local government required any groom who wished to participate in Monday's mass marriage ceremony to send a photo of themselves with their toilet, or prove their intent to install one within 30 days of their wedding, the Times of India reported Tuesday. The initiative is part of the state's Mukhyamantri Kanyadan Yojna (MKY), a program launched in 2006 to help poor women marry. Under the MKY, the state pays for couples to participate in mass marriage ceremonies and awards them housewarming gifts worth 15,000 rupees ($270), according to Slate.The toilet requirement, which requires groom to prove that their homes contain a toilet in order to receive the MKY benefits, was added in 2011. More than 1,700 couples have married under the MKY this year, according to The Wall Street Journal. One hundred eighty-four couples participated in Monday's ceremony. In addition to hygienic concerns, MKY attempts to address the problem of women and girls being raped when they go out to relieve themselves in the open (especially in the early morning or late evening). The BBC reported earlier this month that 400 women would have ""escaped"" rape last year if they had a toilet in their home.Test your knowledge of marriage around the world with the quiz below.Keep in touch! Check out HuffPost Weddings on Facebook, Twitter and Pinterest."
1,WELLNESS,WHO Is Helping Saudi Arabia Investigate SARS-Like Virus Before Haj,"Reuters, Reuters",https://www.huffingtonpost.com/entry/saudi-arabia-sars-like-virus-who-haj_us_5b9d31d2e4b03a1dcc856328,"Asked about the risk factors for contracting the disease, Memish said: ""It seems like being a male is a risk factor, being",2013-05-24,"The Coronaviruses Owe Their Name To The The Crown Like Projections, Visible Under Microscope, That Encircle The Capsid. The Coronaviruses Are Responsible For Respiratory Ailments And Gastro Enteritis. The Virus Responsible For Sars Belongs To This Family. (Photo By BSIP/UIG Via Getty Images)",https://img.huffingtonpost.com/asset/5b9d31d22500003600365c5b.jpeg?ops=scalefit_720_noupscale,"By Stephanie NebehayGENEVA, May 24 (Reuters) - The World Health Organisation (WHO) said on Friday that it would help Saudi Arabia dig deeper into deadly outbreaks of a new SARS-like virus to draw up advice ahead of the annual haj pilgrimage, which attracts millions of Muslims.The U.N. agency, which is not currently recommending any restrictions on travel to the kingdom or screening of passengers at airports or entry points, will sent a second team of experts in the coming weeks, WHO director-general Margaret Chan said.The virus, which can cause coughing, fever and pneumonia, emerged in Saudi Arabia last year and has been found in 33 people there, killing 17. They are among 44 cases and 22 deaths worldwide, according to the WHO, which has called it the Middle East Respiratory Syndrome Coronavirus (MERS-CoV).""Without that proper risk assessment, we cannot have clarity on the incubation period, on the signs and symptoms of the disease, on the proper clinical management and then, last but not least, on travel advice,"" Chan told the WHO's annual ministerial meeting in Geneva.The WHO, which sent a first team to Saudi Arabia this month, will provide a fresh risk assessment ahead of this year's haj, which takes place in October.""We need to get the facts clear and get the appropriate advice to all your countries where your pilgrims want to go to Mecca. It is something quite urgent,"" Chan said.Millions flock to the Muslim holy cities of Mecca and Medina for the haj, although pilgrims come and go all year round. CENTRED IN MIDDLE EASTThe virus has also been found in Jordan, Qatar, Tunisia, United Arab Emirates, while isolated cases have been exported to France, Britain and Germany by visitors.Saudi Arabia said on Friday that tighter controls had helped to stamped out a MERS-CoV outbreak in a hospital in the eastern region of al Ahsa, which infected 22 people, killing 10.""Certain infection control measures were applied because we thought there was some transmission happening in the areas where the patients were clustered. These included the ICU (intensive care unit) and the haemo-dialysis unit,"" Saudi Arabia's Deputy Health Minister Ziad Memish told the Geneva talks.The measures included separating patients or increasing the distance between them, and reduction of direct contact.Many questions remain about how the new virus spreads and what the vector may be, ranging possibly from animals to surface contamination. Saudi and WHO officials say there has been some contagion between people, but only where contact has been close and prolonged.Saudi authorities have collected a large number of samples from bats, camels, sheep and cats for testing, Memish said.Asked about the risk factors for contracting the disease, Memish said: ""It seems like being a male is a risk factor, being old is a risk factor; having underlying diseases including diabetes, heart disease and renal failure seem to be putting people at risk."" (Reporting by Stephanie Nebehay; Editing by Kevin Liffey)"
2,TRAVEL,The Hipster's Summer Guide: Bowie's Glamorama at the V&A and Where to Talk It Through,"Susan Michals, Contributor
L.A. Based Art/Culture/Lifestyle Writer",https://www.huffingtonpost.com/entry/the-hipsters-summer-guide_us_5b9d2dc0e4b03a1dcc853d2d,Plan ahead -- not just for this exhibition but for London travel in general. Below are a smattering of suggestions for visiting London -- and witnessing the glitteringly glam career of Mr. Bowie.,2013-05-24,2013-05-22-Original_photography_for_the_Earthling_album_cover_1997__Frank_W_Ockenfels_3_jpg_610x610_q85.jpg,https://images.huffingtonpost.com/2013-05-22-Original_photography_for_the_Earthling_album_cover_1997__Frank_W_Ockenfels_3_jpg_610x610_q85.jpg," (Original photography for the Earthling album cover, 1997.  Union Jack coat designed by Alexander McQueen in collaboration with David Bowie. Photograph by Frank W Ockenfels 3. © Courtesy Victoria and Albert Museum, London)There never was, and never will be someone quite like David Bowie. Not only is he one of this world's most innovative and original musicians, he is perhaps one of our most important and seminal assassins of the banal. (Promotional shoot for The Kon-rads, 1963. Photograph by Roy Ainsworth. Courtesy Victoria and Albert Museum, London) Through August 2013, fans (and even those who are just curious about The Man Who Fell To Earth's persona) can experience a full on Bowie immersion in the artist's hometown of London at the Victoria and Albert Museum at the aptly named exhibition, ""David Bowie Is..."" All one really needs is a good 48 hours in London, an open mind and a place to stay overnight (as you'll want to visit the exhibition the day after to really drink it in).(Getting a Glam groove on. Image courtesy Victoria and Albert Museum, London)More than 300 objects from the Bowie Archives have been brought together for the very first time including handwritten lyrics, original costumes, fashion, photography, film, music videos, set designs, Bowie's own instruments and album artwork. (One of David Bowie's most PANTastic outfits. Striped bodysuit for Aladdin Sane tour. Design by Kansai Yamamoto. Image courtesy of Victoria and Albert Museum, London)The exhibition explores the broad range of Bowie's collaborations with artists and designers in the fields of fashion, sound, graphics, theatre, art and film. On display you'll find Ziggy Stardust bodysuits (1972) designed by Freddie Burretti, photography by Brian Duffy; album sleeve artwork by Guy Peellaert and Edward Bell; visual excerpts from films and live performances including The Man Who Fell to Earth, music videos such as Boys Keep Swinging and set designs created for the Diamond Dogs tour (1974). Alongside these will be more personal items such as never-before-seen storyboards, handwritten set lists and lyrics as well as some of Bowie's own sketches, musical scores and diary entries, revealing the evolution of his creative ideas.David Bowie Is, Victoria and Albert Museum, Cromwell Rd, London SW7 2RL, United Kingdom Tube stop: South Kensington (on the Piccadilly, Circle and District Line). To note: Plan ahead -- not just for this exhibition, (which is sold out online, but you can still get tix the day of) but for London travel in general. The city is experiencing an unprecedented number of bookings, and what was once easy to book last minute is not the case this summer. Below are a smattering of suggestions for visiting London -- and witnessing the glitteringly glam career of Mr. Bowie.GETTING THERE.Despite the recent brouhaha about uniforms (those were for the trains though, not the planes) Richard Branson's Virgin Atlantic is still the coolest way to jet cross the pond. Further, his Upper Class Clubhouses out of Heathrow (as well as Gatwick and JFK) remain the best lounges bar none. The lounges have everything you need for a start to a happy holiday, (or a hardcore business trip) including spa treatments, (mani/pedi's, blowouts, and massages) food aplenty and of course, the requisite champagne. It's the perfect way to spend a couple of hours before setting off. UPON ARRIVAL: WHERE TO STAY. (The many faces of The Hoxton Hotel. All images courtesy of The Hoxton, London.)HIPSTER CENTRAL/EAST LONDON: While it's not Brixton (where Bowie was born), London's Shoreditch neighborhood is currently the epicenter of hip and cool, and really the best place to experience it all (and perhaps, sleep it off) is The Hoxton, an uber slick, urban playground with budget prices and Frette Linens in its 280 rooms. The Hox is undoubtedly the epicenter of urban cool for the East End, complete with groovy ping pong tables, DJ's constantly spinning (not that you'd hear it from your room, fyi) and their bespoke Gin Garden Bombay Sapphire Botanical Experience -- learn how to make your own gin specialty, or, have the opportunity to blend their own unique scent and will take away their own 10ml bottle of tailor made perfume at the end of the session for only £35.If you find the Hox unavailable for your dates and you're still keen to stay East, try The Boundary. With only 12 rooms, (each with a different design that has been inspired by legendary designers or design movements that the owners admire, like Eames, Le Corbusier and Charlotte Perriand) it'll be straight out of Dwell Mag, but it'll cost you a pretty penny compared to the one size/price fits all rooms of The Hoxton.   Tube Stop: Old Street Station (Northern Line, EXIT 3).(Brown's Hotel at dusk. Image courtesy of Brown's Hotel, London) MAYFAIR MAINSTAY/WEST LONDON: In 1837, James Brown, Lord Byron's butler and his wife Sarah, who was Lady Byron's maid, acquired 23 Dover Street and by mid 1838, had expanded into numbers 21, 22 and 24, to create Brown's Hotel. Recognized as the oldest hotel in London, the five star establishment is celebrating it's 175th anniversary with a series of specials throughout 2013, including getting a second night in a one of their suites for the 1837 price: £18.37 (approximately $28.03).  (Room with a view. Image courtesy Brown's Hotel, London)Another facet of the traditional yet still uber hip hotel this summer incorporates classic cars and Highclere Castle, aka, ""Downton Abbey."" From July through September, guests can experience 'The Highclere Castle Vintage British Summer Day' and choose the Rolls Royce that recently appeared in the series, or the Queen Mothers' favorite car 'The Ivy Baroness'. Upon arriving at Highclere, guests will be able to explore the historic castle, home to Carnarvon family since 1679, and stroll around its beautifully landscaped gardens before taking in the Egyptian Exhibition highlighting the achievements of the 5th Earl of Carnarvon who famously discovered the Tomb of the Egyptian Boy Pharaoh, Tutankhamen, in 1922.(Your respective rides to check out Lord Grantham's pad. Images courtesy Brown's Hotel, London) Tube Stop: Green Park."
3,TRAVEL,The Hipster's Summer Guide: Bowie's Glamorama at the V&A and Where to Talk It Through,"Susan Michals, Contributor
L.A. Based Art/Culture/Lifestyle Writer",https://www.huffingtonpost.com/entry/the-hipsters-summer-guide_us_5b9d2dc0e4b03a1dcc853d2d,Plan ahead -- not just for this exhibition but for London travel in general. Below are a smattering of suggestions for visiting London -- and witnessing the glitteringly glam career of Mr. Bowie.,2013-05-24,2013-05-22-Promotional_shoot_for_The_Konrads_1963._Photograph_by_Roy_Ainsworth._Courtesy_of_The_David_Bowie_Archive_2012._Image__VA_Images_jpg_610x610_q85.jpg,https://images.huffingtonpost.com/2013-05-22-Promotional_shoot_for_The_Konrads_1963._Photograph_by_Roy_Ainsworth._Courtesy_of_The_David_Bowie_Archive_2012._Image__VA_Images_jpg_610x610_q85.jpg," (Original photography for the Earthling album cover, 1997.  Union Jack coat designed by Alexander McQueen in collaboration with David Bowie. Photograph by Frank W Ockenfels 3. © Courtesy Victoria and Albert Museum, London)There never was, and never will be someone quite like David Bowie. Not only is he one of this world's most innovative and original musicians, he is perhaps one of our most important and seminal assassins of the banal. (Promotional shoot for The Kon-rads, 1963. Photograph by Roy Ainsworth. Courtesy Victoria and Albert Museum, London) Through August 2013, fans (and even those who are just curious about The Man Who Fell To Earth's persona) can experience a full on Bowie immersion in the artist's hometown of London at the Victoria and Albert Museum at the aptly named exhibition, ""David Bowie Is..."" All one really needs is a good 48 hours in London, an open mind and a place to stay overnight (as you'll want to visit the exhibition the day after to really drink it in).(Getting a Glam groove on. Image courtesy Victoria and Albert Museum, London)More than 300 objects from the Bowie Archives have been brought together for the very first time including handwritten lyrics, original costumes, fashion, photography, film, music videos, set designs, Bowie's own instruments and album artwork. (One of David Bowie's most PANTastic outfits. Striped bodysuit for Aladdin Sane tour. Design by Kansai Yamamoto. Image courtesy of Victoria and Albert Museum, London)The exhibition explores the broad range of Bowie's collaborations with artists and designers in the fields of fashion, sound, graphics, theatre, art and film. On display you'll find Ziggy Stardust bodysuits (1972) designed by Freddie Burretti, photography by Brian Duffy; album sleeve artwork by Guy Peellaert and Edward Bell; visual excerpts from films and live performances including The Man Who Fell to Earth, music videos such as Boys Keep Swinging and set designs created for the Diamond Dogs tour (1974). Alongside these will be more personal items such as never-before-seen storyboards, handwritten set lists and lyrics as well as some of Bowie's own sketches, musical scores and diary entries, revealing the evolution of his creative ideas.David Bowie Is, Victoria and Albert Museum, Cromwell Rd, London SW7 2RL, United Kingdom Tube stop: South Kensington (on the Piccadilly, Circle and District Line). To note: Plan ahead -- not just for this exhibition, (which is sold out online, but you can still get tix the day of) but for London travel in general. The city is experiencing an unprecedented number of bookings, and what was once easy to book last minute is not the case this summer. Below are a smattering of suggestions for visiting London -- and witnessing the glitteringly glam career of Mr. Bowie.GETTING THERE.Despite the recent brouhaha about uniforms (those were for the trains though, not the planes) Richard Branson's Virgin Atlantic is still the coolest way to jet cross the pond. Further, his Upper Class Clubhouses out of Heathrow (as well as Gatwick and JFK) remain the best lounges bar none. The lounges have everything you need for a start to a happy holiday, (or a hardcore business trip) including spa treatments, (mani/pedi's, blowouts, and massages) food aplenty and of course, the requisite champagne. It's the perfect way to spend a couple of hours before setting off. UPON ARRIVAL: WHERE TO STAY. (The many faces of The Hoxton Hotel. All images courtesy of The Hoxton, London.)HIPSTER CENTRAL/EAST LONDON: While it's not Brixton (where Bowie was born), London's Shoreditch neighborhood is currently the epicenter of hip and cool, and really the best place to experience it all (and perhaps, sleep it off) is The Hoxton, an uber slick, urban playground with budget prices and Frette Linens in its 280 rooms. The Hox is undoubtedly the epicenter of urban cool for the East End, complete with groovy ping pong tables, DJ's constantly spinning (not that you'd hear it from your room, fyi) and their bespoke Gin Garden Bombay Sapphire Botanical Experience -- learn how to make your own gin specialty, or, have the opportunity to blend their own unique scent and will take away their own 10ml bottle of tailor made perfume at the end of the session for only £35.If you find the Hox unavailable for your dates and you're still keen to stay East, try The Boundary. With only 12 rooms, (each with a different design that has been inspired by legendary designers or design movements that the owners admire, like Eames, Le Corbusier and Charlotte Perriand) it'll be straight out of Dwell Mag, but it'll cost you a pretty penny compared to the one size/price fits all rooms of The Hoxton.   Tube Stop: Old Street Station (Northern Line, EXIT 3).(Brown's Hotel at dusk. Image courtesy of Brown's Hotel, London) MAYFAIR MAINSTAY/WEST LONDON: In 1837, James Brown, Lord Byron's butler and his wife Sarah, who was Lady Byron's maid, acquired 23 Dover Street and by mid 1838, had expanded into numbers 21, 22 and 24, to create Brown's Hotel. Recognized as the oldest hotel in London, the five star establishment is celebrating it's 175th anniversary with a series of specials throughout 2013, including getting a second night in a one of their suites for the 1837 price: £18.37 (approximately $28.03).  (Room with a view. Image courtesy Brown's Hotel, London)Another facet of the traditional yet still uber hip hotel this summer incorporates classic cars and Highclere Castle, aka, ""Downton Abbey."" From July through September, guests can experience 'The Highclere Castle Vintage British Summer Day' and choose the Rolls Royce that recently appeared in the series, or the Queen Mothers' favorite car 'The Ivy Baroness'. Upon arriving at Highclere, guests will be able to explore the historic castle, home to Carnarvon family since 1679, and stroll around its beautifully landscaped gardens before taking in the Egyptian Exhibition highlighting the achievements of the 5th Earl of Carnarvon who famously discovered the Tomb of the Egyptian Boy Pharaoh, Tutankhamen, in 1922.(Your respective rides to check out Lord Grantham's pad. Images courtesy Brown's Hotel, London) Tube Stop: Green Park."
4,HOME & LIVING,10 Quick and Easy Home Décor Ideas to Update Your Space,"Lamps Plus , Contributor
Lighting & Home Furnishings",https://www.huffingtonpost.com/entry/home-decor-updates_us_5b9d2e71e4b03a1dcc854660,"Summer is just around the corner, and now is the perfect time to update your space for the season! Here are 10 quick and easy home décor updates that will enliven your home for the warm months ahead.",2013-05-24,Easy Home Decor Ideas to Update Your Space - Use a Garden Stool as an Accent Table,https://images.huffingtonpost.com/2013-05-21-useagardenstoolasanaccenttable.jpg,"Summer is just around the corner, and now is the perfect time to update your space for the season! Here are 10 quick and easy home décor updates that will enliven your home for the warm months ahead.1. Use a Garden Stool as an Accent Table. Not just for the outdoors anymore, decorative ceramic accents come in an impressive array of colors and finishes and are the perfect pop of color and texture in a living room. 2. Add Brightly Colored Pillows to Your Bed. Nothing livens up a space like colorful accent pillows. Swap them out seasonally to completely change the look of your bedroom without breaking the bank.3. Paint an Accent Wall. When done right, an accent wall can help the rest of a room's décor really sing. If you're not sure what color to choose, start by looking around your room -- there will likely be an accent color in a pillow, a piece of art, or an accessory that you can use as inspiration. The key is selecting an accent wall color that complements your décor without drawing too much attention. 4. Swap Your Bedside Lampshades. If your lamp base has good ""bones,"" but the shade has seen better days, a replacement lampshade can revive its sluggish appearance. Not sure how to find out the lampshade size you need? Here's a handy guide on how to update your décor with a new lamp shade.5. Put an Antique in an Unexpected Place. No matter your décor style, an antique is the perfect finishing touch in a room by blending harmoniously with traditional décor, or standing out among contemporary styling. Pick a piece with sentimental value, or choose a unique home accent at a flea market or estate sale.6. Hang a Gallery Wall. Small photographs and artworks can have a major design impact when hung together as a group. Here's an easy technique for hanging wall art that will make installing your gallery wall a breeze.7. Paint a Flea Market Find in High-Gloss Paint. Nothing revives a tired piece of furniture and gives it a new life like lacquer! Be sure to properly sand and prime the piece before painting to ensure a uniform, glossy finish. 8. Swap Out Builder's Basic Light Fixtures. If you live in a new home, chances are that many of your ceiling fixtures are inexpensive builder's basics. Close-to-ceiling lights (typically found in hallways, kitchens, and bathrooms) are easily exchanged with more stylish options. You can do this even if you're a renter -- just keep the original fixtures and make sure to re-install them when you move.9. Hang a Mirror Opposite a Window. The reflection will create the illusion of having more windows and natural light. 10. Dress up a Hallway or Entryway with a Runner. Area rugs are often viewed as a design necessity for living rooms and dining rooms - but why not in the hallway and entryway too? A beautiful runner can bring color, pattern, and softness into an otherwise ""hard"" space.Whether you incorporate just one or all 10, these easy home décor ideas can provide an instant update to your space this summer."
