,category,headline,authors,link,short descr,date,image_caption(s),image_link(s),article
0,WELLNESS,"Pierce Brosnan Talks His Love For Painting, Paddleboarding And Peace In ORIGIN Magazine (PHOTOS)",,https://www.huffingtonpost.com/entry/pierce-brosnan-interview-origin-magazine_us_5b9d831be4b03a1dcc88f3d4,"PB: I paint in oils, I paint in acrylics. I paint figurative and landscape portraits. It’s all in my own kind of style. I’m",2013-09-15,"TORONTO, ON - SEPTEMBER 12: Actor Pierce Brosnan arrives at the 'Love Punch' premiere during the 2013 Toronto International Film Festival at Roy Thomson Hall on September 12, 2013 in Toronto, Canada. (Photo by Sarjoun Faour Photography/WireImage)",https://img.huffingtonpost.com/asset/5b9d831b2100003000c58dc1.jpeg?ops=scalefit_720_noupscale,"The following is an excerpt from ORIGIN Magazine.Interviewer: Maranda PleasantMaranda Pleasant: What are the things that make you feel most alive in this world?Pierce Brosnan: Being here by the ocean in Malibu. Living in this beautiful house that we built, that took so long to build. Being in my art studio, painting. Packing my bags tomorrow to go home to Kauai where we have a house. Which all sounds very grand, and I suppose it is, in some respects, but nothing comes from nothing. It all comes from hard work. Being with my wife and children in Kauai, seeing old friends there, being on the beach, painting, paddleboarding. Sitting under a Kauai moon with a bonfire going, buddies around. Those are the things that kind of make my world turn.MP: Now I really want to fly to Hawaii and start a bonfire. That’s really going to make my day very difficult, thinking about that. So thank you for that. What does love mean to you?PB: PB: Love means that everything is right with the world. Love and only love. Love means that you are content within your own heart and in the presence of the person that you love, who fills your day and makes you stronger and wiser, and gives you the confidence to go out into the world. Love is just the most beautiful, joyous feeling. It can come from many places. Hopefully, the one who is beside you, the one who is there on the pillow beside you in the morning -- my wife. We’ve been together nineteen years, we’re celebrating our nineteenth year on April 4th. We’ve done a lot of life together. It’s been a great journey, a great road, and we still have lots of plans and desires and wants and wishes and plans. She’s my north star, somebody who has been a constant companion. And we seem to do well at being together and being in love and more importantly, liking each other. The like factor is a great thing. Love cannot burn constantly.It’s very hard for it to be so intense. But it’s wonderful. I tell her I love her everyday. It’s important to say that.MP: What makes you feel vulnerable in life?PB: Sickness of my family, sickness of friends. Sometimes the limited time you have. The news. Listening to the world, hearing the madness, seeing the madness of mankind and our leaders. The fragilities of our societies, the fragility of our ecosystem. The sheer shameful neglect of our leaders not to collectively get together and try to sort this planet out. China, North Korea. All of the above.MP: Are there causes or things happening on the planet that you’re sensitive to or you’re passionate  about? Organizations or causes that you’re behind?PB: On my website there are a number of organizations that I have supported, from the NRDC to Sea Shep to Jane Goodall to Save the Elephants. All of these players are significant human beings and organizations. The slaughter of the elephants -- it seems to have a dreadful inevitability to it, which is just absolutely shocking and appalling. You don’t see it on the news at night, you don’t hear the drum loudly enough through the static of other issues. So the demise of that creature will come with such a death knell, if we don’t really collectively pull together and try to stop the trade that’s going on and the slaughter for the Asian market. That has to be done through the young people, really, because those are the ones that will stand up and say, No, this is unacceptable.MP: Do you have a daily routine, a way that you keep your center and your balance?PB: Play tennis in the morning after dropping the boys at school. Then I go to the gym and I come home. Make a cup of coffee, go up to my studio, and paint for a while. Read scripts, answer phone calls, have lunch with Keely. Then I go back to the studio and paint for a while. Pick the boys up from school. That’s about it, really. It’s very simple. I live a very simple existence when I’m not on the road. Because when I’m on the road making a movie, I’m away from home. The next destination is Croatia. Last year I was in Sorrento, Mallorca, London, Tokyo. When I’m home, I’m home.MP: About the film, Love is All You Need -- is there something about it that you connect with on an emotional level?PB: It’s a movie about a woman with cancer. There’s a man who watched his wife suffer and endure the greatest emotional havoc and physical havoc from cancer. That leaves an indelible mark. So the film connected to me initially on that level, but it’s not all about that -- it’s about love. It’s about this woman who has breast cancer and is fighting the good fight with family, a son and daughter and a husband—who’s an idiot. The daughter’s getting married in Sorrento and she bumps into a very grouchy guy like me. They fall in love. It’s about a wedding, really. Susanne Bier directed it. She makes very intricate, complex, human stories. It’s like a Mama Mia! Luckily, I don’t sing. There’s no singing. The world is safe. You don’t have to endure my dulcet songs. But it’s a beautiful film. I love this film. It’s like a warm embrace. And so for any man or woman who is suffering through all of the onslaught of cancer or anything like that, this is a delightful film. It’s not sad, it’s joyous. It’s about family. And it looks ravishing!MP: I didn’t realize you were a painter. I financed this magazine through my artwork. What do you paint?PB: I paint in oils, I paint in acrylics. I paint figurative and landscape portraits. It’s all in my own kind of style. I’m self-taught. I was a commercial artist when I left school, but luckily I became an actor. I’ve painted for many, many years. Now the last few years it’s gotten more serious. Thinking about and hoping I will put on an exhibit and make a book shortly. Maybe next year.MP: Now he’s a painter, oh god. Put that on the list.PB: He paints like he sings and he acts like he sings. It’s all a game, Maranda. It’s all a game. The thing is to get away with it! Get away with it, great!MP: I have a PhD in getting away with it!PB: So there you go! Wonderful. Thank you so much. ORIGIN is the conscious culture national print magazine bringing together art, yoga, music, humanitarianism, and sustainability to shift the planet for good. Twenty percent of our editorial is donated to nonprofits impacting the planet. You can find ORIGIN in Whole Foods, Barnes and Noble, Pharmacas, Central Markets and 15+ other National retailers. "
1,STYLE & BEAUTY,Miss Uzbekistan Mystery: Is Rakhima Ganieva A Pageant Queen Imposter?,Amanda Scherker,https://www.huffingtonpost.com/entry/miss-uzbekistan-mystery_us_5b9d82fde4b03a1dcc88f285,"While local authorities were unaware that the event transpired, several United States pageant blogs publicized the results",2013-09-15,"NUSA DUA, INDONESIA - SEPTEMBER 08: Miss World contestants perform during the Miss World 2013 Indonesia opening show on September 8, 2013 in Nusa Dua, Indonesia. Indonesia's government has moved the final round of the Miss World pageant from main Java island to the resort island of Bali due to the ongoing Muslim protests. (Photo by Ed Wray/Getty Images)",https://img.huffingtonpost.com/asset/5b9d82fd2400003000951b9b.jpeg?ops=scalefit_720_noupscale,"The first-ever Miss Uzbekistan is one of 110 pageant queen hopefuls in the 63rd Miss World Competition. The only problem? Apparently, nobody in Uzbekistan seems to know how 18-year-old Rakhima Ganieva won her crown.This is Uzbekistan's first year participating in the Miss World pageant, making it the third of former Soviet republics of Central Asia to be made eligible. In late July, the official website of Miss World announced Ganieva as the winner of the Miss Uzbekistan competition. It was reported that the self-described piano and travel enthusiast was crowned on July 20 in Uzbekistan's capital city, Tashkent. So why does it seem nobody in Tashkent knew about it? Radio Free Europe/Radio Liberty reported that its Uzbek services contacted the Uzbek Culture and Sports Ministry and the National Committee on Women, both of which said they were unaware that Ganieva had participated and that Uzbekistan even had a Miss Uzbekistan contestant competing in Miss World. Zhavlon Komolov, a representative of the Tashkent-based Pro Models modeling agency, noted that ""Rakhima Ganieva never passed through any special selection process in Uzbekistan.""According to Uzbek news site Mezon, the circumstances behind Miss Uzbekistan's crown are hazy. Mezon called all 10 modeling agencies in Tashkent and found that none knew who Ganieva was or had heard of a Miss Uzbekistan pageant occurring earlier that year. While local authorities were unaware that the event transpired, several United States pageant blogs publicized the results earlier in the summer. Beauty Pageant News described the contest as including ""national costumes, catwalk in cocktail dresses and catwalk and interview in evening dresses"" (although the webpage that listed that description has since been pulled down). The site said that the event was organized by Interalliance UZ and thanked Animesh Barua, national director of Miss World in Uzbekistan and Kyrgyzstan for the information. Missosology, another pageant site, also publicized the results in its forum, saying, ""Thanks to Interalliance UZ for exclusive photos of Rakhima.""Which brings the mystery to Animesh Barua and his company, Interalliance KG, which has a ""Department of Models and Beauty"" branch  claiming to organize several different beauty contests including Miss Kyrgyzstan. The 2013 Miss Kyrgyzstan competition is publicized thoroughly on an official website. That site also posted several of Miss World's interview videos with other 2013 Miss World candidates, including one of the mystery candidate, Miss Uzbekistan. Interalliance KG makes no mention of an actual Miss Uzbekistan pageant, however, despite apparently distributing pictures of the purported winner on U.S. pageant blogs. In order for Miss Uzbekistan to have qualified for the contest, the ""preliminary"" round must have been approved by the Miss World pageant. The question remains, though: If there was a pageant, why does it seem to exist only in rumor?Miss Uzbekistan's Miss World introduction video, posted to MissWorld.org:A preview from last year's pageant: Want more? Be sure to check out HuffPost Style on Twitter, Facebook, Tumblr, Pinterest and Instagram at @HuffPostStyle."
2,STYLE & BEAUTY,Jared Leto Thinks All Men Should Wear High Heels,,https://www.huffingtonpost.com/entry/ss_us_5b9d839ae4b03a1dcc88fe23,"It turns out we have more to learn from Jared Leto than just haircare tips. ""Well, I recommend that men try it. I think it'll",2013-09-15,"TORONTO, ON - SEPTEMBER 08: Actor Jared Leto attends Variety Studio Presented by Moroccanoil at Holt Renfrew during the 2013 Toronto International Film Festival on September 8, 2013 in Toronto, Canada. (Photo by Jonathan Leibson/Getty Images for Variety)",https://img.huffingtonpost.com/asset/5b9d83992400005100951bd3.jpeg?ops=scalefit_720_noupscale,"It turns out we have more to learn from Jared Leto than just haircare tips.The ""Dallas Buyers Club"" actor's latest role has the heartthrob playing a transsexual drug dealer, a part he perfected with the input of transgendered women, Leto reveals in a recent interview with Cosmopolitan. ""[They] taught me how to live,"" he said.Perhaps the most perilous part of the actor's attempts? Wearing high heels. Though Leto reveals the experience was a constructive one:""Well, I recommend that men try it. I think it'll give you a deeper understanding and appreciation for women around the world.""Jared told us back in May that he developed a ""relationship"" with the fancy footwear, so we trust his opinions on their effects. Just be careful not to hurt yourself, guys!No word on this stuff, though:Want more? Be sure to check out HuffPost Style on Twitter, Facebook, Tumblr, Pinterest and Instagram at @HuffPostStyle."
3,BLACK VOICES,Colin Kaepernick And 'Post' Post-Race America,"www.theshadowleague.com, www.theshadowleague.com",https://www.huffingtonpost.com/entry/colin-kaepernick-san-francisco_us_5badefe8e4b0bb1705fb8e6c,"You know what? I’d like to propose a toast: to post-post-Post-Race-America, where we are now invited to freely move about",2013-09-15,"SAN DIEGO, CA - AUGUST 29: Colin Kaepernick #7 of the San Francisco 49ers smiles from the sidelines with his team leading 7-0 over the San Diego Chargers during the first quarter of a preseason game at Qualcomm Stadium on August 29, 2013 in San Diego, California. (Photo by Harry How/Getty Images) ",https://img.huffingtonpost.com/asset/5badefe82100003100c6ba85.jpeg?ops=scalefit_720_noupscale,"This post is in partnership with TheShadowLeague.com.You remember: Barack Obama won the presidency, everyone was feeling all bloated with hope and the images of the Civil Rights era took on a shiny new hue, on the way from legend to prophecy. Eulogies for the recently deceased specter of racism met no sarcasm or derision; token blacks and browns everywhere suddenly, unimaginably belonged, like a stumble that becomes a part of a dance. We frolicked for a moment in the utopic playground of Post-Race America, where no one could see or respond to race because we were, you know, over it. But now we’re over being over it; Oscar Grant and Trayvon Martin have seen to that. We live in post-Post-Race-America, where we lie in wait for a chance to catch-a-racist-by-the-toe, knowing both intuitively and misguidedly that the best protection against being labeled a racist is to label somebody else a racist first. We do it well; we’ve read some books and we watch both Bill Maher and The Daily Show. We were ready for the Adventures of Oprah in Switzerland and we were ready to pull the race card on her race card when the saleslady cried foul.And we’re ready for someone like Colin Kaepernick, whose racial-cultural background has wound its way into more than a few compelling water-cooler chats. There are many reasons to talk about the 25-year-old starting quarterback of the San Francisco 49ers. First and least controversial among them is this Sunday’s much-anticipated game against the other half of the newest of the great football rivalries , the Seattle Seahawks. With an injury-free preseason and a Week 1 win safely behind him, Kaepernick is officially poised to dazzle both fans and fantasy-owners as he leads his Niners through the regular season. Amid breathless reports that San Francisco coaches have every reason to renegotiate Kaep’s contract at the start of the 2014 season, it’s finally time to find out if Colin Kaepernick can live up to the hype.And yet, somehow, that’s only half the story. Colin Kaepernick’s status as one of the NFL’s rising stars is due not just to the hype related to his potential as one of the league’s next best quarterbacks, but also to the gossipy phenomena that surround not Kaepernick the athlete, but Colin the man. As recent photo spreads on newsstands in GQ and ESPN Magazine’s Body Issue suggest (along with the resulting options you get when you Google “Colin Kaepernick Tumblr”), that man is the kind of man who has the kind of body women want to see more of. And as recent controversies in the media have shown, that body boasts the kinds of tattoos some people feel some type of way about .The beautiful thing about a Colin Kaepernick is that the attraction we feel as consumers to his celebrity gets complicated with the ways we see the world, ourselves and everyone else in it. Sometimes the thing everybody’s talking about is exactly the thing we need to talk about. But, when that thing is race, we seem to have a hard time getting beyond pointing fingers and isolating ourselves from people who don’t share our views.Especially in post-Post-Race-America.Stanford law professors Ralph Richard Banks and Richard Thompson Ford, writing about unconscious race bias, describe a shift after the Civil Rights Movement in which conscious race bias effectively moved underground, in step with an increasing “moral condemnation” of racist and prejudicial attitudes and behaviors. For me this connects to the failed state of Post-Race America. Failed because of what Banks and Ford’s work suggests, which is that the people who feel they have the most to lose from appearing biased will make a more conscious effort to hide it.And from what I can tell, the strain of that effort makes a jumpy trigger finger. When you see a racist around every corner, you might want to double-check to make sure you’re not in a hall of mirrors.In this climate, it should not be a surprise to discover that when people write about Kaepernick, they at least touch on, if not outright discuss, his racial identity. The public discourse of post-Post-Race America is a Wild West of sorts, complete with a land grab across a muddied plain, where everyone, regardless of race, is seeking to articulate some newly discovered ground, to stake a claim and announce to the world: “No, I’m the one who gets it!”And before you get all troll-y on me and start calling me names on Twitter, allow me to implicate myself: I am very well aware that I, too, suffer under the delusion that I have at least one finger—or maybe just a pinky toe—on the race-pulse of America.To get a better picture of post-Post-Race-America, let’s take a bird’s eye view of the controversy that started when Sporting News writer David Whitley wrote a column criticizing the omnipresence of black ink on Kaepernick’s body, on the grounds that it soils the image of the great American quarterback with a little too much of “Who’sWho on Cell-block Four.” From Whitley we get at least a clearly racially coded (of his own horror: “It’s not just a white thing, I hope”), if not actually (and perhaps accidentally) racist column. And then, as is natural in post-Post-Race America, the writers of Team Kaep’ weighed in to happily excoriate Whitley in the name of defending Kaepernick -as-magical-negro, displaying their newly acquired uber-progressive capacity to recognize and deconstruct undercover (and perhaps imagined) racist frameworks: “Why, some of his best children are black!” At least one Whitley defender chimes in, making the claim that Whitley suffers from age bias, not race bias, as if each of us is allowed just one bias per life and are perfectly fair and balanced in every other respect. There’s even a middle-of-the-road-er , who is ready to make a distinction between someone being a racist and someone like Whitley being racialized by his own experience and making comments that are both offensive and in line with integrity to that experience and the beliefs it yields.And so, our post-Post-Race-American landscape stretches out before us: Everyone agrees that there are ways to talk about race and ways not to. Everyone agrees that someone is doing a really bad job of talking about race, and perhaps even has the hubris to assume that they are doing a much better job.Is there a silver lining here? In an attempt to find one, I’d like to offer up a few observations: We are comfortable talking about conscious bias because it is never our own;e are comfortable talking about unconscious bias as long as we are certain it is not our own;e are ultimately unable to hide our unconscious bias because we are what we eat.And this is not a bad thing.Maybe one day, we’ll be able to turn to a friend after an awkwardly raced moment and simply say, like DJ Jay Smooth suggests, “ Hey, there’s something racist in your teeth,” and everything will still be copacetic.You know what? I’d like to propose a toast: to post-post-Post-Race-America, where we are now invited to freely move about the cabin and talk about race, to talk about what we see and even to talk about Colin Kaepernick, freely, without fear of rebuttal. Not because we don’t expect one, but because we don’t fear rebuttal. It’s where, instead of ending a conversation at agree-to-disagree, we might begin one. We are allowed to change our minds. Grow a little from time to time. Maybe even get to the bottom of it. A hall of mirrors is a pretty good place to begin the business of seeing yourself as you really are."
4,QUEER VOICES,"'Naked As We Came' Premiere: Ryan Vigilant, Benjamin Weaver, Lué McWilliams And Karmine Alers Debut Film In New York",Curtis M. Wong,https://www.huffingtonpost.com/entry/naked-as-we-came-premiere_us_5bafbaabe4b0ad769260f425,"The film was a very personal one for writer-director LeMay, who said he was inspired by several close friends who lost parents",2013-09-15,Elliot (Vigilant) is seduced by Ted (Weaver) in the film's steamy hot tub scene. ,https://img.huffingtonpost.com/asset/5bafbaa73c000020010b9c90.jpeg?ops=scalefit_960_noupscale,"An unexpected, mid-September thundershower didn't dampen spirits at the New York premiere of ""Naked As We Came,"" Richard LeMay's stunning new film about love, loss and the delicacy of family ties. Though ""Naked"" has already nabbed a number of awards at film festivals in San Francisco, Palm Springs and Atlanta, the movie's starring foursome -- Ryan Vigilant, Karmine Alers, Lué McWilliams and Benjamin Weaver -- appeared particularly jubilant to present the film before an eager audience of Manhattanites on Sept. 12. (Check out the film's trailer above) ""This is the premiere I've been waiting for, because we all met in New York,"" said Vigilant, whose acting résumé includes stints on ""Gossip Girl"" and Lenox Avenue,"" among other roles. Noting that his ""Naked"" role was his first lead in a feature film, he added, ""It was a true test of my endurance. The movie was kind of born here, so it feels like a cap in a way."" ""Naked"" focuses on Laura (Alers) and Elliot (Vigilant), two siblings who return to their childhood home to re-connect with their ailing mother (McWilliams), who is in the final stages of terminal cancer. The pair is surprised to find that not only has Mom taken up smoking marijuana in addition to arts and crafts, she's also acquired a dashingly handsome new housekeeper, Ted (Weaver). Elliot quickly discovers that Ted's domestic talents aren't limited to the kitchen as the two men begin a smoldering affair, but his mysterious new beau has a hidden agenda of his own. Check out photos from the premiere of ""Naked As We Came,"" then scroll down to keep reading: Though the movie has received most of its acclaim on the lesbian, gay, bisexual and transgender (LGBT) festival circuit, ""Naked As We Came"" has cinematic aims that go well beyond the sexuality of its principal characters, and refreshingly so. The film ultimately serves as a complex portrait of a tormented family finding strength and courage in what is unquestionably a tumultuous circumstance. The tension of the plot is juxtaposed against the backdrop of a pastoral New England estate, but each member of the ensemble cast turns in an equally solid performance, highlighting the subtle nuggets of humor in LeMay's script. The film was a very personal one for writer-director LeMay, who said he was inspired by several close friends who lost parents over the course of a year. ""I started thinking about what I would do if I knew one of parents was going to die,"" he said. ""It's a pretty dysfunctional family, but I think dysfunction can also be funny, if you stand back and let it be."" Noting this his aim was to ""make a movie that wasn't focused entirely on gay themes or gay issues,"" LeMay added, ""I don't think that [being gay] is the issue in this case; the issue is really just that they're human."" Weaver echoed those sentiments, noting, ""I think the message is about identifying what your real dream is, and having the courage to go after that, but also knowing that it's not always so easy to articulate that, and it might take some false starts before you figure it all out."" After its week-long theatrical run, ""Naked As We Came"" will be released on DVD in October. For more information, click here. "
