,category,headline,authors,link,short descr,date,image_caption(s),image_link(s),article
0,GREEN,"Earth Day's Soundtrack: Wider Circles, New Album by Rising Appalachia","Jeff Biggers, ContributorAuthor: Journalist, Historian, Playwright, www.jeffbiggers.com",https://www.huffingtonpost.com/entry/earth-days-soundtrack-wid_b_7102978.html,,2015-04-20,2015-04-20-1429550853-596762-5168RisingAppTourAdmat.png,https://images.huffingtonpost.com/2015-04-20-1429550853-596762-5168RisingAppTourAdmat-thumb.png,"In an effort to encourage low-impact touring and community engagement, the internationally acclaimed folk roots group Rising Appalachia has taken to the rails this spring to promote their border-crossing sixth album, Wider Circles. Set to be released on April 21, the album's blend of ethereal sister harmonies, banjo and fiddle duets, driving percussion, and brass and backup bass presents a lush Earth Day soundtrack for global times. The band's coast-to-coast tour, in partnership with the National Association of Railway Passengers and Amtrak, also showcases Rising Appalachia's long-time commitment to the environmentally conscious ""slow music movement,"" an effort to bring performance back to its roots and serve as a ""cultural influence and catalyst of justice."" ""We're supporting local businesses with farm-to-table hospitality; providing local non-profits at each show a platform to display information; exploring alternative methods of travel, including train, bike, low-impact vehicles, boat, horse, or simply focusing on regional touring; and encouraging concert goers to take in more than just the catharsis of the music,"" said Leah Smith, the soulful singer, poet, banjo player and fiddler who fronts the Georgia-raised group with her sister Chloe.""These women and Rising Appalachia have lifted our spirits and stood, rode and canoed on the front lines of the resistance to fossil fuels pipelines,"" said Winona LaDuke, the founding director of the White Earth Recovery Land Project and the Native-led organization Honor the Earth. ""Their music is good for the soul, spirit and courage.""Since their entry onto the roots music scene eight years ago and the release of their now-classic ""Scale Down,"" Rising Appalachia has always made their own road in the music industry, eschewing glitz and the ease of a pigeon-holed persona for years of musical and cultural travel across the U.S. and the far reaches of Europe, India, and Latin America. They've produced five other albums as modern-day griots, defying categories with their collaboration with various musicians on old-time mountain tunes; New Orleans jazz; hip hop; soul; multilingual Congolese, Bulgarian and Cuban songs; and spoken word. ""Wider Circles is in tribute to our journey on this troubadour path and is in homage to the incredible people we have collaborated with, met along the way, and been championed by,"" said Chloe, whose crystalline voice carries the freshness and vitality of Rhiannon Giddens.On the new album, which includes Biko Casini on percussion and David Brown on stand-up bass and baritone guitar, the group roams from the Smith family's Appalachian musical traditions to the island of Stromboli in Italy to the mountain forests of the indigenous BriBri in Costa Rica. In the gorgeous ""Lean In,"" Leah's earthy voice easily weaves around Chloe's lilting tone, ""I""m a roadmap, baby, I'll take you back home."" With syncopating ""Medicine,"" Rising Appalachia celebrates traditional herbal medicine, as Leah's spoken-word poem invites listeners to find medicine in the seeds, which ""we hold tight to our right to protect.""In a joyous global beat, the title track references Rainer Maria Rilke's poem -- ""I live my life in widening circles / that reach out across the world"" -- as the sisters' effortless harmonies weave between the banjo and brass, celebrating their journey in an anthem for those on the front lines of environmental justice. ""Speak your words with triumph And I will watch your mouth. I'll march with you, my sister, to your place of fearing, we'll dive into those waters, swim in to the clearing.We always keep our heads up, we'll always sing along.  We'll walk the path of kindness, know where we belong. I'll march with you, my brother, to the mountaintop, we haul back the dynamite, make the rumble stop. Be a pillar, I'll be your mocking bird. We'll sing the rock of ages,  yes, we will be heard. Let's form a great salvation through harmony and sound. We'll know the shape of progress, like nature is always around."""
1,GREEN,"Earth Day's Soundtrack: Wider Circles, New Album by Rising Appalachia","Jeff Biggers, ContributorAuthor: Journalist, Historian, Playwright, www.jeffbiggers.com",https://www.huffingtonpost.com/entry/earth-days-soundtrack-wid_b_7102978.html,,2015-04-20,2015-04-20-1429556564-74744-2098ChloeLeah_Envision.jpg,https://images.huffingtonpost.com/2015-04-20-1429556564-74744-2098ChloeLeah_Envision-thumb.jpg,"In an effort to encourage low-impact touring and community engagement, the internationally acclaimed folk roots group Rising Appalachia has taken to the rails this spring to promote their border-crossing sixth album, Wider Circles. Set to be released on April 21, the album's blend of ethereal sister harmonies, banjo and fiddle duets, driving percussion, and brass and backup bass presents a lush Earth Day soundtrack for global times. The band's coast-to-coast tour, in partnership with the National Association of Railway Passengers and Amtrak, also showcases Rising Appalachia's long-time commitment to the environmentally conscious ""slow music movement,"" an effort to bring performance back to its roots and serve as a ""cultural influence and catalyst of justice."" ""We're supporting local businesses with farm-to-table hospitality; providing local non-profits at each show a platform to display information; exploring alternative methods of travel, including train, bike, low-impact vehicles, boat, horse, or simply focusing on regional touring; and encouraging concert goers to take in more than just the catharsis of the music,"" said Leah Smith, the soulful singer, poet, banjo player and fiddler who fronts the Georgia-raised group with her sister Chloe.""These women and Rising Appalachia have lifted our spirits and stood, rode and canoed on the front lines of the resistance to fossil fuels pipelines,"" said Winona LaDuke, the founding director of the White Earth Recovery Land Project and the Native-led organization Honor the Earth. ""Their music is good for the soul, spirit and courage.""Since their entry onto the roots music scene eight years ago and the release of their now-classic ""Scale Down,"" Rising Appalachia has always made their own road in the music industry, eschewing glitz and the ease of a pigeon-holed persona for years of musical and cultural travel across the U.S. and the far reaches of Europe, India, and Latin America. They've produced five other albums as modern-day griots, defying categories with their collaboration with various musicians on old-time mountain tunes; New Orleans jazz; hip hop; soul; multilingual Congolese, Bulgarian and Cuban songs; and spoken word. ""Wider Circles is in tribute to our journey on this troubadour path and is in homage to the incredible people we have collaborated with, met along the way, and been championed by,"" said Chloe, whose crystalline voice carries the freshness and vitality of Rhiannon Giddens.On the new album, which includes Biko Casini on percussion and David Brown on stand-up bass and baritone guitar, the group roams from the Smith family's Appalachian musical traditions to the island of Stromboli in Italy to the mountain forests of the indigenous BriBri in Costa Rica. In the gorgeous ""Lean In,"" Leah's earthy voice easily weaves around Chloe's lilting tone, ""I""m a roadmap, baby, I'll take you back home."" With syncopating ""Medicine,"" Rising Appalachia celebrates traditional herbal medicine, as Leah's spoken-word poem invites listeners to find medicine in the seeds, which ""we hold tight to our right to protect.""In a joyous global beat, the title track references Rainer Maria Rilke's poem -- ""I live my life in widening circles / that reach out across the world"" -- as the sisters' effortless harmonies weave between the banjo and brass, celebrating their journey in an anthem for those on the front lines of environmental justice. ""Speak your words with triumph And I will watch your mouth. I'll march with you, my sister, to your place of fearing, we'll dive into those waters, swim in to the clearing.We always keep our heads up, we'll always sing along.  We'll walk the path of kindness, know where we belong. I'll march with you, my brother, to the mountaintop, we haul back the dynamite, make the rumble stop. Be a pillar, I'll be your mocking bird. We'll sing the rock of ages,  yes, we will be heard. Let's form a great salvation through harmony and sound. We'll know the shape of progress, like nature is always around."""
2,POLITICS,Can We Even Be Sure That 'Draft De Blasio' Is A Real Thing Or Not?,Jason Linkins,https://www.huffingtonpost.com/entry/draft-de-blasio_n_7102984.html,,2015-04-20,"NEW YORK, NY - APRIL 08: New York City Mayor Bill de Blasio speaks at the National Action Network (NAN) national convention on April 8, 2015 in New York City. Reverend Al Sharpton founded NAN in 1991; the convention hosted various politicians, organizers and religious leaders to talk about the nation's most pressing issues. (Photo by Andrew Burton/Getty Images)",https://img.huffingtonpost.com/asset/5bb8f3622100005002c96e5c.jpeg?ops=scalefit_720_noupscale,"Editor: Have you seen the ""Draft de Blasio"" thing, where the New York mayor is allegedly going to run for president?Me: I don't think it's real! It can't be a real thing.Editor: It got a big old article in the New York Post.Me: You realize of course that the fact that there is a ""big old article in the New York Post"" does not, in and of itself, serve as an endorsement of its realness.Editor: I'm not saying it does. I'm saying this is where you'll find this story, such as it is.Me: All right, let me go look at it.Despite repeated claims to the contrary, Mayor Bill de Blasio is positioning himself to be the leftist “progressive” alternative to Wall Street-friendly Hillary Rodham Clinton as the Democratic candidate for president, a national party operative told The Post.Me: As I suspected, this insistence that ""Draft de Blasio"" is a thing fails to convince me of its essential thingness. The New York Post has a single ""operative"" willing to compare de Blasio to George McGovern. This sort of reads like an April Fools' Day prank that got published on the wrong day. Maybe this is what 2016 is going to be like -- a series of tricks.Editor: Yes.Me: How are we going to stay sane? What are our strategies for coping with this?Editor: These are the questions you could pose and answer.Me: What if we all agreed to just not have a presidential election until, like, June of next year? Just everyone go home and wait until then?Editor: Put this into writing!Me: Wait, though! You do not actually believe that de Blasio is going to run for president though, right?Editor: Right. I do not believe it.Me: Why is this a story, though? What happened?Editor: ""@DraftDeblasio"" is a twitter account someone made. So I suppose that's the reason? Everyone freaking out over a Twitter account, basically? Me: OMG so this is why? There is a Twitter account?Editor: Yeah, basically.Me: You know in the movie ""Inception"" they had to spend, like, millions of dollars and invent crazy machines and then a team of people had to all almost get killed to make ONE person think ONE thing. They should have just used Twitter and then the whole movie would have been six minutes long.Editor: Ha, ha, yes, I know it.Me: Have you considered the possibility that NONE OF THIS IS HAPPENING, and it's actually still 2007 and I am alone at our old office and some chemical fumes from the construction down the hall have knocked me unconscious and I need someone to come help me!? Or maybe I am in the ""Inception"" world? Maybe you are just a figment of my imagination -- a literary device that I constructed with whom I'm now trapped in a conversation -- and what I think of as ""the real world"" is just a gossamer web of half forgotten memories. Editor: Maybe! I'm sorry that if you are, in fact, in the ""Inception"" world, it's lacking some quality Joseph Gordon-Levitt for you.Me: I'm more of a Tom Hardy man but I appreciate the sentiment, even if you are just a dollop of pixellated memory dust that's here to implant the notion that this crazy world, in which ""Draft de Blasio"" is a thing, is actually the real world and I'm not in a coma somewhere.Editor: Oooh, I'm gonna put ""dollop of pixellated memory dust"" on my business cards now. So really this ""Draft de Blasio"" thing was not for nothing! I got a cool new biz card out of it.Me: Well damn, I didn't get anything out of it!  Editor: :(Would you like to follow me on Twitter? Because why not?"
3,POLITICS,Modernizing Combat Medical Training to Provide American Troops With the Best Care Possible,"Sen. Ron Wyden and Rep. Hank Johnson, Contributors",https://www.huffingtonpost.com/entry/modernizing-combat-medical-training_b_7103378.html,"Every year, the Department of Defense burns, maims, and kills more than 8,500 goats and pigs teaching combat medicine and training trauma medics. It should go without saying these animals differ from humans on many essential anatomical levels. These differences lead to sub-par training.",2015-04-20,"FILE - In a May 9, 2012 file photo, Capt. Sara Rodriguez, 26, of the 101st Airborne Division, carries a litter of sandbags during the Expert Field Medical Badge training at Fort Campbell, Ky. The Pentagon is lifting its ban on women serving in combat, opening hundreds of thousands of front-line positions and potentially elite commando jobs after generations of limits on their service, defense officials said Wednesday, Jan. 23, 2013. (AP Photo/Kristin M. Hall, File)",https://img.huffingtonpost.com/asset/5bb8f3632100002501c96e5e.jpeg?ops=scalefit_720_noupscale,"At a time when cutting-edge technology has transformed nearly every aspect of how the U.S. military does business, the Defense Department is stuck teaching combat medics with techniques straight from the last century.Every year, the Department of Defense (DoD) burns, maims, and kills more than 8,500 goats and pigs teaching combat medicine and training trauma medics. It should go without saying these animals differ from humans on many essential anatomical levels. These differences lead to sub-par training. Today, high-tech simulation devices based on human anatomy allow trainees to work with lifelike human skin, fat, and muscle. These medical simulation devices can now replicate the look, feel, and even smell of severe combat injuries. And unlike anesthetized animals, high-tech simulators can move and respond. Plenty of evidence exists that this training is now as effective as the use of live animals, if not more effective. In fact, more than 95 percent of civilian trauma programs have already switched to modern simulators. The Uniformed Services University -- the military medical school -- now trains future military physicians without using animals and, as of January 2015, Advanced Trauma Life Support courses across the U.S. military no longer use live animals either. To ensure that our armed forces are using the most advanced trauma training, we've introduced bipartisan, bicameral legislation--the Battlefield Excellence through Superior Training, or BEST Practices Act. Our bill modernizes military combat trauma courses by phasing out the use of live animals over several years. In so doing, it improves the standard of care for troops sent into harm's way. The bottom line is that maiming, burning, and killing animals isn't necessary because better training methods are readily available. We'll be working with our colleagues to make sure the BEST Practices Act brings the DoD into the 21st century of combat trauma training. Ron Wyden is the senior Senator from Oregon and has served in the Senate since 1996.Hank Johnson represents Georgia's 4th Congressional District and serves on the House Armed Services Committee."
4,FIFTY,Mother Nature and Father Time are Cruel,"Barbara Hammond, ContributorWriter, Artist, Blogger at http://zeroto60andbeyond.com",https://www.huffingtonpost.com/entry/mother-nature-and-father-time-are-cruel_b_7103790.html,"Back in the day, I had a pretty decent body, great hair, good skin and I never appreciated it as I should have. I did some modeling, worked with models and owned a modeling agency. Still, I wasn't happy with my body.",2015-04-20,2015-04-20-1429555088-3104274-babsmodelingportfolio.jpg,https://images.huffingtonpost.com/2015-04-20-1429555088-3104274-babsmodelingportfolio-thumb.jpg,"Where to begin...Back in the day, I had a pretty decent body, great hair, good skin and I never appreciated it as I should have. I did some modeling, worked with models and owned a modeling agency. Still, I wasn't happy with my body.After having two kids, I was never able to lose the paunch. That's not true... I could have if I'd really worked at it, but I didn't. I even bought a health club, thinking I could teach aerobics and it would miraculously disappear. Crazy, huh?At 42 years old, I decided to have a tummy tuck, because I was unhappy and I knew if I could FINALLY have a flat stomach, my life would be fabulous! Oh, how I would love to bitch slap my former self for that mistake.It was a botched procedure, which left me with a good-sized rock of scar tissue in the middle of my lower abdomen. The universe can be cold when you need to wake-up and face reality.Life went on, and twenty lus years later I still hate my stomach, but I'm trying to let it go. I am 10 pounds overweight, (give or take a few), which is not bad for someone who loathes exercise.I don't worry much about my stomach these days, because I'm trying to figure out how to get my eyebrows back. Stomachs can be hidden, camouflaged, buried under clothing. Eyebrows? Not so much.I've had the thyroid test and all is normal. And yet, I have lost, approximately, 90% of my body hair, starting at the eyebrows. I don't miss shaving my legs, but, of course, there are still hairy arm pits to deal with. Damn you, Mother Nature!In the meantime, I've found products that help camouflage the flaws. And, I have to admit, all the years of trying to take good care of my skin has paid off. I have never removed makeup at bedtime, and I'm not advocating you do the same, but it's worked for me. Good genes trump makeup remover, apparently.So, I think if I could just get an eyebrow transplant, all would be right in my world. Then I remember the stomach fiasco and smack myself.Have you made mistakes in the name of beauty that you've regretted? Please share!"
