,category,headline,authors,link,short descr,date,image_caption(s),image_link(s),article
24,SPORTS,Chicago Fan's Obituary Takes Passing Shot At Jay Cutler,Ron Dicker,https://www.huffingtonpost.com/entry/chicago-fans-obituary-takes-passing-shot-at-jay-cutler_us_56aba8b0e4b00b033aaee966,Her QB hate will be eternal.,2016-01-29,"Jay Cutler, pictured during a game Dec. 27, was singled out for all the wrong reasons in a Bears fan's obituary.",https://img.huffingtonpost.com/asset/56aba9291a00002d00ab1981.jpeg?ops=scalefit_720_noupscale,"She just sacked Jay Cutler from the grave.The recent obituary for Elizabeth Porter Bowman, who died Jan. 9 at age 78, extolled her virtues as a grandmother, mother and lover of Chicago sports teams.But Cutler, the oft-maligned Bears quarterback, rated special mention in the Chicago Tribune's Legacy.com post:Ouch. Cutler has gotten plenty of criticism in his career, but this diss is eternal.Also on HuffPost:"
25,SCIENCE,Feds Scrap Grand Vision To Expand Marine Sanctuary In Hawaii,Chris D'Angelo,https://www.huffingtonpost.com/entry/noaa-humpback-sanctuary_us_56a9194de4b0947efb6655b0,"After six years of planning, NOAA failed to secure necessary state support.",2016-01-28,A humpback whale mother and calf swim off the coast of Hawaii.,https://img.huffingtonpost.com/asset/56a934482a00006e00031678.jpeg?cache=6B72DD08Sd&ops=scalefit_720_noupscale,"After six years of planning, the National Oceanic and Atmospheric Administration has withdrawn its proposal to expand the size and focus of the Hawaiian Islands Humpback Whale National Marine Sanctuary.In addition to enlarging the sanctuary from 1,366 square miles to 1,601 square miles, the proposal would have allowed it to protect more marine species -- not only the humpback whale -- by shifting to an ecosystem-based management approach.NOAA said it decided to abandon the project in the face of opposition from the state of Hawaii, which co-manages the sanctuary and must sign off on any changes.Allen Tom, regional director of NOAA's Office of National Marine Sanctuaries, told The Huffington Post that the inability of state and federal agencies to agree was disappointing, but not surprising.""Certainly going out to the public, we got an earful,"" he said.Established by Congress in 1992, the national sanctuary lies within the shallow, warm waters surrounding the main Hawaiian islands -- one of the world's most important humpback whale habitats.Each year between November and May, as many as 10,000 humpback whales return from their summer feeding grounds in Alaska to the warmer waters of Hawaii to mate and give birth.After being pushed to the brink of extinction, the North Pacific humpback population has increased drastically over the last half-century. In 1966, the year commercial whaling was banned in the North Pacific, the population had been reduced to fewer than 1,400. Current estimates put their numbers at around 20,000. While the recovery of the species is a success story, the sanctuary recognized the need to pivot its attention to a more holistic approach. ""Managing a single species is not the way management is done, either on land or in the water,"" Tom said. ""We were trying to evolve to a much broader approach of managing some of these endangered animals as well as the resources in the ocean.""The state, however, argued the proposal went too far.Suzanne Case, head of the Hawaii Department of Land and Natural Resource, outlined the state's concerns in a Jan. 22 letter to John Armor, acting director of NOAA's Office of National Marine Sanctuaries.""As the trustee of Hawaii’s natural resources, cultural resources, and submerged lands, the State of Hawaii supports an ecosystem-based management approach, but cannot endorse federal jurisdiction or enforcement of Hawaiian waters at this scale,"" Case wrote.NOAA's proposal came under fire from Hawaii residents concerned the plan and its associated regulations would restrict recreational ocean use and hurt business. Fishing groups opposed the proposal’s call to increase protective areas for Hawaiian monk seals, according to the Honolulu Star-Advertiser.The NOAA proposal, introduced publicly in March, was six years in the making, according to Tom. He didn't have an estimate of the costs involved, but said NOAA ""spent a fair amount of time and energy"" on it.""But again, our mandate says that if we are working with states and in state waters, that the governor and state have the final say as to what we do,"" Tom said. ""If the state's not comfortable, or if they're not on board with our proposal, then it is wise for us to just sort of save everybody any more time and money on this.""The sanctuary says it will continue in its present form, conserving and protecting humpback whales and providing needed research support and public education.Hawaiian Islands Humpback Whale National Marine Sanctuary is the only U.S. sanctuary dedicated to a single species.Also on HuffPost: "
26,POLITICS,Ohio Politician Suggests His 'Young Gal' Opponent Can't Handle Elected Office,Amanda Terkel,https://www.huffingtonpost.com/entry/tom-patton-ohio_us_56aa565ae4b001648922a237,"""The gal that's running against me is a 30-year-old, you know, mom, mother of two infants.""",2016-01-28,Ohio state Sen. Tom Patton (R) questioned his female opponent's ability to handle his job because she's the mother of young children.,https://img.huffingtonpost.com/asset/56aa58601a00002d00ab1818.jpeg?cache=jtbjFTAwl1&ops=crop_0_170_3050_2295%2Cscalefit_720_noupscale,"A prominent Ohio politician is questioning whether his female opponent is fit to serve, saying in a recent interview that she might not be up to the job because she's a ""young gal"" with children.""The gal that's running against me is a 30-year-old, you know, mom, mother of two infants,"" Ohio Senate Majority Leader Tom Patton (R) said in a Jan. 18 interview on America's Work Force Radio.""And I don't know if anybody explained to her we've got to spend three nights a week in Columbus,"" he added. ""So, how does that work out for you? I waited until I was 48 and my kids were raised, and at least adults, before we took the opportunity to try.""Patton is currently running against Jennifer Herold in the Republican primary for the 7th district in the Ohio state House. Cleveland.com reports that Herold is married and her children are 1 and 3 years old.During the interview, Patton also referred to Herold as a ""young gal"" and ""sweetie.""Herold responded with a lengthy statement on her Facebook page Thursday morning, writing, ""Tom, only one man in my life is allowed to call me 'sweetie.' From now on, I respectfully ask you to refer to me as Jen, Jennifer, Ms. Herold, or your opponent.""She said it was ""insulting"" that he questioned her intelligence and whether she knew what being in state government entailed, noting she and her family took her decision to run very seriously. She also pointed out the sexism in his comments: I would also be remiss if I did not recognize the men who also serve while they have children at home. For example, our own Governor John Kasich has two teenage daughters. Speaker of the House Paul Ryan’s three children have all been born while he has been in Congress. He commutes weekly between Washington D.C. and his home in Janesville, Wisconsin.Female politicians frequently face questions that their male counterparts don't, often centered around how they can possibly handle their job and raise a family.When Rep. Paul Ryan (R-Wis.) ran for vice president in 2012, he rarely, if ever, received questions about how he could do so much as the father of three young children.In the 2008 campaign, in contrast, voters and the media constantly talked about how Sarah Palin, who was then the GOP's vice presidential nominee, could take care of her five children.Male politicians, however, are increasingly bringing up the issue on their own. Ryan insisted on maintaining his ""family time"" when he agreed to become speaker of the House last year. Patton has since tried to clarify his remarks, saying he apologizes ""if my words were misplaced on this matter.""""As a widower who raised five daughters, it was not my intention to suggest that a young mother couldn't serve ably in the legislature,"" he said in a statement. ""I used a poor choice of words to express what I know first-hand - raising young children and working is tough. Millions of women do just that every day, including my own daughters. I would ask to be judged on my hard work and advocacy for working families.""The Huffington Post recently sat down with four male members of Congress and asked them about how they fit time with their families into the busy schedule of being a lawmaker. Read their responses here.Also on HuffPost:"
27,POLITICS,Here's The Problem With Hillary Clinton's Electability Argument,Ariel Edwards-Levy,https://www.huffingtonpost.com/entry/hillary-clinton-electability-bernie-sanders_us_56aa39bde4b0d82286d515ad,Most Democratic voters don't see her as their only chance of winning.,2016-01-28,More than half of the Democratic base now think Bernie Sanders could be elected.,https://img.huffingtonpost.com/asset/56aa526b1a00002d00ab1810.jpeg?ops=crop_112_267_7206_4575%2Cscalefit_720_noupscale,"Hillary Clinton may have something of an electability problem.The problem is not that Democratic voters don't think she's electable. It's that they don't care who's electable. That's too bad for Clinton, since she's made electability a cornerstone of her campaign. Her ads now running in Iowa and New Hampshire describe her as ""the one candidate who can stop"" a Republican.To try to gauge how much Clinton's electability argument is resonating, HuffPost teamed with YouGov to probe the views of Democratic and Democratic-leaning voters. What we found is that only 8 percent say they're backing somebody who isn't their top choice, but whom they see as more electable. Sixty-two percent say they're supporting their favorite candidate regardless of that consideration, while the rest are undecided or don't plan to vote.""I am absolutely determined that we're going to make sure we have a Democrat to succeed President Obama so we don't let the Republicans rip away the progress we have made together,"" Clinton told Iowa voters earlier this month. In New Hampshire, she similarly made what Time magazine described as ""a pitch for pragmatism, not passion.""The target audience for Clinton's electability argument also seems to be shrinking.A majority of all Democratic and Democratic-leaning voters -- 54 percent -- now say that Clinton's chief rival, Sen. Bernie Sanders, is in fact electable. And not everybody agrees with Clinton's assessment of her own strength: 83 percent of Democratic and Democratic-leaning voters deem her electable, meaning nearly 1 in 5 think she does not have a chance in the general election. (Most of the latter, presumably, are already in the Sanders camp.)""[I]f the issue of electability were ever to shift dramatically to Sanders' advantage, this race would quickly and dramatically change,"" Democratic strategist Steve Kofinis wrote after conducting a focus group of mostly black South Carolina voters, who currently lean heavily toward Clinton.If Clinton is just an option, rather than the only viable possibility, for the Democratic Party, she needs to worry about attracting passion to go along with the pragmatism. Last July, HuffPost/YouGov polling found Democratic and Democratic-leaning voters 10 points more likely to be enthusiastic about Clinton than about Sanders, and 28 points more likely to say they'd be at least satisfied to have her as the nominee as to have him.Clinton hasn't become any less popular since then, but Sanders has caught up, nearly erasing that gap. Seventy-nine percent now say they would be at least satisfied to have Clinton as their candidate, while 73 percent say the same about Sanders. Forty percent would be enthusiastic about a Clinton candidacy, while 42 percent say the same about Sanders.None of this is fatal news for Clinton. Despite her current struggles in Iowa and New Hampshire, she so far has maintained a significant lead in national polls. Sanders has yet to woo the chunk of minority voters he would need to win in states like South Carolina and Florida. She also faces a primary electorate that, unlike the GOP counterpart, substantially prefers an establishment candidate over an outsider.Another problem for Sanders is that his support is by far strongest not among Democratic Party members, but among sympathetic independents who may or may not turn out to vote in primaries and caucuses. Democratic-leaning independents are far likelier than Democrats to consider Sanders electable and to express outright enthusiasm about his candidacy. Party members are considerably more positive about Clinton.The HuffPost/YouGov poll consisted of 1,000 completed interviews conducted Jan. 16-19 among U.S. adults, using a sample selected from YouGov's opt-in online panel to match the demographics and other characteristics of the adult U.S. population.The Huffington Post has teamed up with YouGov to conduct daily opinion polls.You can learn more about this project and take part in YouGov's nationally representative opinion polling. Data from all HuffPost/YouGov polls can be found here. More details on the polls' methodology are available here.Most surveys report a margin of error that represents some, but not all, potential survey errors. YouGov's reports include a model-based margin of error, which rests on a specific set of statistical assumptions about the selected sample, rather than the standard methodology for random probability sampling. If these assumptions are wrong, the model-based margin of error may also be inaccurate. Click here for a more detailed explanation of the model-based margin of error."
28,POLITICS,Bernie Sanders To Cosponsor Bill Repealing Gun Law He Once Voted For,Samantha Lachman,https://www.huffingtonpost.com/entry/bernie-sanders-guns_us_56aa5716e4b001648922a308,The existing legislation shields weapons makers and sellers from lawsuits.,2016-01-28,"Chris Murphy (D-CT), Rep. Adam Schiff (D-CA), Sen. Richard Blumenthal (D-CT) and Rep. Chris Van Hollen (D-MD), discuss a bill Wednesday to ensure that victims of gun violence are allowed to have their day in court and that industry manufacturers, sellers and interest groups are not shielded from liability when they act with negligence and disregard for public safety.",https://img.huffingtonpost.com/asset/56aa5dad2a00002c00031767.jpeg?ops=crop_0_144_3000_1955%2Cscalefit_720_noupscale,"WASHINGTON -- Sen. Bernie Sanders (I-Vt.) agreed to co-sponsor a bill Thursday that would repeal a law he voted for which gives broad legal immunity to gun makers and dealers, after months of attacks from rival presidential candidate Hillary Clinton concerning his gun safety record. The Protection of Lawful Commerce in Arms Act was passed in 2005, after the National Rifle Association made its passage a priority in order to shield gun manufacturers and sellers from lawsuits. Suits filed in the 1990s and early 2000s argued that they should make their products safer or track where their products are sold. The NRA’s Wayne LaPierre called the PLCAA “the most significant piece of pro-gun legislation in 20 years.”Sanders voted for the legislation; Clinton voted against it.Sens. Richard Blumenthal (D-Conn.) and Chris Murphy (D-Conn.) introduced the Equal Justice for Gun Violence Victims Act, which would repeal the law, Wednesday. While Sanders resisted any suggestion that his vote was a mistake, he had inched towards saying that he would be open to revisiting the issue. Blumenthal and Murphy’s bill provided gun safety advocates with an opportunity to press Sanders and he announced support for it just before the last Democratic primary debate this month. Clinton's campaign said he was flip-flopping on the issue. On Thursday, Sanders said he would co-sponsor the legislation, dropping a previous demand he had made that the law must contain protections for small gun shops for him to put his name on the bill.Gun rights advocates pushing for PLCAA argued that lawsuits would bankrupt gun makers and sellers. But safety supporters advocating for its repeal say that the mere fact that plaintiffs would have a right to go to court under their legislation doesn’t mean they’ll succeed. They also argue that lawsuits have successfully changed the way the tobacco industry markets its products and helped ensure the safety of motor vehicles, so the gun industry should be held to the same standards of care. “Repealing PLCAA would not mean anyone would automatically be held liable -- it would merely put gun makers and dealers on equal footing with everyone else. But while the law remains on the books, our absurd reality is that the gun industry, which sells the most dangerous consumer product on the market, is subject to the lowest duty of care in the country,” Blumenthal and Schiff wrote in a post on Medium Wednesday. “By providing this unique immunity, Congress has effectively empowered the gun industry to ignore best practices and act with impunity. Rather than adopting commonsense policies that could reduce the deadly tide of gun violence across the nation, negligent sellers and manufacturers are protected from the consequences of their actions.”Dan Gross, the president of the Brady Campaign to End Gun Violence, which has endorsed Clinton, celebrated Sanders’ co-sponsorship of the bill Thursday.“This great victory is proof of what can happen when the public holds politicians accountable -- which is happening on the gun violence prevention issue like never before,” Gross said in a statement. “Senator Sanders has defended his checkered record on gun safety very comfortably until very recently – until the American people held his feet to the fire. They knocked on his door and flooded his office with phone calls demanding action. And Sanders finally took notice. His next step must be to champion this legislation in Congress.”Gross pointed out that the family of Josh Adames, who was accidentally shot and killed by a friend in 2001, met with Sanders’ senate staff Wednesday. Hours after that meeting, Sanders’ office reached out to the Brady campaign to say he’d cosponsor the legislation.Adames was killed while visiting his friend's home in Chicago. His friend, who wanted to show off his father’s gun, removed the gun’s magazine and fired at Adames, thinking there were no longer any bullets in the weapon. But a bullet still in the chamber hit Adames in the stomach. His family’s lawsuit against Beretta, the maker of the gun, claimed that the company failed to put proper warnings or safety mechanism on the gun. But PLCAA blocked their suit in the Supreme Court, which declined to consider it in 2009.Hector Adames, Josh’s uncle, told The Huffington Post Wednesday that they were happy with Sanders' support of the legislation and that “any help, whether it comes early or late, is well received.”“We respect the politicians who realize it was a mistake and try to amend the mistake,” he added. “The problem was refusing to change, that hurts the cause, when there's no growth there.”Congressman Adam Schiff (D-Calif.), who is sponsoring the law in the House, said that “it was a tragedy that this bill was passed in the first place,” when asked at a press conference Thursday about whether he, Blumenthal and Murphy were pushing their legislation because of the attention PLCAA has gotten in the Democratic primary. “Without personalizing it to the presidential candidates … the harm has already been done,” he added."
29,POLITICS,Bernie Sanders To Cosponsor Bill Repealing Gun Law He Once Voted For,Samantha Lachman,https://www.huffingtonpost.com/entry/bernie-sanders-guns_us_56aa5716e4b001648922a308,The existing legislation shields weapons makers and sellers from lawsuits.,2016-01-28,1981: The Attempted Assassination Of President Ronald Reagan,https://img.huffingtonpost.com/asset/587a8abe1200002d00ad7981.jpeg?ops=scalefit_960_noupscale,"WASHINGTON -- Sen. Bernie Sanders (I-Vt.) agreed to co-sponsor a bill Thursday that would repeal a law he voted for which gives broad legal immunity to gun makers and dealers, after months of attacks from rival presidential candidate Hillary Clinton concerning his gun safety record. The Protection of Lawful Commerce in Arms Act was passed in 2005, after the National Rifle Association made its passage a priority in order to shield gun manufacturers and sellers from lawsuits. Suits filed in the 1990s and early 2000s argued that they should make their products safer or track where their products are sold. The NRA’s Wayne LaPierre called the PLCAA “the most significant piece of pro-gun legislation in 20 years.”Sanders voted for the legislation; Clinton voted against it.Sens. Richard Blumenthal (D-Conn.) and Chris Murphy (D-Conn.) introduced the Equal Justice for Gun Violence Victims Act, which would repeal the law, Wednesday. While Sanders resisted any suggestion that his vote was a mistake, he had inched towards saying that he would be open to revisiting the issue. Blumenthal and Murphy’s bill provided gun safety advocates with an opportunity to press Sanders and he announced support for it just before the last Democratic primary debate this month. Clinton's campaign said he was flip-flopping on the issue. On Thursday, Sanders said he would co-sponsor the legislation, dropping a previous demand he had made that the law must contain protections for small gun shops for him to put his name on the bill.Gun rights advocates pushing for PLCAA argued that lawsuits would bankrupt gun makers and sellers. But safety supporters advocating for its repeal say that the mere fact that plaintiffs would have a right to go to court under their legislation doesn’t mean they’ll succeed. They also argue that lawsuits have successfully changed the way the tobacco industry markets its products and helped ensure the safety of motor vehicles, so the gun industry should be held to the same standards of care. “Repealing PLCAA would not mean anyone would automatically be held liable -- it would merely put gun makers and dealers on equal footing with everyone else. But while the law remains on the books, our absurd reality is that the gun industry, which sells the most dangerous consumer product on the market, is subject to the lowest duty of care in the country,” Blumenthal and Schiff wrote in a post on Medium Wednesday. “By providing this unique immunity, Congress has effectively empowered the gun industry to ignore best practices and act with impunity. Rather than adopting commonsense policies that could reduce the deadly tide of gun violence across the nation, negligent sellers and manufacturers are protected from the consequences of their actions.”Dan Gross, the president of the Brady Campaign to End Gun Violence, which has endorsed Clinton, celebrated Sanders’ co-sponsorship of the bill Thursday.“This great victory is proof of what can happen when the public holds politicians accountable -- which is happening on the gun violence prevention issue like never before,” Gross said in a statement. “Senator Sanders has defended his checkered record on gun safety very comfortably until very recently – until the American people held his feet to the fire. They knocked on his door and flooded his office with phone calls demanding action. And Sanders finally took notice. His next step must be to champion this legislation in Congress.”Gross pointed out that the family of Josh Adames, who was accidentally shot and killed by a friend in 2001, met with Sanders’ senate staff Wednesday. Hours after that meeting, Sanders’ office reached out to the Brady campaign to say he’d cosponsor the legislation.Adames was killed while visiting his friend's home in Chicago. His friend, who wanted to show off his father’s gun, removed the gun’s magazine and fired at Adames, thinking there were no longer any bullets in the weapon. But a bullet still in the chamber hit Adames in the stomach. His family’s lawsuit against Beretta, the maker of the gun, claimed that the company failed to put proper warnings or safety mechanism on the gun. But PLCAA blocked their suit in the Supreme Court, which declined to consider it in 2009.Hector Adames, Josh’s uncle, told The Huffington Post Wednesday that they were happy with Sanders' support of the legislation and that “any help, whether it comes early or late, is well received.”“We respect the politicians who realize it was a mistake and try to amend the mistake,” he added. “The problem was refusing to change, that hurts the cause, when there's no growth there.”Congressman Adam Schiff (D-Calif.), who is sponsoring the law in the House, said that “it was a tragedy that this bill was passed in the first place,” when asked at a press conference Thursday about whether he, Blumenthal and Murphy were pushing their legislation because of the attention PLCAA has gotten in the Democratic primary. “Without personalizing it to the presidential candidates … the harm has already been done,” he added."
