,category,headline,authors,link,short descr,date,image_caption(s),image_link(s),article
22,ENTERTAINMENT,Kanye West Calls Out Taylor Swift For Her Success Again,Carly Ledbetter,https://www.huffingtonpost.com/entry/kanye-west-calls-out-taylor-swift-again_us_56cdb7d9e4b0928f5a6dcac5,"Haters gonna hate, hate, hate, hate ...",2016-02-24,"Taylor Swift during the 58th Annual Grammy Awards on Monday, Feb. 15, 2016. ",https://img.huffingtonpost.com/asset/56cdc20d1500002a000b098d.jpeg?ops=scalefit_720_noupscale,"Kanye West is at it again. ""The Life of Pablo"" rapper tweeted up a storm on Tuesday night, first calling out music producer Bob Ezrin for giving his new album a bad review. Toward the end of his rant, West decided to call out Taylor Swift (again) by insulting her past accomplishments at the Grammys.""I made 'Dark Fantasy' and 'Watch the Throne' in one year and wasn't nominated for either and you know who has 2 albums of the year."" Early Wednesday morning, West continued to talk about Swift during an appearance at LA hotspot 1 Oak. ""I called Taylor,"" West said in video obtained from the club. ""I said 'Taylor, I talked to my wife about it.' I said 'How you feel about this line, Taylor?' I was like 'Taylor, I feel like me and you might still have sex.' She said ""Oooh, Kanye I like that line."" West caused controversy with his line about Swift when he premiered his song, ""Famous,"" at the Yeezy Season 3 launch at Madison Square Garden. In the song, West raps the line he mentioned above: ""I feel like me and Taylor might still have sex / I made that bitch famous.""Though the rapper later insisted he ""never dissed"" Swift and that she signed off on the lyrics, Swift's rep was quick to deny his side of the story. ""Kanye did not call for approval,"" a rep for Swift said in a statement. ""But to ask Taylor to release his single 'Famous' on her Twitter account. She declined and cautioned him about releasing a song with such a strong misogynistic message. Taylor was never made aware of the actual lyric, 'I made that bitch famous.'""Swift, being Swift, responded to West like a goddamn professional during her Album of the Year acceptance speech at the Grammys earlier this month.""As the first woman to win Album of the Year at the Grammys twice, I want to say to all the young women out there: There are going to be people along the way who will try to undercut your success or take credit for your accomplishments or your fame,"" Swift said. ""But if you just focus on the work and don't let those people sidetrack you, someday when you get where you're going, you'll look around and you'll know that it was you and the people who love you who put you there. And that will be the greatest feeling in the world."" Leave it to Swift to turn an unsavory moment into an inspirational speech. We doubt she'll respond to this jibe until she's holding her third Album of the Year award. Also on HuffPost: "
23,POLITICS,North Carolina Republicans Vow Showdown Over Trans Rights,"Nadya Agrawal, Guest Writer",https://www.huffingtonpost.com/entry/charlotte-passes-bathroom-bill-to-protect-trans-people-and-conservatives-arent-happy_us_56cdd1e8e4b0928f5a6de60c,"""I think it's just inappropriate,"" state Sen. David Curtis said of a new bill to protect trans people.",2016-02-24,"A bill passed in Charlotte, North Carolina, would allow transgender residents to use the bathrooms that align with their gender identities. Republican politicians in the state aren't happy.",https://img.huffingtonpost.com/asset/56cdf9481e00002200702b27.jpeg?ops=scalefit_720_noupscale,"North Carolina state legislators are vowing to reverse a new law in Charlotte that aims to protect lesbian, gay, bisexual and transgender residents against discrimination from businesses. In a 7-4 vote Monday, the City Council of Charlotte approved broad civil rights protections for LGBT people, including prohibiting businesses from discriminating against LGBT patrons. The law also allows transgender customers to use the bathroom of their choice, a measure conservative state politicians have taken issue with.North Carolina state Sen. David Curtis (R), Rep. Jason Saine (R) and Gov. Pat McCrory (R) have all said they will work to reverse the so-called ""Bathroom Bill.""""I think it's just inappropriate. We have rules in our society and that's just one of the rules in our society,"" Curtis old the Lincoln Times-News. ""This liberal group is trying to redefine everything about our society. Gender and marriage -- just the whole liberal agenda. I don't think we should let national criticism stop us from doing what we should do.""Conservative lawmakers say that allowing transgender patrons to use the bathrooms that correlate to their gender identities could create possible dangers for other customers. “It is not only the citizens of Charlotte that will be impacted by changing basic restroom and locker room norms but also citizens from across our state and nation who visit and work in Charlotte,” McCrory said, according to the Charlotte Observer. ""This shift in policy could also create major public safety issues by putting citizens in possible danger from deviant actions by individuals taking improper advantage of a bad policy.""The ACLU of North Carolina praised the council's decision. “With this vote, North Carolina’s largest city has affirmed that all people deserve to be treated fairly and protected by the law,” acting Executive Director Sarah Preston said in a statement. “When a business decides to open its doors to the public, it should be open to everyone on the same terms. We applaud Charlotte’s council members for making their city more safe, welcoming, and inclusive, and we urge municipal leaders across the state to follow their example.”Bills that protect LGBT rights have come under fire in recent years because of their inclusion of clauses that allow transgender citizens to access bathrooms based on their gender identity.Last February, former Arkansas Gov. Mark Huckabee joked that he wished he had found his ""feminine side"" in high school so that he could have showered with female students.Conservative lawmakers passed a bill last week in South Dakota that would punish transgender citizens for using the ""wrong"" bathroom. California, by contrast, has battled hard to maintain its ""Privacy for All"" law that protects transgender citizens. Also on HuffPost:"
24,POLITICS,North Carolina Republicans Vow Showdown Over Trans Rights,"Nadya Agrawal, Guest Writer",https://www.huffingtonpost.com/entry/charlotte-passes-bathroom-bill-to-protect-trans-people-and-conservatives-arent-happy_us_56cdd1e8e4b0928f5a6de60c,"""I think it's just inappropriate,"" state Sen. David Curtis said of a new bill to protect trans people.",2016-02-24,"Gov. Pat McCrory says the bill could ""create major public safety issues"" for North Carolina residents.",https://img.huffingtonpost.com/asset/56cddcb01e0000220070ea78.jpeg?ops=scalefit_720_noupscale,"North Carolina state legislators are vowing to reverse a new law in Charlotte that aims to protect lesbian, gay, bisexual and transgender residents against discrimination from businesses. In a 7-4 vote Monday, the City Council of Charlotte approved broad civil rights protections for LGBT people, including prohibiting businesses from discriminating against LGBT patrons. The law also allows transgender customers to use the bathroom of their choice, a measure conservative state politicians have taken issue with.North Carolina state Sen. David Curtis (R), Rep. Jason Saine (R) and Gov. Pat McCrory (R) have all said they will work to reverse the so-called ""Bathroom Bill.""""I think it's just inappropriate. We have rules in our society and that's just one of the rules in our society,"" Curtis old the Lincoln Times-News. ""This liberal group is trying to redefine everything about our society. Gender and marriage -- just the whole liberal agenda. I don't think we should let national criticism stop us from doing what we should do.""Conservative lawmakers say that allowing transgender patrons to use the bathrooms that correlate to their gender identities could create possible dangers for other customers. “It is not only the citizens of Charlotte that will be impacted by changing basic restroom and locker room norms but also citizens from across our state and nation who visit and work in Charlotte,” McCrory said, according to the Charlotte Observer. ""This shift in policy could also create major public safety issues by putting citizens in possible danger from deviant actions by individuals taking improper advantage of a bad policy.""The ACLU of North Carolina praised the council's decision. “With this vote, North Carolina’s largest city has affirmed that all people deserve to be treated fairly and protected by the law,” acting Executive Director Sarah Preston said in a statement. “When a business decides to open its doors to the public, it should be open to everyone on the same terms. We applaud Charlotte’s council members for making their city more safe, welcoming, and inclusive, and we urge municipal leaders across the state to follow their example.”Bills that protect LGBT rights have come under fire in recent years because of their inclusion of clauses that allow transgender citizens to access bathrooms based on their gender identity.Last February, former Arkansas Gov. Mark Huckabee joked that he wished he had found his ""feminine side"" in high school so that he could have showered with female students.Conservative lawmakers passed a bill last week in South Dakota that would punish transgender citizens for using the ""wrong"" bathroom. California, by contrast, has battled hard to maintain its ""Privacy for All"" law that protects transgender citizens. Also on HuffPost:"
25,POLITICS,"If Fourth-Year Presidents Shouldn't Do Things, How About Sixth-Year Senators?",Michael McAuliff,https://www.huffingtonpost.com/entry/supreme-court-lame-duck-senators_us_56cdd9d6e4b0928f5a6dea9a,What's sauce for the goose is sauce for the gander in the Supreme Court standoff.,2016-02-24,"GOP Sens. John McCain, Kelly Ayotte and Lindsey Graham think President Obama shouldn't fill the Supreme Court vacancy.",https://img.huffingtonpost.com/asset/56cde2fc1500002a000b09ba.jpeg?cache=ThuULCA3M6&ops=crop_9_18_4824_2182%2Cscalefit_720_noupscale,"WASHINGTON -- President Barack Obama is in the last year of his second term, Republican senators argue, so he should no longer have a say in something so important as who sits on the Supreme Court. Let's wait for the voters to weigh in this fall, they say.But Obama isn't the only elected official in the last year of his term who has a key role in choosing the next justice, whose party may or may not hold onto his power post, and who generally makes consequential decisions.The GOP logic seems to be that voters may have changed their minds about what sorts of leaders they want over the past three years, so rather than let Obama function for his full four-year term, the Senate should stall him. Beyond the Supreme Court vacancy, Republicans have also refused to hold hearings on Obama's budget, and one senator had himself recorded throwing Obama's final proposal to close the Guantanamo Bay, Cuba, prison base into the trash.If after a mere three years, however, Obama has lost his mandate, what about those other elected officials who haven't gone before the voters in five years?There are 34 senators serving the final years of their six-year terms. Ten of them are Democrats, and 24 are Republicans, including at least seven facing difficult re-election fights. One of those going before the voters this fall is Chuck Grassley (R-Iowa), the chairman of the Senate Judiciary Committee, which in theory holds hearings on Supreme Court nominees.The logic that says a president shouldn't be allowed to make a consequential appointment in his final year would seem to indicate those ""lame duck"" senators shouldn't be allowed to cast consequential votes. One might even suggest that argument is stronger against senators, who are one among one hundred, than against the singular president.""I don't have any idea what that means,"" said Sen. Lindsey Graham (R-S.C.), another member of the Judiciary Committee, when presented with the lame-duck senator scenario. Both Grassley and Graham, who is not currently up for re-election, signed a letter Tuesday vowing that the Judiciary Committee would not hold hearings on an Obama nominee to the Supreme Court.Graham had just left a news conference with Sens. Kelly Ayotte (R-N.H.) and John McCain (R-Ariz.) denouncing Obama for proposing to close the Gitmo prison camp.""It's a ridiculous analogy, but I appreciate it,"" said Ayotte, who is facing a tough electoral challenge this year from New Hampshire Gov. Maggie Hassan (D).Democrats weren't so sure that the analogy was ridiculous, although one at least didn't think senators should stop doing their jobs voting or evaluating nominees.""I'd not thought about that,"" said Sen. Tim Kaine (D-Va.), who is not up for re-election in 2016. ""I haven't thought about that because that would be an extension of their logic. I reject their logic.""Graham insisted that Republicans were taking a principled stand because it was rare in U.S. history for a president to replace a justice in an election year when the Senate is controlled by the opposing party.""All I can tell you is that in the history of the Republic, we had one [Supreme Court] judge confirmed in an election year where you had ... different parties holding the White House and the Senate,"" Graham said, presumably referring to the confirmation of Democratic President Grover Cleveland's nominee by a Republican-led Senate in 1888.There is actually a second example: A Democratic-controlled Senate confirmed Justice Anthony Kennedy in 1988, the last year of President Ronald Reagan's second term. But GOP senators have repeatedly insisted that doesn't count because Kennedy was nominated in late 1987.Graham also insisted that Democrats would do the same in reversed circumstances.""You're never going to convince me that they would do anything different than what we've done,"" he said.Kaine disagreed, suggesting that the blockade on Obama is much more personal than principled.""In some ways, this isn't even about the court -- it's about fundamental disrespect for the president. They wouldn't have a hearing on his budget,"" Kaine said. ""That's never happened before.""While he didn't suggest that the GOP should stop working, Kaine added that the Democrats wouldn't stop pushing the Republicans to relent.""We're not going to drop it,"" Kaine said. ""When the president nominates an individual ... it's going to be somebody highly qualified. There will be a real person on the table -- maybe some person who has received in the past a lot of Republican support -- and we will be able to demonstrate to the American public the outrageous nature of the Senate refusing to do one of the parts of its job description."""
26,GOOD NEWS,"When Woman With Down Syndrome Got Stage Fright, Her Friend Came To The Rescue",Kimberly Yam,https://www.huffingtonpost.com/entry/when-woman-with-down-syndrome-gets-stage-fright-her-friend-comes-to-the-rescue_us_56cdd20de4b0ec6725e49b0e,Because that's what friends are for.,2016-02-24,"Hawks, comforting his friend during her big moment. ",https://img.huffingtonpost.com/asset/56cdf1b31e00002200702b17.png?ops=scalefit_720_noupscale,"When it came time for this woman's big moment, she got by with a little help from her friend. Suzy Cloutier, a 28-year-old who has Down syndrome, spoke at an event for nonprofit STRIVE, which helps individuals with developmental disabilities in South Portland, Maine, last week, according to WGME. After seeing the crowd there, Suzy got a bit nervous and had a tough time moving along in her speech.However, Cloutier's 25-year-old friend Chandler Hawks, who also has Down syndrome, had her back. He walked up to the podium and gave the woman a much-needed hug, giving her the fuel she needed to finish her speech with flying colors. The uplifting gesture, which was caught on camera by local news station WGME, is the definition of pure friendship. Watch as Hawks goes up to the 28-year-old and asks if she's OK, while he wraps his arms around her to comfort the speaker. It's clear that the hug did the trick. ""OK, I can do it now,"" Cloutier says. Hawks returns to the crowd, jumping up and down with excitement for his friend. According to WGME, the event was a celebration for the nonprofit's expansion of its facility. Cloutier, who has participated in the organization's programs since she was a teenager, was delighted when she was asked to speak at the event. However, the crowd of about 200 people was a little shocking for Cloutier, whose speech was about her experiences with STRIVE, according to ABC News.""From the time she started talking, it took her that long to process that she was speaking in front of that many people,"" Cloutier's mother, Peggy, told the outlet. That reaction time is very typical for her.Luckily, Hawks made it all better, and the 28-year-old finished her speech like a pro, and telling the crowd about the fun activities she's done because of the nonprofit, including learning how to cook, dancing and -- most importantly -- making friends, according to WGME. Every BFF should strive to be like Hawks! Also on HuffPost: "
27,POLITICS,"Obama Has A Plan To Bring Paid Leave To 828,000 Workers",Dave Jamieson,https://www.huffingtonpost.com/entry/obama-paid-leave_us_56cdf6bbe4b041136f1923c8,Here's how it would work.,2016-02-24,President Barack Obama's executive order on paid leave would guarantee workers under federal contracts could accrue up to a week per year.,https://img.huffingtonpost.com/asset/56cdf8281500002b000b09e8.jpeg?ops=scalefit_720_noupscale,"More than 800,000 U.S. workers may be getting more paid sick leave on their jobs, thanks to a federal rule outlined by the Labor Department on Wednesday.The proposal, set in motion by an executive order from President Barack Obama in September, would guarantee that workers under federal contracts could accrue up to a week of paid leave per year. Companies that want to maintain their business with the government would be required to offer the leave as a benefit.For now, the rule remains just a proposal, and it has to go through a period of public comment before it can be finalized and go into effect. Republicans and business groups oppose the plan, so administration officials would want to implement the rule before a Republican potentially takes over the White House next year and undoes it.In a blog post outlining the proposed rule, Labor Secretary Tom Perez said an estimated 828,000 workers would be getting some amount of paid leave that they didn't get before. Roughly 437,000 of those workers currently get no paid leave at all, he added.""I’m looking forward to a day when working moms and dads can afford to stay home with their sick kids, when a younger worker can take paid sick leave to care for an ailing grandparent and a husband can use his earned sick time to care for his wife -- all without fear of losing a day’s pay or their livelihood,"" Perez wrote. ""Today, we’re one step closer to making it happen.""The U.S. is an outlier among wealthy countries in not guaranteeing paid sick days for workers. In lieu of a federal mandate, it's left up to individual businesses to decide whether workers can take paid time off when they or their family members are ill. A handful of states and local governments have implemented their own paid sick leave mandates recently, but the Bureau of Labor Statistics estimates that some 44 million workers still receive no paid leave. Those without the benefit are more likely to be working in low-wage industries such as restaurants and retail, where many workers can't afford to go without a day's pay.Like raising the minimum wage, expanding paid leave has become a common theme in Obama's speeches about building a fairer economy. As The Huffington Post pointed out early last year, issuing an executive order requiring contractors to provide paid sick days would be one of the easiest ways for the White House to unilaterally bolster paid leave in the U.S.Issuing such a mandate is perfectly within the administration's power. But without additional action from Congress, the rule is inherently limited, only covering work that's done under federal contracts. That's why the rule would impact hundreds of thousands of workers, as opposed to many millions. Still, there's a long history of presidents using the government's contracting power to send a message to private-sector employers and influence working standards in the broader economy. Under the proposed plan, how much paid leave workers are guaranteed depends on how much they work. For every 30 hours they log, they would accrue at least one hour of paid time off. The amount would be capped at 56 hours -- or seven days -- for the year. Workers could use the time to care for themselves or a loved one who's sick or suffered domestic violence or a sexual assault. If employers already have leave plans that meet those minimum requirements, they don't have to change anything.Workers could carry their unused time over into a new year, though employers wouldn't have to allow them to cash out their unused time when they leave the job. And employers could require that workers show proof of the illness -- like a doctor's note or a hospital bill -- in order to use three or more days of their paid time in a row.The rule would apply only to firms who secure new contracts with the government starting next January, and employees would only be guaranteed leave if they're working under those contracts.Elsewhere on HuffPost:"
28,POLITICS,"Donald Trump Likely Won Among Nevada Latinos, But Don't Read Too Much Into It",Ariel Edwards-Levy,https://www.huffingtonpost.com/entry/donald-trump-latino-vote-nevada_us_56cddc7de4b041136f190024,It doesn't mean Latinos love him.,2016-02-24,A victory among Nevada GOP caucus-goers isn't as yuuuge of a deal as it looks.,https://img.huffingtonpost.com/asset/56ce032f1e0000230070eac8.jpeg?ops=crop_15_10_2542_1533%2Cscalefit_720_noupscale,"Donald Trump, who has spent much of his presidential campaign loudly disparaging Latino immigrants, seems to have won a plurality of the Latino vote in Nevada's GOP caucus on Tuesday.Per entrance polls, he had the support of 45 percent of Latino caucus-goers to Florida Sen. Marco Rubio's 28 percent and Texas Sen. Ted Cruz's 18 percent. That's very close to the 47 percent Trump apparently took among white caucus-goers.The statistic, while striking, needs a few caveats. Entrance polls, like other surveys, aren't an exact science, especially when it comes to very small populations. Just 132 of the caucus-goers surveyed were Latinos, giving the results a margin of error of plus or minus 10 percent.Measuring opinions among Latino voters can be especially tricky. Entrance polls for Nevada's Democratic caucus last weekend showed Sen. Bernie Sanders doing unexpectedly well among those voters, sparking a wave of controversy about their accuracy.Still, even if Tuesday's poll numbers don't exactly match the actual vote, they show Trump carrying significant support from a group he has repeatedly denigrated.""I still think we can be pretty confident that Trump won the Hispanics who caucused last night,"" exit pollster Joe Lenski of Edison Research told HuffPost in an email. ""He won just about every demographic group.""Rubio, who came in second in the Nevada caucus, offered one explanation for Trump's success on Wednesday.""Americans of Hispanic descent ... care about the future of our country. They care about everything else people care about. They care about jobs. They care about terrorism. They're impacted by illegal immigration negatively in communities that are overrun by that,"" Rubio said in a Fox News interview.Trump's supporters, though, aren't a good representation of Nevada Latinos as a whole. Most of them don't vote Republican, as political scientist David Damore highlighted in this chart, based on the entrance polls and an analysis of party identification:Because not all voting-age Americans register to vote or end up caucusing, those who do turn out are likely an even smaller fraction of the population as a whole. Lenski estimates that about 1 percent of all Nevada's voting-age Latinos turned out on Tuesday.And while Nevada's few Latino Republicans might like Trump as much as the state's white Republicans do, the same isn't true for Latinos across the United States. National polls consistently show that most hold deeply negative views of Trump, even in comparison to other Republican candidates."
