,category,headline,authors,link,short descr,date,image_caption(s),image_link(s),article
5,PARENTING,Yahoo's Marissa Mayer Is in a Lose-Lose Battle,"BabyPost, Contributor
Canada’s Newest Parenting Destination!",https://www.huffingtonpost.com/entry/yahoos-marissa-mayer-is-i_us_5b9cdfa9e4b03a1dcc8299bc,"As a woman I understand that my role as a parent shouldn't factor into the way I'm viewed professionally. But also, as a women, I think it is imperative that our commitments to our family be respected and demanded.",2013-03-05,"FILE- In this Monday, April 19, 2010 file photo, Google vice president of search products and user experience, Marissa Mayer, attends the 2010 Matrix Awards presented by the New York Women in Communications at the Waldorf-Astoria Hotel in New York. Yahoo announced Monday, July 16, 2012, that it is hiring longtime Google executive Marissa Mayer to be its next CEO, the fifth in five years as the company struggles to rebound from years of financial malaise and internal turmoil. Mayer, who starts at Yahoo Inc. on Tuesday, was one of Googleￂﾒs earliest employees and was most recently responsible for its mapping, local and location services. (AP Photo/Evan Agostini)",https://img.huffingtonpost.com/asset/5b9cdfa9240000510094db5b.jpeg?ops=scalefit_720_noupscale,"Written by Leslie Kennedy for BabyPost.com Marissa Mayer is in a lose-lose battle. The Yahoo! CEO notoriously took a two-week maternity leave, calling into question her commitment or even her desire for a work-life balance. Many women who looked at the pregnant CEO of the Internet powerhouse were left wondering why someone who had the potential to be an amazing advocate or example to working women, instead ostensibly said ""children shouldn't impact time spent at work any more than a bad case of the flu.""As a woman I understand that my role as a parent shouldn't factor into the way I'm viewed professionally. But also, as a women, I think it is imperative that our commitments to our family be respected and demanded.Last week, Mayer called to an end the ability for employees to telecommute.Said Mayer: ""To become the absolute best place to work, communication and collaboration will be important, so we need to be working side-by-side. That is why it is critical that we are all present in our offices. Some of the best decisions and insights come from hallway and cafeteria discussions, meeting new people, and impromptu team meetings. Speed and quality are often sacrificed when we work from home.""Related: Federal Court: Employers Must Try to Accommodate Child Care Needs of StaffAccording to Mayer, speed and quality of work are sacrificed by accommodating schedules. According to a wack of studies listed conveniently on Mommyish.com, the reality is something quite different. In fact, flex schedules and telecommuting have been a great step forward in the work force, recognizing the various needs of people's lives outside the office.Mayer's recent policy change is reflective of a corporate culture that espouses that your first and only commitment should be to your job. Thing is, no one exists in a vacuum and being chained to a desk will negatively affect morale and thus drive and productivity. That's not my opinion. That's fact.The latest news out of Yahoo! is that Mayer is setting up a nursery in her office so that she can be close to her child. This would call into question the notion that she doesn't think work-life balance is important, but for the fact she isn't offering this as an option to any other employees. What she is doing, instead, is accommodating her own life while taking away the one accommodation her employees have to make their own personal situations easier.Anyone who has read anything about Marissa Mayer has been left with the impression that she's a cold fish who is a calculating, heartless, career-bent CEO. But, in fairness, how much does the public know, ask or care about male CEOs and their work-life balance? What Mayer is doing, though maybe too well, is separating the voyeuristic interest in her private life by making little mention of it. The sad but all too true reality is that for women to be taken seriously in business they can't talk about their families. They need to be seen as focused on their job and only their job. Men don't have those same challenges. Not talking about their children doesn't make them cold. It makes them business minded. No questions asked. No judgement. Marissa Mayer has been quoted as saying her priorities are ""God, family and Yahoo! -- in that order."" How her personal life philosophy falls into what can only be described as a major step backwards in the workplace is beyond me. It's either a classic case of 'do as I say but not as I do' or she's selling a life philosophy but living another.Anyway you slice it, Mayer is adding to the feeding frenzy of interest into intricacies of her private life by making it less possible for her thousands of employees to live theirs the same way before she took the helm.More on BabyPost What Not to Say to Your Child-free Friends Walt Disney World on a Budget Rebecca Eckler: Why I Care What My Son Wears"
6,WELLNESS,GPS Guide: Kathy Andersen's Awareness Meditation,,https://www.huffingtonpost.com/entry/gps-guide-kathy-andersons_us_5b9ce2c1e4b03a1dcc82b201,"Kathy Andersen is an international success coach, award-winning author and Harvard-trained leadership expert, who teaches",2013-03-05,Your awareness begins with creating a pause in your day and adventuring within.,https://img.huffingtonpost.com/asset/5b9ce2be2500003500363f44.jpeg?ops=scalefit_960_noupscale,"The stress and strain of constantly being connected can sometimes take your life -- and your well-being -- off course. GPS For The Soul can help you find your way back to balance. GPS Guides are our way of showing you what has relieved others' stress in the hopes that you will be able to identify solutions that work for you. We all have de-stressing ""secret weapons"" that we pull out in times of tension or anxiety, whether they be photos that relax us or make us smile, songs that bring us back to our heart, quotes or poems that create a feeling of harmony, or meditative exercises that help us find a sense of silence and calm. We encourage you to look at the GPS Guide below, visit our other GPS Guides here, and share with us your own personal tips for finding peace, balance and tranquility.In her GPS Guide below, Kathy Anderson leads a soothing mediation with six positive actions and affirmations that will help increase your awareness for a more fulfilling day.Kathy Andersen is an international success coach, award-winning author and Harvard-trained leadership expert, who teaches people how to become their most successful in their lives, businesses and organizations. Kathy's award-winning book, ""Change Your Shoes, Live Your Greatest Life,"" shows how anyone can overcome difficult circumstances to achieve their dreams. Learn more at www.KathyAndersen.com.For more GPS Guides, click here. "
7,PARENTING,My Child Will Miss Out: Parenting and Disabilities,"Brenda Rothman, Contributor
Writer at Mama Be Good",https://www.huffingtonpost.com/entry/parenting-and-disabilities_us_5b9ce328e4b03a1dcc82b57e,"Children with a disability do not have a life ""minus."" They have a life, period. It's their life. It's not some other child's life, their parent's life or their peers' life. It's their life.",2013-03-05,"A young boy is sitting on a swing set and looking at a shadow figure of a man or bully at a playground. Use it for a kidnap, defense or safety concept.",https://img.huffingtonpost.com/asset/5b9ce3282500003500363f76.jpeg?ops=scalefit_720_noupscale,"When we parents worry about our children with disabilities, like autism, we often experience a sense of loss, a bittersweet realization that our child will miss out on what they consider a ""normal"" childhood experiences. I felt the same thing. I wanted to understand why I felt this to be true and why it made me sad.""My child will miss out."" Is that true? It's true that my child will not experience things that other kids do. He already has. His peers went to daycare, pre-K and elementary school. They've had kindergarten graduation, grandparents' day and moms visiting the class to read books. They've had good teachers and bad teachers. They've been on field trips. They play sports on a team. They've gone over to friends' houses for playdates and sleepovers. They ride bikes and scooters. They've seen Star Wars. My child has not experienced those things.He will not experience the things I did growing up, either. No memories of a first-grade teacher like mine who wanted to be an astronaut, even though she walked with a cane. No friends he can look at and say ""Dear Lord, we've been friends since elementary school."" No chasing after an ice cream truck or playing kickball in the yard. No tree-climbing or bike races.So it is true that he won't experience the same things. Why does that make me feel sad? It's because my entire frame of reference is wrong. Consider it this way: I grew up in Florida. I remember areas outside the city that were rolling hills of orange groves. Orange tree after orange tree. Dark green leaves, bright orange dots, the fragrance of orange blossoms. I loved that smell. Now, when I drive back to visit I say, ""See those hills where all those houses are? There used to be orange trees there."" It's sad, poignant -- for me. But someone growing up there now never knew the orange groves. They grow up in those rolling hills of houses and say, ""See, that house there? My grandmother lives there. I used to rollerblade down that hill. It's awesome.""When I try to imagine how my child feels about life, I take my childhood and try to imagine my life minus those experiences. But that's a fallacy. Anytime I try to subtract my experiences, I will feel a sense of loss. That same sadness happens when I imagine what I think is a ""normal"" childhood, an ideal childhood, that comes with a list of all the experiences a child needs for a great childhood. Karate, Valentines, music lessons, ballet, team sports, schoolmates, formal dances, first car, spring break, college visits. Any missed experience means that I have to cross that item off his list. A missed experience means a less-than-ideal childhood. Always. It's a flawed paradigm for any child.Children with a disability do not have a life ""minus."" They have a life, period. It's their life. It's not some other child's life, their parent's life or their peers' life. It's their life.A complete childhood has nothing to do with specific experiences. A complete childhood does have certain qualities: connectedness, optimism, playfulness, a passion for things that interest them, a feeling of proficiency at things they want to do and a feeling of being loved wholeheartedly for who they are right now. That's the list that matters."
8,TRAVEL,Hotel Room Prices Stay Low As Europe Gets Affordable (INFOGRAPHIC),,https://www.huffingtonpost.com/entry/hotel-room-prices-stay-low_us_5b9ce390e4b03a1dcc82b9c1,"Over the course of the last year, the price of European hotel rooms has increased by only 1 percent -- a fairly stunning",2013-03-05,"In this photo, taken Saturday, Feb. 25, 2012, at the Green Park Inn in Blowing Rock, N.C., a guest relaxes in one of the historic hotel's 52 spacious rooms. The property started as a boarding house in 1882. (AP Photo/Allen Breed)",https://img.huffingtonpost.com/asset/5b9ce3902000004e00fdc10d.jpeg?ops=scalefit_720_noupscale,"Though hotel rooms are becoming more expensive every year, the march of prices slowed in 2012 and has failed to keep pace with many other goods and services according to the Hotels.com Price Index, a study looking at trends across the hospitality industry. The new HPI shows that prices still haven't recovered to where they were hovering before the financial collapse in 2008 and that excellent deals are still available, predominantly in Europe.Over the course of the last year, the price of European hotel rooms has increased by only 1 percent -- a fairly stunning number given that the London Olympics attracted enormous crowds who paid enormous sums of money. On the other end of the spectrum, prices continued to rise more rapidly in the Pacific region, which has seen rates rocket up 21 percent in the last three years largely thanks to the reliability of business travel.These numbers don't necessarily mean that travel to Europe has become incredibly cheap -- food and transportation continue to be expensive -- but they do mean that high-end luxury is available to anyone savvy enough to find a deal. Of the 10 cities with the lowest five-star room rates, seven are in Europe. And these are desirable destinations: Berlin, Lisbon and Pisa made the list.As Europe's economic crisis churns forward, the trends of 2012 are likely to become the trends of 2013, meaning that now might be the time to visit the continent. That said, there is an argument to be made that it is really the time to visit Asia and the Pacific in an attempt to get there before it get too expensive."
