,category,headline,authors,link,short descr,date,image_caption(s),image_link(s),article
0,COMEDY,Guess What Else Hemingway Didn't Say?,"Lev Raphael, ContributorAuthor, reviewer, and blogger",https://www.huffingtonpost.com/entry/more-stuff-hemingway-neve_b_7787746.html,"It must be wonderful to be dead and keep writing. I guess when you're a genius, nothing can stop you.",2015-07-19,2015-07-19-1437299218-6403548-hemingwaywriting.jpg,https://images.huffingtonpost.com/2015-07-19-1437299218-6403548-hemingwaywriting-thumb.jpg,"It must be wonderful to be dead and keep writing. Like Hemingway. He died in 1961 but he keeps writing all kinds of snappy lines. I just saw a new posthumous quote this week: ""The first draft of anything is shit."" It's all over the Internet.Imagine the excitement of the people hearing it at a writers conference séance when he transmitted that brilliant, ineffable wisdom to them from The Other Side! Right.But if you feel unhappy about your first draft, or you want to encourage someone who just showed you a draft that could be a lot better, why not attribute the maudlin line to a master like Hemingway for comfort? Or Faulkner or Neil Gaiman or J.K. Rowling or Stephen King or Anne Rice or any writer at all.... Hell, even Snooki might inspire some people because her name is on books, right? If they're desperate enough.Quote-mongers who are overly reliant on Google and Goodreads fall into the Famous Writer Quotation Trap all the time: they don't bother checking for a source. They also don't bother checking to see if there's a web site which might list that quote as not being by the author. Yes, web sites like that really exist for famous writers. Of course, there's always Bartlett's Familiar Quotations or The Oxford Dictionary of Quotations.... If you're embarrassed to go old-school, you don't have to tell anyone.How bad does spreading bogus quotations get? Check out the lines below. People who seriously think they're by Hemingway, well, they haven't read him. And if they have read him, maybe they were multi-tasking at the time, or stoned, or really just don't get Hemingway. When it comes to quoting someone, I like to follow Madonna's advice: ""Make sure a quote doesn't bite you on the ass--unless that turns you on.""(I made that up, of course)Lev Raphael is the author of the novel The German Money, which The Washington Post compared to Philip Roth, John le Carré, and Kafka--and 24 other books in genres from memoir to mystery which you can find on Amazon."
1,COMEDY,Guess What Else Hemingway Didn't Say?,"Lev Raphael, ContributorAuthor, reviewer, and blogger",https://www.huffingtonpost.com/entry/more-stuff-hemingway-neve_b_7787746.html,"It must be wonderful to be dead and keep writing. I guess when you're a genius, nothing can stop you.",2015-07-19,2015-07-13-1436816773-6112462-Beforeyouactlisten_Beforeyoureactthink_Beforeyouspendearn_Beforeyoucriticizewait_Beforeyouprayforgive_Beforeyouquittry_ErnestHemingway.png,https://images.huffingtonpost.com/2015-07-13-1436816773-6112462-Beforeyouactlisten_Beforeyoureactthink_Beforeyouspendearn_Beforeyoucriticizewait_Beforeyouprayforgive_Beforeyouquittry_ErnestHemingway-thumb.png,"It must be wonderful to be dead and keep writing. Like Hemingway. He died in 1961 but he keeps writing all kinds of snappy lines. I just saw a new posthumous quote this week: ""The first draft of anything is shit."" It's all over the Internet.Imagine the excitement of the people hearing it at a writers conference séance when he transmitted that brilliant, ineffable wisdom to them from The Other Side! Right.But if you feel unhappy about your first draft, or you want to encourage someone who just showed you a draft that could be a lot better, why not attribute the maudlin line to a master like Hemingway for comfort? Or Faulkner or Neil Gaiman or J.K. Rowling or Stephen King or Anne Rice or any writer at all.... Hell, even Snooki might inspire some people because her name is on books, right? If they're desperate enough.Quote-mongers who are overly reliant on Google and Goodreads fall into the Famous Writer Quotation Trap all the time: they don't bother checking for a source. They also don't bother checking to see if there's a web site which might list that quote as not being by the author. Yes, web sites like that really exist for famous writers. Of course, there's always Bartlett's Familiar Quotations or The Oxford Dictionary of Quotations.... If you're embarrassed to go old-school, you don't have to tell anyone.How bad does spreading bogus quotations get? Check out the lines below. People who seriously think they're by Hemingway, well, they haven't read him. And if they have read him, maybe they were multi-tasking at the time, or stoned, or really just don't get Hemingway. When it comes to quoting someone, I like to follow Madonna's advice: ""Make sure a quote doesn't bite you on the ass--unless that turns you on.""(I made that up, of course)Lev Raphael is the author of the novel The German Money, which The Washington Post compared to Philip Roth, John le Carré, and Kafka--and 24 other books in genres from memoir to mystery which you can find on Amazon."
2,IMPACT,New Cartoon Video Demystifies Ebola,"Georgianne Nienaber, ContributorWriter and author",https://www.huffingtonpost.com/entry/new-cartoon-video-demysti_b_7797046.html,"The Global Health Media Project has produced a cartoon video, The Story of Ebola. The video presents the Ebola virus in scientific, yet understandable terms for West African countries still facing the viral threat.",2015-07-19,2015-07-14-1436907288-5144406-9f334d5d7cff497999c75edaed78c724.jpg,https://images.huffingtonpost.com/2015-07-14-1436907288-5144406-9f334d5d7cff497999c75edaed78c724-thumb.jpg,"Remember the panic that ensued when the United States encountered its first cases of Ebola? Despite the parade of experts across our First World television screens, misinformation, fear and confusion spread faster than the virus. Imagine how a family living in a small village in Western Africa feels to see health workers clad in dehumanizing protective gear descending upon their homes. Reach deep for empathy for the family whose loved one was wrapped in a body bag and hauled away with no traditional ceremony. Consider the fear and confusion that clouds judgment and results in reactions that give a virus undeserved power.The Global Health Media Project has produced a cartoon video, The Story of Ebola, in collaboration with the International Federation of Red Cross and Red Crescent Societies (IFRC), UNICEF, and award-winning cartoonist Yoni Goodman. The video presents the Ebola virus in scientific, yet understandable terms for West African countries still facing the viral threat.The challenge was to relate the concept of an ""invisible germ"" as something that can be fought through understanding of how Ebola is spread. Preventive behavior is the key to winning the fight against Ebola. Ebola is small. Ebola is a germ. It is not a superhuman entity. Villagers have the power to take control of this disease, and the Story of Ebola tells them how to accomplish this.In an email conversation Deborah Van Dyke, Director of the Global Health Media Project, said ""We set the narrative in the communities where people are at risk so the story feels like it's about them, relatable."" Currently translated in French, Portuguese, Swahili, Kissi, Krio, Thembe, and Fular, the goal is to provide voice-overs in those and in a number of other West African languages as funds become available.The Story of Ebola is skillfully presented through the eyes of a young girl whose revered grandfather dies from the virus. The family is confused, frightened and saddened when the grandfather is taken away without the benefit of a traditional burial. This is a double loss. The health care worker, who is from the community and thankfully not a foreigner, explains how Ebola is spread and how a simple thing like regular hand-washing is a vital tool in prevention.The visuals are simple, direct and clearly understood. Purple coloring is a stand-in for the invisible virus, making it real, but less frightening. Seeing is believing. Knowledge is power. The girl's mother also contracts Ebola, but because she is treated early, survives. The drama ensues when her parents initially decide to run away, fearing that the health care workers are the source of death, instead of the virus. The young girl is the heroine of the film, convincing her frightened parents to go to the clinic immediately. Of course, the mother survives.I especially like the animated visual of the sun rising and setting to represent the passage of time. It is a very African concept. The connection with nature is soothing in the midst of the frightening drama that unfolds. The end result is that a complicated scientific message is delivered in an easy to understand format.Ebola has not been eliminated. Just this week, the New York Times reported that a young woman died hours after being admitted to an Ebola treatment unit in Liberia. This was the second Ebola fatality since Liberia was declared free of the virus on May 9. Six Liberians have been infected since then.""The new cases in Liberia show us that that our efforts should not be focussed on becoming Ebola-free, but on staying Ebola-free,"" said Savita Naqvi, UNICEF Regional Advisor on Communications for Development in a press release. ""It's not over yet and no one should drop their guard. We need to continue working with communities, keeping them engaged and vigilant, even beyond zero new cases.""Correction: Translations, but not productions, have been completed in other languages, as noted in original post."
3,BUSINESS,The Art of Storytelling - 7 Lessons From Cartoonist Liza Donnelly,"Vala Afshar, ContributorChief Digital Evangelist, Salesforce",https://www.huffingtonpost.com/entry/the-art-of-storytelling_b_7827738.html,"Liza Donnelly is a cartoonist and writer with The New Yorker Magazine, where she has been drawing cartoons about culture and politics for over thirty years.",2015-07-19,2015-07-19-1437320146-1799952-119_liza_donnelly_v1.png,https://images.huffingtonpost.com/2015-07-19-1437320146-1799952-119_liza_donnelly_v1-thumb.png,"There is no greater agony than bearing an untold story inside you. ― Maya Angelou Liza Donnelly is a cartoonist and writer with The New Yorker Magazine, where she has been drawing cartoons about culture and politics for over thirty years. Donnelly's work has appeared in many national publications and she truly is one of the top cartoonists in the world. Liza Donnelly is also the author of fifteen books and an experienced public speaker, speaking at the United Nations and the first TED Women conference.  Liza Donnelly, Cartoonist - The New Yorker Magazine Donnelly (Twiiter: @lizadonnelly) started drawing when she was little as a coping mechanism and to help make people happy. After graduating from college, Donnelly moved to New York City and worked at a museum, while submitting cartoons to the New Yorker, and within two years, Donnelly sold her first cartoon. I asked Donnelly to give us advice about the art of effective storytelling. Here are 10 ways to improve the art of storytelling:1. A good story has a beginning, a compelling middle and an endDonnelly says:I usually do single panel cartoons - a single image. In a good cartoon, the beginning and end are implied. What you're seeing is the middle of the story. You can see the back story and you can see where these people came from, and where they're going.2. A good storyteller is a great collaborator  As a cartoonist I work with my world around me, I work with the people around me. I rely on knowing what's going on around me and using it. I use what I see and what I sense and what I hear. 3. Good stories inspire and ignite reflection  Rarely do we cartoonists use phrases verbatim on people. People think we go to cocktail parties and you know eavesdrop. We don't do that. We're like sponges in a way, we pick up what's going on around us and soak up either knowingly or subconsciously and squeeze it back out. Donnelly's cartoons do have an ulterior motive. She draws cartoons hoping to get people to think about what they are doing, or to take note of something that they are doing that might be funny or wrong.4. Share stories that are important and matter to you  I try to draw about everything that I can, mostly about American life or about Americans, people in this country. I'm focusing more on women's rights because I feel like the kind of cartoon I do can get at things going on in our culture that you might not be able to get from an article, or a traditional political cartoon.5. Great storytellers know their characters It is better to be informed than opinionated. Although I do it intuitively and I go to the same people, characters that I feel comfortable with that I know something about. Most of my cartoons are making fun of my demographic, because I know my demographic and you have got to draw or write about what you know otherwise it might ring false.6. Great storytellers are able to create stories with a twist The first cartoon Donnelly sold to the New Yorker Magazine was a caption less cartoon with a twist. Paul Cezanne, the artist has a theory of three elements in nature a cone, a sphere, a cylinder. That's what he bases his art theories on, and so I just come out of art school, you know art school, so I drew a cone, a sphere, and a cylinder that's the given, and I added to the picture a TV set.7. Humor is a powerful tool in storytelling Referencing her TED talk, Donnelly spoke about the power of humor in storytelling. Women plus humor equals change, what I meant by that was that humor is a powerful tool. If you go to anybody doing stand-up, they are in a powerful position. They're standing on that stage and they have control of their audience.Donnelly concluded our interview by drawing a cartoon live. Drawing a live cartoon by one of the top cartoonist in the world was truly an extraordinary experience - perhaps one of my favorite moments of any show we've ever done since we started in 2013 (this was episode 119). To learn more about the art of storytelling and the importance of stories in how they inspire and ignite purposeful action, please watch Liza Donnelly's interview here. Please join me and Michael Krigsman every Friday at 3PM EST as we host CXOTalk -- connecting with thought leaders and innovative executives who are pushing the boundaries within their companies and their fields."
4,IMPACT,She Dreamed of Africa -- And Then She Was Sent There,"Sidonie Sawyer, ContributorBorn in France, immigrated to the USA / Features and Travel Wr...",https://www.huffingtonpost.com/entry/she-dreamed-of-africa--an_b_7827858.html,"My daughter joined the Peace Corps last year, right after graduating from college in Florida, with an International Affairs degree. She wants to be a diplomat. After having trekked the World with me during her childhood, she was still dreaming of Africa.",2015-07-19,2015-07-19-1437319920-8740874-zaziechildafrica.jpg,https://images.huffingtonpost.com/2015-07-19-1437319920-8740874-zaziechildafrica-thumb.jpg,"402 Days Done, 402 Left to Go.My daughter joined the Peace Corps last year, right after graduating from college in Florida, with an International Affairs degree. She wants to be a diplomat. After having trekked the World with me during her childhood, she was still dreaming of Africa: the culture, the music, the food, the spirits, the ancestors 'beliefs, the fabrics, everything was always drawing her to Africa.When still in school, she decided to apply to the Peace Corps and tempt fate to see where she would be shipped to, if accepted. The odds of being sent to Africa were slim, as the wonderful program has a presence in hundreds of locations around the planet.Still, she liked the opportunity to do some good, learn many things, and live in a foreign country for a little while - a while that is in fact quite not so little, as a commitment of 27 months is required of all applicants. Yes, that's two years and three months.The Application Process.For months she studied the purpose and intent of the federal program; she filled out paperwork, wrote essays, letters, forms. She gathered tons of information from her past 20 years in this world. She waited anxiously for an answer.It came in April - she was accepted in the Peace Corps program! She still had no idea where on Earth she would be asked to make a life for the next two and more years of her young existence. She had to get all her medical records since her birth, pass medical tests, get many immunizations and boosters. She read testimonials and absorbed the concept and the details of the ultimate goals of the program launched in 1961 by seating President John F. Kennedy.Its purpose, as outlined by the Peace Corps Act: ""To promote world peace and friendship through a Peace Corps, which shall make available to interested countries and areas men and women of the United States qualified for service abroad and willing to serve, under conditions of hardship if necessary, to help the peoples of such countries and areas in meeting their needs for trained manpower"".Africa! Here She Comes!Finally, 11 months after applying, the long-awaited letter came, and in mid-May she learned with great joy that she will be sent to Africa! With a few tears she added that her new country was going to be Burkina Faso. Huh? Burkina Faso? Ok, I knew it was in West Africa, and that's just about it.We grabbed our world map, spread it on the floor and looked at the massive shape of the African continent. Right at the line where desert (white) meets jungle (green), there it was: the country formerly-known as Haute Volta (in my memory of geography) was just right there, landlocked between Niger, Ghana, Ivory Coast, Benin, Mali and Togo. No Ebola in the country.The first thing she found was how remote it was from any ocean. Being a Miami-born girl, she is a beach child, a surfer, a diver, a sun-worshiper. Well, she will now have to do without all those. But she wanted this, and was happy with it.I have a feeling she was chosen to go to Burkina Faso because she speaks fluent French and that is the official tongue of the country in West Africa. Her purpose there was stated as English teacher. She still did not know her exact location. Would she be in a big city, in a small village?Only 50 Pounds of Stuff Was Allowed to go With Her.The packing of the extra-large suitcase was an adventure in itself - with a long list of items required by the Peace Corps. Then June 3rd came and we said a long goodbye at the airport. Tears and smiles, hugs and kisses. I knew it was going to be hard, but the sheer span of the enterprise was still not completely grasped by either side.Three days in Philadelphia for gathering with the other 30 team members going to the same country; one bus trip to New York City; two airlines stops later (Brussels and Ouagadougou), she finally made it to her temporary new country.Africa, at Last!A couple of days in the capital, Ouagadougou (a name that always made me smile), where they were given cell phones and many instructions, the group of 30 were shipped to Leo, in the south of the country, for their three months of training. She met a few volunteers like her from Florida, she felt good about meeting them.The training is basically about how to live in Africa. It's got nothing to do with how to teach English to African children. They learned of their final destination. Only at that point did my daughter found out that she was assigned to a small village, Bagassi, in the west of the country. They each took lessons in the dialect of their village.She learned Djula. She's good at languages - she was the most fluent in French of the entire group for that session. She made instant friends; she's good at that too.Bagassi.Once in her village, where she is the only white person, she was given a house of bricks with walls of mud - no water, no electricity, no bathroom, but a hole in the ground far away in the back field. She sleeps on a cot under a mosquito net. There is no furniture, just a few tables, used as shelves, wardrobe, cupboard, pantry.The water she can drink comes in plastic pouches. She bought a solar panel to charge her phone. We speak every Sunday. The well for washing water is a mile away and she can fill two jerrycans each day. She got a puppy for company - and that puppy just had puppies, three of them, one got stolen - village people eat animals, there's no such thing as a pet.She teaches English to 200 students of all ages. I sent her many books on ESOL and other beginners' methods. She also started a girls club for the many (all) with questions about their bodies. She put a box for secret questions the girls can ask anonymously. It's always full.When we met in Paris in March, during her first 10-day break, we came upon a translated book by Jane Fonda about the female body, that's all we could find, so thank you for that Miss Fonda, your book is helping young girls in Africa.No Regrets.My daughter says sometimes it's difficult, sometimes it's heart-wrenching, but she loves it - she cannot wait for the other year and a half! She made many friends in the village, and she travels around the country a lot, to see other volunteers and attend Peace Corps meetings.During last October's elections, the worry was to see if the military coup that took place will allow Americans to stay in the country. It did. Now for this coming vote for president, also in October, the same question remains to be answered. She has had experiences she would never have obtained in the United States. She became even more resilient, resourceful, humble, compassionate and driven. I am very proud of her - she is changing lives, and changing the world at the same time.Follow her blog - when she travels to the capital and has access to the Internet, she updates it.Questions? Comments! sidoniesawyer@gmail.com Visit my website for more stories."
5,COMEDY,Whaddya Say?,"Marcia Liss, Contributor(Almost) Famous Cartoonist",https://www.huffingtonpost.com/entry/whaddya-say_b_7827096.html,Whaddya say we go out for dinner?,2015-07-19,2015-07-19-1437307489-8380199-FantasyOutforDinner.jpg,https://images.huffingtonpost.com/2015-07-19-1437307489-8380199-FantasyOutforDinner-thumb.jpg,
