,category,headline,authors,link,short descr,date,image_caption(s),image_link(s),article
9,IMPACT,"GoFundMe Will Donate Extra $10,000 To Largest Fundraiser For Flint",Krithika Varagur,https://www.huffingtonpost.com/entry/gofundme-10k-flint_us_56a264f0e4b0404eb8f169d7,"""Raising as much money as possible for those affected by this terrible crisis.""",2016-01-22,"Flint residents Justin Roberson, age 6, and Mychal Adams, age 1, of Flint wait on a stack of bottled water at a rally where the Rev. Jesse Jackson was speaking about about the water crises at the Heavenly Host Baptist Church.",https://img.huffingtonpost.com/asset/56a2666d2a00006e0003117b.jpeg?ops=scalefit_720_noupscale,"Update: The campaigns raised a total of $405,000 for Flint residents by the contest's closing date of February 2. The contest winner was Flint resident Marseille Allen, who raised $39K in total for her campaign Water for Flint, and received an additional $10,000 donation from GoFundMe.Crowdfunding site GoFundMe just gave people an extra incentive to raise money for the Flint water crisis.The campaign that raises the most money to supply clean drinking water to Flint, Michigan, residents between Friday, Jan. 22 and Friday, Jan. 29 will receive an additional $10,000 from GoFundMe. GoFundMe CEO Rob Solomon urged uniting for a common goal in a press release.“We hope that this challenge will inspire a friendly competition between these wonderful campaign organizers, with the overall goal of raising as much money as possible for those affected by this terrible crisis,"" he said.So far, people from Michigan and around the country have created 60 campaigns to raise over $170,000 for Flint residents. On January 5, the government declared a federal state of emergency in Flint because of dangerous levels of lead in the public’s water supply. Nearly 27,000 children in the town are being treated for lead exposure, according to the Detroit News. Current efforts to help the disproportionately poor and black residents of Flint include donations of bottled water, independent research on the water supply, and a petition asking Michigan's governor to stop making residents pay for toxic water.The official contest rules can be found here. More News About The Flint Water Crisis:5 Ways You Can Help Flint, Michigan Amid The Water CrisisHow A Stubborn Pediatrician Forced The State To Take Flint's Water Crisis SeriouslyObama Calls Flint Water Crisis 'Inexplicable And Inexcusable'How The Federal Government Botched Flint's Water CrisisWhat's Happening In Flint Could Happen In Lots Of Other PlacesAlso on HuffPost:"
10,POLITICS,"Paid Family Leave Laws Aren't Crushing Business, Despite What Ted Cruz Says",Jonathan Cohn,https://www.huffingtonpost.com/entry/paid-family-leave_us_56a26e47e4b0404eb8f17190,Another conservative talking point is falling apart.,2016-01-22,Research shows paid leave is good for new dads and moms -- and not bad for their employers.,https://img.huffingtonpost.com/asset/56a2711d1f0000500021680b.jpeg?ops=scalefit_720_noupscale,"Paid family leave is finally getting serious attention in Washington and on the campaign trail, as politicians are waking up to the financial struggles of people who need time away from work to care for newborns, newly adopted children or sick relatives. But efforts to create laws guaranteeing paid leave are running into opposition from conservatives and business groups who say, among other things, that such programs will burden business and drag down the economy.Now a new report has come to the exact same conclusion that past research has: The fears of conservatives and business owners are misplaced.The report focuses on Rhode Island, which in 2013 became the third state to approve a paid leave law. Its program allows all private sector and some public sector workers up to four weeks of leave and pays out about 60 percent of salary during that time, with a cap of $790 in replacement wages a week. To qualify for the program, employees must have worked previously in Rhode Island and earned at least $11,520 there. To finance the benefits, the state imposed a small payroll tax, which officials calculated would cost just 64 cents a week for the typical employee making $40,000 a year.Rhode Island’s program took effect one year ago, and the timing of the report, one of the first to assess aspects of the law’s impact, is perfect. Paid family leave has come up repeatedly in the presidential campaign, with both former secretary of state Hillary Clinton and Sen. Bernie Sanders (I-Vt.) calling for legislation that would guarantee leave to all workers in all states -- and several Republicans coming out against such proposals. “I think maternity leave and paternity leave are wonderful things. I support them personally,” Sen. Ted Cruz (R-Texas) said in the fall. “But I don’t think the federal government should be in the business of mandating them.”Proponents argue that paid leave laws have multiple beneficial effects, and they have a lot of evidence on their side. Studies have shown that paid leave laws increase the likelihood that new parents who want to work, particularly women, can stay in the workforce over the long run. Other studies have found that access to paid leave leads to better child health, possibly because it increases the likelihood that new mothers will breastfeed -- or because paid leave allows new parents, fathers as well as mothers, to be more attentive to their newborns’ health and medical needs. In every other developed country, paid leave is a universal right. In most of the U.S., paid leave is at the discretion of the employer, which is why just 13 percent of employees have access to it right now, according to the National Partnership for Women and Families. Low- and middle-income workers are the least likely to have paid leave, since their employers are the least likely to offer the benefit. Of course, those workers are also the ones who need it the most. They’re the ones living paycheck to paycheck, using every dollar just to cover rent, food and other basic necessities. Without some kind of income, they can’t take extended time away from work.The conservatives and business leaders who oppose paid leave laws don’t generally dispute the benefits for workers and their families. They warn, instead, about the new taxes and -- especially -- the burden paid leave laws put on employers, who must fill lengthy vacancies whenever workers take time off. Such arguments came up repeatedly in 2013 in Rhode Island, when legislators there were debating about their paid leave bill. ""I think it will raise holy hell for small businesses,"" David Bates, a Republican state senator, told the Associated Press at the time. ""There is just no way this is good for the employer.""The new report, which the U.S. Department of Labor helped to finance, represents an attempt to see whether such dire predictions came true. From the looks of things, they haven’t, at least not so far.The study actually has two parts. One compared small- and medium-size businesses in Rhode Island to counterparts in two neighboring states, Connecticut and Massachusetts. It focused on the food and manufacturing industries and found no signs that the law had affected Rhode Island’s firms adversely -- although, as the authors concede, the small data size meant that they couldn’t say so definitively.HuffPost Infographic by Alissa Scheller.The other, more significant finding came from a survey of Rhode Island employers that the researchers conducted. The poll asked respondents what they thought of the new law. Sixty-one percent said they strongly supported or were somewhat in favor of the law, while another 15 percent said they had no strong feelings either way. Twenty-four percent said they opposed the program, somewhat or strongly -- a significant portion, to be sure, but still a clear minority. And the survey doesn't even include large employers who, because they have such vast workforces, can most easily accommodate extended absences from individual employees.It's just one survey. But the findings echo media reports from Rhode Island over the last few months. Based on those accounts, the program has been a hit with employees and hasn’t bothered most employers. Even some state legislators who voted against the law say they are rethinking their opposition. “I’ve had a chance to see it in effect,” Christopher Ottiano, a Republican state senator, told The New Republic’s Rebecca Leber. Ottiano, a physician who specializes in spinal problems, said he has noticed relatives of his elderly patients using the program to take time off. Had he been considering the policy today, Ottiano said, “I’d probably vote for it.”The new study is also consistent with other research and media accounts, including studies of California’s program, which offers up to six weeks of paid leave and has been in place for more than a decade. The debate leading up to the enactment of that program also featured predictions of economic problems that never materialized. Jane Waldfogel, a Columbia University professor of social work and co-author of the report on Rhode Island, told The Huffington Post, “I think our findings -- consistent with those from California -- suggest that these state laws are not having a negative impact on employers. So that’s good news. And we find that a majority of employers -- even small ones -- support the law. That’s good news too.”One key difference between the existing state laws and the national proposals from Democrats is the maximum duration of leave. The leading proposal in Congress would allow workers to stay away from work for as many as 12 weeks. The Democratic presidential candidates say 12 weeks of leave is their goal as well.But the data shows that most workers in the U.S. take only a portion of allowed time, and in other countries, governments guarantee paid leave that can last for months -- or even more than a year. Research on those programs showed that the result was higher productivity and workforce participation for women, and their economies don’t appear to be suffering as a result.Betsey Stevenson, a University of Michigan economist who focused on work-family policy while serving in the Obama White House, says the evidence on paid family leave points in one clear direction. ""The Rhode Island study confirms what many other research studies have found -- paid family leave offers families needed support without harming employers,"" she said. ""Just like every other developed country has been able to provide this kind of security to their citizens without harming their businesses, California and Rhode Island have learned that American businesses can thrive while still supporting families."""
11,POLITICS,Bernie Sanders Wants To Kill Citizens United. It's Actually Not That Simple.,Cristian Farias,https://www.huffingtonpost.com/entry/bernie-sanders-citizens-united_us_56a24542e4b0404eb8f13f1b,Overturning the decision is more complicated than the senator lets on.,2016-01-22,Bernie Sanders has some thoughts about how to fix Citizens United.,https://img.huffingtonpost.com/asset/default-missing-image.jpg?cache=jIO2VoZgTY&ops=scalefit_720_noupscale,"To commemorate the six-year anniversary of the Supreme Court's reviled Citizens United decision, Sen. Bernie Sanders (I-Vt.) lamented the occasion on Twitter.The Democratic presidential candidate called it ""one of the most disastrous"" rulings in his lifetime.""This decision hinges on the absurd notion that money is speech and that corporations are people,"" Sanders tweeted, saying it's given the richest of the rich ""unlimited influence in our elections.""These critiques have merit, as The Huffington Post's Paul Blumenthal explained Thursday. But then came this curious tweet:There's nothing special about wanting to overturn Citizens United. Both Sanders and his chief opponent for the Democratic nomination, Hillary Clinton, have made opposition to the ruling a litmus test for their eventual Supreme Court nominees. (Clinton also mourned the ruling on Thursday with an editorial.) But short of passing a constitutional amendment, fixing Citizens United is much more complicated than simply hoping one of your nominees will help get the decision reversed by a post-Sanders court. For one, an America where a democratic socialist like Sanders is president may very well affect the politics of confirmation hearings -- and maybe the Supreme Court itself.As things stand now, the Senate, which confirms Supreme Court nominees, is still GOP-controlled, and it is still far too early to know for sure whether Democrats can take it back. But even if Democrats regain a majority, President Sanders could face staunch opposition from Republicans to get his anti-Citizens United nominee confirmed, which would require a 60-vote supermajority in the Senate.Then there's the court itself. A new Sanders appointment will necessarily depend on a conservative justice retiring. With two of them approaching 80 -- Justices Antonin Scalia and Anthony Kennedy -- it may very well be one of them. Or both. But what if the prospect of a President Sanders is simply too much for them? Will they hold on to their seats for dear life? That's a long shot, but it's still possible. But imagine Kennedy, the author of Citizens United, does retire, and President Sanders does get his dream replacement confirmed. What then? You would still need a case engineered to overturn Citizens United. Maybe the Federal Election Commission decides to crack down on a corporation giving millions to a super PAC, or a state passes a law banning such donations. Maybe then you'd have a new court case under the First Amendment. But even that case would take time to be litigated and move up the appellate chain. The process could take years. And once the lucky case finally reaches the Supreme Court, there's no guarantee the justices will actually agree to hear it. Their discretion in the matter is essentially unfettered. To be sure, cases raising important constitutional issues tend to catch the court's attention more often than not. And as ThinkProgress' Ian Milhiser notes, it is not beyond the realm of possibility to think that the right case challenging Citizens United could eventually land before the justices. But Supreme Court dynamics -- legal, institutional and otherwise -- are a tricky thing. Sanders' tweet obscures that reality.Civics aside, whether it's Sanders or someone else who takes the White House, the future president's nominees put the future of the Supreme Court -- and maybe even the country -- very much on the line.Related on HuffPost:"
12,ENTERTAINMENT,Gillian Anderson Offered Less Money Than David Duchovny To Star In The Same Damn Show,Carly Ledbetter,https://www.huffingtonpost.com/entry/gillian-anderson-pay-gap-xfiles_us_56a26caee4b0d8cc1099e8df,She's not his sidekick!,2016-01-22,"David Duchovny and Gillian Anderson at the 'The X-Files' panel discussion at TCA on Jan. 15, 2016. ",https://img.huffingtonpost.com/asset/56a271511f00007f0021680d.jpeg?cache=3ViHY5xOgQ&ops=scalefit_720_noupscale,"In infuriating news, Gillian Anderson revealed she was initially offered half of David Duchovny's salary for the upcoming ""X-Files"" reboot, despite putting in equal star power and screen time. ""I'm surprised that more [interviewers] haven’t brought that up because it’s the truth,"" Anderson said in an interview with the Daily Beast. ""Especially in this climate of women talking about the reality of [unequal pay] in this business, I think it’s important that it gets heard and voiced. It was shocking to me, given all the work that I had done in the past to get us to be paid fairly. I worked really hard toward that and finally got somewhere with it."" As the Daily Beast points out, the 47-year-old star first spoke publicly of the disparity with The Hollywood Reporter in early January. ""There's no point in dealing with my side [first] because, as usual, they come to me with half of what they want to offer David,"" she said of negotiations. Anderson recalled how even the blocking on ""The X-Files"" favored her male counterpart in earlier seasons -- the studio deliberately placed Anderson a few feet behind Duchovny while filming.“I can only imagine that at the beginning, they wanted me to be the sidekick,” Anderson told the Daily Beast. She would eventually secure equal pay (and footing), but it took some convincing.""Even in interviews in the last few years, people have said to me, 'I can’t believe that happened, how did you feel about it, that is insane.' And my response always was, ‘That was then, this is now,'' Anderson said. ""And then it happened again! I don’t even know what to say about it."" Patricia Arquette sparked the conversation in Hollywood during her Oscars acceptance speech for Best Supporting Actress in 2015. ""It's our time to have wage equality once and for all, and equal rights for women in the United States of America,"" Arquette told a roaring audience. Jennifer Lawrence followed Arquette's impassioned plea with a thoughtful essay on Hollywood sexism in October 2015. ""I feel awkward negotiating, I feel uncomfortable asking for more money,"" Lawrence said. ""I don’t want to seem like a brat."" Despite the initial conflict, Anderson and Duchovny will be paid equally for the upcoming six-episode ""X-Files"" reboot, which premieres Sunday, Jan. 24, on Fox. Let's just hope this ""X-Files"" series is equal parts exciting as the original. Also on HuffPost: "
13,ENTERTAINMENT,Gillian Anderson Offered Less Money Than David Duchovny To Star In The Same Damn Show,Carly Ledbetter,https://www.huffingtonpost.com/entry/gillian-anderson-pay-gap-xfiles_us_56a26caee4b0d8cc1099e8df,She's not his sidekick!,2016-01-22,Gillian Anderson as Dana Scully and David Duchovny as Fox Mulder.,https://img.huffingtonpost.com/asset/56a27d282a00002c000311af.jpeg?ops=scalefit_720_noupscale,"In infuriating news, Gillian Anderson revealed she was initially offered half of David Duchovny's salary for the upcoming ""X-Files"" reboot, despite putting in equal star power and screen time. ""I'm surprised that more [interviewers] haven’t brought that up because it’s the truth,"" Anderson said in an interview with the Daily Beast. ""Especially in this climate of women talking about the reality of [unequal pay] in this business, I think it’s important that it gets heard and voiced. It was shocking to me, given all the work that I had done in the past to get us to be paid fairly. I worked really hard toward that and finally got somewhere with it."" As the Daily Beast points out, the 47-year-old star first spoke publicly of the disparity with The Hollywood Reporter in early January. ""There's no point in dealing with my side [first] because, as usual, they come to me with half of what they want to offer David,"" she said of negotiations. Anderson recalled how even the blocking on ""The X-Files"" favored her male counterpart in earlier seasons -- the studio deliberately placed Anderson a few feet behind Duchovny while filming.“I can only imagine that at the beginning, they wanted me to be the sidekick,” Anderson told the Daily Beast. She would eventually secure equal pay (and footing), but it took some convincing.""Even in interviews in the last few years, people have said to me, 'I can’t believe that happened, how did you feel about it, that is insane.' And my response always was, ‘That was then, this is now,'' Anderson said. ""And then it happened again! I don’t even know what to say about it."" Patricia Arquette sparked the conversation in Hollywood during her Oscars acceptance speech for Best Supporting Actress in 2015. ""It's our time to have wage equality once and for all, and equal rights for women in the United States of America,"" Arquette told a roaring audience. Jennifer Lawrence followed Arquette's impassioned plea with a thoughtful essay on Hollywood sexism in October 2015. ""I feel awkward negotiating, I feel uncomfortable asking for more money,"" Lawrence said. ""I don’t want to seem like a brat."" Despite the initial conflict, Anderson and Duchovny will be paid equally for the upcoming six-episode ""X-Files"" reboot, which premieres Sunday, Jan. 24, on Fox. Let's just hope this ""X-Files"" series is equal parts exciting as the original. Also on HuffPost: "
