,category,headline,authors,link,short descr,date,image_caption(s),image_link(s),article
7,ENTERTAINMENT,Justin Bieber Isn't Here For All The Fakeness Of Award Shows,Julia Brucculieri,https://www.huffingtonpost.com/entry/justin-bieber-isnt-here-for-all-the-fakeness-of-award-shows_us_57432ed5e4b045cc9a718bb9,"The ""Sorry"" singer just wants a little authenticity.",2016-05-23,"Recording artist Justin Bieber performs onstage during the 2016 Billboard Music Awards at T-Mobile Arena on May 22, 2016 in Las Vegas, Nevada.",https://img.huffingtonpost.com/asset/574330281600006400f94337.jpeg?cache=1x9XGZJaZ2&ops=crop_9_86_1988_1440%2Cscalefit_720_noupscale,"Justin Bieber went home a winner after Sunday night's Billboard Music Awards, but he sure didn't feel like one. On Monday, the Biebs penned a lengthy Instagram caption in which he called out award shows, like the BBMAs, for being ""hollow"" and filled with ""fake"" people. ""I don't know about these award shows,"" he wrote. ""No disrespect to anybody at any of the shows or the people running it. Nothing but love for you guys and your support. But I don't feel good when I'm there nor after."" He went on, explaining that he feels judged and graded when he performs at award shows (as opposed to concerts), adding that people in the crowd seem more concerned with how much camera time they'll get or who they can network with.""When I look in the audience I see a bunch of fake smiles so that when the camera hits them they look happy,"" he wrote. ""There's an authenticity missing that I crave! And I wonder does anybody else..""You can read Biebs' entire pensive note below: "
8,BUSINESS,Bayer Offers To Buy Monsanto For $62 Billion,"Ludwig Burger and Georgina Prodhan, Reuters",https://www.huffingtonpost.com/entry/bayer-offers-to-buy-monsanto-for-62-billion_us_5742ff24e4b0613b512ab140,"Monsanto, which said last week it had a received an approach from Bayer but gave no details, has yet to comment on the offer.",2016-05-23,"The Bayer AG corporate logo is displayed on a building of the German drug and chemicals company in Berlin, Germany, Monday, May 23, 2016. (AP Photo/Markus Schreiber)",https://img.huffingtonpost.com/asset/default-missing-image.jpg?cache=jIO2VoZgTY&ops=scalefit_720_noupscale,"By Ludwig Burger and Georgina ProdhanFRANKFURT (Reuters) - German drugs and crop chemicals group Bayer has offered to buy U.S. seeds company Monsanto for $62 billion in cash, defying criticism from some of its own shareholders in a bid to grab the top spot in a fast-consolidating farm supplies industry.The unsolicited proposal, which includes debt, would be the largest foreign takeover by a German company if accepted.The move, which would eclipse a planned combination of Dow Chemical and DuPont's agriculture units, comes just three weeks after Werner Baumann took over as Bayer CEO, and was condemned by a major shareholder as ""arrogant empire-building"" when news of the proposal emerged last week.Giving details for the first time, Bayer said on Monday it would offer $122 per share, a 37 percent premium to Monsanto's stock price before rumors of a bid surfaced.""We fully expect a positive answer of the Monsanto board of directors,"" Baumann told reporters on a conference call, describing criticism from some investors as ""an uneducated reaction in the media"" when deal terms were not yet known, and driven by an element of surprise.Monsanto, which said last week it had a received an approach from Bayer but gave no details, has yet to comment on the offer. The U.S. company's shares jumped 9.5 percent to $111.17 in pre-market trading.""UPPER LIMIT""Global agrochemicals companies are racing to consolidate, partly in response to a drop in commodity prices that has hit farm incomes and also due to the growing convergence between seeds and pesticides markets.ChemChina is buying Switzerland's Syngenta for $43 billion after Syngenta rejected a bid from Monsanto, while Dow and DuPont are forging a $130 billion business.With German rival BASF also looking into a possible tie-up with Monsanto, Bayer has moved to avoid being left behind.Baumann rejected suggestions from some investors that Bayer should instead try to forge a joint venture with Monsanto, saying this would have tax disadvantages.Sources close to the matter have said BASF is unlikely to start a bidding war with Bayer. BASF declined to comment on Monday. But analysts say Bayer might still have to pay more to persuade Monsanto and its shareholders to sell up.That could be a problem, with some saying Bayer's proposal, at 15.8 times its earnings before interest, tax, depreciation and amortization for the year ended Feb. 29, is already a stretch for the German company.""The price that has now been disclosed is at the upper limit and it is just about economical. Should it rise further, which is to be assumed, the takeover will become increasingly unattractive,"" said Markus Manns, a fund manager at Union Investment, Bayer's 14th biggest investor.Shares in Bayer, which had already fallen 14 percent since rumors of a bid emerged last week, dropped as much as 3.6 percent on Monday to a new 2-1/2 year low of 86.3 euros.""VERY AMBITIOUS""Bayer said it would finance the bid with a combination of debt and equity, primarily a share sale to existing investors. Equity would account for about a quarter of the deal value.Equinet analyst Marietta Miemietz, who has a 'buy' rating on Bayer stock, said the extra debt appeared manageable but could limit Bayer's ability to invest in its healthcare business, which some analysts think needs a boost to its drugs pipeline.Baumann said Bayer would continue to develop its healthcare arm, which includes stroke prevention pill Xarelto and aspirin, the painkiller it invented more than a century ago.""We are not feeding Peter by starving Paul here,"" he said, adding no asset sales were planned to help pay for the deal.Bayer also forecast synergies from a deal with Monsanto would boost annual earnings by around $1.5 billion after three years, plus additional future benefits from integrated product offerings - a reference to its push to combine the development and sale of seeds and crop protection chemicals.Berenberg analysts, who have a 'buy' rating on Bayer shares, described the synergies estimate as ""very ambitious"".(Reporting by Maria Sheahan, Ludwig Burger and Patricia Weiss; Writing by Ludwig Burger and Georgina Prodhan; Editing by Edwina Gibbs and Mark Potter)"
9,ENTERTAINMENT,Madonna And Stevie Wonder Prove No One Compares To Prince At Billboard Music Awards,Julia Brucculieri,https://www.huffingtonpost.com/entry/madonna-billboard-music-awards-prince_us_57424faae4b0613b512a97ff,The duo performed a touching tribute to the music icon on Saturday night.,2016-05-23,Stevie Wonder and Madonna perform a tribute to Prince onstage during the 2016 Billboard Music Awards.,https://img.huffingtonpost.com/asset/574279001a00002f00c294a0.jpeg?cache=Z5Pi37oCvd&ops=scalefit_720_noupscale,"Madonna took the stage at the Billboard Music Awards on Saturday night to pay tribute to the late, great Prince. Before she even stepped on stage, the crowd was on their feet as Prince's voice blared over the speakers, reciting the iconic opening lines of ""Let's Go Crazy"": ""Dearly beloved, we are gathered here today to get through this thing called life."" Madge, dressed in ""Purple Rain"" garb, appeared sitting on a plush purple chair. She broke out into a cover of Prince's ""Nothing Compares 2 U,"" which was made popular by Sinead O'Connor. Then Stevie Wonder walked onto the stage to sing ""Purple Rain"" with the Material Girl. The two held hands and belted out the lyrics as the crowd waved their arms (wrapped in purple wristbands) in the air and sang along. The performance was understated yet moving, and overall, a great tribute to one of music's biggest icons. "
10,POLITICS,Supreme Court Bars GOP Congressmen From Defending Racially Gerrymandered Map,Cristian Farias,https://www.huffingtonpost.com/entry/supreme-court-congressional-redistricting-virginia_us_5743422ce4b045cc9a71a1c7,"Claims that their Virginia districts might be ""flooded"" with Democrats weren't convincing.",2016-05-23,"Reps. Randy Forbes, Rob Wittman and Dave Brat are going to have to run for re-election without the justices' help.",https://img.huffingtonpost.com/asset/574346de1300000105382839.jpeg?cache=FTvd0gN9xP&ops=scalefit_720_noupscale,"In a short opinion that hints at compromise, the U.S. Supreme Court on Monday declined to allow Republican lawmakers to defend a Virginia districting map that had earlier been ruled racially discriminatory.At issue was the state's 3rd Congressional District, which a lower court had determined was drawn unconstitutionally because it packed too many black voters into one district and thereby diluted black voting power overall. The 3rd District seat is held by Rep. Bobby Scott (D), currently the state's only African-American in Congress.Virginia, which is now led by a Democratic governor, never appealed the lower court ruling. But three Republican congressmen did, arguing that the now-overturned redistricting plan should be reinstated because the redrawn map would harm their re-election prospects.The new map was approved earlier this year by the same lower court that had found the original plan constituted an illegal racial gerrymander.In a unanimous ruling written by Justice Stephen Breyer, the Supreme Court said the three lawmakers -- Reps. Randy Forbes, Rob Wittman and Dave Brat -- had failed to establish ""standing"" to intervene in the dispute because they couldn't show they had suffered any injury.Forbes, who currently represents District 4, has chosen to switch over to District 2, which offers him a better chance of re-election. When the state redrew District 3, it shifted more black voters into District 4. Forbes had earlier claimed that change would turn District 4 into a ""safe 60% Democratic district” if the Supreme Court didn't intervene.But since Forbes isn't running in District 4 now, Breyer wrote that he couldn't ""see how any injury that Forbes might have suffered ‘is likely to be redressed by a favorable judicial decision.'""As for Wittman and Bratt, who represent Virginia's 1st and 7th congressional districts, the justices simply found no evidence that their legislative turf would be ""flooded with Democratic voters"" in a way that would lead to losses in November -- especially since the case centered on districts far removed from theirs.The practical result of Monday's ruling is that the new congressional map will remain in effect heading into the 2016 election.The minimalist ruling is also the third this term in an area, voting rights, where the Supreme Court has often clashed along ideological lines. The previous two were handed down in April, and all three have lacked major fireworks -- perhaps to avoid even splits or the appearance of partisanship in the wake of Justice Antonin Scalia's death."
11,ENTERTAINMENT,Even The Cast Of 'Mr. Robot' Gets Confused By The Show's Plot,Julia Brucculieri,https://www.huffingtonpost.com/entry/even-the-cast-of-mr-robot-gets-confused-by-the-shows-plot_us_57422c2be4b0613b512a932f,You're not alone.,2016-05-23,"Rami Malek, Portia Doubleday, Carly Chaikin and Christian Slater attend ""Inside Mr. Robot"" at the 2016 Vulture Festival at Milk Studios on May 21, 2016, in New York City.",https://img.huffingtonpost.com/asset/57422e1e1a00002f00c29477.jpeg?cache=btuqkoT0t9&ops=crop_0_291_2112_1251%2Cscalefit_720_noupscale,"If you've watched USA Network's ""Mr. Robot,"" you know the show can get a little confusing at times. With so many plot twists and storylines, it can be hard to keep up. Even the cast thinks so. During a discussion at Vulture Fest in New York City on Saturday, the cast of the Golden Globe-winning show revealed that they, too, don't know what's going on most of the time. ""Its so crazy -- you're like, 'Oh, yeah, I know what's going to happen,' and then you get your script and you're like, 'What?! I never heard that,'"" said Carly Chaikin, who plays Darlene on the hit show. ""But [director Sam Esmail] has such an amazing vision of who we are, that when he would talk to me about it, it would just make me so excited.""Portia Doubleday, who plays the main character Elliot's childhood friend Angela, even admitted, ""Sometimes I have to Wikipedia our own show to figure out [what's going on].""""This season, there are a couple things where I'm like, 'Wait, when did that happen?' I actually had to research it and figure it out as opposed to [knowing] what episode was that in,"" she said.Chaikin added that she and her cast mates had arguments about scripts with Esmail, but they always eventually realized the director knew what he was doing. ""It's nice to be in the hands of somebody we absolutely trust,"" Christian Slater, who plays the eponymous Mr. Robot, said. ""He does get it and there is a reason for each and every thing we end up doing and saying. He's thought it all the way through.""In fact, they trust Esmail so much, Chaikin joked, ""If [he] started a cult, we probably would just follow. We'd be like, 'Well, if you think it's good, then, you're right.'"" ""Mr. Robot"" Season 2 premieres July 13 at 10 p.m. ET on USA. "
12,CRIME,Drug-Addled Puppy 'Looks Much Better' After Undergoing Doggie Rehab,Nina Golgowski,https://www.huffingtonpost.com/entry/puppy-drug-rehab_us_5742ffeee4b0613b512ab15d,"The dog was found in a motel room with meth, heroin and nicotine in his system.",2016-05-23,"Bubba, a mixed terrier, was found with meth and heroin in his system.",https://img.huffingtonpost.com/asset/57430c98130000d60538278a.jpeg?cache=i7jPIyONB4&ops=scalefit_720_noupscale,"Everyone deserves a second chance, especially this little pooch named Bubba.The mixed terrier recently underwent doggie rehab in southern California after police say they found him in a motel room with meth, heroin and nicotine in his system.Bubba’s saving grace came in late March when Tustin police say they raided the room on an arrest warrant for the pup's owner, Joshua West. Tustin Police Lt. Robert Wright told CNN that officers found illegal drugs in the room.The little puppy had somehow ingested the toxic substances. After being transported to Orange County Animal Care, tests confirmed that Bubba was “under the influence of drugs,” police said.""We are happy to report Bubba has been treated for his drug addiction and is doing excellent,” the Tustin police department posted on Facebook earlier this month.To document his whirlwind progress, police shared two new photos of little Bubba on May 6, showing remarkable improvement. Noting that ""he looks much better,"" the police department thanked the public for Bubba's support. Once he is back to his usual puppy self, Bubba will be up for adoption, authorities said. OC Animal Care did not immediately respond to a request for comment Monday.Tustin Police have meanwhile asked that prosecutors charge West with animal cruelty along with illegal drug possession charges, Fox 5 reported."
13,CRIME,Drug-Addled Puppy 'Looks Much Better' After Undergoing Doggie Rehab,Nina Golgowski,https://www.huffingtonpost.com/entry/puppy-drug-rehab_us_5742ffeee4b0613b512ab15d,"The dog was found in a motel room with meth, heroin and nicotine in his system.",2016-05-23,Bubba is a whole new pup after being removed from the California motel room.,https://img.huffingtonpost.com/asset/57430c5d1600002a00f942c7.png?ops=crop_336_327_774_424%2Cscalefit_720_noupscale,"Everyone deserves a second chance, especially this little pooch named Bubba.The mixed terrier recently underwent doggie rehab in southern California after police say they found him in a motel room with meth, heroin and nicotine in his system.Bubba’s saving grace came in late March when Tustin police say they raided the room on an arrest warrant for the pup's owner, Joshua West. Tustin Police Lt. Robert Wright told CNN that officers found illegal drugs in the room.The little puppy had somehow ingested the toxic substances. After being transported to Orange County Animal Care, tests confirmed that Bubba was “under the influence of drugs,” police said.""We are happy to report Bubba has been treated for his drug addiction and is doing excellent,” the Tustin police department posted on Facebook earlier this month.To document his whirlwind progress, police shared two new photos of little Bubba on May 6, showing remarkable improvement. Noting that ""he looks much better,"" the police department thanked the public for Bubba's support. Once he is back to his usual puppy self, Bubba will be up for adoption, authorities said. OC Animal Care did not immediately respond to a request for comment Monday.Tustin Police have meanwhile asked that prosecutors charge West with animal cruelty along with illegal drug possession charges, Fox 5 reported."
14,ENTERTAINMENT,Madonna Speaks Out After Widely Panned Prince Tribute At The Billboard Music Awards,Carly Ledbetter,https://www.huffingtonpost.com/entry/madonna-speaks-out-after-widely-panned-prince-tribute-at-the-billboard-music-awards_us_5743124ae4b0613b512abd4e,Questlove also defended the singer's performance.,2016-05-23,Singer Madonna is seen on stage during the 2016 Billboard Music Awards for her Prince tribute.,https://img.huffingtonpost.com/asset/574313b31a00008800c29570.jpeg?cache=PRx3CdeiNw&ops=scalefit_720_noupscale,"Dearly beloved, we are gathered here today to get through Madonna's much-hyped performance honoring Prince at the Billboard Music Awards.Many were unhappy with the singer's tribute to Prince Rogers Nelson on Sunday night, which featured Stevie Wonder and a lot of purple. Prior to the show, fans started a Change.org petition to stop the ""Material Girl"" from performing.After the tribute, Twitter attacked Madonna for her lackluster showing, and BET made sure people knew its tribute to the ""Purple Rain"" singer would be much better.BET tweeted out a link to their own Prince tribute, with a video that showed the words, ""Yeah, we saw that. Don't worry. We Got You."" Madonna didn't seem too bothered, sharing a series of photos after the awards show. ""Anyone who wants to do a tribute to Prince is welcome to,"" Madonna wrote on her social media accounts on Monday morning, most likely after seeing the criticism of her performance. ""Whatever your age Gender or skin Color. If you loved him and he inspired you then show it!!!! I love Prince 4 ever 💜☔️👑🙏🏻"" Questlove, who introduced the duo's performance, later took to Twitter to defend Madonna's tribute. Questlove has a point. Of course no one will ever compare to Prince, but we as viewers (and fans) must prepare ourselves for tributes to the singer of all kinds as awards season gears up again in the fall. "
15,WEIRD NEWS,'Inception'-Themed Math Book Cover Drives Internet Haywire,Nina Golgowski,https://www.huffingtonpost.com/entry/textbook-drives-internet-crazy_us_57433c84e4b0613b512aed52,Has a hole been torn in the space-time continuum?,2016-05-23,"Robert Burt, 19, wore his mugshot in his mugshot following a drunk driving arrest in 2014.",https://img.huffingtonpost.com/asset/574352921600006400f9438f.jpeg?ops=scalefit_720_noupscale,"As far as math books go, this one's not adding up.A bizarre, ""Inception""-style textbook cover is driving the internet mad. It shows students holding the same books on which they seem to appear, as if trapped in a never-ending loop.The College Prep Algebra book shows five student cheerfully clutching textbooks. Things get screwy, however, when one looks closely: Are the exact same students carrying the exact same textbook and standing in the exact same way?Naturally, the internet exploded with shock and conspiracy theories.Cengage Learning, which produced the books, also got in on the action.Fortunately for those who couldn't wrap their head around the anomaly, Reddit came to their rescue.A year ago the same photo caused heads to spin online, leading to an undoctored image of the students to emerge. In their hands they're seen holding books, but ones that have not yet been edited.Not that creepy, right? Some other notable ""tunnel vision"" mashups include:This Maine man, who wore a past mug shot on his T-shirt during his booking for drunk driving.Seth Rogen meeting a fan for the third time...And, of course, this scene out of the Mel Brooks classic, ""Spaceballs""...h/t Buzzfeed"
16,LATINO VOICES,Shakira Clears Up Rumor So Paparazzi Will Stop Going Through Her Garbage,Carolina Moreno,https://www.huffingtonpost.com/entry/shakira-clears-up-rumors-so-paparazzi-will-stop-going-through-her-garbage_us_57432037e4b045cc9a717c3a,The singer was in Colombia shooting a new music video with Carlos Vives.,2016-05-23,"Colombian singers Shakira and Carlos Vives ride bikes during the recording of the video for the song ""La Bicicleta.""",https://img.huffingtonpost.com/asset/574330641600002a00f94338.jpeg?ops=scalefit_720_noupscale,"Shakira just wants to ride her bicycle, and for people to stop going through her trash. The Colombian star recently returned to her hometown of Barranquilla, Colombia, to shoot a music video with Carlos Vives for their upcoming single ""La Bicicleta"" (The Bicycle). The singer spoke at a press conference on Saturday, towards the end of her four-day visit to the South American country, where she was forced to make two things very clear.""For now there is no plan for a wedding nor am I pregnant,"" she said, when asked about whether she intended to marry beau and Spanish soccer star Gerard Piqué, according to EFE. ""We're very happy the way we are, and for now there are no plans for marriage.""Shakira also took the time to call out some unwelcome guests who've been snooping around her home to confirm rumors that she may be pregnant with her third child. Both artists shared photos of their bike adventures from their social media accounts. ""I've always dreamt of writing, producing and recording a song with Shakira so that together we can show our Colombia to the world,"" Vives told Billboard on May 5. ""She has taken our country's music to unimaginable heights, and finally being able to collaborate with her is a realization of this dream.""The trip ended on a happy note as Shakira and Vives were both serenaded to his iconic song ""El Amor De Mi Tierra"" (The Love of My Country), in a video that he shared on Twitter. In the caption he wrote the little party was for Shakira, so she ""never forgets the love of her country."""
17,LATINO VOICES,Shakira Clears Up Rumor So Paparazzi Will Stop Going Through Her Garbage,Carolina Moreno,https://www.huffingtonpost.com/entry/shakira-clears-up-rumors-so-paparazzi-will-stop-going-through-her-garbage_us_57432037e4b045cc9a717c3a,The singer was in Colombia shooting a new music video with Carlos Vives.,2016-05-23,Dozens of fans showed up to watch the two Colombian singers ride their bicycles. ,https://img.huffingtonpost.com/asset/574330f0130000d605382800.jpeg?ops=scalefit_720_noupscale,"Shakira just wants to ride her bicycle, and for people to stop going through her trash. The Colombian star recently returned to her hometown of Barranquilla, Colombia, to shoot a music video with Carlos Vives for their upcoming single ""La Bicicleta"" (The Bicycle). The singer spoke at a press conference on Saturday, towards the end of her four-day visit to the South American country, where she was forced to make two things very clear.""For now there is no plan for a wedding nor am I pregnant,"" she said, when asked about whether she intended to marry beau and Spanish soccer star Gerard Piqué, according to EFE. ""We're very happy the way we are, and for now there are no plans for marriage.""Shakira also took the time to call out some unwelcome guests who've been snooping around her home to confirm rumors that she may be pregnant with her third child. Both artists shared photos of their bike adventures from their social media accounts. ""I've always dreamt of writing, producing and recording a song with Shakira so that together we can show our Colombia to the world,"" Vives told Billboard on May 5. ""She has taken our country's music to unimaginable heights, and finally being able to collaborate with her is a realization of this dream.""The trip ended on a happy note as Shakira and Vives were both serenaded to his iconic song ""El Amor De Mi Tierra"" (The Love of My Country), in a video that he shared on Twitter. In the caption he wrote the little party was for Shakira, so she ""never forgets the love of her country."""
