,category,headline,authors,link,short descr,date,image_caption(s),image_link(s),article
18,POLITICS,This State Is Making Sure That Blue Lives Matter,Julia Craven,https://www.huffingtonpost.com/entry/law-blue-lives-matter_us_57433776e4b0613b512ae653,The governor of Louisiana is expected to sign a bill that will make any attack on a police officer a hate crime.,2016-05-23,"Policemen arrive at the funeral for Harris County Deputy Darren Goforth in Houston on Sept. 4, 2015.",https://img.huffingtonpost.com/asset/57433a621600006400f9434d.jpeg?ops=scalefit_720_noupscale,"Louisiana Gov. John Bel Edwards (D) is expected to sign a bill that will expand state hate crime statutes to include any attack on a police officer, EMT or firefighter. HB 953 has passed in both chambers of the state legislature, and if it's signed, Louisiana would be first state in the country with such a law. State Rep. Lance Harris (R) said he was inspired to pen the bill following the murder of Sheriff's Deputy Darren Goforth in Houston last August. “It looked like it was strictly done because someone didn’t like police officers, like a hate crime,” Harris told CNN on Friday.HB 953 is commonly known as “Blue Lives Matter,"" a phrase co-opted from the Black Lives Matter movement and that stands as a counterpoint to criticisms of police brutality. The Blue Lives Matter movement maintains that in fact, police officers are under attack and need extra protections. “I certainly do think there is a need for it,"" Harris said. ""If you’re going to have an extensive hate crime statute then we need to protect those that are out there protecting us on a daily basis.""""There is a concerted effort in some areas to terrorize and attack police and I think this will go forward and stop that,” Harris added, citing social media attacks on police officers. But rates of assault and deadly violence against police in the U.S. have actually declined. Only 41 police officers were intentionally killed while on duty in 2015 -- nearly a 20 percent decrease from 2014 -- making it one of the safest years for police officers on record, according to preliminary statistics from the FBI.Critics of the bill say hate crime legislation should stick to race, religion, ethnicity and other static attributes. “It’s really focused on immutable characteristics,” Allison Goodman, regional director for the Anti-Defamation League, told The Advocate of the current state statute. “Proving the bias intent for a hate crime for law enforcement or first responders is very different than proving it for someone who is Jewish or gay or black.” Others have asserted that it is actually citizens and not police who are under siege. Officers are heavily protected by the justice system: They typically do not face legal repercussions for using lethal force against civilians, and when someone kills an officer, they are usually swiftly prosecuted to the full extent of the law. In some states, such as Michigan and New York, killing a police officer is an automatic first-degree murder charge. The New Orleans chapter of Black Youth Project 100, a black activist organization, is asking that Edwards veto the bill. “By treating the police as specialized citizens held above criticism and the laws they are charged to enforce, we lose our ability to exercise our First Amendment right,” the organization wrote in a statement. “Including ‘police’ as a protected class in hate crime legislation would serve to provide more protection to an institution that is statistically proven to be racist in action, policy, and impact.”Edwards is expected to sign the bill this week, his press secretary Shauna Sanford told The Huffington Post.CORRECTION: An earlier version of this post incorrectly referred to the ""Blue Lives Matter"" legislation as HB 923. It is HB 953."
19,POLITICS,GOP Congressman: 'I've Never Thought' It Was A Good Idea To Block Obama's SCOTUS Pick,Jennifer Bendery,https://www.huffingtonpost.com/entry/daniel-donovan-merrick-garland_us_574367bce4b045cc9a71b591,Rep. Daniel Donovan says it's time to give Merrick Garland a break.,2016-05-23,"Here's Obama's Supreme Court nominee, Merrick Garland. The guy just wants a vote.",https://img.huffingtonpost.com/asset/574369fe1600006400f943bc.jpeg?ops=crop_320_309_2491_1691%2Cscalefit_720_noupscale,"WASHINGTON -- Another Republican lawmaker is breaking from his party and urging the Senate to vote on President Barack Obama's Supreme Court nominee.Rep. Daniel Donovan (R-N.Y.) said Monday that the the failure of GOP leaders to even give Merrick Garland a hearing, never mind a vote, is the kind of thing that makes Americans cynical about politics.""I've never thought that was a good idea,"" Donovan told reporters at an an event in Staten Island, New York. ""I've always thought that the Republicans were wrong, that they should see who the nominee was -- actually, the president nominated Judge Garland -- and judge him on his abilities, his jurisprudence.""Donovan, a first-term member of Congress, said senators who don't think Garland is a good choice should just vote against him instead of denying him a hearing. Garland is currently the chief judge on the U.S. Court of Appeals for the D.C. Circuit.""In the hearings, he’d be asked pointed questions, which I don’t think we have the advantage of now because we don’t have a hearing,"" said Donovan. ""We'd be able to judge the man better if he was able to respond to some of the questions people have.""Senate Majority Leader Mitch McConnell (R-Ky.) has more or less kept his caucus united in opposing confirmation hearings for Garland. They've made the unprecedented argument that Obama's time in the White House is nearly over, so the next president should get to fill the Supreme Court vacancy. The court has had an empty seat since Antonin Scalia died in February. That's had its own ramifications.But a few Republicans have pushed for Garland to get a vote, including Sen. Mark Kirk (Ill.), Sen. Susan Collins (Maine) and Senate hopeful David Jolly, who is currently a Florida congressman. Conservative Sen. Jerry Moran (Kansas) surprised a lot of people when he said he, too, thought Garland deserved a vote. But then someone pulled him into a room and threatened some stuff (or at least it seemed like it), and he changed his mind. The White House and congressional Democrats have spent months trying to shame Republicans into letting Garland's nomination move, using the hashtag #doyourjob on social media. McConnell hasn't budged, but public opinion has. An NBC/Wall Street Journal poll from April found that a majority of Americans think Garland should get a confirmation vote this year."
20,ENTERTAINMENT,Exclusive Clip Of 'Law & Order: SVU' Proves The Season Will Finish With A Bang,Carly Ledbetter,https://www.huffingtonpost.com/entry/exclusive-clip-of-law-order-svu-assures-us-the-finale-will-be-extra-dramatic_us_5743100be4b045cc9a716c6c,"And it stars an ""Everybody Loves Raymond"" cast favorite.",2016-05-23,"Our faves, back at it again in the episode ""Heartfelt Passages."" ",https://img.huffingtonpost.com/asset/574310aa1a00002f00c2955c.jpeg?cache=koBjgkR7lA&ops=scalefit_720_noupscale,"If you've been keeping up with Season 17 of ""Law & Order: Special Victims Unit,"" you know it's been extremely dramatic (just like that ""Bachelor""-inspired episode). The tone remains the same for the ""SVU"" finale this week, centered around an accused rapist, corrections officer Gary Munson (Brad Garrett from ""Everybody Loves Raymond""), and his many victims -- including his wife, Lisa, played by Karina Logue. The Huffington Post has an exclusive clip of this week's episode, which shows Lisa asking Lieutenant Olivia Benson for help escaping her violent husband: ""I read the season finale and I was so deeply moved and deeply inspired. I couldn't put it down ... couldn't stop crying,"" Mariska Hargitay told E! News at a Variety event in April. ""After doing a show for this long, there are these moments that come up that are so earned and so painful.""The actress/director added, ""For Olivia, something very tragic happens and something so beautiful happens, which is so much like life, right? It's that marriage of joy and pain and all of it, living in the question and gray. Gray, gray, gray, which 'SVU' is so amazing at. I'm hooked and excited."" Tune into ""SVU"" Wednesday, May 25, at 9:00 p.m. ET on NBC. "
21,ENTERTAINMENT,Get Trippy With Adele In Her Gorgeous New Video For 'Send My Love (To Your New Lover)',Carly Ledbetter,https://www.huffingtonpost.com/entry/get-trippy-with-adele-in-her-gorgeous-new-video-for-send-my-love-to-your-new-lover_us_573f7b9ce4b0613b512a5f92,She can do no wrong.,2016-05-23,"Adele performs at Meo Arena on May 21, 2016, in Lisbon, Portugal.",https://img.huffingtonpost.com/asset/574260fe1600006400f9420c.jpeg?ops=scalefit_720_noupscale,"After teasing a snippet of her new video earlier this week, Adele premiered the gorgeous new video for ""Send My Love (To Your New Lover)"" at the 2016 Billboard Music Awards on Sunday. Wearing a gorgeous floral Dolce & Gabbana dress, the trippy video will have you grooving (just like Adele) to the third single off the singer's hit album ""25."" It sort of feels like dancing with four versions of Adele at the same time, which is just fine with us. Below is the teaser that Adele tweeted out: "
22,ENTERTAINMENT,Celine Dion Performs Emotional Tribute At The Billboard Music Awards,Carly Ledbetter,https://www.huffingtonpost.com/entry/celine-dion-performs-emotional-tribute-billboard-music-awards_us_574245a0e4b0613b512a9781,"""René, this one’s for you.""",2016-05-23,"Honoree Celine Dion performs onstage during the 2016 Billboard Music Awards at T-Mobile Arena on May 22, 2016 in Las Vegas, Nevada.",https://img.huffingtonpost.com/asset/574275fd1600002a00f9421a.jpeg?ops=scalefit_720_noupscale,"Celine Dion brought down the house at the 2016 Billboard Music Awards with an emotional rendition of Queen's ""The Show Must Go On."" The performance was especially personal for Dion, who lost both her husband, René Angélil, and brother, Daniel, this year to cancer. The 48-year-old was honored with the Icon Award at the show and received a warm welcome from singer Seal and a video tribute. Dion looked stunning in a gorgeous, sparkling gown with a dramatic slit. Dion's teenage son, René-Charles Angelil, surprised the singer by handing her the Icon award personally after her performance. ""Rene, this one’s for you,"" Dion said. ""The show must go on."" Many celebrities tweeted their support and admiration for Dion after she sang and spoke. "
