,category,headline,authors,link,short descr,date,image_caption(s),image_link(s),article
0,MEDIA,Photographer Leila Alaoui's Death In Terror Attack Shows Journalism's Danger,Judah Robinson,https://www.huffingtonpost.com/entry/photographer-leila-alaoui_us_56a1231de4b0d8cc10990d6f,"The world-acclaimed artist was remembered as ""a peace correspondent.""",2016-01-22,"A photo of photographer Leila Alaoui, from her personal Instagram account.",https://img.huffingtonpost.com/asset/56a150bb1f00007f00216730.png?cache=6AUcSMbRGF&ops=scalefit_720_noupscale,"The death of Leila Alaoui, a world-acclaimed photographer on assignment in the West African nation of Burkina Faso who was killed this week in a terrorist attack, puts a tragic exclamation point on the danger faced by journalists. Alaoui, 33, was killed Monday, along with her driver, Mahamadi Ouédraogo, and at least 30 other people in the Burkina Faso capitol of Ouagadougou, in a terrorist shooting rampage. The North African affiliate of al Qaeda, al Qaeda in the Islamic Maghreb, claimed responsibility.Alaoui's death adds to a toll that includes 69 journalists who were killed in the line of duty in 2015, according to The Committee To Protect Journalists. At least three other journalists have been killed so far in 2016, the group said.Alaoui, who was French-Moroccan, was on assignment for human rights group Amnesty International to document women's rights in the region. She and her driver were parked outside the Cappucino cafe, across from the hotel targeted in the attack, according to Amnesty International. Alaoui died awaiting medical evacuation. ""She was representing Arab women in the art world, a visionary when it came to topics like immigration and women’s rights,” her cousin, Yalda Alaoui, told The Independent following Leila Alaoui's burial in Marrakesh, Morocco.Alaoui's work has been exhibited around the world. She studied at the City University of New York, and her work recently was featured in The European House of Photography in Paris.""She was young, she was beautiful and she was talented,"" said Jean-Luc Monterosso, director of the European House of Photography, and Jack Lang, president of the Institut du Monde Arabe, in a joint statement on Facebook. ""She was a radiant artist. She fought to return life to society’s forgotten, to the homeless, to migrants, with photography as her sole weapon. She was a peace correspondent.""Look at a few of the stunning images from Alaoui's exhibit, ""The Moroccans,"" here:Alaoui also posted images on her Instagram from her time photographing in India and Lebanon. View the images here:Also On HuffPost:"
1,MEDIA,"National Review Stands Athwart Donald Trump, Even If It Can't Stop Him",Michael Calderone,https://www.huffingtonpost.com/entry/national-review-donald-trump-debate_us_56a24a3ce4b0404eb8f14410,"""We’re not going to let political leaders claim what conservatism is when they don’t really know what it is,"" the magazine's publisher says.",2016-01-22,"Rich Lowry, editor of the National Review, has long been a critic of Republican front-runner Donald Trump.",https://img.huffingtonpost.com/asset/56a24a942a00006e00031150.jpeg?ops=crop_24_325_4199_2360%2Cscalefit_720_noupscale,"NEW YORK -- When the late William F. Buckley Jr. launched National Review six decades ago, he memorably issued a mandate for the conservative magazine to stand “athwart history, yelling Stop.”The conservative magazine's latest mission appears to be a variation of that: “Stop Trump.” On Thursday night, National Review unveiled a new issue that makes the conservative case against real estate mogul Donald Trump's bid for the presidency. It features 22 contributors, from veteran magazine writers to popular bloggers to fiery radio hosts. ""We take our heritage seriously,"" National Review's publisher, Jack Fowler, told The Huffington Post on Friday. ""We were the founding institution of the modern conservative movement and we see ourselves as the protector of what conservative means,"" he said. In the new issue, National Review's editors denounce Trump for shifting his political stances and describe him as ""a menace to American conservatism who would take the work of generations and trample it underfoot in behalf of a populism as heedless and crude as the Donald himself.”The Weekly Standard also recently bemoaned Trump's supposed lack of conservative credentials, calling him a ""non­conservative longtime Democrat"" in an editorial from its Feb. 1 issue.Conservative media's rupture over Trump is part of a broader dispute on the right about the bombastic ex-reality star’s candidacy. Some leading conservative figures have long criticized him for a lack of ideological consistency -- as well as his harsh attacks on fellow Republican candidates and figures such as Sen. John McCain (R-Ariz.) and his bigoted proposal to ban Muslims from entering the United States.National Review has played the role of gatekeeper on the right over the years, attempting to drive fringe voices, like the John Birch Society, from what the magazine's editors have deemed to be respectable conservative opinion. But the media world has radically changed since Buckley denounced the Birchers in the early 1960s, given the emergence of conservative talk radio, Fox News and a plethora of right-leaning blogs, news sites and opinion outlets -- some of which have broadly supported Trump’s candidacy.Trump also reaches millions and drives political coverage through social media. He immediately issued a broadside against National Review on Twitter. National Review remains influential, but its clout has arguably diminished over the years as conservative media has become more fragmented. And presumably, many Trump supporters will only dig in their heels after New York and Washington-based opinion magazines -- in other words, ""The Establishment"" -- align against their candidate. While National Review's editors clearly don't want Trump to be the Republican nominee, Fowler said the magazine's motivations stretch beyond the current political situation. ""We’re about 2016, but we’re also about 1776,"" Fowler said. ""We’re not abandoning principle and we’re not going to let political leaders claim what conservatism is when they don’t really know what it is.""""If Donald Trump blows through the primary, does that mean we’re irrelevant? Does that mean we failed?"" he asked. ""In some sense, that means we failed. But we’re about the truth, and the truth wins in the long term.""What National Review is doing now, Fowler said, ""may be felt 10 years from now or 20 years from now.""However, the magazine is paying a price in the short term for its anti-Trump issue, with the Republican National Committee disinviting it from a CNN debate next month. (Originally, National Review was partnering with NBC for the event, but after CNBC's much-criticized October debate, the party instead awarded the debate to CNN earlier this week.) The RNC specifically brought in conservative outlets this election cycle because of its perception of a liberal bias in the media. So, networks sponsoring GOP debates -- with the exception of Fox News and CNBC -- teamed up with right-leaning magazines, news sites, and radio networks.Fowler said National Review had been in talks with CNN earlier this week to prepare for the debate and address issues surrounding it -- including whether Rich Lowry, who is National Review's editor but also a Fox News analyst, could contractually take part in a CNN event.But Fowler was informed last night that no one from National Review could participate in the debate because the magazine was being removed from the event. RNC communications director Sean Spicer confirmed to HuffPost that the magazine was disinvited, but did not provide additional comment. Explaining the decision, Spicer told BuzzFeed that ""a debate moderator can't have a predisposition.""Earlier this month, the New Hampshire Union Leader -- which endorsed New Jersey Gov. Chris Christie (R) and has harshly criticized Trump -- was removed from an ABC News debate. ""The reason National Review and Salem Radio and these other entities have been brought to the table is the belief that the traditional media is biased,"" Fowler said. ""We’re brought in to counterbalance. National Review is now not good enough, but George Stephanopoulos is?""(Stephanopoulos actually lost his chance to moderate a debate after word got out that he'd donated to the Clinton Global Initiative, but other mainstream media figures are permitted to moderate.) ""It’s their party; they do with it what they want,"" Fowler said. ""We don’t own it. I think they were very hasty and very presumptive in the action they took. I don’t think it will be to their benefit.""Fowler said he can't speak for National Review, but would still rather vote for Trump, if he becomes the Republican nominee, than any of the Democratic candidates, and would ""sleep quite happily"" after doing so.""An election is a choice between two individuals,"" Fowler said. ""What we’re doing today at National Review, yesterday and today, is not about making a box choice. It's about defending conservatism.""Also on HuffPost:"
2,MEDIA,"National Review Stands Athwart Donald Trump, Even If It Can't Stop Him",Michael Calderone,https://www.huffingtonpost.com/entry/national-review-donald-trump-debate_us_56a24a3ce4b0404eb8f14410,"""We’re not going to let political leaders claim what conservatism is when they don’t really know what it is,"" the magazine's publisher says.",2016-01-22,"The National Review, in Trumpian gold, calls on conservatives to stop the Republican front-runner.",https://img.huffingtonpost.com/asset/56a24b041f00007f002167c3.jpeg?cache=M3EkltAkv6&ops=scalefit_720_noupscale,"NEW YORK -- When the late William F. Buckley Jr. launched National Review six decades ago, he memorably issued a mandate for the conservative magazine to stand “athwart history, yelling Stop.”The conservative magazine's latest mission appears to be a variation of that: “Stop Trump.” On Thursday night, National Review unveiled a new issue that makes the conservative case against real estate mogul Donald Trump's bid for the presidency. It features 22 contributors, from veteran magazine writers to popular bloggers to fiery radio hosts. ""We take our heritage seriously,"" National Review's publisher, Jack Fowler, told The Huffington Post on Friday. ""We were the founding institution of the modern conservative movement and we see ourselves as the protector of what conservative means,"" he said. In the new issue, National Review's editors denounce Trump for shifting his political stances and describe him as ""a menace to American conservatism who would take the work of generations and trample it underfoot in behalf of a populism as heedless and crude as the Donald himself.”The Weekly Standard also recently bemoaned Trump's supposed lack of conservative credentials, calling him a ""non­conservative longtime Democrat"" in an editorial from its Feb. 1 issue.Conservative media's rupture over Trump is part of a broader dispute on the right about the bombastic ex-reality star’s candidacy. Some leading conservative figures have long criticized him for a lack of ideological consistency -- as well as his harsh attacks on fellow Republican candidates and figures such as Sen. John McCain (R-Ariz.) and his bigoted proposal to ban Muslims from entering the United States.National Review has played the role of gatekeeper on the right over the years, attempting to drive fringe voices, like the John Birch Society, from what the magazine's editors have deemed to be respectable conservative opinion. But the media world has radically changed since Buckley denounced the Birchers in the early 1960s, given the emergence of conservative talk radio, Fox News and a plethora of right-leaning blogs, news sites and opinion outlets -- some of which have broadly supported Trump’s candidacy.Trump also reaches millions and drives political coverage through social media. He immediately issued a broadside against National Review on Twitter. National Review remains influential, but its clout has arguably diminished over the years as conservative media has become more fragmented. And presumably, many Trump supporters will only dig in their heels after New York and Washington-based opinion magazines -- in other words, ""The Establishment"" -- align against their candidate. While National Review's editors clearly don't want Trump to be the Republican nominee, Fowler said the magazine's motivations stretch beyond the current political situation. ""We’re about 2016, but we’re also about 1776,"" Fowler said. ""We’re not abandoning principle and we’re not going to let political leaders claim what conservatism is when they don’t really know what it is.""""If Donald Trump blows through the primary, does that mean we’re irrelevant? Does that mean we failed?"" he asked. ""In some sense, that means we failed. But we’re about the truth, and the truth wins in the long term.""What National Review is doing now, Fowler said, ""may be felt 10 years from now or 20 years from now.""However, the magazine is paying a price in the short term for its anti-Trump issue, with the Republican National Committee disinviting it from a CNN debate next month. (Originally, National Review was partnering with NBC for the event, but after CNBC's much-criticized October debate, the party instead awarded the debate to CNN earlier this week.) The RNC specifically brought in conservative outlets this election cycle because of its perception of a liberal bias in the media. So, networks sponsoring GOP debates -- with the exception of Fox News and CNBC -- teamed up with right-leaning magazines, news sites, and radio networks.Fowler said National Review had been in talks with CNN earlier this week to prepare for the debate and address issues surrounding it -- including whether Rich Lowry, who is National Review's editor but also a Fox News analyst, could contractually take part in a CNN event.But Fowler was informed last night that no one from National Review could participate in the debate because the magazine was being removed from the event. RNC communications director Sean Spicer confirmed to HuffPost that the magazine was disinvited, but did not provide additional comment. Explaining the decision, Spicer told BuzzFeed that ""a debate moderator can't have a predisposition.""Earlier this month, the New Hampshire Union Leader -- which endorsed New Jersey Gov. Chris Christie (R) and has harshly criticized Trump -- was removed from an ABC News debate. ""The reason National Review and Salem Radio and these other entities have been brought to the table is the belief that the traditional media is biased,"" Fowler said. ""We’re brought in to counterbalance. National Review is now not good enough, but George Stephanopoulos is?""(Stephanopoulos actually lost his chance to moderate a debate after word got out that he'd donated to the Clinton Global Initiative, but other mainstream media figures are permitted to moderate.) ""It’s their party; they do with it what they want,"" Fowler said. ""We don’t own it. I think they were very hasty and very presumptive in the action they took. I don’t think it will be to their benefit.""Fowler said he can't speak for National Review, but would still rather vote for Trump, if he becomes the Republican nominee, than any of the Democratic candidates, and would ""sleep quite happily"" after doing so.""An election is a choice between two individuals,"" Fowler said. ""What we’re doing today at National Review, yesterday and today, is not about making a box choice. It's about defending conservatism.""Also on HuffPost:"
3,HEALTHY LIVING,Licorice Cough Syrup Recalled For Containing Morphine,Kate Bratskeir,https://www.huffingtonpost.com/entry/cough-syrup-recall-master-herbs-liquid_us_56a22d13e4b0404eb8f12c06,The product was distributed in six states.,2016-01-22,Master Herbs' Licorice Coughing Liquid cough syrup sold in 100 ml bottles has been recalled for containing undeclared morphine. ,https://img.huffingtonpost.com/asset/56a22e4d2a00002c00031128.png?ops=scalefit_720_noupscale,"Master Herbs, Inc. recalled all of its Licorice Coughing Liquid cough syrup in 100 ml bottles in retail stores on Wednesday. The product contains morphine, which is not listed as an ingredient on the label. Morphine is an opioid pain reliever that is only available through a prescription. Misuse of the narcotic can lead to addiction, overdose and, in severe cases, death. Morphine is also associated with serious breathing problems, and the person taking it should be monitored while doing so. Master Herbs' Liquid Coughing syrup was sold primarily in Chinese grocery stores in California, Hawaii, Illinois, Nevada, New Jersey and Ohio. For some, taking morphine could lead to severe allergic reactions. Young children with respiratory illness are at risk for respiratory depression from opioids, according to the Food and Drug Administration. There have been no reports of illness associated with the product thus far. If you have any questions about the recall, you can call Master Herbs, Inc. by phone at 626-319-9915 Monday through Friday from 10 a.m. to 5 p.m. PST or e-mail them any time at 999herbs@gmail.com. The FDA advises consumers to contact their healthcare provider immediately if they experience any negative effects related to the use of the product. Related on HuffPost:"
