,category,headline,authors,link,short descr,date,image_caption(s),image_link(s),article
4,LATINO VOICES,"Latino Millennials Have The Power, So Why Don't They Use It?",Michael McLaughlin,https://www.huffingtonpost.com/entry/latino-millennials-have-the-power-so-why-dont-they-use-it_us_56a13571e4b0404eb8f0af8b,"""Everyone wants to know when this really large voting group is going to punch its weight.""",2016-01-22,"Soraya Marquez, the state coordinator for Mi Familia Vota and her crew hit a Puerto Rican neighborhood trying to get Latinos to register to vote in the 2016 presidential election on July 24.<br><br>Millennials make up 44% of eligible Latino voters, a bigger share than any other age group.",https://img.huffingtonpost.com/asset/56a136051a00001001ab1172.jpeg?ops=scalefit_720_noupscale,"Millennials make up a huge share of eligible Latino voters, much more than their peers do among their black and white counterparts, according to the Pew Research Center.Latino voters born since 1981 make up 44 percent of the 27.3 million Hispanics eligible to choose the next president. Then there are the 3.2 million Latinos who reached voting age since Obama's reelection in 2012, according to Pew. That sounds like an exciting opportunity to get new voters to the polls. But what's more likely is that Latino millennials won't exert anything close to their full power on Election Day, analysts said, and that will dilute the overall Latino vote.""Everyone wants to know when this really large voting group is going to punch its weight,"" said Jens Manuel Krogstad, a co-author of Pew's recent report on Latino voting trends. ""A big part of the story is that the Latino electorate is young.""The growing numbers of young Latinos eligible to vote don't surprise academics or pollsters who track voting demographics, What's tougher to grasp is why they're underrepresented among people who actually vote. Millennials don't vote much in general, but the problem is more acute among Hispanics because they make up a larger share of the overall Latino vote than do black and white millennials in their respective racial groups. Hispanic millennials also vote at lower levels than their African American and white counterparts. In 2012, only 37.5 percent of Latino millennials voted, compared to 47.5 percent of whites and 55 percent of African Americans in the same age group. That lack of participation drags down the overall Latino turnout rate There are several reasons why Hispanic millennials are discouraged from maximizing their clout at the voting booths.Latinos concentrated in uncompetitive states.Why bother voting if it's unlikely to matter in your state's outcome? More than half of all eligible Latinos live in California, Texas and New York, according to Pew. California and New York reliably vote for the Democratic presidential nominee and Texas is a deeply red state. Candidates don't spend much time in those states because they favor possible swing areas. Florida, Nevada and Colorado are the only battleground states with sizable Latino populations, according to Pew. With the outcome in Texas, California and New York virtually declared already, Krogstad said it's not surprising that young Latinos might not see any reason to get involved. Cultural divide.""Latinos have rather large cultural and language barriers that keep the voter turnout rate down,"" Krogstad said. Bilingual voting materials are generally available, but that doesn't mean it will be easy to exercise the right to vote.Spanish speakers will probably see and hear less advertising targeting them and thus not get as excited about voting either.The lack of voting interest could be a holdover too, if the voter was born abroad or has a family connection to a Spanish speaking country that didn't inspire democratic participation either, so they or their parents didn't vote before naturalizing in the U.S. Politicians don't interact well with LatinosCandidates' half-hearted attempts at peppering speeches with a few basic words of Spanish don't work on Latinos, who report receiving less interaction from candidates and their campaigns than black and white voters do, according Matt Barreto, a UCLA professor who does polling on Hispanics for Hillary Clinton's campaign.""You have to feel like the candidate depends on your vote,"" he said. ""People ask 'Why aren't these Latinos voting?' The question should be 'Why isn't the political establishment investing the same amount?'""Latinos overall vote less on average.The behavior of Latino millennials is hardly unprecedented. In some ways, they're following a general pattern of the previous generations. Older, eligible Latinos don't vote as much as their white and black counterparts either. In 2012, during Obama's reelection, only 48 percent of eligible Latinos voted compared to 64 percent of whites and 65 percent of blacks, Pew's data shows. Wild card: the Trump factor.If Donald Trump becomes the GOP presidential nominee, will Latinos turn out in higher than expected numbers to try and defeat someone who has vilified immigrants, especially people from Mexico? Not necessarily, which is why Hillary Clinton and Bernie Sanders' campaigns have tried cultivating Latinos. ""You can't count on the bogeyman on the other side [to motivate Latino voters],"" Barreto said. ""You've got to have engagement. Outreach is happening, but nothing is going to automatically materialize if Trump wins.""Wild card #2: the Cruz and Rubio factor.There's yet another question that could upset the equation. What happens if a Cuban-American like Sen. Ted Cruz (R-Texas) or Sen. Marco Rubio (R-Florida) becomes the nominee? It's hard to say, according to Krogstad, because Latinos have reliably supported the Democratic party. In 2012, Obama won 71 percent of the Hispanic vote. Presumably that number would be much lower if a Hispanic candidate has the chance to move into the White House, but so far Latinos haven't embraced Cruz or Rubio. Part of the reason, is that many identify with their country of origin, such as Mexico, Colombia or Cuba, rather than under the umbrella category of Latino.Their connection to the Democratic party might hold up, according to Cornell professor Sergio Garcia-Rios. ""I don't think they're up for grabs,"" he said. ""Latinos favor a lot of policies that Republicans are against,"" such as looser immigration controls and expanded healthcare programs. Bright spots: Children of Latino immigrants.Though polling results indicate low turnout for Latino millennials, it doesn't mean they're politically off the grid. Other research shows that children of immigrants get involved in other ways that could lay the foundation for strong voting power, according to Garcia-Rios. Children from a young age who speak English often help their non-native speaking parents fill out forms or translate when dealing with authorities, such as school officials. These interactions with officials and institutions might make voting feel natural for the sons and daughters of immigrants. ""They're used to being involved in these activities from a young age,"" Garcia-Rios said. Bright spots: More educated, more motivated.Another reason for optimism is eligible Latino voters are much more educated now. In the 2000 election, only 24 percent had a two-year degree orsome college schooling and just 11 percent had earned a bachelor's degree. This year, Pew projects that 30 percent will have a two-year degree or some college schooling, while 18 percent will have graduated from a university. The proportion who dropped out before finishing high school fell from 32 percent in the George W. Bush v Al Gore election to a projected 20 percent this fall.Then there are the so-called Dreamers. Researchers believe that these children, brought to the U.S. without documentation by their parents and whom Obama granted amnesty, might become highly active in the political arena. ""My sense…is that naturalized dreamers are more prone to participate in politics [and vote] than older, naturalized Latinos,"" said University of Connecticut professor Charles Venator-Santiago. So when will Latino millennials make their voices heard? Not till they're older. Experts said that passage of time will probably have a bigger effect than any outreach effort from the traditional parties. Older age groups simply vote more. As the huge number of millennials mature, they'll show up at the polls. Barreto, who does polling for Clinton's campaign, looks at the data with a lot of optimism. ""It’s the best of both worlds,"" he said. ""You have all of the existing Latino voters and now you have a very, very large percent who are younger so it means you even have more potential."" Also on HuffPost:"
5,COLLEGE,Professor Says She Was Fired Unconstitutionally For Cursing,Tyler Kingkade,https://www.huffingtonpost.com/entry/teresa-buchanan-lawsuit-swearing_us_56a12ba3e4b0d8cc10991ba1,Teresa Buchanan's lawsuit against LSU blames the federal government for her termination.,2016-01-22,Former LSU professor Teresa Buchanan lost her job after students complained that she used curse words and joked about the decline in sex over the course of a relationship.,https://img.huffingtonpost.com/asset/56a277ba1a00002d00ab1294.png?ops=scalefit_720_noupscale,"A former professor says she might still have her job if it weren't for the U.S. Department of Education's overly broad take on what constitutes sexual harassment.In a lawsuit filed on Wednesday, Teresa Buchanan, a terminated professor at Louisiana State University, suggested that a 2013 Education Department letter may have influenced LSU's policies and led to her firing.The letter followed an investigation of the University of Montana's handling of harassment and assault. It defined sexual harassment as ""unwelcome verbal, visual, or physical behavior of a sexual nature,"" but did not state that it must be offensive to an ""objectively reasonable person.""The Foundation for Individual Rights in Education, a civil liberties nonprofit often critical of federal efforts to address sexual assault, has said that omission is a problem. FIRE raised the alarm about the Education Department's letter back in 2013, arguing that such a broad definition of harassment would lead to a crackdown on professors.FIRE's director of litigation, Catherine Sevcenko, said on Thursday that her organization essentially knew this was coming. ""FIRE predicted that universities would silence and punish faculty by using the Department of Education's unconstitutional definition of sexual harassment -- and that's exactly what happened at LSU,"" she said.Buchanan was a tenured education professor who had worked at LSU for two decades. She lost her job after students complained that she used curse words and vulgar terms like ""pussy"" and joked about the decline in sex over the course of a relationship. ""Students complain about professors, and we have a procedure to follow, and that wasn't followed,"" Buchanan told HuffPost in July. ""Instead I was removed immediately from teaching and [referred] to human resources to investigate me for sexual harassment."" The national American Association of University Professors defended Buchanan at the time of her firing, saying she was using ""run-of-the-mill"" language that should not have been grounds for termination. LSU's faculty senate also objected to Buchanan's removal and voted in October to censure LSU President F. King Alexander, Provost Stuart Bell and Damon Andrew, the dean of the College of Human Sciences and Education.Buchanan's lawsuit names several administrators at the university as defendants, but not the Department of Education, despite the fact that it is mentioned in the complaint.LSU said in July that Buchanan created a ""consistently hostile and abusive environment in the classroom,"" and noted that ""more than one"" elementary school where she supervised student teachers had asked her not to return.""We have not been served with a lawsuit,"" said Ernie Ballard III, a spokesman for LSU. ""However, we are confident that our action regarding Ms. Buchanan was appropriate. We take our responsibility to protect students from abusive behavior very seriously, and we will vigorously defend our students’ rights to a harassment-free educational environment.""Watch an interview with Teresa Buchanan from July 2015."
6,POLITICS,Noam Chomsky's First Campaign Contribution Was To Bernie Sanders*,Zach Carter,https://www.huffingtonpost.com/entry/noam-chomsky-bernie-sanders_us_56a25a6de4b0d8cc1099d089,Online FEC records dating back to 1997 show he's given to just two candidates.,2016-01-22,"Noam Chomsky has supported just Ralph Nader and Bernie Sanders since 1997, according to online FEC records.",https://img.huffingtonpost.com/asset/56a267851f00007f00216801.jpeg?ops=scalefit_720_noupscale,"Radical intellectual Noam Chomsky has supported just two federal political candidates with campaign contributions over the past 18 years.Chomsky gave a total of $750 to Ralph Nader's 2000 presidential bid. But a month before he started cutting checks for that corporate reformer, Chomsky had already given $200 to a candidate for the U.S. House of Representatives from Vermont named Bernie Sanders.At the time, Sanders was running for his fifth term as Vermont's sole representative in the lower chamber. When Sanders ran for Senate in 2006, Chomsky added $1,000 in support, and he kicked in another $200 when Sanders sought reelection in 2012.Thus far in the presidential cycle, Chomsky hasn't given to any candidate, according to online FEC records, which date back to 1997. It's possible Chomsky could have given to campaigns that predate the federal records. Chomsky did not respond to a request for comment.Chomsky has long been a sharp critic of the capital class and its power to subvert democratic ideals. He called the Supreme Court's 2010 Citizens United decision ""The Corporate Takeover Of Democracy,"" in an article for In These Times. But Chomsky also has a pragmatic streak. He assailed President Barack Obama's international drone assassination program as a moral outrage, but encouraged swing-state voters to support his reelection in 2012, on the grounds that a Mitt Romney presidency would be worse.Chomsky is still an admirer of Sanders today, but has dinged his campaign operation for not harnessing its energy into a longer-term populist movement. ""Take, say, the Bernie Sanders campaign, which I think is important, impressive,"" Chomsky told teleSUR's Abby Martin in October. ""He's doing good and courageous things. He’s organizing a lot of people. That campaign ought to be directed to sustaining a popular movement that will use the election as a kind of an incentive and then go on, and unfortunately it's not. When the election's over, the movement is going to die. And that's a serious error.""""The only thing that’s going to ever bring about any meaningful change is ongoing, dedicated, popular movements that don't pay attention to the election cycle,"" he said. ""It's an extravaganza every four years. You have to be involved in it, so fine. We’ll be involved in it, but then we go on. If that were done, you could get major changes.""Jason Linkins and Zach Carter are co-hosts of the HuffPost Politics podcast ""So That Happened."" Subscribe here or listen to the latest episode below:  "
7,SPORTS,The Super Bowl Could Cost San Francisco Taxpayers $4.8 Million,Travis Waldron,https://www.huffingtonpost.com/entry/super-bowl-cost-san-francisco-48-million_us_56a27d15e4b0404eb8f17f68,And the city isn't even hosting the actual game.,2016-01-22,"The Super Bowl is expected to be expensive for San Francisco's police and fire departments, as well as its emergency management department. The NFL isn't reimbursing the city for expense incurred as part of hosting the game's related events.",https://img.huffingtonpost.com/asset/default-missing-image.jpg?cache=jIO2VoZgTY&ops=scalefit_720_noupscale,"The city of San Francisco will spend an estimated $4.8 million to host nine days of pre-Super Bowl events next month, according to a recently released report from the city's budget analysts.The analysis, first reported by the San Francisco Examiner, documents the types of costs associated with the event that are often unaccounted for when the NFL and Super Bowl boosters tout the benefits the game brings to its hosts.San Francisco is not hosting the actual game, which will be played at Levi's Stadium in nearby Santa Clara, but it will host related events at the NFL's ""Super Bowl City"" celebration.The primary costs come from additional expenses for city departments, including police ($1.5 million) and the fire department ($600,000). The city's transportation department will also incur an extra $2.3 million in costs, though it could recoup some of those costs through additional public transit fares.Only the city's emergency management and fire departments have budgeted for the additional expenses, according to the report, though other departments have been asked to identify surpluses that could cover the remainder of the costs -- roughly $4.3 million.The Super Bowl Host Committee, the private group that brought the game to the Bay Area, has agreed to cover just $104,000. Santa Clara was able to negotiate agreements with the Host Committee that require reimbursements for additional city services, but San Francisco has no written agreement in place with the committee, the analysis says.The NFL makes a laundry list of demands of each Super Bowl host, but it will not cover any of San Francisco's costs, even though its annual revenue figure -- $9.2 billion in 2013 -- is larger than the city's $8.9 billion budget. As part of the original Super Bowl bid, the report states, San Francisco's fire, police and emergency departments ""signed letters of assurance to not seek reimbursement from the NFL for providing additional public safety services in support of public events related to the Super Bowl.""The report recommends that the city seek an agreement similar to Santa Clara's. The analysis notes that Mayor Ed Lee's office ""expects local tax revenues generated by Super Bowl 50 to offset the City’s General Fund expenditures for these events."" A spokesperson for Lee told the Examiner that the report was a one-sided look that ignored the benefits the events will bring the city. While host committees and Super Bowl backers often tout those benefits, research has shown that mega-sporting events like the Super Bowl have little discernible impact on local economies, especially once additional costs for public services are counted.The big game has been a loser for cities in the past. The mayor of Glendale, Arizona, which hosted Super Bowl XLIX a year ago, predicted before the game that the city would lose $1 million to $2 million on the game. In the end, a city-commissioned report found that the city may have received a small financial gain but more likely lost between $579,000 and $1.2 million hosting the Super Bowl."
8,POLITICS,WaPo Bombshell: Marco Rubio Was A Teenager Once,Jason Linkins,https://www.huffingtonpost.com/entry/marco-rubio-once-drank-a-beer-omg_us_56a257afe4b0404eb8f155b0,An early contender for 2016's most superfluous campaign story.,2016-01-22,The shocking new revelation that presidential candidate Marco Rubio once stood in a park that was closed.,https://img.huffingtonpost.com/asset/56a261221f00007f002167ed.jpeg?cache=7e08BDRPQk&ops=scalefit_720_noupscale,"Now that it's pretty clear that either Donald Trump or Ted Cruz is going to be the Republican nominee for president, reporters who've collected dribs and drabs of information on the candidates once thought to be contenders are taking that material and stitching it up into story form. After all, if ""labor"" doesn't result in ""content"" then can these reporters truly say they ever existed at all?That's the best explanation for a story by Manuel Roig-Franzia and Scott Higham in today's Washington Post titled ""Rubio’s summer of ’90: An arrest, then newfound purpose."" In it, you'll find the incredibly true tale of that time Rubio was nicked by the cops for standing in a park that was closed, and how this could have potentially been -- you never know! -- the singularly profound experience that would forever change his life.The backstory on this: Rubio is a man who is alive and 18 years old. He has some bad grades and he hurts his neck, and he needs money. Poor dissolute Marco, what's he gonna do?Ehhh, he's going to hang out in a park at the wrong time, drinking a beer, that's all. Per the Post:He resolved to go back to Florida and get his life on a path to success. Instead the 18-year-old added to his troubles after returning to Miami for summer break: He was arrested one night in May 1990 for being in a crime-plagued public park after closing time, according to police records and an interview with a friend who was cited with Rubio that night.That's it? I'm just not feeling the weight, guys. What else do you got?The previously unreported misdemeanor, which eventually was dismissed, tugged Rubio into the criminal-justice system just one year after the conviction of his brother-in-law in a major drug-trafficking case had exacted a devastating toll on his family.I can picture the scene. Mom is wailing in the bedroom. Dad, a bent and downcast portrait of wrecked middle-class masculinity in the kitchen, stares at his feet, as his son Marco quietly, almost imperceptibly, vibrates with worry by the stove. Marco's dad slowly unwraps himself, and takes a deep breath before speaking:DAD: Marco! How could you? First your brother-in-law devastates the family by being convicted in a major drug-trafficking case, and now you? Standing in a park after it closed? How are we going to come back from this?And he obviously never did. But as the Post relates, he did forget to include this event in his book, An American Son. Now, my explanation would be that getting poached by a beat cop for drinking in public while underage is a pretty common thing to happen to anyone around Marco's age, and when you write a memoir, you tend to want to focus on details that set you apart from everyone else on the planet. At the very least, you don't include quotidian things like that time you were 18 and had a beer like almost every other 18-year-old.(Sometimes I think political reporters don't understand that memoirs have editors and they typically inveigh against including every piddling detail of your stupid life, because no one wants to read a 4,000-page autobiography about Florida's junior senator.)The Post reporters seem to have gotten it into their heads that this event was some sort of formative, game-changing experience that put Rubio on the path to coming in fourth, or maybe third, in a presidential primary. Go read, if you want, and judge for yourself, but the only real conclusion the paper arrives at is that some stuff happened, and then Rubio got nicked in a park, and then some other stuff happened, and here we are. To listen to the other guy who got cited by police, Rubio's friend Angel Barrios, it doesn't sound like a big deal at all: “We were there just hanging out.” He goes on to say that he and Rubio received, from the police, a promise-to-appear form, ostensibly obligating them to appear in court. “I don’t think we even ended up going to court,"" he told the Post.So there you have it. For a brief moment as a teen, Marco Rubio's life was almost but not quite as riveting as a Hold Steady lyric. Stay tuned to find out if Rubio will strenuously deny ever having gotten with your little hoodrat friend.Also on HuffPost:"
