,category,headline,authors,link,short descr,date,image_caption(s),image_link(s),article
13,ENTERTAINMENT,5 Reasons We Love Kristen Bell,Lily Karlin,https://www.huffingtonpost.com/entry/5-reasons-we-love-kristen-bell_us_55a93855e4b0896514d132b2,"Bell's skills aren't limited to the straight acting sphere. She also kills it in the singing department, most prominently",2015-07-18,"LOS ANGELES, CA - JANUARY 07: Actress Kristen Bell attends The 41st Annual People's Choice Awards at Nokia Theatre LA Live on January 7, 2015 in Los Angeles, California. (Photo by Frazer Harrison/Getty Images for The People's Choice Awards)",https://img.huffingtonpost.com/asset/55a957401200002c0013566e.jpeg?ops=crop_16_151_1827_2347%2Cscalefit_720_noupscale,"Could Kristen Bell literally be any cooler?The actor, who rose to fame in the titular role on ""Veronica Mars,"" has since become a Hollywood mainstay, with iconic roles in films including ""Frozen"" and ""Forgetting Sarah Marshall."" She also publicly advocates for causes like animal rights and environmentalism, and has a very excellent Twitter.In honor of Bell's birthday on July 18, The Huffington Post put together some of the things we love most about the star. 1. She sings like an angel.Bell's skills aren't limited to the straight acting sphere. She also kills it in the singing department, most prominently in her starring role as Anna in Disney's ""Frozen."" In case you're not familiar with her beautiful voice, here's a little sampling:Bonus cool points: Bell was partly responsible for making her ""Frozen"" character so relatable. She opened up to Buzzfeed last year about her role in the development process:My character initially was written very, what I would call, prissy. She was very girly, [and] I kind of pushed more for something weirder. Something different. Something more unique and unlike anything we’d seen before ... I never saw a Disney Princess that I identified with when I was growing up. They all had good posture, they all woke up batting their eyelashes, no one had bad breath; I couldn’t relate. I wanted to see someone that felt like me.  Bell also brought us a relevant texting-themed Christmas song:Amazing.2. She speaks out about her beliefs.Bell uses her celebrity platform to support causes including animal rights, environmentalism, voter education and social equality. She postponed her marriage to her now-husband Dax Shepard until California legalized same-sex marriage.“We’ve been very vocal about not wanting to be married in a state that doesn’t allow that right to all of its citizens,"" Bell told Celebuzz back in 2012. ""We’ll wait until California gets on the right side of history.“Bell also consistently works to protect and empower children. Alongside Shepard, Bell launched a campaign to stop paparrazzi from taking invasive photos of celebrities' kids, and urged major outlets, to large success, to stop running the images.Not to mention her consistently great insight into the world of parenting, and raising young women in particular:""I think we slighted a lot of girls [in the past] by trying to give them advice. And I love to give unsolicited advice, so I’m just as guilty,” Bell said to Buzzfeed in 2014. “But something I’ve learned ... is that people are their own best moral compass and introspection is something that is not encouraged enough today.” 3. To put it simply: Veronica MarsBell likely entered your consciousness as bad-ass teen private eye in the much too short-lived series ""Veronica Mars,"" which ran from 2004-2007. Though the show premiered more than 10 years ago, it's fan base (which includes us!) continues to have rabid interest in the series, thanks in no small part to Bell's fantastic work in the titular role. In 2014, Bell reprised the part for a Veronica Mars film, funded by fans on Kickstarter. And as of earlier this month, it seems like the series could have even more life. Though ""nothing [is] in the works,"" show creator Rob Thomas told TV Line's Michael Ausellio that both he and Bell would be open to doing another ""Mars"" project -- potentially a ""short-run series"": “Kristen [Bell]’s game, I’m certainly game,"" he said. “Like a Veronica Mars True Detective is really appealing to us, that sort of setup.""In case it's of any bearing: we, too, are game. 4. She is extremely hilariousBell is obviously acclaimed for her work in dramas (see reason #3) and musicals (see reason #1), but she truly brings down the house as a comic actress as well.The actor steals the screen as Sarah Marshall in 2008 comedy ""Forgetting Sarah Marshall,"" and makes us LOL as very intense catering professional Uda Bengt in Starz series ""Party Down"" (our personal favorite funny work from the actor).Bell also rocks it in the Ryan Hansen-starring CW Seed meta ""Veronica Mars"" spin-off ""Play It Again, Dick."" 5. She REALLY loves sloths.No explanation necessary.BONUS: She's the voice of ""Gossip Girl."" You know we love you.Happy birthday, Kristen!"
14,THE WORLDPOST,Greece Orders Banks To Re-Open Monday,"Karolina Tagaris, Reuters",https://www.huffingtonpost.com/entry/greece-banks-re-open_us_55aa59a6e4b065dfe89e849e,"ATHENS, July 18 (Reuters) - The Greek government ordered banks to open on Monday, three weeks after they were shut down to",2015-07-18,"<p><span style=""color: #333333; font-family: FuturaStdBook, monospace; font-size: 14px; background-color: #ffffff;"">Greek Prime Minister Alexis Tsipras looks up during a swearing-in ceremony of the newly appointed members of the government at the Presidential Palace in Athens on July 18, 2015.</span></p>",https://img.huffingtonpost.com/asset/55aa60f71700004000bafb18.jpeg?ops=scalefit_720_noupscale,"ATHENS, July 18 (Reuters) - The Greek government ordered banks to open on Monday, three weeks after they were shut down to prevent the system collapsing under a flood of withdrawals, as Prime Minister Alexis Tsipras looked to the start of new bailout talks next week.The decree to re-open the banks came hours after new ministers were sworn in following a cabinet reshuffle in which Tsipras replaced dissident members of his ruling Syriza party following a revolt over the tough bailout terms.In a move that marked a split with the main leftist faction in the ruling Syriza party, Tsipras sacked hardline former Energy Minister Panagiotis Lafazanis and two deputy ministers following a party rebellion in which 39 Syriza lawmakers withheld support from the government over the package.Panos Skourletis, a close Tsipras ally who left the labor ministry to take over the vital energy portfolio, said the reshuffle marked “an adjustment by the government to a new reality.”The reshuffle allowed Tsipras to replace cabinet rebels with allies of his own or from his junior coalition partners, the right-wing Independent Greeks party.The first action of the new cabinet was to sign off on a decree to reopen banks on Monday with slightly more flexible withdrawal limits that allow a maximum of 420 euros a week in place of the strict limit of 60 euros a day currently in place.But restrictions on transfers abroad and other capital controls remain in place.The move had been widely expected after the European Central Bank agreed to re-open the emergency credit lines which the tottering Greek banking sector needs to survive.Tsipras now intends to seal the bailout accord with European partners over the next few weeks before likely new elections which Interior Minister Nikos Voutsis said this week could happen in September or October.“Our aim is to negotiate hard for the terms of the agreement, not just to seal it, but on how it will be implemented. There are many vague terms in the text,” said newly-appointed Labor Minister George Katrougalos.He said the government, elected in January on an anti-austerity platform, would fight for an agreement that was “socially just” and dismissed suggestions that it would have to take on the powerful labor unions and risk street protests.“The Left is with demonstrations. The Left wants the people on the streets,” he said.TOUGH BAILOUT TERMSThe deal, approved with the support of opposition parties on Thursday after 39 Syriza rebels withheld their backing, agrees a painful mix of tax hikes, spending curbs and pension cuts as well as a rollback of collective bargaining agreements.In addition, 50 billion euros ($54.14 billion) in public assets are to be placed in a special privatization fund as collateral for loans of up to 86 billion euros that must be agreed with European partners.Acceptance of the tough bailout terms marked a turnaround for Tsipras after months of acrimonious talks and a referendum that resoundingly rejected a less stringent deal proposed by the lenders. But opinion polls suggest the prime minister's popularity remains high.A poll published on Saturday in the leftwing Efimerida Ton Syntaknon newspaper suggested Syriza would get 42.5 percent of the vote if an election were held now, almost double conservative New Democracy's 21.5 percent.In addition, 70 percent said they would prefer to accept the bailout deal if it kept Greece in the euro.($1 = 0.9236 euros) (Writing by James Mackenzie; Editing by Tom Heneghan and Louise Heavens)Also on HuffPost:"
15,THE WORLDPOST,ISIS Used Chemical Weapons In Syria: Monitor,,https://www.huffingtonpost.com/entry/isis-used-chemical-weapons-in-syria-monitor_us_55a9b04ee4b065dfe89e82da,The militants allegedly attacked Kurdish forces and civilians with poison gas.,2015-07-18,"A resident of Tabqa city touring the streets on a motorcycle waves an Islamist flag in celebration after Islamic State militants took over Tabqa air base, in nearby Raqqa city Aug. 24, 2014.",https://img.huffingtonpost.com/asset/587c307b170000880192a3d4.jpeg?cache=UWW4egp57I&ops=scalefit_720_noupscale,"The Islamic State group used poison gas in attacks against Kurdish-controlled areas of northeastern Syria in late June, a Syrian Kurdish militia and a group monitoring the Syrian conflict said on Saturday.Two UK-based organizations investigating the attack said they had confirmed Islamic State's use of chemical weapons against Kurdish forces and civilian targets in Syria and Iraq, where they said chemical agents were also used in an attack on an Iraqi Kurdish peshmerga position on June 21 or 22.Kurdish forces are playing a vital role in the fight against Islamic State in both Syria and Iraq. The ultra-radical group has seized wide areas of both countries, declaring them part of a cross-border ""caliphate"" claiming to rule all Muslims.The Syrian Kurdish YPG militia said Islamic State had fired ""makeshift chemical projectiles"" on June 28 at a YPG-controlled area of the city of Hasaka, and at YPG positions south of the town of Tel Brak to the northeast of Hasaka city.It was the first Islamic State attack of its kind against the YPG, said Redur Xelil, spokesman for the militia.The type of chemical used had not been definitively determined, he said. None of the YPG fighters exposed to the gas had died because they were quickly taken to hospital.The White House said it was aware of the reports of chemical weapons use and was seeking additional information.""We continue to monitor these reports closely,"" Alistair Baskey, a spokesman for the White House National Security Council, said in a statement.The YPG has emerged as an important partner for the U.S.-led campaign against Islamic State. Backed by U.S.-led air strikes, the YPG has seized wide areas of northern Syria from Islamic State this year.The Syrian Observatory for Human Rights, a UK-based group that reports on the war using an activist network on the ground, said it had also documented the use of poison gas by Islamic State in an attack on a village near Tel Brak on June 28.It said 12 YPG fighters had been exposed to the gas. The Observatory also said it had received information about the gas attack on Hasaka city but gave no further details.In a statement, the YPG said its forces had captured industrial grade gas masks in the last four weeks from Islamic State fighters, ""confirming that they are prepared and equipped for chemical warfare along this sector of the front"".MOSUL DAMIt said soldiers exposed to the gas ""experienced burning of the throat, eyes and nose, combined with severe headaches, muscle pain and impaired concentration and mobility"".""Prolonged exposure to the chemicals also caused vomiting,"" it added.The YPG said it was investigating Islamic State's use of chemical weapons with help from international experts from UK organizations Conflict Armament Research and Sahan Research.In a separate statement, those organizations said the three attacks - two in northeastern Syria and one in Iraq - were ""the first documented use by (Islamic State) forces of projectile-delivered chemical agents against Kurdish forces and civilian targets"".In the attack in Iraq, Islamic State forces had fired a projectile ""containing a liquid chemical agent at the peshmerga Mosul Dam checkpoint"", they said. ""The characteristics and clinical effects of this substance are consistent with a chlorine chemical agent,"" the statement said.Iraqi Kurdish authorities said earlier this year they had evidence Islamic State had used chlorine against their peshmerga fighters in northern Iraq.Reports of poison gas attacks by the Islamic State group could not be independently verified by Reuters.The Nusra Front, al Qaeda's affiliate in the Syrian war, has previously accused Islamic State of setting a booby trap using barrels of chlorine.(Additional reporting by Roberta Rampton; Writing by Tom Perry; Editing by Toni Reinhold and Ken Wills)"
16,SPORTS,F1 Driver Jules Bianchi Dies 9 Months After Suzuka Crash,,https://www.huffingtonpost.com/entry/f1-driver-jules-bianchi-dies-9-months-after-suzuka-crash_us_55a9d1a1e4b0caf721b2fb40,Bianchi is the first F1 driver to die from injuries during a race since F1 legend Ayrton Senna.,2015-07-18,"<p>Jules Bianchi of France and Marussia receives urgent medical treatment after crashing during the Japanese Formula One Grand Prix at Suzuka Circuit on October 5, 2014 in Suzuka, Japan.</p>",https://img.huffingtonpost.com/asset/55a9d42f1700004000bafb13.jpeg?ops=scalefit_720_noupscale,"French Formula One driver Jules Bianchi has died of critical head injuries sustained at last year's Japanese Grand Prix, his family said in a statement on Saturday. He was 25.Bianchi had been in a coma since the accident at Suzuka last October. He passed away at a hospital in Nice, near his parents' home in the south of France.""Jules fought right to the very end, as he always did, but today his battle came to an end,"" said the Bianchi family.""The pain we feel is immense and indescribable.""Bianchi was the first driver since Brazilian triple world champion Ayrton Senna, at Italy's Imola circuit in May 1994, to die from injuries sustained during a grand prix weekend.""We are devastated to lose Jules after such a hard-fought battle,"" his Manor F1 team Tweeted. ""It was a privilege to have him race for our team.""The Frenchman suffered severe head injuries when, in wet conditions and fading light, his Marussia slammed into a recovery tractor while it was attempting to remove Adrian Sutil's crashed Sauber. Television images of the Oct. 5 accident, which were not publicly broadcast but have since been posted on the internet, showed the Marussia's roll hoop had been entirely ripped off in the massive impact.The race was stopped and the unconscious driver was extracted from the wrecked car and taken by road ambulance to the nearby hospital.Bianchi, who was also contracted to Ferrari and was considered to have a bright future in the sport, was initially treated in the Mie General Medical Centre in Yokkaichi.His parents and siblings flew out from France and were a constant presence at his bedside, hoping against hope for a miracle.'HEARTS AND MINDS'An International Automobile Federation (FIA) report said in December that the Frenchman had not slowed sufficiently under warning flags before crashing.The report found that Bianchi's car hit the tractor at 126 kph and said medical services were not at fault in their handling of the aftermath.His family praised medical staff in Nice and Mie Prefecture for their care over the last nine months and asked for privacy as they sought to come to terms with the loss.""Listening to and reading the many messages made us realize just how much Jules had touched the hearts and minds of so many people all over the world,"" the statement said.""We would like to ask that our privacy is respected during this difficult time, while we try to come to terms with the loss of Jules.""Bianchi's father, Philippe, had told French radio earlier this month that he was ""less optimistic"" of a recovery. In May he said they had been preparing for the worst.""It's hard to get up in the morning while telling yourself that you're not sure whether your son is going to live and every day is like that,"" he said.(Reporting by Peter Rutherford and Alan Baldwin.; Editing by Nick Mulvenney)"
17,RELIGION,A Joyous Eid In Somalia: Ugaaso Abukar Boocow's Instagram Photos Capture The Celebrations In Mogadishu,Carol Kuruvilla,https://www.huffingtonpost.com/entry/instagram-eid-in-somalia_us_55a80840e4b0896514d0b193,"As Muslims around the world celebrated Eid al-Fitr on Friday, Ugaaso Abukar Boocow was in Somalia, capturing the festivities",2015-07-18,<p>A young woman displays her henna tattoo over a view of Liido Beach.</p>,https://img.huffingtonpost.com/asset/55a9cfd81300002f009d7b0b.jpeg?ops=scalefit_1280_noupscale,"As Muslims around the world celebrated Eid al-Fitr on Friday, Ugaaso Abukar Boocow was in Somalia, capturing the festivities in the country for her more than 90,000 Instagram followers.Boocow, a 27-year-old civil servant living in Mogadishu, sees herself as an ambassador of sorts for Somalia. Since 1991, Somalia has endured civil war, a broken economy, most recently, terrorist attacks from militants groups like al-Shabab. But there's another side to life in Somalia, one that Boocow wants to share with the world. The woman's Instagram feed is filled with images of beaches, food, and festivities -- interjected with humorous sketches about Somalian culture.This was Boocow's first year celebrating Eid in Somalia. Born in Canada, she fell in love with the country after traveling to Somalia to visit her mother. ""I find hope in the resiliency of the Somali people. They've been through so much, but they're so graceful, so wilful, so determined to move on. It's impressive!"" she told HuffPost. Boocow agreed to take over HuffPost Religion's Instagram feed on July 17, giving us a glimpse of what it's like to celebrate Eid in Mogadishu, Somalia's capital. Scroll down to see her photos and follow her on Instagram for more."
18,RELIGION,A Joyous Eid In Somalia: Ugaaso Abukar Boocow's Instagram Photos Capture The Celebrations In Mogadishu,Carol Kuruvilla,https://www.huffingtonpost.com/entry/instagram-eid-in-somalia_us_55a80840e4b0896514d0b193,"As Muslims around the world celebrated Eid al-Fitr on Friday, Ugaaso Abukar Boocow was in Somalia, capturing the festivities",2015-07-18,"<p><span style=""color: #222222; font-family: arial, sans-serif; font-size: 12.8000001907349px; background-color: #ffffff;""> Young girls wearing their Eid outfits.</span></p>",https://img.huffingtonpost.com/asset/55a9d0c72a000028007af72f.jpeg?ops=scalefit_1280_noupscale,"As Muslims around the world celebrated Eid al-Fitr on Friday, Ugaaso Abukar Boocow was in Somalia, capturing the festivities in the country for her more than 90,000 Instagram followers.Boocow, a 27-year-old civil servant living in Mogadishu, sees herself as an ambassador of sorts for Somalia. Since 1991, Somalia has endured civil war, a broken economy, most recently, terrorist attacks from militants groups like al-Shabab. But there's another side to life in Somalia, one that Boocow wants to share with the world. The woman's Instagram feed is filled with images of beaches, food, and festivities -- interjected with humorous sketches about Somalian culture.This was Boocow's first year celebrating Eid in Somalia. Born in Canada, she fell in love with the country after traveling to Somalia to visit her mother. ""I find hope in the resiliency of the Somali people. They've been through so much, but they're so graceful, so wilful, so determined to move on. It's impressive!"" she told HuffPost. Boocow agreed to take over HuffPost Religion's Instagram feed on July 17, giving us a glimpse of what it's like to celebrate Eid in Mogadishu, Somalia's capital. Scroll down to see her photos and follow her on Instagram for more."
