,category,headline,authors,link,short descr,date,image_caption(s),image_link(s),article
14,MEDIA,Did Binge-Watching Fox News Inspire This Man To Threaten Muslims?,Christopher Mathias,https://www.huffingtonpost.com/entry/fox-news-anti-muslim-rhetoric_us_56a12d57e4b0d8cc10991d50,Rhetoric has consequences.,2016-01-22,"In a letter to the Council on American-Islamic Relations, dated Dec. 10, 2015, John David Weissinger expresses regret over the threats he previously made against the organization.",https://img.huffingtonpost.com/asset/56a1116d2a00002c00031045.jpeg?ops=scalefit_720_noupscale,"On Jan. 14, 2015, John David Weissinger called the San Diego office of the Council on American-Islamic Relations -- a civil rights group that advocates on behalf of U.S. Muslims -- and left a terrifying voice mail.“You're gonna be in the news. It's gonna be like Charlie Hebdo,” said Weissinger, 54, referring to the deadly attack on the French satirical magazine that had taken place a week earlier. ""Guess what? It's coming your way, motherfuckers.""The following audio contains profanity.Weissinger followed up with an email to CAIR spokesman Ibrahim Hooper.""I'll show up any day, any time with plenty of firepower to kill any and every one of you fuckers,"" Weissinger wrote. ""It's coming your way and Hell is coming with it.""CAIR reported the voice mail to San Diego police, who tracked Weissinger down and arrested him two weeks later in his home. There, they also recovered an unlicensed AR-15, an assault weapon that is illegal in California, and an illegal large-capacity ammunition magazine.Weissinger pled guilty in August to felony charges of possessing an illegal firearm and making a criminal threat determined to be a hate crime, along with a misdemeanor charge of interfering with civil rights. This Tuesday, during a sentencing hearing, Weissinger's attorney advanced a peculiar argument: His client, who was drunk when he made the threats, had committed the crimes “after a week of watching Fox News over and over.”“Fox News is a hate machine, spewing out horrible things” about Muslims, attorney Michael Malowney said.Malowney said he wasn't trying to make up a ""lame excuse"" for Weissinger -- who he said struggles with depression and anxiety -- or say that ""Fox News made him do it."" But Malowney did argue that Islamophobia, of the sort propagated by media outlets like Fox News, helped push a susceptible man over the edge.Fox News did not respond to a request for comment Friday.It's true that Fox News has served as a platform for some of the country's most vile Islamophobia. According to the liberal media watchdog group Media Matters for America, in the week after the Charlie Hebdo attacks -- when Weissinger was watching Fox News constantly -- the cable channel ramped up its rhetoric against Muslims. Host Sean Hannity, for example, asked whether the U.S. should ""insist"" on assimilation from Muslim immigrants. Bob Beckel, the channel’s supposedly liberal counterweight, flat-out declared, ""I'm an Islamophobe.""Fox News invited one polemicist after another to rail against Muslims in broad, blanket terms. Steve Emerson, a self-styled ""terrorism expert"" of limited credibility, appeared on the channel at least four times in the week after the Charlie Hebdo killings. Emerson claimed that Birmingham, England, was a ""totally Muslim"" city ""where non-Muslims just simply don't go in."" Birmingham is in fact 22 percent Muslim. In another appearance, Emerson said that Europe was ""finished"" because it had too many Muslims who hadn't assimilated to Western culture. In response, U.K. Prime Minister David Cameron called Emerson ""clearly an idiot.""Robert Spencer, director of the anti-Muslim website Jihad Watch, claimed on Fox News' “Hannity” that a ""core principle"" of Islam is ""the idea of emigrating to a new place to conquer and Islamize it."" Spencer is a known personality on the anti-Muslim circuit who “engages in fear-mongering through steady reference to theories like 'stealth jihad,' eminent 'Islamization of America,' and the infiltration of Congress by 'Muslim spy interns,’” according to the Southern Poverty Law Center.Brigitte Gabriel, once described by an editor of The Oxford History of Islam as a ""professional Muslim basher,"" is the founder of ACT! for America, a group the SPLC says has ""eagerly tapped into a groundswell of anti-Muslim rage and done what it could to fan the flames."" Gabriel appeared on Fox News multiple times after the Charlie Hebdo attacks, arguing that Europe was ""paying the price"" for allowing Muslims in after World War II. Europe, she said, had ""ignored the cancer growing within its body when it was at stage 2.""Fox News also had Frank Gaffney on the air, a man described by the SPLC as ""the anti-Muslim movement's most paranoid propagandist."" Gaffney once accused the prominent conservative Grover Norquist of being a mole for the Muslim Brotherhood.People commit crimes for all kinds of reasons. But it's impossible to deny that rhetoric has consequences.There's no available data yet on hate crimes in the U.S. following the Charlie Hebdo attacks. But Professor Brian Levin, a criminologist at California State University, San Bernardino, has analyzed hate-crime data for the months following other recent attacks in Paris and San Bernardino, California. The militant group that calls itself the Islamic State claimed credit for the Paris killings, while authorities say the San Bernardino shooters were adherents of radical Islamic theology and admirers of ISIS.After the Nov. 13 attacks in Paris and the Dec. 2 shootings in San Bernardino, speakers on Fox News and other cable channels relentlessly demonized Islam and argued that all Muslims should be considered dangerous. According to Levin's data, the number of U.S. hate crimes targeting Muslims and mosques during that period was three times as high as in previous months. The Huffington Post alone has documented nearly 80 anti-Muslim incidents in the U.S. and Canada in the two months since the Paris attacks.""Agenda-driven media outlets like Fox create an atmosphere in which hate crimes are more likely to occur,"" Hooper said. ""It's not a shock to anyone that someone taking on a steady diet of Fox evening talk programs would come away with Islamophobic view points.”The judge didn't buy Weissinger’s Fox News defense on Tuesday, sentencing him to a year in prison and five years’ probation.Malowney told HuffPost he wasn't surprised by the decision. Weissinger was ultimately responsible for his own actions, he said, and the judge ""wanted to send [the] message that you can't do this.""Still, Malowney maintained that exposure to anti-Muslim propaganda was a ""mitigating factor” in his client’s case.""He lashed out for sure at who he thought was hurting the country,"" Malowney said. ""There are going to be more people like this when Fox News broadcasts such hatred.”It would be a huge oversimplification, of course, to claim that Fox News and Fox News alone has been responsible for the rising tide of anti-Muslim acts and sentiments. Still, the role of media in these circumstances can't be ignored. A 2010 academic study from the University of Exeter's European Muslim research center, for example, found that anti-Muslim media coverage had led directly to a rise in hate crimes against London's Muslim population. ""The report provides prima facie and empirical evidence to demonstrate that assailants of Muslims are invariably motivated by a negative view of Muslims they have acquired from either mainstream or extremist nationalist reports or commentaries in the media,"" the report says.And Fox News can certainly boast a large reach. It's the country's top cable news channel, according to Nielsen data, and often beats out ESPN in the ratings. An average of 1.8 million people tune in to Fox News' primetime programming each night.Weissinger wants Hooper and other employees at CAIR to understand how sorry he is. He wept in court Tuesday when a CAIR employee described the ""terror"" she felt upon hearing his threatening voice mail. In a Dec. 10 letter to the organization, Weissinger wrote that ""nobody should be subjected to the type of harassment and language I displayed.""After a year of ""support and therapy,"" the letter continues, ""I understand peaceful Muslims are not in any way responsible for the horrible events taking place around the world. I have no hatred toward any religion.""Malowney told HuffPost that Weissinger ""blames himself for being under the influence of booze and Fox News."" Both are vices, Malowney added, that Weissinger has recently decided to give up."
15,MEDIA,Here Are The Best Things The National Review Said About Trump... And His Lame Response,Willa Frej,https://www.huffingtonpost.com/entry/national-review-trump-best-quotes_us_56a1ecb9e4b076aadcc61f18,The conservative magazine published an entire symposium bashing the Republican presidential candidate.,2016-01-22,Trump Announces Candidacy for 2016 Presidential Election,https://img.huffingtonpost.com/asset/56703dc71900002300789e6b.jpeg?ops=scalefit_960_noupscale,"Conservative magazine 'National Review' didn't mince words in its monster manifesto against Republican presidential candidate Donald Trump.The publication released the essay on Thursday night, and boy was it a doozy! Here are some of the best quotes from the article:On Trump's threat to the GOP""Trump is a philosophically unmoored political opportunist who would trash the broad conservative ideological consensus within the GOP in favor of a free-floating populism with strong-man overtones.""On his often left-leaning stances: ""He and Bernie Sanders have shared more than funky outer-borough accents.""On his immigration plan:""Trump piles on the absurdity by saying he would re-import many of the illegal immigrants once they had been deported, which makes his policy a poorly disguised amnesty (and a version of a similarly idiotic idea that appeared in one of Washington’s periodic “comprehensive” immigration reforms).""On his proposals to defeat the so-called Islamic State:""For someone who wants to project strength, he has an astonishing weakness for flattery, falling for Vladimir Putin after a few coquettish bats of the eyelashes from the Russian thug.""On his not-so-conservative ways:""His obsession is with “winning,” regardless of the means — a spirit that is anathema to the ordered liberty that conservatives hold dear and that depends for its preservation on limits on government power.""On his lack of political experience:""He is like a man with no credit history applying for a mortgage — or, in this case, applying to manage a $3.8 trillion budget and the most fearsome military on earth.""On his questionable success as a businessman:""Few of us will ever have the experience, as Trump did, of having Daddy-O bail out our struggling enterprise with an illegal loan in the form of casino chips.""Greatest closing line ever?:""Donald Trump is a menace to American conservatism who would take the work of generations and trample it underfoot in behalf of a populism as heedless and crude as the Donald himself.""Trump responded in typical Trump fashion... on Twitter, chastising his critics.The Republican National Convention decided Thursday night to disinvite the magazine from an upcoming GOP debate.""We expected this was coming,"" publisher Jack Fowler said in response. ""Small price to pay for speaking the truth about The Donald.""Read the entire National Review editorial here."
16,POLITICS,"As Reproductive Rights Hang In The Balance, Debate Moderators Drop The Ball",Samantha Lachman and Laura Bassett,https://www.huffingtonpost.com/entry/2016-election-abortion_us_56a2681ae4b076aadcc66b98,The Democratic presidential hopefuls haven't been asked about abortion in any of the debates so far.,2016-01-22,"Sen. Marco Rubio (R-Fla.), Donald Trump, and Sen. Ted Cruz (R-Texas) have not been asked about reproductive rights in recent GOP presidential debates.",https://img.huffingtonpost.com/asset/56a26ad41f00005000216805.jpeg?ops=crop_0_20_3000_1005%2Cscalefit_720_noupscale,"WASHINGTON -- Forty-three years after the Supreme Court established the right to a safe and legal abortion in Roe v. Wade, the stakes have never been higher for those on both sides of the abortion debate. States have enacted 288 new abortion restrictions in the past five years that have shut down a slew of clinics across the country, and the next president could nominate Supreme Court justices who will determine the fate of legal abortion for decades to come. But even as abortion access for millions of women hangs in the balance, the issue has somehow been neglected by presidential debate moderators, causing the issue of reproductive rights to fade from the 2016 race. The Democratic candidates haven't been asked about reproductive rights at all in any of their four debates, and the Republicans have only been asked about abortion and funding for Planned Parenthood in the first two of the six debates they've participated in so far. Advocates working for and against abortion rights are baffled by the silence.“There are real and important differences between candidates here, and it's a loss for American women that they haven't been explored,” said Jess McIntosh, a spokeswoman for EMILY’s List, a group that helps elect pro-choice women to office.NBC moderators did not ask how Sen. Bernie Sanders’ (I-Vt.) new health plan, released just two hours before the Democratic debate the network hosted Sunday, would handle public funding for abortion, and did not press Hillary Clinton on her view that federal restrictions on Medicaid funding for abortion should be repealed. Sens. Marco Rubio (R-Fla.) and Ted Cruz (R-Texas) haven't been asked in the past four GOP debates about their opposition to allowing victims of rape or incest to get abortions, a position that is significantly more conservative than those held by prior Republican presidential nominees.The only abortion-related question GOP frontrunner Donald Trump has fielded during a debate was back in August, when Fox's Megyn Kelly asked him about his 1999 comment that he was ""very pro-choice."" His stance on abortion is much murkier these days, but no other moderators have chosen to ask him about it.Americans United for Life, an anti-abortion group, wants candidates on both sides to explain whether they support public funding for abortion or the kinds of clinic regulations that conservative states have passed to make it difficult for abortion providers to stay open.“Pro-life Americans would love to know whether candidates support health and safety standards for women who are exposed to great risks in abortion clinics,” said Kristi Hamrick, a spokeswoman for AUL. On the Democratic side, Clinton took it upon herself to mention Republican attacks on reproductive rights and Planned Parenthood in the first Democratic debate in October, even though the question she had been asked was about the political feasibility of passing paid family leave legislation. Neither Sanders nor former Maryland Gov. Martin O'Malley have brought up abortion or Planned Parenthood in any debates.None of the networks The Huffington Post reached out to would say why they hadn’t asked about reproductive justice in the Democratic debates they have sponsored. One network spokeswoman even asked whether such a debate question would be ""exciting,"" since, she presumed, Clinton and Sanders hold similar positions on the issue.Ilyse Hogue, president of NARAL Pro-Choice America, suggested the moderators simply don’t care about the nuances of a “pro-choice” position.“Unfortunately, we're battling decades of conventional wisdom of 'check-the-box pro-choice-ism,' which is just say you're pro-choice and move on and talk about things people really care about,” Hogue said. “The idea of how and when and if we grow our families is integrally tied up with our economic progress and our education and our debt and everything else. So I think it’s an old model of thinking about things that we've been very pleased to see Hillary breaking through.”After Sunday’s debate, Clinton campaign chairman John Podesta argued that reproductive rights have “just not been a big issue” for Sanders. Sanders’ camp obviously disagrees. Tad Devine, a senior campaign strategist, told HuffPost that “Bernie is one of the strongest supporters of a woman’s right to choose” and that reproductive rights would be “one of his core principles” as president. Jeff Weaver, Sanders’ campaign manager, said that Sanders' health care plan would cover abortions. “You just do it when you pass the plan,” Weaver said. “It’s part of the list of comprehensive benefits that are covered by the plan.""Sanders has criticized GOP candidates for their stances on abortion, spoken out against abstinence-based education and said he would “expand” funding for Planned Parenthood. He’s said he supports the EACH Woman Act, which would mandate insurance coverage for abortion services, and said in a statement Friday that he would ""rescind the Hyde amendment and resist attempts by states to erect roadblocks to abortion."" But the senator didn’t endear himself to reproductive rights groups earlier this week when he called Planned Parenthood and NARAL part of “the establishment."" He partially walked back those comments on Thursday, after intense criticism, saying that such groups are “fighting the important fights that have to be fought.” But he had already alienated himself from some advocates by characterizing abortion as a “social issue” in an interview with Rolling Stone last year. Those who back Clinton argue that reproductive justice and economic justice are intrinsically linked and that Sanders doesn’t seem to understand the connection.Hogue said NARAL endorsed Clinton over Sanders because Clinton is more outspoken and proactive on abortion and is the most vocal in calling for the repeal of the Hyde Amendment, a measure inserted regularly into appropriations bills that prevents federal dollars from paying for most abortions. Clinton has spoken this election season about Hyde’s disproportionate impact on low-income women of color.“We need champions. And a champion means not just voting right when it comes up on the floor, but actually sponsoring legislation, which Hillary did a lot more in her time in the Senate,” Hogue said. “It means actually speaking about things on the stump.”The Democratic candidates don't disagree about the need to fight back against conservative attempts to restrict health care access. But Clinton frequently talks about those attacks in her stump speech, while Sanders does not. That's a revealing difference that moderators should explore in the primary's two remaining debates. "
17,ENTERTAINMENT,"In This 'Mojave' Clip, Oscar Isaac Is Not Your Charming, Groovy Internet Crush",Matthew Jacobs,https://www.huffingtonpost.com/entry/mojave-clip_us_56a11649e4b0d8cc1098f954,He's a homicidal maniac. But maybe that's your thing?,2016-01-21,"""13 Hours: The Secret Soldiers of Benghazi"" (Jan. 15)",https://img.huffingtonpost.com/asset/5689ad4d1600000001eb9de0.jpeg?ops=scalefit_960_noupscale,"Oscar Isaac has played heroes like Poe Dameron, misanthropic artists like Llewyn Davis and menacing innovators like Nathan Bateman. The Internet loves him all the same. But in ""Mojave,"" which premiered at last year's Tribeca Film Festival and opens in limited release on Friday, he is an all-out homicidal weirdo. The Huffington Post has an exclusive clip from the movie, which was written and directed by ""The Departed"" and ""Kingdom of Heaven"" scribe William Monahan. ""Mojave"" revolves around Thomas (Garrett Hedlund), a suicidal artist who encounters his unfriendly doppelgänger (Isaac) in the desert, after which said doppelgänger attempts to dismantle Thomas' life. The clip finds the men in a gun-wielding standoff at Thomas' lush Los Angeles home.Also on HuffPost:"
18,ENTERTAINMENT,Will Smith Joins Wife Jada Pinkett Smith In Oscars Boycott,Carly Ledbetter,https://www.huffingtonpost.com/entry/will-smith-will-not-attend-oscars_us_56a0ecf3e4b0d8cc1098d26e,"""We're part of this community but at this current time, we're uncomfortable to stand there and say that this is OK.""",2016-01-21,"Will Smith, a two-time Oscar nominee, was snubbed by the Academy this year for his role in ""Concussion.""",https://img.huffingtonpost.com/asset/56a0f3242a00006e00030f93.jpeg?ops=crop_0_0_1993_1594%2Cscalefit_720_noupscale,"Will Smith will not be attending the Oscars this year, he confirmed Thursday in an interview with ""Good Morning America"" co-anchor Robin Roberts.""We're part of this community but at this current time, we're uncomfortable to stand there and say that this is OK,"" Smith said. The 47-year-old actor is one of the many to address the Oscars' lack of diversity. Not a single actor of color was nominated for an Academy Award for the second year in a row, prompting the hashtag #OscarsSoWhite. Smith, a two-time Oscar nominee in previous years, was snubbed by the Academy this year for his role in ""Concussion,"" though he insists it's not the entire reason that he and his wife are taking a stand. ""There's probably a part of that in there but, for Jada, had I been nominated and no other people of color were, she would have made the video anyway,"" Smith told Roberts. ""We'd still be here having this conversation. This is so deeply not about me.""As the actor explained earlier in the interview, diversity is what makes America so great. And when the Academy doesn't reflect that diversity, there's a problem. ""When I look at it, the nominations reflect the Academy. The Academy reflects the industry, reflects Hollywood. And then the industry reflects America, it reflects a series of challenges that we are having in our country at the moment,"" Smith said. ""There's a regressive slide towards separatism, towards racial and religious disharmony. And that's not the Hollywood that I want to leave behind. That's not the industry, that's not the America I want to leave behind.""  On Monday, Jada Pinkett Smith posted a video on Facebook confirming that she would not attend or watch the Academy Awards in February. The video, entitled ""We must stand in our power,"" currently has over 11 million views. ""Is it time that people of color recognize how much power, influence, that we have amassed, that we no longer need to ask to be invited anywhere?"" she said in the video. ""Maybe it's time that we recognize that if we love and respect and acknowledge ourselves in the way in which we are asking others to do, that that is the place of true power."" Spike Lee, George Clooney, Lupita Nyong'o and David Oyelowo have all spoken out about the Oscars frustrating lack of diversity. ""The Academy has a problem. It’s a problem that needs to be solved,"" Oyelowo said at a gala honoring Academy president Cheryl Boone Isaacs on Monday night. ""For 20 opportunities to celebrate actors of color, actresses of color, to be missed last year is one thing; for that to happen again this year is unforgivable."" Isaacs also addressed the Oscars controversy in a official statement on Monday. ""I'd like to acknowledge the wonderful work of this year's nominees. While we celebrate their extraordinary achievements, I am both heartbroken and frustrated about the lack of inclusion,"" Isaacs said in the statement. ""This is a difficult but important conversation, and it's time for big changes. The Academy is taking dramatic steps to alter the makeup of our membership.""Those dramatic steps can't come soon enough. Also on HuffPost: "
