,category,headline,authors,link,short descr,date,image_caption(s),image_link(s),article
8,COLLEGE,How Not to Reinvent the Wheel in College Accountability,"Gary A. Olson, ContributorPresident, Daemen College; Columnist",https://www.huffingtonpost.com/entry/how-not-to-reinvent-the-w_b_6387924.html,"At a well-publicized speech in Buffalo, New York on August 22, 2013, President Barack Obama announced that he would create a plan for sweeping reform of higher education. The details were sketchy, but the projected plan would institute a rating system of colleges and universities nationwide.",2014-12-28,"US President Barack Obama addresses the second White House Summit on College Opportunity in Washington on December 4, 2014. Organizations will announce over 600 new actions to help more students prepare for and graduate from college during the day action, according to the White House. AFP PHOTO/Nicholas KAMM (Photo credit should read NICHOLAS KAMM/AFP/Getty Images)",https://img.huffingtonpost.com/asset/5bae5442200000e800ff417a.jpeg?ops=scalefit_720_noupscale,"At a well-publicized speech in Buffalo, New York on August 22, 2013, President Barack Obama announced that he would create a plan for sweeping reform of higher education. The details were sketchy, but the projected plan would institute a rating system of colleges and universities nationwide. The stated purpose of the plan is to hold institutions of higher education accountable to consumers, especially in the areas of access, affordability, and outcomes.The president promised to solicit ample input from all interested constituencies before unveiling the actual plan, and he charged the Department of Education with holding public forums and working out the plan's details. The outline of the plan originally presented by the president drew substantial criticism from university leaders, some public officials, and numerous professional organizations. Nineteen of the nation's most important and influential professional organizations representing higher education (such as the American Council on Education, the Association of Public and Land-Grant Universities, and the National Association of Independent Colleges and Universities) cosigned a letter to the administration expressing serious reservations about the plan.Despite receiving a huge volume of input on the proposed plan -- the overwhelming amount of it negative -- Department of Education officials apparently have made little change to the proposed plan, judging from the ""framework"" of the final plan released by the administration just this month. The plan still proposes to rate colleges using metrics that are problematic, if not seriously flawed. On the surface, several of the metrics sound reasonable, but a close examination reveals a system with very little nuance or awareness of context. Take completion rates, for example. As I point out in an earlier post, while we all want more college students to earn their degrees and graduate, using a simple statistic of how many of an institution's full-time students graduate in six -- or, worse, four -- years does not account for how the demographics of the college student population has changed in the last several decades. It would be entirely reasonable to expect a high percentage of a college's students to proceed smoothly through four or so years of school and graduate ""on time"" if that population were composed primarily of students from relatively affluent families and who were not the first in their family to attend college -- as was the case 30 or 40 years ago. Such students enjoy significant family and financial support and don't typically need to work while attending college.Today, however, many of our students are the first in their families to attend college; many are people of color, or citizens of other countries; some are single parents or products of them; females outnumber males; and a large number of students are older than traditional age. Given this demographic, many students -- perhaps the majority -- have no choice but to work while they are attending college. Needless to say, holding down a job -- even a part-time job -- while attending college full time significantly decreases a person's likelihood of sailing straight through four years of college to graduation. The recent large influx of military veterans into the ranks of college attendees also makes today's student population nothing like that of the Father Knows Best years. Vets often bring their own challenges to college life, including problems with sustained concentration and struggles with post-traumatic stress, and so this subpopulation needs extra support to help them succeed and to do so in a timely fashion.As currently formulated, the proposed ""reform"" plan will use a stark completion percentage devoid of any accounting for personal, institutional, or demographic context. As such, it is hardly a useful statistic for rating colleges -- not to mention that it could become an incentive for some colleges to lower their standards in order to boost their completion rates.Another misguided metric still included in the plan despite widespread criticism is ""labor market success,"" meaning tracking the salaries of just-graduated students and comparing that average to those of other institutions. The recently published ""framework"" admits that this metric drew the most criticism and states that an attempt will be made in the final plan to devise instead a ""substantial employment"" metric, but even this misses the point. Tracking how much students earn is misleading and will contribute to a skewed ""rating"" of institutions. The students graduating from an institution heavily oriented toward the arts and humanities, for example, will likely be entering relatively low paying professions. In contrast, students graduating from a college with a heavy orientation toward health care professions or engineering will be earning considerably more.  Many of the metrics in the proposed reform plan are equally misguided, but I will not address them here. My larger point is that the architects of the plan need to pay closer attention to the input they receive. The proposed plan at its best will be grossly misleading and at its worse will be actively destructive to the extent that it incentivizes colleges to make poor choices for the wrong reasons.Better yet, perhaps the administration should scrap the proposed plan altogether and instead adopt a version of an already existing system operated by the National Association of Independent Colleges and Universities called the University and College Accountability Network (U-CAN), a website designed to offer prospective students and their parents ""concise, consumer-friendly information about the nation's private, nonprofit colleges and universities in a common format."" Why reinvent the wheel?"
9,POLITICS,Christie Alienates New Jersey Residents With National Ambitions,,https://www.huffingtonpost.com/entry/christie-roams-and-popula_n_6387784.html,,2014-12-28,"New Jersey Gov. Chris Christie pauses while addressing students, teachers and parents at Mendham Township Middle School Wednesday, Dec. 17, 2014, in Mendham Township, N.J., after a student asked if he was going to run for President. Christie said that he was still deciding and planned to make his decision early next year. (AP Photo/Mel Evans)",https://img.huffingtonpost.com/asset/5bb8e255260000300183be5d.jpeg?ops=scalefit_720_noupscale,"When the Chris Christie-for-president chatter first started, in 2011, voters in his home state of New Jersey took pride in having a celebrity governor. As Nancy Reagan escorted Mr. Christie to his speech at her husband’s presidential library, and hedge fund billionaires, The Weekly Standard and The Wall Street Journal’s editorial pages urged him to run, his approval ratings jumped. Voters told pollsters the national attention made him more effective, and improved their state’s long-maligned image.Read more on The New York Times"
10,BLACK VOICES,North Korea's Racial Slur of President Obama Is Business as Usual,"Earl Ofari Hutchinson, ContributorAuthor and political analyst",https://www.huffingtonpost.com/entry/north-koreas-slur-of-pres_b_6386960.html,"It's hardly the first time that some official or official source in North Korea has gotten caught with its racial dirty linen waving. The verbal war is the outcrop of the deep suspicion, distrust, antagonism, and confrontation that's characterized relations between the U.S. and North Korea for decades.",2014-12-28,"This photo combination shows U.S. President Barack Obama, left, and North Korean leader Kim Jong Un. North Korea has compared Obama to a monkey and blamed the U.S. for shutting down its Internet amid the hacking row over the movie ""The Interview."" (AP Photos)",https://img.huffingtonpost.com/asset/5bae0462240000500054d0be.jpeg?ops=scalefit_720_noupscale,"The racial taunt by North Korean official's of President Obama as a monkey was no real surprise. The regime has blasted Obama before with border line racial jabs. Obama is the most visible and inviting target for North Korea to single out for blame and vitriol after its bare bones Internet and mobile phone networks were disrupted for a few days. North Korean officials apparently saw this as retaliation for allegedly hacking Sony picture executive's internal emails. It's hardly the first time that some official or official source in North Korea has gotten caught with its racial dirty linen waving. Last May, the Korean Central News Agency drew fire when it lambasted Obama with the admonition to ""live with a group of monkeys in the world's largest African natural zoo."" North Korean officials deny that there is any explicit intent to racially demean Obama. They contend that the criticism is simply part of the ongoing war of words between two countries. The verbal war is the outcrop of the deep suspicion, distrust, antagonism, and confrontation that's characterized relations between the U.S. and North Korea for decades.It is true that North Korea has leveled choice verbal derogatory broadsides on foreign leaders it considers hostile overtly to the regime. A prime example is its attack last August on U.S. Secretary of State John Kerry. It called him a ""wolf donning the mask of sheep."" This jab at Kerry was in response to Kerry allegedly calling for peace at the same moment the U.S staged its annual military drills with South Korea. The wolf characterization was harsh but that's an image that's more in keeping with a not uncommon vilification of someone who's seen as predatory. North Korean officials have also called South Korean President Park Geun-hye a prostitute. This too was insulting and demeaning. But that's also a common usage epitaph often hurled at supposedly on the make politicians.These types of insults, no matter how disreputable and loathsome, at least make some political sense. The continual reference to Obama as a monkey is something else. It shouldn't surprise, though, that North Korea would latch onto that image. They are just following playing on the stereotype that the pack of race baiting websites, chat rooms, some college frat parties, and student websites has frequently used in assorted offbeat, crude, vile cartoons to ridicule Obama and First Lady Michelle and African-Americans. The racial tie to that depiction was tested in 2007.Then Penn State researchers conducted six separate studies and found that many Americans still link blacks with apes and monkeys. Many of them were young and had absolutely no knowledge of the vicious stereotyping of blacks of years past. Their findings with the provocative title ""Not Yet Human: Implicit Knowledge, Historical Dehumanization and Contemporary Consequences,"" in the February 2008 issue of Journal of Personality and Social Psychology, was published by the American Psychological Association.The overwhelming majority of the participants in the studies bristled at the faintest hint that they had any racial bias. But the animal savagery image and blacks was very much on their minds. The researchers found that participants -- and that included even those with no stated prejudices or knowledge of the historical images -- were quicker to associate blacks with apes than they were to associate whites with apes.This was not simply a dry academic exercise. The animal association and blacks has had devastating real life consequences. In hundreds of news stories from 1979 to 1999, the Philadelphia Inquirer was much more likely to describe African Americans than Whites convicted of capital crimes with ape-relevant language, such as ""barbaric,"" ""beast,"" ""brute,"" ""savage"" and ""wild."" And jurors in criminal cases were far more likely to judge blacks more harshly than whites, and regard them and their crimes as savage, bestial and heinous, and slap them with tougher sentences than whites.North Korea would be especially susceptible to trade in this type of crude race baiting, and name calling given its self-imposed isolation from global discourse and its near paranoid xenophobic view of itself as somehow an ethnically pure nation. This notion is deeply tinged by race and racial chauvinism. This, and the regime's political insularity, inevitably instills in the regime an us versus them fortress wall to keep out anything that sullies its notion of its superiority. North Korean leaders have played hard on this for decades as a political serving mechanism to insure domestic control and compliance with its brutal policies. There was some talk that former NBA player Dennis Rodman's much criticized tour of North Korea earlier in 2014 with a team of mostly black former pro basketball players might dent the regime's racial insularity. There is no evidence it did. It gave the regime a momentary PR boost, but it was passing. An apologetic Rodman got the message and vowed not to return to the country. It wouldn't have mattered. Two months later it branded Obama as a monkey and now it has repeated the slur. For North Korea this is simply racial business as usual.Earl Ofari Hutchinson is an author and political analyst. He is a weekly co-host of the Al Sharpton Show on American Urban Radio Network. He is the author of How Obama Governed: The Year of Crisis and Challenge. He is an associate editor of New America Media. He is host of the weekly Hutchinson Report Newsmaker Hour heard weekly on the nationally network broadcast Hutchinson Newsmaker Network. Follow Earl Ofari Hutchinson on Twitter: http://twitter.com/earlhutchinson"
11,POLITICS,WaPo: How The Secret Service Lost Its Way,,https://www.huffingtonpost.com/entry/critical-decisions-after-_n_6386858.html,,2014-12-28,"WASHINGTON, DC - OCTOBER 01: A member of the U.S. Secret Service stands watch as U.S. President Barack Obama departs the White House October 1, 2014 in Washington, DC. Earlier today, U.S. Secret Service Director Julia Pierson resigned in the wake of Omar Gonzalez allegedly jumping over the White House fence and entering the residence of the President. (Photo by Win McNamee/Getty Images)",https://img.huffingtonpost.com/asset/5bb8e23b25000094003a57d3.jpeg?ops=scalefit_720_noupscale,"According to government documents and interviews with dozens of current and former officials, the recent string of security lapses at the White House resulted from a combination of tight budgets, bureaucratic battles and rapidly growing demands on the agency that have persisted through the Bush and Obama administrations in the 13 years since the attacks.Read more on Washington Post"
12,WORLDPOST,AirAsia Passengers Share Stories Of Near-Misses That Kept Them Off Vanished Plane,Nick Robins-Early,https://www.huffingtonpost.com/entry/airasia-passengers-no-shows_n_6386838.html,,2014-12-28,"SINGAPORE - DECEMBER 28: An electronic flight information departure board showing information for AirAsia flights departing for Surabaya is seen at Changi Airport on December 28, 2014 in Singapore. AirAsia announced that flight QZ8501 from Surabaya, Indonesia to Singapore lost contact with air traffic control on the morning of December 28. (Photo by Suhaimi Abdullah/Getty Images)",https://img.huffingtonpost.com/asset/5cc142f8240000d30b51b6a4.jpeg?ops=scalefit_720_noupscale,"As reports emerged Sunday that AirAsia Flight QZ8501 was missing, a few passengers who hadn't boarded began to realize just how close they had come to being on the ill-fated aircraft. Now some of the reported 26 who had been scheduled to travel to Singapore from Surabaya, Indonesia, are sharing their stories.A mother of three told Bloomberg that her family was among the no-shows after a last-minute decision the night before not to travel. They were headed on vacation to a Singapore water park, but nixed the trip after a grandparent fell ill. Chandra Susanto, the father of the family, told the Daily Mail that he only found out about the missing plane after his sister called in a panic after the news broke. While thankful for missing the flight, Susanto expressed deep condolences for those on board. Another report via the Jakarta Post told of an even closer call, as a family of 10 narrowly missed the flight due to a unseen email. The flight, they say, had been originally scheduled for later in the morning but was rescheduled to depart earlier. When the family arrived at the airport, they found they'd missed takeoff by about 10 minutes. Only an hour later they learned that the plane they would have boarded had disappeared. The names of both families correspond with those on a reported passenger manifest, which lists 23 no-shows, along with three children in arms, who did not board Flight QZ8501. The plane, which lost contact at 7:24 a.m. Singapore time, had 155 passengers and seven crew members aboard when it departed. The passengers, from five different nationalities, include 16 children and one infant."
13,FIFTY,"Dame Maggie Smith's Best One-Liners From Downton, As Told By Gifs",Yagana Shah,https://www.huffingtonpost.com/entry/maggie-smith-birthday_n_6355802.html,,2014-12-28,"In this image released by PBS, Maggie Smith as the Dowager Countess Grantham, is shown in a scene from the second season on ""Downton Abbey."" Smith was nominated for a Golden Globe award for best supporting actress in mini-series or TV movie for her role in the series, Thursday, Dec. 13, 2012. The 70th annual Golden Globe Awards will be held on Jan. 13. (AP Photo/PBS, Carnival Film & Television Limited 2011 for MASTERPIECE, Nick Briggs)",https://img.huffingtonpost.com/asset/5bb66e113c000018010d4a6b.jpeg?ops=scalefit_720_noupscale,"Happy birthday Dame Maggie Smith -- or should we say Lady Grantham? The Dowager Countess turns 80 on Sunday and though her ""Harry Potter"" days are over, we thank our lucky stars we can still get our weekly dose of her sharp wit and biting humor when ""Downton Abbey"" returns for its fifth season on January 4th on PBS. While Smith has had quite a distinguished career with roles in acclaimed films like ""The Prime Of Miss Jean Brodie,"" for which she won an Oscar, ""A Room With A View,"" and the recent ""Best Exotic Marigold Hotel"" films, perhaps her most memorable role is that of the nosy, pushy, caustic family matriarch at ""Downton Abbey."" While millions of viewers tune in to see the drama unfold, Smith herself says she has never watched the show. She says what she gets out of the role is simply ""the delight of acting."" We're pretty sure the pleasure is all ours, Dame Maggie. Besides seeing what becomes of the Grantham ladies' love lives, the upstairs/downstairs relationships and apparently, a cameo appearance by none other than George Clooney, we're looking forward to seeing what the Dowager Countess has up her sleeve next, whether it's bickering with Mrs. Crawley or battling with new technologies. So to celebrate Dame Maggie' birthday and to get you excited about the next season, here are the Dowager Countess' very best one-liners in gifs. Enjoy!"
14,POLITICS,De Blasio and His Police: We Can't Listen With Our Backs Turned,"Paul Kendrick, ContributorWriter, ""Douglass and Lincoln"" and ""Sarah's Long Walk.""",https://www.huffingtonpost.com/entry/de-blasio-and-his-police-_b_6385996.html,"De Blasio has been exceptionally evenhanded in his respect for police while trying to help us grasp the perspectives of people of color. He has tried to be a true friend to the NYPD, in the sense of a friend who believes in you enough to be critical when you can be better.",2014-12-28,"Police officers turn their backs as New York City Mayor Bill de Blasio speaks at the funeral of New York city police officer Rafael Ramos in the Glendale section of Queens, Saturday, Dec. 27, 2014, in New York. Ramos and his partner, officer Wenjian Liu, were killed Dec. 20 as they sat in their patrol car on a Brooklyn street. The shooter, Ismaaiyl Brinsley, later killed himself. (AP Photo/John Minchillo)",https://img.huffingtonpost.com/asset/5bb8e2392500008b013a57d1.jpeg?ops=scalefit_720_noupscale,"When I heard about the deaths of Officer Wenjian Liu and Officer Rafael Ramos, it broke my heart. I wanted to read stories about the good family men, role models and community leaders they undoubtedly were. Yes, such profiles were written. But it is a different kind of story that is dominating the Internet: the scapegoating of people who did not kill them. The prime target has been Mayor Bill de Blasio. With some NYPD officers turning their back on de Blasio during Officer Ramos' funeral on Saturday, tensions rose to new heights. But why this anger, this personal sense of blame, so pointedly directed to de Blasio? Because he publicly spoke his truth about what a parent feels compelled to tell a Black child. Many resent de Blasio for voicing the need to caution his Black son on the suspicions he may be subject to. We vilify de Blasio for expressing his reality instead of listening to him and working to change why parents need to have ""the talk.""This moment could be a chance to start listening. Only hearing each other's experiences -- as cops, as parents, as young people -- will allow us to find a way forward towards trust. That is the only path that gets us to what all parties want: a better relationship between law enforcement and communities they serve and, of course, less violence. I imagine people of color know all too well what de Blasio just found out: that voicing a personal truth about race in America must be weighed against the potential cost of doing so. How defensively will it be received? What will be the price for expressing it? But how can we solve a challenge as profound as racism if we don't even let each other speak? If we have our backs turned to each other and refuse to listen?What protestors are doing is giving collective voice to their experiences. They are expressing fear that society values their life less because of skin color, that they are more likely to face excessive -- even lethal -- force. And are we going to listen to what it's like to be a cop, a job that could cost you your life at any moment? Police have a hard job with constant danger and they've seen horrible things. They didn't sign up to be seen as racists; they want to be seen as human, as protectors in a perilous job. We can -- and should -- accept hard and conflicted truths from people on both sides of the divide. Let's not be threatened by one or the other. There is no need to choose sides, especially until we have listened, paused, and pondered a bit. What we must not do is use tragedy as an excuse to silence those who just want to be treated equally. Protestors wanted the deaths of Liu and Ramos no more than they wanted the deaths of Eric Garner, Tamir Rice or anyone else.De Blasio has been exceptionally evenhanded in his respect for police while trying to help us grasp the perspectives of people of color. To think otherwise is to dismiss the lived experiences of these communities. He has tried to be a true friend to the NYPD, in the sense of a friend who believes in you enough to be critical when you can be better.New Yorkers elected de Blasio because he was candid about raising his biracial son, and now some want him to resign for doing that very same thing. There is a better way of hearing his truths, and those of so many other people, in order to know the changes we must make.We've progressed to a point where people do not want to be considered racist, but we haven't yet solved the underlying effects of racism in all of our assumptions, fears and resentments. So it becomes challenging to have the candid conversations needed to move us closer to the country we want to be. If we start from an understanding that people on both sides want to reduce violence against innocent people, and that their life matters, we can get somewhere. There are changes that must happen to increase trust and we can get there. Let's support a process based on simple respect for protestors and police, which surely begins with the ability to listen. If we can stop blaming each other for things we are not responsible for, maybe we can work together on solving the things for which we are all responsible."
