,category,headline,authors,link,short descr,date,image_caption(s),image_link(s),article
27,POLITICS,Why Kris Kobach Was Found In Contempt For Not Clarifying To People That They Could Vote,Sam Levine,https://www.huffingtonpost.com/entry/kris-kobach-contempt_us_5ad8d5fce4b03c426dac6519,A federal judge said the Kansas secretary of state didn't do what he was ordered to do to make sure people knew they were eligible.,2018-04-19,"Kansas Secretary of State Kris Kobach (R) failed to ensure that voters affected by a 2016 court ruling received postcards like this one confirming their eligibility to vote. The former head of the Kansas League of Women Voters testified that the postcard ""is the way we think about being fully registered in Kansas.""",https://img.huffingtonpost.com/asset/5ad8da1b1f0000260616d9c5.png?ops=scalefit_720_noupscale,"Kansas Secretary of State Kris Kobach (R) was found in contempt of court on Wednesday for not following a court order to fully inform thousands of Kansans that they were eligible to vote.U.S. District Judge Julie Robinson, a George W. Bush appointee, rebuked Kobach ― who is running for Kansas governor and was in charge of President Donald Trump’s voter fraud commission ― in her finding and demanded he pay attorneys fees associated with the motion to hold him in contempt. The finding also underscores how Kobach wrought confusion in the state and neglected to make sure that thousands of eligible voters knew they were allowed to cast a ballot. This confusion affected people like Tad Stricker, who wanted to make sure his Kansas voter registration was valid ahead of the 2016 presidential election. He had registered in the state two years earlier but was humiliated when he went to vote in the 2014 elections and was told he needed to cast a provisional ballot because he wasn’t on the voter rolls. Kansas law in 2014 required people to bring proof of citizenship when they registered to vote, and state officials said Stricker failed to do so when he registered at the Department of Motor Vehicles that year.Robinson blocked that law in 2016. She ordered Kobach to make sure that the approximately 18,000 people whose registration status was uncertain were fully registered and allowed to vote. Robinson also told Kobach that affected voters should be sent postcards confirming their eligibility to vote and telling them their polling places. But Kobach also didn’t update the state’s election manual to reflect that people didn’t have to prove their citizenship to register to vote, leaving state election officials without clear guidance to inform confused constituents.Stricker says he called his local election office in Sedgwick County before the 2016 election and asked to confirm that he was fully registered, but that the person on the other end of the phone told him his status was unclear. Stricker says he was told there were a lot of legal issues up in the air.Stricker and his fellow plaintiffs, who are represented by the American Civil Liberties Union, say the Kansas law that was put on hold in 2016 violates the National Voter Registration Act. The law says state motor vehicle agencies must offer people a chance to register to vote and can only ask them for the minimum amount of information necessary to do so.At a trial held about the issue in March, Kobach argued the law was necessary to prevent noncitizens from voting. He presented 129 cases of noncitizens trying to vote since 2000 but has said there could be thousands of them on the rolls. Several studies have shown voter fraud is not a widespread problem.Plaintiffs argued that Kobach could have assuaged confusion after the 2016 order by updating the state elections manual to reflect that people did not need to prove their citizenship when they went to register at the DMV. Instead, he took down the document altogether, saying that Robinson’s order did not amount to final law and that the manual was continuously informally updated. Bryan Caskey, the state’s election director and a Kobach staffer, also testified that he was “too busy” to update the document.Robinson fired back at that rationale, noting that Kobach had amended the document in 2012 to reflect the proof of citizenship law.“This publication is the policy and training Bible for the 105 county election officials,” she wrote. “Given that the Court’s preliminary injunction was issued almost two years ago in May 2016, four years after the last revision, the Court does not find credible Defendant’s rationale for not amending the document.”Local Kansas election officials are responsible for sending out the postcards to registered voters, and different counties have different practices for how they send them out. But Kobach is responsible for making sure that all the officials are complying with the law. Kansans rely on these postcards to confirm they’re registered to vote and to tell them where they’re registered.“The postcard is considered by traditional in Kansas to be the way you know you’re fully registered to vote,” Margaret Ahrens, the former president of the Kansas League of Women Voters, testified during the trial. “It’s because it’s traditional. ... That is the way we think about being fully registered in Kansas. The postcard is significant.”Kansas had previously sent letters to anyone who failed to prove their citizenship when registering to vote, informing them that their registration was incomplete. But after the order, Kobach was required to send affected voters a new notice to let them know they could disregard any previous notices telling them they weren’t fully registered and that they could look up their polling place online.This meant that thousands of voters who thought they had registered in the state received two official letters telling them completely contradictory information. The postcards could have helped get rid of confusion by telling Kansans once again that they were registered to vote. Kobach and his lawyers initially said in court documents that they were only obligated to send affected voters the court notice, not the postcards. But when Robinson reminded Kobach in court last month that he had previously assured her in court that he would send the postcards, Kobach changed course, saying his office had orally instructed county officials to send the postcards and could not force them to do so. Robinson said she did not find it credible that Kobach’s office had orally instructed officials to send out the postcards. Kobach’s office said after the trial that it had given written orders to the county officials to send the postcards, but Robinson said on Wednesday that was “too little, too late.” Robinson appeared to be similarly unimpressed by Kobach’s claim that the court’s order on postcards was unclear.“The term ‘register’ is not ambiguous, nor should there have been any question that these voters were to be treated just like any other registered voter prior to the 2016 election,” she wrote. "
28,ENTERTAINMENT,How 'Riverdale' Got Away With A Bloody Good Musical Episode,Cole Delbyck,https://www.huffingtonpost.com/entry/riverdale-cw-carrie-musical_us_5acfba36e4b016a07e9a90b8,"Archie and the gang staged a predictably murderous rendition of ""Carrie: The Musical."" Somehow, it brought the campy show back to earth.",2018-04-19,"Lili Reinhart (Betty) and Camila Mendes (Veronica) in ""Riverdale.""",https://img.huffingtonpost.com/asset/5ad6e3131f00002d0016d6af.jpeg?ops=scalefit_1280_noupscale,"The tale of a teen outcast turned murderous prom queen: With all that’s gone down on the second season of “Riverdale” — a hunt for a hooded serial killer, the football team moonlighting as a local militia, Archie and the gang getting high on a drug called jingle-jangle — that hardly ranks as a compelling B-plot on any given episode. Singing and dancing about the horrors of high school, however, make for a very special installment of the hit CW series.Wednesday’s episode, the series’ first official foray into the depths of the musical-on-TV genre, revolves around a teen production of “Carrie: The Musical.” Adapted from the classic 1974 Stephen King novel, the musical has been called the “most expensive quick flop in Broadway history.” Nevertheless, it’s found a home in “Riverdale,” a massively popular TV show that deals with similar themes ― the good-girl-versus-mean-girl binary, raging teenage hormones and bloodshed.But since buckets of pig’s blood lack a certain visual panache in 2018, the cast of “Riverdale” lends the story a horrific new ending. (Spoiler alert!) Instead of simply acting out King’s familiar finale, the teens witness an actual murder when a student is stabbed multiple times on stage unbeknownst to the audience. Leave it to “Riverdale” to turn up the camp and the crazy for a musical episode unlike any we’ve seen before. The episode came to life thanks to series creator Roberto Aguirre-Sacasa, the man who once staged an unauthorized production of the gold-standard “Buffy” musical episode as a Yale drama student. Aguirre-Sacasa actually envisioned “Riverdale” as a musical series in the beginning stages of development. He’s been angling to do a full-blown production ever since. “Originally, we always thought that there would be a stronger musical element and the kids would do school musicals, but as the show developed, it became more of a crime and noir show,” he told HuffPost. “But, by this point, even the superhero shows had done musical episodes, so I think the network was, like, if we’re letting these shows do it, we better let the show about high school kids do musicals, too.”Musical episodes on television, much like the high school musicals of real life, have indeed become something of a rite of passage. What was once a set-your-DVR-or-regret-it event is now an increasingly regular milestone for shows including “Buffy the Vampire Slayer,” “Scrubs” and “The Flash.” (Not to mention “Crazy Ex-Girlfriend,” which gifts the world with a mini-musical every week.) As a result, it’s never been harder to stand out.Of course, “Riverdale” slips easily into its new skin as Archie (K.J. Apa), Betty (Lili Reinhart), Veronica (Camila Mendes) and Cheryl (Madelaine Pestch) get in touch with their inner theater kids. The town’s resident fire-starter, Cheryl, takes on the role of Carrie White, a socially ostracized, telekinetic girl repressed by her religious fanatic mother. Betty, naturally, plays good girl Sue Snell, who initially bullies Carrie but succumbs to remorse. Veronica embodies the titular teen’s tormenter, Chris Hargensen. Finally, Archie fits nicely into the boy-next-door slot as Tommy Ross, Carrie’s ill-fated prom date.Dressed in peak ’70s garb, the musically inclined actors belt their way through 11 songs from the musical, gathering for an especially impressive opening group number, “In,” that requires each of the cast members to show off their singing chops and some serious choreography. Meanwhile, Jughead, not exactly the song-and-dance type, films a behind-the-scenes documentary after actor Cole Sprouse took a hard pass on any musical moments. “He’s a Broadway Scrooge,” Casey Cott, who plays the musical’s director, Kevin Keller, joked. “I’ve seen him do karaoke, and I’ve seen him dancing on the dance floor. That kid can move.”Back in 1988, when “Carrie: The Musical” first opened more than a decade after the Brian De Palma film hit theaters, the production closed after a handful of performances due to scathing reviews. ”‘Carrie’ expires with fireworks like the Hindenberg,” a New York Times theater critic wrote in a particularly savage takedown at the time. The show, however, found its audience years later, amassing a cult following that flocked to see revivals in London and Los Angeles.That audience included Aguirre-Sacasa, a self-professed mega-fan of the “Carrie” story who wrote the screenplay for a tepidly received 2013 movie remake starring Chloë Grace Moretz, which he described as a “very fraught” ordeal.“It was not the most artistically satisfying or pleasant experience in my career,” he said. “I’ll save you the gory details. It sort of soured me to ‘Carrie.’ I really feel like this musical has allowed me to take it back as something I love and feel good about after years of not feeling good about it.”Before landing on “Carrie,” Aguirre-Sacasa’s team considered staging other productions, like “Little Shop of Horrors” and “Sweeney Todd.” He even contemplated using songs from an original musical based on Archie Comics characters that he wrote before he was brought on as the company’s chief creative officer in 2014.“It never got produced, but it has really good songs. I briefly thought if we can’t get the rights to ‘Carrie’ we’ll do ‘Archie: The Musical,’” he said. But the disastrous prom saga seemed almost tailor-made for the series, which is why Aguirre-Sacasa stuck primarily to script, save for the addition of a few distinctively “Riverdale” flourishes ― mainly that twist ending that revives the mystery of the Black Hood, the town’s believed-to-be-dead serial killer.The musical is “literally about a girl who goes crazy and kills everybody with blood all down her face,” Cott said. “Cheryl does that, and no one is surprised.”Overall, the musical feels expertly suited to highlight the series’ biggest draw: the core four characters. In a season paced at break-neck speed, the lion’s share of the “Riverdale” plot has been dedicated to a whirlwind of murder mysteries, mayoral races, long-lost siblings and corruption scandals. This episode gives the series a much-needed chance to breathe by finding crucial moments to revisit some of the relationships that made the show a success in the first place. In one of the episode’s most inspired plot diversions, Betty sings “You Shine,” a love song featured in the original musical, to Veronica instead of her onstage paramour as a peace offering after a particularly nasty fight. “Even though there’s this big shocking ending, the musical allows us to focus more exclusively on the friendships, which we don’t always get to do because we are so frantically telling other stories,” Aguirre-Sacasa said.As “Riverdale” rockets off toward the season finale, perhaps that’s the lesson it should take to heart ahead of Season 3. (Netflix recently picked up two seasons of a “Sabrina the Teenage Witch” spinoff, too.) Sure, the show thrives on crazy plot twists (remember: the town was founded on maple syrup blood money, after all), but how it builds upon the iconic characters of comic book lore in new and interesting ways will always be its lifeblood. And should the musical experiment prove to be a success, the powers that be have every intention of making this a tradition for the show that has no incentive to stick to form.“Every week ‘Riverdale’ is something different,” Aguirre-Sacasa said. “One week, it’s a serial killer show or ‘The Godfather’ in a small town and the next it’s a political thriller or a homage to ‘The Wrestler.’” “The show is naturalistic, but it also exists in this weird area where the musical episode comes in and makes total sense,” Cott added. “It’s not all ‘Glee’ or flashy. It’s actually really weird and such a ‘Riverdale’ story.” As for who might take the reins the next time around, Cott has some suggestions: “One day we’ll get Cole into a musical episode. In Season 3, he can be the lead.” "
29,ENTERTAINMENT,How 'Riverdale' Got Away With A Bloody Good Musical Episode,Cole Delbyck,https://www.huffingtonpost.com/entry/riverdale-cw-carrie-musical_us_5acfba36e4b016a07e9a90b8,"Archie and the gang staged a predictably murderous rendition of ""Carrie: The Musical."" Somehow, it brought the campy show back to earth.",2018-04-19,"Madelaine Petsch (Cheryl) performs as Carrie White in a teen production of “Carrie: The Musical” on the CW series ""Riverdale.""",https://img.huffingtonpost.com/asset/5ad4fe601f00002d0016d470.jpeg?ops=scalefit_1280_noupscale,"The tale of a teen outcast turned murderous prom queen: With all that’s gone down on the second season of “Riverdale” — a hunt for a hooded serial killer, the football team moonlighting as a local militia, Archie and the gang getting high on a drug called jingle-jangle — that hardly ranks as a compelling B-plot on any given episode. Singing and dancing about the horrors of high school, however, make for a very special installment of the hit CW series.Wednesday’s episode, the series’ first official foray into the depths of the musical-on-TV genre, revolves around a teen production of “Carrie: The Musical.” Adapted from the classic 1974 Stephen King novel, the musical has been called the “most expensive quick flop in Broadway history.” Nevertheless, it’s found a home in “Riverdale,” a massively popular TV show that deals with similar themes ― the good-girl-versus-mean-girl binary, raging teenage hormones and bloodshed.But since buckets of pig’s blood lack a certain visual panache in 2018, the cast of “Riverdale” lends the story a horrific new ending. (Spoiler alert!) Instead of simply acting out King’s familiar finale, the teens witness an actual murder when a student is stabbed multiple times on stage unbeknownst to the audience. Leave it to “Riverdale” to turn up the camp and the crazy for a musical episode unlike any we’ve seen before. The episode came to life thanks to series creator Roberto Aguirre-Sacasa, the man who once staged an unauthorized production of the gold-standard “Buffy” musical episode as a Yale drama student. Aguirre-Sacasa actually envisioned “Riverdale” as a musical series in the beginning stages of development. He’s been angling to do a full-blown production ever since. “Originally, we always thought that there would be a stronger musical element and the kids would do school musicals, but as the show developed, it became more of a crime and noir show,” he told HuffPost. “But, by this point, even the superhero shows had done musical episodes, so I think the network was, like, if we’re letting these shows do it, we better let the show about high school kids do musicals, too.”Musical episodes on television, much like the high school musicals of real life, have indeed become something of a rite of passage. What was once a set-your-DVR-or-regret-it event is now an increasingly regular milestone for shows including “Buffy the Vampire Slayer,” “Scrubs” and “The Flash.” (Not to mention “Crazy Ex-Girlfriend,” which gifts the world with a mini-musical every week.) As a result, it’s never been harder to stand out.Of course, “Riverdale” slips easily into its new skin as Archie (K.J. Apa), Betty (Lili Reinhart), Veronica (Camila Mendes) and Cheryl (Madelaine Pestch) get in touch with their inner theater kids. The town’s resident fire-starter, Cheryl, takes on the role of Carrie White, a socially ostracized, telekinetic girl repressed by her religious fanatic mother. Betty, naturally, plays good girl Sue Snell, who initially bullies Carrie but succumbs to remorse. Veronica embodies the titular teen’s tormenter, Chris Hargensen. Finally, Archie fits nicely into the boy-next-door slot as Tommy Ross, Carrie’s ill-fated prom date.Dressed in peak ’70s garb, the musically inclined actors belt their way through 11 songs from the musical, gathering for an especially impressive opening group number, “In,” that requires each of the cast members to show off their singing chops and some serious choreography. Meanwhile, Jughead, not exactly the song-and-dance type, films a behind-the-scenes documentary after actor Cole Sprouse took a hard pass on any musical moments. “He’s a Broadway Scrooge,” Casey Cott, who plays the musical’s director, Kevin Keller, joked. “I’ve seen him do karaoke, and I’ve seen him dancing on the dance floor. That kid can move.”Back in 1988, when “Carrie: The Musical” first opened more than a decade after the Brian De Palma film hit theaters, the production closed after a handful of performances due to scathing reviews. ”‘Carrie’ expires with fireworks like the Hindenberg,” a New York Times theater critic wrote in a particularly savage takedown at the time. The show, however, found its audience years later, amassing a cult following that flocked to see revivals in London and Los Angeles.That audience included Aguirre-Sacasa, a self-professed mega-fan of the “Carrie” story who wrote the screenplay for a tepidly received 2013 movie remake starring Chloë Grace Moretz, which he described as a “very fraught” ordeal.“It was not the most artistically satisfying or pleasant experience in my career,” he said. “I’ll save you the gory details. It sort of soured me to ‘Carrie.’ I really feel like this musical has allowed me to take it back as something I love and feel good about after years of not feeling good about it.”Before landing on “Carrie,” Aguirre-Sacasa’s team considered staging other productions, like “Little Shop of Horrors” and “Sweeney Todd.” He even contemplated using songs from an original musical based on Archie Comics characters that he wrote before he was brought on as the company’s chief creative officer in 2014.“It never got produced, but it has really good songs. I briefly thought if we can’t get the rights to ‘Carrie’ we’ll do ‘Archie: The Musical,’” he said. But the disastrous prom saga seemed almost tailor-made for the series, which is why Aguirre-Sacasa stuck primarily to script, save for the addition of a few distinctively “Riverdale” flourishes ― mainly that twist ending that revives the mystery of the Black Hood, the town’s believed-to-be-dead serial killer.The musical is “literally about a girl who goes crazy and kills everybody with blood all down her face,” Cott said. “Cheryl does that, and no one is surprised.”Overall, the musical feels expertly suited to highlight the series’ biggest draw: the core four characters. In a season paced at break-neck speed, the lion’s share of the “Riverdale” plot has been dedicated to a whirlwind of murder mysteries, mayoral races, long-lost siblings and corruption scandals. This episode gives the series a much-needed chance to breathe by finding crucial moments to revisit some of the relationships that made the show a success in the first place. In one of the episode’s most inspired plot diversions, Betty sings “You Shine,” a love song featured in the original musical, to Veronica instead of her onstage paramour as a peace offering after a particularly nasty fight. “Even though there’s this big shocking ending, the musical allows us to focus more exclusively on the friendships, which we don’t always get to do because we are so frantically telling other stories,” Aguirre-Sacasa said.As “Riverdale” rockets off toward the season finale, perhaps that’s the lesson it should take to heart ahead of Season 3. (Netflix recently picked up two seasons of a “Sabrina the Teenage Witch” spinoff, too.) Sure, the show thrives on crazy plot twists (remember: the town was founded on maple syrup blood money, after all), but how it builds upon the iconic characters of comic book lore in new and interesting ways will always be its lifeblood. And should the musical experiment prove to be a success, the powers that be have every intention of making this a tradition for the show that has no incentive to stick to form.“Every week ‘Riverdale’ is something different,” Aguirre-Sacasa said. “One week, it’s a serial killer show or ‘The Godfather’ in a small town and the next it’s a political thriller or a homage to ‘The Wrestler.’” “The show is naturalistic, but it also exists in this weird area where the musical episode comes in and makes total sense,” Cott added. “It’s not all ‘Glee’ or flashy. It’s actually really weird and such a ‘Riverdale’ story.” As for who might take the reins the next time around, Cott has some suggestions: “One day we’ll get Cole into a musical episode. In Season 3, he can be the lead.” "
