,category,headline,authors,link,short descr,date,image_caption(s),image_link(s),article
53,WORLD NEWS,Russia Says It Will Track U.S. Planes As Potential Targets In Syria,Nick Robins-Early,https://www.huffingtonpost.com/entry/russia-syria-jet-us_us_5947e348e4b0f15cd5bcf302,The move is retaliation for the U.S. shooting down a Syrian jet.,2017-06-19,A military vehicle operated by the U.S.-backed . Syrian Democratic Forces rumbles through the Raqqa area on Sunday. ,https://img.huffingtonpost.com/asset/5947f8c315000045004e70ce.jpeg?ops=scalefit_720_noupscale,"Russia’s Defense Ministry issued an ominous warning to Washington on Monday, saying it would track U.S.-led coalition aircraft operating in certain areas of Syria as potential targets.Moscow also declared it would suspend the use of a military hotline meant to avoid conflicts between the U.S. and Russian military campaigns in Syria.“Any aircraft, including planes and drones of the international coalition, detected in the operation areas west of the Euphrates River by the Russian air forces will be followed by Russian ground-based air defense and air defense aircraft as air targets,” Russia’s Defense Ministry said in the statement.The Russians’ announcement is retaliation for the U.S. downing of a Syrian military plane on Sunday near the city of Raqqa. It was the first time an American fighter jet has shot down a Syrian aircraft in the civil war, with U.S. officials saying the action was taken to defend Washington-allied forces in the area.Syria and its ally Russia condemned the incident, claiming the downed jet was targeting Islamic State militants. Both the U.S. downing of the jet and Moscow’s response are evidence of escalating tensions between the two powers in Syria, as in recent months Washington has shown an increased willingness to target Syrian President Bashar Assad’s forces. Sunday’s incident came one month after a U.S. airstrike hit a pro-Assad militia that threatened U.S.-backed forces in southern Syria.In early April, Russia similarly suspended the agreement with Washington to coordinate on matters such as airstrikes and flights over Syria ― a deal intended to limit the danger to pilots and prevent unintended conflict between the two powers. The cause then was the U.S. missile strikes on Syria in response to Assad’s deadly chemical attack in the country’s Idlib province.The agreement was reinstated after U.S. Secretary of State Rex Tillerson visited Russia later that month.The fight to take back the city of Raqqa from ISIS has meant an increased potential for clashes between the multitude of different forces converging on the militants’ de facto capital. U.S.-backed Syrian Democratic Forces are taking the lead in the offensive, but so are Russian-backed Syrian army forces and pro-Assad militias.As ISIS is set to be squeezed into smaller areas in Syria’s east, various factions are competing over who will hold the land it leaves behind that could further complicate the conflict. Adding to the region’s instability, Iran launched a barrage of missiles on Sunday into eastern Syria as retaliation for ISIS’s twin attacks in Tehran earlier this month. Iran’s strike was the first time the country has launched missiles into Syria since the civil war began and pulls the country deeper into it. Along with Russia, Iran has been a prominent backer of Assad’s regime and its support has helped prop up Damascus against opposition forces."
54,WORLD NEWS,"Even After Being Attacked, London Imam Responds To Violence With Peace",Willa Frej,https://www.huffingtonpost.com/entry/london-attack-response-peace_us_5947ea95e4b01eab7a2f5d33,He shielded the assailant from an angry crowd and asked the police to step in.,2017-06-19,Imam Mohammed Mahmoud helped protect the attacker from crowds of people wanting to hurt him Monday morning until police could take him.,https://img.huffingtonpost.com/asset/5947f29615000021004e70b9.png?ops=scalefit_720_noupscale,"Plenty of witnesses to the truck that rammed into a crowd of pedestrians finishing Ramadan prayers early Monday in London’s Finsbury Park couldn’t help but lash out. The acts of bravery didn’t stop there. Congregants on the scene who were attending to the injured happened to see a police van driving by, so they flagged it down. Mahmoud begged police to take the attacker to safety."
55,WORLD NEWS,Several Injured After Vehicle Plows Into Crowd Near London Mosque,Nick Visser,https://www.huffingtonpost.com/entry/london-vehicle-injures-pedestrians_us_5947194ee4b06bb7d2741b74,One person has been arrested in what is being investigated as a potential terrorist attack.,2017-06-19,Police officers stand guard near Finsbury Park Mosque. ,https://img.huffingtonpost.com/asset/594759441600002100116ca5.jpeg?ops=scalefit_720_noupscale,"Nearly a dozen people were injured after a vehicle rammed into pedestrians in north London early Monday. One person at the scene died but it wasn’t clear if his death was the result of the attack.Authorities say one person is dead and at least 10 are injured after a man drove a vehicle into a crowd of pedestrians near a north London mosque that had just completed evening prayers.The incident, which occurred shortly after midnight on Monday, is being investigated as a potential terrorist attack. Police said it was “too early” to determine if the victim, who was already being given first aid at the time of the assault, died because of the attack or of an unrelated issue.The suspect was identified Monday as Darren Osborne, according to several news outlets. Authorities say the man was detained by members of the public at the scene before his arrest and was later taken to the hospital as a precaution. Originally from Somerset, the 47-year-old Osborne lived in Cardiff, Wales, with his partner and four children. “I’ve seen him walking in the street but never spoken to him,” neighbor Pauline Tibbs, 48, told The Telegraph. “He seemed normal enough.”Nine people had been taken to the hospital, and two people had been treated at the scene for minor injuries.The incident occurred near the Muslim Welfare House, a community center down the road from several local mosques, according to the U.K.’s Muslim Council. The mosques had been holding evening prayers for the holy month of Ramadan and were likely to have hosted hundreds of worshippers over the past week.Metropolitan Police Commissioner Cressida Dick said the attack was “quite clearly an attack on Muslims.”A HuffPost UK reporter witnessed police detaining a second person several hours after the collision. Authorities declined to comment on the reason for the arrest.Cynthia Vanzella, a woman who lives near the scene, told CNN she heard the collision from her home and went to a window to see people “desperately trying to make some signs to a police car.”“I saw a lot of people injured,” she said. “They were helping on the pavement and trying to help them to get to the scene.”“The gentleman went straight down this road, people were just conversing, talking, just doing what we’re doing. And he just came into all of us,” a witness told the Press Association.“I was shocked, shocked, shocked,” he added. “There were bodies around me.” The chairman of the Finsbury Park mosque, Mohammed Kozbar, described the incident as a “cowardly attack” and said there were many injuries.There was confusion and dismay among witnesses and bystanders in the aftermath of the incident. Anxious crowds gathered at police cordons surrounding the area to wait for news.“One thing that is clear: This happened after night prayer that us Muslims pray during Ramadan,” a witness told HuffPost UK. “It was clearly an act that was planned and an act that was done with full intention.”Miqdaad Versi, the assistant secretary general of the Muslim Council, said the incident reflects growing fear within the community about a rising tide of Islamophobia in the country. “People have been worried about this for a long time,” he told HuffPost.“People are shocked. People are terrified,” Versi, who was not at the scene, went on. “It’s an important time. It’s the last 10 nights of Ramadan, and that’s why there are such big crowds.”In a statement early Monday, the Muslim Council’s secretary general, Harun Khan, condemned the rise in anti-Muslim sentiment following a series of high-profile terrorist attacks in the country.“Muslim communities have been calling for increased action to tackle the growth in hate crime for many years and transformative action must now be taken to tackle not only this incident but the hugely worrying growth in Islamophobia,” Khan said. “This is a terrible incident,” British Prime Minister Theresa May said in a statement. “All my thoughts are with those who have been injured, their loved ones, and the emergency services on the scene.”Labour leader Jeremy Corbyn said he was “totally shocked.”“My thoughts are with those and the community affected by this awful event,” he said in a statement. London Mayor Sadiq Khan condemned the incident in a statement posted to Facebook early Monday, describing it as a “horrific terrorist attack on innocent people.”“We don’t yet know the full details, but this was clearly a deliberate attack on innocent Londoners, many of whom were finishing prayers during the holy month of Ramadan,” Khan wrote. “While this appears to be an attack on a particular community, like the terrible attacks in Manchester, Westminster and London Bridge, it is also an assault on all our shared values of tolerance, freedom and respect.”Khan, May, and Corbyn all visited the scene of the attack on Monday. May held a meeting with leaders of various faiths inside the mosque. Ivanka Trump, the daughter of and adviser to President Donald Trump, tweeted on Monday that, “we must stand united against hatred and extremism in all it’s ugly forms.” The president did not immediately issue a response. “We’ve made it very clear to our British allies that we stand ready to provide any support and assistance that they may need,” White House spokesman Sean Spicer told reporters at a briefing.Monday’s attack is the latest in a series of incidents in the country involving vehicles hitting pedestrians and comes at a turbulent time for May. In March, four people were killed and dozens were injured after a man drove his car into a crowd on Westminster Bridge and then stabbed a police officer. On May 22, a suicide bomber killed 22 people following a concert by Ariana Grande in the Manchester Arena. And in June, men driving a van plowed into pedestrians on London Bridge and then began stabbing people in a popular market, killing eight.Rowaida Abdelaziz, Eline Gordts, Nick Robins-Early, and Willa Frej contributed reporting."
56,WORLD NEWS,Several Injured After Vehicle Plows Into Crowd Near London Mosque,Nick Visser,https://www.huffingtonpost.com/entry/london-vehicle-injures-pedestrians_us_5947194ee4b06bb7d2741b74,One person has been arrested in what is being investigated as a potential terrorist attack.,2017-06-19,Forensic officers attend to the scene after a vehicle collided with pedestrians in the Finsbury Park neighborhood of North London.,https://img.huffingtonpost.com/asset/5947597d1600002100116ca6.jpeg?ops=scalefit_720_noupscale,"Nearly a dozen people were injured after a vehicle rammed into pedestrians in north London early Monday. One person at the scene died but it wasn’t clear if his death was the result of the attack.Authorities say one person is dead and at least 10 are injured after a man drove a vehicle into a crowd of pedestrians near a north London mosque that had just completed evening prayers.The incident, which occurred shortly after midnight on Monday, is being investigated as a potential terrorist attack. Police said it was “too early” to determine if the victim, who was already being given first aid at the time of the assault, died because of the attack or of an unrelated issue.The suspect was identified Monday as Darren Osborne, according to several news outlets. Authorities say the man was detained by members of the public at the scene before his arrest and was later taken to the hospital as a precaution. Originally from Somerset, the 47-year-old Osborne lived in Cardiff, Wales, with his partner and four children. “I’ve seen him walking in the street but never spoken to him,” neighbor Pauline Tibbs, 48, told The Telegraph. “He seemed normal enough.”Nine people had been taken to the hospital, and two people had been treated at the scene for minor injuries.The incident occurred near the Muslim Welfare House, a community center down the road from several local mosques, according to the U.K.’s Muslim Council. The mosques had been holding evening prayers for the holy month of Ramadan and were likely to have hosted hundreds of worshippers over the past week.Metropolitan Police Commissioner Cressida Dick said the attack was “quite clearly an attack on Muslims.”A HuffPost UK reporter witnessed police detaining a second person several hours after the collision. Authorities declined to comment on the reason for the arrest.Cynthia Vanzella, a woman who lives near the scene, told CNN she heard the collision from her home and went to a window to see people “desperately trying to make some signs to a police car.”“I saw a lot of people injured,” she said. “They were helping on the pavement and trying to help them to get to the scene.”“The gentleman went straight down this road, people were just conversing, talking, just doing what we’re doing. And he just came into all of us,” a witness told the Press Association.“I was shocked, shocked, shocked,” he added. “There were bodies around me.” The chairman of the Finsbury Park mosque, Mohammed Kozbar, described the incident as a “cowardly attack” and said there were many injuries.There was confusion and dismay among witnesses and bystanders in the aftermath of the incident. Anxious crowds gathered at police cordons surrounding the area to wait for news.“One thing that is clear: This happened after night prayer that us Muslims pray during Ramadan,” a witness told HuffPost UK. “It was clearly an act that was planned and an act that was done with full intention.”Miqdaad Versi, the assistant secretary general of the Muslim Council, said the incident reflects growing fear within the community about a rising tide of Islamophobia in the country. “People have been worried about this for a long time,” he told HuffPost.“People are shocked. People are terrified,” Versi, who was not at the scene, went on. “It’s an important time. It’s the last 10 nights of Ramadan, and that’s why there are such big crowds.”In a statement early Monday, the Muslim Council’s secretary general, Harun Khan, condemned the rise in anti-Muslim sentiment following a series of high-profile terrorist attacks in the country.“Muslim communities have been calling for increased action to tackle the growth in hate crime for many years and transformative action must now be taken to tackle not only this incident but the hugely worrying growth in Islamophobia,” Khan said. “This is a terrible incident,” British Prime Minister Theresa May said in a statement. “All my thoughts are with those who have been injured, their loved ones, and the emergency services on the scene.”Labour leader Jeremy Corbyn said he was “totally shocked.”“My thoughts are with those and the community affected by this awful event,” he said in a statement. London Mayor Sadiq Khan condemned the incident in a statement posted to Facebook early Monday, describing it as a “horrific terrorist attack on innocent people.”“We don’t yet know the full details, but this was clearly a deliberate attack on innocent Londoners, many of whom were finishing prayers during the holy month of Ramadan,” Khan wrote. “While this appears to be an attack on a particular community, like the terrible attacks in Manchester, Westminster and London Bridge, it is also an assault on all our shared values of tolerance, freedom and respect.”Khan, May, and Corbyn all visited the scene of the attack on Monday. May held a meeting with leaders of various faiths inside the mosque. Ivanka Trump, the daughter of and adviser to President Donald Trump, tweeted on Monday that, “we must stand united against hatred and extremism in all it’s ugly forms.” The president did not immediately issue a response. “We’ve made it very clear to our British allies that we stand ready to provide any support and assistance that they may need,” White House spokesman Sean Spicer told reporters at a briefing.Monday’s attack is the latest in a series of incidents in the country involving vehicles hitting pedestrians and comes at a turbulent time for May. In March, four people were killed and dozens were injured after a man drove his car into a crowd on Westminster Bridge and then stabbed a police officer. On May 22, a suicide bomber killed 22 people following a concert by Ariana Grande in the Manchester Arena. And in June, men driving a van plowed into pedestrians on London Bridge and then began stabbing people in a popular market, killing eight.Rowaida Abdelaziz, Eline Gordts, Nick Robins-Early, and Willa Frej contributed reporting."
57,WORLD NEWS,How Obama Won The French Election,Nick Robins-Early,https://www.huffingtonpost.com/entry/macron-us-france-democrats_us_593ecf20e4b02402687bbd93,A political consulting firm founded by former Obama volunteers helped Emmanuel Macron take over French politics.,2017-06-19,"French President Emmanuel Macron attends a ceremony at the Mont Valerien memorial in Suresnes, near Paris, June 18, 2017.",https://img.huffingtonpost.com/asset/5946fb9a1600002100116c55.jpeg?ops=scalefit_720_noupscale,"French President Emmanuel Macron’s party, La Republique En Marche, won a resounding victory Sunday in the final round of the country’s parliamentary elections, gaining a commanding majority in the National Assembly.The victory, which dramatically reshapes French politics, is particularly remarkable given that Macron’s party is just a year old and many of its elected representatives are new to government. Macron himself was practically unknown a year ago. But amid a fracturing of support for France’s traditionally powerful parties, En Marche successfully presented itself as a party able to transcend left-right political divides to bring reform. En Marche created both a presidential and a parliamentary campaign that mimicked the campaign of then-U.S. Sen. Barack Obama (D-Ill.) in 2008 ― with young candidates pledging change and a large grassroots movement of volunteers getting out the vote. Behind the scenes, the parallel was even more explicit, as Macron employed a political consulting firm called Liegey Muller Pons to bring U.S.-style voter outreach strategy and data collection methods reminiscent of Obama’s 2008 and 2012 campaigns into French politics.The consulting firm’s founders, Vincent Pons, Arthur Muller and Guillaume Liegey, met while at Harvard and MIT and had spent time as canvassers for Obama’s data-driven ground game. While volunteering and observing how the Obama campaign ran, they began to note its extensive use of data, door-to-door canvassing and recording of information from voters. Pons, who went door-to-door in New Hampshire in 2012, told HuffPost he was struck by the level of professionalism and technology in Obama’s campaign as compared to French elections. Pons, Liegey and Muller focused their firm on taking some of the methods they’d witnessed in the U.S. and bringing them back to France.For Macron, Liegey Muller Pons developed an algorithm based on census data and past election results to help En Marche pinpoint neighborhoods in France that were indicative of the country as a whole. Macron’s party then sent tens of thousands of volunteers to speak with potential voters in those areas during 2016, and used these visits as a kind of mass focus group to determine what issues the electorate cared about.“The effort was not meant to persuade and mobilize voters to support [Macron],” Pons, an assistant professor at Harvard Business School, told HuffPost. “The intention was instead to have a discussion with voters and bridge the gap between politics and voters.”En Marche recorded tens of thousands of conversations, using the resulting data to craft Macron’s policy platform and communications strategy. It also planted an early seed in key neighborhoods and helped build a base of volunteers and staff that it could use in its official election campaign this year. Liegey Muller Pons provided analysis on this data to further inform the campaign’s strategy.Pons believes that the process of canvassing and voter engagement outside of the election cycle ― something not previously done in France ― allowed Macron to reach disillusioned citizens who would have otherwise ignored last-minute appeals to vote. It also created an image of a party willing to hear the grievances of voters, even before they were formally asking for a vote in return.En Marche and Macron ran on a platform that combined centrist, pro-European Union policies with promises of reform and a change from establishment parties. Unlike the more radical campaigns run by the far-left and far-right candidates, which attracted a high percentage of the youth vote, En Marche received an almost even distribution of voters across age demographics. The party did especially well in major cities and with educated voters.“The success of En Marche shows that you can also provide a powerful answer by having someone who has reasonable ideas, progressive ideas, but who brings a change simply because he doesn’t have a large political background and is going to present a number of new faces and new candidates,” Pons said.Macron, a banker and former Socialist minister, came from relative obscurity to upend French politics, defeating established party candidates and far-right leader Marine Le Pen to win the presidency last month. But even after his win, Macron still needed a parliamentary majority in order to avoid a gridlocked government and a diminished presidency.En Marche fielded more than 14,000 applications from people seeking to run for Parliament. Around half of the party’s 526 candidates are new to politics, and 266 of them are women. La Republique En Marche candidates ended up easily securing a majority on Sunday, as projections showed the party and its centrist ally the MoDems on pace to secure at least 355 seats out of the chamber’s 577.Even as low voter turnout in parliamentary elections took some sheen off the strong showing, the results still suggest that Macron’s party will have the numbers to enact the wide-ranging reforms promised during the campaign.But public backlash to some of Macron’s pro-business reforms is likely, and the low turnout is not a good sign for French enthusiasm toward its current politics. France’s powerful trade unions have in the past rallied millions of people to the streets over proposed policy changes, and the unions have cautioned Macron against pushing through labor reforms too swiftly. "
