,category,headline,authors,link,short descr,date,image_caption(s),image_link(s),article
65,POLITICS,Trump's Space Adviser Wants To Toss NASA's Climate Research Funding,Nick Visser,https://www.huffingtonpost.com/entry/trump-nasa-climate-science_us_58364827e4b000af95edd961,"""Mr. Trump’s decisions will be based upon solid science, not politicized science,"" Bob Walker says.",2016-11-24,"A Greenpeace demonstration outside the U.N. climate talks in Marrakech, Morocco, this month. Diplomats at the talks discussed how to hold Trump to the Paris accord.",https://img.huffingtonpost.com/asset/58364a9a1700002500e7c2b4.jpeg?ops=scalefit_720_noupscale,"Former Rep. Bob Walker, President-elect Donald Trump’s senior adviser on space policy, hopes to end NASA’s research into climate change and instead focus on “deep space” investigation, according to an interview published Wednesday in The Guardian.Walker, a Pennsylvania Republican, told the news organization that he envisions the space agency in more of “an exploration role” under Trump’s administration and would see the end of what he referred to as “politicized science.” NASA is one of the world’s leaders in climate change research, measuring global temperatures, levels of sea ice, the amount of carbon dioxide in that atmosphere and other important climate-related indicators.“My guess is that it would be difficult to stop all ongoing NASA programs, but future programs should definitely be placed with other agencies,” Walker told the Guardian. “I believe that climate research is necessary, but it has been heavily politicized, which has undermined a lot of the work that researchers have been doing. Mr. Trump’s decisions will be based upon solid science, not politicized science.”Walker, who was chairman of the U.S. House Science, Space and Technology Committee, isn’t a member of the presidential transition team, but he told Scientific American that, although he can’t predict what policies Trump will eventually follow through on, his view is based on concerns that exploration programs “were robbed in order to concentrate on Earth science, and we want to reestablish the emphasis of NASA itself on the things that go beyond Earth orbit and Earth-observation activities.”The pronouncement is the latest sign that a Trump presidency will almost certainly be very bad for the planet. The president-elect has promised to rapidly increase U.S. production of fossil fuels, including coal, and his appointment of a noted climate denier to lead the Environmental Protection Agency has rankled activists and scientists alike. His likely picks for Interior secretary look no better, including former Alaska Gov. Sarah Palin and oil executive Harold Hamm.Despite earlier threats to pull the United States out of the landmark Paris climate agreement, Trump backtracked during an interview Tuesday with The New York Times, saying he had “an open mind” about staying in the pact alongside nearly 200 other nations.“We’re going to look [at the agreement] very carefully,” Trump said during the Times’ on-the-record meeting. “It’s one issue that’s interesting because there are few things where there’s more division than climate change. ... I do have an open mind.”But initial stories about Trump’s possible about-face ― he once tweeted that climate change was a “hoax” manufactured by the Chinese ― failed to point out that the New York businessman then almost immediately expressed some doubt to the Times about the overwhelming consensus that the Earth is warming and that humans are the primary cause.“You know the hottest day ever was in 1890-something, ‘98. You know, you can make lots of cases for different views ...As New York magazine points out, a hot day more than a century ago has no bearing on the current changes in our climate. As NASA says (for now): “Weather is what conditions of the atmosphere are over a short period of time, and climate is how the atmosphere ‘behaves’ over relatively long periods of time.”Trump, when pressed about a human link to climate change by the Times’ James Bennet, said he thought “there is some connectivity” but went on to suggest that addressing climate change would take a back seat to economic interests.“There is some, something. It depends on how much. It also depends on how much it’s going to cost our companies. You have to understand, our companies are noncompetitive right now.”Diplomats at the recent U.N. climate talks have already threatened to punish the U.S. with a carbon tariff or a potential trade war if Trump pulls out of the Paris accord."
66,POLITICS,Trump Touted His Turkish Business Partner In A Call With President Erdogan,Paul Blumenthal,https://www.huffingtonpost.com/entry/donald-trump-turkey-business_us_5836188ae4b01ba68ac41d9f,"Dogan Holding, which owns Trump Towers Istanbul, has butted heads with Erdogan's government.",2016-11-24,"President-elect Donald Trump called his Turkish business partner a ""close friend"" on a phone call with Turkish President Recep Tayyip Erdogan.",https://img.huffingtonpost.com/asset/58361a23180000230c30fc5f.jpeg?ops=scalefit_720_noupscale,"WASHINGTON ― When President-elect Donald Trump spoke to Turkish President Recep Tayyip Erdogan on Nov. 9, he mentioned one of his Turkish business partners as a “close friend” and passed on his remarks that he is “your great admirer.”The twinned Trump Towers bear the president-elect’s name in Istanbul. Dogan Holding, a massive media and real estate conglomerate in Turkey, owns the conjoined buildings and pays the Trump Organization to license the Trump name and brand. It can now rely on that name and brand to be sitting in the Oval Office and singing its praises to President Erdogan.In his call with the Turkish leader, Trump passed on praise for Erdogan from Mehmet Ali Yalcindag, son-in-law of Dogan Holding owner Aydin Dogan and former president of the Dogan Media Group. His wife, Arzuhan Dogan Yalcindage, sits on the board of Dogan Holding. He’s friends with the Trump family and had worked closely on the Trump Towers project in Istanbul. On election night, he attended Trump’s shocking victory celebration at the New York Hilton in Midtown Manhattan.Trump’s praise for Mehmet Ali Yalcindag was first reported by Amberin Zaman in the independent Turkish paper Diken. Zaman’s report has since been picked up by other Turkish newspapers and television stations.Vouching for his Turkish business partner in the call with Erdogan is just the most recent sign of Trump’s near-impossible task in avoiding the significant conflicts of interest his global real estate business presents. During the campaign he promised to separate himself from his business and to work only for the American people.“I wouldn’t ever be involved because I wouldn’t care about anything but our country, anything,” he said in January.Since his election, Trump has declared that he would hand off his business to three of his adult children, Ivanka, Donald Jr. and Eric Trump, in a so-called blind trust. He has done no such thing. Instead, he appointed his children to the executive committee of his presidential transition ― blending his business with his government activities.One week after his election, he welcomed three of his Indian business partners to Trump Tower in Manhattan. The Trump Organization is involved in at least five real estate deals in India. Ivanka Trump, despite her supposed separate role as head of the Trump business, joined her father last week for his in-person meeting with Japanese Prime Minister Shinzo Abe.The president-elect also reportedly handed the phone to Ivanka during a conversation with Argentinian President Mauricio Macri. Trump reportedly discussed the possibility of speeding up the permit process for a building that would bear his name in Buenos Aires. Spokesmen for both Macri and Trump denied that any such discussion took place. Further, Trump recently told British politician and former head of the UK Independence Party Nigel Farage that he should help lead the opposition to offshore wind farms in Britain. Trump has long opposed the construction of such offshore wind farms near his golf course in Scotland. When the New York Times asked Trump on Tuesday if he had this conversation with Farage, he said, “I might have brought it up.”Norm Eisen, the former top ethics official for President Barack Obama and former ambassador to the Czech Republic, called Trump’s references to his business partner in his conversation with Erdogan “entirely improper,” “wrong” and “reprehensible.”“There should be a big, beautiful wall between his personal interests and the public interest,” Eisen said. “It’s only a matter of time before not only will his voters and the more than half of the voters who chose someone else get fed up, but when you disrespect these boundaries it’s an invitation to people to disrespect them back.”For now, Trump’s touting of Yalcindag provides a major benefit for the company and its leadership. There is a reason the company’s stock briefly surged after Trump’s victory. In recent years, the Dogan Media Group has butted heads with the authoritarian Erdogan as he sought to punish dissenting media.“It will give them a layer of protection,” said Henri Barkey, director of the Middle East program at the Wilson Center, a nonpartisan policy forum. “Not because Trump will necessarily defend them, but because the Turkish government will think twice about going after them because the president of the United States is supporting them and, also, Erdogan is really looking for Trump to change many of Obama’s policies, especially in Syria and with respect to Iran. So he’s not going after anything that would upset or annoy Trump.”In 2009, Erdogan’s government levied a $2.5 billion fine on Aydin Dogan’s company while Erdogan called for his supporters to boycott the company’s television stations and newspapers. The massive fine was nearly equivalent to Dogan’s entire net worth. Dogan was at the time an outspoken critic of Erdogan and his Islamist AK political party. The fine was compared at the time to efforts by Russian President Vladimir Putin to crush his wealthy political opponents, including Mikhail Khodorkovsky, a former oil tycoon who now lives in exile. And this was only one of many attacks the Erdogan government has made against Dogan and his business empire.“In the last decade, Erdogan put a huge amount of political and economic pressure on Dogan Group, which ended up with two outcomes,” said Soner Cagaptay, director of the Turkish Research Program at the nonprofit Washington Institute for Near East Policy. “One, sales of Dogan-owned media to government-owned businesses. Second, change of editorial tone and content. For example, prominent columnists have been fired. Editors have been demoted.”While not entirely losing its independent voice, Dogan Media Group properties have adopted pro-government stances in all but the most egregious instances.The change was evident in its coverage of the 2013 popular protests in Istanbul’s Taksim Square by CNN Turk, a Dogan Media Group property. Instead of covering the protests, CNN Turk aired documentaries about penguins. The penguin soon became a popular image among protesters.CNN Turk was also instrumental in Erdogan’s successful defeat of the coup attempt in July. In a famous moment, Erdogan made his first appearance amid the chaos of the coup attempt on CNN Turk, when the anchor held up her phone with the Turkish president on the screen via FaceTime. He called for his supporters to flood the streets and show their support for his regime. It turned the tide in his favor. After the coup was defeated, Erdogan adopted emergency powers. He has since shuttered at least 20 television and radio stations while arresting reporters and columnists accused of working with or holding sympathies with the coup plotters.During this time, Yalcindag served as head of the Dogan Media Group. He resigned in September amid a computer hacking scandal that implied he coordinated with the government to censor news. A hacking collective released emails alleged to be from Yalcindag to Energy Minister Berat Albayrak, Erdogan’s son-in-law, that purported to show the two ensuring the news stayed within bounds approved by the government. Yalcindag asserted that the hacked emails were fraudulent.Now Yalcindag is the key middleman between the incoming president of the United States and the Turkish government. Trump’s victory may also help keep his name on that complex. In June, Erdogan denounced Trump’s Islamophobia, stating that the then-candidate had “no tolerance for Muslims in America.” The Turkish president called for Trump’s name to be stripped from Trump Towers Istanbul and said that he regretted attending the opening ceremony. Now that the Trump brand is connected to American diplomacy, this topic apparently did not come up when the two leaders spoke.None of this is worrying to the president-elect, who has dismissed any concerns about conflicts of interest. In a tweet sent Monday, he blamed the media for reporting on his potential conflicts and said that everyone knew he had these business ties when they voted for him. In his Tuesday interview with New York Times reporters, Trump asserted that he could continue to run his business while in the White House if he really wanted to. He further laid down his explanation for this and all future conflicts as they present themselves: “The law is totally on my side, meaning, the president can’t have a conflict of interest.”CORRECTION: An earlier version of this story said Trump had praised his business partner to Erdogan. In fact, according to the Turkish-language report, he passed on the business partner’s praise of Erdogan."
67,POLITICS,Trump Touted His Turkish Business Partner In A Call With President Erdogan,Paul Blumenthal,https://www.huffingtonpost.com/entry/donald-trump-turkey-business_us_5836188ae4b01ba68ac41d9f,"Dogan Holding, which owns Trump Towers Istanbul, has butted heads with Erdogan's government.",2016-11-24,Trump Towers Istanbul are conjoined office and residence towers with a shopping mall.,https://img.huffingtonpost.com/asset/58361acc180000230c30fc63.jpeg?ops=scalefit_720_noupscale,"WASHINGTON ― When President-elect Donald Trump spoke to Turkish President Recep Tayyip Erdogan on Nov. 9, he mentioned one of his Turkish business partners as a “close friend” and passed on his remarks that he is “your great admirer.”The twinned Trump Towers bear the president-elect’s name in Istanbul. Dogan Holding, a massive media and real estate conglomerate in Turkey, owns the conjoined buildings and pays the Trump Organization to license the Trump name and brand. It can now rely on that name and brand to be sitting in the Oval Office and singing its praises to President Erdogan.In his call with the Turkish leader, Trump passed on praise for Erdogan from Mehmet Ali Yalcindag, son-in-law of Dogan Holding owner Aydin Dogan and former president of the Dogan Media Group. His wife, Arzuhan Dogan Yalcindage, sits on the board of Dogan Holding. He’s friends with the Trump family and had worked closely on the Trump Towers project in Istanbul. On election night, he attended Trump’s shocking victory celebration at the New York Hilton in Midtown Manhattan.Trump’s praise for Mehmet Ali Yalcindag was first reported by Amberin Zaman in the independent Turkish paper Diken. Zaman’s report has since been picked up by other Turkish newspapers and television stations.Vouching for his Turkish business partner in the call with Erdogan is just the most recent sign of Trump’s near-impossible task in avoiding the significant conflicts of interest his global real estate business presents. During the campaign he promised to separate himself from his business and to work only for the American people.“I wouldn’t ever be involved because I wouldn’t care about anything but our country, anything,” he said in January.Since his election, Trump has declared that he would hand off his business to three of his adult children, Ivanka, Donald Jr. and Eric Trump, in a so-called blind trust. He has done no such thing. Instead, he appointed his children to the executive committee of his presidential transition ― blending his business with his government activities.One week after his election, he welcomed three of his Indian business partners to Trump Tower in Manhattan. The Trump Organization is involved in at least five real estate deals in India. Ivanka Trump, despite her supposed separate role as head of the Trump business, joined her father last week for his in-person meeting with Japanese Prime Minister Shinzo Abe.The president-elect also reportedly handed the phone to Ivanka during a conversation with Argentinian President Mauricio Macri. Trump reportedly discussed the possibility of speeding up the permit process for a building that would bear his name in Buenos Aires. Spokesmen for both Macri and Trump denied that any such discussion took place. Further, Trump recently told British politician and former head of the UK Independence Party Nigel Farage that he should help lead the opposition to offshore wind farms in Britain. Trump has long opposed the construction of such offshore wind farms near his golf course in Scotland. When the New York Times asked Trump on Tuesday if he had this conversation with Farage, he said, “I might have brought it up.”Norm Eisen, the former top ethics official for President Barack Obama and former ambassador to the Czech Republic, called Trump’s references to his business partner in his conversation with Erdogan “entirely improper,” “wrong” and “reprehensible.”“There should be a big, beautiful wall between his personal interests and the public interest,” Eisen said. “It’s only a matter of time before not only will his voters and the more than half of the voters who chose someone else get fed up, but when you disrespect these boundaries it’s an invitation to people to disrespect them back.”For now, Trump’s touting of Yalcindag provides a major benefit for the company and its leadership. There is a reason the company’s stock briefly surged after Trump’s victory. In recent years, the Dogan Media Group has butted heads with the authoritarian Erdogan as he sought to punish dissenting media.“It will give them a layer of protection,” said Henri Barkey, director of the Middle East program at the Wilson Center, a nonpartisan policy forum. “Not because Trump will necessarily defend them, but because the Turkish government will think twice about going after them because the president of the United States is supporting them and, also, Erdogan is really looking for Trump to change many of Obama’s policies, especially in Syria and with respect to Iran. So he’s not going after anything that would upset or annoy Trump.”In 2009, Erdogan’s government levied a $2.5 billion fine on Aydin Dogan’s company while Erdogan called for his supporters to boycott the company’s television stations and newspapers. The massive fine was nearly equivalent to Dogan’s entire net worth. Dogan was at the time an outspoken critic of Erdogan and his Islamist AK political party. The fine was compared at the time to efforts by Russian President Vladimir Putin to crush his wealthy political opponents, including Mikhail Khodorkovsky, a former oil tycoon who now lives in exile. And this was only one of many attacks the Erdogan government has made against Dogan and his business empire.“In the last decade, Erdogan put a huge amount of political and economic pressure on Dogan Group, which ended up with two outcomes,” said Soner Cagaptay, director of the Turkish Research Program at the nonprofit Washington Institute for Near East Policy. “One, sales of Dogan-owned media to government-owned businesses. Second, change of editorial tone and content. For example, prominent columnists have been fired. Editors have been demoted.”While not entirely losing its independent voice, Dogan Media Group properties have adopted pro-government stances in all but the most egregious instances.The change was evident in its coverage of the 2013 popular protests in Istanbul’s Taksim Square by CNN Turk, a Dogan Media Group property. Instead of covering the protests, CNN Turk aired documentaries about penguins. The penguin soon became a popular image among protesters.CNN Turk was also instrumental in Erdogan’s successful defeat of the coup attempt in July. In a famous moment, Erdogan made his first appearance amid the chaos of the coup attempt on CNN Turk, when the anchor held up her phone with the Turkish president on the screen via FaceTime. He called for his supporters to flood the streets and show their support for his regime. It turned the tide in his favor. After the coup was defeated, Erdogan adopted emergency powers. He has since shuttered at least 20 television and radio stations while arresting reporters and columnists accused of working with or holding sympathies with the coup plotters.During this time, Yalcindag served as head of the Dogan Media Group. He resigned in September amid a computer hacking scandal that implied he coordinated with the government to censor news. A hacking collective released emails alleged to be from Yalcindag to Energy Minister Berat Albayrak, Erdogan’s son-in-law, that purported to show the two ensuring the news stayed within bounds approved by the government. Yalcindag asserted that the hacked emails were fraudulent.Now Yalcindag is the key middleman between the incoming president of the United States and the Turkish government. Trump’s victory may also help keep his name on that complex. In June, Erdogan denounced Trump’s Islamophobia, stating that the then-candidate had “no tolerance for Muslims in America.” The Turkish president called for Trump’s name to be stripped from Trump Towers Istanbul and said that he regretted attending the opening ceremony. Now that the Trump brand is connected to American diplomacy, this topic apparently did not come up when the two leaders spoke.None of this is worrying to the president-elect, who has dismissed any concerns about conflicts of interest. In a tweet sent Monday, he blamed the media for reporting on his potential conflicts and said that everyone knew he had these business ties when they voted for him. In his Tuesday interview with New York Times reporters, Trump asserted that he could continue to run his business while in the White House if he really wanted to. He further laid down his explanation for this and all future conflicts as they present themselves: “The law is totally on my side, meaning, the president can’t have a conflict of interest.”CORRECTION: An earlier version of this story said Trump had praised his business partner to Erdogan. In fact, according to the Turkish-language report, he passed on the business partner’s praise of Erdogan."
