,category,headline,authors,link,short descr,date,image_caption(s),image_link(s),article
0,POLITICS,DNC Members Vote Down Corporate Money Ban,Daniel Marans,https://www.huffingtonpost.com/entry/dnc-pac-contributions-ban_us_58b1ac9ee4b0a8a9b782bb00,The measure would have reinstated a policy put in place by Barack Obama.,2017-02-25,"Supporters of Rep. Keith Ellison (D-Minn.), a candidate for Democratic National Committee Chairman, cheer during a forum in Baltimore, on Feb. 11, 2017.",https://img.huffingtonpost.com/asset/58b1b07829000020000c31f9.jpeg?cache=NXfGBkjnlL&ops=scalefit_720_noupscale,"ATLANTA ― Democratic National Committee members on Saturday voted down a resolution that would have reinstated former President Barack Obama’s ban on corporate political action committee donations to the party.Resolution 33, introduced by DNC Vice Chair Christine Pelosi, would also have forbidden “registered, federal corporate lobbyists” from serving as “DNC chair-appointed, at-large members.”A majority of the 442 eligible DNC members rejected the resolution after roughly a dozen members rose to speak for and against it. Supporters of DNC chair candidate Rep. Keith Ellison (D-Minn.) could be heard cheering loudly during arguments in favor of the resolution from their seats in the section of the auditorium open to the public.The resolution will now go to the DNC’s smaller executive committee for consideration.Obama, as the party’s presidential nominee in 2008, banned contributions from political action committees, as well as from lobbyists. Former DNC chair Debbie Wasserman Schultz quietly lifted the ban ahead of the 2016 election.Bob Mulholland, DNC member from Chico, California, was one of the bill’s most vocal opponents and helped lead a successful effort to table the resolution for further review on Friday. He argued that the ban would handicap Democrats at a time when they need all the resources they can muster.“Just a reminder that Republicans control all three branches of the government right now ― all three branches. We do not have a president in the White House,” Mulholland said. “I am not a member of Mother Theresa’s sisters organization; I am a member of the Democratic Party.”New York DNC Member Stuart Appelbaum, a co-sponsor of the resolution, insisted that it was crucial for voters to believe the DNC is accountable to them, not corporate interests.“This resolution provides us an important opportunity to send a message to the people of this country as to our values,” said Appelbaum, president of the Retail, Wholesale and Department Store Union.“It is not something new: We operated this way for seven years!” Appelbaum added, referring to the Obama-era ban.Resolution 33 appears to be narrower than the ban on contributions from lobbyists and PACs imposed by Obama, explicitly banning donations only from corporate PACs.Ellison told HuffPost in January that he would reinstate Obama’s ban on lobbyist donations. He subsequently walked back the promise, vowing only to make sure the measure was seconded and debated by the DNC’s executive committee.His chief opponent, former Labor Secretary Tom Perez, declined to say whether he supports the idea of such a ban."
1,CRIME,Tech Consultant Arrested For Murder After Wife Vanishes During Cruise,Mary Papenfuss,https://www.huffingtonpost.com/entry/wife-vanishes-cruise_us_58b14326e4b0780bac29b996,Maritime authorities alerted police after noticing the mom was missing during a head count of disembarking passengers.,2017-02-25,"<br>Daniel Belling, 45, faced a preliminary investigative judge Friday for a hearing in the Rome prison of Regina Coeli, where a a preliminary investigative judge said he should remain in custody.",https://img.huffingtonpost.com/asset/58b195ea2900002200f28b12.jpeg?ops=scalefit_720_noupscale,"Italian officials have detained a German tech consultant at Rome’s Ciampino airport after his wife vanished from their vacation cruise and he didn’t tell anyone, police say.Daniel Belling, 45, his wife Li Yinglei, 36, and their two young children began a 10-day Mediterranean cruise Feb. 10 on the Magnifica cruise ship in Civitavecchia, Italy, the Irish Times reports. Li disappeared at some point but it didn’t come to light until cruise workers did a head count of disembarking passengers on Monday. Maritime authorities alerted police, who arrested Belling on suspicion of murder. He was charged with murder and faced a preliminary investigative judge Friday for a hearing in the Rome prison of Regina Coeli. The judge said just before midnight local time that he should remain in custody because of his “suspect” behaviour and concerns that he would try to leave the country, according to the Irish Times.His lawyer indicated to The Telegraph Wednesday that there’s a perfectly good explanation for what happened, though he didn’t provide one. He says Belling would have behaved differently had he been a killer.“He simply headed to Ciampino airport with his children [ages 4 and 6] to catch the flight that he had booked when he first organized the cruise,” said defense lawyer Luigi Conti. He added that his client would explain what happened in court.The lawyer expects the investigative procedure to be brief and expects the case to come to court within less than a year, the Irish Times reports.The last time anyone remembers seeing Belling’s wife was in a shop with her family on Feb. 10, according to La Stampa. The Magnifica was stopped mid-cruise Wednesday evening so investigators could examine the room where the couple was staying, the Irish Sun reports.Belling works as a tech consultant whose clients include Apple, according to the Telegraph. He’s a German citizen but lives in the Irish capital of Dublin. Italian authorities stopped him as he was about to board a flight to Dublin Monday.The couple’s children are in the care of Italian social services.This article has been updated to include details of Belling’s hearing Friday."
2,BUSINESS,7 Ways Managers Motivate And Demotivate Employees,"Dr. Travis Bradberry, ContributorTalentSmart, President and 'Emotional Intelligence 2.0,' Coauthor",https://www.huffingtonpost.com/entry/7-ways-managers-motivate-and-demotivate-employees_us_58af5199e4b0658fc20f9314,Few things are as costly and disruptive as managers who kill morale.,2017-02-25,"<p>Dr. Travis Bradberry takes a closer look at 7 mistakes that kill morale, with advice for how managers can do right by their employees.</p>",https://img.huffingtonpost.com/asset/58af51ba2900002700f285d1.jpeg?ops=scalefit_720_noupscale,"Few things are as costly and disruptive as managers who kill morale.Demotivated employees underperform and then walk out the door at the first opportunity.The scariest thing is how prevalent this lack of motivation is. Gallup research shows that 70% of employees consider themselves to be disengaged at work.Organizations know how important it is to have motivated, engaged employees, but most fail to hold managers accountable for making it happen.When they don’t, the bottom line suffers.Research from the University of California found that motivated employees were 31% more productive, had 37% higher sales, and were three times more creative than demotivated employees. They were also 87% less likely to quit, according to a Corporate Leadership Council study on over 50,000 people.The Gallup research shows that a mind-boggling 70% of an employee’s motivation is influenced by his or her manager. It’s no wonder employees don’t leave jobs; they leave managers.Making Things WorseBefore managers can start creating motivated, engaged employees, there are some critical things that they need to stop doing. What follows are some of the worst behaviors that managers need to eradicate from the workplace.1. Making a lot of stupid rules. Companies need to have rules—that’s a given—but they don’t have to be short sighted and lazy attempts at creating order. Whether it’s an overzealous attendance policy or taking employees’ frequent flier miles, even a couple of unnecessary rules can drive people crazy. When good employees feel like big brother is watching, they’ll find someplace else to work. 2. Letting accomplishments go unrecognized. It’s easy to underestimate the power of a pat on the back, especially with top performers who are intrinsically motivated. Everyone likes kudos, none more so than those who work hard and give their all. Rewarding individual accomplishments shows that you’re paying attention. Managers need to communicate with their people to find out what makes them feel good (for some, it’s a raise; for others, it’s public recognition) and then to reward them for a job well done. With top performers, this will happen often if you’re doing it right. 3. Hiring and promoting the wrong people. Good, hard-working employees want to work with like-minded professionals. When managers don’t do the hard work of hiring good people, it’s a major demotivator for those stuck working alongside them. Promoting the wrong people is even worse. When you work your tail off only to get passed over for a promotion that’s given to someone who glad-handed their way to the top­­­­­­­, it’s a massive insult. No wonder it makes good people leave. 4. Treating everyone equally. While this tactic works with school children, the workplace ought to function differently. Treating everyone equally shows your top performers that no matter how high they perform (and, typically, top performers are work horses), they will be treated the same as the bozo who does nothing more than punch the clock. 5. Tolerating poor performance. It’s said that in jazz bands, the band is only as good as the worst player; no matter how great some members may be, everyone hears the worst player. The same goes for a company. When you permit weak links to exist without consequence, they drag everyone else down, especially your top performers.6. Going back on their commitments. Making promises to people places you on the fine line that lies between making them very happy and watching them walk out the door. When you uphold a commitment, you grow in the eyes of your employees because you prove yourself to be trustworthy and honorable (two very important qualities in a boss). But when you disregard your commitment, you come across as slimy, uncaring, and disrespectful. After all, if the boss doesn’t honor his or her commitments, why should everyone else?7. Being apathetic. More than half of people who leave their jobs do so because of their relationship with their boss. Smart companies make certain their managers know how to balance being professional with being human. These are the bosses who celebrate an employee’s success, empathize with those going through hard times, and challenge people, even when it hurts. Bosses who fail to really care will always have high turnover rates. It’s impossible to work for someone eight-plus hours a day when they aren’t personally involved and don’t care about anything other than your productivity.Making Things BetterOnce managers have eradicated the seven negative behaviors that demotivate their best people, it’s time to replace them with the following seven behaviors that make people love their jobs. 1. Follow the platinum rule. The Golden Rule (treat others as you want to be treated) has a fatal flaw: it assumes that all people want to be treated the same way. It ignores the fact that people are motivated by vastly different things. One person loves public recognition, while another loathes being the center of attention. The Platinum Rule (treat others as they want to be treated) corrects that flaw. Good managers are great at reading other people, and they adjust their behavior and style accordingly.2. Be strong without being harsh. Strength is an important quality in a leader. People will wait to see if a leader is strong before they decide to follow his or her lead or not. People need courage in their leaders. They need someone who can make difficult decisions and watch over the good of the group. They need a leader who will stay the course when things get tough. People are far more likely to show strength themselves when their leader does the same. A lot of leaders mistake domineering, controlling, and otherwise harsh behavior for strength. They think that taking control and pushing people around will somehow inspire a loyal following. Strength isn’t something you can force on people; it’s something you earn by demonstrating it time and again in the face of adversity. Only then will people trust that they should follow you.3. Remember that communication is a two-way street. Many managers think that they’re great communicators, not realizing that they’re only communicating in one direction. Some pride themselves on being approachable and easily accessible, yet they don’t really hear the ideas that people share with them. Some managers don’t set goals or provide context for the things they ask people to do, and others never offer feedback, leaving people wondering if they’re more likely to get promoted or fired.4. Be a role model, not a preacher. Great leaders inspire trust and admiration through their actions, not just their words. Many leaders say that integrity is important to them, but great leaders walk their talk by demonstrating integrity every day. Harping on people all day long about the behavior you want to see has a tiny fraction of the impact you achieve by demonstrating that behavior yourself.5. Be transparent. Good managers are transparent and forthcoming about company goals, expectations, and plans. When managers try to sugarcoat, mask, or euphemize in order to make things seem better than they are, employees see right through it.6. Be humble. Few things kill motivation as quickly as a boss’s arrogance. Great bosses don’t act as though they’re better than you, because they don’t think that they’re better than you. Rather than being a source of prestige, they see their leadership position as bringing them additional accountability for serving those who follow them.7. Take a genuine interest in employees’ work-life balance. Nothing burns good employees out quite like overworking them. It’s so tempting to work your best people hard that managers frequently fall into this trap. Overworking good employees is perplexing to them; it makes them feel as if they’re being punished for their great performance. Overworking employees is also counterproductive. New research from Stanford shows that productivity per hour declines sharply when the workweek exceeds 50 hours, and productivity drops off so much after 55 hours that you don’t get anything out of the extra work.Bringing It All TogetherIf you cultivate the characteristics above and avoid the demotivators, you’ll become the kind of boss that people remember for the rest of their careers.Have you seen these motivators and demotivators in action? Please share your thoughts in the comments section, as I learn just as much from you as you do from me.If you’d like to learn more, my book Emotional Intelligence 2.0 is a great place to start."
3,GREEN,Viral Tiger Drone Video Reveals A Grim Reality In China,Carla Herreria,https://www.huffingtonpost.com/entry/tiger-drone-video-slaughter-farm_us_58b09968e4b0a8a9b7822d5a,"""These tigers are doomed,"" says big cat welfare activist Susan Bass.",2017-02-25,Tigers chased a drone and the internet loved every bit of it,https://img.huffingtonpost.com/asset/58b0a6172900002100beac7d.png?cache=Kv4SbS9xgz&ops=scalefit_720_noupscale,"This week, the Chinese state-run media introduced to the world a streak of chubby tigers, adorably chasing a drone out of the sky.Set to playful music, the video shows Siberian tigers, including a few surprisingly fat ones, stalking a drone and eventually knocking it out of the air.Staff at this tiger park in China’s Heilongjiang province were reportedly using the drones to give the overweight tigers a workout before spring, China Central Television explained on its news site.Chubby cats, snow, drone footage: It was internet gold that even had its own segment on Friday’s “Today” show on NBC.That is until animal rights activists came forward to expose where they believe the viral Siberian tigers actually are: a slaughter farm.“This is not a secret,” Susan Bass, spokeswoman for the Florida-based Big Cat Rescue, told The Huffington Post. “They have them all over China.”Bass told HuffPost that her rescue organization tracks tiger slaughter farms in China, and they are quite familiar with the one in the video, which she recognized as the Harbin Siberian Tiger Park. Vice’s Motherboard also identified the park as the one in Harbin.While Trip Advisor reviews for the park suggest that it’s a popular tourist attraction with “healthy” and “happy” animals, Bass says the facility is actually used to farm and harvest tiger parts.“This is the kind of stuff we follow,” Bass said of the tiger park. “The kind of situations where captured tigers are being exploited.” Her organization is an accredited animal sanctuary that rescues abused exotic cats.“This is sad. These tigers are doomed,” she told HuffPost. “You’re watching tigers that are going to be slaughtered for their parts.”These tiger farms, according to EcoWatch, breed and kill tigers so their parts can be made into traditional medicines, decorations or tiger bone wine. The wine is believed to give the drinker energy and a strong sex drive. Tiger penises are sold as an aphrodisiac, according to National Geographic.Although China banned tiger breeding in 1993 and promised the Convention on International Trade in Endangered Species (CITES) that it had banned internal trade in tiger parts, the country is believed to have 200 working tiger farms, The Guardian reported in 2016. China allows these farms to hold an estimated 6,000 tigers for slaughter.According to estimates by the Environmental Investigation Agency, at least one tiger is killed daily for its use in traditional Chinese medicine. But parts of the endangered animal are reportedly sold in markets throughout the world, from China, Taiwan and Japan, to South Korea, the U.S. and Britain. As for the Siberian tigers in the now-viral drone video, Bass believes that their fates may already be sealed.“They’re pretty large tigers,” she told HuffPost. “They’re probably going to be slaughtered pretty soon.”"
4,GREEN,Viral Tiger Drone Video Reveals A Grim Reality In China,Carla Herreria,https://www.huffingtonpost.com/entry/tiger-drone-video-slaughter-farm_us_58b09968e4b0a8a9b7822d5a,"""These tigers are doomed,"" says big cat welfare activist Susan Bass.",2017-02-25,A tiger begs tourists for treats at the Heilongjiang Siberian Tiger Park in Harbin.,https://img.huffingtonpost.com/asset/58b0c07e290000f616f289f1.jpeg?ops=scalefit_720_noupscale,"This week, the Chinese state-run media introduced to the world a streak of chubby tigers, adorably chasing a drone out of the sky.Set to playful music, the video shows Siberian tigers, including a few surprisingly fat ones, stalking a drone and eventually knocking it out of the air.Staff at this tiger park in China’s Heilongjiang province were reportedly using the drones to give the overweight tigers a workout before spring, China Central Television explained on its news site.Chubby cats, snow, drone footage: It was internet gold that even had its own segment on Friday’s “Today” show on NBC.That is until animal rights activists came forward to expose where they believe the viral Siberian tigers actually are: a slaughter farm.“This is not a secret,” Susan Bass, spokeswoman for the Florida-based Big Cat Rescue, told The Huffington Post. “They have them all over China.”Bass told HuffPost that her rescue organization tracks tiger slaughter farms in China, and they are quite familiar with the one in the video, which she recognized as the Harbin Siberian Tiger Park. Vice’s Motherboard also identified the park as the one in Harbin.While Trip Advisor reviews for the park suggest that it’s a popular tourist attraction with “healthy” and “happy” animals, Bass says the facility is actually used to farm and harvest tiger parts.“This is the kind of stuff we follow,” Bass said of the tiger park. “The kind of situations where captured tigers are being exploited.” Her organization is an accredited animal sanctuary that rescues abused exotic cats.“This is sad. These tigers are doomed,” she told HuffPost. “You’re watching tigers that are going to be slaughtered for their parts.”These tiger farms, according to EcoWatch, breed and kill tigers so their parts can be made into traditional medicines, decorations or tiger bone wine. The wine is believed to give the drinker energy and a strong sex drive. Tiger penises are sold as an aphrodisiac, according to National Geographic.Although China banned tiger breeding in 1993 and promised the Convention on International Trade in Endangered Species (CITES) that it had banned internal trade in tiger parts, the country is believed to have 200 working tiger farms, The Guardian reported in 2016. China allows these farms to hold an estimated 6,000 tigers for slaughter.According to estimates by the Environmental Investigation Agency, at least one tiger is killed daily for its use in traditional Chinese medicine. But parts of the endangered animal are reportedly sold in markets throughout the world, from China, Taiwan and Japan, to South Korea, the U.S. and Britain. As for the Siberian tigers in the now-viral drone video, Bass believes that their fates may already be sealed.“They’re pretty large tigers,” she told HuffPost. “They’re probably going to be slaughtered pretty soon.”"
5,ENTERTAINMENT,George Clooney Subtly Compares Donald Trump Era To McCarthyism,Maxwell Strachan,https://www.huffingtonpost.com/entry/george-clooney-edward-r-murrow_us_58b1c65be4b060480e0879f8,The actor referenced Edward R. Murrow’s famous words during a speech on Friday night.,2017-02-25,George Clooney took on President Donald Trump once again on Friday.,https://img.huffingtonpost.com/asset/58b1c7022900002200beae39.jpeg?cache=JRusr5jQb3&ops=scalefit_720_noupscale,"George Clooney was in Paris on Friday for the 42nd César awards, France’s version of The Oscars, where he was presented with an Honorary César for his body of work. On stage with actor Jean Dujardin, who presented the award, the actor at first thanked his wife, Amal Clooney, and the French Academy, before turning to the state of things in the U.S.“As citizens of the world, we’re going to have to work harder and harder not to let hate win,” he said, later adding, “I was thinking about Edward R. Murrow as we find ourselves nostalgic for when America was great and when the news wasn’t fake.”Clooney then weaved together quotes from one of the broadcast legend’s most famous telecasts, when Murrow famously criticized Sen. Joseph R. McCarthy (R-Wis.) on CBS’ “See It Now” on March 9, 1954, as the senator ramped up his anti-communist activities.Said Clooney on Friday:We must not confuse dissent with disloyalty. We must not walk in fear of one another. We must not be driven by fear into an age of unreason. If we dig deep in our history and remember that we are not descendants from fearful people, we proclaim ourselves indeed as we are the defenders of freedom wherever it continues to exist in the world. But we cannot defend freedom abroad by deserting it at home.Cassius, in this instance, refers to the character from William Shakespeare’s Julius Caesar. Clooney also swapped in a few words to bring Murrow’s words into the modern era, switching out the journalist’s “the junior Senator from Wisconsin” for “this president.”Edward R. Murrow’s famous criticism of Joseph R. McCarthyClooney is a known fan of Murrow’s career, as he wrote, directed and starred in 2005’s “Good Night, and Good Luck,” a film that followed the tension between Murrow and McCarthy in the 1950s. The actor has repeatedly taken President Donald Trump to task in recent months. Just earlier this week, he called Trump a “Hollywood elitist” who collected “$120,000 a year in his Screen Actors Guild pension fund.”"
