,category,headline,authors,link,short descr,date,image_caption(s),image_link(s),article
21,POLITICS,Parents Shift From Fear To Defiance As Bomb Threats Target Jewish Centers,Andy Campbell and Sebastian Murdock,https://www.huffingtonpost.com/entry/parents-bomb-threats-jewish-community-centers_us_58b04cb2e4b060480e071a18,"Kids learn to read, swim, draw and do cartwheels at these facilities.",2017-02-24,People of ages take classes at their local Jewish Community Center.,https://img.huffingtonpost.com/asset/58b06b4b280000db9899affc.jpeg?cache=yuUudPgw5L&ops=scalefit_720_noupscale,"Kara Nelson has been going to the New Orleans Jewish Community Center for more than 20 years. She likes that they have karate and ballet courses. Sometimes she takes art classes. Her children, 5 and 7, have attended camp there. Nelson and her kids aren’t Jewish.“It’s the best place,” Nelson told The Huffington Post. “It’s like a second home to me since I’ve been in New Orleans. People are super friendly and I like that my kids are learning about Jewish traditions.”On Thursday morning, Nelson was taking her exercise class at the JCC when an evacuation was announced on the overhead speakers. Someone had called in a bomb threat to the community center, which also acts as a nursery and preschool.“The kids were all out first and taken to the high school across the street,” Nelson said. “That seemed to be the first priority, to hustle them out and away from everybody.”Within minutes, New Orleans police arrived and swept the building. Unwilling to let the threats destroy their day, Nelson’s classmates continued their exercise outside. Police eventually gave the all-clear.The last two months haven’t been easy for parents who have children attending classes at Jewish Community Centers. At least 69 bomb threats have been called into 55 JCCs across the country since Jan. 9, sometimes forcing kids and adults to evacuate and wait for police officers to sweep buildings. Fear has mixed with aggravation as authorities have deemed the bomb threats to be hoaxes so far. Gordon JCC in Nashville, Tennessee, has received three threatening calls, the most targeting any one location. “We have no idea why we were singled out,” Leslie Sax, executive director of the center, told HuffPost. “It’s such a disruption. We’ve had to spend too much time on security protocol recently rather than what we do here every day.”She said parents haven’t pulled their kids from her center’s programming in light of the threats, but suggested that other JCCs haven’t been so lucky.“I think they’re more sad and frustrated that it’s going on,” Sax said. “The important thing to note is that the kids have not been traumatized by this. I credit the staff for that. The time we did evacuate, the kids thought they were on a field trip ― they were having fun.”Some officials at the JCC Association of North America have found comfort in the fact that FBI is looking into the series of bomb threats, although the agency doesn’t comment on active investigations. Members of Congress have called on the departments of Justice and Homeland Security to aid local investigators.But parental nerves are still strung tight.On Thursday, a suspicious package was reported at the Newton JCC in Massachusetts, a center that had already been the victim of an earlier bomb threat. Authorities deemed it a false alarm, and no threat was called in this time. But it was enough to shake up Sean Roche, a father and one of the people evacuated (his kids weren’t there at the time). Initially, he’d called the incident “terrorism” on Twitter.“This is a direct consequence of threats that JCCs all over the country have received,” Roche told HuffPost. “There’s a heightened awareness and sensitivity.” Although there have been no bombs yet, every threat is taken seriously by local authorities and the JCC Association. The calls themselves can be terrifying and have often involved a disguised voice that sounds robotic.The Jewish Telegraphic Agency obtained audio from one call made to an unidentified JCC. The voice said, “In a short time, a large number of Jews are going to be slaughtered. Their heads are going to be blown off from the shrapnel.”Anti-Semitic hate crimes make up the largest portion of religiously motivated attacks in the United States. Bomb threats are all too easy for the perpetrators and harmful to communities all over the country.“We want the threats to stop so we can continue working for our community,” Sax said. “We hope to find someone responsible. We realize that with today’s technology it could be difficult to find them, but we can’t have this hanging over our heads.”"
22,CRIME,"GoFundMe Raises Over $160,000 For Family Of Man Killed In Apparent Hate Crime",Antonia Blumberg,https://www.huffingtonpost.com/entry/gofundme-raises-over-160k-for-family-of-man-killed-in-apparent-hate-crime_us_58af7bf3e4b060480e066071,"The victim ""was a brilliant, budding engineer who had a bright future ahead of him.""",2017-02-24,"The GoFundMe campaign for Srinivas Kuchibhotla's family had raised over $160,000 as of Thursday evening.",https://img.huffingtonpost.com/asset/58af89ac280000d59899adda.jpeg?cache=qbuZDdTKTC&ops=scalefit_720_noupscale,"A GoFundMe campaign is raising money to help the family of an Indian-American engineer killed Wednesday evening by a man who reportedly yelled “Get out of my country!” before opening fire.Srinivas Kuchibhotla, a 32-year-old aviation engineer originally from Hyderabad, India, was shot at an Olathe, Kansas bar Wednesday. Two other people ― including Kuchibhotla’s co-worker at technology company Garmin, Alok Madasani, 32, and Ian Grillot, a 24-year-old bystander ― were injured in the shooting.An Olathe man, Adam Purinton, 51, has been charged in the shooting. He reportedly fled the scene and later told an employee at a bar in Clinton, Missouri, that he had killed two Middle Eastern men, according to the Kansas City Star.Kavipriya Muthuramalingam, a friend of Kuchibhotla’s, set up the GoFundMe campaign Thursday to raise money for his family.“Srinu was a kindhearted, gentle, very compassionate human being. He was a brilliant, budding engineer who had a bright future ahead of him,” Muthuramalingam told The Huffington Post. “Everywhere Srinu went, he only left a positive impression with his gentle and decent behavior. We are heartbroken, and things will never be the same. His wife and family are facing incredible grief.”The campaign exceeded its fundraising goal of $150,000 in a matter of hours. The funds will go toward helping Kuchibhotla’s family pay for funeral costs and other recovery expenses, according to the GoFundMe page.“This includes the very expensive process of carrying his mortal remains back to India, so his parents can say goodbye one last time to their beloved son,” the page says.Crowd-funding pages were also set up Thursday to help cover medical expenses for Madasani and Grillot. Police arrested Purinton early Thursday morning at an Applebee’s about 80 miles from the Olathe bar. He was charged with premeditated murder and two counts of attempted murder, according to local officials. An FBI representative said the agency was investigating whether the shooting violated federal laws that might designate it as a hate crime, the New York Daily News reported."
23,ENTERTAINMENT,Oprah Winfrey Says 'I Wouldn't Have Been A Good Mom For Babies',Ron Dicker,https://www.huffingtonpost.com/entry/oprah-winfrey-says-i-wouldnt-have-been-a-good-mom-for-babies_us_58b0278ae4b0780bac28505f,"She looks after the ""world's children"" now.",2017-02-24,"Oprah Winfrey says she is a ""mother to the world's children.""",https://img.huffingtonpost.com/asset/58b029ab290000f616f2871a.jpeg?ops=scalefit_720_noupscale,"Oprah Winfrey has been a mother of sorts to millions of TV viewers ― but the magnate and activist said having children of her own wouldn’t have been a good idea.“I wouldn’t have been a good mom for babies,” the 63-year-old former talk show host said in an April issue preview of Good Housekeeping U.K., posted Friday. “I don’t have the patience. I have the patience for puppies, but that’s a quick stage!”Winfrey now uses motherly instincts to direct her Leadership Academy boarding school in Johannesburg, South Africa. She has 172 girls enrolled ― 20 of whom attend college in the United States and use her residence as a home away from home.“When people were pressuring me to get married and have children, I knew I was not going to be a person that ever regretted not having them, because I feel like I am a mother to the world’s children,” she told the magazine. “Love knows no boundaries. It doesn’t matter if a child came from your womb or if you found that person at age 2, 10 or 20. If the love is real, the caring is pure and it comes from a good space, it works.”Winfrey, who lost a child just weeks after birth when she was 14, has opened up previously about forgoing parenthood. “If I had kids, my kids would hate me,” she said in a 2013 interview. “They would have ended up on the equivalent of the Oprah show talking about me; because something [in my life] would have had to suffer and it would’ve probably been them.”H/T People"
24,POLITICS,Arizona Republicans Want To Prosecute Protesters The Same Way They Do Terrorists,Ryan Grenoble,https://www.huffingtonpost.com/entry/arizona-bill-protesters-racketeering_us_58af3692e4b060480e05e81d,"Lawmakers say they're targeting ""paid protesters.""",2017-02-24,A protester marches around the Arizona State Capitol's grounds in 2012 after the Supreme Court upheld a key part of Arizona's crackdown on illegal immigrants.,https://img.huffingtonpost.com/asset/58af7324280000db9899ada4.jpeg?cache=wQl599gb7W&ops=scalefit_720_noupscale,"UPDATE: Feb. 28 ― Arizona House Speaker J.D. Mesnard (R) announced Monday that the chamber will not hear a bill that would permit the government to seize protesters’ assets and prosecute them under a racketeering law designed to target organized crime.Mesnard told The Arizona Republic he reached his decision after hundreds of constituents called his office to express their concerns.“At the end of the day, I think the people need to know we are not about limiting people’s rights,” he said. “The sponsor is not about it, the governor is not about it, the government is not about that. The most efficient, expedient way to communicate that is to kill the bill.”Previously:The Republican-led Arizona state Senate passed a bill on Wednesday that would permit the government to seize protesters’ assets and prosecute them under a racketeering law designed to target organized crime.Senate Bill 1142 seeks to limit political demonstrations by expanding the definition of a “riot” to include actions that damage property, and making rioting an offense that can be prosecuted under racketeering statutes. If the measure passes in the GOP-controlled state House and is signed into law, protesting in Arizona would be on par with terrorism.Republican lawmakers say the legislation is intended to limit the influence of paid protesters, a popular conservative conspiracy-theory scapegoat for grassroots demonstrations that have been intensifying since the election of President Donald Trump. There’s no evidence of any paid protest movement.The legislation is written in a way that would allow protesters to be charged ― even if they don’t do anything. As the Arizona Capitol Times reports, racketeering laws permit police to arrest people for planning to commit a crime ― before anything has actually happened. Even those who don’t participate in a demonstration could be charged. The bill’s fact sheet explains that “an overt act is not required” to prove conspiracy. The state could seize assets for restitution. As the Phoenix New Times observed: “Plan a protest, lose your house.”“The purported purpose for this bill isn’t based in reality,” Steve Kilar, the communications director for the Arizona ACLU, told HuffPost in an email. “The bill’s supporters are using the false ‘paid protestors’ argument to connect this bill to what is commonly the purpose of anti-racketeering laws: targeting the financial incentives of criminal enterprises.“But if this bill were to pass, ‘riot’ would join ‘terrorism’ as the only racketeering crimes in Arizona that would not require a financial incentive,” Kilar said.The bill’s implications for free speech apparently are of little concern to state Sen. Sonny Borrelli, the primary sponsor.Borrelli said in comments published by the Phoenix New Times that the First Amendment is “not absolute,” and that his bill would protect “the civil liabilities of the citizens.”It’s true that there are limits on free speech ― yelling fire in a theater, for example. Still, the ACLU isn’t sold on Borrelli’s argument.“There’s no doubt this proposal would chill the public’s right to free speech and assembly because it could allow police and prosecutors to go after the organizers of peaceful protests if a handful of participants engage in unlawful acts,” Kilar said. “Furthermore, the conduct this bill allegedly addresses is prohibited by existing law and there’s no evidence that additional deterrence is necessary to prevent rioting or the incitement of riot.”The bill passed the state Senate on a party-line vote, with all 17 Republicans voting in favor, and all 13 Democrats opposed. "
25,BLACK VOICES,Four Black Trailblazers On How They Are Empowering Communities Of Color,Lilly Workneh,https://www.huffingtonpost.com/entry/four-black-trailblazers-on-how-they-are-empowering-communities-of-color_us_58b03dcfe4b060480e06ffd6,"These influencers work across the areas of business, media, tech and activism.",2017-02-24,Jonathan Jackson shares his insight on how Blavity has achieved success since their launch. ,https://img.huffingtonpost.com/asset/58b08dce2900002200f288ff.jpeg?ops=scalefit_720_noupscale,"Every individual has the power to create change and in honor of Black History Month. BAOLers, a new employee resource group for black employees at AOL, hosted an event in New York Wednesday to recognize four black trailblazers who have made this their full-time mission. The event, which was held at the AOL/The Huffington Post office in New York City, was titled “Black Trailblazers on Building Power, Legacy and Community.” (AOL is the parent company for HuffPost.) It included a discussion led by HuffPost’s new editor-in-chief Lydia Polgreen, former Global Director at The New York Times, and highlighted four individuals who work across the areas of business, media, activism and tech who discussed how they are empowering communities of color through their work. The panelists were: Tani Brown, head of partnerships at Jopwell, a company that connects the best and brightest minority candidates with top employment opportunities; Jonathan Jackson, co-founder and head of corporate brand at Blavity, a successful digital platform that caters to black millennials; Janel Martinez, co-founder of 2020Shift, a career development and skills-based learning startup focused on diversifying tech; and Ifeoma Ike, a strategist and co-founder of Black and Brown People Vote, a nonpartisan civic engagement project that prioritizes underrepresented voices in the current political climate.Each panelist spoke about how their respective platforms are amplifying the black experience and helping people of color land opportunities in areas where they have been largely overlooked. The event was also livestreamed on HuffPost Black Voices’ Facebook page.Brown said one way Jopwell is by sustaining the important mission the founders of the business had when they launched it in the summer of 2014. The company was launched by two black men, Porter Braswell and Ryan Williams, who wanted to empower underrepresented ethnic minority professionals and students to successfully navigate their careers.”We serve over 50,000 members in our community,” said Brown, who oversees Jopwell’s exclusive partner relationships with over 50 leading companies. “My job is to run the client services team and to make sure that we are doing right by our partner companies and understanding their recruiting process so we can help them diversity their talent pools.”Jackson’s responsibility at Blavity is slightly different but just as important. As one of the co-founders of the brand, Jackson said he understands the need to provide a digital platform that caters specifically to black millennials and builds a strong sense of community. Since the site’s launch in 2015, Blavity, which publishes content that covers a wide-range of topics, has seen tremendous success in the digital space.  “You can create the environment that you want and actually tell the stories that matter to you,” Jackson said, adding that it feels meaningful to him to “own a platform where you have the freedom and authority to manage the platform in ways [you] think best without having to answer to or be handcuffed by anyone.”  Martinez shares this same sense of freedom in her role at 2020Shift. As one of the co-founders, Martinez works to help diversify the tech industry by providing people of color with the lessons and skills they need to thrive. Martinez, who is afro-latina, has always been committed to the tech space. She wants to broaden people’s knowledge of how vast the industry is and help people of color land and keep positions within it. “We focus primarily on teaching our demographic the skills needed [so that] once they get in the door, they can actually do the work,” she said.As for Ike, her main focus as a strategist and activist is centered around uplifting the black community by getting them better engaged with the political process both through and beyond voting. This is why she helped to launch Black and Brown People Vote, a nonpartisan civic engagement project that prioritizes underrepresented voices in the current political climate. Ike is also a founding #SheWoke Committee member, Lehman College professor and co-laborer of two Congressional Caucuses: My Brother’s Keeper Caucus and the Congressional Caucus on Black Women and Girls. Ike, who has worked relentlessly to educate, empower and uplift black communities, says advocacy work like this is so important, especially now in the age of Donald Trump as President. However, she says she’s looking forward to what lies ahead because she has witnessed new levels of activism and intersectionality and encourages Americans to keep it up. “I’m really excited,”she said, “because I’m seeing the most creative forms of activism and collaboration and conversations between the intersection of so many different communities than we’ve ever seen before.”"
26,COMEDY,Ellen DeGeneres Zings Trump's Mar-A-Lago Security Bungle In Killer Spoof Ad,Mary Papenfuss,https://www.huffingtonpost.com/entry/degeneres-mar-a-lago-ad_us_58af7a8ee4b060480e065ccd,"Enjoy “breathtaking views of classified government documents,” quips the TV spot.",2017-02-24,"Donald Trump and his wife, Melania, with Japanese Prime Minister Shinzo Abe and his wife, Akie, at a dining room of Trump's Mar-a-Lago resort on Feb. 10.",https://img.huffingtonpost.com/asset/58af7f1e290000f616f28644.jpeg?ops=scalefit_720_noupscale,"Sun-kissed sands, fine wines — and access to Donald Trump with a peek at classified documents. That’s what scads of money can buy Mar-a-Lago’s well-heeled guests, according to a slick spoof ad with a sarcastic twist on “The Ellen DeGeneres Show.”Along with “luxurious poolside massages,” the mock TV commercial touts “breathtaking views of classified government documents” at Trump’s Palm Beach 20-acre golf resort, which the president repeatedly refers to as the “Winter White House.”Then, “put on your best dinner attire,” a sultry-voiced woman urges in the ad. “And join our waitstaff in the dining room, where you’ll experience our world-renowned cuisine just a table away from a confidential national security meeting.” The ad flashes a photo of Trump dining with Japanese Prime Minister Shinzo Abe in full view of resort guests earlier this month.DeGeneres’ ad, which also has the nation’s nuclear codes offered alongside imported chocolates on a guest’s pillows, aired Wednesday.It’s a lighter take on a situation that triggered national security concerns. During the visit by Abe, photos of Trump and his guests were snapped by curious club members on their cell phones. Documents were lying on the table in full view and easily photographed. The White House has insisted the two were not talking about classified information on the open-air terrace surrounded by club members and guests. But Trump, Abe and his aides did discuss a response to North Korea’s missile test Feb. 11 as they reviewed papers, and they held a news conference on the missile launch shortly afterward.Security protocol requires that any issues relating to sensitive intelligence be discussed only in rooms designated as “secure compartmentalized information facilities” (SCIFs).“HOLY MOLY !!! It was fascinating to watch the flurry of activity at dinner when the news came that North Korea had launched a missile in the direction of Japan,” Mar-a-Lago club member Richard DeAgazio wrote later on Facebook with photos of the scene.The man apparently toting the “nuclear football” bag holding codes to launch a nuclear attack also posed for a photo with DeAgazio. (All of the posts have since been removed, and DeAgazio’s entire Facebook page has been deleted.)After the photos appeared on social media, President Barack Obama’s former speechwriter Jon Favreau posted contrasting photos of how the two presidents dealt with security matters, showing Obama and his staff in a secure location, and Trump smiling blithely at a dinner table surrounded by milling aides.Democrats have insisted on a full rundown of security procedures at Mar-a-Lago, including details on all members and guests who have access to the president, who can overhear conversations during a potential crisis and who may even have access to classified information.“If it is just a high price of admission and anybody can come in, it’s important for us to know who those people are,” Rep. Katherine Clark (D-Mass.) told The Huffington Post. “They have unusual proximity to our president and apparently under this president are going to have close proximity to high security information and potentially classified information.”The membership fee to join Mar-a-Lago is $200,000, which was doubled from $100,000 after Trump was elected president. Trump still owns the resort.House Oversight Committee Chairman Jason Chaffetz (R-Utah) and ranking member Elijah Cummings (D-Md.) also sent a letter to White House Chief of Staff Reince Priebus asking for details on security at Mar-a-Lago and the vetting of members, guests and workers.“There’s no excuse for letting an international crisis play out in front of a bunch of country club members like dinner theater,” tweeted House Democratic Leader Nancy Pelosi of California. Sen. John McCain (R-Ariz.) scoffed, “You can’t make this stuff up.”It was all fodder for DeGeneres’ spoof Mar-a-Lago ad. Her version of a commercial for Trump’s resort ends: “Mar-a-Lago, where luxury meets top-secret government information.”"
