,category,headline,authors,link,short descr,date,image_caption(s),image_link(s),article
0,POLITICS,Comey Memo: Trump Floated Idea Of Jailing Journalists To Make Them 'Talk',Nick Visser,https://www.huffingtonpost.com/entry/trump-jail-journalists-james-comey-memos_us_5ad96befe4b029ebe0229019,The president wanted to stop leaks pouring from the White House.,2018-04-20,President Donald Trump speaks to reporters at the Pentagon accompanied by Defense Secretary Jim Mattis and Vice President Mike Pence in January.,https://img.huffingtonpost.com/asset/5ad96d361f0000270616da31.jpeg?ops=scalefit_720_noupscale,"President Donald Trump floated the idea of jailing journalists to stop leaks from the White House, former FBI Director James Comey wrote in a memo last year in which he recalled an encounter with the president. The document was published by various news outlets on Thursday just hours after the Department of Justice released copies to congressional leaders.“The president then wrapped up our conversation by returning to the issue of finding leakers,” Comey wrote in the document, dated Feb. 14, 2017. “I said something about the value of putting a head on a pike as a message. He replied by saying it may involve putting reporters in jail.”″‘They spend a couple days in jail, make a new friend, and they are ready to talk,’” Comey recounted the president saying. “I laughed as I walked to the door Reince Priebus had opened.”The New York Times first reported the encounter last May.The Justice Department sent the memo copies to top lawmakers after some threatened to subpoena the agency to obtain them. Assistant Attorney General Stephen Boyd said the Justice Department decided to do so after determining their release “would not adversely impact any ongoing investigation.”They were quickly leaked to various media outlets who published the redacted versions in full. They contained little information that hadn’t been made public during congressional testimony or in Comey’s new memoir, but they touched on a variety of topics reported since Comey’s firing last May.Trump has long fought against the press, branding national media outlets like CNN, The New York Times and The Washington Post as “fake news”Late Thursday, Trump tweeted that Comey’s memos proved there was “NO COLLUSION and NO OBSTRUCTION” regarding the ongoing investigation into Russian interference in the presidential election.“Also, he leaked classified information. WOW!” Trump wrote. “Will the Witch Hunt continue?”Read the full memos here."
1,ENTERTAINMENT,Natalie Portman Backs Out Of Israel Award Over 'Recent Events',Ron Dicker,https://www.huffingtonpost.com/entry/natalie-portman-genesis-prize_us_5ad9ad4ae4b029ebe022eace,"""She cannot in good conscience move forward with the ceremony.""",2018-04-20,"Natalie Portman is distressed over recent events in Israel, a rep said.",https://img.huffingtonpost.com/asset/5ad9ad921e0000fb077b2065.jpeg?ops=scalefit_720_noupscale,"Actress Natalie Portman has pulled out of accepting a prestigious award in Israel because she said her conscience prevented her from doing so, the Genesis Prize Foundation said.The Jerusalem-born “Black Swan” actress was scheduled to accept the Genesis Prize, a so-called Jewish Nobel, in June, but the Genesis Prize Foundation said in a news release on Thursday that a rep for Portman explained the Oscar winner would not attend because of “recent events in Israel.”The foundation quoted Portman’s rep as saying that “recent events in Israel have been extremely distressing” to the actress, and that “she cannot in good conscience move forward with the ceremony.”Portman later posted her own statement:The prize was established in 2013 to honor those who inspire Jewish values. Former New York Mayor Michael Bloomberg, actor Michael Douglas and violinist Itzhak Perlman are among its winners.The foundation said it respected Portman’s right to disagree with the policies of the Israeli government, but was saddened that political reasons would prevent her participation.“We fear that Ms. Portman’s decision will cause our philanthropic initiative to be politicized, something we have worked hard for the past five years to avoid,” the foundation said.Portman’s announcement follows Israel’s response to demonstrations along the Gaza border this month, killing dozens of Palestinians. Portman, who said she was proud of her Israeli roots and Jewish heritage after hearing in November that she would receive the prize, has been critical of Netanyahu.This article has been updated to include Portman’s statement."
2,SPORTS,Lance Armstrong Settles $100 Million Federal Fraud Case For $5 Million,"Bernie Woodall, Reuters",https://www.huffingtonpost.com/entry/lance-armstrong-fraud-case-settlement_us_5ad97c79e4b029ebe02297f0,"The former cycling champion was accused of defrauding his sponsor, the U.S. Postal Service, by using performance-enhancing drugs.",2018-04-20,"In his statement, Lance Armstrong’s attorney Elliot Peters said, “Lance is delighted to put this behind him.”",https://img.huffingtonpost.com/asset/5ad97d1b2000002d00eb52ff.jpeg?cache=9fy7x8RdhO&ops=scalefit_720_noupscale,"(Reuters) - Former cycling champion Lance Armstrong on Thursday agreed to pay $5 million to settle a federal suit claiming he defrauded his sponsor, the U.S. Postal Service, by using performance-enhancing drugs, his attorney and federal officials said.The settlement ends the long-running false claims suit brought by fellow cyclist Floyd Landis and joined by the U.S. government, which had sought $100 million in damages on behalf of the Post Office, according to statements from Armstrong’s attorney, Elliot Peters, and the U.S. Department of Justice.“No one is above the law,” Acting Assistant Attorney General for the Justice Department’s Civil Division Chad Readler said in a statement. “This settlement demonstrates that those who cheat the government will be held accountable.”By phone, Peters told Reuters that he thinks the Postal Service realized it could not prove damages to it caused by Armstrong’s behavior. He said the settlement was reached ahead of a scheduled May 7 trial date.Armstrong, who is now 46 and lives in Austin, Texas, won the biggest race in professional cycling, the Tour de France, a record seven times, six of them while riding for the Postal Service team.He was stripped of his titles and banned for life from the sport in 2012 by the U.S. Anti-Doping Agency after it accused him in a report of engineering one of the most sophisticated doping schemes in sports. Armstrong admitted to the cheating in a January 2013 televised interview with Oprah Winfrey.This is the last legal matter related to Armstrong’s doping, Peters said.“I’m looking forward to devoting myself to the many great things in my life ― my five kids, my wife, my podcast, several exciting writing and film projects, my work as a cancer survivor, and my passion for sports and competition,” Armstrong said in a statement provided by Peters.The settlement also calls for Armstrong to pay $1.65 million for the court costs of his former teammate Landis, who also used performance-enhancing drugs and who was stripped of his 2006 Tour de France championship.Landis originally brought the lawsuit in 2010 under a federal law, the False Claims Act, that lets whistle-blowers pursue fraud cases on behalf of the government, and obtain rewards if successful. Landis will receive $1.1 million as his share of the settlement.The Justice Department joined the case in February 2013 after Amstrong’s public confession."
3,ENTERTAINMENT,Michelle Williams Gives The Kookiest Performance Of Her Career In 'I Feel Pretty',Matthew Jacobs,https://www.huffingtonpost.com/entry/michelle-williams-i-feel-pretty_us_5ad64e9ce4b0edca2cbeb5f7,"How a baby-doll voice, NPR, a puppy dress and Ivanka Trump's hair led to this tour de force.",2018-04-20,"Michelle Williams, seen here wearing Gucci, is the MVP of ""I Feel Pretty.""",https://img.huffingtonpost.com/asset/5ad8af452000007d06eb523c.jpeg?cache=2cQQu2iWVs&ops=scalefit_720_noupscale,"At one point in “I Feel Pretty,” after the newly emboldened protagonist, Renee Bennett (Amy Schumer), has landed her dream job as a receptionist at a haughty cosmetics company, she is in the cafeteria when the couture-clad CEO, Avery LeClair (Michelle Williams), spots her. Bosses at bustling beauty enterprises are, the average story goes, bloodthirsty. Avery, on other hand, is thirsty for an understanding of how normal people ― ones whose grandmothers aren’t the namesake of an imperious brand ― live their lives.Naturally, that’s something of a struggle for someone whose privilege butts up against her eccentricities. “I thought I smelled animal products,” she meows upon seeing Renee. If an actor is fortunate, at some point she’ll give a performance so unlike anything we’ve ever seen her do that it’s downright startling. This week, Michelle Williams is that actor. Even though Williams’ first lead in a movie was playing an airheaded teenager who inadvertently exposes Richard Nixon’s Watergate break-in in the 1999 satire “Dick,” she’s since matured into a so-called serious actress with indie clout and four Oscar nominations to her name ― a fact that makes her bonkers work in “I Feel Pretty” all the more delicious. It’s the type of role that’s only memorable coming from an established performer, especially one known for dramatic heft like “Brokeback Mountain,” “Blue Valentine” and “Manchester by the Sea.” Maybe your jaw will drop as low as mine did upon first hearing Williams speak in “I Feel Pretty,” which opens this weekend. Instead of the velvety innocence that usually accents her on-screen persona, Williams speaks with what co-directors Abby Kohn and Marc Silverstein call “high-pitched vocal fry.” It’s an odd confluence of Valley Girl lilt, enunciated baby-speak and spacey stonerisms, further underscored because the character actually fits none of those attributes. Avery, we learn, has an MBA from Wharton and clerked for a Supreme Court justice before taking a leadership post at Lily LeClair. Coupled with the bamboozled but relentlessly relaxed aura Williams brings to the film, Avery’s flat cadence skirts the dragon-lady stereotype that defines the high-powered fashionistas portrayed by Meryl Streep in “The Devil Wears Prada” and Tilda Swinton in “Trainwreck.” She carries herself with the weight of a feather, gliding along as if oblivious to her surroundings at all times.Kohn and SIlverstein, longtime creative partners who also penned “Never Been Kissed” and “He’s Just Not That Into You,” had written Avery’s intonation into their script, but they had no idea what Williams would do with it until a couple of weeks before she arrived on set. Williams sent Kohn and Silverstein an NPR story from 2015 about a woman incapable of feeling fear. The woman’s speech, which sounds almost identical to the voice Jenny Slate created for the adorable stop-motion creation Marcel the Shell, was Williams’ inspiration, though the results were still a work in progress when she tested it for Kohn and Silverstein over the phone. They didn’t hear the final version until they went to Williams’ trailer on her first day shooting the movie. “Truthfully, the thing she did for us on the day in the trailer was not like anything we’d talked about before,” Silverstein said. “It was so much better.”“We were like, ‘Can you sustain it? How is it to do a voice like that?’” Kohn recalled. “She was like, ’Yes, I got it. I can do it. It’s part of the whole thing.’”Avery’s wardrobe completes the “whole thing.” Costume designer Debra McGuire, who was attracted to “I Feel Pretty” because its empowerment message works in opposition to the “tight, sexy” clothing she felt obligated to use while working on “Friends” in the ’90s, based Avery’s grandmother (Lauren Hutton) on a cosmetics guru she once knew who dressed head to toe in Chanel. With that in mind, McGuire wanted Avery to put a “fun” twist on high-end fashion, bringing a California ease to the office’s cutthroat New York setting.Furthermore, Avery and the self-effacing Renee needed to work as complements, not foils à la Streep and Anne Hathaway in “The Devil Wears Prada.” When Renee falls off a SoulCycle bike and knocks her head, her feelings of unworthiness vanish. Convinced she is suddenly thinner and more conventionally beautiful ― “Modeling is an option for me,” she later tells Avery and her colleague (Naomi Campbell) ― Renee encounters a series of contrivances that ultimately lead her to realize she got the job (and a boyfriend) without actually shapeshifting or altering her appearance. Normally, McGuire would have designed Avery’s attire from scratch. But she didn’t have access to Williams during pre-production, as the actress was filming another movie in Europe (presumably “All the Money in the World,” which Williams shot in Rome immediately before “Pretty”). Instead, McGuire scouted Tom Ford, Dolce & Gabbana and Gucci boutiques. Knowing that Kohn and Silverstein didn’t want Williams to wear the same sort of regalia she dons in real life, McGuire sought an “au current” metropolitan sensibility accentuated by straight, flowing blond locks. “There was an Ivanka Trump vibe going on there,” she said half-jokingly. That dichotomy ― corporate gloss meets puerile squeal ― is best evidenced in a baby-blue dress Avery wears with pink flowers and golden retrievers all over. A Dolce & Gabanna original that McGuire said was inspired by the designers’ own dogs, the blithe garment reflects Avery’s lifelong struggle to cultivate a personality despite the fact that no one takes her seriously. The movie’s producers first balked at the canine frock, thinking it might be too distracting, but McGuire, who had the directors’ support, wasn’t budging. “That dress was going to be on camera even if I had to stomp over anybody who didn’t want it,” she said. “I felt this was just a perfect place to show part of who this character is because there’s a snobby vibe to the Lily LeClair aesthetic. To come to work in a puppy dress, you’ve gotta be some kind of woman to do that.”Avery’s accouterments and wispiness mask a crippling insecurity. “I sound like a freaking moron,” she moans in an uncharacteristically candid moment, listing the line items on her astoundingly intellectual biography to prove how belittled she is because of her voice. In the same way that Schumer learns to value her body by the movie’s end, Avery is meant to better understand her place in the class-conscious, image-obsessed world. She is the face of Lily LeClair, but it’s her inability to muster the confidence needed to excel that encourages her to extend the brand to reach more than just snobby rich women. That arc is baked into Williams’ oddities. “On the first day, she did this one thing where she, like, leaned on her hands together like she was posing for a picture while she was talking,” Silverstein said. “Avery has seen human behavior and tries to emulate it in ways that are not right: ‘Oh, this is what a person would do right now. They would lean on this table as they talk.’ [Williams] really got into that. This is the story of a person of privilege, yet someone who’s grown up with a lot of obstacles in her way and maybe without a lot of personal connections and without a lot of real human interaction. It’s just a really fun thing to watch her do this and find the line.”"
4,POLITICS,Exclusive: 'Everyday Guy' Describes How He Brought Down An American Terrorist Cell,Ryan J. Reilly,https://www.huffingtonpost.com/entry/right-wing-terrorism-dan-day-fbi-informant_us_5ad80fa7e4b03c426dab314c,"Dan Day -- a gun-toting Kansan -- felt a ""calling from God"" to work with the FBI to prevent militiamen's attack on Muslim refugees.",2018-04-20,"Without Dan Day, there would have been no case against the men who plotted to bomb Somali Muslim immigrants in Kansas.",https://img.huffingtonpost.com/asset/5ad8ef751f0000270616d9ee.jpeg?cache=XEsvq1b4A2&ops=crop_7_92_1093_1059%2Cscalefit_720_noupscale,"WICHITA, Kan. ― Three anti-Muslim domestic terrorists who plotted to blow up a Garden City apartment complex where many Somali Muslim immigrants lived were convicted on Wednesday on federal charges that could send them to prison for life. Five weeks into the trial, jurors deliberated for less than a full day before finding Kansas militiamen Patrick Stein, Curtis Allen and Gavin Wright guilty on all charges. But it wasn’t just the trio on trial. So too was Dan Day, the FBI informant whose hours of recordings ― which featured vile discussions of planned violence against Muslims, who the men called “cockroaches” ― were the centerpiece of the federal government’s case against a group that dubbed themselves “The Crusaders.”Day’s testimony was at the center of the trial. Federal prosecutors would not have had a case without him. Defense attorneys said the plot would never have moved forward were it not for Day pushing the group to action. The two sides offered up competing portraits of the 49-year-old Day in court. The government portrayed him as an “everyday guy,” a patriot and a hero who risked his life and stepped up to prevent a looming attack that would have killed countless men, women and children because of their faith, race and national origin. Defense attorneys said Day was an unemployed wannabe who jumped at the chance to become an undercover FBI informant and was willing to do whatever the federal government needed for a check. In an exclusive interview with HuffPost, Day said it’s a relief to put this experience behind him. “It’s just so hard to believe this actually happened,” he said. He’s glad “justice was served” in the case, and thinks divine intervention led to his involvement, he added.“I felt like it was a calling from God, honestly,” Day said of taking the risk of becoming an informant. “I’m not an over-religious person, but I believe in God and I believe he put me there at the right time, the right place, if that makes any sense.”The father of two high school-age children and the youngest of 14 kids, Day grew up in Garden City, Kansas, home to the apartment complex the defendants ultimately targeted. Up until a few years ago, he worked as a probation officer and in juvenile detention before that.His path to becoming an informant for the FBI is completely unique.It began in July of 2015 with a trip to the local library with his son. He saw what he considered an anti-Israel poster, which featured a Palestinian flag and described the situation in Israel as apartheid. He tore it down.“They have the right to put that up, and I have the right to take that down, in my opinion, so I did,” Day said of the incident.Then he passed along a photo of the poster to a friend who eventually posted about it on Facebook. The post went viral.Day was soon invited to a cookout attended by a number of members of a militia group in Kansas. Somewhere along the line the story got mixed up, and people in the militia believed that Day had found an ISIS recruiting poster. That wasn’t the case at all. But the FBI, which was looking into rumors of the ISIS poster, interviewed Day and ended up being interested in him because of his connection to the militia. It wasn’t long before Day was working on the bureau’s behalf, giving the federal government an inside look at the larger militia group. Then Day met the defendants. The difference between them and the larger group, federal prosecutors said, was that the defendants weren’t just talking ― they were ready to take action.Kansas-based Assistant U.S. Attorney Tony Mattivi, who prosecuted the case alongside two prosecutors from the Justice Department’s Civil Rights Division, told jurors that Day was an “average guy” who stepped up at the right moment to stop men who wanted to “blow up a bomb, flatten the building and murder every single man, woman and child inside.”Day could have walked away, like the other members of the larger militia group who knew a plan was in motion but did nothing to stop it, Mattivi said. “That guy’s a patriot. He’s a hero,” he added.Defense attorneys saw it differently. They accused the federal government of overreaching and said the case wouldn’t have gone anywhere if it hadn’t been for Day’s involvement. They frequently mentioned that Day was working for the FBI before he ever came into contact with the defendants.“The FBI owns Dan Day and they own the words that he said,” argued Melody Brannon, the top federal public defender in Kansas who was representing Allen.Day said the defense’s attacks on him were unfair and only happened because defense attorneys couldn’t dispute what the defendants said in the tapes he recorded. “They had to attack me, and they had to attack the FBI,” he said. “I put my whole life out there so they could knock me down.’”But Day said he was also uncomfortable with the prosecution’s glowing depiction of his role. “I’m no hero, man, believe me,” he said. “I’m not a perfect person, but I’m truthful.”Working in remote areas of Kansas, there was no backup team standing by when Day attended meetings with the militiamen. He had a phone that was constantly recording in the background that even he couldn’t turn off. It was scary at times, Day said. He noted he was armed, and “would’ve did what [he] had to do” if he was discovered.Being undercover, observing and participating as the men spewed Islamophobic rhetoric, Day said the defense attorneys and the media overplayed the influence that President Donald Trump’s anti-Muslim remarks had on the defendants. He called it a “Trump card” used as an excuse for the militia’s behavior.“These guys had a hate in their heart towards all Muslims, long before Trump came along in the picture,” said Day, who described himself as “anti-Hillary” and said he would have voted for Trump had he not been preoccupied with the case right before the 2016 election. Still, Day said he would have liked Trump to have toned down some of his more extreme rhetoric about Muslims.“Trump should not have ever said those things. I don’t agree with him saying that, you know?” he said. “Regular Muslims, if they come over and they’re vetted, that’s our country, man. That’s a free country. That’s how my grandparents got here.”Day, like a lot of Americans, said he personally hasn’t had much interaction with Muslims. He said he had concerns about radical Islam, but said he “never had a bad view” of Muslims as a whole.It’s rare for the federal government to deploy informants and undercover officers in terrorism stings against non-Muslim defendants. The Intercept’s Trial and Terror project identified 310 terrorism sting operations that involved international terrorism, meaning groups like the self-described Islamic State.Most of the high-profile cases typically involved young Muslim men who became the focus of FBI investigations because of what they’d written online. Those cases primarily resulted in material support charges unavailable in cases against domestic extremists. Day said he doesn’t know what’s next for him. As defense attorneys noted, he’ll probably get a conviction bonus from the FBI for his work on the case, in addition to the more than $30,000 he has already received. He would’ve made more money working a regular job, he said, and he’ll start looking for one soon. He said he found some of the defense’s comments in closing arguments to be laughable. Stein was compared to a “child playing at war” who had a “willingness to believe the fantastical” and an “inflated sense of self.” Wright was portrayed as someone who just wanted to fit in and thought Day was his friend. Day said it was particularly ridiculous that Wright’s attorney brought up the defendant’s parents’ divorce more than 35 years ago, when Wright was 14.“Come on, man,” Day said. “Give him a puppy, I don’t know.”Day added that he doesn’t want to sound like he’s overly happy about what happened to the defendants and that he’s particularly conscious of the effect their convictions will have on their families. But he doesn’t have much sympathy for the defendants themselves, who he said had plenty of opportunities to back away from the plot.“I’d tell them fuck off,” Day said. “They made their choices.”Ryan Reilly is HuffPost’s senior justice reporter, covering the Justice Department, federal law enforcement, criminal justice and legal affairs. Have a tip? Reach him at ryan.reilly@huffpost.com or on Signal at 202-527-9261."
