,category,headline,authors,link,short descr,date,image_caption(s),image_link(s),article
46,POLITICS,Trump: 'Human Trafficking Is Worse Than It's Ever Been In The History Of The World',Antonia Blumberg,https://www.huffingtonpost.com/entry/trump-human-trafficking-build-wall_us_5ad8d447e4b029ebe02217a8,The president is using the specter of human trafficking to push his U.S.-Mexico border wall.,2018-04-19,U.S. President Donald Trump discussed sanctuary cities in California before bringing up the topic of human trafficking on Thursday.,https://img.huffingtonpost.com/asset/5ad8d5831f00002d0016d9c1.jpeg?cache=OHfxw59t4y&ops=scalefit_720_noupscale,"In comments advocating a wall along the U.S.-Mexico border on Thursday, President Donald Trump said, “Human trafficking is worse than it’s ever been in the history of the world.”“Drugs are flowing into our country,” he told reporters while visiting the Joint Interagency Task Force South in Key West, Florida. “We need border protection. We need the wall. We have to have the wall. The Democrats don’t want to approve the wall because they think it’s good politically, but it’s not.”He continued: “If you look at what’s happening in California with sanctuary cities — people are really going the opposite way. They don’t want sanctuary cities. There’s a little bit of a revolution going on in California. Human trafficking is worse than it’s ever been in the history of the world.”Though Trump did not clarify what metric he was using or whether he had accounted for world population growth, human trafficking is a critical issue today. According to the International Labor Organization, there are an estimated 24.9 million people around the world who are trapped in forced labor. Of those, 16 million are exploited for labor in the private sector, 4.8 million are sexually exploited, and 4.1 million forced into state-imposed labor.Most victims of forced labor or sexual exploitation are in the Asia and Pacific regions. More relevant to Trump’s border wall, though, is human trafficking in the Americas, which accounts for roughly 1 percent of forced labor and 4 percent of sexual exploitation in the world, according to the ILO.But the president’s conflation of immigration with human trafficking serves an agenda. He has warned of “caravans” threatening to shuttle waves of dangerous immigrants across the U.S.-Mexico border ― a fear-mongering tactic that echoes racist and derogatory comments he made on the campaign trail and in the first year of his presidency.His comment also did not appear to address one of the most glaring historical examples of human trafficking: the centuries-long trans-Atlantic slave trade, during which over 10 million people were forcibly shipped from parts of Africa to North America, the Caribbean, and Central and South America.The president has previously emphasized his commitment to fighting human trafficking, including in comments he made to law enforcement officials in Long Island, New York, last year.“Human traffickers. This is a term that’s been going on from the beginning of time, and they say it’s worse now than it ever was,” he said, according to CNN. “You go back 1,000 years, where you think of human trafficking, you go back 500 years, 200 years, 100 years, human trafficking, they say ― think of it, what they do ― human trafficking is worse now, maybe, than it’s ever been in the history of this world.”Under the Trump administration, there were over 8,500 U.S. cases of human trafficking reported in 2017 ― an increase of almost 1,000 reported incidents from the previous year, according to the National Human Trafficking Hotline.CORRECTION: A previous version of this story misstated a statistic from the ILO about forced labor. The organization estimates 24.9 million people are trapped in forced labor, but more are trapped in “modern-day slavery.”"
47,SPORTS,McKayla Maroney Says Larry Nassar Abused Her Hundreds Of Times,Alanna Vagianos,https://www.huffingtonpost.com/entry/mckayla-maroney-says-larry-nassar-abused-her-hundreds-of-times_us_5ad8935de4b0e4d0715dde94,The Olympic gymnast said the now-imprisoned former USA Gymnastics team doctor groomed her with food.,2018-04-19,"McKayla Maroney attends the New York Society for the Prevention of Cruelty to Children's 2018 Luncheon on April 17, in New York city.",https://img.huffingtonpost.com/asset/5ad8954a1e0000741b7b1f38.jpeg?cache=3Po0J0ZXx9&ops=crop_14_130_3586_2005%2Cscalefit_720_noupscale,"The first time USA Gymnastics team doctor Larry Nassar examined Olympic gymnast McKayla Maroney, she said, he sexually abused her. Maroney, in her first interview since she went public with allegations against Nassar in October, said he abused her “every time” she saw him after that initial experience ― “hundreds” of times.“He said that nobody would understand this and the sacrifice that it takes to get to the Olympics so ‘You can’t tell people this,’” Maroney told NBC “Today” co-host Savannah Guthrie for a “Dateline” report set to air on Sunday. “He didn’t say it in a way that was like mean or anything like that. I actually was like, ‘That makes sense, I don’t want to tell anybody about this.’ I didn’t believe that they would understand.”Nassar, who also was Michigan State University team doctor, has been accused of sexually abusing over 260 young athletes under the guise of medical treatment. He’s now serving three concurrent prison sentences of up to 175 years for sexual assault and child pornography.Maroney told Guthrie that Nassar groomed her by bringing her food ― a show of affection in a sport that consistently starves its athletes. “I would’ve starved at the Olympics if I didn’t have him bring me food,” Maroney said, adding that Nassar bought her a loaf of bread. “Your coaches are just always watching you and wanting to keep you skinny. There’s just other things about the culture that are also messed up that he used against us.”Maroney signed a confidentiality settlement with USA Gymnastics in December 2016 barring her from sharing her story. The organization said in January it wouldn’t seek to punish Maroney if she chose to break the agreement. During a luncheon on Tuesday for the New York Society for the Prevention of Cruelty to Children in New York City, Maroney said it seemed as though all USA Gymnastics “cared about is money and medals.” “I wasn’t listened to, cared about or believed, and all of those things need to be weeded out of society because that’s where things went wrong,” she said at the event. Neither Michigan State University nor USA Gymnastics immediately responded to HuffPost’s requests for comment on Maroney’s remarks. Other Nassar survivors, including Maroney’s Olympic teammate Jordyn Wieber, and Olympic athletes from other sports, testified before a U.S. Senate committee on Wednesday, encouraging lawmakers to help combat sexual abuse in amateur sports. The same day, seven women filed lawsuits against MSU, USA Gymnastics and the U.S. Olympic Committee, alleging Nassar abused them. "
48,BLACK VOICES,This California Church Is Hosting A Beyoncé Mass,Carol Kuruvilla,https://www.huffingtonpost.com/entry/this-california-church-is-hosting-a-beyonce-mass_us_5ad8c8f1e4b03c426dac52d1,San Francisco's Grace Cathedral is using Beyoncé's music to highlight black female spirituality.,2018-04-19,The Beyoncé Mass at Grace Cathedral in San Francisco will include songs from the pop icon and Scripture read by women of color.,https://img.huffingtonpost.com/asset/5ada329c1a00002700533a9d.jpeg?ops=scalefit_720_noupscale,"A California church is getting ready to stand in the light of Queen B’s halo.San Francisco’s Grace Cathedral is planning to host a Beyoncé Mass on April 25, using the pop icon’s music to celebrate black female spirituality.The Wednesday evening service is part of The Vine, a weekly contemporary gathering organized by Grace for San Francisco’s “urbanites and spiritual seekers.” The Beyoncé Mass promises to help attendees discover how the musician’s art “opens a window into the lives of the marginalized and forgotten ― particularly black females.”The Rev. Jude Harmon, founding pastor of The Vine, pointed to how Jesus used ordinary stories to preach the gospel ― parables about vineyards, day laborers, stewards, and other figures that would have been familiar to his audience. He said the upcoming Mass uses a familiar part of modern culture ― Beyoncé lyrics ― in the same way.“Conservative Christians see a high wall separating the Church from the world; Progressive Christians do not,” Harmon told HuffPost in an email. He said the Mass seeks to elevate the experiences of black women. “The sad truth is that dominantly White churches, and even many traditional Black churches, have historically not done a good job of elevating and celebrating Black female voices,” Harmon said. “This isn’t just an oversight; in the language of our Christian faith, it’s a sin, and we’re called to repent.”In recent years, Beyoncé has begun making more explicit references to female spirituality in her music and in her public persona. During her Grammy performance last year, she incorporated imagery from African, Hindu and Roman goddesses. In July, Beyoncé ignited Instagram with a portrait of her holding her newborn twins, draped in a veil and flowing robes. The image provoked comparisons to the Virgin Mary, who for centuries has been represented as a white woman in Western art. Beyoncé’s portrait challenged the association of Mary, often seen as the ideal feminine figure, with whiteness. Attendees at Grace Cathedral’s Beyoncé Mass will sing some of the performer’s top songs and hear Scripture read by women of color. The message will be delivered by the Rev. Yolanda Norton, an assistant professor of Old Testament at San Francisco Theological Seminary. Norton teaches a class, “Beyoncé & the Bible,” in which she uses the life, persona and music of Beyoncé as a medium to explore black female sexuality and motherhood, as well as stigmas created around black women. “This is about [Beyoncé’s] life, her music, her agency as a Black woman and what that represents for how Black women walk in the world as spiritual and complicated individuals,” Norton told HuffPost in an email. Norton said her class did a version of this Mass at SFTS during Black History Month, using various aspects of Beyoncé’s music to “center Black women as beings created in the image of God, to name our struggles, and affirm our Christian witness.”She said the expanded version of the service planned at Grace Cathedral will have the same goals ― to talk about God, faith and justice.This article has been updated with comments from the Rev. Jude Harmon."
49,BLACK VOICES,This California Church Is Hosting A Beyoncé Mass,Carol Kuruvilla,https://www.huffingtonpost.com/entry/this-california-church-is-hosting-a-beyonce-mass_us_5ad8c8f1e4b03c426dac52d1,San Francisco's Grace Cathedral is using Beyoncé's music to highlight black female spirituality.,2018-04-19,"Beyoncé performance at the 59th Annual Grammy Awards last year in Los Angeles incorporated imagery from African, Hindu and Roman goddesses.",https://img.huffingtonpost.com/asset/5ad8dec42000007d06eb528d.jpeg?cache=4epVOmLKu9&ops=scalefit_720_noupscale,"A California church is getting ready to stand in the light of Queen B’s halo.San Francisco’s Grace Cathedral is planning to host a Beyoncé Mass on April 25, using the pop icon’s music to celebrate black female spirituality.The Wednesday evening service is part of The Vine, a weekly contemporary gathering organized by Grace for San Francisco’s “urbanites and spiritual seekers.” The Beyoncé Mass promises to help attendees discover how the musician’s art “opens a window into the lives of the marginalized and forgotten ― particularly black females.”The Rev. Jude Harmon, founding pastor of The Vine, pointed to how Jesus used ordinary stories to preach the gospel ― parables about vineyards, day laborers, stewards, and other figures that would have been familiar to his audience. He said the upcoming Mass uses a familiar part of modern culture ― Beyoncé lyrics ― in the same way.“Conservative Christians see a high wall separating the Church from the world; Progressive Christians do not,” Harmon told HuffPost in an email. He said the Mass seeks to elevate the experiences of black women. “The sad truth is that dominantly White churches, and even many traditional Black churches, have historically not done a good job of elevating and celebrating Black female voices,” Harmon said. “This isn’t just an oversight; in the language of our Christian faith, it’s a sin, and we’re called to repent.”In recent years, Beyoncé has begun making more explicit references to female spirituality in her music and in her public persona. During her Grammy performance last year, she incorporated imagery from African, Hindu and Roman goddesses. In July, Beyoncé ignited Instagram with a portrait of her holding her newborn twins, draped in a veil and flowing robes. The image provoked comparisons to the Virgin Mary, who for centuries has been represented as a white woman in Western art. Beyoncé’s portrait challenged the association of Mary, often seen as the ideal feminine figure, with whiteness. Attendees at Grace Cathedral’s Beyoncé Mass will sing some of the performer’s top songs and hear Scripture read by women of color. The message will be delivered by the Rev. Yolanda Norton, an assistant professor of Old Testament at San Francisco Theological Seminary. Norton teaches a class, “Beyoncé & the Bible,” in which she uses the life, persona and music of Beyoncé as a medium to explore black female sexuality and motherhood, as well as stigmas created around black women. “This is about [Beyoncé’s] life, her music, her agency as a Black woman and what that represents for how Black women walk in the world as spiritual and complicated individuals,” Norton told HuffPost in an email. Norton said her class did a version of this Mass at SFTS during Black History Month, using various aspects of Beyoncé’s music to “center Black women as beings created in the image of God, to name our struggles, and affirm our Christian witness.”She said the expanded version of the service planned at Grace Cathedral will have the same goals ― to talk about God, faith and justice.This article has been updated with comments from the Rev. Jude Harmon."
50,WORLD NEWS,South Korean Actress Who Was Kidnapped And Forced To Make North Korean Films Dies At 92,Kimberly Yam,https://www.huffingtonpost.com/entry/choi-eun-hee-dies-at-92_us_5ad64154e4b077c89ced6bdc,"“All of a sudden a guy grabbed me by the arms. Before I knew it, I was onboard. All the blood drained from my head to my toes.”",2018-04-18,"Choi Eun-hee, center, at the Busan International Film Festival.",https://img.huffingtonpost.com/asset/5ad654a61e00008e0b7b1c88.jpeg?cache=92xoV8cK6b&ops=crop_521_334_1867_1074%2Cscalefit_720_noupscale,"Legendary South Korean actress Choi Eun-hee died on Monday during a hospital visit for kidney dialysis, according to Yonhap News Agency. Choi was 92 years old. The actress, who cemented her icon status in a series of roles in the 1960s and ’70s, also gained international attention after it was revealed she’d been kidnapped by North Korea and forced to make movies for the country in 1978.Choi, along with her ex-husband Shin Sang-ok, who’d also been abducted, would spend eight years imprisoned by then-heir apparent of the North Korean leadership, Kim Jong Il. The actress was born in the South Korean town of Gwangju on Nov. 20, 1926. She ran away from home as a teenager and married an abusive husband, according to author Paul Fischer, who wrote a book about the kidnapping. Before becoming an acclaimed actress, Choi had been enlisted by both North and South Korea during the Korean War and had survived rape. She divorced her first husband before meeting Shin. With Shin as the director, Choi was featured in about 130 movies and won several awards for her performances. The pair’s artistic relationship was severed after Choi discovered Shin had a secret second family, leading the couple to divorce in 1976. Two years later, the film star was lured to Hong Kong with a promise of a starring role. However, the meeting took a terrifying turn. “There was a speedboat with three or four strong men,” Choi said in the documentary “The Lovers and the Despot.” “All of a sudden a guy grabbed me by the arms. Before I knew it, I was onboard. All the blood drained from my head to my toes.”Choi’s ex-husband Shin would be captured as well, and he was imprisoned by North Korea for several years. The two were eventually reunited and remarried in 1983. Kim Jong Il, who’d orchestrated the abductions, had been a huge admirer of Western cinema and put pressure on the prolific couple to change his country’s film industry.“Why do all of our films have the same ideological plots?” the late dictator can be heard saying in a tape secretly recorded by Choi, lamenting the North Korean film industry. “There’s nothing new about them. Why are there so many crying scenes? All of our films have crying scenes. This isn’t a funeral, is it?”The actress noted in the documentary that she went on to make North Korea’s first love story. The reunited couple made nearly 20 films for the country, and Choi won best actress at the 1985 Moscow Film Festival during her imprisonment. Kim was pleased with the pair’s work and allowed the two to travel overseas to a number of film festivals. During one such event in Vienna, the pair escaped. The two lived in the U.S. for 10 years following their defection and returned to South Korea for their remaining years. Shin died in 2006, and Choi’s health began declining soon after, Yonhap noted. Though Choi says she “understood [Kim’s] desire to develop the North Korean movie industry, she never forgot the trauma of the kidnapping. “I still have nightmares about being chased by North Korean agents,” she said in 2015, according to Korea Joongang Daily. “It feels like somebody is always chasing me. People who haven’t experienced this will never know the feeling.” While she lived through a tumultuous career, Choi maintained that acting was a profession of immense pride and was meant for a “great person.”“That is because an actor needs to be able to sympathize with the feelings of others in order to act well,” she said, according to Korea Joongang Daily. “I believe a kind heart, looks, speech, skills and the ability to write are the five qualifications of a good actor.” "
51,WORLD NEWS,Raul Castro To Step Down As Cuba's President,Dominique Mosbergen,https://www.huffingtonpost.com/entry/raul-castro-stepping-down-cuba-miguel-diaz-canel_us_5ad685dae4b029ebe01eef65,"Vice President Miguel Diaz-Canel -- who is, significantly, not a Castro -- is expected to succeed him.",2018-04-18,"Cuban President Raúl Castro, left, and Vice President Miguel Diaz-Canel on July 14, 2017.",https://img.huffingtonpost.com/asset/5ad694661f00002d0016d67e.jpeg?ops=scalefit_720_noupscale,"A Castro will no longer be the leader of Cuba ― for the first time in almost 60 years.Raúl Castro is expected to step down as Cuba’s president this week, a role he’s filled since his late brother Fidel’s resignation in 2008. The 86-year-old has been grooming his vice president, 57-year-old Miguel Diaz-Canel, to take his place. Castro has said, however, that he intends to remain as head of the Communist Party.On Wednesday, the Cuban General Assembly nominated Diaz-Canel, an engineer and former education minister, as the sole candidate to succeed Castro as president. The nomination will be voted on later Wednesday and formally announced Thursday, Reuters reports. Diaz-Canel is expected to be approved with almost total unanimity.“To have someone without the family name or the same aura of revolutionary is a historic shift,” Geoff Thale of the Washington Office of Latin America told ABC News of the impending vote.If elected, the new president will inherit a country in the throes of change and mired in financial troubles. Observers have questioned whether Diaz-Canel will be up to the challenge to continue the social and economic reforms initiated during his predecessor’s tenure, particularly without the clout of the Castro name. Some have wondered if he may even backtrack on some reforms. “People in Cuba really haven’t processed yet what it means to have a government without Raúl or Fidel leading it,” Yassel Padron Kunakbaeva, a 27-year-old Marxist blogger, told The Associated Press this week. “We’re entering unknown territory.”Cuban experts have described Diaz-Canel as a “party ideologue” and “pragmatist” who is not expected to push for dramatic political change. In fact, observers say, Diaz-Canel’s ideology appears, if anything, to have hardened in recent years. He recently spoke out against the historic detente between the U.S. and Cuba achieved during President Barack Obama’s tenure, calling it “a different way [for the U.S.] to try to reach its final objective to destroy the revolution.”Diaz-Canel is “not there to break the china or disrupt the political system,” Thale told ABC. “But he is going to face serious economic problems and questions of his legitimacy.”As president, Raúl Castro took steps to modernize Cuba’s centrally planned economy — an unfinished effort that’s yielded mixed results. The private sector was expanded, and fallow state-owned land was leased out to farmers, among other reforms.Castro also oversaw the historic thaw in relations with the U.S. and introduced new — though still limited — social freedoms, such as expanding internet access and allowing Cubans to travel and own cellphones.But the Cuban economy has remained sluggish, growing by just 2.4 percent per year on average over the past decade — well short of the 7 percent annual growth that government officials say is necessary for the country to develop, according to Reuters. The inefficient Soviet-style state economy still employs three out of every four Cuban workers, who earn an average of $30 a month.Infrastructure is crumbling, foreign investment is lagging and any hope that Cubans may have pegged on a warmer relationship with the U.S. has faltered as renewed tensions have emerged under President Donald Trump. The state also continues to quash free expression and stifle dissent.William Leogrande, a professor and Latin America expert at the American University School of Public Affairs, said Raul Castro’s legacy hinges on how well his successor is able to grow Cuba’s economy and continue his path of reform.“If the updating fails, Raul will be remembered as just one more reform communist who couldn’t force the system to change despite his best efforts,” Leogrande told Reuters. Castros have ruled Cuba since 1959, when Fidel Castro was first sworn in as prime minister. Fidel, among the world’s longest-serving political leaders, died at the age of 90 in 2016.This story has been updated with information about Diaz-Canel’s nomination."
