,category,headline,authors,link,short descr,date,image_caption(s),image_link(s),article
71,HEALTHY LIVING,Millions Of These Knives Are Being Recalled Because Their Blades Can Break,Nina Golgowski,https://www.huffingtonpost.com/entry/kitchen-knives-recalled_us_58af1eb2e4b0780bac273350,The massive recall of Calphalon Contemporary Cutlery affects products sold as far back as 2008.,2017-02-23,Millions of knives sold by Calphalon Contemporary Cutlery are being recalled because of the risk of injury.,https://img.huffingtonpost.com/asset/58af3b50280000db9899acd1.jpeg?cache=F8extojF1S&ops=crop_0_40_300_292%2Cscalefit_720_noupscale,"Roughly 2 million kitchen knives are being voluntarily recalled following reports of hand and finger lacerations from the blades breaking, federal authorities announced Wednesday.The massive recall of Calphalon Contemporary Cutlery specifically targets blades sold between August 2008 and this past December, the Consumer Product Safety Commission said in a press release.Thirteen models that were sold individually for $25 and in sets for $300 are specifically being recalled. The recalled model numbers are as follows: 1808008, 1808009, 1821332, 1922890, 1922971, 1922976, 1932810, KNR0005C, KNR0007C, KNR10045C, KNR4008C, KNSR002C and KNSR0102C.Of the products sold ― about 7,000 of which were in Canada ― there have been about 3,150 reports of broken knives. At least four of the injuries required stitches, the CPSC said.“Consumers should immediately stop using the recalled cutlery and contact Calphalon for a replacement cutlery product,” the safety commission states on its website.The list of stores that the models were sold at includes J.C. Penney, Kohl’s, Macy’s and Amazon.comAnyone who has one or more of these knives is asked to contact the company to exchange the product for a replacement. "
72,HEALTHY LIVING,Millions Of These Knives Are Being Recalled Because Their Blades Can Break,Nina Golgowski,https://www.huffingtonpost.com/entry/kitchen-knives-recalled_us_58af1eb2e4b0780bac273350,The massive recall of Calphalon Contemporary Cutlery affects products sold as far back as 2008.,2017-02-23,This is one of the knives that is undergoing a voluntary recall.,https://img.huffingtonpost.com/asset/58af4be42900002200f285c6.jpeg?ops=scalefit_720_noupscale,"Roughly 2 million kitchen knives are being voluntarily recalled following reports of hand and finger lacerations from the blades breaking, federal authorities announced Wednesday.The massive recall of Calphalon Contemporary Cutlery specifically targets blades sold between August 2008 and this past December, the Consumer Product Safety Commission said in a press release.Thirteen models that were sold individually for $25 and in sets for $300 are specifically being recalled. The recalled model numbers are as follows: 1808008, 1808009, 1821332, 1922890, 1922971, 1922976, 1932810, KNR0005C, KNR0007C, KNR10045C, KNR4008C, KNSR002C and KNSR0102C.Of the products sold ― about 7,000 of which were in Canada ― there have been about 3,150 reports of broken knives. At least four of the injuries required stitches, the CPSC said.“Consumers should immediately stop using the recalled cutlery and contact Calphalon for a replacement cutlery product,” the safety commission states on its website.The list of stores that the models were sold at includes J.C. Penney, Kohl’s, Macy’s and Amazon.comAnyone who has one or more of these knives is asked to contact the company to exchange the product for a replacement. "
73,POLITICS,Donald Trump Didn't Actually Roll Back Any Legal Protections For Transgender Kids,Jennifer Bendery and Cristian Farias,https://www.huffingtonpost.com/entry/trump-transgender-students-bathrooms_us_58af1591e4b0780bac2725d4,Federal and state laws still protect trans students from discrimination. The president can't rescind those.,2017-02-23,"Gavin Grimm, 17, with his mom. Grimm is suing his school district to use bathrooms that match his gender identity. The case is going before the Supreme Court.",https://img.huffingtonpost.com/asset/58af16fb280000d59899ac57.jpeg?ops=crop_9_0_4919_3280%2Cscalefit_720_noupscale,"WASHINGTON ― President Donald Trump outraged LGBTQ rights supporters on Wednesday when his administration eliminated Obama-era federal guidance to schools aimed at protecting transgender students from bullying and discrimination.But it’s important to note that Trump’s action, while it sends the signal that his administration won’t stand up for transgender kids, didn’t change anything legally. The same federal and state laws that protect transgender people against discrimination are still in place, and Trump’s move has no effect on them.The guidance that President Barack Obama’s Departments of Justice and Education issued to school districts in 2016 was just that: guidance. It wasn’t legally binding. It directed schools to accommodate transgender kids’ desire to use school bathrooms and locker rooms that reflect their gender identity.The Obama administration issued that guidance based on its interpretation of Title IX, the 1972 federal law that bans sex discrimination in schools that receive federal funding. His agencies read the law to mean that schools have to treat a student’s gender identity the same as the student’s sex. “The guidance ... didn’t create law,” Vanita Gupta, the DOJ’s civil rights chief under Obama, told NPR on Thursday. “The guidance simply enunciated the Justice Department’s interpretation of Title IX and what federal civil rights law requires of schools. It was based on a decade of case law. It was based on proven best practices that, frankly, a lot of schools around the country were already implementing at the time that we issued the guidance.”So, for example, if a teacher told a transgender boy he couldn’t use the boy’s bathroom at school, the Obama administration would argue that that would qualify as discrimination based on that boy’s sex, which would be illegal. That direct tie between a student’s gender and sex isn’t explicitly spelled out in Title IX, but that’s how Obama’s team was interpreting the law, and that’s the thrust of the guidance they issued.Trump got rid of that guidance but he can’t get rid of Title IX. And Obama’s interpretation of that law ― that a student’s gender identity should be viewed the same as the student’s sex ― is the opinion of a federal appeals court and more than a dozen district courts that have tackled related issues over the last 15 years.The only difference now, without that guidance, is that transgender students would have to go through more of a hassle when suing a school for discrimination, because they’ll have one less tool to assert the right to use the restroom of their choice.“They have access to the courts, even without the guidance,” explained Sarah Trumble, deputy director of social policy at Third Way, a centrist think tank. “It’s just a heavier burden for them to vindicate those rights without the guidance.”It’s also worth noting that Obama’s guidance has been frozen since August, when a judge in Texas blocked it nationwide.Yet independent of that ruling, many states and localities have been mindful of students’ gender identities. As Third Way spells out in a handy explainer, 14 states, the District of Columbia and hundreds of local school districts already have their own policies that protect transgender students from discrimination.Transgender students are among the most vulnerable people in schools. More than half of them nationwide face verbal harassment, a quarter are physically attacked and 13 percent are sexually assaulted while attending school because they are transgender, according to the 2015 National Transgender Discrimination Survey. Seventy-seven percent experience mistreatment between kindergarten and 12th grade, the survey says.The big development to watch when it comes to discrimination against trans people comes in March, when the Supreme Court hears oral arguments in the case of Gavin Grimm, a transgender teenager who’s suing the Gloucester County School Board in Virginia for denying him the ability to use school bathrooms that match his gender identity. While the U.S. Court of Appeals for the 4th Circuit and other districts courts have deferred to the Obama administration’s interpretation of Title IX, applying the law’s protections to transgender students, this case could be the ultimate decider.The American Civil Liberties Union is representing Grimm before the Supreme Court. The organization was using Obama’s guidance as part of its argument in Grimm’s case, but with that gone, it’s now relying almost entirely on the text of Title IX to make the case that the law should apply to gender identity.Joshua Block, the lead ACLU attorney in Grimm’s case, said the slew of previous court decisions in favor of Title IX applying to transgender protections gives him a strong case.“While it’s disappointing to see the Trump administration revoke the guidance, the administration cannot change what Title IX means,” Block said. “When it decided to hear Gavin Grimm’s case, the Supreme Court said it would decide which interpretation of Title IX is correct, without taking any administration’s guidance into consideration. We’re confident that the law is on Gavin’s side and he will prevail just as he did in the 4th Circuit.”The Gloucester County School Board issued a statement praising Trump for rescinding the guidance, saying it shows why decisions about transgender students’ use of bathrooms should be decided at the local level.“This action shows ‘due regard for the primary role of the States and local school districts in establishing educational policy,’” reads the board’s statement. “We look forward to explaining to the Supreme Court why this development underscores that the Board’s commonsense restroom and locker room policy is legal under federal law.”The Supreme Court will hear oral arguments in Grimm’s case on March 28."
74,ENTERTAINMENT,Here's Why Donald Trump Won't Be Watching The Oscars,Ron Dicker,https://www.huffingtonpost.com/entry/donald-trump-wont-be-watching-the-oscars_us_58aede58e4b0140601301cde,"""I think Hollywood is known for being rather far to the left.""",2017-02-23,"Donald Trump and his wife Melania are shown attending the 2011 Academy Awards, but the president apparenlty won't be tuning in this time around.",https://img.huffingtonpost.com/asset/58aeea06290000f616f28464.jpeg?ops=scalefit_720_noupscale,"President Donald Trump likely won’t be watching the Academy Awards on Sunday night because, duh.But we’ll let White House press secretary Sean Spicer share the official reason why:I think Hollywood is known for being rather far to the left in its opinions, and I’ve got to be honest with you, I think the president will be hosting the Governors’ Ball that night. Mrs. Trump looks forward to putting on a phenomenal event. And the first lady’s put a lot of time into this event, in welcoming our nation’s governors to the capital, and I have a feeling that’s where the president and first lady are going to be focused on Sunday night.The former reality star has fired up feuds with the likes of Meryl Streep (who’s nominated) and has also gotten roasted at previous award shows, so he probably isn’t feeling chummy with show business right about now. Plus, given the anti-administration yuks that will likely spill forth at the Oscars, perhaps Trump wants to spare his ego.While he may not tune in, we have a sneaking suspicion that the commander-in-chief won’t tune out what transpires on Oscar night. Got that, Twitter?He apparently hasn’t been such a fan of the ceremony anyway, tweeting in 2014 that it was “amateur night” and “bullshit.” In 2015, he issued this politicized critique: "
75,ARTS & CULTURE,"A Free, Lady-Led Zine Is Here To School You On Reproductive Rights",Priscilla Frank,https://www.huffingtonpost.com/entry/reproductive-rights-zine_us_58adab8ee4b04a0b274e93b1,Because knowledge is (girl) power.,2017-02-23,"Poster art by Alia Penner. Two-color Risograph print, printed with Endless Editions on archival paper.",https://img.huffingtonpost.com/asset/58adabc92900002200f28078.jpeg?cache=Bb36F61i3H&ops=scalefit_1280_noupscale,"It’s 2017 and, sadly, the question of whether women should be trusted to make decisions regarding their own bodies is still up for debate. With a new administration threatening to roll back rights for women and LGBTQ communities, it is crucial for people of all ages, genders and origins to know what they are legally entitled to when it comes to sexuality and reproductive health. With “Repro Rights Zine,” activists India Menuez, Layla Alter and Emma Holland hope to do just that. Their downloadable feminist zine aims to provide information and empowerment in this alarming time ― for free.Following in the radical tradition of DIY zines, the mission of the publication is threefold: inform others about the current state of reproductive rights, warn them of what is at risk over the next four years, and list the precautions that can be taken to protect ourselves and each other. Oh, and share some quality feminist art.“The framing of these issues is really key,” Holland explained in an interview with i-D, “and this is where awareness changes a lot across the country. In general, this country still — for some insane reason — hasn’t accepted and institutionalized the idea of health as a basic human right. This is obvious in the way our healthcare system functions (or doesn’t) and its fundamental exploitative nature, particularly towards anyone who isn’t a white male with ample means.””When it comes to reproductive rights,” she continued, “the conversation often skews even further away from the idea of them as a right to health and safety and control over your own existence. And that’s if there’s a conversation at all. Doing this has made us even more aware of the lack of knowledge around these issues, even in our immediate communities.”Repro Rights Zine offers information on how to get an IUD, reproductive rights for trans and gender-nonconforming individuals, who to call to help protect the Affordable Care Act, and where to find the specifics of reproductive rights state-by-state. The first edition of the zine, published shortly before Trump’s inauguration, is available for free download on the Repro Rights Zine website. The goal is, with the help of social media, to get the reading material to anyone and everyone who might benefit from its contents, from a middle school girl in conservative Texas to a non-binary, queer teen in Middle America. For the second edition, the zine-masters enlisted artists Petra Collins, Meriem Bennani, Lola Ogbara, Ser Serpas, Alia Penner, Aidan Koch and Raina Hamner to create limited edition posters to stick inside the zines. These special artist editions sell for $20 each, with all proceeds going to the Center for Reproductive Rights.We reached out to contributing artist Ogbara to learn more. How did you get involved with Repro Rights Zine? What stood out to you about the publication, in relation to other material on women’s sexual health? I was approached by India Menuez. She sought me out via Instagram and emailed me about the project. I think what stood out the most for me was the way the Repro Rights Zine, compared to other publications, took on a strong political stance on the subject of women’s reproductive issues while simultaneously being current, timely and relatable.What can art teach women about reproductive rights and health that writing or scientific data cannot? I think there’s an important difference in the way we are learning and going about obtaining information. Art compared to scientific data/writing is more visual and, in today’s world, having a visual of anything grabs the attention of the masses. I think people, in general, are seeing the importance of art more and more each day. Hopefully when realizing that, women will take their reproductive health and rights more seriously. What better way to approach learning than through art? Who, in your opinion, is this zine meant for?I believe this zine is for anyone and everyone. Reproductive rights not only affect women but a whole family. It’s something everyone should be able to understand. The more we understand the more we can make strides toward progress.Can you talk about the work you contributed to the artist edition? Was this something you made specifically for the zine or decided to submit? What are you hoping to communicate through the piece? I had been working on a uterus drawing a few weeks back that I never finished and had been sitting in a folder on my computer. When the opportunity to create something outside my own personal interest came, specifically something with purpose, that’s when I thought of the drawing I had done. I revisited the drawing, added to it and expanded it.I aimed for a vintage psychedelic poster aesthetic and used simple line work to achieve it. I connected with the early 1960s and ‘70s era because that era birthed a more radical political stance on women’s rights. It was seen as the second wave of feminism. I wanted to send a message that was bold but clear from the beginning of the movement [1920s] to now. Nothing has changed — our bodies, our decisions. In your artist statement you write: “I gravitate towards a more literal and abstract functionality of the female aesthetic.” Can you expand upon what you mean by that? I work in multiple mediums — whether it’s drawing, sculpture or painting, my undertones tend to concentrate on the female form, aesthetic, or way of life. It could be as literal as a drawing of a female figure or more subtle and abstract as in my paintings using delicate shapes and certain color palettes. However we are functioning and evolving in today’s society, I am a storyteller of that process.How does the political climate we’re in right now shape your ideas regarding the efficacy of art activism? My art has always had a purpose; an activism rooted in any adversity I felt connected to. As a black woman living in America, there will always be some type of adversity for me so I will always feel inspired to express that. I think our current political standing expands to a demographic of artists that may not have been affected before and, as a result, more artists are participating in this new wave of art activism. To reach any change, I think it’s necessary that art activism grows to help make society better for everyone. What is one thing you wish everyone knew in terms of women’s health and reproductive rights?It’s not just an issue for women, it’s an issue for everyone. The idea that If you educate a man, you educate an individual; but if you educate a woman, you educate a family (nation) — applies to this situation, as well. If you tend to a woman, you tend to the family (nation). Download a free copy of Repro Rights Zine here and purchase an artist edition here. "
76,POLITICS,Ruth Bader Ginsburg Is Confident We'll Get Out Of This Mess,Lydia O'Connor,https://www.huffingtonpost.com/entry/ruth-bader-ginsburg-donald-trump_us_58af2222e4b060480e05bfd1,"The Women's March is ""reason to hope that that we will see a better day,"" she said.",2017-02-23,Supreme Court Justice Ruth Bader Ginsburg sees reason to hope that America will move past its current political troubles.,https://img.huffingtonpost.com/asset/58af3973290000f616f2858a.jpeg?ops=scalefit_720_noupscale,"While it may feel like the United States is in a troubling and chaotic political moment, Supreme Court Justice Ruth Bader Ginsburg doesn’t think it’s inescapable.In an interview broadcast on BBC Newsnight on Thursday, Ginsburg shied away from addressing Donald Trump’s presidency but struck a hopeful tone about some of the issues his administration has divisive stances on, including immigration, women’s rights and the press. “I am optimistic in the long run,” she said. “There was a great man who once said that the true symbol of the United States is not the bald eagle. It is the pendulum. And when the pendulum swings too far in one direction it will go back.”While things look bleak, she believes the record levels of activism at events like last month’s Women’s March, which may have been the largest protest in U.S. history, bode well for the future. “[T]here’s hope in seeing how the public is reacting to it,” she said. “The Women’s March ― I’ve never seen such a demonstration, both the numbers and the rapport of the people in that crowd. There was no violence; it was orderly. So yes, we are not experiencing the best times, but there is reason to hope that that we will see a better day.” Ginsburg noted that the U.S. has emerged from dark chapters in its history, like the imprisonment of Japanese Americans during World War II.“That was a dreadful mistake,” she said. “It took a long time for the United States to realize how dreadful it was. But ultimately the president acknowledged that there was no reason to intern people of Japanese ancestry and Congress passed a bill providing compensation for the people who were interned or their survivors.”And the media is instrumental in holding the government accountable, she said.“Think of what the press has done in the United States,” she said. “[The Watergate scandal] might never have come out if we didn’t have the free press that we do.”The 83-year-old is optimistic about her own future on the Supreme Court, too.“At my age you have to take it year by year. I know I’m OK. What will be next year?” she said.“I’m hopeful however, because my most senior colleague ― the one who most recently retired, Justice John Paul Stevens ― stepped down at age 90. So I have a way to go.”"
