,category,headline,authors,link,short descr,date,image_caption(s),image_link(s),article
64,ENTERTAINMENT,Jason Aldean On His New Album And What He Learned From Vegas,Lauren Moraski,https://www.huffingtonpost.com/entry/jason-aldean-rearview-town_us_5acd22abe4b0259339de36e9,"The country star was onstage at when a gunman fired into the crowd. Here's how he feels about that night, the gun debate and more.",2018-04-18,Aldean's new album features an appearance by Miranda Lambert.,https://img.huffingtonpost.com/asset/5ad652ab2000002d00eb4f34.jpeg?ops=scalefit_720_noupscale,"You may call Jason Aldean his own worst critic. The country star will often listen to his music over and over, or watch tapings of his performances. “I pick all my stuff apart. I listen to it a lot. But I do that with everything,” Aldean told HuffPost. If we have a live performance on TV, I go back and watch it and go, ‘I should have done this different or that different. Or I should have done this here.’ I analyze everything.” Aldean did that with his new album, “Rearview Town,” released on Friday. The title track, in particular, is one he analyzed a lot before releasing it. Though, now it appears he listens to it more for enjoyment that anything else. He likes its relatable premise about “leaving your hometown and putting the past behind you and moving on to something else down the road that maybe you couldn’t achieve in your hometown.”For his eighth studio album, Aldean wanted to “push the envelope,” similar to what he did with his self-titled debut in 2005. “Early on in my career when we would make records we had a little bit of an ‘anything goes’ mentality as far as songs, and finding songs that let us step outside the box — from what everybody else was doing,” he said. “I think on the last couple of albums we played it safe ... I just wanted to get back to finding and recording songs where people would never know what’s going to come next.”The new set of 15 songs includes a mix of sounds ranging from country and blues to rock and hip-hop. It also features an appearance by Miranda Lambert on “Drowns the Whiskey.” The two previously collaborated on “Grown Woman” from Aldean’s 2007 sophomore effort. The trickiest part this time involved making sure he found the right track to introduce to Lambert. “I actually sent her a song before I sent her ‘Drowns the Whiskey,’ and she just wasn’t loving it. She didn’t hate it. She didn’t love it. I told her if you’re going to sing on it, I want it to be something that you really like,” Aldean recalled. Luckily, Lambert fell in love with “Drowns the Whiskey.” It’s a more traditional song ― something right in her wheelhouse, Aldean said.“One thing a lot of people don’t know about her is that she’s a really great harmony singer. Like really good,” Aldean said. “She doesn’t necessarily sing it like if I brought in a background singer. But that’s what makes it cool. It’s very stylistic, and you can tell that it’s her. We had her come in and cranked her into the mix and it sounded great. Highlight of the record for sure.” This album is Aldean’s first release since the Route 91 Harvest Festival in Las Vegas in October. Aldean was performing onstage at the country music fest when a gunman started shooting from a nearby hotel room, killing 58 people and injuring hundreds. It was the nation’s deadliest mass shooting in modern history.Although the new songs were neither influenced nor inspired by Vegas (he completed them prior to Route 91), Aldean does mention the victims and survivors of the massacre in the liner notes; he doesn’t want people to forget what happened that night. “I feel like a lot of times it becomes less and less of a headline as times goes on. For me, it was a way to acknowledge people that were there and let them know that a lot of time has passed now, but it’s still something I think about. I think about those people every day, and that night, I still think about all the time.”In the days after the shooting, Aldean visited hospitals and met with survivors, something that impacts him to this day. “I don’t think you can go through something like that and have it not change you. It’s a life-altering kind of thing. It made me view a lot of things differently,” he said. “I think going and talking to some of the victims and their families and seeing the spirit that those people had was pretty amazing to see. I was going through my own stuff in private and dealing with all of it. But to go talk to all the people and see the way they were dealing with it — that had been shot. They were in great spirits and just glad to be alive. I was like, ‘Oh man, maybe I’m looking at this all wrong.’ It really helped me have a different view on it. But it’s tough. I don’t know if you ever really get over it. Hopefully it gets better.”Since the Vegas shooting, a lot of talk has surrounded gun control ― with eyes on the country music community. Aldean, a gun owner himself, recently said it’s too easy to get guns.“When you can walk in somewhere and you can get one in five minutes, do a background check that takes five minutes, like how in-depth is that background check? Those are the issues I have. It’s not necessarily the guns themselves or that I don’t think people should have guns,” he told The Associated Press. “I have a lot of them.”But when pressed on the hot-button gun debate during our interview, Aldean didn’t want to elaborate. “I feel like it gets taken out of context, and the headline becomes that I speak out on gun control. ... I’m not saying that people should have their guns taken away,” he said. “Because I don’t think that. It’s just one of those things ― it’s like a no-win. For me, I’ve said my piece on that and people can take it for what they want to.”With that, Aldean wants to focus on his new music and his return to the stage, with a major tour kicking off in May. Playing live is still where he feels most at ease. “I know I’m not the best singer,” Aldean, ever the self-critic, said. “That’s my thing ― you put me onstage and you put me in front of people, that’s where I’m comfortable.” Now, more than a decade into his career, Aldean continues to attract a large audience. Over the weekend, he returned to Las Vegas for the Academy of Country Music Awards, where he took home Entertainer of the Year for the third consecutive time. “I feel like I’m able to pick songs that work for me,” he said about his success, adding, “and being able to work hard when you do get the opportunities and take advantage of things and be able to sustain it.” "
65,WORLD NEWS,Here's Why You've Never Heard Of The Titanic's Chinese Survivors,Kimberly Yam,https://www.huffingtonpost.com/entry/titanic-chinese-survivors-documentary_us_5ad7600fe4b03c426daa7ccd,"A century ago, a racist press muddied their names when it didn't ignore them entirely.",2018-04-18,"The Titanic sailed with eight Chinese passengers, six of whom survived only to be met with racism on shore.",https://img.huffingtonpost.com/asset/5ad7a9e41e00008e0b7b1e25.jpeg?ops=scalefit_720_noupscale,"While the RMS Titanic left a lasting cultural legacy, the fate of its wealthiest passengers discussed in news and entertainment media, the history of the ship’s Chinese passengers has remained largely hidden.And racist policies have a lot to do with it. Out of the eight Chinese passengers aboard the ship, six survived the disaster that occurred off the coast of Newfoundland on April 15, 1912. But following their escape and eventual landing in the U.S., they were met with fierce anti-Chinese sentiment and strict immigration policies targeting those from China. The six were ultimately turned away at Ellis Island.Their story is the subject of an upcoming documentary, “The Six,” to be released later this year. The film’s chief researcher, Steven Schwankert, told the South China Morning Post that his team hopes to set the record straight and address the attitudes that obscured the fate of the six travelers.“Six Chinese guys made it off the Titanic alive and 24 hours later were written out of the story,” Schwankert said. “That wasn’t an accident. That was deliberate. It’s something that the culture of the time made happen.”The passengers, who appeared to be from southern China, boarded the British ship in the English city of Southampton. In line with the way many ships handled third-class passengers a century ago, all eight of their names were written on a single ticket. After the crash into an iceberg, four of the men escaped aboard the final lifeboat, according to news site Quartz. One made it onto another lifeboat while another, who was reportedly named Fang Lang, was picked up after being spotted floating in the wreckage. Records reveal that even that rescue was tinged with racism. Officer Harold Lowe, who manned lifeboat 14, was said to have hesitated over saving the Chinese passenger, whom he called a “Jap,” a derogatory term used to describe individuals of Japanese descent.“What’s the use?” Lowe said, according to lifeboat passenger Charlotte Collyer as reported in Encyclopedia Titanica. “He’s dead, likely, and if he isn’t, there’s others better worth saving than a Jap!”But other passengers convinced Lowe to act. After he recovered his strength, Fang Lang proved to be a valuable member of the lifeboat and “worked like a hero,” rowing until they were rescued, Collyer later said. Lowe soon walked back his comments.In part because most of the Chinese men survived the sinking of the Titanic ― even though women and children had been prioritized in the rush to the lifeboats ― their appearance in the U.S. was greatly scrutinized. A story in a 1912 issue of the Brooklyn Eagle offers a snapshot of the anti-Chinese bias aimed at the six men. Referring to them as “creatures” and “coolies,” the newspaper claimed that some of them were “found, wedged beneath the seats” of the lifeboats.But documentary director Arthur Jones doesn’t believe that is accurate. “We visited a large number of foreign archives and museums, worked with historians from the United States and China, searched and studied many [pieces of] evidence,” he told Xinhua News Agency. “There is no single [piece of] evidence to prove the Chinese survivors were stowaways [on the lifeboats]. I believe they did not do anything dishonorable.”Other Western media outlets at the time also claimed that the Chinese passengers disguised themselves as women to escape the doomed ship ― another detail that the team producing “The Six” don’t buy.“The press at the time labeled the Chinese survivors, referred to in places as ‘celestials,’ as cowards who dressed as women to sneak into lifeboats,” Schwankert told Quartz. “They had no basis for that, and we believe it’s just not true. … It’s time for these men to have their rightful place in history.”Unlike the other passengers, these six survivors were ordered to leave the U.S. A century ago, American immigration policy was firmly set against the Chinese. The Chinese Exclusion Act of 1882 had initially barred all immigration of Chinese laborers for 10 years; the discriminatory policy was extended in 1892 by the Geary Act and made permanent in 1902 with even further restrictions. (The policy would not be ended until 1943 when China was a World War II ally.)Little is known about the lives of the six men after their expulsion from the U.S. Their stories were mostly forgotten and if they were brought up in the press, “it was to say they did something dishonorable,” Jones told the South China Morning Post.With the help of a social media campaign, however, the documentarians set out to track down their descendants. It was a difficult task, given that the survivors’ names have been recorded with varying spellings. But the team did make headway, according to the South China Morning Post. Their research led them from Wisconsin to the port city of Guangzhou. Soon, the passengers will receive the treatment they deserve. “We don’t accept the reports and the history as it is presented. The six Chinese men have been put into a position of injustice for more than a hundred years. We can finally tell their story rightly,” Schwankert told Xinhua.For more on the film, head to the Facebook page for “The Six” here. "
66,POLITICS,Senate Votes Unanimously To Allow Newborns On Chamber Floor,Alanna Vagianos and Nick Visser,https://www.huffingtonpost.com/entry/tammy-duckworth-proposes-legislation-to-allow-newborns-on-senate-floor_us_5ad7542de4b0e4d0715c50b0,"Family-friendly policies ""aren’t just a women’s issue,"" said Sen. Tammy Duckworth. ""They are a common-sense economic issue.""",2018-04-18,Sen. Tammy Duckworth's new baby girl just scored her first political victory.,https://img.huffingtonpost.com/asset/5ad755171e000008087b1db0.jpeg?cache=miAkRRY5dZ&ops=crop_246_126_2749_1531%2Cscalefit_720_noupscale,"UPDATE: 7 p.m. ― The Senate unanimously agreed Wednesday to change its rules to allow senators to bring their infant children onto the chamber floor during floor votes, for which a lawmaker must be present in person.Sen. Tammy Duckworth (D-Ill.), who became the first sitting senator to give birth while in office earlier this month, applauded the move, saying that the Senate was “leading by example” and that making accommodations for new parents was “a common-sense economic issue.”“I would like to thank my colleagues ... for helping bring the Senate into the 21st Century by recognizing that sometimes new parents also have responsibilities at work,” Duckworth said in a statement. “By ensuring that no Senator will be prevented from performing their constitutional responsibilities simply because they have a young child, the Senate is leading by example and sending the important message that working parents everywhere deserve family-friendly workplace policies. These policies aren’t just a women’s issue, they are a common-sense economic issue.”Sen. Roy Blunt (R-Mo.), chairman of the Senate Rules Committee, said he was “glad we were able to get this done.” He had expressed support for the change earlier in the week alongside the committee’s ranking member, Sen. Amy Klobuchar (D-Minn.).“Being a parent is a difficult job, and the Senate rules shouldn’t make it any harder,” Blunt said in a statement.Previously: Sen. Tammy Duckworth (D-Ill.) made history earlier this month when she became the first sitting senator to give birth while in office. She wants to make history again by doing away with the archaic chamber rule that newborns are not allowed onto the Senate floor.Her effort has gained what’s become a rarity in Congress ― bipartisan support.The Iraq War veteran submitted a resolution this week that would allow senators to bring children under the age of one onto the Senate floor. The resolution needs to pass the Senate Rules Committee and then be approved by the full chamber. If passed quickly, Duckworth would be able to vote with her daughter by next week. “As leaders of the Senate Rules Committee, we support Senator Duckworth’s resolution and intend to move it swiftly through our committee,” Senate Rules Committee Chairman Sen. Roy Blunt (R-Mo.) and Sen. Amy Klobuchar (D-Minn.) said in a joint statement on Tuesday, according to CNN. Politico reported that Senate leaders are ready to have the full chamber act on the request once the Rules Committee approves it. Duckworth told Politico in February that she couldn’t “technically” take maternity leave because senators are required to appear in person to vote. “If I have to vote, and I’m breastfeeding my child, especially during my maternity leave period, what do I do? Leave her sitting outside?” Duckworth asked in the interview.In a recent essay for Elle Magazine, she discussed how exhausting it can be to always be the “first.”“I have won historic elections, but it feels like these ‘firsts’ are so overdue,” she said. “I never set out to be the first in anything, and with a lot of these ‘firsts,’ it really makes me wonder how it’s taken so long. It also underscores how much farther we have to go to have representation in our government.”"
67,ENTERTAINMENT,"Lea Michele, Jonathan Groff Join Parkland Survivors For 'Spring Awakening' Rehearsal",Cole Delbyck,https://www.huffingtonpost.com/entry/lea-michele-jonathan-groff-rehearse-spring-awakening-with-florida-shooting-survivors_us_5ad749eee4b03c426daa3120,"The ""Glee"" star called the students ""such incredible, talented and inspiring young adults.""",2018-04-18,"Jonathan Groff and Lea Michele pose with Stoneman Douglas school shooting survivors Sawyer Garrity, bottom left, and Cameron Kasky, top right.",https://img.huffingtonpost.com/asset/5ad755dd1f0000270616d79a.png?cache=KoPb1U2FiT&ops=scalefit_720_noupscale,"A group of students who survived February’s Parkland, Florida, school shooting had some special visitors Tuesday at a rehearsal for their production of “Spring Awakening.”Former “Glee” star Lea Michele, Jonathan Groff and other cast members from the show’s original Broadway run traveled to Florida to help the teens as they prepare to put on the Tony Award-winning rock musical.Three survivors of the shooting at Marjory Stoneman Douglas High School ― Alfonso Calderon, Sawyer Garrity and Cameron Kasky ― have lead roles in the Boca Raton production. Calderon and Kasky helped found the student-led gun control advocacy group Never Again MSD in the wake of the tragedy.Michele tweeted a photo of the combined casts, writing: “What an honor joining my original Broadway Spring Awakening cast in Florida yesterday to work with some of the Stoneman Douglas students and their cast mates on their production of Spring Awakening.”Also on hand was “Pitch Perfect” star Skylar Astin, as well as Remy Zaken, Gideon Glick, Lauren Pritchard, Brian Charles Johnson and Phoebe Strole from the original cast.“Very honored to meet such incredible, talented and inspiring young adults who are fighting to make a change!” Michele tweeted with a selfie showing Groff, Kasky and Garrity.The musical, adapted from a 1891 German play of the same name about a group of teenagers coming of age, was actually conceived in response to a school shooting.Playwright Steven Sater and composer Duncan Sheik originally collaborated on the project to address “the unheard, anguished cries of young people” in the wake of the Columbine High School shooting in 1999, according to Topic.“Now more than ever, this musical carries important weight,” the show’s producers write on the theater’s website.The production of “Spring Awakening” is set to open May 2. "
68,POLITICS,Tennessee Republicans Punish Memphis For Removing Confederate Statues,Sara Boboltz,https://www.huffingtonpost.com/entry/tennessee-republicans-memphis-confederate-statues_us_5ad7556de4b0e4d0715c55a9,"The majority-black city is out $250,000 in funds for its bicentennial.",2018-04-18,"Back in 2005, protesters rallied against the name of Memphis' Nathan Bedford Forrest Park in front of a statue of the Confederate general.",https://img.huffingtonpost.com/asset/5ad756391f00002d0016d79c.jpeg?cache=9608OhzNAJ&ops=scalefit_720_noupscale,"Tennessee’s Republican-controlled House on Tuesday retaliated against Memphis for removing two Confederate monuments by withholding $250,000 previously earmarked for the city’s 2019 bicentennial celebration.Democrats in the House condemned the move, which came in the form of a last-minute amendment to an appropriations bill and triggered a heated debate. State Rep. Antonio Parkinson (D) said the amendment was the most “vile, racist” measure he had seen, while state Rep. Raumesh Akbari (D) called it “un-Christian.”“The amendment and the explanation is hateful,” Akbari said before the vote. But Republicans were not moved, and the amendment passed with a strong majority. In a largely party-line vote, only five Republicans joined 22 Democrats in opposing the measure.Memphis itself had been legally blocked from removing the statues of Confederate general and Ku Klux Klan leader Nathan Bedford Forrest and Confederate president Jefferson Davis from two public parks, according to The Commercial Appeal. But in December, the city council voted unanimously to sell the parks to a local nonprofit, for a reported $1,000 each. That evening, the nonprofit took down the monuments. Some people in the majority-black city had been voicing their discomfort with the lingering reminders of the Confederacy for well over a decade. Tennessee House Republicans strongly opposed removing the statues, however, and have called for an investigation into the legality of the parks’ sale.“The law was very clear, and they got smart lawyers to figure out how to wiggle around the law,” state Rep. Gerald McCormick (R) told Nashville Public Radio.Memphis Mayor Jim Strickland (D) said on Twitter that officials “followed the state law down to the letter of it.” Ahead of the city’s 200th anniversary in May 2019, Memphis government officials have been working on a plan that Strickland calls “Memphis 3.0.” According to the project’s website, organizers aim to develop “great neighborhoods” and “walkable/bikeable communities connected by effective transportation options,” among other goals.“While we would have appreciated the additional funding, the ongoing planning for the joint city-county bicentennial will continue unchanged,” Strickland said. A Memphis resident has set up a GoFundMe page to help recoup the $250,000.The story has been updated with comment from Mayor Strickland and news of the GoFundMe page."
