,category,headline,authors,link,short descr,date,image_caption(s),image_link(s),article
44,THE WORLDPOST,Philippines' Duterte Seeks Peace,"Marjorie Cohn, ContributorProfessor Emerita at Thomas Jefferson School of Law",https://www.huffingtonpost.com/entry/philippines-duterte-seeks-peace_us_58385bcde4b050dfe6187b67,"“Duterte is not a saint, but he stands for an independent foreign policy.""",2016-11-25,"<p>Philippine President Rodrigo Duterte speaks upon his arrival at Davao International Airport in Davao city, Philippines, after returning from a leaders' summit in Peru of the Asia-Pacific Economic Cooperation (APEC), November 23, 2016.</p>",https://img.huffingtonpost.com/asset/58388c1f1a00000b03cc9c7b.jpeg?cache=w3ggARmxR7&ops=scalefit_720_noupscale,"In April 2016, Rodrigo Duterte won the Philippine presidential election by a landslide, with more than 6 million votes. He openly declared that he was the nation’s first Left president, calling himself a socialist but not a communist. So far, his regime has been controversial, to put it mildly.The U.S. press has focused on Duterte’s vicious war on drugs that claimed upwards of 2,000 lives and led to the incarceration of tens of thousands of people. His decision to allow former Filipino dictator Ferdinand Marcos’s burial in the National Cemetery of the Heroes also has drawn the ire of those who recall Marcos’s brutal two-decade regime that killed more than 3,000, tortured tens of thousands, and stole $10 billion from the Philippines.But, significantly, Duterte is engaging with revolutionary forces in the peace process that aims to end 47 years of armed struggle against the repressive Filipino government. And Duterte has taken actions that, for the first time, challenge the longstanding military and economic power of the United States in the Philippines.Peace Process With OppositionSince 1969, a civil war has been raging in the Philippines. The roots of the armed conflict can be traced to the colonial and neocolonial domination of the Philippines by the Spanish, then U.S. imperialism, feudal exploitation by big landlords and capitalist interests, as well as widespread bureaucratic corruption. After Duterte’s election, he cited peace as a top priority of his administration, vowing to engage in peace negotiations with the National Democratic Front of the Philippines (NDFP).According to JustPeacePH, an international platform that supports the Philippine peace process and takes its name from its Internet site, “justpeace.ph,” “The daily, systematic and systemic injustice experienced by the people drive them to desire and seek fundamental changes in society through various means. But because the forces against fundamental social change use all means including the instruments and violence of the state to defend the status quo, many Filipinos over many generations have embraced armed struggle to overthrow the ruling system.”The NDFP “is the alliance of progressive forces seeking to bring about fundamental change in the existing social system in the Philippines through armed revolution,” JustPeacePH states in its Primer on Just and Lasting Peace in the Philippines. The NDFP alliance includes trade unions, peasants, youth, women, national minorities, teachers, health workers, religious clergy, the Communist Party of the Philippines (CPP), and the New People’s Army.Duterte’s Peace InitiativeTwo rounds of peace negotiations have already occurred since Duterte took office, with a third scheduled for January 2017 in Oslo, Norway.In May, Duterte declared he would release all political prisoners, which number more than 400, through a presidential declaration of amnesty, provided both houses of congress approve. Nineteen NDFP consultants, who have been involved in the revolutionary movement for years, have already been released.Duterte offered four cabinet positions to the CPP, but they declined, stating there must first be a comprehensive peace agreement. The CPP, however, recommended a veteran peasant leader who was appointed Secretary of Agrarian Reform and a veteran academic activist leader who was named secretary of social welfare and development.“These are major appointments,” Luis Jalandoni, NDFP’s Senior Adviser on the Peace Negotiating Panel, told me at a recent conference of the International Association of Democratic Lawyers in Lisbon, Portugal.NDFP has a people’s army and organs of political power with mass organizations in 71 out of the 81 provinces in the country, Jalandoni said. He noted that landlessness and poverty afflict the 100 million people in the Philippines.“The NDFP insists on addressing the roots of the armed conflict in order to achieve a just and lasting peace,” Jalandoni said.The demands in the peace talks are: Release of all political prisoners; Land reform for the peasantry (70% of the population); National industrialization to develop the economy using available human and natural resources; Protect the environment and ancestral lands of the indigenous peoples; and Philippine national sovereignty and abrogation of all unequal treaties with the United States.Challenging U.S. PowerU.S. domination and interference in the Philippines date back to 1898, when the United States annexed the Philippines. The U.S. continued to exercise colonial rule over the country until 1946, when the Philippines gained its independence although the United States retained many military installations there and the Filipino economy maintained its dependence on the U.S.With U.S. assistance, Marcos ruled the Philippines with an iron fist from 1965 through 1986, under martial law from 1972 to 1981. In 2002, the Gloria Macapagal-Arroyo government developed Oplan Bantay Laya, a counterinsurgency program modeled on U.S. strategies. After 9/11, the Bush administration gave Arroyo $100 million to fund that campaign in the Philippines. The government of Benigno Aquino III continued the program in 2011 under the name Oplan Bayanihan.Oplan Bayanihan led to large numbers of extrajudicial killings, forced disappearances, torture and cruel treatment. Many civilians, including children, have been killed. Philippine military and paramilitary death squads murdered hundreds of members of progressive organizations. Communities and leaders opposed to large-scale and invasive mining have been targeted. Even ordinary people with no political affiliation have not escaped the government’s reign of terror.From 2001 to 2010, the U.S. government provided more than $507 in military assistance to the Philippine government, facilitating tremendous repression.Between 2010 and 2015, the Philippine police, military and paramilitary forces perpetrated extrajudicial killings, forced disappearances, torture, illegal arrests and forced evacuation, many to enable extraction by mining companies.The 2014 Enhanced Defense Cooperation Agreement, which President Barack Obama negotiated with Duterte’s predecessor, gave U.S. troops the right to prolonged deployment in the Philippines. The agreement is widely seen in the Philippines as a threat to the country’s sovereignty.In September 2016, Duterte declared, “I am not a fan of the Americans … Filipinos should be first before everybody else.” He added, “In our relations to the world, the Philippines will pursue an independent foreign policy. I repeat: The Philippines will pursue an independent foreign policy.”The United States has not apologized for all the atrocities it committed against the Filipino people, Duterte said. Responding to U.S. criticism of the Philippines for its human rights violations, he stated, “Why are you Americans killing the black people there, shooting them down when they are already on the ground.”Duterte promised to end joint military maneuvers with U.S. forces and expel the hundreds of U.S. troops currently stationed in the Philippines. He also expressed his intention to end bilateral agreements concluded by his predecessor with the United States and reverse permission for the United States’ use of five Philippine military bases.“I will break up with America,” Duterte said. “I would rather go to Russia and to China.” He vowed to rescind joint patrols with U.S. and Filipino forces against Chinese expansion in the disputed South China Sea. Indeed, Duterte recently traveled to China and secured valuable fishing rights for Filipinos in the South China Sea.Hope for Peace ProspectsIn an unprecedented development, both the government and the opposition declared unilateral ceasefires in August. But there are still problems with the government’s ceasefire, says Jalandoni, as Duterte doesn’t have full control of the military. The military and paramilitary forces, which are protected by the military, have engaged in several violations that imperil the ceasefire, he said.“There is high optimism that the peace talks will prosper under the presidency of Duterte,” according to JustPeacePH. “Unlike past presidents who harbor strong anti-communist bias, Duterte seems capable of rethinking the government’s peace strategy since he claims to be a socialist.”Opposition forces are not uncritical of the excesses in Duterte’s war on drugs. The CCP declared the campaign is becoming anti-people and anti-democratic. Due process must be respected, human rights must be upheld; the drug users and small drug dealers, who come from poverty, require rehabilitation and care, the CCP maintains.“Understandably, Duterte’s war on drugs and other crimes is given more coverage by the global media,” JustPeacePH wrote in its primer. “But Duterte’s aim to establish a lasting peace in the provinces deserves even more attention as this strikes at the root causes of the problem of illegal drugs and related crimes.”Jalandoni said, “Duterte is not a saint, but he stands for an independent foreign policy. His stand against the United States is respected and has received a lot of support.”The NDFP, Jalandoni noted, says that “if there are threats against Duterte by U.S. imperialism, the Left will be a reliable ally to him,” adding, “He is the first president to stand up to the United States.”Marjorie Cohn is professor emerita at Thomas Jefferson School of Law, former president of the National Lawyers Guild, and deputy secretary general of the International Association of Democratic Lawyers. She is a member of the International Legal Assistance Team that advises the National Democratic Front of the Philippines on human rights and humanitarian law in their peace negotiations. Her most recent book is Drones and Targeted Killing: Legal, Moral, and Geopolitical Issues. Follow her on Twitter @marjoriecohn.This article first appeared on Consortiumnews."
45,WEIRD NEWS,Artist Turns Random Dog Poops Into Donald Trump Art Installation,David Moye,https://www.huffingtonpost.com/entry/trump-dog-poop_us_583622a4e4b01ba68ac4212b,He has designs on making 'Trump' a new word for dookies.,2016-11-25,Florida artist Allan Adler is putting Trump photos around the dop poop in his Miami Beach neighborhood.,https://img.huffingtonpost.com/asset/583623781700002500e7c27a.png?cache=tG3LqlScAO&ops=scalefit_720_noupscale,"A graphic designer in Miami Beach has designs on turning Donald Trump’s last name into a new euphemism for “poop.”The way he’s doing it will strike many as crappy: He’s putting Trump’s face and, occasionally, his quotes on pieces of dog poop he sees around his South Beach neighborhood.Every day, the artist, who goes by the name “Allan Adler” to avoid detection, walks around looking for pieces of dog crap suitable for his purposes. “I don’t want it too old,” he told The Huffington Post. Once he finds a piece of poop that fits his purposes, Adler sticks a toothpick with Trump’s face glued to it into the doggy defecation. Sometimes, he adds one of Trump’s infamous quotes, “such as ‘grab her by the pussy’ or ‘I like soldiers who weren’t captured.’” Then he photographs the Trumped-up dog poop and posts it on Facebook at “Pieces Of Trump.”The end result not only is a commentary on people who don’t bother to clean up after their pets, but also a subtle suggestion on what kind of president Adler believes Trump will be. Spoiler alert: Adler doesn’t think he’ll be a good one. “He’s a piece of shit,” Adler explained. “When Trump won, I was depressed, but my friends said, ‘Don’t be. Now is the time to get your voice heard.’” And his way of doing that is through dog poop. “He’s said a lot of crappy things and I still can’t understand how someone who’s said things like this could get elected,” Adler said. Adler first started doodoo-ing his poop protests November 15. He has averaged one a day since then.The “installations,” as he calls them, are easy since “there is literally dog poop everywhere here ― it’s a big problem here.”Still, Adler is seeing benefits from the project.“It’s been therapeutic for me,” he said. “I can laugh about the situation and I’m not super depressed. It’s hilarious because you know everyone who is picking one up is a Trump supporter.”There have been some embarrassing moments too.“I haven’t been caught put his face on the poop, but I’ve been caught taking photos of them and I get weird looks,” Adler laughed.Adler has two big goals for his lowbrow protest.First, he’d like to make Trump’s last name into an alternative for defecation, such as “That’s a bunch of Trump” or “I almost stepped in that Trump.”Second, he hopes to join “SNL” and the “Hamilton” cast as the subject of Trump twitter storm.“I am worried about hate mail, but it would be funny if Trump commented on it,” Adler said. “It’s possible he could get unhinged about it.”"
46,GREEN,"Even When A Leopard Cub Dies, These Filmmakers Don't Turn The Cameras Off",Nick Visser,https://www.huffingtonpost.com/entry/national-geographic-savage-kingdom_us_58384146e4b000af95ee17a1,"""It's not all happy endings, it's not Bambis and rainbows.""",2016-11-25,"A leopard dubbed ""Torn Ear,"" featured in Nat Geo WILD's miniseries ""Savage Kingdom.""",https://img.huffingtonpost.com/asset/583841a21a00000b03cc9c00.jpeg?cache=9drNAfmeWM&ops=scalefit_720_noupscale,"One of the biggest lies you’ve ever been told is that Simba lives.Without a parent, alone on the plains of Africa, a lion cub will almost certainly die before he can find an all-you-can-eat grub buffet. It’s not sad, it’s reality, and like Disney, most wildlife films spare viewers the gritty details if the cub in peril is cute, cuddly or popular on the stuffed animal circuit.Not so for Brad Bestelink, the filmmaker behind a new miniseries from Nat Geo WILD called “Savage Kingdom.” Bestelink and his crew are based in northern Botswana, one of the world’s last remaining wild places where lions, leopards, hyenas and hippos roam free, kill each other and struggle to protect their own.“They’re mothers, they’re fathers, they are families like you and I. They fight every day just to keep their offspring alive and to keep themselves and their entire families fed,” Bestelink told me during a visit to Chobe National Park, one of the shooting locations for the series.“Savage Kingdom” is a different kind of wildlife film ― in nearly every episode, something cute dies. A leopard cub you watch grow up for 40 minutes is in the wrong place at the wrong time. A young lion gets mauled to death by his overeager family members. An unfortunate warthog piglet becomes a quick snack.His crew at Natural History Film Unit Botswana, a ragtag family of conservationists from nearly every continent, have one mission in mind when they go out to film: tell the real story, avoid embellishment and don’t lie.It’s a rough task. The crew often spends weeks at a time out in the bush filming and they form strong bonds with the animals. Richard Uren, a lead cameraman for the series, said at times it feels like the filmmakers are basically “one of the pride” and lions will occasionally stroll up and nap in the shade of their trucks.But when an animal gets killed, especially one they’re attached to, the crew mourns.“You get to know these animals so well, we’ve watched them grow up,” Uren, more of a “leopard guy,” said. But the cameras keep rolling, and Bestelink (a “lion guy”) said it’s this stark reality, this unvarnished look that shows animals “in a way you’ll inherently respect.”“I think it’s important to make sure it’s honest and it’s real and it’s raw,” he said. “We try to make sure that part of that portrayal is it’s not all happy endings, it’s not Bambis and rainbows. We’re talking about revenge, we’re talking about jealousy, we’re talking about power [and] kingdoms. It’s something that anyone can understand.”And the location couldn’t be more harsh.Botswana is one of the few countries in Africa with self-managed wildlife populations that live in unfenced national parks. The country has become a haven for animals, so much so that some scientists have warned there may soon be too many elephants in the country for nature to support. About 130,000 now live within its borders, the most anywhere on the planet.But African wildlife has been having a rough time lately. Some 30,000 elephants and 1,200 rhinos are killed every year across the continent by poachers looking for a quick payday. And African lions face extinction by mid-century without fierce conservation efforts.Bestelink said the role of a project like “Savage Kingdom” is to get past these statistics and simply make people care about wildlife again. These animals are out there, they’re fighting to survive and the battle is hard enough without the added pressures of humanity.“We are slowly losing habitats, we are slowly losing environments, we are slowly losing our respect for these animals,” he said. “We just need to bring more people in and show them how important the natural world is, how important these lives are. People can really buy into that and actually give a shit, really care.”“Savage Kingdom” premieres on Nat Geo WILD Friday, Nov. 25 at 9 p.m. ET.The author traveled to Botswana as a guest of Nat Geo WILD."
47,GREEN,"Even When A Leopard Cub Dies, These Filmmakers Don't Turn The Cameras Off",Nick Visser,https://www.huffingtonpost.com/entry/national-geographic-savage-kingdom_us_58384146e4b000af95ee17a1,"""It's not all happy endings, it's not Bambis and rainbows.""",2016-11-25,"The majority of the Marsh Pride, one of the five groups of predators featured in ""Savage Kingdom.""",https://img.huffingtonpost.com/asset/58385006180000461230fefd.jpeg?ops=scalefit_720_noupscale,"One of the biggest lies you’ve ever been told is that Simba lives.Without a parent, alone on the plains of Africa, a lion cub will almost certainly die before he can find an all-you-can-eat grub buffet. It’s not sad, it’s reality, and like Disney, most wildlife films spare viewers the gritty details if the cub in peril is cute, cuddly or popular on the stuffed animal circuit.Not so for Brad Bestelink, the filmmaker behind a new miniseries from Nat Geo WILD called “Savage Kingdom.” Bestelink and his crew are based in northern Botswana, one of the world’s last remaining wild places where lions, leopards, hyenas and hippos roam free, kill each other and struggle to protect their own.“They’re mothers, they’re fathers, they are families like you and I. They fight every day just to keep their offspring alive and to keep themselves and their entire families fed,” Bestelink told me during a visit to Chobe National Park, one of the shooting locations for the series.“Savage Kingdom” is a different kind of wildlife film ― in nearly every episode, something cute dies. A leopard cub you watch grow up for 40 minutes is in the wrong place at the wrong time. A young lion gets mauled to death by his overeager family members. An unfortunate warthog piglet becomes a quick snack.His crew at Natural History Film Unit Botswana, a ragtag family of conservationists from nearly every continent, have one mission in mind when they go out to film: tell the real story, avoid embellishment and don’t lie.It’s a rough task. The crew often spends weeks at a time out in the bush filming and they form strong bonds with the animals. Richard Uren, a lead cameraman for the series, said at times it feels like the filmmakers are basically “one of the pride” and lions will occasionally stroll up and nap in the shade of their trucks.But when an animal gets killed, especially one they’re attached to, the crew mourns.“You get to know these animals so well, we’ve watched them grow up,” Uren, more of a “leopard guy,” said. But the cameras keep rolling, and Bestelink (a “lion guy”) said it’s this stark reality, this unvarnished look that shows animals “in a way you’ll inherently respect.”“I think it’s important to make sure it’s honest and it’s real and it’s raw,” he said. “We try to make sure that part of that portrayal is it’s not all happy endings, it’s not Bambis and rainbows. We’re talking about revenge, we’re talking about jealousy, we’re talking about power [and] kingdoms. It’s something that anyone can understand.”And the location couldn’t be more harsh.Botswana is one of the few countries in Africa with self-managed wildlife populations that live in unfenced national parks. The country has become a haven for animals, so much so that some scientists have warned there may soon be too many elephants in the country for nature to support. About 130,000 now live within its borders, the most anywhere on the planet.But African wildlife has been having a rough time lately. Some 30,000 elephants and 1,200 rhinos are killed every year across the continent by poachers looking for a quick payday. And African lions face extinction by mid-century without fierce conservation efforts.Bestelink said the role of a project like “Savage Kingdom” is to get past these statistics and simply make people care about wildlife again. These animals are out there, they’re fighting to survive and the battle is hard enough without the added pressures of humanity.“We are slowly losing habitats, we are slowly losing environments, we are slowly losing our respect for these animals,” he said. “We just need to bring more people in and show them how important the natural world is, how important these lives are. People can really buy into that and actually give a shit, really care.”“Savage Kingdom” premieres on Nat Geo WILD Friday, Nov. 25 at 9 p.m. ET.The author traveled to Botswana as a guest of Nat Geo WILD."
48,POLITICS,Michelle Obama Greets The Official White House Christmas Tree For The Last Time,Paige Lavender,https://www.huffingtonpost.com/entry/michelle-obama-white-house-christmas-tree_us_5838647de4b09b6056007794,The fir is 19 feet tall.,2016-11-25,"The official White House Christmas Tree is delivered to the White House in Washington, D.C., on November 25, 2016. The 19-foot Douglas Fir was donated by a tree farm in Pennsylvania.",https://img.huffingtonpost.com/asset/58386745180000521230ff1d.jpeg?ops=scalefit_720_noupscale,"First lady Michelle Obama greeted the official 2016 White House Christmas tree on Friday.The tree is a 19-foot Douglas Fir, which was donated to the White House by a tree farm in Wisconsin and delivered on a horse-drawn cart.Obama was joined by first dogs Bo and Sunny, as well as two of her nephews. The two boys helped President Barack Obama during the official presidential turkey pardon on Thursday.The boys, who Obama joked were her “replacement kids,” said the tree was “great.”CORRECTION: This article previously said the tree farm that donated the White House tree was in Pennsylvania; it is in Wisconsin."
49,POLITICS,Michelle Obama Greets The Official White House Christmas Tree For The Last Time,Paige Lavender,https://www.huffingtonpost.com/entry/michelle-obama-white-house-christmas-tree_us_5838647de4b09b6056007794,The fir is 19 feet tall.,2016-11-25,The official White House Christmas Tree arrives at the White House in Washington.,https://img.huffingtonpost.com/asset/5838672f1a00000b03cc9c34.jpeg?ops=scalefit_720_noupscale,"First lady Michelle Obama greeted the official 2016 White House Christmas tree on Friday.The tree is a 19-foot Douglas Fir, which was donated to the White House by a tree farm in Wisconsin and delivered on a horse-drawn cart.Obama was joined by first dogs Bo and Sunny, as well as two of her nephews. The two boys helped President Barack Obama during the official presidential turkey pardon on Thursday.The boys, who Obama joked were her “replacement kids,” said the tree was “great.”CORRECTION: This article previously said the tree farm that donated the White House tree was in Pennsylvania; it is in Wisconsin."
