,category,headline,authors,link,short descr,date,image_caption(s),image_link(s),article
44,THE WORLDPOST,Bomb Kills At Least 10 In Upscale Shopping District In Pakistan's Lahore,"Mubashir Bukhari, Reuters",https://www.huffingtonpost.com/entry/lahore-pakistan-bomb-shopping-district_us_58af263ee4b060480e05c60e,A government spokesman said said the blast caused a huge crater and authorities were investigating the exact “nature and motives” of the blast.,2017-02-23,"Pakistani soldiers and policemen cordon off the site of a bomb attack in Lahore on February 23, 2017.",https://img.huffingtonpost.com/asset/58af28fa280000d59899ac97.jpeg?ops=scalefit_720_noupscale,"LAHORE, Pakistan, Feb 23 (Reuters) - A bomb blast in an upscale shopping center in Pakistan’s eastern city of Lahore killed at least 10 people on Thursday, a provincial government spokesman said, the latest attack in a surge of violence that has shaken the country.“It was a bomb blast with a huge sound impact that smashed the windows of almost all the buildings around,” said Punjab government spokesman Malik Mohammad Khan.He said the blast caused a huge crater and authorities were investigating the exact “nature and motives” of the blast. Punjab police spokesman Nayab Haider said the explosion was caused by a bomb that was detonated either remotely or by timer.Pakistan has been struck by a wave of militant attacks in recent weeks which have killed at least 130 people. One attack at a Sufi shrine in southern Sindh province killed 90 people.Rescue officials said security forces cordoned off the site of Thursday’s blast, in a residential neighborhood which also houses banks and coffee shops, after what one bank worker described as a frightening explosion.“We left the building and saw that the motor-bikes parked outside were on fire and all the windows in the surrounding buildings were shattered,” eyewitness Mohammad Khurram told Reuters.Reports of a second explosion in the city turned out to be a tire blow-out, a government official said.Thursday’s bombing was the second attack in Lahore in two weeks. A suicide bombing on Feb. 13 killed at least 13 people at a protest near the provincial assembly.Government and military officials have vowed to hunt down militants across the country and Pakistan’s border with Afghanistan has been shut down due to security concerns.After the shrine bombing, Pakistani security forces said they had killed more than 100 suspected militants in targeted campaigns across the country.(Writing by Saad Sayeed; Editing by Nick Macfie, Mehreen Zahra-Malik and Dominic Evans)"
45,IMPACT,There's A Bold New Plan To Make Ocean Trash A Thing Of The Past,Eleanor Goldberg,https://www.huffingtonpost.com/entry/un-environment-clean-seas-ocean-plastics_us_58adcc39e4b0d0a6ef470d42,Ten countries have already signed on.,2017-02-23,"Each year, 8 million tons of plastic ends up in the oceans. Such debris injures and kills fish and other marine life.",https://img.huffingtonpost.com/asset/58ae030f290000f616f282ad.jpeg?ops=scalefit_720_noupscale,"The way things are going now, our oceans will contain more plastic than fish by 2050. An ambitious United Nations campaign aims to stop this from happening.On Wednesday, UN Environment announced its #CleanSeas initiative at the Economist World Ocean Summit in Bali, Indonesia. The campaign focuses on two major sources of marine litter: single-use plastic bags and microplastics in cosmetic products. The goal is to eliminate these major sources of marine litter by 2022. “We’ve stood by too long as the problem has gotten worse,” Erik Solheim, head of UN Environment, said in a statement. “It must stop.”Each year, more than 8 million tons of plastic ends up in the oceans. Much of it can’t be broken down and will remain in the oceans for centuries. The debris injures and kills fish, seabirds and marine mammals. It also causes fish to be smaller and slower than those raised in clean water.There’s also a concern that it could be harmful for humans to consume fish that have ingested plastic, but more research needs to be done on the issue. Plastic pollution costs $8 billion in damage to marine ecosystems each year, according to UN Environment. Ten countries, which are considered pioneers in addressing the issue, have joined the #CleanSeas initiative. They include Indonesia, Uruguay, Belgium, Costa Rica and France. The United States hasn’t yet joined in.It’s up to the participating countries to find ways to reduce the amount of plastic being introduced to the oceans. Indonesia, for example, has committed to slashing its marine litter by 70 percent by 2025. Uruguay said it will tax single-use plastic bags later this year.Major companies are also getting involved.Dell Computers announced that its product packaging will incorporate plastic that has been fished out of the sea near Haiti.The UN also hopes to target the personal care industry’s use of microplastics, which are tiny plastic particles that are found in toothpaste and skin care products. In many cases these plastic beads have replaced natural ingredients. Waste treatment facilities don’t always trap microbeads after they’re flushed down the drain, allowing the beads to find their way into the oceans.“On bathroom shelves around the world sit products that are destroying life in our oceans,” actress and advocate Nadya Hutagalung said in a statement. “No beauty product is worth destroying the world’s beautiful oceans, not to mention our own human well-being.”"
46,IMPACT,There's A Bold New Plan To Make Ocean Trash A Thing Of The Past,Eleanor Goldberg,https://www.huffingtonpost.com/entry/un-environment-clean-seas-ocean-plastics_us_58adcc39e4b0d0a6ef470d42,Ten countries have already signed on.,2017-02-23,Uruguay is one of 10 countries that joined the UN Environment's #CleanSeas initiative by taxing single-use plastic bags.,https://img.huffingtonpost.com/asset/58ae0443280000db9899aa16.jpeg?ops=scalefit_720_noupscale,"The way things are going now, our oceans will contain more plastic than fish by 2050. An ambitious United Nations campaign aims to stop this from happening.On Wednesday, UN Environment announced its #CleanSeas initiative at the Economist World Ocean Summit in Bali, Indonesia. The campaign focuses on two major sources of marine litter: single-use plastic bags and microplastics in cosmetic products. The goal is to eliminate these major sources of marine litter by 2022. “We’ve stood by too long as the problem has gotten worse,” Erik Solheim, head of UN Environment, said in a statement. “It must stop.”Each year, more than 8 million tons of plastic ends up in the oceans. Much of it can’t be broken down and will remain in the oceans for centuries. The debris injures and kills fish, seabirds and marine mammals. It also causes fish to be smaller and slower than those raised in clean water.There’s also a concern that it could be harmful for humans to consume fish that have ingested plastic, but more research needs to be done on the issue. Plastic pollution costs $8 billion in damage to marine ecosystems each year, according to UN Environment. Ten countries, which are considered pioneers in addressing the issue, have joined the #CleanSeas initiative. They include Indonesia, Uruguay, Belgium, Costa Rica and France. The United States hasn’t yet joined in.It’s up to the participating countries to find ways to reduce the amount of plastic being introduced to the oceans. Indonesia, for example, has committed to slashing its marine litter by 70 percent by 2025. Uruguay said it will tax single-use plastic bags later this year.Major companies are also getting involved.Dell Computers announced that its product packaging will incorporate plastic that has been fished out of the sea near Haiti.The UN also hopes to target the personal care industry’s use of microplastics, which are tiny plastic particles that are found in toothpaste and skin care products. In many cases these plastic beads have replaced natural ingredients. Waste treatment facilities don’t always trap microbeads after they’re flushed down the drain, allowing the beads to find their way into the oceans.“On bathroom shelves around the world sit products that are destroying life in our oceans,” actress and advocate Nadya Hutagalung said in a statement. “No beauty product is worth destroying the world’s beautiful oceans, not to mention our own human well-being.”"
47,POLITICS,"This GOP Senator Is Weeding Out Democrats From His Events, Attendees Say",Marina Fang,https://www.huffingtonpost.com/entry/rob-portman-gop-town-hall_us_58aedc36e4b05ca474a10a89,Democrats say they were denied access to a speech by Sen. Rob Portman (R-Ohio).,2017-02-23,"About 100 protesters gathered outside the event that Sen. Rob Portman (R-Ohio) held on Wednesday, calling on him to hold President Donald Trump accountable.",https://img.huffingtonpost.com/asset/58aedc582900002100bea6d4.jpeg?ops=scalefit_720_noupscale,"The office of Sen. Rob Portman (R-Ohio) denied entry to Democrats at his event Wednesday in another instance of GOP lawmakers attempting to avoid protesters and contentious questions from constituents, attendees claim.Katie Finneran said she had planned to attend Portman’s speech at the Lincoln Day Dinner scheduled for Wednesday evening, but organizers informed her that morning that she would not be allowed to attend because she is a registered Democrat, according to the Columbus Dispatch. Several other attendees told the Toledo Blade that they were also barred and received refunds for their tickets.But Portman’s office denied the claims. “This story is false, neither Senator Portman nor his office controlled access to this event,” spokeswoman Emily Benavides said in an email. Justin Smith, chair of the Sandusky County GOP, which helped organize the dinner, told The Huffington Post that the private event “was purely a Republican fundraiser,” and organizers wanted to limit the potential for disruptions.“We wanted to show respect for the Senator,” Smith said. “We wanted a disruption-free event for Sen. Portman and the Republican faithful.”A local Republican official had earlier told the Dispatch that it was Portman’s office that decided to restrict access to the event. “It’s my personal opinion that these people should be allowed in,” said David Koehl, Seneca County Republican Party treasurer. “Portman and his office are afraid protesters will show up. They made this decision a week ago, but several people have been refunded on short notice.”Finneran, who said she identifies with the Green Party and voted for Sen. Bernie Sanders (I-Vt.) in last year’s Democratic presidential primaries, told the paper that her entire table was also barred from attending, after being told it was a private event and then paying $30 for a ticket.She said she was initially told she couldn’t attend because it was a private event, and only later did organizers inform her it was because of her political affiliation.Before the dinner, Portman held a roundtable discussion on the opioid crisis, which Finneran said she was also blocked from attending.“Just because Republicans are in power does not mean Republican citizens have more of a voice than Democratic citizens or even independent citizens or Green Party citizens or Libertarian citizens,” she said. “He represents everybody, not just the Republican Party.”Across the country, GOP lawmakers have been curtailing or avoiding public town halls, amid protests and raucous crowds. Activists have mocked their absence and held their own town halls instead. In Ohio, the liberal group MoveOn.org created a petition demanding that Portman hold a public town hall. Members invited him to its own town hall, but they said he declined.About 100 protesters gathered outside Portman’s event on Wednesday, calling on him to hold President Donald Trump accountable. Some demonstrators chanted, “Hey, Portman, we’re here! Come outside and face your fear.”Portman said at the event that it was “perfectly appropriate for them to be there and express their views.”“I am listening,” he added.This article has been updated with comment from Smith and Portman’s office."
48,ARTS & CULTURE,New Podcast To Explore Richard Simmons' Disappearance From The Public Eye,Jillian Capewell,https://www.huffingtonpost.com/entry/new-podcast-to-explore-richard-simmons-disappearance-from-the-public-eye_us_58adf787e4b01406012f5778,"The ""Sweatin' to the Oldies"" star hasn't made a public appearance in over two years.",2017-02-23,"Richard Simmons on a 1996 ""Cruise to Lose,"" which sailed through the Carribbean.",https://img.huffingtonpost.com/asset/58adff19280000db9899a9f9.jpeg?cache=878WHgJ023&ops=scalefit_720_noupscale,"“In February of 2014, Richard Simmons ghosted the world.”The words of filmmaker Dan Taberski, host of the new podcast “Missing Richard Simmons,” deftly sum up the mysterious radio silence from the effervescent fitness guru, as well as the impetus for Taberski’s audio project: a weekly podcast series in which he aims to connect once more with the “Sweatin’ to the Oldies” icon.What makes this venture more than just a news investigation is Taberski’s personal investment in the project. He was once a friend to Simmons, and a regular at the 68-year-old’s long-running exercise class in his Los Angeles studio Slimmons.Rumors swirled in 2016 that Simmons was being held hostage in his Hollywood home after two years had gone by without a peep from the typically extroverted celebrity. The news caused a stir, leading Simmons to assure fans that he was not in danger with a Facebook post on his personal page. The page is regularly updated in a cheery voice, encouraging followers to keep their spirits up and think healthy.Yet, listening to the podcast, we learn that everyone from decadeslong attendees of his class to close friends to fans across the country who leaned on him for support had long stopped hearing from Simmons. Taberski dutifully chronicles the many mysterious ways Simmons cut himself off from the public, even installing a security fence around the home where he once happily perched, waiting for vans of tourists looking for a famous face. The stories from the fans and friends paint a clear picture of the impact Simmons had long after his workout tapes became a VCR staple and the shockwaves his absence has left. Through these interviews, the podcast becomes a meditation on public figures, their obligation to their fans, and whether one can truly disappear.Who knows where Taberski’s investigation will lead — could an audio plea and renewed widespread interest in the star be the thing to lure him out once more? — but the journey is fascinating thus far.Subscribe to “Missing Richard Simmons” on iTunes."
49,POLITICS,A Girl Named Ehlena And A Dog Named Wonder Win At U.S. Supreme Court,"Andrew Chung, Reuters",https://www.huffingtonpost.com/entry/a-girl-named-ehlena-and-a-dog-named-wonder-win-at-us-supreme-court_us_58ae505fe4b05ca474a0a9c2,The justices ruled 8-0.,2017-02-23,"Ehlena Fry and her trained service dog, Wonder, are shown in this handout photo provided by the American Civil Liberties Union. Family photo, courtesy ACLU",https://img.huffingtonpost.com/asset/58ae5267280000d59899aadf.jpeg?ops=scalefit_720_noupscale,"The U.S. Supreme Court on Wednesday sided with a disabled Michigan girl whose school refused to let her bring her service dog to class, making it easier for students like her to seek redress for discrimination in federal court.The justices ruled 8-0 that Ehlena Fry, 13, and her parents may not be obligated to go through time-consuming administrative appeals with the local school board before suing for damages for the emotional distress she said she suffered by being denied the assistance of her dog, a goldendoodle named Wonder.Ehlena was born with cerebral palsy, a neurological condition that severely limited her mobility. Wonder was trained to help her balance, retrieve dropped items, open and close doors, turn on lights, take off her coat and other tasks.“I saw with my own eyes how Wonder helped my daughter grow more self-reliant and confident,” Stacy Fry, Ehlena’s mother, said in a statement. “We are thankful that the Supreme Court has clarified that schools cannot treat children with disabilities differently or stand in the way of their desired independence.”The justices sent the case back to a lower appeals court to determine whether Ehlena’s complaint involves the impermissible denial of a proper special education.The dispute arose in 2009 when Ehlena’s elementary school in Napoleon, Michigan refused to allow her to attend school with Wonder. The school said she already had a one-on-one human aide, as part of her individualized special education program.The family eventually moved to a different school district where Wonder was welcomed. They filed suit in 2012 in federal court, claiming discrimination under the federal Americans with Disabilities Act, which permits service dogs in public institutions.The American Civil Liberties Union, which represented the family, said the ruling will remove unfair legal hurdles for victims of discrimination that prevent students from seeking justice guaranteed by the Americans with Disabilities Act.Napoleon Community Schools Superintendent Jim Graham said he had no comment.Ehlena and her parents sued the school district seeking money damages for emotional harm, claiming the school deprived Ehlena of her independence, including in intimate settings such as the bathroom.Wednesday’s ruling overturned a 2015 decision by the 6th U.S. Circuit Court of Appeals in Cincinnati, Ohio upholding a dismissal of the lawsuit. The appeals court had said that under the Individuals with Disabilities Education Act (IDEA), a federal law governing special education, the family had to exhaust all of the administrative hearings in its service dog dispute with local and state officials before filing suit.Writing for the court on Wednesday, Justice Elena Kagan said that if the substance of a lawsuit does not claim the denial of a proper special education under IDEA, then exhausting the administrative remedies is not required."
