,category,headline,authors,link,short descr,date,image_caption(s),image_link(s),article
19,THE WORLDPOST,"Trump’s Apprenticeship Program Is A Good Thing, But He Should Remember These Cautionary Tales","Nancy Hoffman, ContributorSenior Adviser, Jobs for the Future",https://www.huffingtonpost.com/entry/trump-apprenticeship-program_us_59499b61e4b0177d0b8a4229,"Companies may agree with Trump’s executive order, but if their employees aren't also committed to students, it won't work.",2017-06-21,C-Town Tech students participate in an IT pathway program at their high school. ,https://img.huffingtonpost.com/asset/5949f32b1500001f008ff65c.png?ops=scalefit_720_noupscale,"MUNICH ― Last week, U.S. President Donald Trump launched a series of events for “workforce development week,” the centerpiece of which was a new executive order focused on expanding apprenticeship. So what is President Trump up to? I will avoid temptation to remind readers at any length why he likes apprenticeship. “College, except without the debt,” as former U.S. Secretary of Labor Thomas Perez called apprenticeship, can be a major boon to young Americans as well as older workers wanting to upskill or change careers. In principle, Trump’s commitment to expanding apprenticeship is a good thing, but some context is useful.Learn-and-earn approaches to education and training, as they are often called, engage employers in supporting the training of a new pipeline of workers. The best approaches and those promoted by the Department of Labor during the Obama administration, combine structured learning in a workplace with credit-bearing community college course-taking so that a student arrives at completion of the apprenticeship not just with job-related skills but with a useable transferable credential as well. In a nutshell, the best apprenticeship programs last several years, wages are paid by the employer, and the ‘student’ learns both on the job and in the classroom.While the image of apprenticeship in the United States is often associated with labor unions and blue collar work, today’s apprentices are training for the insurance industry (see Harper College in Illinois and the Swiss commercial insurance firm Zurich), or for cybersecurity where jobs at $45 an hour go begging (see Tidewater Community College and Yorktown-based Peregrine Technical Solutions, LLC in Virginia, which launched a registered cybersecurity program in fall 2016).Given a variety of economic and social forces roiling the U.S. today ― slowing productivity, underemployment, inequity of opportunity and unstable jobs ― apprenticeship can give workers and learners a leg up in the labor market while slowing the complaints of employers that workers don’t have the training and experience they need to fill their entry-level positions. After all, there’s not much an aspiring worker can do with the puzzle of needing to get experience to get a job and needing a job to get experience. Apprenticeship when done right is a win for all. In fact, my organization, Jobs for the Future, or JFF, just launched a Center for Apprenticeship and Work-Based Learning because we believe that the time is right to spread proven and promising practices and to assist those doing so. Most important in the future of apprenticeship is that opportunities expand into new areas such as health care, information technology and financial services. The Pathways to Prosperity Network, a collaboration between JFF and the Harvard Graduate School of Education, lays the foundation for these new fields by creating career-focused pathways starting in high school. SAP, the German software company, for example, is sponsoring C-Town Tech, a pathway at Boston’s Charlestown High School partnered with the local Bunker Hill Community College, where students begin college level IT courses as early as 10th grade and are well-positioned for apprenticeships and internships in the immediate future. My expertise is in the best of European vocational training for youth, especially the dual system countries ― Switzerland, Germany, Austria and the Netherlands. In those countries, starting at age 16, young people of a wide variety of academic talents and inclinations choose a mix of school and work, which turns out to be a more appealing way for a teenager to live his or her life than sitting in an academically-oriented classroom. In fact, I’m writing from Munich and am on my way to the CEMETS (Center on the Economics and Management of Education and Training Systems) Summer Institute at Eidgenössische Technische Hochschule Zurich, an international gathering on apprenticeship where teams from Seattle, Denver, Nepal, Benin and Chile, among others, will be studying the Swiss system and visiting apprenticeship sites with an eye toward adaptation of the Swiss system for their 16 through 19-year-olds.That President Trump sees apprenticeship and work-based learning as ways to expand opportunity for American workers is a good thing. That he put expansion under the rubric of deregulation is a mixed bag. Even the most ardent supporters of registered apprenticeship see the state and federal set of regulations that currently come along with quality control as overly complex and thus discouraging to some employers who would engage. If Trump’s review makes current regulations less bureaucratic while maintaining standards that ensure that workers get good training from skilled workplace and college teachers, then the approach will be a plus. Under the existing registered apprenticeship programs, some over 87 percent of apprentices are employed after completing training at an average starting wage of about $60,000. With around 500,000 registered apprenticeships in the U.S., this form of training has a high return on investment for workers and employers.It is worth noting that registration is not now required at all to run a homegrown apprenticeship program or learn-and-earn program. Many high schools and community colleges partner with employers to do just that. For example, Bunker Hill Community College, two stops away from my office in Boston, runs a great learn-and-earn program initiated by the Massachusetts Competitive Partnership in 2012. Today, over 100 students a semester are working 16 to 40 hours a week at $15 an hour in Boston’s major corporations and financial institutions. Many go on to work in their internship companies or get a 4-year degree. The quality of such a program is high because academic faculty and employers together agree to the curriculum, and jobs put students in situations where they are challenged to learn as well as contribute to productivity. The president’s order ― with few details yet available ― would provide financial support to a wider range of employer and training applicants than currently and appears to be favoring allowing Pell grants, which support low-income undergraduates, to go to students whether in an accredited program or not. Here’s where the problem lies. In the U.S., we have a history of problematic results from for-profit career education providers. Perhaps best known is the recent demise of Corinthian Colleges Inc, which filed for bankruptcy after defrauding many students. Weak programs prey on poorly informed consumers who too often end up in debt and without the promised credentials and jobs. The most sobering examples come from outside America. Both Australia and England have histories of apprenticeship. Australia’s system was long considered a beacon and interested edu-tourists made pilgrimages to see it. I wrote about it in my 2011 book Schooling in the Workplace. But when the Australian training market was deregulated, private providers took advantage of government funds to mount programs leading nowhere. Now the federal government has had to step in with huge fines to stem the rampant abuse that allowed students to borrow heavily and land in heavy debt without the skills required for a job.In England, the problem was different. Apprenticeship was not closely tied to educator partners so employers simply used the funds as they pleased, often to “train” current employees rather than new ones. As we say about good apprenticeship programs, students or trainees “own” their skills and can sell them in the marketplace. Apprentices are educated specifically enough to enter an occupation, but not so specifically that they are “owned” by a company and its particular needs. In 2015, the United Kingdom government published its plans to expand to around 5 million apprenticeships by 2020 and to make this strategy a pillar for developing the nation’s skills. Just a quick look at how the rollout was messaged reveals that “quality quality quality” is at the forefront of the reform.These are cautionary tales. In his announcement, Trump all but declared that employers know best what they need by way of training. While that may be true about their company needs, the same cannot be said for all employers’ commitment to students’ needs. The key will be to ensure that all apprenticeships and work-based learning programs supported through the new effort continue to meet the same high standards as currently provided through registered apprenticeship and accredited college employer collaborations. Let’s keep an open mind, but let’s also remember that a growing number of students have become savvy about the trail of bankruptcy and debt from for-profit providers. So have the attorney generals. And, of course, Trump has to deliver the dollar. That, too, remains questionable. "
20,WOMEN,Thousands Mourn Nabra Hassanen At Funeral Prayer Service In Virginia,Carol Kuruvilla,https://www.huffingtonpost.com/entry/thousands-mourn-nabra-hassanen-at-funeral-prayer-service-in-virginia_us_594aa48fe4b0312cfb60e0e1,“May Allah ... make her legacy of loving and caring to be a legacy that is carried for generations to come.”,2017-06-21,"The hearse carrying Nabra Hassanen, who was killed Sunday on her way back to an overnight event at the All Dulles Area Muslim Society, arrives at the Sterling Cemetery where she will be laid to rest in Sterling, Virginia, on June 21.",https://img.huffingtonpost.com/asset/594acf6515000020008ff867.jpeg?ops=scalefit_720_noupscale,"Nabra Hassanen was laid to rest Wednesday, after a funeral service at her mosque where she was remembered as a bright, generous and energetic young woman. Thousands of mourners attended the Islamic prayer service, called a Janazah, at the All Dulles Area Muslim Society mosque in Sterling, Virginia.Before the prayer, the mosque’s Imam Mohamed Magid spoke of how this was the most difficult funeral he had ever presided over.″[Hassanen was] so loved by so many people,” Magid said, standing in front of a crowded room in the mosque’s main hall. “May Allah (Subhanahu Wa Ta’ala) make her legacy of loving and caring to be a legacy that is carried for generations to come.”Magid described how just hours before her death, the 10th grader was hosting an iftar, or evening meal, for her friends at her home. “That’s how generous she was,” Magid said. Magid also said he believed that those who lost their lives to violence in the way that Hassanen did would enter paradise, “with not any questions asked.” “May Allah (Subhanahu Wa Ta’ala) compensate her for the frightening, for the fear she had before she died,” Magid added. “Because Allah (Subhanahu Wa Ta’ala) on the day of judgment brings security for people who have felt insecure in this life.” The 17-year-old girl was killed early Sunday morning, while walking back to ADAMS after eating a pre-dawn suhoor meal with her friends at a local IHOP restaurant. A male driver who was passing by reportedly got into a confrontation with the group. The suspect exited the car, chased Hassanen down, assaulted her with a bat, and then kidnapped her. Investigators later found her body in a nearby pond.Fairfax County Police have charged 22-year-old Darwin Martinez Torres, an El Salvadorian national, in her death. Police have said that there was no indication that the killing was a hate crime. Instead, police believe Hassanen was a victim of a “road rage” incident.Hassanen’s parents, and Muslim rights groups, are skeptical about the claim that the teen wasn’t targeted for her faith.Mohmoud Hassanen Aboras, Nabra’s father, is convinced that the teen was attacked because she was visibly identifiable as a Muslim. The young woman was wearing a headscarf and an abaya (a long traditional robe) on the morning she was killed.Her father told The Guardian that the suspect “killed my daughter because she is Muslim. That’s what I believe.”Ibrahim Hooper, a spokesman for the Council on American-Islamic Relations, believes there is a strong possibility that the crime was linked to Hassanen’s faith.“You can’t just say, ‘Oh, [the suspect] didn’t say anything against Islam, so no hate crime,’” Hooper told The Associated Press.CAIR is representing the teenager’s family and has pledged to watch the investigation closely to “ensure a thorough examination of any possible bias aspects of the case,” CAIR National Litigation Director Lena Masri said. At ADAMS mosque on Wednesday afternoon, Magid encouraged his community to remain strong and resilient ― particularly the young people in the community who knew Hassanen well and have been deeply affected by the crime.“We have to always encourage our youth not to have them get frightened or scared,” Magid said. “I want our youth to be in this [mosque]. This [mosque] is open for them.” The Associated Press estimates that about 5,000 people showed up at the mosque to show their support for Hassanen and her family.The burial will be followed by a public vigil at Lake Anne Plaza in Reston, Hassanen’s hometown. Magid and Fairfax Police Chief Edwin C. Roessler Jr. will be attending the vigil, according to the AP. Vigils honoring Hassanen also took place across the nation, in cities like New York, Boston, Philadelphia, Detroit, Los Angeles and Washington, D.C.Scroll down to see images from vigils honoring Hassanen’s life below."
21,WOMEN,Thousands Mourn Nabra Hassanen At Funeral Prayer Service In Virginia,Carol Kuruvilla,https://www.huffingtonpost.com/entry/thousands-mourn-nabra-hassanen-at-funeral-prayer-service-in-virginia_us_594aa48fe4b0312cfb60e0e1,“May Allah ... make her legacy of loving and caring to be a legacy that is carried for generations to come.”,2017-06-21,"A photo of Nabra Hassanen, from a<a href=""https://www.launchgood.com/project/for_nabra#/"" target=""_blank"" role=""link"" class="" js-entry-link cet-external-link"" data-vars-item-name="" LaunchGood page "" data-vars-item-type=""text"" data-vars-unit-name=""594aa48fe4b0312cfb60e0e1"" data-vars-unit-type=""buzz_body"" data-vars-target-content-id=""https://www.launchgood.com/project/for_nabra#/"" data-vars-target-content-type=""url"" data-vars-type=""web_external_link"" data-vars-subunit-name=""article_body"" data-vars-subunit-type=""component"" data-vars-position-in-subunit=""4""> LaunchGood page </a>created to raise funds for her family.",https://img.huffingtonpost.com/asset/594746a415000021004e6f7a.png?cache=Ai5bxAe1aH&ops=scalefit_720_noupscale,"Nabra Hassanen was laid to rest Wednesday, after a funeral service at her mosque where she was remembered as a bright, generous and energetic young woman. Thousands of mourners attended the Islamic prayer service, called a Janazah, at the All Dulles Area Muslim Society mosque in Sterling, Virginia.Before the prayer, the mosque’s Imam Mohamed Magid spoke of how this was the most difficult funeral he had ever presided over.″[Hassanen was] so loved by so many people,” Magid said, standing in front of a crowded room in the mosque’s main hall. “May Allah (Subhanahu Wa Ta’ala) make her legacy of loving and caring to be a legacy that is carried for generations to come.”Magid described how just hours before her death, the 10th grader was hosting an iftar, or evening meal, for her friends at her home. “That’s how generous she was,” Magid said. Magid also said he believed that those who lost their lives to violence in the way that Hassanen did would enter paradise, “with not any questions asked.” “May Allah (Subhanahu Wa Ta’ala) compensate her for the frightening, for the fear she had before she died,” Magid added. “Because Allah (Subhanahu Wa Ta’ala) on the day of judgment brings security for people who have felt insecure in this life.” The 17-year-old girl was killed early Sunday morning, while walking back to ADAMS after eating a pre-dawn suhoor meal with her friends at a local IHOP restaurant. A male driver who was passing by reportedly got into a confrontation with the group. The suspect exited the car, chased Hassanen down, assaulted her with a bat, and then kidnapped her. Investigators later found her body in a nearby pond.Fairfax County Police have charged 22-year-old Darwin Martinez Torres, an El Salvadorian national, in her death. Police have said that there was no indication that the killing was a hate crime. Instead, police believe Hassanen was a victim of a “road rage” incident.Hassanen’s parents, and Muslim rights groups, are skeptical about the claim that the teen wasn’t targeted for her faith.Mohmoud Hassanen Aboras, Nabra’s father, is convinced that the teen was attacked because she was visibly identifiable as a Muslim. The young woman was wearing a headscarf and an abaya (a long traditional robe) on the morning she was killed.Her father told The Guardian that the suspect “killed my daughter because she is Muslim. That’s what I believe.”Ibrahim Hooper, a spokesman for the Council on American-Islamic Relations, believes there is a strong possibility that the crime was linked to Hassanen’s faith.“You can’t just say, ‘Oh, [the suspect] didn’t say anything against Islam, so no hate crime,’” Hooper told The Associated Press.CAIR is representing the teenager’s family and has pledged to watch the investigation closely to “ensure a thorough examination of any possible bias aspects of the case,” CAIR National Litigation Director Lena Masri said. At ADAMS mosque on Wednesday afternoon, Magid encouraged his community to remain strong and resilient ― particularly the young people in the community who knew Hassanen well and have been deeply affected by the crime.“We have to always encourage our youth not to have them get frightened or scared,” Magid said. “I want our youth to be in this [mosque]. This [mosque] is open for them.” The Associated Press estimates that about 5,000 people showed up at the mosque to show their support for Hassanen and her family.The burial will be followed by a public vigil at Lake Anne Plaza in Reston, Hassanen’s hometown. Magid and Fairfax Police Chief Edwin C. Roessler Jr. will be attending the vigil, according to the AP. Vigils honoring Hassanen also took place across the nation, in cities like New York, Boston, Philadelphia, Detroit, Los Angeles and Washington, D.C.Scroll down to see images from vigils honoring Hassanen’s life below."
22,WORLD NEWS,French Police Discover Weapons Cache In Home Of Champs Elysees Attacker,,https://www.huffingtonpost.com/entry/champs-elysees-attack-investigation_us_5948fea1e4b0cddbb0093ae8,"The suspect was also carrying in his car an assault rifle, two pistols, ammunition and two large gas canisters when he rammed a police convoy.",2017-06-20,A masked French policeman secures the area on the Champs Elysees avenue after the incident in Paris on Monday.,https://img.huffingtonpost.com/asset/5948ff67210000f01b33d0de.jpeg?cache=4qhbHZytOn&ops=scalefit_720_noupscale,"PARIS (Reuters) - A man who rammed a car into a police van in Paris stored a cache of weapons at his home and held a gun permit despite being on a secret service list of people linked to radical Islam, police sources and French officials said on Tuesday.A judicial source said investigators were compiling an inventory of the arms and equipment found in the 31-year-old’s home. The man, who died in the attack, was also carrying in his car an assault rifle, two pistols, ammunition and two large gas canisters when he rammed a police convoy on Monday.Prime Minister Edouard Philippe said the individual first received a permit to possess a gun before he was flagged to intelligence agencies as a potential militant threat. At the time there was no reason to deny him the permit, Philippe said.Philippe said it was “quite possible” the license was active at the time the attacker was on a security watchlist. Three sources close to the investigation confirmed it was.“Nobody can be happy, and certainly not me, that someone who has been flagged to security agencies can continue to benefit from such an authorization,” Philippe told BFM TV.The man was placed on France’s so called ‘Fiche S’ watchlist after he was found to belong to a radical Islamist movement, two police sources said.Individuals on the list are placed under surveillance though the intensity of that surveillance varies depending on the perceived threat the individual poses."
23,WORLD NEWS,Otto Warmbier's Family And Friends Remember Student With The 'Biggest Heart Of Anyone',Nick Visser,https://www.huffingtonpost.com/entry/otto-warmbier-family-friends_us_5948a3e4e4b07499199e1c22,"He felt like ""everyone's friend.""",2017-06-20,"Otto Warmbier, imprisoned for 17 months in North Korea, died a few days after returning to the United States in a state of ""unresponsive wakefulness.""",https://img.huffingtonpost.com/asset/5948a6691600002100116feb.jpeg?cache=yXYfQx8RBM&ops=scalefit_720_noupscale,"Those who knew Otto Warmbier, who died Monday following a 17-month imprisonment in North Korea, remember the former University of Virginia student as a man with a big heart and an even bigger spirit of adventure, according to comments from friends, family and former teachers.“I never saw him in a bad mood,” Danica White, Warmbier’s high school English teacher in Wyoming, Ohio, told HuffPost. “He is the epitome of the kind of student wanted in a classroom.”“Otto had the biggest heart of anyone I knew,” she continued, saying her former pupil would be “dearly missed.”Sallee Ann Ruibal, a former classmate of Warmbier’s who graduated with him from Wyoming High School, wrote about his “nondiscriminatory friendliness” and “unending charisma.” She said Warmbier felt like “everyone’s friend,” a man who would go out of his way to be kind.“He was a person who deserved to be talked about in the same exuberant, personal way he talked about others,” Ruibal said. “It saddens me that a terrible regime damaged an essential part of Otto ― his brain.”On Monday afternoon, Warmbier’s parents, Fred and Cindy, announced their 22-year-old son had died just days after he was released by the North Korean government and flown back to the United States in a state of “unresponsive wakefulness” following a severe brain injury.Warmbier was serving a 15-year sentence of hard labor after he was arrested for stealing a propaganda poster on a group tour in early 2016.Doctors and diplomats have said they are unsure what happened to the student inside the reclusive nation, although one official has said Warmbier may have been subject to brutal beatings (doctors, however, have found no sign of broken bones). North Korea has said his injury was the result of a mix of sleeping pills and a case of botulism and not ill treatment, although doctors have also said there was no evidence of that either.The Warmbiers described their son in a statement following his death as a “warm, engaging, brilliant young man whose curiosity and enthusiasm for life knew no bounds.”“We choose to focus on the time we were given to be with this remarkable person,” they said. “You can tell from the outpouring of emotion from the communities that he touched ― Wyoming, Ohio, and the University of Virginia, to name just two ― that the love for Otto went well beyond his immediate family.”The University of Virginia, where Warmbier was student when he was arrested, said he would be “missed by all those who knew him.”“In particular, I know that Otto’s classmates and faculty feel a tremendous sense of loss, and he will always be an important member of the McIntire Class of 2017,” Carl Zeithaml, dean of UVA’s McIntire School of Commerce, said in a statement. “Our thoughts and prayers are with his family and all who knew this wonderful young man.”In his high school salutatorian speech in 2013, Warmbier spoke about his affinity for the TV sitcom “The Office” and described living in a small town where everyone knew everyone else and their “deep secrets and failed relationships.” But to the 123 students he spoke to, he also described a community where friendship was paramount and reruns of good times spent together would carry them through the future.“We know where everyone is going next year, we know where everyone has come from ... we know each other’s family, we know each other’s friends, we know each other’s siblings,” Warmbier said. “We know when someone is struggling, and we come together as a class to make things better.”"
