,category,headline,authors,link,short descr,date,image_caption(s),image_link(s),article
0,POLITICS,On The Ground Of Standing Rock,"Zen L. Honeycutt, ContributorMoms Across America Executive Director",https://www.huffingtonpost.com/entry/on-the-ground-of-standing-rock_us_583b2429e4b0a79f7433b78a,"The day after Thanksgiving, the Army Corps of Engineers gave an eviction notice, December 5, 2016, to the largest gathering",2016-11-27,<p>Thanksgiving Day prayer at Turtle Rock ancestral burial grounds.</p>,https://img.huffingtonpost.com/asset/583b2b601700001b00e7c735.jpg?ops=scalefit_720_noupscale,"The day after Thanksgiving, the Army Corps of Engineers gave an eviction notice, December 5, 2016, to the largest gathering of Native Americans and supporters in recorded history. Concerns for escalated violence are high.On Sunday, November 20, 2016, I experienced first hand the intense pain of tear gas as I supported an event at a barricade on the bridge by Oceti Sakowin Camp. I saw hundreds of people being doused with water by a water cannon on top of a military vehicle and dozens more doused with fire hoses in below-freezing temperatures as they protected their campfire which was built to prevent them from getting hypothermia. All around me and before me, dozens were shot with rubber bullets, compression grenades, and countless more were sprayed with mace by the Morton County Police. Throughout the twelve hour, overnight confrontation, I also witnessed extraordinary acts of restraint and commitment. An elder chanted and stepped side to side in prayer for hours despite being repeatedly sprayed with freezing water. Native American men rushed through tall grasses on the riverside to put out fires started by the tear gas grenades with their own bodies. Water protectors chanted ""Mni Wiconi, Water is Life!"" repeatedly, despite having their sisters shot in the head and their men shot in the groin with rubber bullets beside them. My heart broke, however, when I saw the young adults who formed a human wall for hours to protect their campfire, fall to the ground when the police shot them with rubber bullets. Later, I learned a young woman had her arm amputated after the damage done by a compression grenade. Another young woman has lost the use of her eye. 40 people were arrested the day after Thanksgiving at a peaceful prayer event, the total count is well over 400, for exercising their right of free speech. The police brutality at Standing Rock has shocked the world and yet the greed of the corporations, who will stop at nothing to increase their profits, surprises no one. Americans are realizing that the new patriotism is not to blindly chant how great America is, but to speak up, show up, and stand up to the horrific tragedies our government is willfully causing.Today, ten thousand strong people are at the main camp, Oceti Sakowin in Standing Rock, North Dakota. Never before has there been such a gathering to stop a pipeline, not only in the terms of sheer numbers of people but the significance of people as well. Groups from all over the world, including Japan, New Zealand, Hawaii, and over 300 indigenous tribes, many of them sworn enemies, have come together peacefully to pray and stop the Dakota Access Pipeline. Pipelines are nothing new. 72,000 miles of crude oil pipelines cross rivers and residential areas across the USA. This pipeline, however, gained national interest when LaDonnah Brave Bull Allard and seven Sioux Nation Native Americans noticed that the pipeline was re-routed from a white neighborhood above Bismark to their treaty land. The pipeline would go beneath the Missouri River and near seven different points of water, above their reservation, and through ancestral burial grounds. The pipeline has never gone through the proper environmental or cultural assessments and was never given permission to go through the Sioux nation 1851 Fort Laramie treaty land, which is being cared for by the Army Corps of Engineers. When LaDonnah made the request for support to help stop the pipeline she ""thought maybe forty people would show up."" Instead, thousands are flocking to the site, raising awareness with international media. Non-native and native alike are selling their homes to move to Standing Rock in solidarity. Florence, Cheyenne Sioux River mother of Kalen, a 17-year-old young man who was one of the original seven campers at Sacred Stone Camp in Standing Rock said, ""We should listen to our young people more. My son and six others began this with silent prayer and signs. That's it. They always intended this to be prayerful, not violent."" The reports of demonstrations escalating to violence have not deterred supporters, however, arrivals with women and children are only increasing.Their fervor is warranted. The Missouri River is upstream from 20 million people who stand to have their main water source polluted beyond repair. Dallas Goldtooth stated, ""It is not a matter of if, but when the pipeline will break."" The website DAPLLies.com clearly shows the devastating impact that oil spills have on the health of the people downstream: tumors, leukemia, miscarriages and more. Over 300 pipeline breaks are recorded each year, spilling over 300 million gallons of oil into water and land, causing billions of dollars of clean up and years of toxic pollution. John Bolenbaugh, producer of DAPLLies stated Wednesday night at Standing Rock, ""The same companies who create the pipelines are also the same companies hired to clean up the spills, with federal funding, so they often ignore the reports of cracks in pipelines for years and wait for them to break. Then they cut corners, instead of cleaning up the oil. They cover the spills with mesh and grass seeds.""The majority of the people flocking to Standing Rock or donating ten, twenty or a hundred dollars are not driven only by the above atrocities. There is a deeper drive of injustice. Millions of Americans have realized over the past few years, that corporations are bullying and bribing our government to put the profits of corporations before the wellbeing of our children and citizens. We live in a nation that puts wealth before health. The result is a country full of sick children, ailing loved ones and angry citizens. Pennsylvania mother Zoe Swartz said of GMOs and pesticides on our food, sprayed with chemical cocktails which contain petroleum, ""A chemical company's right to make a profit in no way surpasses a mother's right to protect her child."" Apparently, Obama and the Governor of North Dakota do not agree, however. With one phone call, either of them could stop the pipeline and police brutality, which is happening at Standing Rock.To find out more about Standing Rock or to donate go to www.ocetisakowincamp.org. To learn more about DAPLLies and oil spills go to www.helppa.org. Contact zen@momsacrossamerica.org www.momsacrossamerica.org."
1,POLITICS,Afghanistan Is All Ready To Be Donald Trump's First Foreign Policy Disaster,David Wood,https://www.huffingtonpost.com/entry/afghanistan-war-taliban_us_581cb5aee4b0d9ce6fbb71ff,The next president has tough choices to make as Taliban forces push forward.,2016-11-27,"U.S. military advisers link up with Afghan security forces near Tarin Kowt, where there has been sustained fighting with Taliban insurgents.",https://img.huffingtonpost.com/asset/581cc557150000d804531c0f.jpeg?cache=nde9fDawkU&ops=scalefit_720_noupscale,"Afghanistan is failing. Fifteen years after the United States first scattered the Taliban with high-altitude bombing, the battlefield gains achieved by tens of thousands of U.S. troops are in jeopardy from a resurgent Taliban. The United States has spent $115 billion on this longest war in its history. The conflict has taken the lives of 1,865 Americans and wounded 20,224 (as of Nov. 16), many with life-shattering injuries. Yet the main goals set forth by Presidents George W. Bush and Barack Obama haven’t been achieved: Afghanistan does not have a stable, working democracy and terrorists still find a safe haven there.Even stalwart defenders of the U.S. intervention, such as Vice President Joe Biden, now seem deeply concerned.But few people in the U.S. are paying attention.The 15th anniversary of the start of the war passed last month almost without notice. The stark choices facing President-elect Donald Trump ― more troops? more money? withdrawal? ― received no attention in the presidential campaign, an ill omen for the months ahead when careful and considered action will be needed.And time is short.Major cities across Afghanistan are under siege by the Taliban and other Islamic extremist militias, which are steadily taking more territory.In their path, the U.S. has some 7,000 U.S. troops training and advising Afghan forces, and another 6,000 mostly special forces members engaged in counter-terrorism operations.  Last week, two soldiers from the 1st Cavalry Division ― Sgt. John W. Perry, 30, of Stockton, California, and Pfc. Tyler Iubelt, 20, of Tamaroa, Illinois ― were killed by a suicide bomber at Bagram, the main U.S. military base in Afghanistan. Two American contractors, not identified by the Defense Department, died as well, and 17 people were wounded. Also at risk are tens of thousands of Afghans, especially women and children, who have relied on the U.S. commitment to help safeguard what progress they have made in self-government, human rights and education. In growing violence, 30 people were killed Monday and more than 70 injured in a bomb blast at a Kabul mosque. The Islamic State claimed responsibility.Little is known about Trump’s views on Afghanistan, although he has suggested that building schools there is a waste of money. In his most detailed comments, he declared in 2012 that the U.S. intervention is “a total and complete disaster.”It likely will be months before the Trump White House can shift from such criticism toward a coherent strategy for Afghanistan.The Afghan military and police have been unable to reverse the insurgents’ gains, despite the $68 billion spent by the U.S. trying to build up the country’s security forces. The Afghan army loses a third of its soldiers every year between battle casualties, desertions and those who decline to re-enlist. Officials reportedly pocket the pay of legions of non-existent “ghost soldiers.”The Taliban “continue to expand their influence,” the Pentagon acknowledged this fall. U.S. Army Gen. John Nicholson, the senior commander in Afghanistan, told reporters in July that the overstretched Afghan army has basically conceded parts of the country to the Taliban.The most recent data provided by the Pentagon to the U.S. Special Inspector General for Afghanistan Reconstruction show that among the country’s 407 districts, the number controlled by the government slipped from 267 in May to 258 in August. The Taliban controls only eight districts and influences another 25, according to the Pentagon data. But a new independent analysis found worse news: The Taliban actually controls or influences 97 districts, up from 70 a year ago.It is from these districts that insurgents have been able to launch serious and continuing assaults on five provincial capitals: Kunduz in the north, Maimana in the northwest, Tarin Kowt in the southeast, Farah city in the west and Lashkar Gah in the south.The northeast city of Gormach, a vital post on the strategic Ring Road that links a number of major cities, was overrun this fall. Kunduz, where U.S. and allied troops spent years training security forces and helping stabilize the local economy and government, has been overrun twice. This fall, hasty reinforcements of Afghan special forces in Kunduz and Lashkar Gah, aided by U.S. airstrikes and U.S. special forces, narrowly beat back determined Taliban attacks. Rebel forces remain on the outskirts of those cities and sporadic fighting continues.And in the western city of Mazar e-Sharif, site of a major German and U.S. military base, the German consulate was hurriedly evacuated last week after Taliban fighters attacked with a massive truck bomb, killing four Afghans and wounding 128. Local corruption, ethnic squabbling and inept officials have eroded the population’s faith in their government and effectively provided the Taliban with safe bases from which to continue their attacks, according to an analysis by two U.S. Army officers who served in Kunduz.The latest Taliban gains, even if temporary, have further shaken the people’s trust. Forty-two percent of Afghans say security is worse than it was under Taliban rule in the 1990s, according to the latest United Nations report. The number of refugees fleeing to Europe has increased 83 percent this year.As the war grinds on, violence has intensified to horrifying levels and civilians are increasingly the victims. The new Afghan air force alone is responsible for a 72 percent increase in civilian casualties since 2015, the U.N. said. Suicide bomb blasts in July, also the work of Islamic State terrorists, killed 85 peaceful demonstrators and injured 413, in what the U.N. called the single most deadly incident in the country since 2001. And the number of dead and injured children has risen 15 percent this year, as the Taliban has attacked schools and health clinics.“For God sake, don’t kill innocent Afghans,” an elderly widow from Kunduz, Bibi Gul, told the Pajhwok Afghan News. She had lost her 35-year-old son in the fighting. Stop the war, she begged, “or kill us all together to end our plight forever.”People are scared, said Patricia Gossman, senior Afghanistan analyst for Human Rights Watch. “There are gains [by the Taliban], and now the attitude is, ‘We have to push them back regardless of the cost.’”“It’s pretty grim,” she added. Gossman has been visiting and studying Afghanistan since the early 1990s.Against these daunting problems, the national government’s awkward political power-sharing arrangement, brokered by the U.S. in 2014, has devolved into squabbling. In August, one chief executive declared the other “unfit” to lead the country. Systemic corruption continues to undermine attempts at reform, and opium production is skyrocketing.“I regret there’s still real problems in Afghanistan,” Biden told NBC’s “Meet the Press” on Oct. 16. But with U.S. forces currently engaged in Iraq and Syria, he added, “there has to be a sense of humility about what is able to be done at the time.”Yet some military and foreign policy experts argue that the U.S. intervention in Afghanistan, with its goal of a stable nation free of extremists, is not a lost cause yet. A “surge” of U.S. troop reinforcements would certainly help, some argue, and even at current levels, U.S. military advisers in Afghanistan could be given more leeway to engage directly in combat. For many who have served there, the bottom line is this: The United States cannot abandon those Afghans who were promised that the U.S. would stand by them.Retired Marine Gen. John Allen, who commanded U.S. and NATO forces in Afghanistan from 2011 to 2013, is one who argues that Afghanistan is not “ready to go over the edge,” even though it might appear so from a distance. “I know from personal experience that Afghanistan always looks better close up,” he told The Huffington Post.Allen cited the increase in life expectancy for Afghans, from 53 years in 1996 to 60.5 years today, as one hopeful sign that foreign investment in Afghanistan’s schools and health clinics is having an effect.The retired general said the Obama administration’s decision to reduce U.S. forces in Afghanistan ― and to announce the timetable for the withdrawals ― damaged the American effort there. “That’s been hard to overcome,” he said. “Our words say we are committed; our actions do not.” “But that’s water under the bridge,” Allen added.Can Afghanistan’s slide toward failure be arrested?John F. Sopko, the special inspector general for Afghanistan reconstruction, is in essence a congressionally mandated gumshoe looking over U.S. efforts. In an October report to lawmakers, he wrote that “systemic corruption, aggravated by floods of aid money, undermined the U.S. mission in Afghanistan from the outset and, unless effectively checked, will continue to undermine progress and could ultimately result in mission failure.”“I’m cautiously optimistic,” he told HuffPost from Afghanistan, adding that he is “impressed at the hard work being done by Afghans in civil society, media and top leadership.”“But much more remains to be done,” Sopko said.The new administration should give the nation’s top Afghanistan experts 90 days, Allen suggested, to come up with a plan to bolster that nation’s security, economy and government performance. (He talked to The Huffington Post several days before the election and was not speaking specifically of Trump.)Perhaps the one clearly wrong decision would be for Trump to put Afghanistan on the backburner. “Our hard-won successes are in the balance,” Sopko said.And the Taliban advance.Sign up for the HuffPost Must Reads newsletter. Each Sunday, we will bring you the best original reporting, longform writing and breaking news from The Huffington Post and around the web, plus behind-the-scenes looks at how it’s all made. Click here to sign up!"
